contest,caption,mean,precision,votes,not_funny,somewhat_funny,funny,has_question_mark,ends_with_punctuation,caption_length
677,Sventabbi,1.247863247863248,0.048414263331137,117,93,19,5,False,False,9
677,"You shall now fight for my affection all night, while I ponder whether to give it or not.",1.247863247863248,0.0452682721256424,117,91,23,3,False,True,89
677,"Yes, come closer, you're under my spell. Now get the M I L K out of the frig.",1.247863247863248,0.046867671987938,117,92,21,4,False,True,77
677,"You will cluck like a chicken of the sea, then open one up.",1.247863247863248,0.048414263331137,117,93,19,5,False,True,59
677,tuna! tuna!tuna!,1.247863247863248,0.046867671987938,117,92,21,4,False,True,16
677,"This is either a really weird dream, or I need to teach you how to use the can opener.",1.247863247863248,0.046867671987938,117,92,21,4,False,True,86
677,Open the CANNED stuff... I deserve the CANNED stuff... the dry stuff is for the dog...,1.247863247863248,0.0436102538964574,117,90,25,2,False,True,86
677,Who forgot to turn off the Cat Signal?,1.247863247863248,0.048414263331137,117,93,19,5,True,True,38
677,This the part I love when he sleep walks and takes out the Milk!,1.247863247863248,0.0436102538964574,117,90,25,2,False,True,64
677,It's time to make the catnip.,1.247863247863248,0.0452682721256424,117,91,23,3,False,True,29
677,Must...Make...More...Lasagna.,1.247863247863248,0.0452682721256424,117,91,23,3,False,True,29
677,Open the door...take out the pate..put it in my bowl!,1.247863247863248,0.048414263331137,117,93,19,5,False,True,53
677,Ha! I'm expected to raid the lawn in the dark for my midnight snacks!,1.247863247863248,0.0499129553345062,117,94,17,6,False,True,69
677,I must feed the cat.  I must feed the cat.....,1.247863247863248,0.0452682721256424,117,91,23,3,False,True,46
677,Now open the fridge and take out that package of ground sirloin.,1.247863247863248,0.046867671987938,117,92,21,4,False,True,64
677,You will open the cans in the pantry you will open the cans in the pantry you will open the cans in the pantry...,1.247863247863248,0.0452682721256424,117,91,23,3,False,True,113
677,"Catch the mice, bring me the mice . . .",1.247863247863248,0.0513679406493208,117,95,15,7,False,True,39
677,I hope he believes in letting spilled milk and sleeping dogs lie...,1.247863247863248,0.0436102538964574,117,90,25,2,False,True,67
677,Get the can opener. Open all the cans. Set them on the floor and go back to bed.,1.247863247863248,0.0499129553345062,117,94,17,6,False,True,80
677,He loves it when I dance to Thriller,1.247863247863248,0.046867671987938,117,92,21,4,False,False,36
677,"OK, Kevin, you are under my control now. First fill my food bowl to the the top. Then we will talk about getting a new pillow and then there’s way I like to be petted....and then.......",1.247863247863248,0.0418866569277825,117,89,27,1,False,True,185
677,"Now open a fresh can, not the cold stuff in the fridge.",1.247863247863248,0.048414263331137,117,93,19,5,False,True,55
677,"well, as long as you're up anyway....",1.247863247863248,0.0436102538964574,117,90,25,2,False,True,37
677,"Yes, yes, keep coming, you will find my food on the second shelf",1.247863247863248,0.046867671987938,117,92,21,4,False,False,64
677,Must...make...tuna...casserole...,1.247863247863248,0.0418866569277825,117,89,27,1,False,True,33
677,Where's the beef?,1.247863247863248,0.0436102538964574,117,90,25,2,True,True,17
677,"You are under my power, bring me some fresh salmon.",1.247863247863248,0.046867671987938,117,92,21,4,False,True,51
677,Cats eyes certainly make night travel easier.,1.247863247863248,0.046867671987938,117,92,21,4,False,True,45
677,Tuna! You need tuna!,1.247863247863248,0.0452682721256424,117,91,23,3,False,True,20
677,You will never leave me alone in the moonlight.,1.247863247863248,0.0452682721256424,117,91,23,3,False,True,47
677,"Now you must feed the cat, and not that gruel in the can.",1.247863247863248,0.046867671987938,117,92,21,4,False,True,57
677,That's enough Youtube for tonight.,1.247863247863248,0.046867671987938,117,92,21,4,False,True,34
677,"Yes, master. One sardine sandwich on 7 grain bread with catnip aioli.",1.247863247863248,0.0436102538964574,117,90,25,2,False,True,69
677,My rays make me feline attractive.,1.247863247863248,0.048414263331137,117,93,19,5,False,True,34
677,I should have never gotten Mittens Lasik.,1.247863247863248,0.048414263331137,117,93,19,5,False,True,41
677,Such a good boy.,1.247863247863248,0.048414263331137,117,93,19,5,False,True,16
677,Yes master. I will move you litter box to the kitchen counter.,1.247863247863248,0.0427571413538091,117,92,22,3,False,True,62
677,Attention earthling!  Tuna.. Tuna.. Must have Tuna.. now!,1.247863247863248,0.046867671987938,117,92,21,4,False,True,57
677,"You are my staff, and be so forever!",1.247863247863248,0.046867671987938,117,92,21,4,False,True,36
677,Must...have...pate...,1.247863247863248,0.0452682721256424,117,91,23,3,False,True,21
677,"Your are sleepy, very sleepy. Peel me a mouse.",1.247863247863248,0.0513679406493208,117,95,15,7,False,True,46
677,Must ... scratch ... Fluffy’s ... butt.,1.247863247863248,0.048414263331137,117,93,19,5,False,True,39
677,"Oh goody, she’s catatonic.",1.247863247863248,0.0436102538964574,117,90,25,2,False,True,26
677,"You will remember nothing. There's a good boy, two more steps. Now open the refrigerator door.",1.247863247863248,0.046867671987938,117,92,21,4,False,True,94
677,Toxoplasmosis,1.247863247863248,0.046867671987938,117,92,21,4,False,False,13
677,Must...find...the can opener.,1.247863247863248,0.0418866569277825,117,89,27,1,False,True,29
677,Catnip?  Where did I hide the catnip?,1.247863247863248,0.046867671987938,117,92,21,4,True,True,37
677,Tuna Fish,1.247863247863248,0.048414263331137,117,93,19,5,False,False,9
677,You are nocturnal... You are nocturnal...,1.247863247863248,0.0499129553345062,117,94,17,6,False,True,41
677,"Feed me, clean my litter, pet my belly, and you can live here another day, feed me, clean my litter,  pet my belly, and you can live here another day, feed me...........",1.247863247863248,0.046867671987938,117,92,21,4,False,True,169
677,"Okay, one final instruction. Tomorrow, on my command, you will say: Mackerel? No, honey, remember? We decided not to buy it.",1.247863247863248,0.046867671987938,117,92,21,4,True,True,124
677,Must...Get...Tuna!,1.247863247863248,0.0452682721256424,117,91,23,3,False,True,18
677,"If you wanted to sleep so bad, just leave the food out and I won't have to summon you like this.",1.247863247863248,0.0427571413538091,117,92,22,3,False,True,96
677,"It's reflect, got it? Not project!",1.247863247863248,0.0452682721256424,117,91,23,3,True,True,34
677,"Fresh tuna steak, fre-esh tu-una steak!",1.247863247863248,0.0452682721256424,117,91,23,3,False,True,39
677,Open the door on your left. Take out the container labeled milk.,1.247863247863248,0.0436102538964574,117,90,25,2,False,True,64
677,Just walk past the light and towards the cat food.,1.247863247863248,0.0452682721256424,117,91,23,3,False,True,50
677,The dog is on the kitchen counter... hear me? The dog is on the kitchen counter.,1.247863247863248,0.048414263331137,117,93,19,5,True,True,80
677,When I purr to 3 you'll serve the tuna.,1.247863247863248,0.0452682721256424,117,91,23,3,False,True,39
677,"Remember that annoying laser toy you bought for me, well I swallowed it by accident.",1.247863247863248,0.0436102538964574,117,90,25,2,False,True,84
677,"While you're in there, would you pour me a saucer of milk?",1.247863247863248,0.046867671987938,117,92,21,4,True,True,58
677,"Yes, my friend the cat, you deserve a midnight snack""",1.247863247863248,0.0513679406493208,117,95,15,7,False,False,53
677,I need to remember not to bring home leftover Sushi,1.247863247863248,0.0452682721256424,117,91,23,3,False,False,51
677,"So you think you can take ""a little cat nap"" during my dinner time, eh?",1.247863247863248,0.0452682721256424,117,91,23,3,True,True,71
677,Thanks for all the laser pointing training!,1.247863247863248,0.0436102538964574,117,90,25,2,False,True,43
677,You will now find the can opener.,1.247863247863248,0.046867671987938,117,92,21,4,False,True,33
677,"That’s right. Keep walking to the fridge, slowly...",1.247863247863248,0.046867671987938,117,92,21,4,False,True,51
677,"Must take out the tuna, must take out the tuna...",1.247863247863248,0.0499129553345062,117,94,17,6,False,True,49
677,DID YOU SLIP ME AN AMBIEN?,1.247863247863248,0.046867671987938,117,92,21,4,True,True,26
677,"Lead me to the PEOPLE food, Marvin!",1.247863247863248,0.046867671987938,117,92,21,4,False,True,35
677,"Turn left,open door,get leftover sushi.
More instructions will follow.",1.247863247863248,0.0452682721256424,117,91,23,3,False,True,70
677,"Now repeat after me, I will never again forget to feed you.",1.247863247863248,0.0452682721256424,117,91,23,3,False,True,59
677,"Now open the door on the left,and pass me the milk.",1.247863247863248,0.0452682721256424,117,91,23,3,False,True,51
677,"Aw, c'mon, you've already got my tongue.",1.247863247863248,0.048414263331137,117,93,19,5,False,True,40
677,"(""You will open the fridge and bring out the salmon."")",1.247863247863248,0.046867671987938,117,92,21,4,False,False,54
677,I have this recurring dream that my ex wife kept the cat.,1.247863247863248,0.046867671987938,117,92,21,4,False,True,57
677,Take me to your leader. And some tuna fish.,1.247863247863248,0.046867671987938,117,92,21,4,False,True,43
677,"Must find milk, must find milk....",1.247863247863248,0.0436102538964574,117,90,25,2,False,True,34
677,You will buy me wet food only.,1.247863247863248,0.0499129553345062,117,94,17,6,False,True,30
677,Cat... food... must... find... cat... food...,1.247863247863248,0.0452682721256424,117,91,23,3,False,True,45
677,"Forget the catnip, I want the salmon leftovers.",1.247863247863248,0.046867671987938,117,92,21,4,False,True,47
677,"Mr. Kitty Witty perfects his role as Imhotep in the upcoming, much anticipated sequel, ""The Mummy: Bastet Unbound."" Coming soon. Advance ticket purchase recommended. Material may be disturbing to dogs, humans too. (Kitty Witty, seriously?)",1.247863247863248,0.048414263331137,117,93,19,5,True,False,239
677,"Can opener, can opener, can opener; find the can opener",1.247863247863248,0.0452682721256424,117,91,23,3,False,False,55
677,I wish I had nine lives.,1.247863247863248,0.046867671987938,117,92,21,4,False,True,24
677,I wonder when this catnip will wear off.,1.247863247863248,0.0452682721256424,117,91,23,3,False,True,40
677,"One bowl of diced chicken coming up, my feline master.",1.2477064220183487,0.0490410302443421,109,86,19,4,False,True,54
677,Maybe now I'll get some milk.,1.2477064220183487,0.0472771401643434,109,85,21,3,False,True,29
677,Must have some fish sticks.,1.2477064220183487,0.0490410302443421,109,86,19,4,False,True,27
677,*sigh* ... me is cat,1.2477064220183487,0.0472771401643434,109,85,21,3,False,False,20
677,"The salmon is in the Meat drawer, bottom right...",1.2457627118644068,0.0465162421308293,118,93,21,4,False,True,49
677,"Yes Morris, I will fetch the tuna sushi boat for tomorrow's party and then sleep for 16 hours.",1.2454545454545454,0.0468994695022619,110,86,21,3,False,True,94
677,"I know, I know.  The salmon pate, then some half and half to wash it down.",1.2434782608695651,0.0438277335542383,115,89,24,2,False,True,74
677,"You will remember *only* that the vet told you to feed me cream, chocolate and ice cream and never to bring me back again. Oh: and to laugh when I bite you and then pet and feed me.",1.2434782608695651,0.0455348825604945,115,90,22,3,False,True,181
677,Must... leave... glass... at... edge... of... counter...,1.2434782608695651,0.0471803013035604,115,91,20,4,False,True,56
677,Must have  pussy.,1.2434782608695651,0.0487702381826403,115,92,18,5,False,True,17
677,Must clean litter box. Must clean litter box.....,1.2434782608695651,0.0438277335542383,115,89,24,2,False,True,49
677,Get down off the counter Geiger,1.2434782608695651,0.0471803013035604,115,91,20,4,False,False,31
677,"The tuna's gone, but, as long as you're up, how about changing my litter?",1.2434782608695651,0.0487702381826403,115,92,18,5,True,True,73
677,"But wait, that’s not all Kate!  This little kitty doubles as a night light...just pay shipping and handling...batteries included!",1.2434782608695651,0.0503099536243891,115,93,16,6,False,True,129
677,"The eyes have it.""",1.2434782608695651,0.0487702381826403,115,92,18,5,False,False,18
677,"Okay, damn it, I'll refill your bowl.",1.2434782608695651,0.0471803013035604,115,91,20,4,False,True,37
677,"I feel the need to pour milk in a bowl, and I do not know why.",1.2434782608695651,0.0471803013035604,115,91,20,4,False,True,62
677,Ollie Ollie Kitty Free,1.2434782608695651,0.0487702381826403,115,92,18,5,False,False,22
677,Cat got tongue...and brain.,1.2434782608695651,0.0471803013035604,115,91,20,4,False,True,27
677,Obedience training included how to hypnotize humans.  I never go hungry.,1.2434782608695651,0.0471803013035604,115,91,20,4,False,True,72
677,Need warm milk. Need warm milk.,1.2434782608695651,0.0518039258645994,115,94,14,7,False,True,31
677,Hooray! I'm going to get fed breakfast twice today!,1.2434782608695651,0.0455348825604945,115,90,22,3,False,True,51
677,Multitasking during a catnap.,1.2434782608695651,0.0487702381826403,115,92,18,5,False,True,29
677,"You are still in my power. Go into the refrigerator, get the chicken and put it in the cat’s bowl.",1.2434782608695651,0.0471803013035604,115,91,20,4,False,True,98
677,Yes...whatever...happens...will...blame...dog.,1.2434782608695651,0.0438277335542383,115,89,24,2,False,True,46
677,"Hey, relax! Feeding me is a better side effect than driving.",1.2434782608695651,0.0471803013035604,115,91,20,4,False,True,60
677,Make this Calico full again...make this Calico full again...,1.2434782608695651,0.0471803013035604,115,91,20,4,False,True,60
677,"The use of telekinesis has been proven, in several decade long double-blind studies, to be beneficial for both man and animals.",1.2434782608695651,0.0487702381826403,115,92,18,5,False,True,127
677,O-o-o-pen...,1.2434782608695651,0.0438277335542383,115,89,24,2,False,True,12
677,"For God's sake, can't you just spit up a fur ball or chase a mouse now?",1.2434782608695651,0.0487702381826403,115,92,18,5,True,True,71
677,My own fault for agreeing to pet sit Superman's cat.,1.2434782608695651,0.0487702381826403,115,92,18,5,False,True,52
677,"When he sees me, he'll wake and drop the sausage. Works every time.",1.2434782608695651,0.0438277335542383,115,89,24,2,False,True,67
677,Cat bachelor thought he could be a cat lady ‘in his sleep’ but this ignorance would cost him dearly.,1.2434782608695651,0.0438277335542383,115,89,24,2,False,True,100
677,....I should've gotten a dog,1.2434782608695651,0.0455348825604945,115,90,22,3,False,False,28
677,resistance is futile…,1.2434782608695651,0.0455348825604945,115,90,22,3,False,False,21
677,TeleCATnesis Abuse,1.2434782608695651,0.0487702381826403,115,92,18,5,False,False,18
677,Now lick yourself!,1.2434782608695651,0.0455348825604945,115,90,22,3,False,True,18
677,Puurfect!,1.2434782608695651,0.0471803013035604,115,91,20,4,False,True,9
677,Being catatonic really suits you!,1.2434782608695651,0.0455348825604945,115,90,22,3,False,True,33
677,I might as well take advantage of this sleepwalking thing,1.2434782608695651,0.0438277335542383,115,89,24,2,False,False,57
677,Must sell dog... Must sell dog...,1.2434782608695651,0.0438277335542383,115,89,24,2,False,True,33
677,Rude Awakening !,1.2434782608695651,0.0487702381826403,115,92,18,5,False,True,16
677,"Human ""ca-tivity!_",1.2434782608695651,0.0471803013035604,115,91,20,4,False,False,18
677,Fluffy wasn’t one to brood over having spent his first eight lives waiting to be fed.,1.2434782608695651,0.0471803013035604,115,91,20,4,False,True,85
677,You WILL give me the marinating salmon in the refrigerator,1.2434782608695651,0.0401965126087807,115,87,28,0,False,False,58
677,... And then I wake up.....,1.2434782608695651,0.0420513368063916,115,88,26,1,False,True,27
677,Why didn't I just get a dog?,1.2434782608695651,0.0487702381826403,115,92,18,5,True,True,28
677,Purrfect Catnap Vision,1.2434782608695651,0.0455348825604945,115,90,22,3,False,False,22
677,I wish for a fish in a dish.,1.2434782608695651,0.0503099536243891,115,93,16,6,False,True,28
677,Definitely should not have gotten a pet with telecathic powers.,1.2434782608695651,0.0438277335542383,115,89,24,2,False,True,63
677,"Not even in his dreams, John, MD, CAT scan specialist, could stop focusing on his job.",1.2434782608695651,0.0420513368063916,115,88,26,1,False,True,86
677,Could you at least turn off your high beams?,1.2434782608695651,0.0438277335542383,115,89,24,2,True,True,44
677,I must admit a small part of me remains relieved I never married.,1.2434782608695651,0.0455348825604945,115,90,22,3,False,True,65
677,"Now, open the fridge and serve me my glass of milk.",1.2434782608695651,0.0471803013035604,115,91,20,4,False,True,51
677,Misty! You are spending too much time near the microwave.,1.2429906542056075,0.0456947804443038,107,83,22,2,False,True,57
677,'Mind-Control' Parasite Toxoplasma Gondii strikes again.,1.2429906542056075,0.0456947804443038,107,83,22,2,False,True,56
677,We really are jerks,1.2429906542056075,0.0494032837609348,107,85,18,4,False,False,19
677,Warning: may cause catatonia.,1.2429906542056075,0.0494032837609348,107,85,18,4,False,True,29
677,I have a sudden desire for tuna fish at 5:35 a.m.,1.2429906542056075,0.0475851731436199,107,84,20,3,False,True,49
677,"I guess the cat is out of the bag,
my boss is sleep walking.",1.2429906542056075,0.0494032837609348,107,85,18,4,False,True,60
677,"First, tuna. Then the world...",1.2429906542056075,0.0437227311200704,107,82,24,1,False,True,30
677,Must... open... freezer.,1.2407407407407407,0.0489953946493442,108,86,18,4,False,True,24
677,This isn't the only pussy you'll be hypnotized by tonight.,1.2407407407407407,0.0489953946493442,108,86,18,4,False,True,58
677,"Food, human. And not that cheap stuff, either.",1.2407407407407407,0.0433743921831806,108,83,24,1,False,True,46
677,Meow meow meow meow meow!,1.2407407407407407,0.0507308482422007,108,87,16,5,False,True,25
677,I just . . . fed you. I’ve not yet fed you.,1.2407407407407407,0.0489953946493442,108,86,18,4,False,True,43
677,Hope he passes me by; I am destined to line a tennis racket.,1.2407407407407407,0.0489953946493442,108,86,18,4,False,True,60
677,I should’ve just taught you how to use the cab opener.,1.2407407407407407,0.047196169657259,108,85,20,3,False,True,54
677,"How may I provide you with excellent customer service this morning, Master?",1.2407407407407407,0.0540347989394762,108,89,12,7,True,True,75
677,"When you hear me purr, you will open the refrigerator and pour me some milk.",1.2407407407407407,0.047196169657259,108,85,20,3,False,True,76
677,Get. Cat. A. Tonic. Get. Cat. A. Tonic...,1.2407407407407407,0.0453255795747674,108,84,22,2,False,True,41
677,Of course--an alien! You always seemed an odd duck for a pet cat.,1.2407407407407407,0.0453255795747674,108,84,22,2,False,True,65
677,X,1.2407407407407407,0.0489953946493442,108,86,18,4,False,False,1
677,Can I have some of what you're having?,1.2407407407407407,0.047196169657259,108,85,20,3,True,True,38
677,Hear no evil. See no evil.,1.2407407407407407,0.0489953946493442,108,86,18,4,False,True,26
677,"You look a little tense, relax, you’ll see that I’m a fair and just ruler...",1.2407407407407407,0.0453255795747674,108,84,22,2,False,True,76
677,When you awaken you will feel refreshed and will have no memory of having gotten up in the middle of the night to get  me my favorite cat food out of the fridge.,1.2407407407407407,0.047196169657259,108,85,20,3,False,True,161
677,Open the tuna then stub your toe.,1.2407407407407407,0.0524088659474846,108,88,14,6,False,True,33
677,Dawn of the fed,1.2407407407407407,0.047196169657259,108,85,20,3,False,False,15
677,"No! Not milk and cookies, milk and sardines!",1.2407407407407407,0.047196169657259,108,85,20,3,False,True,44
677,Now open the door and remove the salmon!,1.2407407407407407,0.0453255795747674,108,84,22,2,False,True,40
677,"As he wondered in a somnambulistic state, Harold felt a strange force leading him to the cabinet where the cat food was kept.",1.2407407407407407,0.0507308482422007,108,87,16,5,False,True,125
677,You go eat the crap you feed me,1.2407407407407407,0.0507308482422007,108,87,16,5,False,False,31
677,"Even though they only live a short life, mind control cats make the most of it...",1.2407407407407407,0.0507308482422007,108,87,16,5,False,True,81
677,"What is thy bidding, master?",1.2407407407407407,0.0489953946493442,108,86,18,4,True,True,28
677,"...good, good, now you will prepare the lasagna.",1.2407407407407407,0.047196169657259,108,85,20,3,False,True,48
677,Ugh. I hate catnaps.,1.2407407407407407,0.047196169657259,108,85,20,3,False,True,20
677,"Excellent... Now to the left, to the left dang nab you!",1.2407407407407407,0.0489953946493442,108,86,18,4,False,True,55
677,Do you only let the president grab you?,1.2407407407407407,0.0489953946493442,108,86,18,4,True,True,39
677,"Yes, yes... Now open the fridge you stinky bag of bones and fetch me some of that leftover lobster mac and cheese",1.2407407407407407,0.0489953946493442,108,86,18,4,False,False,113
677,Great. Jim is sleepwalking again. This is just purrfect.,1.2407407407407407,0.047196169657259,108,85,20,3,False,True,56
677,You have become the laser pointer.,1.2407407407407407,0.0507308482422007,108,87,16,5,False,True,34
677,Filet mignon...filet mignon....,1.2407407407407407,0.047196169657259,108,85,20,3,False,True,31
677,Next time pick the cute little puppy with the sad face and not the scrawny little kitten with the twinkle in its eye.,1.2407407407407407,0.0453255795747674,108,84,22,2,False,True,117
677,I succumbed to kitty's powerful glow,1.2407407407407407,0.0489953946493442,108,86,18,4,False,False,36
677,"So much for stereotypes, look at what I'm dragging out of the house.",1.2407407407407407,0.0489953946493442,108,86,18,4,False,True,68
677,It opens the refrigerator and it takes out the cream...,1.2407407407407407,0.047196169657259,108,85,20,3,False,True,55
677,Closer... closer... NOW OPEN THE DOOR!!!,1.2407407407407407,0.0489953946493442,108,86,18,4,False,True,40
677,He’s been watching too many episodes of “The Walking Dead” again.,1.2407407407407407,0.047196169657259,108,85,20,3,False,True,65
677,I have a sudden urge for fish with  fresh cream.,1.2407407407407407,0.047196169657259,108,85,20,3,False,True,48
677,"YES MASTER. A fresh can, cold water and litter change.",1.2407407407407407,0.0453255795747674,108,84,22,2,False,True,54
677,"Dogs get washed, but cats do not.
Dogs get washed, but cats do not.",1.2407407407407407,0.047196169657259,108,85,20,3,False,True,67
677,I am under your spell. I will transfer all my money into a trust account in the name of Snowball. Then I will scratch your neck and give you a delicious treat.,1.2407407407407407,0.0489953946493442,108,86,18,4,False,True,159
677,Follow... light. Take... fish. Give... to... cat. Give... fish... to... cat. Give... fish...,1.2407407407407407,0.0489953946493442,108,86,18,4,False,True,92
677,Refill the food bowl – right meow!,1.2407407407407407,0.0507308482422007,108,87,16,5,False,True,34
677,You always run the show,1.2407407407407407,0.047196169657259,108,85,20,3,False,False,23
677,Voice Controller: terminate sleep walking and turn off cat.,1.2407407407407407,0.0453255795747674,108,84,22,2,False,True,59
677,Just a few more steps to the meow food that you are sleep craving.,1.2407407407407407,0.0357154303405632,108,87,19,2,False,True,66
677,Roger that—Initiating Phase 1.,1.2407407407407407,0.0453255795747674,108,84,22,2,False,True,30
677,Household cat induces catatonic state for owner to open 5 cans of tuna.,1.2407407407407407,0.0489953946493442,108,86,18,4,False,True,71
677,Cat's... got... my cerebral... cortex.,1.2407407407407407,0.0507308482422007,108,87,16,5,False,True,38
677,"You belong to me, human!",1.238938053097345,0.0474946538397806,113,90,19,4,False,True,24
677,"When I get to zero you will take 4 salmons and 3 tenderloins out of the freezer.....3,2,1",1.238938053097345,0.0474946538397806,113,90,19,4,False,False,89
677,"Now on two, open the fridge and get me some tasty tuna""",1.238938053097345,0.0458008114607757,113,89,21,3,False,False,55
677,I knew I should have gone with Sea Monkey's...,1.238938053097345,0.0507128954916866,113,92,15,6,False,True,46
677,Scrambled or over easy?,1.238938053097345,0.0474946538397806,113,90,19,4,True,True,23
677,Cat burglar or cookie jar? You decide.,1.238938053097345,0.0474946538397806,113,90,19,4,True,True,38
677,For my breakfast you must prepare bird au vin.,1.238938053097345,0.0458008114607757,113,89,21,3,False,True,46
677,I am your master. You will now kill the dog.,1.238938053097345,0.0491301328743945,113,91,17,5,False,True,44
677,"New bowl of food, top off the water, and tighten up the kitty litter if you could.",1.238938053097345,0.0402943034656304,113,86,27,0,False,True,82
677,"I am a dog,I am fun. I am a dog.i am fun.",1.238938053097345,0.0474946538397806,113,90,19,4,False,True,41
677,"That's right, stop here. Now you will open the door and get out the roast chicken. Then go back to bed and we'll do it again at 8am.",1.238938053097345,0.0440418723213541,113,88,23,2,False,True,132
677,Midnight snack... tuna on rack.,1.238938053097345,0.0474946538397806,113,90,19,4,False,True,31
677,Tuna fish. Tuna fish. Tuna fish.,1.238938053097345,0.0491301328743945,113,91,17,5,False,True,32
677,Must… drink… from… sink…,1.238938053097345,0.0458008114607757,113,89,21,3,False,False,24
