contest,caption,mean,precision,votes,not_funny,somewhat_funny,funny,has_question_mark,ends_with_punctuation,caption_length
710,Is he playing a Fender or a Gibson?,1.261744966442953,0.0460639910453783,149,119,21,9,True,True,35
710,Is he nesting or just passing through?,1.261744966442953,0.0419417737436064,149,115,29,5,True,True,38
710,I’m not really that impressed. He’s just doing covers — nothing original.,1.261744966442953,0.0419417737436064,149,115,29,5,False,True,73
710,He's Arlo Woodpecker's father.,1.261744966442953,0.0460639910453783,149,119,21,9,False,True,30
710,It's Roger McWren - he left the Byrds and's gone solo.,1.261744966442953,0.0397205606912272,149,113,33,3,False,True,54
710,"Oh, it's just another YouTubird.",1.261744966442953,0.0397205606912272,149,113,33,3,False,True,32
710,It's the Yellow-bellied Thumbpicker.,1.261744966442953,0.0397205606912272,149,113,33,3,False,True,36
710,He sings for his supper.,1.261744966442953,0.0440511274304561,149,117,25,7,False,True,24
710,"Behold the nesting song of the American Blues Jay. While the female scouts for food, the male ponders if she'll ever come back.",1.261744966442953,0.0419417737436064,149,115,29,5,False,True,127
710,I think he's saying that that tree is his tree.,1.261744966442953,0.043009383933359,149,116,27,6,False,True,47
710,Leonard Cohen....You know I've often wondered about that.,1.261744966442953,0.043009383933359,149,116,27,6,False,True,57
710,The guide says it woos a mate with an open mic night.,1.261744966442953,0.043009383933359,149,116,27,6,False,True,53
710,Blues bird. I recognize its song.,1.261744966442953,0.0450687979589149,149,118,23,8,False,True,33
710,"Francie and Roger, this one is for you.",1.261744966442953,0.0408462686569125,149,114,31,4,False,True,39
710,They say he hasn't stopped playing since he became an empty nester.,1.261744966442953,0.043009383933359,149,116,27,6,False,True,67
710,This is the best Willie Nelson concert I've ever been to.,1.261744966442953,0.0460639910453783,149,119,21,9,False,True,57
710,I think that's much farther than 6 feet,1.261744966442953,0.043009383933359,149,116,27,6,False,False,39
710,It’s a rare Unplugged  Blues Bird.,1.261744966442953,0.043009383933359,149,116,27,6,False,True,34
710,I  think it’s a full-throated country and western warbler.,1.261744966442953,0.0419417737436064,149,115,29,5,False,True,58
710,"Yes, yes, it is the Anerican Idol, finally.",1.261744966442953,0.043009383933359,149,116,27,6,False,True,43
710,"It’s a live streaming, yellow breasted, Blues warbler!",1.261744966442953,0.0450687979589149,149,118,23,8,False,True,54
710,Looks like we found a Cerulean Warbler.,1.261744966442953,0.0413976451501323,149,117,26,5,False,True,39
710,"Look Honey, Leonard Cohen's reincarnated afterall.",1.261744966442953,0.0419417737436064,149,115,29,5,False,True,50
710,"It's the nearly extinct Fedora Topped Warbler!""",1.261744966442953,0.0440511274304561,149,117,25,7,False,False,47
710,"Apparently, Hallelujah has even more verses.”",1.261744966442953,0.0460639910453783,149,119,21,9,False,False,45
710,What you're hearing is the unique three-chord call it uses to communicate losing a mate to another bird.,1.261744966442953,0.0440511274304561,149,117,25,7,False,True,104
710,"Whaddaya mean you can't identify it? Obviously, it's an Acoustic Crooner exhibiting typical springtime courtship behavior!",1.261744966442953,0.0440511274304561,149,117,25,7,True,True,122
710,The Audubon Society recognizes it as a Blues Traveler Jay.,1.261744966442953,0.0408462686569125,149,114,31,4,False,True,58
710,apparently they only make their nests out of bluegrass,1.261744966442953,0.0440511274304561,149,117,25,7,False,False,54
710,"The ever so rare, Blues Bird.",1.261744966442953,0.0470381333876664,149,120,19,10,False,True,29
710,This isolation makes every bird think he's a musician!,1.261744966442953,0.0408462686569125,149,114,31,4,False,True,54
710,Open beak night.,1.261744966442953,0.0450687979589149,149,118,23,8,False,True,16
710,I still say it's a warbler.,1.261744966442953,0.0408462686569125,149,114,31,4,False,True,27
710,"By golly, the Leon Redboned Warbler has made a come-back!",1.261744966442953,0.0419417737436064,149,115,29,5,False,True,57
710,"Yes, I think you're right, it's a Blues Bird.",1.261744966442953,0.0408462686569125,149,114,31,4,False,True,45
710,A Mockingbird!  But he just does cover songs!,1.261744966442953,0.0450687979589149,149,118,23,8,False,True,45
710,I bet the chicks dig him.,1.261744966442953,0.0408462686569125,149,114,31,4,False,True,25
710,"Apparently, he writes and composed all his own birdsongs.",1.261744966442953,0.0440511274304561,149,117,25,7,False,True,57
710,We agreed to let him follow his dreams before we kicked him out of the nest”,1.2615384615384615,0.0444322109059675,130,100,26,4,False,False,76
710,"Okay, maybe not a jay, but it's definitely blue.",1.2611940298507462,0.044855538739205,134,104,25,5,False,True,48
710,"Yep Jerry, I can confirm it’s the rare Leonard Crowen”",1.2611464968152866,0.0410606726096059,157,124,26,7,False,False,54
710,They’re called blues birds.,1.2605633802816902,0.0443372909814091,142,111,25,6,False,True,27
710,A rare bluesbird sighting,1.2605633802816902,0.0443372909814091,142,111,25,6,False,False,25
710,I told you ‘Blues’ wasn’t a typo!”,1.2605633802816902,0.0454498128977138,142,112,23,7,False,False,34
710,"Now we can hear them, they are really making it count”",1.2605633802816902,0.0454498128977138,142,112,23,7,False,False,54
710,"I know why the uncaged bird sings.""",1.2605633802816902,0.0443372909814091,142,111,25,6,False,False,35
710,At least he's social distancing,1.2605633802816902,0.0431961254130865,142,110,27,5,False,False,31
710,he's a blues bird since the incident with that cuckoo,1.2605633802816902,0.0420239827935912,142,109,29,4,False,False,53
710,": it’s a common misconception Margret, that true songbirds don’t need accompaniment.",1.2605633802816902,0.0465357455436596,142,113,21,8,False,True,84
710,Look! An independent artist who could make it to the top.”,1.2605633802816902,0.0431961254130865,142,110,27,5,False,False,58
710,‘Bob Dylan is still alive?’,1.2605633802816902,0.0454498128977138,142,112,23,7,True,False,27
710,Earth has music for those who listen”,1.2605633802816902,0.0420239827935912,142,109,29,4,False,False,37
710,I thought he would stop singing after he made bail,1.2605633802816902,0.0420239827935912,142,109,29,4,False,False,50
710,"Two birds, one stone",1.2605633802816902,0.0420239827935912,142,109,29,4,False,False,20
710,Even Mother Nature is resulting to side hustles to survive this economy.,1.2605633802816902,0.0454498128977138,142,112,23,7,False,True,72
710,His music just hasn‘t been the same since he bought thаt hat.,1.2605633802816902,0.0408181945824286,142,108,31,3,False,True,61
710,Tom Waits for no one.,1.2605633802816902,0.0431961254130865,142,110,27,5,False,True,21
710,His solo career really took off after he left that flock of seagulls.,1.2605633802816902,0.0454498128977138,142,112,23,7,False,True,69
710,It’s Leon Redbone for pete’s sake !,1.2605633802816902,0.0408181945824286,142,108,31,3,False,True,35
710,I told you I saw a Bluesbird.,1.2605633802816902,0.0443372909814091,142,111,25,6,False,True,29
710,They’re known to brood like this until the mother returns,1.2605633802816902,0.0465357455436596,142,113,21,8,False,False,57
710,Five bucks says his next tune is 'While my Guitar Gently Tweets',1.2605633802816902,0.0431961254130865,142,110,27,5,False,False,64
710,It’s just another gig economy warbler.,1.2605633802816902,0.0420239827935912,142,109,29,4,False,True,38
710,Ohh! I love Leonard Cohen,1.2605633802816902,0.047596908872019,142,114,19,9,False,False,25
710,He flew south and came back singing the blues.,1.2605633802816902,0.0443372909814091,142,111,25,6,False,True,46
710,He's a bluesbird.,1.2605633802816902,0.0454498128977138,142,112,23,7,False,True,17
710,"'Yippee Kye Yeh' in middle C?--He's a Ghost Warbler in the Sky.""",1.2605633802816902,0.0443372909814091,142,111,24,6,True,False,64
710,It's a groovy-throated strummingbird.,1.2605633802816902,0.0443372909814091,142,111,25,6,False,True,37
710,You think he'd get mad if I requested Free Bird?,1.2605633802816902,0.0454498128977138,142,112,23,7,True,True,48
710,Why yes...that is a blues bird.,1.2605633802816902,0.0443372909814091,142,111,25,6,False,True,31
710,You can always spot the ones that are having a hard time with the empty nest.,1.2605633802816902,0.0431961254130865,142,110,27,5,False,True,77
710,He branched out...then he really branched out,1.2605633802816902,0.0382928814172414,142,114,23,5,False,False,45
710,Know anything by the Eagles?,1.2605633802816902,0.0395756855670493,142,107,33,2,True,True,28
710,I believe that's a leadbelly sapsucker.,1.2605633802816902,0.0431961254130865,142,110,27,5,False,True,39
710,Looks like he’s taken his tweeting to the next level,1.2605633802816902,0.0454498128977138,142,112,23,7,False,False,52
710,Rarely seen... It's a Blues Jay.,1.2605633802816902,0.0454498128977138,142,112,23,7,False,True,32
710,I hear his new album is for the birds.,1.2605633802816902,0.0431961254130865,142,110,27,5,False,True,38
710,Is it Dylan or THe Birds?,1.2605633802816902,0.0431961254130865,142,110,27,5,True,True,25
710,That's the haunting melody of the North American Bluesbird,1.2605633802816902,0.0454498128977138,142,112,23,7,False,False,58
710,The Byrds?  The Eagles?  Maybe Counting Crows?,1.2605633802816902,0.0454498128977138,142,112,23,7,True,True,46
710,I thought I heard Free Bird.,1.2605633802816902,0.0443372909814091,142,111,25,6,False,True,28
710,His warbling has peaked.,1.2605633802816902,0.0408181945824286,142,108,31,3,False,True,24
710,"No, it's not the red-bellied bluebird -- it's the lead-bellied bluesbird.",1.2605633802816902,0.0431961254130865,142,110,27,5,False,True,73
710,Yep. That's a blues jay alright.,1.2605633802816902,0.0420239827935912,142,109,29,4,False,True,32
710,"Wait, no! It's not a rockin' robin, it's a blues bird.",1.2605633802816902,0.0454498128977138,142,112,23,7,False,True,54
710,This is taking Social Distancing to a whole new level.,1.2605633802816902,0.0443372909814091,142,111,25,6,False,True,54
710,"Yep,it's a common folky-fedora spotted troubadour.",1.2605633802816902,0.0310949218185169,142,114,25,3,False,True,50
710,"This species thinks a cappella groups are too pretentious.""",1.2605633802816902,0.0443372909814091,142,111,25,6,False,False,59
710,"You are extremely lucky, this is his first live gig.",1.2605633802816902,0.0431961254130865,142,110,27,5,False,True,52
710,I'm glad to see he's exploring new hobbies while quarantining at home.,1.2605633802816902,0.0431961254130865,142,110,27,5,False,True,70
710,"Rumor has it they're calling themselves ""Fleetwood Thrush.""",1.2605633802816902,0.0454498128977138,142,112,23,7,False,False,59
710,"Ahh, the elusive Eastern Bluesbird!",1.2605633802816902,0.0431961254130865,142,110,27,5,False,True,35
710,Wow! It's rare to spot one playing unplugged.,1.2605633802816902,0.0454498128977138,142,112,23,7,False,True,45
710,"Turns out, the whole ‘home concert’ thing works better on YouTube.",1.2605633802816902,0.0431961254130865,142,110,27,5,False,True,66
710,It’s either a rare hatted bluesbird or the more common strummingbird.,1.2605633802816902,0.0420239827935912,142,109,29,4,False,True,69
710,I thought they went extinct in the seventies.,1.2605633802816902,0.0431961254130865,142,110,27,5,False,True,45
710,He has the empty nester blues.,1.2605633802816902,0.0443372909814091,142,111,25,6,False,True,30
710,"Yeah, but he’s no Clapton.",1.2605633802816902,0.0443372909814091,142,111,25,6,False,True,26
710,He sings and plays lead guitar in a local The Byrds cover band.,1.2605633802816902,0.0420239827935912,142,109,29,4,False,True,63
710,Ain't no Blue Bird of Happiness,1.2605633802816902,0.0454498128977138,142,112,23,7,False,False,31
710,Cuz I’m as free as a bird now...,1.2605633802816902,0.0420239827935912,142,109,29,4,False,True,32
710,"Nah, it's just the common Blues Jay",1.2605633802816902,0.0454498128977138,142,112,23,7,False,False,35
710,Early bird gets the earworm.,1.2605633802816902,0.0443372909814091,142,111,25,6,False,True,28
710,I saw him last year at Birldand.,1.2605633802816902,0.0443372909814091,142,111,25,6,False,True,32
710,that's the rare Northern Bluegrass,1.2605633802816902,0.047596908872019,142,114,19,9,False,False,34
710,He was streaming before it was a thing.,1.2605633802816902,0.0382928814172414,142,106,35,1,False,True,39
710,Once a raptor now a rapper,1.2605633802816902,0.0465357455436596,142,113,21,8,False,False,26
710,It’s a country songbird,1.2605633802816902,0.0454498128977138,142,112,23,7,False,False,23
710,Mating season.,1.2605633802816902,0.0443372909814091,142,111,25,6,False,True,14
710,It's a Red-Headed Stranger.,1.2605633802816902,0.0443372909814091,142,111,25,6,False,True,27
710,"I recognize the song, but not the arrangement.",1.2605633802816902,0.047596908872019,142,114,19,9,False,True,46
710,He's definitely seeking songbirds,1.2605633802816902,0.0431961254130865,142,110,27,5,False,False,33
710,I thought this bird had flown.,1.2605633802816902,0.0465357455436596,142,113,21,8,False,True,30
710,The elusive raspy-throated country warbler.,1.2605633802816902,0.0420239827935912,142,109,29,4,False,True,43
710,"We can add the rarely sighted ""bluesbird"" to our lifelist!",1.2605633802816902,0.0408181945824286,142,108,31,3,False,True,58
710,Do you think he's a songbird?,1.2605633802816902,0.0465357455436596,142,113,21,8,True,True,29
710,Who even knew there was such a thing as the blue jay blues?,1.2605633802816902,0.0431961254130865,142,110,27,5,True,True,59
710,"I'm pretty sure, that's an original song bird.",1.2605633802816902,0.0431961254130865,142,110,27,5,False,True,46
710,"He couldn't find an affordable studio space in Manhattan, so he comes here instead.",1.2605633802816902,0.0454498128977138,142,112,23,7,False,True,83
710,What a hack - it's the same song as last time!,1.2605633802816902,0.0420239827935912,142,109,29,4,False,True,46
710,"No doubt, it's a red Spoitified warbler.",1.2605633802816902,0.0431961254130865,142,110,27,5,False,True,40
710,"Oh look,its a blues jay!",1.2605633802816902,0.0408181945824286,142,108,31,3,False,True,24
710,Let's get out of here... there's a flock of groupies on  the horizon,1.2605633802816902,0.0408181945824286,142,108,31,3,False,False,68
710,"Ahhh. The red, red robin comes bob, bob bobbin along.",1.2605633802816902,0.0431961254130865,142,110,27,5,False,True,53
710,"Well would you look at that, the leaves are coming in",1.2605633802816902,0.047596908872019,142,114,19,9,False,False,53
710,I liked his earlier stuff better...,1.2605633802816902,0.0465357455436596,142,113,21,8,False,True,35
710,To think Little Richard is gone and that's still here---------,1.2605633802816902,0.0408181945824286,142,108,31,3,False,False,62
710,"I don't think you'll be able to hear him any better with those, Dave",1.2605633802816902,0.047596908872019,142,114,19,9,False,False,68
710,That's a Singing the Blues Jay.,1.2605633802816902,0.0420239827935912,142,109,29,4,False,True,31
710,Talk about working from home!,1.2605633802816902,0.0431961254130865,142,110,27,5,False,True,29
710,It is called a Willie Nelson Warbler,1.2605633802816902,0.0420239827935912,142,109,29,4,False,False,36
710,"Well, it’s a songbird, but Roger Tory Peterson doesn’t have it listed.",1.2605633802816902,0.0431961254130865,142,110,27,5,False,True,70
710,"Amazing, a Blues Strummingbird!",1.2605633802816902,0.0443372909814091,142,111,25,6,False,True,31
710,That'd be a Blind Blues-Bird warbling for a Wren.,1.2605633802816902,0.0465357455436596,142,113,21,8,False,True,49
710,"Look honey, the Blues Bird",1.2605633802816902,0.0443372909814091,142,111,25,6,False,False,26
710,"No, it's not a bluebird, but you're very very close.",1.2605633802816902,0.0431961254130865,142,110,27,5,False,True,52
710,"Well, Bill, looks like it's officially the start of 'Unplugged' season.",1.2605633802816902,0.0420239827935912,142,109,29,4,False,True,71
710,You're right it's a Nightingale but he's doing an original song.,1.2605633802816902,0.0431961254130865,142,110,27,5,False,True,64
710,"I can't see the species, but it sounds like "" Lullaby of Bird Land"".",1.2605633802816902,0.0431961254130865,142,110,27,5,False,True,68
710,Amazing! Smallest guitar I ever saw.,1.2605633802816902,0.0443372909814091,142,111,25,6,False,True,36
710,I love the mournful sound of a bues bird,1.2605633802816902,0.0431961254130865,142,110,27,5,False,False,40
710,"Hm, I've only ever heard his a capella pieces.""",1.2602739726027397,0.0424284048050164,146,113,28,5,False,False,47
710,"Honestly, I don't really care how close we get. All his songs sound the same to me.""",1.2602739726027397,0.0413000753390206,146,112,30,4,False,False,84
710,So that’s what they meant by the great gig in the sky”,1.2602739726027397,0.0456463521890525,146,116,22,8,False,False,54
710,"Music does help, he is no longer an angry bird!",1.2602739726027397,0.0435274952827279,146,114,26,6,False,True,47
710,‘Oh look up! You hear that!? He’s serenading the Gods for getting rid of most of us!,1.2602739726027397,0.0424284048050164,146,113,28,5,True,True,84
710,"Coachella just isn't quite the same this year.""",1.2602739726027397,0.0435274952827279,146,114,26,6,False,False,47
710,"Describing my music as ""for the birds"" is actually quite flattering.",1.2602739726027397,0.0456463521890525,146,116,22,8,False,True,68
710,"must say, I prefer the strumming to the humming.",1.2602739726027397,0.0445995084824649,146,115,24,7,False,True,48
710,Looks like the first Blues bird of spring.,1.2602739726027397,0.0424284048050164,146,113,28,5,False,True,42
710,We come all the way out here and all we hear is his new stuff!,1.2602739726027397,0.0435274952827279,146,114,26,6,False,True,62
710,The mockingbird is doing George Jones again.,1.2602739726027397,0.0445995084824649,146,115,24,7,False,True,44
710,"You should note the Mississippi bluesbird has a distinctive, raspy mating song.",1.2602739726027397,0.0429814633294763,146,116,23,7,False,True,79
710,"Wow Gal Gadot really got everyone to sing ""Imagine""!",1.2602739726027397,0.0466697201561846,146,117,20,9,False,True,52
710,Look son!  A Democrat!,1.2602739726027397,0.0445995084824649,146,115,24,7,False,True,22
710,"'I liked it better when all he could do was hum.""",1.2602739726027397,0.0424284048050164,146,113,28,5,False,False,49
710,The musician birds don't support their young.,1.2602739726027397,0.0424284048050164,146,113,28,5,False,True,45
710,"I don't know, I still prefer the stuff he did in the cage.",1.2602739726027397,0.0435274952827279,146,114,26,6,False,True,58
710,"Not bad, but is the revenue model sustainable?",1.2602739726027397,0.0413000753390206,146,112,30,4,True,True,46
710,I told you New York had a lot to offer.,1.2602739726027397,0.0424284048050164,146,113,28,5,False,True,39
710,The sequestered thrush is particularly amenable to low ambient noise environments...,1.2602739726027397,0.0466697201561846,146,117,20,9,False,True,84
710,"“No, with that melancholic twang it’s gotta be a Jeff Tweety”",1.2602739726027397,0.0435274952827279,146,114,26,6,False,False,61
710,It’s a benefit for Corvids Fight COVID,1.2602739726027397,0.0445995084824649,146,115,24,7,False,False,38
710,"Unfortunately, he only knows one three-note song.",1.2602739726027397,0.0445995084824649,146,115,24,7,False,True,49
710,the mom feeds him his lyrics too,1.2602739726027397,0.0445995084824649,146,115,24,7,False,False,32
710,"Ba ba ba ba ba bird, bird is the word",1.2602739726027397,0.0445995084824649,146,115,24,7,False,False,37
710,Hallelujah!  It’s the reincarnation of Leonard Cohen!,1.2602739726027397,0.0413000753390206,146,112,30,4,False,True,53
710,I can tell by its song.  It's a blues-bird.,1.2602739726027397,0.0435274952827279,146,114,26,6,False,True,43
710,A sweet tweet for a change,1.2602739726027397,0.0456463521890525,146,116,22,8,False,False,26
710,"I can't make out the words. Something about putting it deep in your cloaca til you cry ""daddy daddy daddy"".",1.2602739726027397,0.0445995084824649,146,115,24,7,False,True,107
710,I prefer the early stuff,1.2602739726027397,0.0456463521890525,146,116,22,8,False,False,24
710,Is it a rock dove or a blues jay?,1.2602739726027397,0.0435274952827279,146,114,26,6,True,True,33
710,I was watching him before he was big.”,1.26,0.0427573142218157,150,117,27,6,False,False,38
710,"The lyrics aren’t bad, but his music’s for the birds.",1.26,0.0427573142218157,150,117,27,6,False,True,53
710,Looks like it’s definitely a blues-jay,1.2597402597402598,0.038876063856688,154,117,34,3,False,False,38
710,Is that a Leonis redbonicus?,1.2587412587412588,0.042931675959346,143,111,27,5,True,True,28
710,"Mock..Yayah ...Ing...
Yayah...",1.2587412587412588,0.0451676312546647,143,113,23,7,False,True,30
710,"These backstage passes are amazing, but boy am I tired from the walk to get here. Can you believe the parking spot we got? It took us like two minutes to park. When I get home I’m gonna make a grilled cheese. I hope we have bacon. Did you buy tomat-oh he’s started? Wow the birds got pipes. I wonder what his encore will be? I hope it’s a cover. I love covers.",1.2587412587412588,0.0440638384269667,143,112,25,6,True,True,360
710,Is that the bird from Rockin’ Robin” “Shhhh he doesn’t play that song anymore. He said it cheapened his artistry”,1.2587412587412588,0.042931675959346,143,111,27,5,False,False,113
710,"""His blues is okay, but you should've heard his techno.""",1.2587412587412588,0.046245085894578,143,114,21,8,False,False,56
710,"That is the rare singer-songwriter bird""",1.2587412587412588,0.0417688370012711,143,110,29,4,False,False,40
710,"I can't believe it Ben. Since quarantine started and fuel emissions went down, the birds started playing sweet melodies again",1.2587412587412588,0.0405726840152241,143,109,31,3,False,False,125
710,"Do you know how rare this is? He's the only living Bluesbird Brother.""",1.2587412587412588,0.0451676312546647,143,113,23,7,True,False,70
710,Another cover? I thought you said I’d be ‘amazed’.,1.2587412587412588,0.042931675959346,143,111,27,5,True,True,50
710,"Now they can sing better than The Eagles""",1.2587412587412588,0.0417688370012711,143,110,29,4,False,False,41
710,Do you think he’ll whistle? I hope he whistles.,1.2587412587412588,0.0417688370012711,143,110,29,4,True,True,47
710,Now there's a way to sing and social distance at the same time!,1.2587412587412588,0.042931675959346,143,111,27,5,False,True,63
710,"Ah, the Southern Bluesbird- listen carefully for the microtonal pitch inflections.",1.2587412587412588,0.042931675959346,143,111,27,5,False,True,82
710,Alas we've found it! The Tennessee Speckle Breasted Blues Bird!,1.2587412587412588,0.042931675959346,143,111,27,5,False,True,63
710,That's a Leon Redbreast!,1.2587412587412588,0.0440638384269667,143,112,25,6,False,True,24
710,"After he escaped the coal mine, that canary did 10 long before he learned to sing.",1.2587412587412588,0.0440638384269667,143,112,25,6,False,True,82
710,Listen...it’s the Free Bird,1.2587412587412588,0.0451676312546647,143,113,23,7,False,False,27
710,"Well, I think that he is bob, bob, bobbing along.",1.2587412587412588,0.0417688370012711,143,110,29,4,False,True,49
710,"I suppose a ""Free Bird"" request wouldn't be funny...",1.2587412587412588,0.0472980023429788,143,115,19,9,False,True,52
710,I'd say genus: Teracaetus; genre: Traditional Country.,1.2587412587412588,0.042931675959346,143,111,27,5,False,True,54
710,I'm telling you it's not McCartney.  McCartney is left-handed and plays bass.,1.2587412587412588,0.046245085894578,143,114,21,8,False,True,77
710,It's not everyday you see a wood-thrush sing the blues.,1.2587412587412588,0.0440638384269667,143,112,25,6,False,True,55
710,He definitely knows “ Free Bird”,1.2587412587412588,0.0440638384269667,143,112,25,6,False,False,32
710,He's really out on a limb this time.,1.2587412587412588,0.0417688370012711,143,112,26,5,False,True,36
710,That's Leon Redbird.,1.2587412587412588,0.0451676312546647,143,113,23,7,False,True,20
710,I wouldn't sit on that...It's a hit!,1.2587412587412588,0.046245085894578,143,114,21,8,False,True,36
710,"It's Avian Idol, at home edition.",1.2587412587412588,0.0440638384269667,143,112,25,6,False,True,33
710,He once opened for The Byrds.,1.2587412587412588,0.042931675959346,143,111,27,5,False,True,29
710,"Rockin' Robin...He gets a lot of tweets...tweet, tweet, tweet.",1.2587412587412588,0.042931675959346,143,111,27,5,False,True,62
710,Ahhh ... The Delta Blues bird.,1.2587412587412588,0.0417688370012711,143,110,29,4,False,True,30
710,The audience decided to give him a stay-at-home order.,1.2587412587412588,0.0440638384269667,143,112,25,6,False,True,54
710,"Well, we are on Jaybird Street.",1.2587412587412588,0.0417688370012711,143,110,29,4,False,True,31
710,"Look Martha, it's the rare blues jay!",1.2587412587412588,0.042931675959346,143,111,27,5,False,True,37
710,Is he's branching out or out on a limb?,1.2587412587412588,0.042931675959346,143,111,27,5,True,True,39
710,Is it a bluesbird or a rockin’ robin?,1.2587412587412588,0.0440638384269667,143,112,25,6,True,True,37
710,"He calls himself a ""Blues Bird,"" but he's actually a chicken that escaped the Tyson factory down the road.",1.2587412587412588,0.046245085894578,143,114,21,8,False,True,106
710,This branch is your branch,1.2587412587412588,0.0451676312546647,143,113,23,7,False,False,26
710,I’m gonna go out on a limb and say he’s a little chirpy.,1.2587412587412588,0.0451676312546647,143,113,23,7,False,True,56
710,Delta bluesbird is my guess.,1.2587412587412588,0.0417688370012711,143,110,29,4,False,True,28
