contest,caption,mean,precision,votes,not_funny,somewhat_funny,funny,has_question_mark,ends_with_punctuation,caption_length
736,Does this mean it's over?,1.2328767123287672,0.0569404744901366,73,58,13,2,True,True,25
736,And now you can't reach it?,1.2328767123287672,0.0534948607938811,73,57,15,1,True,True,27
736,You traitor! You've been assimilated.,1.2328767123287672,0.0534948607938811,73,57,15,1,False,True,37
736,"Well, the good news is that it definitely takes attention away from your arms.",1.2328767123287672,0.0498114708430854,73,56,17,0,False,True,78
736,Do I look tough if I show my teeth?,1.2328767123287672,0.0632712623769452,73,60,9,4,True,True,35
736,Keep it up kid! It looks promising!  You've got only 65 million more years to catch up with Elon Musk and SpaceX!,1.2328767123287672,0.0662100456621004,73,61,7,5,False,True,113
736,"I'm sorry, but that thing is so 200 million BC.",1.2328767123287672,0.0601891613080551,73,59,11,3,False,True,47
736,Do you think I’ve lost weight?,1.2328767123287672,0.0534948607938811,73,57,15,1,True,True,30
736,It elevates my mood and gives me a sense of direction.,1.2328767123287672,0.0601891613080551,73,59,11,3,False,True,54
736,"Uh.. I was going to ask if you wanted to catch the Deepak Chopra lecture over at the U but, never mind""",1.2328767123287672,0.0569404744901366,73,58,13,2,False,False,103
736,I get it. The new normal. Cool.,1.2328767123287672,0.0534948607938811,73,57,15,1,False,True,31
736,"No, I don't think    it will protect you from fall debris from the sky.  It does, however, bring out the color in your eyes.",1.2328767123287672,0.0569404744901366,73,58,13,2,False,True,124
736,"It’s called a beanie, Baby.",1.2328767123287672,0.0569404744901366,73,58,13,2,False,True,27
736,"Okay, Lou, lemme me if I got this: The twirly thing on top is made out of something you call ""plastic.""  And you made it out of some goo you scooped out of the tar pits?  Lou, Buddy, you need to breed, soon, and often!",1.2328767123287672,0.0632712623769452,73,60,9,4,True,True,218
736,Honest! He tasted just like chicken.,1.2328767123287672,0.0601891613080551,73,59,11,3,False,True,36
736,Just because we’re prehistoric doesn’t mean you can’t be kid at heart,1.2328767123287672,0.0601891613080551,73,59,11,3,False,False,69
736,"No, but if we´d all wear one the meteor stands no chance.",1.2328767123287672,0.0601891613080551,73,59,11,3,False,True,57
736,You are definitely ahead of your time!,1.2328767123287672,0.0569404744901366,73,58,13,2,False,True,38
736,Are you a helicopter?,1.2328767123287672,0.0569404744901366,73,58,13,2,True,True,21
736,Which Fraternity did you pledge?,1.2328767123287672,0.0569404744901366,73,58,13,2,True,True,32
736,"I know, but my Nana got it for me on her last trip and she is coming to see me today.",1.2328767123287672,0.0601891613080551,73,59,11,3,False,True,85
736,"I 
I'm sorry but I'm not allowed to date propelleraptors.",1.2328767123287672,0.0601891613080551,73,59,11,3,False,True,57
736,They'll still keep saying we couldn't fly.,1.2328767123287672,0.0534948607938811,73,57,15,1,False,True,42
736,"That won't keep you out of the draft any more.""",1.2328767123287672,0.0534948607938811,73,57,15,1,False,False,47
736,What part of black and white do you not understand?,1.2328767123287672,0.0569404744901366,73,58,13,2,True,True,51
736,"‘I don’t care how many followers you have, it looks ridiculous.’",1.2328767123287672,0.0632712623769452,73,60,9,4,False,False,64
736,What can I say? My inner child was dying to be let out.,1.2328767123287672,0.0569404744901366,73,58,13,2,True,True,55
736,I like to add a splash of color,1.2328767123287672,0.0569404744901366,73,58,13,2,False,False,31
736,"“But Joey, how can you be sure you’re not a Pterodactyl?”",1.2328767123287672,0.0534948607938811,73,57,15,1,True,False,57
736,"Forget the hat, how did you get it on your head?",1.2328767123287672,0.0569404744901366,73,58,13,2,True,True,48
736,"Enjoy Mars, Starship SpaceREX.  I'm staying here where it's safe.",1.2328767123287672,0.0601891613080551,73,59,11,3,False,True,65
736,You need to grow a pair.,1.2328767123287672,0.0662100456621004,73,61,7,5,False,True,24
736,"Those pterodactyls think
they’re so smart.",1.2328767123287672,0.0534948607938811,73,57,15,1,False,True,42
736,Wow. That exstinks.,1.2328767123287672,0.0662100456621004,73,61,7,5,False,True,19
736,You gave your firstborn away for this?,1.2328767123287672,0.0632712623769452,73,60,9,4,True,True,38
736,I'm not sure that look will take off!,1.2328767123287672,0.0601891613080551,73,59,11,3,False,True,37
736,I hope he tasted as good as that hat looks.,1.2328767123287672,0.0534948607938811,73,57,15,1,False,True,43
736,"Gosh, Will you run again in 2024?",1.2328767123287672,0.0662100456621004,73,61,7,5,True,True,33
736,We're all going to die anyway...,1.2328767123287672,0.0569404744901366,73,58,13,2,False,True,32
736,"Evolution, baby, evolution.",1.2328767123287672,0.0569404744901366,73,58,13,2,False,True,27
736,"Careful, you could evolve into something called a ‘Rudy’.",1.2328767123287672,0.0569404744901366,73,58,13,2,False,True,57
736,"You’re much too old for that nonsense!  
Time to put that silly thing away, join me, and walk together to our extinction.",1.2328767123287672,0.0601891613080551,73,59,11,3,False,True,121
736,You're just jealous.  Now I can fly and you can't.,1.2328767123287672,0.0601891613080551,73,59,11,3,False,True,50
736,You are not a pterodactyl  stan.,1.2328767123287672,0.0569404744901366,73,58,13,2,False,True,32
736,Dude. One thing that hasn’t evolved is your fashion sense.,1.2328767123287672,0.0569404744901366,73,58,13,2,False,True,58
736,Stop it! Nerds are also an evolutionary dead end!,1.2328767123287672,0.0534948607938811,73,57,15,1,False,True,49
736,No. I only wear it to hide my bad haircut.,1.2328767123287672,0.0601891613080551,73,59,11,3,False,True,42
736,Attaining immortality in a cartoon is all very well but I'd settle for not becoming extinct.,1.2328767123287672,0.0601891613080551,73,59,11,3,False,True,92
736,"What's with the whirly gig on your head? I told you being bald was ok with me.""",1.2328767123287672,0.0569404744901366,73,58,13,2,True,False,79
736,"You've lost Timmy again, haven't you?",1.2328767123287672,0.0601891613080551,73,59,11,3,True,True,37
736,Tweedle dumb,1.2328767123287672,0.0632712623769452,73,60,9,4,False,False,12
736,"After you ate him, how did you put his hat on your head?",1.2328767123287672,0.0601891613080551,73,59,11,3,True,True,56
736,Easily makes you look younger... like a member of the Generation Jurassic.,1.2328767123287672,0.0569404744901366,73,58,13,2,False,True,74
736,"So can you take off with it,or what?",1.2328767123287672,0.0632712623769452,73,60,9,4,True,True,36
736,I just got this new beanie to help me deal with global warming.,1.2328767123287672,0.0569404744901366,73,58,13,2,False,True,63
736,"Renewables, huh? You should share your invention with Elon Mesozoic. He’s the new kid genius on the block. 

OR

Renewables, huh? So you think this will outdo fossil fuels?",1.2328767123287672,0.0601891613080551,73,59,11,3,True,True,172
736,"I told you that if you wore that silly cap, the world would end!",1.2328767123287672,0.0632712623769452,73,60,9,4,False,True,64
736,Absolutely! It's so YOU!,1.2328767123287672,0.0601891613080551,73,59,11,3,False,True,24
736,"Yikes. I thought you knew a ""celebration of life"" is a funeral?",1.2328767123287672,0.0601891613080551,73,59,11,3,True,True,63
736,Haven't seen one of those in ages!,1.2328767123287672,0.0569404744901366,73,58,13,2,False,True,34
736,"What a Jurassic faux pas, Christopher.",1.2328767123287672,0.0601891613080551,73,59,11,3,False,True,38
736,I won the staring contest.,1.2328767123287672,0.0569404744901366,73,58,13,2,False,True,26
736,We evolved from the sea. Don't have any illusion about its ever leading to flight in. the air.,1.2328767123287672,0.0498114708430854,73,56,17,0,False,True,94
736,I thought you said you were just going for milk.,1.2328767123287672,0.0569404744901366,73,58,13,2,False,True,48
736,I thought those caps were extinct.,1.2328767123287672,0.0569404744901366,73,58,13,2,False,True,34
736,"Arnold,  is that your evacuation plan?",1.2328767123287672,0.0569404744901366,73,58,13,2,True,True,38
736,That will solve all of our energy needs?,1.2328767123287672,0.0632712623769452,73,60,9,4,True,True,40
736,"Whadya mean it's because your a freshman? You're one hundred years old""",1.2328767123287672,0.0601891613080551,73,59,11,3,True,False,71
736,Really Bozo? This is what you came up with to lure me in mating season? Think Peacock! Peacock!,1.2328767123287672,0.0601891613080551,73,59,11,3,True,True,95
736,"So, you time travel to the 21st century and this is what you bring back?",1.2328767123287672,0.0632712623769452,73,60,9,4,True,True,72
736,It's a better look than the tin foil.,1.2328767123287672,0.0569404744901366,73,58,13,2,False,True,37
736,We can’t do anything about fossil fuels but we can start them off on wind energy.”,1.2328767123287672,0.0534948607938811,73,57,15,1,False,False,82
736,I want them to thing Iam too young to make a handbag out of !,1.2328767123287672,0.0601891613080551,73,59,11,3,False,True,61
736,"That’s not what I meant when I said, “Look breezy for that date.”",1.2328767123287672,0.0601891613080551,73,59,11,3,False,False,65
736,‘Mmmm... not sure about the colour’.,1.2328767123287672,0.0569404744901366,73,58,13,2,False,True,36
736,"I'm telling you, the disaster-detector really does work!",1.2328767123287672,0.0601891613080551,73,59,11,3,False,True,56
736,Does this beanie make my arms look short?,1.2328767123287672,0.0534948607938811,73,57,15,1,True,True,41
736,It spins,1.2328767123287672,0.0534948607938811,73,57,15,1,False,False,8
736,My owner wanted to make a tiktok,1.2328767123287672,0.0632712623769452,73,60,9,4,False,False,32
736,As if you needed to appear more Floridian.,1.2328767123287672,0.0601891613080551,73,59,11,3,False,True,42
736,that's the latest MAGA hat isn't it? The massive fraud edition!,1.2328767123287672,0.0601891613080551,73,59,11,3,True,True,63
736,"You said ""dress casually"".",1.2328767123287672,0.0569404744901366,73,58,13,2,False,True,26
736,I didn’t know I needed it until I saw it. It was a Black Friday deal on Amazon Prime.,1.2328767123287672,0.0569404744901366,73,58,13,2,False,True,85
736,This isn’t what it looks like!,1.2328767123287672,0.0569404744901366,73,58,13,2,False,True,30
736,I see dead people.,1.2328767123287672,0.0632712623769452,73,60,9,4,False,True,18
736,This is going to change history!,1.2328767123287672,0.0601891613080551,73,59,11,3,False,True,32
736,"It's been an awful year, honey. I thought it might cheer you up.",1.2328767123287672,0.0534948607938811,73,57,15,1,False,True,64
736,I thought you said you would wear yours if I wore mine?,1.2328767123287672,0.0601891613080551,73,59,11,3,True,True,55
736,Let it go. You’re not as young as the Earth anymore.,1.2328767123287672,0.0632712623769452,73,60,9,4,False,True,52
736,A propeller beanie? Get with the times!,1.2297297297297298,0.0594535690933109,74,60,11,3,True,True,39
736,I think it's a human artifact from when they covered the earth.,1.2295081967213115,0.063562037261619,61,49,10,2,False,True,63
736,Can it predict the future?,1.2285714285714286,0.0581688431661773,70,56,12,2,True,True,26
736,Did you get that hat in Giulany's office?,1.2285714285714286,0.0581688431661773,70,56,12,2,True,True,41
736,old hat,1.2285714285714286,0.0544934458475796,70,55,14,1,False,False,7
736,"You can try all the new fads you want, but they're still going to call you a dinosaur.",1.2285714285714286,0.0616254248686333,70,57,10,3,False,True,86
736,Too bad you can't twirl that propeller on your own.,1.2285714285714286,0.0581688431661773,70,56,12,2,False,True,51
736,No thanks. I just don't like kids.,1.2285714285714286,0.0616254248686333,70,57,10,3,False,True,34
736,Silly Hat Day was last epoch.,1.2285714285714286,0.0581688431661773,70,56,12,2,False,True,29
736,I can't stand it.That's why we are going extinct.,1.2285714285714286,0.0616254248686333,70,57,10,3,False,True,49
736,Give it 60 million years and see if you’re still in love with it.,1.2285714285714286,0.0680136040813604,70,59,6,5,False,True,65
736,"our species ranks 284th in I.Q., but that makes you look like 285th material",1.2285714285714286,0.0616254248686333,70,57,10,3,False,False,76
736,Your beanie flies high.,1.2285714285714286,0.0544934458475796,70,55,14,1,False,True,23
736,Where are you going to go with that hat? To Mars?,1.2285714285714286,0.0648981638044391,70,58,8,4,True,True,49
736,"Cute, but take it off for the job interview.",1.2285714285714286,0.0581688431661773,70,56,12,2,False,True,44
736,"Ok, now you’re aging yourself.",1.2285714285714286,0.0544934458475796,70,55,14,1,False,True,30
736,"I hate to say it, but I think that Pterodactyl was pranking you.",1.2285714285714286,0.0616254248686333,70,57,10,3,False,True,64
736,"We're dinosaurs, Jeff. We don't need to wear hats to be Insta-worthy.",1.2285714285714286,0.0544934458475796,70,55,14,1,False,True,69
736,"Can’t, I’m on the No Fly list.”",1.2285714285714286,0.0581688431661773,70,56,12,2,False,False,31
736,"I ate the kid, but I love the hat.",1.2285714285714286,0.0616254248686333,70,57,10,3,False,True,34
736,"Your evolutionary theories are brilliant, Rex, but everyone sees you as a fool.",1.2285714285714286,0.0616254248686333,70,57,10,3,False,True,79
736,Does being employed by Google shield you from a once-in-lifetime extinction?,1.2285714285714286,0.0581688431661773,70,56,12,2,True,True,76
736,"Oh Zog, that's so last eon.",1.2285714285714286,0.0616254248686333,70,57,10,3,False,True,27
736,Dragon of the month award ain't what it used to be.,1.2285714285714286,0.0616254248686333,70,57,10,3,False,True,51
736,Leaving the ocean was a success. Flight? Not so much.,1.2285714285714286,0.0581688431661773,70,56,12,2,True,True,53
736,"You'll do anything for a lift, won't you?",1.2285714285714286,0.0648981638044391,70,58,8,4,True,True,41
736,You are positive this will save us?,1.2285714285714286,0.0581688431661773,70,56,12,2,True,True,35
736,"And all of a sudden, I don't have to remind folks to stay 6 feet away anymore",1.2285714285714286,0.0505515278245361,70,54,16,0,False,False,77
736,"You were supposed to bring back dinner, not a souvenir from Jurassic Park.",1.2285714285714286,0.0544934458475796,70,55,14,1,False,True,74
736,It's colorful but it's not gonna fly.,1.2285714285714286,0.0616254248686333,70,57,10,3,False,True,37
736,This proves you have a brain the size of a walnut.,1.2285714285714286,0.0544934458475796,70,55,14,1,False,True,50
736,I think this confirms that evolution has a wacky sense of humor.,1.2285714285714286,0.0648981638044391,70,58,8,4,False,True,64
736,You look smart!,1.2285714285714286,0.0616254248686333,70,57,10,3,False,True,15
736,"Take that off, propeller beanies don't get invented until long after we're gone.",1.2285714285714286,0.0581688431661773,70,56,12,2,False,True,80
736,Nope. Won't improve your natural selection chances.,1.2285714285714286,0.0616254248686333,70,57,10,3,False,True,51
736,"It's worth a try, maybe she'll like it.",1.2285714285714286,0.0544934458475796,70,55,14,1,False,True,39
736,That won't get rid of the stink.,1.2285714285714286,0.0616254248686333,70,57,10,3,False,True,32
736,Survival of the fittest?,1.2285714285714286,0.0616254248686333,70,57,10,3,True,True,24
736,Your hat is rediculous and won't prevent you from from being prosecuted as  an adult,1.2285714285714286,0.0581688431661773,70,56,12,2,False,False,84
736,"If I could fly, would I be here talking to you?",1.2285714285714286,0.0581688431661773,70,56,12,2,True,True,47
736,"I
No, it's not cute.",1.2285714285714286,0.0544934458475796,70,55,14,1,False,True,20
736,"I get it - you lost a bet with T-Rex, and wearing this beanie beats being eaten.",1.2285714285714286,0.0581688431661773,70,56,12,2,False,True,80
736,Cute.  But you're still a dinosaur.,1.2285714285714286,0.0616254248686333,70,57,10,3,False,True,35
736,We don't like your kind...,1.2285714285714286,0.0581688431661773,70,56,12,2,False,True,26
736,I hope you get caught dead wearing that.,1.2285714285714286,0.0544934458475796,70,55,14,1,False,True,40
736,But Trump really did lose the election!,1.2285714285714286,0.0616254248686333,70,57,10,3,False,True,39
736,70 million years from now somebody's gonna really DIG you!,1.2285714285714286,0.0648981638044391,70,58,8,4,False,True,58
736,Welcome to Google! This way to the cafeteria -- it's Triceratops Tuesday.,1.2285714285714286,0.0616254248686333,70,57,10,3,False,True,73
736,"You shouldn't have bothered, Dear. It's  come as you are party.""",1.2285714285714286,0.0581688431661773,70,56,12,2,False,False,64
736,"Someday somebody will find that, maybe fossilized, and start wondering about what kind of moron you were.",1.2285714285714286,0.0581688431661773,70,56,12,2,False,True,105
736,Yes we are related to birds. No that won't help you fly.,1.2285714285714286,0.0581688431661773,70,56,12,2,False,True,56
736,I’m takin’ off.,1.2285714285714286,0.0581688431661773,70,56,12,2,False,True,15
736,My God! You look stupid. You'll never evolve,1.2285714285714286,0.0616254248686333,70,57,10,3,False,False,44
736,But I thought we weren't supposed to fly during this COVID surge?,1.2285714285714286,0.0616254248686333,70,57,10,3,True,True,65
736,Seeming 'distinct' won't save us from being 'extinct.',1.2285714285714286,0.0581688431661773,70,56,12,2,False,False,54
736,"If that's the future, I'll take my chances on the meteor.",1.2285714285714286,0.0581688431661773,70,56,12,2,False,True,57
736,High School reunion?,1.2285714285714286,0.0581688431661773,70,56,12,2,True,True,20
736,Flight may have to wait for us to evolve feathers.,1.2285714285714286,0.0581688431661773,70,56,12,2,False,True,50
736,We're facing mass extinction and you tell me about this now!,1.2285714285714286,0.0648981638044391,70,58,8,4,False,True,60
736,That isn’t what I meant by ‘top hat’ but I think I like this better.,1.2285714285714286,0.0544934458475796,70,55,14,1,False,True,68
736,It is part of the evolution for us to prevent catching COVID 6.,1.2285714285714286,0.0581688431661773,70,56,12,2,False,True,63
736,I bought it from Q.  He said it would keep the meteors away.,1.2285714285714286,0.0616254248686333,70,57,10,3,False,True,60
736,I’m so sick of zoom. I’ll wear anything to spruce up our meetings.,1.2285714285714286,0.0616254248686333,70,57,10,3,False,True,66
736,Does this hat make my tail look big?,1.2285714285714286,0.0544934458475796,70,55,14,1,True,True,36
736,It looked better on the boy you ate.,1.2285714285714286,0.0581688431661773,70,56,12,2,False,True,36
736,"I would take it off, but I can’t reach it",1.2285714285714286,0.0616254248686333,70,57,10,3,False,False,41
736,"Nope, not floating.",1.2285714285714286,0.0648981638044391,70,58,8,4,False,True,19
736,"Marv, you are one cool dude",1.2285714285714286,0.0581688431661773,70,56,12,2,False,False,27
736,You really think this velocicopter thing will take off?,1.2285714285714286,0.0544934458475796,70,55,14,1,True,True,55
736,That hat is so last era.,1.2285714285714286,0.0544934458475796,70,55,14,1,False,True,24
736,"Hey, Cecil, you seen Beany lately?",1.2285714285714286,0.0581688431661773,70,56,12,2,True,True,34
736,Does that come in other colors?,1.2285714285714286,0.0544934458475796,70,55,14,1,True,True,31
736,"Evolving to fly seemed like a long-shot, so I went with this.",1.2285714285714286,0.0581688431661773,70,56,12,2,False,True,61
736,It would look better if you wore a suit and a bow tie.,1.2285714285714286,0.0544934458475796,70,55,14,1,False,True,54
736,"OK, but that's not the remedy I had in mind when I said you lacked wanderlust.",1.2285714285714286,0.0544934458475796,70,55,14,1,False,True,78
736,"An interesting idea, but maybe you should add a chin strap.",1.2285714285714286,0.0544934458475796,70,55,14,1,False,True,59
736,Wanna bully some herbivores?,1.2285714285714286,0.0544934458475796,70,55,14,1,True,True,28
736,Are you sure Godzilla started this way?,1.2285714285714286,0.0581688431661773,70,56,12,2,True,True,39
736,Dad always said you were more evolved than me.,1.2285714285714286,0.0581688431661773,70,56,12,2,False,True,46
736,"Maybe it'll work someday, but my money's still on wings.",1.2285714285714286,0.0616254248686333,70,57,10,3,False,True,56
736,Make dinosaurs great again—sounds like a promising future.,1.2285714285714286,0.0544934458475796,70,55,14,1,False,True,58
736,Hate to be the one to tell you but it'll never fly,1.2285714285714286,0.0680136040813604,70,59,6,5,False,False,50
736,Extinction where is thy sting?,1.2285714285714286,0.0616254248686333,70,57,10,3,True,True,30
736,Looks Tasty',1.2285714285714286,0.0581688431661773,70,56,12,2,False,False,12
736,"George, wind turbines not only kill birds, but that thing will give you cancer.",1.2285714285714286,0.0616254248686333,70,57,10,3,False,True,79
736,That disguise won't save you.,1.2285714285714286,0.0544934458475796,70,55,14,1,False,True,29
736,"Hmmm, Little old for a Beany aren't you Cecil?",1.2285714285714286,0.0581688431661773,70,56,12,2,True,True,46
736,"It's whimsical, but I don't think it will take off.",1.2285714285714286,0.0616254248686333,70,57,10,3,False,True,51
736,That hat is so Triassic Era!,1.2285714285714286,0.0581688431661773,70,56,12,2,False,True,28
736,"Honestly, it’s the only distinguishable difference between alligators and crocodiles.”",1.2285714285714286,0.0616254248686333,70,57,10,3,False,False,86
736,Cute but it won't prevent extinction.,1.2285714285714286,0.0544934458475796,70,55,14,1,False,True,37
736,"Bargain or no bargain, you still look stupid.",1.2285714285714286,0.0616254248686333,70,57,10,3,False,True,45
736,It does nothing to accentuate your eyes.,1.2285714285714286,0.0581688431661773,70,56,12,2,False,True,40
736,I bet Spanky wouldn’t look at me like that,1.2285714285714286,0.0544934458475796,70,55,14,1,False,False,42
736,"Maybe they do ward off meteors, but I say they’re depriving me of my personal freedom.",1.2285714285714286,0.0544934458475796,70,57,11,2,False,True,86
736,It just draws more attention to your flightlessness.,1.2285714285714286,0.0616254248686333,70,57,10,3,False,True,52
736,I don’t know. It makes you look... less evolved.,1.2285714285714286,0.0544934458475796,70,55,14,1,False,True,48
736,No? No.,1.2285714285714286,0.0648981638044391,70,58,8,4,True,True,7
736,This should help people who can’t tell a crocodile from an alligator.,1.2285714285714286,0.0616254248686333,70,57,10,3,False,True,69
736,"If pretty little bluebirds fly
Above the rainbow
Why oh why can’t I?",1.2285714285714286,0.0544934458475796,70,55,14,1,True,True,68
736,How do you get is off?? I want to know how you put it on.,1.2285714285714286,0.0616254248686333,70,57,10,3,True,True,57
736,You Look Like A Dunce-A-Saur!,1.2285714285714286,0.0544934458475796,70,55,14,1,False,True,29
736,"If you're going to evolve, wings may work better.",1.2285714285714286,0.0616254248686333,70,57,10,3,False,True,49
736,"I don’t care if it was 30% off list price, you are not wearing it to little Dina’s wedding!",1.2285714285714286,0.0544934458475796,70,55,14,1,False,True,91
736,"I think its a volcano, not fireworks...",1.2285714285714286,0.0680136040813604,70,59,6,5,False,True,39
736,"Sure, the New Yorker will do color in a cartoon every now and then, but this set-up isn't near funny enough to justify it.",1.2285714285714286,0.0581688431661773,70,56,12,2,False,True,122
736,That will never fly.,1.2285714285714286,0.0544934458475796,70,55,14,1,False,True,20
736,IT MAKES ME LOOK TALLER,1.2285714285714286,0.0616254248686333,70,57,10,3,False,False,23
736,What are you supposed to be? A helicopterodactyl? I saw a ton of those last Halloween.,1.2285714285714286,0.0616254248686333,70,57,10,3,True,True,86
736,"Joe Namath convinced me to sign up for that Medicare Advantage Plan, but this is all I was eligible for!",1.2285714285714286,0.0544934458475796,70,55,14,1,False,True,104
736,It's a requirement for the fraternity I'm pledging!,1.2285714285714286,0.0616254248686333,70,57,10,3,False,True,51
736,I think it means I ate a freshman.,1.2285714285714286,0.0616254248686333,70,57,10,3,False,True,34
736,It keeps me humble.,1.2285714285714286,0.0581688431661773,70,56,12,2,False,True,19
736,"He wouldn’t give it to me
So I ate him...",1.2285714285714286,0.0581688431661773,70,56,12,2,False,True,41
736,I see why they call you diplodocus.,1.2285714285714286,0.0616254248686333,70,57,10,3,False,True,35
736,What do you think? Does this make my butt look big?,1.2285714285714286,0.0581688431661773,70,56,12,2,True,True,51
736,How was the hazing?,1.2285714285714286,0.0648981638044391,70,58,8,4,True,True,19
736,Hard to believe they made that way back in the Cenozoic Era.,1.2285714285714286,0.0544934458475796,70,55,14,1,False,True,60
736,You must know individualism is not valued in our group.,1.2285714285714286,0.0581688431661773,70,56,12,2,False,True,55
736,"All work and no play has made you a dull boy,Brach.",1.2285714285714286,0.0581688431661773,70,56,12,2,False,True,51
736,We already look weird without any ears ..why would you  wear a bennie with a propeller.,1.2285714285714286,0.0648981638044391,70,58,8,4,False,True,87
736,Now we're definitely going extinct.,1.2285714285714286,0.0616254248686333,70,57,10,3,False,True,35
736,So how long will it take to reach Mars?,1.2285714285714286,0.0648981638044391,70,58,8,4,True,True,39
736,Is it too late to visit Disneyland?,1.2285714285714286,0.0616254248686333,70,57,10,3,True,True,35
736,Do you really think that will help you survive?,1.2285714285714286,0.0581688431661773,70,56,12,2,True,True,47
736,Great disguise. No one will ever guess your species.,1.2285714285714286,0.0648981638044391,70,58,8,4,False,True,52
