contest,caption,mean,precision,votes,not_funny,somewhat_funny,funny,has_question_mark,ends_with_punctuation,caption_length
682,Global warming is a hooooax!,1.2597402597402598,0.0410013806674423,154,119,30,5,False,True,28
682,Find me on Facebook!,1.2597402597402598,0.0410013806674423,154,119,30,5,False,True,20
682,You’re turning into someone I don’t recognize.,1.2597402597402598,0.042023751075554,154,120,28,6,False,True,46
682,If they wanted you to stay they would have called it 'stay' not 'Fall'.,1.2597402597402598,0.0342318359089142,154,118,34,2,False,True,71
682,So.....are you falling for me?,1.2597402597402598,0.042023751075554,154,120,28,6,True,True,30
682,You always think it only happens to others.,1.2597402597402598,0.0399528569543268,154,118,32,4,False,True,43
682,I held on for you for as long as I could,1.2597402597402598,0.0348462309096211,154,121,29,4,False,False,40
682,I hate moving,1.2597402597402598,0.0439972786670648,154,122,24,8,False,False,13
682,Who’re you calling a lightweight?,1.2597402597402598,0.0430218327397118,154,121,26,7,True,True,33
682,We're all just fall guys.,1.2597402597402598,0.0410013806674423,154,119,30,5,False,True,25
682,Hope to see you next fall.,1.2597402597402598,0.0410013806674423,154,119,30,5,False,True,26
682,Stop! Don't leaf me behind!,1.2597402597402598,0.0399528569543268,154,118,32,4,False,True,27
682,That’s the last time I go out on a limb for you!,1.2597402597402598,0.038876063856688,154,117,34,3,False,True,48
682,What do you mean I’m a lemming?,1.2597402597402598,0.0410013806674423,154,119,30,5,True,True,31
682,Don’t forget to shut off the water.,1.2597402597402598,0.0377685835472509,154,116,36,2,False,True,35
682,This weather always blows me away.,1.2597402597402598,0.0410013806674423,154,119,30,5,False,True,34
682,The family tree is getting a little sparse.,1.2597402597402598,0.0430218327397118,154,121,26,7,False,True,43
682,I’m more scared of being forgotten.,1.2597402597402598,0.0410013806674423,154,119,30,5,False,True,35
682,"Finally, retirement!",1.2597402597402598,0.0399528569543268,154,118,32,4,False,True,20
682,Don`t leaf me alone!,1.2582781456953642,0.0403774423493992,151,116,31,4,False,True,20
682,It's the end of the fourth quarter and it looks like crunch time.,1.2582781456953642,0.0414564599481144,151,117,29,5,False,True,65
682,"Don’t worry, I’ll save you a spot.",1.2582781456953642,0.0425080967837912,151,118,27,6,False,True,34
682,Don't worry - I'll save you a seat.,1.2582781456953642,0.0414564599481144,151,117,29,5,False,True,35
682,Wait! Do-over!,1.2582781456953642,0.0403774423493992,151,116,31,4,False,True,14
682,I'm taking a leaf of faith!,1.2582781456953642,0.0403774423493992,151,116,31,4,False,True,27
682,I'm off to join the decaying masses!,1.2582781456953642,0.039268786967877,151,115,33,3,False,True,36
682,I need to know.  Were we something more than a quick spring.,1.2582781456953642,0.0425080967837912,151,118,27,6,False,True,60
682,You didn't say if you preferred to be mulched or bagged?,1.2582781456953642,0.0381279085340116,151,114,35,2,True,True,56
682,Hang in there pal. You're the last leaf of the season.,1.2582781456953642,0.0414564599481144,151,117,29,5,False,True,54
682,"No, you go first.""  ""No, you go first.""  ""No, you go first.",1.2582781456953642,0.0435343371711425,151,119,25,7,False,True,59
682,I'll never call you too clingy again!,1.2582781456953642,0.0435343371711425,151,119,25,7,False,True,37
682,I told you to call it autumn!,1.2582781456953642,0.0445369367343699,151,120,23,8,False,True,29
682,Are you kidding me? That's why they call it Fallll.,1.2582781456953642,0.0403774423493992,151,116,31,4,True,True,51
682,I think I’m starting to fall for you...,1.2582781456953642,0.0425080967837912,151,118,27,6,False,True,39
682,I never saw Paris.,1.2582781456953642,0.0381279085340116,151,114,35,2,False,True,18
682,Marco!,1.2582781456953642,0.039268786967877,151,115,33,3,False,True,6
682,This part of the 'Circle of Life' is so unseemly.,1.2582781456953642,0.039268786967877,151,115,33,3,False,True,49
682,Why do you always have to be the last to leave?,1.2582781456953642,0.0425080967837912,151,118,27,6,True,True,47
682,"Pine all you want, but we'll always be deciduous.",1.2582781456953642,0.0414564599481144,151,117,29,5,False,True,49
682,Bottom of the tree means top of the pile!,1.2582781456953642,0.0425080967837912,151,118,27,6,False,True,41
682,"Ohhh, NOW I know why they call it 'fall', duh!",1.2582781456953642,0.0403774423493992,151,116,31,4,False,True,46
682,Don’t you know that’s why they call it Fall,1.2582781456953642,0.039268786967877,151,115,33,3,False,False,43
682,"I'm falling for you, see you in the compost Stella",1.2582781456953642,0.0414564599481144,151,117,29,5,False,False,50
682,"Pride cometh before the fall, Allen!",1.2582781456953642,0.0435343371711425,151,119,25,7,False,True,36
682,I hope to decompose near you!,1.2582781456953642,0.039268786967877,151,115,33,3,False,True,29
682,"Sweetheart, I'm the fall guy.",1.2582781456953642,0.0403774423493992,151,116,31,4,False,True,29
682,"Sorry oki, but I'm the fall guy.",1.2582781456953642,0.0403774423493992,151,116,31,4,False,True,32
682,No one will be able to call me 'clingy' now!,1.2582781456953642,0.0425080967837912,151,118,27,6,False,True,44
682,"Well,let's hope those paraglider lessons pay off.",1.2582781456953642,0.0414564599481144,151,117,29,5,False,True,49
682,Gotta run. Death is trending.,1.2582781456953642,0.0435343371711425,151,119,25,7,False,True,29
682,Take good care of the tree.,1.2582781456953642,0.0445369367343699,151,120,23,8,False,True,27
682,I’m being relocated to another branch,1.2582781456953642,0.0445369367343699,151,120,23,8,False,False,37
682,"It's not you, it's deciduous.",1.2582781456953642,0.0403774423493992,151,116,31,4,False,True,29
682,Damn! I really wanted to see the impeachment.,1.2582781456953642,0.0455174576885816,151,121,21,9,False,True,45
682,I'm gonna miss you so mulch.,1.2582781456953642,0.0425080967837912,151,118,27,6,False,True,28
682,"... and then suddenly, Donald Trump was left all alone.",1.2582781456953642,0.0455174576885816,151,121,21,9,False,True,55
682,I think it’s time we decompose.,1.2582781456953642,0.0403774423493992,151,116,31,4,False,True,31
682,I really am falling for you !,1.2582781456953642,0.0403774423493992,151,116,31,4,False,True,29
682,I dream of covering dog poo for the final act.,1.2582781456953642,0.0403774423493992,151,116,31,4,False,True,46
682,"'Well, goodbye, I knew it was only a summer fling...'",1.2582781456953642,0.0435343371711425,151,119,25,7,False,False,53
682,I've always been partial to Errol Garner's version too.,1.2582781456953642,0.039268786967877,151,115,33,3,False,True,55
682,Don’t leaf me.  I was just about to fall for you.,1.2582781456953642,0.0414564599481144,151,117,29,5,False,True,49
682,Don't worry.  I'll send a text with my GPS coordinates.,1.2582781456953642,0.0403774423493992,151,116,31,4,False,True,55
682,I'm gonna get to the root of what's holding us up.,1.2582781456953642,0.0414564599481144,151,117,29,5,False,True,50
682,The ground comes for us all.,1.2582781456953642,0.0414564599481144,151,117,29,5,False,True,28
682,I told you it wasn't a good idea to branch out,1.2582781456953642,0.0435343371711425,151,119,25,7,False,False,46
682,What Happens After The Fall ?,1.2582781456953642,0.039268786967877,151,115,33,3,True,True,29
682,I'm afraid I'll be leaving now....,1.2582781456953642,0.0403774423493992,151,116,31,4,False,True,34
682,Somehow I just knew this wouldn't last.,1.2582781456953642,0.039268786967877,151,115,33,3,False,True,39
682,You need to stop hanging on when it's time to let go.,1.2582781456953642,0.039268786967877,151,115,33,3,False,True,53
682,"Nooooo, I don't want to diiiiie",1.2582781456953642,0.0403774423493992,151,116,31,4,False,False,31
682,I just hope I'm spared the rake.,1.2582781456953642,0.0403774423493992,151,116,31,4,False,True,32
682,Oh come on. Join the crowd.,1.2582781456953642,0.0425080967837912,151,118,27,6,False,True,27
682,"Look away, I’m orange!",1.2582781456953642,0.0403774423493992,151,116,31,4,False,True,22
682,You picked a fine time to leave me.,1.2582781456953642,0.0403774423493992,151,116,31,4,False,True,35
682,"Sorry, but I have to leaf you now.",1.2582781456953642,0.0414564599481144,151,117,29,5,False,True,34
682,Snowflakes ain't got nothin' on us.,1.2582781456953642,0.039268786967877,151,115,33,3,False,True,35
682,Promise me you’ll wait...,1.2582781456953642,0.0425080967837912,151,118,27,6,False,True,25
682,Look for me at Second and Main.,1.2582781456953642,0.0403774423493992,151,116,31,4,False,True,31
682,I don't want to decompose.,1.2582781456953642,0.039268786967877,151,115,33,3,False,True,26
682,So this is why they call us leaves.,1.2582781456953642,0.0414564599481144,151,117,29,5,False,True,35
682,There's no easy way down.,1.2582781456953642,0.0425080967837912,151,118,27,6,False,True,25
682,It's time we broke up.,1.2582781456953642,0.0414564599481144,151,117,29,5,False,True,22
682,"The landing's not bad, but I dread getting run over.",1.2582781456953642,0.0403774423493992,151,116,31,4,False,True,52
682,Hold on for your dear leaf!,1.2582781456953642,0.0403774423493992,151,116,31,4,False,True,27
682,"Well, that lemming's TED talk made it sound like fun.",1.2582781456953642,0.0414564599481144,151,117,29,5,False,True,53
682,I should have bought some carbon offsets!,1.2582781456953642,0.0425080967837912,151,118,27,6,False,True,41
682,Natural selection,1.2582781456953642,0.0445369367343699,151,120,23,8,False,False,17
682,I leaf you... get it? I leaf you.,1.2582781456953642,0.0403774423493992,151,116,31,4,True,True,33
682,I'm leaving while I still can.,1.2582781456953642,0.0403774423493992,151,116,31,4,False,True,30
682,I never thought this would only be a summer romance!,1.2582781456953642,0.0403774423493992,151,116,31,4,False,True,52
682,I hate to leave you like this.... but nature calls....,1.2582781456953642,0.0425080967837912,151,118,27,6,False,True,54
682,The schools are just better down there - you’ll understand when you have kids,1.2582781456953642,0.0435343371711425,151,119,25,7,False,False,77
682,"“ If ever I would leaf you, it wouldn’t be in Summer. . . .",1.2582781456953642,0.0403774423493992,151,116,31,4,False,True,59
682,I guess your on your own now.,1.2582781456953642,0.0403774423493992,151,116,31,4,False,True,29
682,Now you're the last leaf hanging.,1.2582781456953642,0.039268786967877,151,115,33,3,False,True,33
682,It must be autumn because I'm falling for you.,1.2582781456953642,0.0425080967837912,151,118,27,6,False,True,46
682,Be sure your location status is turned on!!!,1.2582781456953642,0.0455174576885816,151,121,21,9,False,True,44
682,It seemed so normal for the others -- why is it so scary for me?,1.2582781456953642,0.039268786967877,151,115,33,3,True,True,64
682,"You just can't let it go, can you?  Well fine, stick around, I'm leaving!",1.2582781456953642,0.0381279085340116,151,114,35,2,True,True,73
682,"You must promise me that you'll survive. Never let go, Rose.",1.2582781456953642,0.0425080967837912,151,118,27,6,False,True,60
682,"Sadly,this one falling out ends our summer romance.",1.2582781456953642,0.039268786967877,151,115,33,3,False,True,51
682,"You're last, but not least!",1.2582781456953642,0.0414564599481144,151,117,29,5,False,True,27
682,Everybody else is doing it!,1.2582781456953642,0.0381279085340116,151,114,35,2,False,True,27
682,I'll  try and  fall on the driver's side window wiper.,1.2582781456953642,0.0403774423493992,151,116,31,4,False,True,54
682,Look for me on oak street.,1.2582781456953642,0.0403774423493992,151,116,31,4,False,True,26
682,Wish me luck at the Forrest Gump audition!,1.2582781456953642,0.0403774423493992,151,116,31,4,False,True,42
682,We were growing apart anyway.,1.2582781456953642,0.0403774423493992,151,116,31,4,False,True,29
682,Hope you have a nice fall!,1.2582781456953642,0.0425080967837912,151,118,27,6,False,True,26
682,I suppose I’ll have to take the fall for this one...,1.2582781456953642,0.0403774423493992,151,116,31,4,False,True,52
682,Damn! Just once I'd like to go somewhere else for the winter.,1.2582781456953642,0.0414564599481144,151,117,29,5,False,True,61
682,"So what am I, your Fall guy?",1.2582781456953642,0.0425080967837912,151,118,27,6,True,True,28
682,I will always be-leaf in you!,1.2582781456953642,0.0425080967837912,151,118,27,6,False,True,29
682,"I'm proud to be an Oakie from Muskogee, where White Lightening is the biggest thrill of all.",1.2582781456953642,0.0375444709484989,151,116,32,3,False,True,92
682,Take care of our mother.,1.2582781456953642,0.0425080967837912,151,118,27,6,False,True,24
682,"Like I always say, “if you can’t beat em, join ‘em!”",1.2582781456953642,0.0414564599481144,151,117,29,5,False,False,52
682,Everyone always leaves me.,1.2582781456953642,0.0425080967837912,151,118,27,6,False,True,26
682,"Sometimes, you just have to let go!",1.2582781456953642,0.0435343371711425,151,119,25,7,False,True,35
682,"I'll say, Hi to mom and dad.",1.2582781456953642,0.0403774423493992,151,116,31,4,False,True,28
682,I hope next Fall we can go green.,1.2582781456953642,0.0435343371711425,151,119,25,7,False,True,33
682,I can’t fly!!!,1.2582781456953642,0.0455174576885816,151,121,21,9,False,True,14
682,Orange you coming?,1.2582781456953642,0.0414564599481144,151,117,29,5,True,True,18
682,Promise to look me up?,1.2582781456953642,0.0414564599481144,151,117,29,5,True,True,22
682,"Rose, you said you'd never let go!",1.2582781456953642,0.0414564599481144,151,117,29,5,False,True,34
682,I thought we were evergreen!,1.2582781456953642,0.0414564599481144,151,117,29,5,False,True,28
682,Who saw this coming?,1.2582781456953642,0.0414564599481144,151,117,29,5,True,True,20
682,I always told you this relationship would just be a summer thing.,1.2582781456953642,0.0435343371711425,151,119,25,7,False,True,65
682,Sorry babe. It’s time to chill. I told you it was just a summer fling.,1.2582781456953642,0.039268786967877,151,115,33,3,False,True,70
682,"I hear it's the fall that kills you, not the fall.",1.2582781456953642,0.0425080967837912,151,118,27,6,False,True,50
682,"I don't mind the fall so much, it's being stepped on when I'm down that scares me.",1.2582781456953642,0.0425080967837912,151,118,27,6,False,True,82
682,I am special.  I am unique.  There is nobdy quite like me.,1.2582781456953642,0.0414564599481144,151,117,29,5,False,True,58
682,Love the view from here but this neighbourhood's getting too pricey for me.,1.2582781456953642,0.0425080967837912,151,118,27,6,False,True,75
682,Just face it we all end up in the gutter sooner or later.,1.2582781456953642,0.0425080967837912,151,118,27,6,False,True,57
682,"No, you keep the branch.  I’ll settle somewhere else.",1.2582781456953642,0.0414564599481144,151,117,29,5,False,True,53
682,Falling is such sweet sorrow.,1.2582781456953642,0.0414564599481144,151,117,29,5,False,True,29
682,I truly believed we were different.,1.2582781456953642,0.0435343371711425,151,119,25,7,False,True,35
682,Guess I'll be leaving.,1.2578125,0.0460631383570976,128,100,23,5,False,True,22
682,"I'll se ya, down the road...",1.2567567567567568,0.040815394810552,148,114,30,4,False,True,28
682,"Compost bin 147, look me up.",1.2536231884057971,0.0472020424906168,138,111,19,8,False,True,28
682,Let’s meet under the tree.,1.251700680272109,0.0396183656001945,147,113,31,3,False,True,26
682,Good luck Steve. You can do this. Hang in there.,1.251700680272109,0.0396183656001945,147,113,31,3,False,True,48
682,I can't hide it any longer...I've fallen for you.,1.251700680272109,0.0384243013302144,147,112,33,2,False,True,49
682,Let it go.,1.251700680272109,0.0419045440622109,147,115,27,5,False,True,10
682,"I'd love to hang out, but I'm officially grounded until next year.",1.251700680272109,0.0407774797277397,147,114,29,4,False,True,66
682,Last one on is a rotten egg.,1.251700680272109,0.0430020787076315,147,116,25,6,False,True,28
682,That’s it.  I’m leaving you.,1.251700680272109,0.0407774797277397,147,114,29,4,False,True,28
682,The oak's on you!,1.251700680272109,0.0396183656001945,147,113,31,3,False,True,17
682,Remember when I told you that the road to non-conformity could only lead to loneliness.,1.251700680272109,0.0419045440622109,147,115,27,5,False,True,87
682,You’re next!,1.251700680272109,0.0419045440622109,147,115,27,5,False,True,12
682,Tell my twig and acorns I love them!,1.251700680272109,0.0396183656001945,147,113,31,3,False,True,36
682,It's all downhill from here.,1.251700680272109,0.0396183656001945,147,113,31,3,False,True,28
682,I hope I'm not falling for some rake.,1.251700680272109,0.0419045440622109,147,115,27,5,False,True,37
682,"Remember my name!  I'm Leaf, Eric's son",1.251700680272109,0.0430020787076315,147,116,25,6,False,False,39
682,Enjoy your victory while you can - your downfall is inevitable.,1.251700680272109,0.0430020787076315,147,116,25,6,False,True,63
682,The Grim Raker is calling meeeeeee.,1.251700680272109,0.0396183656001945,147,113,31,3,False,True,35
682,Why am I always the first to fall?,1.251700680272109,0.0407774797277397,147,114,29,4,True,True,34
682,Please don’t get remarried.,1.251700680272109,0.0407774797277397,147,114,29,4,False,True,27
682,Look for me at the landfill.,1.251700680272109,0.0407774797277397,147,114,29,4,False,True,28
682,But what if air resistance DOESN'T put a force on me?!,1.251700680272109,0.0407774797277397,147,114,29,4,True,True,54
682,I feel like one of the president's men.,1.251700680272109,0.0396183656001945,147,113,31,3,False,True,39
682,We'll finish the conversation later,1.251700680272109,0.0396183656001945,147,113,31,3,False,False,35
682,‘They let a few of us hang around for the winter. Better than the options.’,1.251700680272109,0.0430020787076315,147,116,25,6,False,False,75
682,"When I said I'd fallen for you, this isn't what I meant.",1.251700680272109,0.0396183656001945,147,113,31,3,False,True,56
682,I told you not to cough.,1.251700680272109,0.0396183656001945,147,113,31,3,False,True,24
682,"By By, Miss America pie.",1.251700680272109,0.0440722898576065,147,117,23,7,False,True,24
682,"Don’t forget, everyone’s getting together for the big blowout this weekend.",1.251700680272109,0.0407774797277397,147,114,29,4,False,True,75
682,I can't stay out on a limb with you; I need to branch out,1.251700680272109,0.0440722898576065,147,117,23,7,False,False,57
682,Sorry I snapped!,1.251700680272109,0.0396183656001945,147,113,31,3,False,True,16
682,"Well, my therapist suggested that I move out of my comfort zone...",1.251700680272109,0.0407774797277397,147,114,29,4,False,True,66
682,"It not you, it’s me...but I have to leaf.",1.251700680272109,0.0419045440622109,147,115,27,5,False,True,41
682,I hate existentialism.,1.251700680272109,0.0371919207973932,147,111,35,1,False,True,22
682,But I was so sure that I was in the 1%!,1.251700680272109,0.0407774797277397,147,114,29,4,False,True,39
682,Now you’ll have to bear the survivors’ guilt alone!,1.251700680272109,0.0407774797277397,147,114,29,4,False,True,51
682,Have a beautiful fall.,1.251700680272109,0.0419045440622109,147,115,27,5,False,True,22
682,"Well, I’m off to the south for the winter. You coming?",1.251700680272109,0.0384243013302144,147,112,33,2,True,True,54
682,"Well, I really let myself get carried away this time.",1.251700680272109,0.0384243013302144,147,112,33,2,False,True,53
682,I've never seen Titanic!,1.251700680272109,0.0419045440622109,147,115,27,5,False,True,24
682,"Uh oh, I think I’m about to leaf you.",1.251700680272109,0.0407774797277397,147,114,29,4,False,True,37
682,Look for me on a hipsters Instagram page above an edgy caption about death.,1.251700680272109,0.0430020787076315,147,116,25,6,False,True,75
682,I've decided to branch out - I'll see you after the fall.,1.251700680272109,0.0430020787076315,147,116,25,6,False,True,57
682,"Come on, why do you think they call it Fall?",1.251700680272109,0.0430020787076315,147,116,25,6,True,True,44
682,Sorry to be leafing you alone.,1.251700680272109,0.0407774797277397,147,114,29,4,False,True,30
682,I hate leaving at rush hour.,1.251700680272109,0.0407774797277397,147,114,29,4,False,True,28
682,Hang in there...we can do this!,1.251700680272109,0.0345957085831243,147,114,31,2,False,True,31
682,"You know what they say, ""make like a tree and leaf""...",1.251700680272109,0.0407774797277397,147,114,29,4,False,True,54
682,We can't hang forever,1.251700680272109,0.0396183656001945,147,113,31,3,False,False,21
682,Watch! I'll demonstrate when to pull the cord.,1.251700680272109,0.0384243013302144,147,112,33,2,False,True,46
682,You ever have that dream where you're FAaaaallllinnng?,1.251700680272109,0.0396183656001945,147,113,31,3,True,True,54
682,You will need to branch out alone.,1.251700680272109,0.0407774797277397,147,114,29,4,False,True,34
682,What!?  She 's dating the MAPLE leaf?!  I'm completely blown away!,1.251700680272109,0.0419045440622109,147,115,27,5,True,True,66
682,Some say there’s an afterleaf,1.251700680272109,0.0440722898576065,147,117,23,7,False,False,29
682,If I'm not back in an hour...just leave,1.251700680272109,0.0440722898576065,147,117,23,7,False,False,39
682,"The blower is your friend, but beware the rake.",1.251700680272109,0.0407774797277397,147,114,29,4,False,True,47
682,"Okay, watch this! I've been practicing the Triple Lindy in my mind all summer!",1.251700680272109,0.0396183656001945,147,113,31,3,False,True,78
682,I've seen your true colors. I'm leaving!,1.251700680272109,0.0419045440622109,147,115,27,5,False,True,40
682,It’s okay—they banned plastic bags.,1.251700680272109,0.0396183656001945,147,113,31,3,False,True,35
682,"I'll be LEAVING you..... sounds like the beginning of a song""",1.251700680272109,0.0407774797277397,147,114,29,4,False,False,61
682,I’m staying. I don’t love you that mulch.,1.25,0.0412272870765128,144,112,28,4,False,True,41
682,But pumpkin spice lattes aren't even on sale yet!,1.25,0.0412272870765128,144,112,28,4,False,True,49
682,"Outwit, outplay, outlast. Ok you win.",1.25,0.0443678254708056,128,100,24,4,False,True,37
682,"Oh man, I knew I should have moisturized!",1.25,0.0400320384512717,144,111,30,3,False,True,41
682,"Hang in there, Freddy.",1.2481203007518795,0.0445299173378677,133,105,23,5,False,True,22
682,It never gets any easier to leaf you.,1.2464788732394363,0.0437784623152986,142,113,23,6,False,True,37
682,Gesundheit!,1.2464788732394363,0.0437784623152986,142,113,23,6,False,True,11
682,Leaves come and go but I thought you were different!,1.2464788732394363,0.042622337357599,142,112,25,5,False,True,52
682,"When you turned, I started falling for someone else.",1.2464788732394363,0.0402104886825674,142,110,29,3,False,True,52
682,It's ok to let go.,1.2464788732394363,0.04490483140553,142,114,21,7,False,True,18
682,I’m pretty positive this is not covered by my insurance!,1.2464788732394363,0.0414339657884438,142,111,27,4,False,True,56
682,"Last fall I landed in a river, exciting 2 weeks traveling to the Gulf.",1.2464788732394363,0.042622337357599,142,112,25,5,False,True,70
682,"It's been great photosynthesizing with you.
s",1.2464788732394363,0.0414339657884438,142,111,27,4,False,False,45
682,I can't stop shaking.,1.2464788732394363,0.042622337357599,142,112,25,5,False,True,21
682,What's the point in hanging on?,1.2464788732394363,0.0376444306419528,142,113,25,4,True,True,31
682,Finally Freedom,1.2464788732394363,0.0414339657884438,142,111,27,4,False,False,15
682,OH-MY-GOD! Not a Volvo!,1.2464788732394363,0.0414339657884438,142,111,27,4,False,True,23
682,"See you next year, bud.",1.2464788732394363,0.0402104886825674,142,110,29,3,False,True,23
682,I guess this is why they call it “fall”.,1.2464788732394363,0.0414339657884438,142,111,27,4,False,True,40
682,I wish I'd traveled more!,1.2464788732394363,0.0414339657884438,142,111,27,4,False,True,25
682,Say Hello to Mom.,1.2464788732394363,0.0402104886825674,142,110,29,3,False,True,17
682,I'm off to join our trashy neighbors.,1.2464788732394363,0.042622337357599,142,112,25,5,False,True,37
682,You win the bet.,1.2464788732394363,0.0437784623152986,142,113,23,6,False,True,16
682,We'll always have Vermont.,1.2464788732394363,0.042622337357599,142,112,25,5,False,True,26
682,Gotta go. I've been subpoenaed by Adam Schiff's committee.,1.2464788732394363,0.0402104886825674,142,110,29,3,False,True,58
682,Maybe I’ll catch you later. Depends on how the wind blows.,1.2464788732394363,0.0437784623152986,142,113,23,6,False,True,58
682,We knew last Spring it would eventually come to this.,1.2464788732394363,0.0402104886825674,142,110,29,3,False,True,53
682,Who am I to fight collectivism?,1.2464788732394363,0.042622337357599,142,112,25,5,True,True,31
682,It was more than just hanging out together to me.,1.2464788732394363,0.0414339657884438,142,111,27,4,False,True,49
682,"God, I hope I don't land by Todd.",1.2464788732394363,0.0437784623152986,142,113,23,6,False,True,33
682,Nature's equivalent of presidential primary season.,1.2464788732394363,0.042622337357599,142,112,25,5,False,True,51
682,Nothing personal.,1.2464788732394363,0.0402104886825674,142,110,29,3,False,True,17
682,Get that stick out of your ass and join the rest of us,1.2464788732394363,0.042622337357599,142,112,25,5,False,False,54
682,I'm sycamore of these falling leaves.,1.2464788732394363,0.0437784623152986,142,113,23,6,False,True,37
682,I gotta leave now!,1.2464788732394363,0.042622337357599,142,112,25,5,False,True,18
682,Congratulations and good luck in November.,1.2464788732394363,0.0389485979108856,142,109,31,2,False,True,42
682,"Rapture, Schmapture, aaaah, Lordy Lordy, I'm coming home!",1.2464788732394363,0.0389485979108856,142,109,31,2,False,True,57
682,Turn the stove off!,1.2464788732394363,0.0402104886825674,142,110,29,3,False,True,19
682,Que sera sera.,1.2464788732394363,0.0376444306419528,142,108,33,1,False,True,14
