contest,caption,mean,precision,votes,not_funny,somewhat_funny,funny,has_question_mark,ends_with_punctuation,caption_length
684,"Publicly, we're still saying there are no side effects.",2.34137523465202,0.0063175174651533,14383,2526,4427,7428,False,True,55
684,You all remember Phil — we used to hang out under his bed.,2.11263907124594,0.0065426367786726,14471,3766,5311,5393,False,True,58
684,This is a good point to stop the meeting; I see that lunch has arrived.,2.03758206927779,0.0070105988668813,13251,4074,4601,4573,False,True,71
684,"Suddenly,  Jeff realized he should have posted his resume on other sites besides monster.com",2.0302907260029235,0.0072876798827733,12314,3861,4225,4227,False,False,92
684,Dr. Smith here will explain what went wrong with the clinical trial.,2.0101719544683943,0.0069217559740312,12387,3626,5016,3745,False,True,68
684,"Do we need to discuss diversity, or are we good?",1.9636292530308956,0.0069356184324813,12785,4173,4903,3708,True,True,48
684,Welcome Bob to the team. He'll be with us until about lunchtime.,1.9483500717360112,0.0303259815144499,697,242,249,206,False,True,64
684,"Good, Human Resources is here.",1.946831275720165,0.007292803065736,12150,4275,4251,3623,False,True,30
684,Apparently we’re the only people willing to work in the White House during Trump’s second term.,1.9334969325153375,0.0075900311729036,12225,4753,3538,3934,False,True,95
684,He’s an attorney. Of course he’s cold-blooded.,1.930758148748424,0.0076764771939352,11106,4048,3782,3276,False,True,46
684,"He brings a fresh perspective, and frankly, we need his opposable thumbs.",1.9260407968507691,0.0086159124782792,8383,2941,3121,2321,False,True,73
684,"Love your Halloween costume, Ed.
Creepy. Take a seat.",1.8864902506963788,0.0104639762358932,5744,2169,2058,1517,False,True,53
684,Let’s open with the pronouns each of us feel comfortable with,1.886343216531896,0.0123052287872664,4452,1782,1394,1276,False,False,61
684,"Everyone I would like you to meet Andy, our diversity hire.",1.8778973911356804,0.0076775901280239,10311,3847,3878,2585,False,True,59
684,"Mr. Morris is here to discuss why there's a problem with the facial identification software.""",1.862982588947767,0.0149063471163171,2642,981,1042,619,False,False,93
684,"I know you're skeptical, but he claims he can cure our reptile dysfunction.",1.8573484069886947,0.0118180959858512,4865,2049,1461,1355,False,True,75
684,Didn't we order Chinese?,1.8435426802299868,0.0086875632308576,9044,3917,2630,2497,True,True,24
684,Don't you guys remember Timmy?  We all used to hide under his bed.,1.83470268764796,0.0091065442930894,7181,2842,2688,1650,True,True,66
684,The ambassador from earth says they will not try to colonize Mars if we provide dirt on Joe Biden.,1.8335269516728625,0.0087984565937746,8608,3711,2622,2275,False,True,98
684,"Now let's not make the same mistake we did last week.  This is our waiter.  He's not our lunch, he gets our lunch",1.8263077704418489,0.0123251674214658,3938,1579,1464,895,False,False,113
684,"Obviously, half of you received a placebo.",1.82536599940245,0.0098996804224405,6694,2882,2099,1713,False,True,42
684,So the board still has no women?,1.8186541958950375,0.0091020621663822,7698,3285,2525,1887,True,True,32
684,Take it easy now. We all looked like that on our first day.,1.8177091298363663,0.0095237831081202,6539,2658,2421,1460,False,True,59
684,"You know what they say, if you aren’t at the table, you’re on the menu.",1.815815485996705,0.014304017155747,3035,1273,1048,714,False,True,71
684,He was a rescue.,1.8039245283018868,0.009607057356427,6625,2807,2312,1506,False,True,16
684,Mr. Reilly will serve as the face of our Company.,1.8014740846409891,0.0082908546707904,8412,3440,3204,1767,False,True,49
684,"Now today team, Zogg has brought along his emotional support human.",1.79247073710851,0.0098354706436806,6322,2725,2184,1413,False,True,67
684,"All those in favor, raise something.",1.7866275051831375,0.0103347007659221,5788,2538,1947,1303,False,True,36
684,Looks like someone forgot that it was casual Friday.,1.7860559501377011,0.0091831513004467,6899,2910,2558,1431,False,True,52
684,"He may not look scary, but his kind is responsible for the destruction of a whole planet.",1.783495736906212,0.0138933141505575,3284,1473,1049,762,False,True,89
684,I'd like to introduce one of our human resources,1.7784906100548232,0.008112440657828,8573,3583,3308,1682,False,False,48
684,"So it's agreed, the bathrooms will be species neutral.",1.762266148958701,0.009998416441325,5666,2440,2134,1092,False,True,54
684,So that’s six votes in favor of promoting Tim to partner and one vote in favor of eating him.,1.744156823322443,0.0120374612762811,3979,1786,1425,768,False,True,93
684,"They all do look alike, don't they.",1.7418895845190665,0.0127344610544748,3514,1579,1266,669,False,True,35
684,The Phase 2 antidote has failed,1.7389152810768012,0.011482811966533,5052,2519,1334,1198,False,False,31
684,"He may not look like a monster at first glance, but this is the pharmaceutical rep I’ve been telling you about.",1.7342629482071714,0.0108489823764652,5020,2339,1681,1000,False,True,111
684,Before we get started I believe we should address the Human in the room.,1.7329076882149508,0.0123593320533909,3759,1715,1333,711,False,True,72
684,"Having exhausted the lobbyist pool, the Trump administration had to recruit from farther outside the swamp",1.7173484475110892,0.0126507185134716,4058,2053,1099,906,False,False,106
684,"I say let's be patient. After the next election, we could once again be somebody's worst nightmare.",1.7142857142857142,0.0172579521284108,2065,1014,627,424,False,True,99
684,"Tom's a shapeshifter and a blood drinker. Or as the humans call him, a consultant.",1.7115468409586057,0.0160667748743469,2295,1106,745,444,False,True,82
684,"Hope you're well-prepared, Chris. Because if you're not, this board will eat you alive.",1.70414673046252,0.0152928407591797,2508,1216,818,474,False,True,87
684,"Ok Jared, Ivanka, Mitch, Mike, Rudy, Time to put the suits back on",1.6930033317467872,0.0175890185829028,2101,1104,538,459,False,False,66
684,"Well, I see lunch has arrived.",1.692258064516129,0.0191034508448051,1550,750,527,273,False,True,30
684,Our ethos is ‘diversity without judgment’.,1.6900826446280992,0.0108394509263241,5082,2551,1553,976,False,True,42
684,Welcome to the swamp !,1.6889991728701406,0.0220341349680566,1209,601,383,225,False,True,22
684,The core of our public relations problem is that the people see us as a bunch of corporate monsters.,1.6885031116934164,0.013750500366817,3053,1507,991,555,False,True,100
684,Did you hear that? He wants to know what we want for lunch.,1.682200152788388,0.0119845310445074,3927,1946,1288,692,True,True,59
684,"Today's guest speaker is a white, middle-aged, male to talk to us about diversity in the workplace.""",1.6809465524275806,0.0155953854529879,2451,1251,733,467,False,False,100
684,All in favor of having Stan for lunch?,1.678550089623581,0.0106543168764861,5021,2501,1635,885,True,True,38
684,I would like to start by asking if anyone has dietary constraints.,1.6694480102695763,0.018326871833441,1558,750,573,235,False,True,66
684,How 'bout we start by introducing ourselves and sharing our preferred pronouns?,1.6692695214105793,0.0120784206790237,3970,2026,1232,711,True,True,79
684,"Sooooo, whose imaginary friend is this little guy?",1.6691052335396737,0.0175445174509696,1777,877,611,289,True,True,50
684,"Hey everybody, this is my cousin Gary. He came out this year as human.",1.667887029288703,0.0170173043267506,1912,952,643,317,False,True,70
684,"I know its pandering, but this is how we win Iowa and New Hampshire.",1.6649122807017545,0.0222357631572234,1140,576,370,194,False,True,68
684,This is Jerry.  He's not as scary as he looks.,1.6562710343280234,0.0109456228528326,4457,2224,1543,690,False,True,46
684,"He's not a monster, he's our lawyer.",1.655994043186895,0.0144800691449756,2686,1377,856,453,False,True,36
684,"It's agreed. No one has to live under Trump's bed.
It's just too scary.",1.6405492730210016,0.0222632429533071,1238,682,319,237,False,True,71
684,"this is Bob, ostensibly the top of the food chain.",1.6351039260969975,0.0245286321292569,866,441,300,125,False,True,50
684,"Say hello to the Homo sapien, he's joining us as the newest member of the Endangered Species Club.""",1.6297085998578535,0.0196530151928167,1407,739,450,218,False,False,99
684,That's an ugly word. I'd rather we refer to Larry as 'undocumented.',1.629690048939641,0.0208658225255513,1226,647,393,186,False,False,68
684,"Trust me, he's one of us.  He convinced millions of parents not to vaccinate their kids!",1.6294552790854069,0.0195764163203947,1487,801,436,250,False,True,88
684,Meet Compassionate White Male.  Another mythical creature.,1.622421524663677,0.0225039584062748,1115,612,315,188,False,True,58
684,This is what we all looked like before climate change.,1.6200971236458723,0.0146555154026636,2677,1471,752,454,False,True,54
684,"We love you as an agent Jimmy, but we haven't had work since the bar scene in Star Wars!",1.614442295293359,0.018907545195425,1551,844,461,246,False,True,88
684,"...and HR informs me he prefers ""human"" to '""fleshbag"".",1.611220472440945,0.0163398181053943,2032,1102,619,311,False,True,55
684,According to Ancestry.com. this is our dad,1.6100278551532032,0.0197724626065026,1436,792,412,232,False,False,42
684,"Alright, girls. Who ordered the stripper?",1.6037187681580476,0.0183407668227764,1721,976,452,293,True,True,41
684,"Okay team, I know WE'RE usually the monsters, but today we have a special guest - an executive from the ExxonMobil corporation!",1.5976729944886712,0.0185865634818207,1633,921,448,264,False,True,127
684,"Ted's not a monster, but he is a lawyer, so there's that.",1.5919821826280625,0.0151759977150379,2245,1228,707,310,False,True,57
684,"And now please welcome the scariest monster of them all, a Republican US Senator!",1.589344262295082,0.0221441934997204,1220,722,279,219,False,True,81
684,"Good work all. Ah, lunch has arrived!",1.587620889748549,0.0142920636826431,2585,1435,781,369,False,True,37
684,"Great costume, Elliott!",1.5847568988173455,0.0149239450548518,2283,1250,729,303,False,True,23
684,"Like Andrew from H.R. said, ""Our human co-workers are not snacks. I'm looking at you, Dots.""",1.5809786354238455,0.0186937048820863,1451,799,461,191,False,False,92
684,"And, for our next visit to earth we've made an improved meat puppet to replace our last probe that somehow got elected President of the most powerful nation.",1.5701438848920863,0.0225555364267012,1112,656,278,178,False,True,157
684,I see no reason to move our company out of Chernobyl.,1.569351230425056,0.0239831683857704,894,505,269,120,False,True,53
684,This is Larry. His species has figured a way to destroy a planet AND turn a profit!,1.5670926517571886,0.0208879249230839,1252,730,334,188,False,True,83
684,"Wow, these DNA ancestry sites sure do make for interesting family reunions!",1.5637480798771122,0.0275899677580669,651,365,205,81,False,True,75
684,Well it looks like one of us didn’t ’drink the Kool-Aid’,1.5535390199637025,0.0305139714679517,551,319,159,73,False,False,56
684,Our lunch has arrived.,1.5518151815181518,0.01857831280149,1515,901,400,213,False,True,22
684,It's even uglier when it sheds.,1.5504731861198735,0.0288869221921566,634,374,171,89,False,True,31
684,Can we talk about the elephant in the room?,1.548728813559322,0.0191741944659321,1416,832,391,193,True,True,43
684,He looks harmless. I say we let them in. What could go wrong?,1.5486173059768065,0.0216336205401922,1121,661,305,155,True,True,61
684,We brought in Henry for an outsider’s perspective. He is also lunch.,1.5452688904016338,0.018899007664102,1469,871,395,203,False,True,68
684,Oh my god... Lucas? From on top of the bed?,1.5432,0.0207338110519168,1250,754,314,182,True,True,43
684,He wants to talk to us about reflooding the swamp.,1.5413839891451833,0.0252920740279138,737,420,235,82,False,True,50
684,We all remember our first day on Capitol Hill.,1.540277777777778,0.0265470174639588,720,424,203,93,False,True,46
684,"In light of recent events, Bob will now be the face of the company.",1.5369458128078817,0.0281503288471963,609,353,185,71,False,True,67
684,An alien walks into a meeting.,1.5356842989084802,0.0202683876824203,1191,695,352,143,False,True,30
684,"If we're all here, who is under Tommy's bed?",1.5353881278538812,0.0241192668215915,876,521,241,114,True,True,44
684,I don't need to tell you that we halted the clinical trial early.,1.5336273428886438,0.0232897831900412,907,533,264,110,False,True,65
684,There used to be more of these before the climate changed.,1.532504780114723,0.0216932346119422,1046,616,303,127,False,True,58
684,So I’ve hired Bill as our new PR person to put a more “human face” on the company.,1.5323426573426573,0.0208566683124404,1144,677,325,142,False,True,82
684,We found him under our kid's bed. Explains the nightmares.,1.532088681446908,0.0244729713334354,857,514,230,113,False,True,58
684,Doesn't Dave look delicious in his new suit?,1.53125,0.0291504872308697,576,339,168,69,True,True,44
684,"Don’t worry, nobody’s draining anything. The swamp is a very important part of our base.",1.529598308668076,0.0235469895571015,946,575,241,130,False,True,88
684,We’ll adjourn.  Lunch has arrived.,1.528837622005324,0.0207581274347712,1127,664,330,133,False,True,34
684,We all looked like you when we started here.,1.527147087857848,0.0219184410578542,1013,599,294,120,False,True,44
684,We were just discussing the evolution of the company.,1.5267249757045676,0.021577718054137,1029,605,306,118,False,True,53
684,"Dave, we know it's your first day, but we do have a dress code.",1.526605504587156,0.028205469381795,545,308,187,50,False,True,63
684,"Striped tie? You're always pushing the envelope, Dan.",1.526034712950601,0.0255153407244392,749,444,216,89,True,True,53
684,"He’s not easy on the eyes, but Ted’s a monster salesman.",1.5247432306255837,0.0208272902440132,1071,624,332,115,False,True,56
684,"Ok, everyone meet Bob. Apparently we all used to live under his bed.”",1.5223880597014925,0.0221432506699808,1005,602,281,122,False,False,69
684,"Of course we have a board room. We're monsters, not animals.",1.5197934595524958,0.0285681390659769,581,344,172,65,False,True,60
684,"So, any other side effects to our new erectile dysfunction drug?",1.5190424374319913,0.0241839842387337,919,574,213,132,True,True,64
684,"We've hired Mr. Bettelheim, here, as a consultant to address our 'brand' problem here at Seuss, Sendak and Rowling.",1.5184804928131417,0.022765586679999,974,598,249,127,False,True,115
684,"And some, we assume, are good people.",1.5184275184275184,0.0243139231803855,814,486,234,94,False,True,37
684,"Larry's new, but he'll evolve.",1.5174953959484343,0.0287689914410126,543,316,173,54,False,True,30
684,"I’d like you all to say hello to Bob, our new Director of Diversity.",1.5167652859960552,0.0220013032211498,1014,612,280,122,False,True,68
684,We can't be any scarier than the last administration.,1.5149544863459037,0.0250999715825196,769,463,216,90,False,True,53
684,"This is Bob from Earth, he's our insider on the hostile takeover.",1.5141921397379912,0.0227244363489511,916,547,267,102,False,True,65
684,Let me introduce our new Diversity Officer.,1.5131164742917105,0.0218737370582884,953,570,284,99,False,True,43
684,That makes 4 votes to let Bob lead today’s diversity training session and 3 votes to eat him.,1.512273212379936,0.0227547604032647,937,567,260,110,False,True,93
684,Shall we talk about the elephant in the room?,1.5112781954887218,0.0248705701459635,798,487,214,97,True,True,45
684,Everyone good with splitting the waiter?,1.5107142857142857,0.0241755940959086,840,512,227,101,True,True,40
684,"I've called you all in to this focus group to discuss the Human Race. Are they worth saving? Bob, your thoughts?",1.5106382978723405,0.0293181658479069,564,342,156,66,True,True,112
684,Very scary John. You almost look human.,1.5100671140939597,0.0228109655632366,894,534,264,96,False,True,39
684,"It's the job of this committee to determine what's funny, and we don't care how long you've been submitting captions.",1.5091240875912408,0.0306149786395383,548,341,135,72,False,True,117
684,Lunch is here.  Who ordered accountant?,1.5090702947845804,0.024182991654451,882,550,215,117,True,True,39
684,Why are we having all these people from shithole places coming here?,1.508571428571429,0.032647140762536,525,339,105,81,True,True,68
684,And Ted will be helping us improve our people skills!,1.5063938618925832,0.0331657551036602,391,230,125,36,False,True,53
684,I thought you ordered Chinese.,1.5059952038369304,0.0247764299764574,834,521,204,109,False,True,30
684,"We've listened to your excuse ""I'm only human"" for the last time!",1.505,0.03539873126877,400,248,102,50,False,True,65
684,"So we're going with ""Side effects include fatigue, nausea and transfiguration into alien form.""",1.503486750348675,0.0265266617210085,717,447,179,91,False,False,95
684,Some side effects are always possible when you begin a new medication,1.5032765399737875,0.0248399800118138,763,463,216,84,False,False,69
684,And that’s when Frank realized he brought the wrong brownies for lunch.,1.5028901734104043,0.0247618385693447,865,551,193,121,False,True,71
684,I think we've filled our diversity quota.,1.5028376844494893,0.023226565803625,881,537,245,99,False,True,41
684,"He’s not our usual kind of slimy, but he did work on Wall Street.",1.5017921146953406,0.0296641935019825,558,345,146,67,False,True,65
684,And now a word from the man who brought us genetic engineering,1.5,0.0265891300802058,668,408,186,74,False,False,62
684,This is Bob. He saw our listing on Monster.com.,1.4993065187239945,0.0261965044380838,721,450,181,88,False,True,47
684,“He’s from a small planet on a distant galaxy and he wants us to help his dad ‘get something’ on somebody named Joe Biden.”,1.4984126984126984,0.0290970953651009,630,405,136,89,False,False,123
684,I see lunch has arrived,1.4981992797118848,0.0241512380996709,833,516,219,98,False,False,23
684,"Nice costume, Frank.",1.4961038961038962,0.0248103716868438,770,474,210,86,False,True,20
684,"I know you wanted Mexican or Chinese, but American isn't that bad.",1.4954367666232071,0.0250181298936477,767,475,204,88,False,True,66
684,"Mr. Darwin, I believe, has a few questions.",1.4949899799599198,0.0307345083405802,499,307,137,55,False,True,43
684,This is the monster I was telling you about.,1.494750656167979,0.0244790449094644,762,469,213,80,False,True,44
684,"This is Gary, he's our appetizer...",1.4943820224719102,0.0253633003046247,801,511,184,106,False,True,35
684,"Excellent, lunch is here.",1.493523316062176,0.0248976459118938,772,479,205,88,False,True,25
684,It appears the fence was not all that effective,1.4934579439252336,0.0296836614148635,535,330,146,59,False,False,47
684,"As you can see, lunch has arrived.",1.493351063829787,0.0259384434828219,752,477,179,96,False,True,34
684,"He said that he wanted to work  where his 'white, male privilege' wasn't an issue.",1.4931297709923663,0.027234043493959,655,409,169,77,False,True,82
684,"Everyone, meet Bob. We've brought him 60 million light years from his home planet to teach us PowerPoint.",1.4912280701754386,0.035640660218109,399,254,94,51,False,True,105
684,Don't believe what you see- it's a fake vision.,1.4910344827586206,0.0281584298079162,725,489,117,119,False,True,47
684,Who’s this weirdo!!,1.490280777537797,0.0331951074204098,463,296,107,60,False,True,19
684,"...I’m kidding, he’s here to audit us",1.490254872563718,0.026016989791904,667,407,193,67,False,False,37
684,"Our guest will read excepts from his new book ""Where the Mild things Are.""",1.4889867841409692,0.0266207144163948,681,427,175,79,False,False,74
684,Let's all welcome Ted to the Extinct Species Group!,1.4877344877344878,0.0263570906126278,693,435,178,80,False,True,51
684,Mr. Darwin would like to ask a few questions,1.486211901306241,0.0259867461800766,689,428,187,74,False,False,44
684,"The question is, can he adapt?",1.4859287054409005,0.0290409451388502,533,327,153,53,True,True,30
684,This meeting of the Chernobyl Alumni Association will now come to order.,1.4853168469860896,0.0270405638648504,647,405,170,72,False,True,72
684,Here's the human I was telling you about -- he survived climate change because he was on a mission to Mars.,1.4851694915254237,0.0302846876393279,472,286,143,43,False,True,107
684,"Sorry Ted, you want the third floor. This is Inhuman Resources.",1.4850299401197604,0.0266671075663107,668,423,168,77,False,True,63
684,"If you're not at the table, you're on the menu.",1.4850136239782017,0.0252614989353015,734,458,196,80,False,True,47
684,"Don't worry, President Trump is not really draining the swamp.",1.4849785407725322,0.0267296073995205,699,447,165,87,False,True,62
684,"We are going to take a break now because, as you can see, lunch just arrived.",1.484463276836158,0.0253956889585365,708,438,197,73,False,True,77
684,"This is Glenn, from auditing. He has scared far more people than all you monsters combined.",1.4835479256080115,0.0269574656707486,699,451,158,90,False,True,91
684,"Remember, talk slowly and keep it simple.",1.480421686746988,0.0260064927028706,664,411,187,66,False,True,41
684,"Before we adjourn forever, let’s thank Jeff for dreaming us.",1.4794238683127572,0.0309161950804393,486,305,129,52,False,True,60
684,Mr. Darwin will be helping us with the selection process.,1.4787234042553192,0.0261757090855728,658,409,183,66,False,True,57
684,"Thank you, Bob. Mansplaining is new to us,
but I guess we'll get used to it.",1.4778225806451613,0.0295063689400823,496,304,147,45,False,True,76
684,"Don’t bring your white male privilege in 
here Brad .",1.4765258215962442,0.032417571906745,426,265,119,42,False,True,53
684,"If it’s Sunday, it’s eat the press!",1.4763779527559056,0.0303164581867975,508,321,132,55,False,True,35
684,Looks like lunch is here....,1.4758942457231727,0.026974901975196,643,407,166,70,False,True,28
684,"You're a token, get used to it.",1.4754901960784317,0.0276863871931035,612,388,157,67,False,True,31
684,Greg enjoyed morning briefings more when he was high as a kite.,1.475409836065574,0.0283289261364991,610,393,144,73,False,True,63
684,Welcome to the Forum of American Monsters. President Trump will be joining us shortly.,1.475103734439834,0.0321878204119955,482,313,109,60,False,True,86
684,He's the new affirmative action hire.,1.475,0.0367412796469317,320,197,94,29,False,True,37
684,"It's unanimous, then
 We will deny that our E.D. medicine causes any side effects!",1.474782608695652,0.0288854912330645,575,368,141,66,False,True,82
684,Good news everyone!  The Far Side is coming back and full employment won't be far behind,1.474782608695652,0.028780408542086,575,367,143,65,False,False,88
684,We're helping the President build a different kind of swamp.,1.4745222929936306,0.0279040389578309,628,405,148,75,False,True,60
684,Bill is a special emissary from Washington D.C. He wants to know if we have have any dirt on the Bidens.,1.4719710669077757,0.0297304432663037,553,358,129,66,False,True,104
684,"On advice of counsel, I will not be hiding under Timmy's bed this evening.",1.4716312056737588,0.0299352278987659,564,370,122,72,False,True,74
684,"Since it's Chuck's nightmare, I say we let him chair.",1.4713584288052373,0.0271260665925306,611,384,166,61,False,True,53
684,"I've been told we've been lacking the ""human touch.""",1.4710743801652892,0.0275196429342804,605,383,159,63,False,False,52
684,"That’s the best Jared Kushner costume I’ve seen this season, Yarog.",1.4702797202797202,0.0284572195051023,572,364,147,61,False,True,67
684,I'd like to introduce a young up-and-comer to the group. This is Jared.,1.469248291571754,0.033308999652645,439,285,102,52,False,True,71
684,"OK, be honest, who wet their pants when they first saw him?",1.4680851063829787,0.0354921848631333,376,242,92,42,True,True,59
684,"If you don't have a seat at the table,you're on the menu.",1.4677685950413224,0.0282980787127767,605,393,141,71,False,True,57
684,Do we hire it or eat it. Let's vote.,1.467687074829932,0.0277810098854516,588,373,155,60,False,True,36
684,"I've brought in a human to speak to us 
about the new meat alternative.""",1.467248908296943,0.0315246262205813,458,291,120,47,False,False,72
684,We hired him on Monster.com.,1.467032967032967,0.0287468666406629,546,346,145,55,False,True,28
684,"On earth they call this ""affirmative action"" .",1.466786355475763,0.0288987537442213,557,357,140,60,False,True,46
684,"Yes, the job's a nightmare, but we offer free dental.",1.4664107485604607,0.0299897977201566,521,335,129,57,False,True,53
684,Congrats on the scariest Halloween costume yet: a Republican,1.465195246179966,0.0296533229503929,589,394,116,79,False,False,60
684,"Wayne is here to discuss diversity and tolerance. 

Don't eat this one.",1.4649122807017545,0.0278633152657881,570,360,155,55,False,True,71
684,Our new hire's from Earth. But keep him off the books: He's a undocumented alien.,1.4640287769784173,0.0284793245704904,556,354,146,56,False,True,81
684,"I know what you’re thinking, but Pete is an absolute beast when it comes to spreadsheets.",1.464,0.0345342321578291,375,238,100,37,False,True,89
684,"First, the good news. The experiment was a success! That’s also the bad news.",1.4625850340136055,0.0309301162897641,441,275,128,38,False,True,77
684,"Oh good, the exotic dancer is here!",1.4624505928853757,0.0299875762678871,506,324,130,52,False,True,35
684,Everybody o.k. with Italian?,1.4622641509433962,0.0289971780385125,530,337,141,52,True,True,28
684,I know what you all must be thinking. He hasn't lost his humanity yet.,1.462085308056872,0.0324339369619061,422,268,113,41,False,True,70
