contest,caption,mean,precision,votes,not_funny,somewhat_funny,funny,has_question_mark,ends_with_punctuation,caption_length
677,You will serve me sushi right now!,1.2178217821782178,0.0458235107540837,101,81,18,2,False,True,34
677,You are changing your will to leave me all the real estate and two trout every day.,1.2178217821782178,0.0458235107540837,101,81,18,2,False,True,83
677,And now for the fanciest feast of all...man.,1.2178217821782178,0.0479355185620206,101,82,16,3,False,True,44
677,"You will now proceed to the cabinet where my food is kept, and open up every single can, place them on the floor, then return to your bed and fall into a deep sleep.",1.2178217821782178,0.0479355185620206,101,82,16,3,False,True,165
677,I love the smell of wet cat food. I love the smell of wet cat food.,1.2178217821782178,0.0412765615557937,101,79,22,0,False,True,67
677,"Not the face, please!",1.2178217821782178,0.0458235107540837,101,81,18,2,False,True,21
677,Midnight Meow Mix here I come.,1.2178217821782178,0.0436093377139509,101,80,20,1,False,True,30
677,Need...more...cat...videos.,1.2178217821782178,0.0458235107540837,101,81,18,2,False,True,27
677,Kick dog. Lick cat.,1.2178217821782178,0.0499583200457143,101,83,14,4,False,True,19
677,Dry or wet? What do you mean both?,1.2178217821782178,0.0458235107540837,101,81,18,2,True,True,34
677,"You have no power over me.. I repeat, you have no power over me..”",1.2156862745098038,0.0475112529567605,102,83,16,3,False,False,66
677,Laser karma my friend . . . laser karma.,1.2156862745098038,0.0454222643288111,102,82,18,2,False,True,40
677,"Whatever you want, Cleopatra. I am yours.",1.2156862745098038,0.0432324535041846,102,81,20,1,False,True,41
677,"You use my litter box, I will use your toilet.",1.2156862745098038,0.051435331038607,102,85,12,5,False,True,46
677,"Yes, master…Clean your litter box and carry you back to the bed.",1.2156862745098038,0.0454222643288111,102,82,18,2,False,True,64
677,You really don't have to use the mind rays. I can smell it from here.,1.2156862745098038,0.051435331038607,102,85,12,5,False,True,69
677,This new app is fantastic!,1.2156862745098038,0.0475112529567605,102,83,16,3,False,True,26
677,Good! He’s headed right for my Purina.  Now I can finally raid the fridge.,1.2156862745098038,0.0454222643288111,102,82,18,2,False,True,74
677,"Could you just go back to waving, please?",1.2156862745098038,0.0432324535041846,102,81,20,1,True,True,41
677,"I'll let the dog out. Woof, woof, woof, woof, woof.”",1.2156862745098038,0.0432324535041846,102,81,20,1,False,False,52
677,10 lives.......11 lives...,1.2156862745098038,0.0454222643288111,102,82,18,2,False,True,26
677,"Heh Heh Heh, now doesn't he wish he had given me food...",1.2156862745098038,0.0475112529567605,102,83,16,3,False,True,56
677,"Okay, okay, I saw the Cat Signal.",1.2156862745098038,0.0432324535041846,102,81,20,1,False,True,33
677,"Bring me a catfish head, meow",1.2156862745098038,0.0454222643288111,102,82,18,2,False,False,29
677,"Don't worry, this isn't a cult.",1.2156862745098038,0.0475112529567605,102,83,16,3,False,True,31
677,Cat people are on call.,1.2156862745098038,0.0454222643288111,102,82,18,2,False,True,23
677,Here's looking at you.,1.2156862745098038,0.0432324535041846,102,81,20,1,False,True,22
677,Somcatulism: a common affliction characterized by a strong desire to break out the kitty treats in the middle of the night.  No known cause.,1.2142857142857142,0.0441150686325483,98,78,19,1,False,True,140
677,"Now Stephen King, you will do what I tell you!",1.2142857142857142,0.0507673082566809,98,81,13,4,False,True,46
677,"Another nice sleepwalk ruined.""",1.2142857142857142,0.0464384831382255,98,79,17,2,False,False,31
677,Oh no. Last time he thought  I was a cookie jar.,1.2142857142857142,0.0486510652699821,98,80,15,3,False,True,48
677,I'd probably open the can even without the cosmic mind spell.,1.2142857142857142,0.0486510652699821,98,80,15,3,False,True,61
677,"How many brownies did you eat, Tim?",1.2142857142857142,0.0486510652699821,98,80,15,3,True,True,35
677,Tracker beam deployed....humanoid entering food storage area.,1.2142857142857142,0.0416622832395158,98,77,21,0,False,True,61
677,I see you,1.2142857142857142,0.0486510652699821,98,80,15,3,False,False,9
677,Call me Snuggles one more time.,1.2142857142857142,0.0464384831382255,98,79,17,2,False,True,31
677,Must get dog next time.,1.2142857142857142,0.0441150686325483,98,78,19,1,False,True,23
677,"Please go back to bed. I have had enough cat-naps today, whereas you look dog-gone dead tired!",1.2142857142857142,0.0441150686325483,98,78,19,1,False,True,94
677,"Must get cat food, cat food, ....",1.2142857142857142,0.0441150686325483,98,78,19,1,False,True,33
677,All your catnip are belong to us.,1.2142857142857142,0.0486510652699821,98,80,15,3,False,True,33
677,"Uh Oh, he's been at my catnip again.",1.2142857142857142,0.0507673082566809,98,81,13,4,False,True,36
677,Visualize mackerel on a dish on the floor....,1.2142857142857142,0.0486510652699821,98,80,15,3,False,True,45
677,Must...find...cat food.......,1.2142857142857142,0.0416622832395158,98,77,21,0,False,True,29
677,Only beneficial effects for cats on Ambien.,1.2142857142857142,0.0441150686325483,98,78,19,1,False,True,43
677,Mr Whiskers now lives in Connecticut with Bob's wife and children. Bob retains visitation rights.,1.2142857142857142,0.0507673082566809,98,81,13,4,False,True,97
677,Alexander's untamed appetite has finally lead to a meaningful discovery!,1.2142857142857142,0.0416622832395158,98,77,21,0,False,True,72
677,"Catnip, no we’re going for the good stuff .",1.2142857142857142,0.0441150686325483,98,78,19,1,False,True,43
677,"Why . . . do . . . I have . . .this . . . overwhelming . . .desire . . .to. . . .open . . . .can . . . .of . . . . tuna. . . .fish . . . .???
Must  . . . . open . . . .can . . . .open . . . . .can . . . .",1.2142857142857142,0.0441150686325483,98,78,19,1,True,True,204
677,"Yes, the litter box should be in the master bath",1.2142857142857142,0.0464384831382255,98,79,17,2,False,False,48
677,"I don't know, but what are you doing up in the middle of the night?",1.2142857142857142,0.0507673082566809,98,81,13,4,True,True,67
677,My cat’s gotten really possessive since my girlfriend moved in,1.2142857142857142,0.0464384831382255,98,79,17,2,False,False,62
677,"Good kiddy, I'll guide you to the treats...",1.2142857142857142,0.0486510652699821,98,80,15,3,False,True,43
677,"Good boy Gary, get me the tuna from the frodge",1.2142857142857142,0.0464384831382255,98,79,17,2,False,False,46
677,"Hey, grab me the salmon while you're in there",1.2142857142857142,0.0464384831382255,98,79,17,2,False,False,45
677,Never fails.,1.2142857142857142,0.0464384831382255,98,79,17,2,False,True,12
677,James is 'catatonic' and couldn't be happier.,1.2142857142857142,0.0441150686325483,98,78,19,1,False,True,45
677,So this is what you learned at that obedience school?,1.2142857142857142,0.0464384831382255,98,79,17,2,True,True,53
677,Taaaaaake meeeeee toooooo your littttttter“.,1.2142857142857142,0.0441150686325483,98,78,19,1,False,True,44
677,Food...must eat cat food.,1.2121212121212122,0.0460179472412755,99,80,17,2,False,True,25
677,Now.....open the door.,1.2121212121212122,0.0482057520591343,99,81,15,3,False,True,22
677,"Meow meow (that’s right), meow meow (keep coming), meow meow meow meow meow meow meow meow meow (now open the fridge and take out that halibut).....purrrr (they’re so stupid).",1.2121212121212122,0.0460179472412755,99,80,17,2,False,True,175
677,He's catatonic ... I'm the catalyst.,1.2087912087912087,0.0530313877534179,91,76,11,4,False,True,36
677,My cat naps are taking me places...,1.2087912087912087,0.0482071322384237,91,74,15,2,False,True,35
677,"...good, good...meow, open the fridge...",1.2087912087912087,0.0482071322384237,91,74,15,2,False,True,40
677,Don’t know what’s going on in this one. The guy who drew it was probably on drugs.,1.2087912087912087,0.0506766992103187,91,75,13,3,False,True,82
677,"Feed me, see more",1.2087912087912087,0.0482071322384237,91,74,15,2,False,False,17
677,"Now, take the big knife. And when I say 'meow', stab Rin Tin Tin!",1.2087912087912087,0.055285878226303,91,77,9,5,False,True,65
677,I hate Mondays.,1.2087912087912087,0.0482071322384237,91,74,15,2,False,True,15
677,I feel ..........strangely catty.,1.2087912087912087,0.0456040278314605,91,73,17,1,False,True,33
677,"Ugh, the dog said my eye-lights would stop zombies!",1.2087912087912087,0.0506766992103187,91,75,13,3,False,True,51
677,My laser eyes will stop this zombie!,1.2083333333333333,0.0442200108177864,96,77,18,1,False,True,36
677,"Ha, ha, ha!",1.2083333333333333,0.0489285790510333,96,79,14,3,False,True,11
677,Must use the litter box.,1.2083333333333333,0.0466337603281054,96,78,16,2,False,True,24
677,"Vat dos cat nip monster request, sire?",1.2083333333333333,0.0489285790510333,96,79,14,3,True,True,38
677,You realize that kitty is hungry and will open a can of tuna immediately.,1.2083333333333333,0.0466337603281054,96,78,16,2,False,True,73
677,Zombie. Will. Feed. Zombie. Will. Feed.,1.2083333333333333,0.0466337603281054,96,78,16,2,False,True,39
677,If I only had a dog!,1.2083333333333333,0.0442200108177864,96,77,18,1,False,True,20
677,That's right. This is what 6G looks like.,1.2083333333333333,0.0442200108177864,96,77,18,1,False,True,41
677,Must. Leave. Warm. Human. Bed. To. Imperil. Dumb. Ape. Body. To. Open. Small. Cardboard. Box.,1.2083333333333333,0.0489285790510333,96,79,14,3,False,True,93
677,Mmmmilk ... mmmilk ....,1.2083333333333333,0.0489285790510333,96,79,14,3,False,True,23
677,"4. Once your biscuit dough has rested, gently pull it from the bed...",1.2083333333333333,0.0442200108177864,96,77,18,1,False,True,69
677,"Repeat after me, Marge: it's time to make the tuna canapés.",1.2083333333333333,0.0489285790510333,96,79,14,3,False,True,59
677,"You may have nine, but I'm making the most of my one.",1.2083333333333333,0.0416666666666666,96,76,20,0,False,True,53
677,Hypnotized by a giant cat with oddly human eyes.,1.2083333333333333,0.0466337603281054,96,78,16,2,False,True,48
677,"You will keep the can opener going 24-7 and in return, I will give you a purr that broadcasts what you call love.",1.2083333333333333,0.0442200108177864,96,77,18,1,False,True,113
677,Must... Reheat... Lasagna...,1.2083333333333333,0.0442200108177864,96,77,18,1,False,True,28
677,"We thought she was sleepwalking, but she was giving her catatonic",1.2083333333333333,0.0466337603281054,96,78,16,2,False,False,65
677,"And you thought you owned me, Kate Turner Swan, nurse at Vanderbilt Hospital in Nashville,Tn.!",1.2083333333333333,0.0466337603281054,96,78,16,2,False,True,94
677,You will make cat-a-tonic.,1.2083333333333333,0.0466337603281054,96,78,16,2,False,True,26
677,you WILL get the catnip...,1.2083333333333333,0.0466337603281054,96,78,16,2,False,True,26
677,Find the can! Find the can!,1.2083333333333333,0.0442200108177864,96,77,18,1,False,True,27
677,Meow meow meow meow,1.2083333333333333,0.0466337603281054,96,78,16,2,False,False,19
677,Hypnosis and sleepwalking - great for my midnight tuna snack.,1.2083333333333333,0.0442200108177864,96,77,18,1,False,True,61
677,The last time I dreamed of a Cheshire cat was when I was dating Alice,1.2083333333333333,0.0442200108177864,96,77,18,1,False,False,69
677,Take me to your Friskies,1.2083333333333333,0.0466337603281054,96,78,16,2,False,False,24
677,"I’ve heard their night vision makes them good predators, but I didn’t realize it was a warning.",1.2083333333333333,0.0442200108177864,96,77,18,1,False,True,95
677,return to me...,1.2083333333333333,0.0466337603281054,96,78,16,2,False,True,15
677,You will take out the open can of cat food and feed me now.,1.2083333333333333,0.0442200108177864,96,77,18,1,False,True,59
677,You will open the top drawer ... You will get out the can of PreMiow Kitty Tuna ... You will insert it into the electric can opener ...,1.2083333333333333,0.0442200108177864,96,77,18,1,False,True,135
677,Time for a cat nap,1.2083333333333333,0.0489285790510333,96,79,14,3,False,False,18
677,H-e-r-e  k-i-t-t-y.   H-e-r-e-'s  s-o-m-e  n-i-c-e  c-r-e-a-m  f-o-r  y-o-u.,1.2083333333333333,0.0466337603281054,96,78,16,2,False,True,76
677,You will open the fridge.... you will pour milk in saucer.... you will place on floor.,1.2083333333333333,0.0489285790510333,96,79,14,3,False,True,86
677,"This is exactly how it went down officer. The cat seduced me!""",1.2083333333333333,0.0466337603281054,96,78,16,2,False,False,62
677,Good kitty. Now please light my way to the fridge.,1.2083333333333333,0.0489285790510333,96,79,14,3,False,True,50
677,"Snickers was aware of the danger her zombie human posed. She loved him all the same. Still, her name didn't help.",1.2083333333333333,0.0466337603281054,96,78,16,2,False,True,113
677,"I will be a good boy, I will invest in mutual funds.",1.2083333333333333,0.0489285790510333,96,79,14,3,False,True,52
677,Garfield channelled his inner Kaa to make Jon open the fridge door.,1.2083333333333333,0.0466337603281054,96,78,16,2,False,True,67
677,"When you come home in the middle of the night, and your cat knows what you did.",1.2083333333333333,0.0442200108177864,96,77,18,1,False,True,79
677,Fluffy’s motion sensors helped Bob yet again.,1.2083333333333333,0.0466337603281054,96,78,16,2,False,True,45
677,I know this was short notice but I have a change  for the menus going forward.,1.2083333333333333,0.0466337603281054,96,78,16,2,False,True,78
677,"Tiger tiger, burning bright
In the kitchen of the night
Dip your lights you ruddy fool
Don't you know the road code rule",1.2083333333333333,0.0489285790510333,96,79,14,3,False,False,120
677,"Feed the kitty
Feed the kitty
Feed the kitty",1.2083333333333333,0.0466337603281054,96,78,16,2,False,False,44
677,Don't tell me.  You're here to protect the kitchen.,1.2083333333333333,0.0489285790510333,96,79,14,3,False,True,51
677,"Now slowly, a left turn...",1.2083333333333333,0.0466337603281054,96,78,16,2,False,True,26
677,"Oh, its 4:35 again?",1.2083333333333333,0.0442200108177864,96,77,18,1,True,True,19
677,Purina before prostate.,1.2083333333333333,0.0442200108177864,96,77,18,1,False,True,23
677,Make biscuits. Back to sleep. Make biscuits. . . .,1.2083333333333333,0.0442200108177864,96,77,18,1,False,True,50
677,Now turn left and open the top left door.,1.2083333333333333,0.0466337603281054,96,78,16,2,False,True,41
677,I am your broker.,1.2083333333333333,0.0489285790510333,96,79,14,3,False,True,17
677,"If you stare at me for one more second, I'm having the vet remove your halogen light implants.",1.2083333333333333,0.0442200108177864,96,77,18,1,False,True,94
677,It puts the food in a bowl.,1.2083333333333333,0.0489285790510333,96,79,14,3,False,True,27
677,I never should have rubbed that beckoning cat lamp.,1.2083333333333333,0.0442200108177864,96,77,18,1,False,True,51
677,There's nothing left.  I ate the canary.,1.2083333333333333,0.0532221978048754,96,81,10,5,False,True,40
677,If only we could get one of us into the White House.,1.2083333333333333,0.0489285790510333,96,79,14,3,False,True,52
677,You could say I have a lot of pull in this house.,1.2083333333333333,0.0442200108177864,96,77,18,1,False,True,49
677,"Deep in a tuna craving, catatonic trance, Harold discovers resistance is futile.",1.2083333333333333,0.0511204860458823,96,80,12,4,False,True,80
677,When the cats get hungry,1.2083333333333333,0.0466337603281054,96,78,16,2,False,False,24
677,"Heck ya!! Right on schedule! ... (She wonders why she's gained 5 lbs)... but if I purr gently , she'll share the salmon they had for dinner...!",1.2083333333333333,0.0466337603281054,96,78,16,2,False,True,143
677,"Bob, I just want to have a little peace. And people say cats disturb at night!",1.2083333333333333,0.0466337603281054,96,78,16,2,False,True,78
677,"First, kitty chow....next, the world!",1.2083333333333333,0.0442200108177864,96,77,18,1,False,True,37
677,"Shut your eyes, and
Trust in meeeeeeeeow...",1.2083333333333333,0.0466337603281054,96,78,16,2,False,True,43
677,"Here, human, human, human...Tuna time!",1.2083333333333333,0.0442200108177864,96,77,18,1,False,True,38
677,Ambien really works!,1.2083333333333333,0.0442200108177864,96,77,18,1,False,True,20
677,Tuna...tuna...tuna.  I am hungry for tuna...,1.2083333333333333,0.0466337603281054,96,78,16,2,False,True,44
677,please... just kill me and eat my eyes. I'm begging you...,1.2083333333333333,0.0489285790510333,96,79,14,3,False,True,58
677,"Yes, my slave, who is whose pet now?",1.2083333333333333,0.0511204860458823,96,80,12,4,True,True,36
677,You will feed the cat again,1.2083333333333333,0.0466337603281054,96,78,16,2,False,False,27
677,Leftovers.  Must eat leftovers.  You will ignore the cat.,1.2083333333333333,0.0442200108177864,96,77,18,1,False,True,57
677,"Goooood, and in the morning, remember this was just some standard cat-ering",1.2083333333333333,0.0466337603281054,96,78,16,2,False,False,75
677,The tuna is on your left hands .,1.2083333333333333,0.0466337603281054,96,78,16,2,False,True,32
677,"Now, walk on the ledge.",1.2083333333333333,0.0511204860458823,96,80,12,4,False,True,23
677,"Hello, “Master”! I see you’ve been up reading The New Yorker’s “stupid honky shit” * cartoons again...
Wanna discuss it over a warm bowl of milk? My treat...",1.2083333333333333,0.0442200108177864,96,77,18,1,True,True,157
677,"Come scratch my belly, Steve.",1.2083333333333333,0.0442200108177864,96,77,18,1,False,True,29
677,"One can bad, Two can good!",1.2083333333333333,0.0466337603281054,96,78,16,2,False,True,26
677,Never underestimate the powers of a cat !,1.2083333333333333,0.0442200108177864,96,77,18,1,False,True,41
677,Cat food first.,1.2083333333333333,0.0442200108177864,96,77,18,1,False,True,15
677,I said “cat walk” not “I walk”,1.2083333333333333,0.0466337603281054,96,78,16,2,False,False,30
677,"More catnip, more catnip.",1.2083333333333333,0.0442200108177864,96,77,18,1,False,True,25
677,"Thanks Morris, I really need that glow before sunrise.",1.2083333333333333,0.0442200108177864,96,77,18,1,False,True,54
677,Let loose the Tender Vittles.  I hear and I obey.,1.2083333333333333,0.0466337603281054,96,78,16,2,False,True,49
677,"You know the kinda eats, the kinda red hot treats, the kinda sticky licky sweets I crave. FEED ME, SEYMOUR!",1.2083333333333333,0.0466337603281054,96,78,16,2,False,True,107
677,"Yes, Master...I will open the fridge...get the tuna...",1.2083333333333333,0.0466337603281054,96,78,16,2,False,True,54
677,Meow...meow....my human is fully hypnotized by my purr!,1.2083333333333333,0.0511204860458823,96,80,12,4,False,True,55
677,"Saturday night's dinner at the fancy restaurant; I'll order the pheasant-under-glass and doggie bag most of it for kitty. Yeah, that's the ticket.",1.2083333333333333,0.0466337603281054,96,78,16,2,False,True,146
677,"Yes, you want a midnight snack of lobster tail, raw egg and cod liver oil. Ummmmmm.....",1.2083333333333333,0.0489285790510333,96,79,14,3,False,True,87
677,"It was clear that the family feline had catastrophic intentions, with her owner being in a catatonic state of mind.",1.2083333333333333,0.0466337603281054,96,78,16,2,False,True,115
677,We'll see who's chonky.,1.2083333333333333,0.0489285790510333,96,79,14,3,False,True,23
677,"Open the pod bay doors, HAL.",1.2083333333333333,0.0466337603281054,96,78,16,2,False,True,28
677,DAGWOOD - Please Help!,1.2083333333333333,0.0466337603281054,96,78,16,2,False,True,22
677,"Now, put the fresh salmon in my dish, then return to bed. You will not remember any of this in the morning.",1.2083333333333333,0.0442200108177864,96,77,18,1,False,True,107
677,OK. OK. The catnip is in the hall closet.,1.2083333333333333,0.0442200108177864,96,77,18,1,False,True,41
677,Never knew YOU could do that.,1.2083333333333333,0.0442200108177864,96,77,18,1,False,True,29
677,"Operation ""Just Grab Them"", by the pussy.",1.2083333333333333,0.0416666666666666,96,76,20,0,False,True,41
677,Leap up on the counter and on to the refrigerator. Knock the clock off the wall. and run.,1.2083333333333333,0.0442200108177864,96,77,18,1,False,True,89
677,It's about time.  Open the fridge and get out the tuna!,1.2083333333333333,0.0442200108177864,96,77,18,1,False,True,55
677,"Yeah, I’m a freaking claw enforcement hero",1.2083333333333333,0.0489285790510333,96,79,14,3,False,False,42
677,Must have Friskies Salmon Filet with Savory Sauce. Must have Friskies Salmon Filet with Savory Sauce. Must have  Friskies Salmon Filet with Savory Sauce. Must have Friskies Salmon Filet with Savory Sauce. Must have....,1.2083333333333333,0.0442200108177864,96,77,18,1,False,True,218
677,must have been only a cat nap,1.2083333333333333,0.0442200108177864,96,77,18,1,False,False,29
677,"Who needs a damn hat, Walter thought to himself.",1.2083333333333333,0.0511204860458823,96,80,12,4,False,True,48
677,"Sleepwalker, awake! It’s breakfast time.",1.2083333333333333,0.0416666666666666,96,76,20,0,False,True,40
677,I've never felt so CATatonic as tonight!,1.2083333333333333,0.0466337603281054,96,78,16,2,False,True,40
677,Follow me into enlightenment.,1.2083333333333333,0.0442200108177864,96,77,18,1,False,True,29
677,"It is already morning? Oh, it was you my cutie cat come here.
Cat - Meow.....",1.2083333333333333,0.0466337603281054,96,78,16,2,True,True,77
677,Now I'm sure I'm the cat's meow!,1.2083333333333333,0.0416666666666666,96,76,20,0,False,True,32
677,The power of cats compels you!,1.2083333333333333,0.0466337603281054,96,78,16,2,False,True,30
677,"Cat Your Friend; Hate The Dog! Repeat! Cat Your Friend; Hate The Dog!
Oh.. and Kibble For Cat!  NOW!",1.2083333333333333,0.0489285790510333,96,79,14,3,False,True,100
677,Somehow I feel like I'm the cat's pajamas.,1.2083333333333333,0.0442200108177864,96,77,18,1,False,True,42
677,After feeding you special treats you will wag your tail and I will forget everything.,1.2083333333333333,0.0442200108177864,96,77,18,1,False,True,85
677,Pusssy dreams!,1.2083333333333333,0.0511204860458823,96,80,12,4,False,True,14
677,"As you wish, Master...sashimi three times a week...
and the Dog MUST go...",1.2083333333333333,0.0466337603281054,96,78,16,2,False,True,74
677,Like fishing with dynamite.,1.2083333333333333,0.0489285790510333,96,79,14,3,False,True,27
677,If I could just program him to leave out the catnip...,1.2083333333333333,0.0466337603281054,96,78,16,2,False,True,54
677,"Freedom is the freedom to say that two plus two make meow.  
If that is granted, all else follows.",1.2083333333333333,0.0442200108177864,96,77,18,1,False,True,98
677,"First this, next a sphinx.",1.2083333333333333,0.0466337603281054,96,78,16,2,False,True,26
677,"Okay, Kitty, I give up. What do you want in the fridge?",1.2083333333333333,0.0511204860458823,96,80,12,4,True,True,55
677,You will come to fear the name “Mr. Whiskers.”,1.2083333333333333,0.0466337603281054,96,78,16,2,False,False,46
677,Sleep deprivation is a hell of a drug.,1.2083333333333333,0.0511204860458823,96,80,12,4,False,True,38
677,"I promise never to put your treats in the cabinet above the sink, ever again.",1.2083333333333333,0.0442200108177864,96,77,18,1,False,True,77
677,What did she mean by ‘Greg’s into weird cat stuff’?,1.2061855670103092,0.0438144329896907,97,78,18,1,True,True,51
677,"Don't give me that sleep walking crap.If you are going to get rid of me,at least give us both some dignity.",1.2045454545454546,0.0489147930313159,88,72,14,2,False,True,107
677,"Your wish is my command, you goddamn fleabag.",1.2045454545454546,0.0563591699447179,88,75,8,5,False,True,45
677,"Needed some backup, it’s about to blow up in here!",1.2045454545454546,0.0489147930313159,88,72,14,2,False,True,50
677,"Now open the fridge for me, Harry",1.2045454545454546,0.0489147930313159,88,72,14,2,False,False,33
677,I keep having weird erotic dreams about tuna.,1.2045454545454546,0.0489147930313159,88,72,14,2,False,True,45
677,Oh I need cat food and more cat food!,1.2045454545454546,0.0563591699447179,88,75,8,5,False,True,37
677,"Cleopatra , it's 4:35 am for God's sake...",1.2045454545454546,0.0489147930313159,88,72,14,2,False,True,42
677,sleepwalking is what you get when you mistake a tiger for a cat.,1.2045454545454546,0.0489147930313159,88,72,14,2,False,True,64
677,Must feed the cat all left over salmon.,1.2045454545454546,0.0515159198418332,88,73,12,3,False,True,39
677,Behold!  Your Lord requires of thee....wet food!,1.2045454545454546,0.0515159198418332,88,73,12,3,False,True,48
677,This is not the cat you are looking for...,1.2045454545454546,0.0461673473078404,88,71,16,1,False,True,42
677,Put my year's supply of catnip in the refrigerator.,1.2045454545454546,0.0489147930313159,88,72,14,2,False,True,51
677,"Give me the world, but first, kibbles",1.2045454545454546,0.0461673473078404,88,71,16,1,False,False,37
677,Damn your super powers Superkitty,1.2045454545454546,0.0489147930313159,88,72,14,2,False,False,33
677,Now just open a nice fresh can of cat food for me.,1.2045454545454546,0.0489147930313159,88,72,14,2,False,True,50
677,Fortunately Dave's recollection of  this refrigerator raid will be all but forgotten in the morning.,1.2045454545454546,0.0461673473078404,88,71,16,1,False,True,100
677,"Yes I do have Betty Davis eyes.
Heidi Olson, New York City",1.2045454545454546,0.0489147930313159,88,72,14,2,False,False,58
677,Mr. Jones under the influence of excited catatonia.,1.2045454545454546,0.0461673473078404,88,71,16,1,False,True,51
677,"Now, for something completely different!",1.2045454545454546,0.0489147930313159,88,72,14,2,False,True,40
677,Open the cat food.....Open the cat food....then kill the dog.,1.2045454545454546,0.0515159198418332,88,73,12,3,False,True,61
677,Why put me in a trance?  All I did was get you neutered.,1.2045454545454546,0.0461673473078404,88,71,16,1,True,True,56
677,Salmon...salmon...I will obey,1.2045454545454546,0.0461673473078404,88,71,16,1,False,False,29
