contest,caption,mean,precision,votes,not_funny,somewhat_funny,funny,has_question_mark,ends_with_punctuation,caption_length
821,He’s trying to fool the field mice.,1.2093023255813953,0.0471232022332827,86,69,16,1,False,True,35
821,I don’t think the Giuliani look works anymore.,1.2093023255813953,0.052609807176551,86,71,12,3,False,True,46
821,I think it's a little too 'Elvis.',1.2093023255813953,0.0499419062505264,86,70,14,2,False,False,34
821,"You gotta be cool, relax…",1.209090909090909,0.0484891921879672,110,92,13,5,False,False,25
821,I swear it's a comb over.,1.209090909090909,0.0467375233367023,110,91,15,4,False,True,25
821,As if the birds don’t know it’s not his feathers,1.209090909090909,0.0389509101572414,110,87,23,0,False,False,48
821,That toupee is really not very flattering.,1.209090909090909,0.0484891921879672,110,92,13,5,False,True,42
821,He's been watching Donald Trump,1.2087912087912087,0.055285878226303,91,77,9,5,False,False,31
821,I heard he wanted to winter in Egypt. Apparently he nested near denial.,1.2087912087912087,0.0530313877534179,91,76,11,4,False,True,71
821,He’s been trying to woo the gloster canary in the next tree for weeks,1.2087912087912087,0.0530313877534179,91,76,11,4,False,False,69
821,"Well, at least it’s not a ducktail.",1.2087912087912087,0.0482071322384237,91,74,15,2,False,True,35
821,"Technically, Haliaeetus leucocephalus Elvisaes",1.2087912087912087,0.0506766992103187,91,75,13,3,False,False,46
821,Well would you look at him… proud as a peacock.,1.2087912087912087,0.0506766992103187,91,75,13,3,False,True,47
821,Aren’t we more evolved than that?,1.2087912087912087,0.0506766992103187,91,75,13,3,True,True,33
821,He muttered something about rebranding America …,1.2087912087912087,0.0456040278314605,91,73,17,1,False,False,48
821,He’s having a bad hair day.,1.2087912087912087,0.0530313877534179,91,76,11,4,False,True,27
821,I hear he also shakes a mean tail feather.,1.2083333333333333,0.0442200108177864,96,77,18,1,False,True,42
821,He identifies as a peacock.,1.2083333333333333,0.0532221978048754,96,81,10,5,False,True,27
821,"After this rather insulting change, the breeding program took off.",1.2083333333333333,0.0442200108177864,96,77,18,1,False,True,66
821,"It's an elaborate ""comb over"".",1.2083333333333333,0.0442200108177864,96,77,18,1,False,True,30
821,It a recessive gene from his mother’s side.,1.2083333333333333,0.0466337603281054,96,78,16,2,False,True,43
821,I heard housekeeping is missing a duster.,1.2083333333333333,0.0552440094923904,96,82,8,6,False,True,41
821,I am so tired of seeing these Elvis wanna he’s since the movie came out.,1.2083333333333333,0.0424986955366349,120,98,19,3,False,True,72
821,"Never mind his hairdo-- he is a catch- faithful, sober, responsible, definitely no Elvis.",1.2083333333333333,0.0489285790510333,96,79,14,3,False,True,89
821,"That new chick in the next tree said he sounded like Elvis, and it went straight to his head.",1.2083333333333333,0.0442200108177864,96,77,18,1,False,True,93
821,"It's real, right?",1.2083333333333333,0.0557264585691889,72,59,11,2,True,True,17
821,"If he sings ""I ain't nothin' but a hound dog"" one more time, I'll clip his wings.",1.2083333333333333,0.0466337603281054,96,78,16,2,False,True,81
821,Should we tell him that Elvis has left the building?,1.2083333333333333,0.0466337603281054,96,78,16,2,True,True,52
821,"Hang in there, he'll be migrating soon",1.2083333333333333,0.0466337603281054,96,78,16,2,False,False,38
821,"He knows he's not fooling anyone, right?",1.2083333333333333,0.0466337603281054,96,78,16,2,True,True,40
821,The chicks don't dig it.,1.207920792079208,0.0473387449025026,101,83,15,3,False,True,24
821,He's also been talking about buying a Porsche.,1.207920792079208,0.0473387449025026,101,83,15,3,False,True,46
821,It was bad enough when he insisted on bald-ING.,1.207920792079208,0.0473387449025026,101,83,15,3,False,True,47
821,The younger eagles call it ‘peacocking.’,1.207920792079208,0.0451988602396567,101,82,17,2,False,False,40
821,He thinks he’s so wonderful because he’s not turning grey.,1.207920792079208,0.0429524989375918,101,81,19,1,False,True,58
821,It's his only New York appearance.,1.207920792079208,0.0429524989375918,101,81,19,1,False,True,34
821,I've killed a fish and two mice by the time he's done working on that in the morning.,1.207920792079208,0.0451988602396567,101,82,17,2,False,True,85
821,What is the diagnosis?he only sees birds on the ink blot test,1.207920792079208,0.0451988602396567,101,82,17,2,True,False,61
821,He's a bird of slay.,1.207792207792208,0.05338078923628,77,63,12,2,False,True,20
821,Who does he think he is? Elvis or Elton?,1.207792207792208,0.0500773917035414,77,62,14,1,True,True,40
821,There's no fool like an old fool.,1.207792207792208,0.0564913458783413,77,64,10,3,False,True,33
821,At least it’s not an Afro.,1.207792207792208,0.0564913458783413,77,64,10,3,False,True,26
821,Birds of a feather flock together. So Jimmy’s out.,1.207792207792208,0.0594393443672171,77,65,8,4,False,True,50
821,"Well, he does look younger.",1.2075471698113207,0.0458854801911949,106,87,16,3,False,True,27
821,I said he flew in from St. Tropez not Bad Toupee,1.2075471698113207,0.0496474201848481,106,89,12,5,False,False,48
821,Looks great on Ernie but it won't stay on in the air!,1.2075471698113207,0.0478034707076139,106,88,14,4,False,True,53
821,Man that’s a bad rug!,1.2075471698113207,0.0438837415572029,106,86,18,2,False,True,21
821,He thinks we won’t notice he’s bald.,1.2075471698113207,0.0478034707076139,106,88,14,4,False,True,36
821,He's going a little cuckoo crazy.,1.2073170731707317,0.0541497051563362,82,68,11,3,False,True,33
821,"Look at Marlon Birdo over there, prancing around.  You know it’s a rug, right?",1.2073170731707317,0.0568621551716999,82,69,9,4,True,True,78
821,What a waste of perfectly good roadkill,1.206896551724138,0.0466404947264146,87,70,16,1,False,False,39
821,Doesn't he know that's ill eagle?,1.206896551724138,0.0520572008568323,87,72,12,3,True,True,33
821,"Supercilious, don't you think?",1.206896551724138,0.0450174735012565,116,96,16,4,True,True,30
821,I mean he always was a cock.,1.206896551724138,0.0520572008568323,87,72,12,3,False,True,28
821,"He’ll yeah, he’s a bald bastard!",1.206896551724138,0.0520572008568323,87,72,12,3,False,True,32
821,Just don't ask him for his autograph.,1.206896551724138,0.0466404947264146,87,70,16,1,False,True,37
821,"Does he think he's fooling anybody? -- I mean, with eyes like ours?",1.206896551724138,0.0545642773929108,87,73,10,4,True,True,67
821,I guess the hair transplant really does work!,1.206896551724138,0.0482330073227748,116,98,12,6,False,True,45
821,He should have tried the feather plugs.,1.2065217391304348,0.0501741912664799,92,76,13,3,False,True,39
821,I still think Jerry Lee Eagle was cooler.,1.2065217391304348,0.0501741912664799,92,76,13,3,False,True,41
821,That's not all he has that's fake,1.2065217391304348,0.0501741912664799,92,76,13,3,False,False,33
821,He was the last presidential seal's model.,1.2065217391304348,0.0525008667784131,92,77,11,4,False,True,42
821,Elvis is feeling a little shy,1.2065217391304348,0.0477342426985695,92,75,15,2,False,False,29
821,"Look it's the ""King of SQUAWK""",1.2065217391304348,0.0501741912664799,92,76,13,3,False,False,30
821,"When his wife gets home, he will have hell toupee",1.2065217391304348,0.0451626658066878,92,74,17,1,False,False,49
821,oh oh.....here comes Love Me Tender,1.2065217391304348,0.0477342426985695,92,75,15,2,False,False,35
821,Is it just me or does Derek look especially fly today?,1.2065217391304348,0.0501741912664799,92,76,13,3,True,True,54
821,He always puts that hat on before flying down to make a kill.,1.2065217391304348,0.0525008667784131,92,77,11,4,False,True,61
821,"He takes our name so literal, its gone to his head.",1.2065217391304348,0.0568693599310157,92,79,7,6,False,True,51
821,But he's so much more than a hound dog.,1.2063492063492065,0.0395489815933903,126,102,22,2,False,True,39
821,He's still in denial about our species.,1.2061855670103092,0.0462004455661469,97,79,16,2,False,True,39
821,A hunk a hunk of burning love he's not!,1.2061855670103092,0.0527144294042695,97,82,10,5,False,True,39
821,The only one he's fooling is himself.,1.2061855670103092,0.0484691427901599,97,80,14,3,False,True,37
821,You think he realizes that this takes him off the endangered species list?,1.2061855670103092,0.0506362956298672,97,81,12,4,True,True,74
821,"I'm not sure if its Elvis or Liberace,but I like it!",1.2061855670103092,0.0506362956298672,97,81,12,4,False,True,52
821,Cock-a-toodle-oo.,1.2061855670103092,0.0506362956298672,97,81,12,4,False,True,17
821,He ain’t nothin but an impersonator,1.2061855670103092,0.0484691427901599,97,80,14,3,False,False,35
821,Maybe it's Maybelline...,1.2061855670103092,0.0506362956298672,97,81,12,4,False,True,24
821,He thinks he’s superior to a bald eagle because he wears a toupee,1.2061855670103092,0.0462004455661469,97,79,16,2,False,False,65
821,"He has the charisma of Elvis, the flamboyance of Liberace and the confidence of Foghorn Leghorn!",1.2061855670103092,0.0462004455661469,97,79,16,2,False,True,96
821,It does make him look younger,1.2058823529411764,0.0469166460252739,102,84,15,3,False,False,29
821,You know it's a toupee --right?,1.2058823529411764,0.0469166460252739,102,84,15,3,True,True,31
821,He says the toupee makes him feel like an egg again.,1.2058823529411764,0.0508865974082631,102,86,11,5,False,True,52
821,I think he looks pretty fly.,1.2058823529411764,0.0447999398827269,102,83,17,2,False,True,28
821,Whatever. He’s a bald  eagle.,1.2058823529411764,0.0489418914124265,102,85,13,4,False,True,29
821,"From Graceland to Birdland, still the King",1.2058823529411764,0.0489418914124265,102,85,13,4,False,False,42
821,His migration had a layover in Graceland.,1.2058823529411764,0.0425781346788589,102,82,19,1,False,True,41
821,"Well, at least it is not orange.",1.2058823529411764,0.0469166460252739,102,84,15,3,False,True,32
821,"Does he really think ""toupeed eagle"" has the same ring to it?",1.2058823529411764,0.0425781346788589,102,82,19,1,True,True,61
821,It’s a MoeHawk.,1.2058823529411764,0.0447999398827269,102,83,17,2,False,True,15
821,Why does he wear that rug?  It’s just sensationally ugly.,1.2058823529411764,0.0489418914124265,102,85,13,4,True,True,57
821,He never fully embraced the “bald is beautiful” aesthetic.,1.2058823529411764,0.0489418914124265,102,85,13,4,False,True,58
821,"See, what they do is, they take the hair from the back of your neck.",1.2058823529411764,0.0508865974082631,102,86,11,5,False,True,68
821,What next... Fedora's?,1.2058823529411764,0.0402338227361774,102,81,21,0,True,True,22
821,He thinks that’ll get his picture on the dollar bill.,1.205607476635514,0.0454959886830417,107,88,16,3,False,True,53
821,He thinks he's Napoleon.,1.205607476635514,0.0454959886830417,107,88,16,3,False,True,24
821,He truly is a bald eagle.,1.205607476635514,0.0473943111512617,107,89,14,4,False,True,25
821,Who needs color?,1.205607476635514,0.0435149312649382,107,87,18,2,True,True,16
821,Jeez... he looks like Liberace!,1.205607476635514,0.0454959886830417,107,88,16,3,False,True,31
821,"He swears it's his own hair, but I have my doubts.",1.205607476635514,0.0473943111512617,107,89,14,4,False,True,50
821,he is SO black & white about everything,1.205607476635514,0.0414392748456961,107,86,20,1,False,False,39
821,"He winters in Graceland.""",1.205607476635514,0.0435149312649382,107,87,18,2,False,False,25
821,The Mississippi Crested Eagle,1.2054794520547945,0.0615592180945788,73,62,7,4,False,False,29
821,"Honestly, I just think it makes him look immature.",1.2054794520547945,0.0583868121120749,73,61,9,3,False,True,50
821,He's sure to get canceled for cultural appropriation.,1.2053571428571428,0.050953572467094,112,96,9,7,False,True,53
821,He wanted to be more aerodynamic.,1.2053571428571428,0.0403858339261236,112,90,21,1,False,True,33
821,"You can always tell a piece, can't ya?",1.2053571428571428,0.0423307304777935,112,91,19,2,True,True,38
821,What’s a Liberace ?,1.2053571428571428,0.0441901109260744,112,92,17,3,True,True,19
821,He thinks it makes him look younger but I think he just looks immature.,1.2053571428571428,0.0441901109260744,112,92,17,3,False,True,71
821,A feather on the head is worth two on the tush.,1.2053571428571428,0.0441901109260744,112,92,17,3,False,True,47
821,He said doesn't identify as a bald eagle.,1.205128205128205,0.0587328009810563,78,66,8,4,False,True,41
821,"Well, at least he hasn't pierced his genitals yet.",1.205128205128205,0.0462862821395627,117,98,14,5,False,True,50
821,You should see his nest.,1.205128205128205,0.052759276388894,78,64,12,2,False,True,24
821,That's cousin Moe Hawk.,1.205128205128205,0.052759276388894,78,64,12,2,False,True,23
821,Yep. Hank is moving to The Villages.,1.205128205128205,0.049502938418637,78,63,14,1,False,True,36
821,Please. No one in their right mind would ever put them on the back of a dollar bill.,1.205128205128205,0.052759276388894,78,64,12,2,False,True,84
821,He thinks no one can tell he’s molting.,1.2049180327868851,0.0434561052513363,122,101,17,4,False,True,39
821,Where is the gown?,1.2048192771084338,0.0507337757218453,83,68,13,2,True,True,18
821,He's out of his Sinatra obsession and back to Elvis.,1.2048192771084338,0.0477499490965608,83,67,15,1,False,True,52
821,he said he's tired of being stereotyped,1.2048192771084338,0.0507337757218453,83,68,13,2,False,False,39
821,He just came back from Graceland.,1.2048192771084338,0.0535516046376283,83,69,11,3,False,True,33
821,The cartoonist just spilled some ink so no need to worry that your husband is going through a midlife crisis or anything.,1.2048192771084338,0.0535516046376283,83,69,11,3,False,True,121
821,He overheard someone calling him a “bald” eagle.,1.2048192771084338,0.0562283978033804,83,70,9,4,False,True,48
821,He switched because he thought that the comb-over made him look like Trump,1.2048192771084338,0.0535516046376283,83,69,11,3,False,False,74
821,Prince had it right. Raspberry beret.,1.2048192771084338,0.0587834252132822,83,71,7,5,False,True,37
821,"Look, it's a Rug, next he will be dripping like Rudy!",1.2048192771084338,0.0535516046376283,83,69,11,3,False,True,53
821,Check out the mullet on Reg's head; it looks pretty fishy to me.,1.2048192771084338,0.0477499490965608,83,67,15,1,False,True,64
821,He's Canadian.,1.2048192771084338,0.0507337757218453,83,68,13,2,False,True,14
821,He says he wants a career as an Elvis impersonator!,1.2048192771084338,0.0477499490965608,83,67,15,1,False,True,51
821,What's next? A convertible.,1.204724409448819,0.04083031282442,127,104,20,3,True,True,27
821,I heard he had a parrotcedure,1.2045454545454546,0.0515159198418332,88,73,12,3,False,False,29
821,Elvis Eagle just doesn't have the same patriotic oomph.,1.2045454545454546,0.0515159198418332,88,73,12,3,False,True,55
821,"Apparently, he missed the memo that bald is beautiful.",1.2045454545454546,0.0515159198418332,88,73,12,3,False,True,54
821,"Gotta admit, he sure picks up chicks.",1.2045454545454546,0.0515159198418332,88,73,12,3,False,True,37
821,BALD IS BETTER.,1.2045454545454546,0.0489147930313159,88,72,14,2,False,True,15
821,"Yeah, he thought it would avoid his extinction",1.2045454545454546,0.0515159198418332,88,73,12,3,False,False,46
821,He’s just going through a semiquincentennial-life crisis.,1.2045454545454546,0.0563591699447179,88,75,8,5,False,True,57
821,He insists it's real.,1.2045454545454546,0.0489147930313159,88,72,14,2,False,True,21
821,Dunno about the Elvis toupee.  You?,1.2045454545454546,0.0515159198418332,88,73,12,3,True,True,35
821,"He is trying to change his image
to attract more prey",1.2045454545454546,0.0539918791764455,88,74,10,4,False,False,53
821,I don't know ... he must be working out.,1.2043010752688172,0.0472703715690037,93,76,15,2,False,True,40
821,MAGA pays him to wear it every Tuesday.,1.2043010752688172,0.0420354593989229,93,74,19,0,False,True,39
821,I tried to explain that our name does not mean follicularly challenged!,1.2043010752688172,0.0472703715690037,93,76,15,2,False,True,71
821,and you really don't want to fly anywhere near him,1.2040816326530612,0.0457749589849691,98,80,16,2,False,False,50
821,"Coiffed eagle? Nope, not going to fly.",1.2040816326530612,0.050161077954179,98,82,12,4,True,True,38
821,We'll never be birds of a rug with him.,1.2040816326530612,0.0480181247634725,98,81,14,3,False,True,39
821,Baldness does not affect members of his family.,1.2040816326530612,0.0480181247634725,98,81,14,3,False,True,47
821,"I don't mind the pompadour, but I'm not crazy about the beak curl.",1.2040816326530612,0.050161077954179,98,82,12,4,False,True,66
821,I told you Elvis lives.,1.2040816326530612,0.0457749589849691,98,80,16,2,False,True,23
821,He's always been a gourmand.,1.2040816326530612,0.0480181247634725,98,81,14,3,False,True,28
821,"He not only the president of the company, he is also a client.",1.2040816326530612,0.0480181247634725,98,81,14,3,False,True,62
821,"Well, If that's our new look, at least it's not a mullet!",1.203883495145631,0.0444078652953465,103,84,17,2,False,True,57
821,I thought it was just a phase he would molt out of.,1.203883495145631,0.0465018914581891,103,85,15,3,False,True,51
821,I don't think 'Rug Eagle' sounds any better.,1.203883495145631,0.0522831534673252,103,88,9,6,False,True,44
821,"Ladies and gentlemen,Elvis has left the roost.",1.203883495145631,0.0444078652953465,103,84,17,2,False,True,46
821,"He's from Memphis, his twin brother died when they hatched and ALL the chicks really dig him.",1.203883495145631,0.0465018914581891,103,85,15,3,False,True,93
821,He always was a bit more ‘ex uno plures.’,1.203883495145631,0.042210082811931,103,83,19,1,False,False,41
821,That's the worst comb-over I've ever seen.,1.203883495145631,0.042210082811931,103,83,19,1,False,True,42
821,I bet it's a toupee.,1.203883495145631,0.0444078652953465,103,84,17,2,False,True,20
821,"No, it's not that - he just thinks he's Elvis.",1.203883495145631,0.0465018914581891,103,85,15,3,False,True,46
821,"It’s tempting, but the upkeep on those things is no joke.",1.203883495145631,0.0504297603344327,103,87,11,5,False,True,57
821,"He ordered it from Amazon, it used to be a Pekingese.",1.2037037037037035,0.0487987568205456,108,91,12,5,False,True,53
821,French maybe?,1.2037037037037035,0.0410979026364838,108,87,20,1,True,True,13
821,Fred hated being called “bald”.,1.2037037037037035,0.0431521478914562,108,88,18,2,False,True,31
821,He jenunely fall in love with her twercking,1.2037037037037035,0.0451129486309011,108,89,16,3,False,False,43
821,"He has never been the same since he saw ""Elvis"".",1.2037037037037035,0.0505409629286874,108,92,10,6,False,True,48
821,One of the greatest names in ornithilogical history and he caves to his wife!,1.2037037037037035,0.0469920035825515,108,90,14,4,False,True,77
821,I don't like talking behind people's backs.,1.2035398230088497,0.0456019093854795,113,94,15,4,False,True,43
821,He keeps squawking “Don’t Be Cruel” too.,1.2035398230088497,0.0438349897536935,113,93,17,3,False,True,40
821,Went to see Bye Bye Birdie. Thinks he’s Conway Twitty.,1.2035398230088497,0.0438349897536935,113,93,17,3,False,True,54
821,He just realized that he's bald.,1.2035398230088497,0.0400680758324664,113,91,21,1,False,True,32
821,I guess it beats the fruit headdress.,1.2035398230088497,0.0473028746747653,113,95,13,5,False,True,37
821,I'm guessing he's a knockoff.,1.2027027027027026,0.0543540361664704,74,61,11,2,False,True,29
821,I think the eagle cam is going to his head.,1.2025316455696202,0.0489412302990869,79,64,14,1,False,True,43
821,He's going for a Trump-Elvis hybrid look.,1.2025316455696202,0.0580426899588362,79,67,8,4,False,True,41
821,"That's Elvis, the toupee eagle",1.2023809523809523,0.0529663992060461,84,70,11,3,False,False,30
821,An orange wig on an eagle only fools 33% .,1.2023809523809523,0.0529663992060461,84,70,11,3,False,True,42
821,He’s convinced himself that it looks totally natural.,1.2023809523809523,0.0472410412624924,84,68,15,1,False,True,53
821,You can see that thing coming from a mile away.,1.2023809523809523,0.0472410412624924,84,68,15,1,False,True,47
821,I can't help feeling a little self-conscious now,1.2023809523809523,0.0501854332671282,84,69,13,2,False,False,48
821,He was seen with Colonel Parker last week.,1.2023809523809523,0.0441005016629023,84,67,17,0,False,True,42
821,I thought colour was the fall trend but it must be all about the hairstyles this season.,1.2023809523809523,0.0529663992060461,84,70,11,3,False,True,88
821,"He may not know it but he's heading for the Jungle Room at 
Graceland.",1.2023809523809523,0.0501854332671282,84,69,13,2,False,True,70
821,Elvis impersonators are a dime a dozen but this guy can really sing!,1.2023809523809523,0.0501854332671282,84,69,13,2,False,True,68
821,Make his day -- tell him his new toupe' makes him look 10 years younger.,1.202247191011236,0.0509856257680422,89,74,12,3,False,True,72
821,He says it’s transformative.,1.202247191011236,0.0457034878880431,89,72,16,1,False,True,28
821,He’s grooming himself to branch out.,1.202247191011236,0.0457034878880431,89,72,16,1,False,True,36
821,"Maybe he can pull off the new look, but I don't know about the Ferrari.",1.202247191011236,0.0484166440394796,89,73,14,2,False,True,71
821,He's rejecting our colonial name.,1.202247191011236,0.0534312329061573,89,75,10,4,False,True,33
821,"I swear that thing on his head is mocking me, Lenny.",1.202247191011236,0.0428187597931015,89,71,18,0,False,True,52
821,Look what mating season has done to him!,1.202247191011236,0.0484166440394796,89,73,14,2,False,True,40
821,Angry Bird?,1.202247191011236,0.0484166440394796,89,73,14,2,True,True,11
821,They say he sings and plays the piano.,1.202247191011236,0.0484166440394796,89,73,14,2,False,True,38
821,"Looks like Harry's been ""trumped""",1.202247191011236,0.0534312329061573,89,75,10,4,False,False,33
821,"Even with a Republican win, the comb-over eagle is still a loser.",1.202247191011236,0.0457034878880431,89,72,16,1,False,True,65
821,It's his Elvis impersonation.,1.202247191011236,0.0428187597931015,89,71,18,0,False,True,29
821,It’s Elvis week.,1.202247191011236,0.0484166440394796,89,73,14,2,False,True,16
821,He gets it from your side of the family.,1.202247191011236,0.0534312329061573,89,75,10,4,False,True,40
821,But why is he ashamed of being bald?,1.202127659574468,0.041642625598873,94,75,19,0,True,True,36
821,I hear he's up for the plugged dollar.,1.202127659574468,0.0536470993045641,94,80,9,5,False,True,38
821,Shall we kick him out of the nest?,1.202127659574468,0.051470677714487,94,79,11,4,True,True,34
821,"If you think he looks pathetic now, you should've seen him with a comb over.",1.202127659574468,0.0491980697282263,94,78,13,3,False,True,76
821,That loudmouth went to Morrie's Wigs again.,1.202127659574468,0.051470677714487,94,79,11,4,False,True,43
821,Is it my turn or yours tonight.,1.202127659574468,0.0468152695771182,94,77,15,2,False,True,31
821,He just migrated in from Paris,1.202127659574468,0.051470677714487,94,79,11,4,False,False,30
821,He has a thing about being bald.,1.202127659574468,0.0557386029893012,94,81,7,6,False,True,32
821,"He came back from the Tropics with it, and that stupid cockatoo, Cheryl.",1.202127659574468,0.0491980697282263,94,78,13,3,False,True,72
821,"Toupee, can you see?",1.202127659574468,0.0491980697282263,94,78,13,3,True,True,20
821,"Changes.  Everywhere you look, changes.",1.202020202020202,0.0430246796994966,99,80,18,1,False,True,39
821,"Well, what she said was that this beats the hell out of a bird in the hand.”",1.202020202020202,0.0475753002073146,99,82,14,3,False,False,76
821,Thats quite a comb-over...,1.202020202020202,0.0517271236044297,99,84,10,5,False,True,26
821,He's has a side gig as an Elvis impersonator.,1.202020202020202,0.0496945897769771,99,83,12,4,False,True,45
821,This will disrupt our whole branding initiative.,1.202020202020202,0.0496945897769771,99,83,12,4,False,True,48
821,He is one eighth cockatoo.,1.202020202020202,0.0475753002073146,99,82,14,3,False,True,26
821,I want to ask if he'll be our wingman.,1.202020202020202,0.0496945897769771,99,83,12,4,False,True,38
821,You may not like that pompadour but he'll blow you over when he croons Love Me Tender..,1.202020202020202,0.0517271236044297,99,84,10,5,False,True,87
821,He's on the reboot of The Partridge Family.,1.202020202020202,0.0453570956580135,99,81,16,2,False,True,43
821,"If he starts playing a guitar, I am outta here!",1.202020202020202,0.0453570956580135,99,81,16,2,False,True,47
821,He dislikes being a BALD eagle.,1.202020202020202,0.0453570956580135,99,81,16,2,False,True,31
821,"I never called him baldy, did you?",1.202020202020202,0.0496945897769771,99,83,12,4,True,True,34
821,"There he is, Mr. God Bless America",1.202020202020202,0.0475753002073146,99,82,14,3,False,False,34
821,I heard it's a wig.,1.202020202020202,0.0453570956580135,99,81,16,2,False,True,19
821,Why? Because the chicks were ignoring him.,1.202020202020202,0.0453570956580135,99,81,16,2,True,True,42
821,Worst Elvis impersonator ever.,1.202020202020202,0.0430246796994966,99,80,18,1,False,True,30
821,"Actually, Elvis envied Roy Orbison’s hair .",1.202020202020202,0.0475753002073146,99,82,14,3,False,True,43
821,He better enjoy that wig before I push it back.,1.2019230769230769,0.0460942950391723,104,86,15,3,False,True,47
821,"Apparently, ""bald"" just doesn't do it for the kids these days...",1.2019230769230769,0.0440224662845252,104,85,17,2,False,True,64
821,"The toupée doesn't bother me, it's the way he sings.",1.2019230769230769,0.0395545767642626,104,83,21,0,False,True,52
821,"It's a toupee. He doesn't like being called "" Baldy"".",1.2019230769230769,0.048076923076923,104,87,13,4,False,True,53
