contest,caption,mean,precision,votes,not_funny,somewhat_funny,funny,has_question_mark,ends_with_punctuation,caption_length
877,"There's no Emoji for Passive, Complacent, Introvert.",1.2127659574468086,0.0400209046669927,141,115,22,4,False,True,52
877,"Wait, do you all think I'm the smiling turd?",1.2125984251968505,0.0482540060652237,127,108,11,8,True,True,44
877,"What filter is THAT, Susan?",1.2125984251968505,0.0441983706768021,127,105,17,5,True,True,27
877,i guess it’s time to upgrade from my blackberry.,1.2123893805309736,0.0477881959040807,113,94,14,5,False,True,48
877,I don’t get what’s so funny about wanting to be the eggplant.,1.2123893805309736,0.0406398870100117,113,90,22,1,False,True,61
877,Why can’t I be friendly and intelligent?,1.2121212121212122,0.041694258313364,132,108,20,4,True,True,40
877,"So: to stand out, I gotta conform?!",1.2121212121212122,0.0430589316786362,132,109,18,5,True,True,35
877,Words really do fail me.,1.2118644067796611,0.0447953074932042,118,97,17,4,False,True,24
877,I’m just trying to get ahead,1.2118644067796611,0.0463840934486698,118,98,15,5,False,False,28
877,"If you're looking for a sharp pang of anxiety riddled with an overwhelming sense of  not being young anymore, you've come to the right place.",1.2118644067796611,0.0479202324357796,118,99,13,6,False,True,141
877,Which one gets me a taxi at rush hour?,1.2118644067796611,0.0447953074932042,118,97,17,4,True,True,38
877,It’s the emoji zone.,1.2116788321167884,0.0419964638637787,137,113,19,5,False,True,20
877,Any of you guys seen Eggplant?,1.2116788321167884,0.0406984123781985,137,112,21,4,True,True,30
877,is it because im android?,1.2116788321167884,0.0406984123781985,137,112,21,4,True,True,25
877,Not big on words?,1.2113821138211385,0.0435833821339135,123,101,18,4,True,True,17
877,You guys have taken this filter thing too damn far.,1.2113821138211385,0.0420265532360902,123,100,20,3,False,True,51
877,Facebook needs new emoticons.,1.2113821138211385,0.0420265532360902,123,100,20,3,False,True,29
877,"Whatever happened to rock, paper, scissors?",1.2113821138211385,0.0465410704741558,123,103,14,6,True,True,43
877,I get so emotional at gatherings like this,1.2113821138211385,0.0420265532360902,123,100,20,3,False,False,42
877,Tell me what you really think!,1.2112676056338028,0.0456158930733393,142,121,12,9,False,True,30
877,Did I miss another OS update?,1.211009174311927,0.0488977979825135,109,91,13,5,True,True,29
877,Can you still accept me if my emotion isn’t visually represented?,1.211009174311927,0.0522569036410858,109,93,9,7,True,True,65
877,I am not an eggplant!,1.211009174311927,0.0471285474233102,109,90,15,4,False,True,21
877,You're all using each other.,1.2109375,0.0424582120724805,128,105,19,4,False,True,28
877,Wait! I am still updating my system!,1.2109375,0.0409837562496257,128,104,21,3,False,True,36
877,"Oh, dear!  I hope I can roll back that operating system update.",1.2108843537414966,0.0412181629858708,147,122,19,6,False,True,63
877,I think I missed a software update.,1.2105263157894737,0.0457368797131426,114,94,16,4,False,True,35
877,Surely there must be another emoji that better expresses how I feel.,1.2105263157894737,0.050573000220171,114,97,10,7,False,True,68
877,"Sorry guys, my subscription expired.",1.2105263157894737,0.0440068945822071,114,93,18,3,False,True,36
877,So I guess this leaves ME as the shithead?,1.210144927536232,0.041719239298109,138,114,19,5,True,True,42
877,I’m not sure how to tell him how I feel.,1.210144927536232,0.0441822133126768,138,116,15,7,False,True,40
877,When Holly finally looked up from her phone she was shocked to realize she recognized her companions more easily by their emojis than by their faces.,1.210144927536232,0.0391014306901793,138,112,23,3,False,True,149
877,What the heck is an emoji???,1.2100840336134453,0.046027105672703,119,99,15,5,True,True,28
877,"Let up, guys - I just can't find the words",1.2100840336134453,0.0444529481959174,119,98,17,4,False,False,42
877,So your emojis are contagious ?,1.2100840336134453,0.046027105672703,119,99,15,5,True,True,31
877,"Beam me up, Scotty",1.2100840336134453,0.0504557629661659,119,102,9,8,False,False,18
877,"Does ""UF"" mean unfriend, or is it the other way?",1.2097902097902098,0.0430918095848759,143,120,16,7,True,True,48
877,You think I'M dramatic?!,1.2096774193548387,0.0447538852796586,124,103,16,5,True,True,24
877,"Look, let’s face facts.",1.2094594594594594,0.0420706232356428,148,124,17,7,False,True,23
877,Whadya mean I'm too wordy?,1.2093023255813953,0.0435723394494517,129,107,17,5,True,True,26
877,"I’m still a little concerned about the fruit, Joan.",1.2093023255813953,0.0421595153445873,129,106,19,4,False,True,51
877,"Uhh, so I see things are getting pretty serious with Aubergine",1.209090909090909,0.0467375233367023,110,91,15,4,False,False,62
877,Sorry.  I just feel like me today.,1.208955223880597,0.0437736124979951,134,112,16,6,False,True,34
877,Don't let social media go to your heads,1.208955223880597,0.0437736124979951,134,112,16,6,False,False,39
877,It looks like none of us are on the same page about this issue.,1.208955223880597,0.0411301282499403,134,110,20,4,False,True,63
877,"You guys didn’t start another group text without me, right? Why is everyone laughing?",1.208955223880597,0.0411301282499403,134,110,20,4,True,True,85
877,Can someone find the one for apathy?,1.208695652173913,0.0470254036121303,115,96,14,5,True,True,36
877,Mine's just a simple smiley face.,1.208695652173913,0.0453743681343006,115,95,16,4,False,True,33
877,Which one of you guys means interested but not too interested,1.208695652173913,0.0418774722373927,115,93,20,2,False,False,61
877,I'm getting some mixed messages here.,1.20863309352518,0.0414455965960947,139,115,19,5,False,True,37
877,God I hate millennials,1.20863309352518,0.0426849141004352,139,116,17,6,False,False,22
877,I feel emotionless.,1.20863309352518,0.0401680602301245,139,114,21,4,False,True,19
877,"I got ""Pray"" hands",1.2083333333333333,0.0456754985428021,120,100,15,5,False,False,18
877,But you guys are so—iconic.,1.2083333333333333,0.0424986955366349,120,98,19,3,False,True,27
877,I'm afraid I don't remember any of your names anymore.,1.2076923076923076,0.0432658350221217,130,108,17,5,False,True,54
877,"Well, that’s enough internet for today.",1.2076923076923076,0.044622786382501,130,109,15,6,False,True,39
877,I must have swiped in the wrong direction.,1.2076923076923076,0.044622786382501,130,109,15,6,False,True,42
877,Do you have one for vanilla?,1.2075471698113207,0.0496474201848481,106,89,12,5,True,True,28
877,"I know we agreed I would be poop-head, but it just seemed too ironic.",1.2074074074074077,0.0434757149271191,135,113,16,6,False,True,69
877,I'm not sure how to convey 'you should get tested.',1.2074074074074077,0.0421850621536888,135,112,18,5,False,False,51
877,I've got nothing to say.,1.2074074074074077,0.0421850621536888,135,112,18,5,False,True,24
877,Mormons are so weird!,1.207207207207207,0.0497612927883715,111,94,11,6,False,True,21
877,I think our phones may be spending a bit too much time on us.,1.207142857142857,0.0447631985409958,140,119,13,8,False,True,61
877,How do you know when you've been hacked?,1.206896551724138,0.0433202941235984,116,95,18,3,True,True,40
877,Sometimes I feel like just another face in the cloud.,1.206896551724138,0.0450174735012565,116,96,16,4,False,True,53
877,"How do you spell ""FOMO""?",1.206896551724138,0.0425442655708546,145,122,16,7,True,True,24
877,Don't you guys understand? You are what you tweet.,1.206896551724138,0.0450174735012565,116,96,16,4,True,True,50
877,I have trouble expressing myself.,1.206896551724138,0.0466529522958364,116,97,14,5,False,True,33
877,"Oh god, I'm an android :(",1.206896551724138,0.0402298850574712,145,120,20,5,False,False,25
877,I can't believe you guys think I'm a total eggplant.,1.206896551724138,0.041403249780064,145,121,18,6,False,True,52
877,Just let me be,1.206611570247934,0.048272292658976,121,103,11,7,False,False,14
877,"Sorry, guys. My phone doesn’t support emojis.",1.206611570247934,0.0468238528073232,121,102,13,6,False,True,45
877,"Sorry, what’s the one for abject failure again?",1.206611570247934,0.0405155402826378,121,98,21,2,True,True,47
877,I don’t want to be the eggplant.,1.2063492063492065,0.0426390689279512,126,104,18,4,False,True,32
877,Can you first help me find the ‘on’ button?”,1.2063492063492065,0.0441029967919041,126,105,16,5,True,False,44
877,"I think we need to have a talk about screen time, guys.",1.2063492063492065,0.0379096006057858,126,101,24,1,False,True,55
877,"Sorry, was it something I texted?",1.2063492063492065,0.0426390689279512,126,104,18,4,True,True,33
877,OMG! I am a victim of identity theft.,1.2063492063492065,0.0441029967919041,126,105,16,5,False,True,37
877,I gotta be me.,1.2063492063492065,0.0426390689279512,126,104,18,4,False,True,14
877,What? I’m from Twitter,1.2063492063492065,0.0455198687718982,126,106,14,6,True,False,22
877,I need an upgrade.,1.2061068702290076,0.0415743569785591,131,108,19,4,False,True,18
877,Omigosh! I never looked up from my phone before!,1.2061068702290076,0.0468848206412893,131,112,11,8,False,True,48
877,You guys are getting paid?,1.2061068702290076,0.0429635539763294,131,109,17,5,True,True,26
877,I guess you're wondering why I called you here.  #,1.2061068702290076,0.0415743569785591,131,108,19,4,False,False,50
877,"Hey, people!  Get out of your heads!",1.2058823529411764,0.0431817951873436,136,114,16,6,False,True,36
877,But I don't want to be the poop emoji.,1.2058823529411764,0.0444252169097161,136,115,14,7,False,True,38
877,"I don’t understand. I responded with a “k”, is that bad?",1.2058823529411764,0.0405808145784977,136,112,20,4,True,True,56
877,"‘Omg, you millennials need to grow up!’",1.2058823529411764,0.0456347713848658,136,116,12,8,False,False,39
877,"C'mon guys, he JUST died.",1.205607476635514,0.0473943111512617,107,89,14,4,False,True,25
877,Maybe it's time to ditch the Blackberry?,1.2053571428571428,0.0459743522470292,112,93,15,4,True,True,40
877,Did you pick it or did it pick you?,1.2053571428571428,0.0441901109260744,112,92,17,3,True,True,35
877,I thought I was assface.,1.205298013245033,0.0413010065083774,151,127,17,7,False,True,24
877,"So, kids, to write an email, you use the ‘letters’ of what we used to call the ‘Al..pha..bet.’",1.205128205128205,0.0429848285055057,117,96,18,3,False,False,94
877,I need a good emoji to capture the true meaning of Christmas,1.205128205128205,0.0462862821395627,117,98,14,5,False,False,60
877,I need new friends .,1.205128205128205,0.0462862821395627,117,98,14,5,False,True,20
877,"Oh boy, nobody’s getting my message.",1.205128205128205,0.0394077536659002,117,94,22,1,False,True,36
877,Can’t we just talk to each other??,1.204724409448819,0.04083031282442,127,104,20,3,True,True,34
877,I'm not sure I'm ready to wear my heart emoji on my sleeve.,1.204724409448819,0.0451892418192498,127,107,14,6,False,True,59
877,Anyone of you guys ever experienced being at a loss for words?,1.204724409448819,0.0437845086674015,127,106,16,5,True,True,62
877,I will NOT be the egg plant!,1.204724409448819,0.0437845086674015,127,106,16,5,False,True,28
877,I think I’ve been hit by the “normal” virus.,1.204225352112676,0.040645491482586,142,118,19,5,False,True,44
877,My emoji is already taken.,1.2040816326530612,0.0385396156770621,147,121,22,4,False,True,26
877,This is my disgusted emoji.,1.2035398230088497,0.0438349897536935,113,93,17,3,False,True,27
877,"I use the ""empty and defeated"" one.",1.2035398230088497,0.0489447623897759,113,96,11,6,False,True,35
877,"Maybe something like an avocado, but with a festive Christmas sweater and some New Year's glasses.",1.2035398230088497,0.0456019093854795,113,94,15,4,False,True,98
877,How come no-one told me it was avatar day?,1.2033898305084745,0.0443200305397026,118,98,16,4,True,True,42
877,I gotta stop taking psychedelics.,1.2033898305084745,0.0443200305397026,118,98,16,4,False,True,33
877,No wonder I don't have any likes!?,1.2033898305084745,0.0443200305397026,118,98,16,4,True,True,34
877,Me at work.,1.2033898305084745,0.0426544318376878,118,97,18,3,False,True,11
877,I have no response to that.,1.2033898305084745,0.0459252616615777,118,99,14,5,False,True,27
877,I still don’t see why I have to be the eggplant,1.2032520325203253,0.0446517909251838,123,103,15,5,False,False,47
877,So many choices. So little time.,1.2032520325203253,0.0446517909251838,123,103,15,5,False,True,32
877,Why do I have to put on a face to be OK?,1.2032520325203253,0.0475430591724589,123,105,11,7,True,True,40
877,You said these were normal brownies!,1.203125,0.0405416315990925,128,105,20,3,False,True,36
877,What do I use for 'apathetic'?,1.203125,0.0405416315990925,128,105,20,3,True,True,30
877,Um what does the human face emoji mean?,1.203125,0.0462141739834058,128,109,12,7,True,True,39
877,"The millennial urge to write ""lol"" is stronger guys, sorry.",1.203125,0.0420315998836533,128,106,18,4,False,True,59
877,"Somehow, I'm not in sync with you all.",1.2030075187969924,0.0410049740191183,133,110,19,4,False,True,38
877,I told you I’m not getting the update until the bugs are worked out.,1.2030075187969924,0.0423713235674944,133,111,17,5,False,True,68
877,So I guess this makes me the eggplant?,1.2030075187969924,0.0423713235674944,133,111,17,5,True,True,38
877,But Mama said to use my words.,1.2028985507246377,0.0400457533339303,138,114,20,4,False,True,30
877,Has Mensa been taken over by A.I.?,1.2019230769230769,0.0518150897646293,104,89,9,6,True,True,34
877,Well…ANDROIDS HAVE BETTER CAMERA QUALITY!,1.2019230769230769,0.0440224662845252,104,85,17,2,False,True,41
877,Why do I always have to be the poop emoji!,1.201834862385321,0.0483850939298912,109,92,12,5,False,True,42
877,Not fair.  I had first dibs on the peach.,1.201834862385321,0.0501099988017551,109,93,10,6,False,True,41
877,Can we go back to judging people by their looks?,1.201834862385321,0.0483850939298912,109,92,12,5,True,True,48
877,Plastic surgery has gone too far,1.201834862385321,0.0483850939298912,109,92,12,5,False,False,32
877,I'll stick with overwhelmed human.,1.2017543859649122,0.0485463660865423,114,97,11,6,False,True,34
877,I'm thinking about rejoining my book club.,1.2017543859649122,0.046920083813689,114,96,13,5,False,True,42
877,All my friends express their emotions but me.,1.2016806722689075,0.0439792390792087,119,99,16,4,False,True,45
877,"Sometimes an eggplant is JUST an eggplant, right ??!?!?",1.2016806722689075,0.0423289926254919,119,98,18,3,True,True,55
877,That does it! I'm never using the poop emoji again.,1.2016806722689075,0.0439792390792087,119,99,16,4,False,True,51
877,"Oh my god! Someone just sent me a… wait, never mind, it’s just Jen’s face.",1.2016129032258065,0.0412559172649555,124,102,19,3,False,True,74
877,So I'm just Cisgender?,1.2016129032258065,0.0457759952383053,124,105,13,6,True,True,22
877,I cannot render my feelings in visual shorthand! I guess I'm mad.,1.2016129032258065,0.0457759952383053,124,105,13,6,False,True,65
877,Anybody else having trouble connecting?!?,1.2016129032258065,0.0443205527548546,124,104,15,5,True,True,41
877,"Oh, sure. YOU don’t have to worry about facial recognition software!",1.2014388489208634,0.0410729013515105,139,116,18,5,False,True,68
877,"Don’t even think about suggesting eggplant""",1.2013422818791946,0.0380695347601701,149,123,22,4,False,False,43
877,"I’m getting a headache from all this screen time, how about you?",1.2,0.0425023718503241,125,104,17,4,True,True,64
877,I guess I am the only one with an android!,1.2,0.0436435780471984,120,100,16,4,False,True,42
877,Is a ‘Pumpkin Head’ already taken?,1.2,0.0414409509425982,130,108,18,4,True,True,34
877,"For the first time, Elaine was grasping the value of adopting a personal emoji.",1.2,0.0465433698652496,115,97,13,5,False,True,79
877,"If you're all willing to enter rehab and turn in your phones, there's a chance we can retrieve your brains.",1.2,0.0422091127056978,145,123,15,7,False,True,107
877,I was drawn in 1977. This is all so strange.,1.2,0.0424440955969441,110,90,18,2,False,True,44
877,Is that a yes to pizza or...,1.2,0.0462072785806326,110,92,14,4,False,True,28
877,Can you send me the link to that AI plastic surgery clinic?,1.2,0.0390602714953045,135,111,21,3,True,True,59
877,I’m at a loss for emojis,1.2,0.0452196630590152,120,101,14,5,False,False,24
877,Be honest… does my complex mix of emotions make me look old?,1.2,0.0417949931010161,135,113,17,5,True,True,60
877,I can’t find an eggplant in this town,1.2,0.0414409509425982,130,108,18,4,False,False,37
877,I received a text from my aunt. What does LOL mean?,1.198717948717949,0.0400783680144586,156,132,17,7,True,True,51
877,They're asking for DNA's.,1.1984732824427482,0.0465104655864844,131,113,10,8,False,True,25
877,You are what you tweet.,1.1984126984126984,0.0406609539622806,126,104,19,3,False,True,23
877,I've got to get some new friends that have more depth than one emoji.,1.1984126984126984,0.0390682614168915,126,103,21,2,False,True,69
877,Am I that hard to read?,1.1984126984126984,0.0406609539622806,126,104,19,3,True,True,23
877,It says my character has already been taken?,1.1984126984126984,0.0451028331490947,126,107,13,6,True,True,44
877,When you think you know your friends until you get into a group text with them.,1.1984126984126984,0.0390682614168915,126,103,21,2,False,True,79
877,I feel totally naked.,1.1984126984126984,0.0421935694639222,126,105,17,4,False,True,21
877,"ah hell nah why’s everyone a emoji? his face is on fire dude, what the fuck.",1.1984126984126984,0.0451028331490947,126,107,13,6,True,True,76
877,So NONE of you guys are on Android?,1.1983471074380163,0.0448748408082749,121,102,14,5,True,True,35
877,Can we take another? My face looks fat in this one.,1.1983471074380163,0.0448748408082749,121,102,14,5,True,True,51
877,The new art of conversation.,1.1983471074380163,0.0463841824806686,121,103,12,6,False,True,28
877,I'm just not a conversationalist.,1.1983471074380163,0.0448748408082749,121,102,14,5,False,True,33
877,Love your Karen emoji!!!,1.1983471074380163,0.0448748408082749,121,102,14,5,False,True,24
877,Cooler heads will prevail,1.1983471074380163,0.0416925562169568,121,100,18,3,False,False,25
877,I think I missed the latest iOS update.,1.1983471074380163,0.0433129344507626,121,101,16,4,False,True,39
877,"Our ancestors would spend a year in the wilderness. They would leave as naked children and returned as trophy-clad adults.

It’s like that, but with Instagram",1.1982758620689655,0.0461725912619068,116,98,13,5,False,False,158
877,There isn't one that captures me right now.,1.1982758620689655,0.0428025479250545,116,96,17,3,False,True,43
877,Guys - I swear. I have no idea why my messages are going through as green.,1.1982758620689655,0.0428025479250545,116,96,17,3,False,True,74
877,I'm sorry if you think that my time on social media is giving me an unrealistic body image.,1.1982758620689655,0.0508102676265623,116,101,7,8,False,True,91
877,I see the latest software installation uploads the Four Emojis of the Apocalypse,1.1982758620689655,0.0428025479250545,116,96,17,3,False,False,80
877,It seems that I would be the lone Rutabaga.,1.1981981981981982,0.0475782381995722,111,94,12,5,False,True,43
877,What do you mean I don't look like my profile picture?,1.19811320754717,0.0491066853351966,106,90,11,5,True,True,54
877,Is this part of the new update?,1.19811320754717,0.0491066853351966,106,90,11,5,True,True,31
877,I see emoji people 👻,1.19811320754717,0.045299862096652,106,88,15,3,False,False,20
877,"Are there any, like, less dramatic emoji head options?",1.196969696969697,0.0379307993596769,132,108,22,2,True,True,54
877,"Forget Mom, what do I tell his kids?",1.1968503937007875,0.0403697602810491,127,105,19,3,True,True,36
877,"What do you mean I'm a ""Karen""?",1.1967213114754098,0.0474799771149746,122,105,10,7,True,True,31
877,You might want to try a different peach.,1.1967213114754098,0.0429871985152189,122,102,16,4,False,True,40
877,But I don’t want to be a zucchini,1.1967213114754098,0.0445351797242442,122,103,14,5,False,False,33
877,"Hi, my name is Sue.",1.1967213114754098,0.0429871985152189,122,102,16,4,False,True,19
877,What do you mean I’m the crying emoji of the group?,1.1967213114754098,0.0429871985152189,122,102,16,4,True,True,51
877,You’re all being too emojional,1.1967213114754098,0.041381351346989,122,101,18,3,False,False,30
877,I feel like I preferred the OLD Fruit of the Loom team,1.1965811965811963,0.0441698424684693,117,98,15,4,False,False,54
877,I hate it when we talk politics.,1.1964285714285714,0.0417584941425998,112,92,18,2,False,True,32
877,Where's my opt-out button?,1.1964285714285714,0.0436422615584104,112,93,16,3,True,True,26
877,Did I just made the group chat weird again?,1.1964285714285714,0.0488597224363605,112,96,10,6,True,True,43
877,I usually wear my emoticons on my sleeve.,1.1964285714285714,0.0454480159611821,112,94,14,4,False,True,41
877,Who ARE these people?,1.1962616822429906,0.0468346539037722,107,90,13,4,True,True,21
877,I can’t find the emoji that fits my innermost feelings!,1.1962616822429906,0.0449126826523529,107,89,15,3,False,True,55
877,I am disappointed . All the good ones are taken.,1.196078431372549,0.0441472969242536,102,84,16,2,False,True,48
877,Is this the casting for the adult version of 'Inside Out'?,1.196078431372549,0.0483451956997591,102,86,12,4,True,True,58
877,This is the only face I have for that comment!,1.1958762886597938,0.045500215384417,97,80,15,2,False,True,46
877,Whose breath smells like ass?,1.1953125,0.0430427847341145,128,108,15,5,True,True,29
877,"If that’s true, I guess I’d better stop using the grinning poop emoji so freely.",1.1953125,0.0415890589170316,128,107,17,4,False,True,80
877,Why do I have to be the poo?  I don't want to be the poo.  I'm always the poo!,1.1953125,0.0415890589170316,128,107,17,4,True,True,78
877,Eggplant says he isn’t coming!,1.1953125,0.0415890589170316,128,107,17,4,False,True,30
877,There's an app for that?,1.195121951219512,0.0456833677612845,123,105,12,6,True,True,24
877,I’ve always had trouble expressing myself in groups.,1.195121951219512,0.0426662635739663,123,103,16,4,False,True,52
877,I wish you guys would just say what you mean.,1.195121951219512,0.0410746883863817,123,102,18,3,False,True,45
877,Enough! Can we all just f@#% already?!,1.195121951219512,0.0442005663842441,123,104,14,5,True,True,38
877,Hothead? Airhead? Fruitcake? Where do I start?,1.194915254237288,0.0454482950903764,118,100,13,5,True,True,46
877,"I feel so...human.""",1.194915254237288,0.0438255972575128,118,99,15,4,False,False,19
877,Emoji is now the most spoken language in the world? I’ll never conform. Guys?,1.194915254237288,0.0421404606445338,118,98,17,3,True,True,77
877,How do I tell him I just want to have dinner?,1.1946902654867255,0.0450775548151287,113,95,14,4,True,True,45
877,Everyone wants to be anonymously famous these days.,1.194174757281553,0.0458817051092486,103,86,14,3,False,True,51
877,How did you all know that I’m AI generated?,1.194174757281553,0.0391666776282258,103,83,20,0,True,True,43
877,Note to self: delete poop emoji from phone.,1.194174757281553,0.0437580101767949,103,85,16,2,False,True,43
877,"And for our next lesson, we’ll learn to use A.I. for more practical purposes",1.193798449612403,0.0427346454868216,129,109,15,5,False,False,76
877,My lack of a colorful online identity is dating me.,1.1935483870967742,0.0438708906063714,124,105,14,5,False,True,51
877,So . . Happy - Fire - Evil - Ass . . what's next?,1.1935483870967742,0.0391313686434772,124,102,20,2,True,True,49
877,It's just a mirror selfie,1.1935483870967742,0.0423500259626214,124,104,16,4,False,False,25
877,"Oh snap, You mean you did not realize it was an emoji masquerade party until now?Whoa How embarrassing!",1.1935483870967742,0.0423500259626214,124,104,16,4,True,True,103
877,"Sadly, I’m the last of the Mojicants",1.1932773109243695,0.0434866122748136,119,100,15,4,False,False,36
877,Don't tell me poop is coming too!,1.1932773109243695,0.0434866122748136,119,100,15,4,False,True,33
877,Sandra regretted saying her Eggplant Parmesan was the key part of her identity.,1.1932773109243695,0.0466470272764993,119,102,11,6,False,True,79
877,"I preferred my old identity crisis; I didn't have so many to choose from.""",1.1929824561403508,0.0464166896677998,114,97,12,5,False,False,74
877,The creators refuse to approve me because there’s no market for “boring”.,1.1929824561403508,0.0429418011902956,114,95,16,3,False,True,73
877,That's your response?!  She was just asking if you're free Saturday night.,1.1926605504587156,0.0460411408384759,109,92,13,4,True,True,74
877,I don't know how to express myself.,1.1926605504587156,0.0460411408384759,109,92,13,4,False,True,35
877,Does this mean you like my suggestion that we go to a club?,1.1926605504587156,0.0478506145730217,109,93,11,5,True,True,59
877,Look at that. I guess manifesting does work.,1.1926605504587156,0.0401260844561969,109,89,19,1,False,True,44
877,"Oh, fuck!",1.1926605504587156,0.0512783643033872,109,95,7,7,False,True,9
877,I cannot remember that many pronouns.,1.1925925925925926,0.0427060042232472,135,115,14,6,False,True,37
877,When did words become so passe?,1.1923076923076923,0.043375419446059,104,86,16,2,True,True,31
877,I feel like my emoji makes me look fat,1.1923076923076923,0.0474851556477788,104,88,12,4,False,False,38
877,Imagine what would happen if we all put our heads together?,1.192,0.0435460453372763,125,106,14,5,True,True,59
877,Maybe I do spent to much time on my phone.,1.192,0.0420383849172588,125,105,16,4,False,True,42
877,"If a zucchini shows up, I'm out of here.",1.1919191919191918,0.0422924989603257,99,81,17,1,False,True,40
