contest,caption,mean,precision,votes,not_funny,somewhat_funny,funny,has_question_mark,ends_with_punctuation,caption_length
821,You shoulda heard the mocking birds this morning.,1.8625247851949769,0.0121049439527259,4539,1864,1435,1240,False,True,49
821,The ego has landed.,1.8355359765051396,0.0112692523259169,5448,2406,1532,1509,False,True,19
821,He does this every time National Geographic shows up.,1.8161261529306751,0.0136831530431922,3361,1423,1133,805,False,True,53
821,"Ed’s single again, eh?",1.775638506876228,0.0153165395123205,2545,1109,898,538,True,True,22
821,Witness protection.,1.7500870170553429,0.0143982410445425,2873,1304,983,586,False,True,19
821,First it was tail feather extensions and now this.,1.734489402697495,0.0149578072066547,2595,1189,906,500,False,True,50
821,You're the one that kept playing Elvis songs while he was in the egg.,1.7341490545050056,0.018103533887665,1798,832,612,354,False,True,69
821,Aren't we supposed to be bald? Like isn't that the whole point?,1.7250233426704016,0.0164503295999393,2142,996,739,407,True,True,63
821,Bet you can’t guess which President changed the national symbol to the comb-over eagle.,1.7209302325581397,0.0172468668690346,2107,1036,623,448,False,True,87
821,Ed doesn't get it — 'bald' is our brand.,1.71964461994077,0.0169934914401277,2026,956,682,388,False,True,40
821,Ten bucks says he voted for Trump.,1.717808219178082,0.0188728848490963,1825,923,494,408,False,True,34
821,Ever since the pink flamingo moved in downstairs.,1.7172260924635845,0.0133524008568921,3158,1469,1116,573,False,True,49
821,"I know we're endangered, but at this point he just looks desperate.",1.7138714354760751,0.0169316028283469,2069,994,673,402,False,True,67
821,That’s a bold eagle.,1.7135441245870693,0.0167363262571069,2119,1019,688,412,False,True,20
821,You know it's bad when the national bird is in denial!,1.7130307467057102,0.0211174538806755,1366,668,422,276,False,True,54
821,Make America bald again.,1.7110055423594617,0.0157641998953828,2526,1263,730,533,False,True,24
821,It’s only worn for mating season and then becomes part of the nest.,1.7057356608478802,0.0188034964801243,1604,760,556,288,False,True,67
821,And you wonder why we're endangered.,1.703178858674837,0.0147914187781051,2611,1248,890,473,False,True,36
821,Probably overcompensating for a small nest.,1.7010663914688682,0.0142159299738215,2907,1418,940,549,False,True,43
821,Pretend you don't notice it. It drives him crazy!,1.6985915492957746,0.0162434378912605,2130,1016,740,374,False,True,49
821,Wind. Wait for it.”,1.6976076555023925,0.0170209454456658,2090,1044,634,412,False,False,19
821,He looks ten years stupider.,1.6951685783802573,0.0145996824862405,2877,1454,846,577,False,True,28
821,His old flock is having a reunion.,1.692575406032483,0.0147308877615454,2586,1245,891,450,False,True,34
821,He always flies south to Graceland.,1.692018072289157,0.0205614601729954,1328,640,457,231,False,True,35
821,"Wigged eagle doesn’t have quite the same ring to it, does it?",1.6839378238341969,0.0180412394289002,1737,852,582,303,True,True,61
821,Just flew in from Memphis.,1.6815487949427104,0.0147721224419242,2531,1230,877,424,False,True,26
821,He heard that bald eagles are endangered.,1.6732473811442383,0.0150026477508295,2482,1231,831,420,False,True,41
821,Wait til he takes off and the rug doesn't.,1.672455378678244,0.0167882453039513,2073,1056,640,377,False,True,42
821,He’s having a mid-flight crisis.,1.6688128772635815,0.0146147045381771,2485,1207,894,384,False,True,32
821,Just give it one windy day.,1.6676767676767676,0.0165041869027977,1980,972,694,314,False,True,27
821,A toupee? It will never fly!,1.6650887573964497,0.0149132469538744,2535,1281,822,432,True,True,28
821,"If that catches on, we'll be endangered all over again.",1.6648441771459814,0.0173939660179722,1829,915,612,302,False,True,55
821,He migrated through Memphis.,1.6640119462419114,0.016514506079925,2009,1001,682,326,False,True,28
821,"He says he's just an ""eagle"" now.",1.661856661856662,0.0161535095492561,2079,1034,714,331,False,True,33
821,He also paints his talons.,1.6575342465753424,0.0148552558261247,2482,1250,832,400,False,True,26
821,"Yeah, and he also just bought a Corvette.",1.6555555555555554,0.0163107828940054,2070,1046,689,335,False,True,41
821,Am I sure? Are you kidding? I can literally spot a toupee from a mile away.,1.6535117056856188,0.0190260764325702,1495,753,507,235,True,True,75
821,I hear he's running for office.,1.651487553126897,0.0181388386863441,1647,833,555,259,False,True,31
821,Act like you don’t notice.,1.648609077598829,0.0192831979308834,1366,671,504,191,False,True,26
821,"He's got great vision, but no awareness.",1.6405135520684735,0.0198356197042458,1402,729,448,225,False,True,40
821,And he's getting a Porsche.,1.640442132639792,0.0190754879379591,1538,806,479,253,False,True,27
821,Don’t be cruel.,1.6383186705767352,0.0235162182410737,1023,541,311,171,False,True,15
821,"It looks great now, but it's a hot mess when he goes fishing.",1.6355555555555557,0.0216842756763414,1125,577,381,167,False,True,61
821,His ex left him for a black crowned night heron. Let him have this.,1.6280637254901962,0.0179457993985124,1632,845,549,238,False,True,67
821,"And besides that,he got implants to lengthen his wingspan.",1.6241737488196413,0.0229945261397015,1059,570,317,172,False,True,58
821,You should see what it looks like when he’s flying.,1.6146723646723646,0.0191256401349827,1404,738,472,194,False,True,51
821,"Last mating season, he had a mohawk.”",1.6144578313253013,0.0184480805136038,1660,912,476,272,False,False,37
821,He calls it a Mo' Hawk.,1.610664718772827,0.019709111133471,1369,734,434,201,False,True,23
821,"I still hate him, but now I also hate his hair.",1.599320882852292,0.0210245474051885,1178,637,376,165,False,True,47
821,Elvis has just left the nest,1.595724907063197,0.0219468367171343,1076,584,343,149,False,False,28
821,You tell him.  Most chicks dig bald.,1.592115238817286,0.0212438107700485,1319,771,315,233,False,True,36
821,More like bird of spray...,1.5892857142857142,0.0233612395044841,1008,569,284,155,False,True,26
821,"Should we tell him it's just a word, not a condition?",1.5873893805309736,0.0240739113719858,904,500,277,127,True,True,53
821,"Duane's never come to terms with being a Bald Eagle.""",1.5870253164556962,0.0206753541249415,1264,710,366,188,False,False,53
821,He looks ten years less endangered.,1.5865209471766848,0.0227659304324217,1098,633,286,179,False,True,35
821,He uses every part of the rodent.,1.5818505338078293,0.0232694766302158,1124,675,244,205,False,True,33
821,Yeesh. For this we struggled back from the brink of extinction?,1.5811001410437235,0.0269501191350612,709,393,220,96,True,True,63
821,We aren’t actually bald.,1.5784851811196488,0.023965510151702,911,511,273,127,False,True,24
821,Quite a wig span.,1.5721295387634937,0.0229726261841985,1019,585,285,149,False,True,17
821,Wait—we're allowed to grow it out ?,1.568292682926829,0.0260911156200299,820,482,210,128,True,True,35
821,"You see husband material, I see nest material.",1.5641592920353982,0.0259635028712008,904,558,182,164,False,True,46
821,"Just wait till he takes flight, we’re called bald eagles for a reason.",1.5637813211845102,0.0255313490752806,878,526,209,143,False,True,70
821,"O.K., let's just go extinct.",1.561549100968188,0.0266597261284351,723,421,201,101,False,True,28
821,Oh that? He ditches it after mating season.,1.5607264472190692,0.0244905036326114,881,511,246,124,True,True,43
821,Sometimes bald is better.,1.5585042219541616,0.0253301293208875,829,484,227,118,False,True,25
821,"Obviously, he’s planning a flight to Memphis.",1.55622009569378,0.0244809058574373,836,477,253,106,False,True,45
821,"Don't yell, he's declassifying documents",1.5503778337531486,0.0265095512409485,794,480,191,123,False,False,40
821,He also had a beak job.,1.5446559297218154,0.0265920209097155,683,391,212,80,False,True,23
821,Just be grateful it isn't orange.,1.5430809399477807,0.0270912271333315,766,470,176,120,False,True,33
821,He's just compensating for those tiny little talons of his.,1.5410557184750733,0.0278159147799795,682,408,179,95,False,True,59
821,Identifies as 'Eagle' now,1.5406562054208277,0.0270139974640591,701,414,195,92,False,False,25
821,I thought the pompadour was extinct.,1.5393759286775632,0.0297102737882796,673,426,131,116,False,True,36
821,It's just Eagle now.,1.5390070921985817,0.0285720675121278,705,440,150,115,False,True,20
821,mating season,1.53698224852071,0.0266500377058612,676,391,207,78,False,False,13
821,Should we tell him it's on backwards?,1.535919540229885,0.0277726149593742,696,423,173,100,True,True,37
821,"I took half a day off work, we hired a babysitter, you had your feathers highlighted and we flew 3 hours to get here and your not even going to ask him for his autograph?",1.5355029585798816,0.028094106633114,676,410,170,96,True,True,170
821,He recently became an empty nester.,1.5348101265822784,0.0282931610461461,632,375,176,81,False,True,35
821,He says he wants to date younger chicks...,1.5314009661835748,0.0293930110156293,621,380,152,89,False,True,42
821,Is it me or does Bob seem a lot more confident lately?,1.5303514376996803,0.0273153784200972,626,362,196,68,True,True,54
821,Wait till the mockingbird sees that.,1.5292207792207793,0.0287655622300301,616,370,166,80,False,True,36
821,"If this catches on, we'll go extinct.",1.5265957446808511,0.0297269879570879,564,337,157,70,False,True,37
821,He looked better bald.,1.5265700483091786,0.0282289184305088,621,370,175,76,False,True,22
821,"Hey, it’s Avis Presley!",1.525987525987526,0.0322362663901653,481,288,133,60,False,True,23
821,You're his father.  You talk to him!,1.523156089193825,0.0289023264818856,583,347,167,69,False,True,36
821,He thinks it makes his beak look smaller.,1.521103896103896,0.0290509825211946,616,378,155,83,False,True,41
821,I'd rather be endangered.,1.521079258010118,0.0284420342251494,593,352,173,68,False,True,25
821,"Yeah, and I’m a mockingbird.",1.5202429149797572,0.0326296405811962,494,305,121,68,False,True,28
821,He says he can catch prey just by thinking about it.,1.5195035460992907,0.031883297607713,564,362,111,91,False,True,52
821,You get one and I'm moving out of the nest.,1.5163265306122449,0.0321956030207096,490,300,127,63,False,True,43
821,Those aren't his feathers either.”,1.5152,0.0308887831271632,625,411,106,108,False,False,34
821,You'd understand if you saw the size of his nest.,1.509433962264151,0.0306435178922156,477,281,149,47,False,True,49
821,I'd rather be a Bald Eagle than a Mid-Life Crisis Eagle.,1.5083798882681565,0.0318624892203699,537,343,115,79,False,True,56
821,I'm pretty sure it's a toupee.,1.505813953488372,0.0312181233907596,516,320,131,65,False,True,30
821,"Kind of dilutes our brand, don’t you think?",1.505112474437628,0.03133023200229,489,298,135,56,True,True,43
821,You scream liberty. He screams Liberace.,1.5041152263374489,0.0333073444281102,486,311,105,70,False,True,40
821,"To be fair, he does suffer from Owlopecia.",1.5033557046979866,0.0325900747559337,447,272,125,50,False,True,42
821,"Next, he’ll be having his beak done.",1.503325942350333,0.0306571702805496,451,263,149,39,False,True,36
821,"Actually it’s working out really well . All the mice and squirrels see him coming but are laughing so hard they forget to run.
We’re eating like royalty.",1.5010183299389002,0.0321545409751155,491,308,120,63,False,True,153
821,Just don't refer to it as a bird's nest.,1.5,0.0326441977809817,460,285,120,55,False,True,40
821,"This is what a national identity crisis looks like.""",1.499009900990099,0.0302076152559303,505,306,146,53,False,False,52
821,I understand he just bought a Corvette too.,1.4989690721649485,0.0317913586587833,485,301,126,58,False,True,43
821,"One one hand he’s no longer the national bird, on the other hand  the chicks totally dig him.",1.497854077253219,0.031167674638855,466,281,138,47,False,True,93
821,"I'm telling you, it's a rug",1.4973958333333333,0.035370470675086,384,237,103,44,False,False,27
821,He's the president of Hair Club for Birds.,1.4960212201591512,0.0354603404628427,377,232,103,42,False,True,42
821,It’ll fly off when he does.,1.4959677419354838,0.0329147679076618,496,321,104,71,False,True,27
821,"He's going by just ""eagle"" now.",1.4957081545064377,0.0328960717392851,466,294,113,59,False,True,31
821,Why does he keep saying “thank you very much?”,1.4953917050691243,0.032170714008674,434,262,129,43,True,False,46
821,"What’s next, a beak lift?",1.4944320712694878,0.0317078753338615,449,272,132,45,True,True,25
821,And all this time I thought he was gathering it to build a nest.,1.494145199063232,0.0349925708001277,427,274,95,58,False,True,64
821,I never felt bald until now.,1.492099322799097,0.0323347590298999,443,272,124,47,False,True,28
821,He hasn't been the same since he saw 'Elvis.',1.4917647058823529,0.0331663463271673,425,262,117,46,False,False,45
821,Oh I’ll admit it makes him a chick magnet but it hurts our brand.,1.491304347826087,0.0329305889342942,460,291,112,57,False,True,65
821,He calls it a mid-flight crisis.,1.4910714285714286,0.0323802312371524,448,277,122,49,False,True,32
821,"He’s not only our national symbol, he knows all of Elvis’ songs.",1.49010989010989,0.0318618713730171,455,280,127,48,False,True,64
821,Being called a ‘toupee eagle’ just isn’t as majestic,1.4895287958115184,0.0343229694164751,382,233,111,38,False,False,52
821,You know what's really endangered? Common sense.,1.4886075949367088,0.0353699874133473,395,250,97,48,True,True,48
821,"Oh, him? Says it's species rebranding. He calls the look 'bold' eagle.",1.4867256637168142,0.0335107938442976,452,290,104,58,True,True,70
821,Like we all don't know he's bald.,1.4866666666666666,0.0336230910155983,450,289,103,58,False,True,33
821,He's just compensating for a small wingspan.,1.4863523573200992,0.0332098007826758,403,246,118,39,False,True,44
821,It's just disrespectful: we're bald eagles for a reason.,1.4863013698630136,0.033857755350203,438,280,103,55,False,True,56
821,"Being bald never bothered me before, but now-",1.4861751152073732,0.0318320130496849,434,264,129,41,False,False,45
821,"And the worst part is, now he thinks he can sing.",1.4834123222748816,0.0346564071245617,422,272,96,54,False,True,49
821,I dare you to snatch it.,1.4824120603015076,0.0346199705635692,398,251,102,45,False,True,24
821,He didn't like being a bald eagle.,1.482233502538071,0.0348793174753989,394,249,100,45,False,True,34
821,"Yeah, it looks good now. Wait until he has to fly!",1.4817351598173516,0.0324341282002986,438,273,119,46,False,True,50
821,He's flying incognito.,1.4812967581047385,0.0315941499294055,401,238,133,30,False,True,22
821,Not even Darwin could have anticipated a combover.,1.4794871794871796,0.0347629521166551,390,246,101,43,False,True,50
821,Oh look who suddenly thinks he’s not endangered.,1.4793814432989691,0.0335320389592854,388,238,114,36,False,True,48
821,"Yeah, but the chicks love it.",1.4791666666666667,0.0340453489102131,432,279,99,54,False,True,29
821,You'd think a symbol of an entire nation would be more self-confident.,1.4783783783783784,0.0344811206608214,370,228,107,35,False,True,70
821,What's next? A beak job,1.477900552486188,0.0363131559470807,362,230,91,41,True,False,23
821,"From two miles away, you can't even tell.",1.476958525345622,0.0324817362907209,434,272,117,45,False,True,41
821,He's part of a flock that flew in from Mar a Lago.,1.4767726161369192,0.0354771111085932,409,268,87,54,False,True,50
821,I thought our whole thing was being bald,1.476683937823834,0.0367118089588887,386,254,80,52,False,False,40
821,He just flew in from Graceland.,1.4759358288770053,0.0352442514843315,374,236,98,40,False,True,31
821,"Yeah, it’s a bit much, but sometimes you just want to run your talons through it.",1.4723756906077348,0.0356647070172394,362,229,95,38,False,True,81
821,He just can't accept being a bald eagle,1.471698113207547,0.0360556976463526,371,239,89,43,False,False,39
821,"Well, it's either fake or evolution has rounded a corner.",1.4705882352941178,0.0356140005879306,391,255,88,48,False,True,57
821,"Looking at it helps me regurgitate food for the chicks.""",1.4694444444444446,0.0383083856577909,360,241,69,50,False,False,56
821,"Actually that's my mother.  
She's auditioning for a role as a partridge in a pear tree.",1.4680851063829787,0.0367718043389985,329,207,90,32,False,True,88
821,Let’s see what happens to it when he actually tries to fly.,1.46684350132626,0.0352199501422101,377,242,94,41,False,True,59
821,Pretend not to notice. It really drives him crazy.,1.466501240694789,0.0335447936412483,403,256,106,41,False,True,50
821,"He does know we're aren't really bald, right?",1.4662921348314606,0.0349751234834673,356,223,100,33,True,True,45
821,I talked him out of the orange one.,1.4656716417910447,0.0386744369486046,335,221,72,42,False,True,35
821,"Everyone knows it's a toupee. I mean, we're bald eagles.",1.465648854961832,0.0360116896967467,393,261,81,51,False,True,56
821,He doesn't identify as 'bald.',1.4656084656084656,0.0359380715669435,378,247,86,45,False,False,30
821,There's still a bald spot.,1.4652278177458034,0.0325457303312708,417,263,114,40,False,True,26
821,"Please, I know a bald eagle when I see one.",1.4643874643874644,0.0369034251305242,351,228,83,40,False,True,43
821,I’ve seen better weaves in a bird’s nest.,1.4642857142857142,0.0376517810320409,336,218,80,38,False,True,41
821,"What part of ""bald"" does he not get?",1.46242774566474,0.0388331483337834,346,233,66,47,True,True,36
821,Look who wants to be on the cover of National Geographic.,1.4623655913978495,0.0363614356582223,372,245,82,45,False,True,57
821,"He's dating a chick half his age, too.",1.4615384615384617,0.0385847977446007,325,213,74,38,False,True,38
821,You don't need eagle eyes to spot that toupée.,1.4613095238095235,0.0376430018963558,336,219,79,38,False,True,46
821,He does a really good rendition of “Love Me Tender”…,1.4608695652173913,0.0355184219909654,345,218,95,32,False,False,52
821,Now women are flocking to him.,1.4599483204134367,0.0380371165317114,387,269,58,60,False,True,30
821,He just got back from Elvis convention.,1.4597014925373135,0.0374833916389046,335,218,80,37,False,True,39
821,That combover won't fly.,1.4594594594594594,0.0358929261172262,370,242,86,42,False,True,24
821,"He told me that if the former President can, why can't he.",1.4591194968553458,0.0381829095520678,318,206,78,34,False,True,58
821,He summered at Graceland.,1.4585635359116025,0.0354122108674744,362,233,92,37,False,True,25
821,Did you notice his small claws?,1.4573170731707317,0.0387921855517681,328,218,70,40,True,True,31
821,It also comes in orange.,1.4572271386430675,0.039649213451659,339,232,59,48,False,True,24
821,My guess? Mid-flight crisis.,1.4570552147239264,0.0343343322490417,326,199,105,22,True,True,28
821,He ain’t never caught a rabbit and he ain’t no friend of mine!,1.4564564564564564,0.0406425892456457,333,231,52,50,False,True,62
821,"But underneath it all, he has the brain of a bird.",1.4558823529411764,0.0363550840101685,340,219,87,34,False,True,50
821,Now he doesn't identify as a bald eagle.,1.455470737913486,0.0337491657969761,393,253,101,39,False,True,40
821,He's compensating for a small beak.,1.4550724637681158,0.0366660871650906,345,225,83,37,False,True,35
821,Turns out he really was bald.,1.4550264550264551,0.0351166527857456,378,247,90,41,False,True,29
821,"He says it's natural selection.  I say it's a rug.""",1.4545454545454546,0.0367454510714945,341,222,83,36,False,False,51
821,He says it makes him look Presidential.,1.4537037037037035,0.0376447956331753,324,211,79,34,False,True,39
821,Just more proof that an apex predator can be a total moron.,1.452991452991453,0.037523495173877,351,235,73,43,False,True,59
821,He's flying to Vegas for the Winter,1.452247191011236,0.0369115702083936,356,237,77,42,False,False,35
821,But can he sing?,1.4518072289156627,0.0357219986041899,332,211,92,29,True,True,16
821,Rogaine evidently works.,1.4512987012987013,0.0365430381148861,308,194,89,25,False,True,24
821,You're the one who wanted to nest in Memphis.,1.451219512195122,0.036796091370551,328,212,84,32,False,True,45
821,The cover-up is always worse than the crime.,1.450657894736842,0.039711356022823,304,202,67,35,False,True,44
821,"Sure, he looks younger, but he’s still no good in the nest.",1.45016077170418,0.0393096600350539,311,207,68,36,False,True,59
821,Obviously he’s having a mid-flight crisis.,1.4491803278688524,0.0390601258666919,305,201,71,33,False,True,42
821,Now he only hunts for mousse,1.4491803278688524,0.0409473523858001,305,208,57,40,False,False,28
821,Let’s see if it holds when he takes off,1.448377581120944,0.036879963065868,339,223,80,36,False,False,39
821,It's times like these that I wish I didn't have such good eyesight.,1.4470198675496688,0.038772319424088,302,198,73,31,False,True,67
821,I prefer to go endangered gracefully.,1.4470198675496688,0.038772319424088,302,198,73,31,False,True,37
821,"Pompadourus vulgaris, if I’m not mistaken.",1.446808510638298,0.040144065489661,282,185,68,29,False,True,42
821,"He Just Flew Over the Cuckoo's Nest.""",1.4465408805031446,0.0391605863643393,318,214,66,38,False,False,37
821,"He loses a few feathers, and now this.",1.4462025316455696,0.0385706862843506,316,210,71,35,False,True,38
821,This all started after he met that chickadee.,1.4455128205128205,0.0373102307964814,312,202,81,29,False,True,45
821,He's never been more confident.,1.4452296819787986,0.0384362565097528,283,181,78,24,False,True,31
821,What happened in Vegas should have stayed in Vegas.,1.4448051948051948,0.0395709796950393,308,207,65,36,False,True,51
821,It really would look better as a nest.,1.4444444444444444,0.0376059956461061,324,214,76,34,False,True,38
821,Something tells me we’re migrating to Nevada this year.,1.4437086092715232,0.0381849085469449,302,197,76,29,False,True,55
821,He's not just a client. He's also the president.,1.4432234432234432,0.0426968052120054,273,186,53,34,False,True,48
821,At least he stopped wearing the jumpsuit.,1.4430769230769231,0.0367477636038618,325,212,82,31,False,True,41
821,As if we weren't endangered enough.,1.4422310756972112,0.0422310756972111,251,165,61,25,False,True,35
821,He just never was the same after his brother made the cover of National Geographic.,1.4405144694533762,0.0373715714148387,311,203,79,29,False,True,83
821,"If his hair was blond, he could run for President",1.4398625429553265,0.0426764260146349,291,204,46,41,False,False,49
821,He snatched it off of Howard Cosell years ago.,1.438943894389439,0.0383557741471008,303,200,73,30,False,True,46
821,"Now, don’t be cruel.",1.4383561643835616,0.0402836777119795,292,197,62,33,False,True,20
821,It all started when he saw himself on the dollar.,1.438095238095238,0.0359093852139634,315,202,88,25,False,True,49
821,"Don't laugh. The last bird that looked that, won the presidency.",1.4356435643564356,0.0408228279764124,303,210,54,39,False,True,64
821,What annoys me is how he just assumes we'll sing back-up.,1.435374149659864,0.0391856146604462,294,196,68,30,False,True,57
821,Since when does the symbol of American have a comb-over?,1.4349315068493151,0.0393785724721535,292,195,67,30,True,True,56
821,Who does he think he’s kidding? He’s as bald as the rest of us.,1.4343434343434345,0.0406082744285232,297,204,57,36,True,True,63
821,"If you think THAT's bad, wait until you hear him sing 'Heartbreak Hotel'.",1.4341637010676156,0.040181342316209,281,188,64,29,False,True,73
821,It's all because of his not so long wingspan.,1.4340277777777777,0.04067438186299,288,196,59,33,False,True,45
821,It's weird. The more he preys on migratory birds the more he reminds me of DeSantis.,1.4334470989761092,0.0426943634260772,293,208,43,42,False,True,84
821,You have to be kidding; you can't tell?,1.4324324324324325,0.0426529553921756,259,176,54,29,True,True,39
821,Ridiculous! It is in our DNA! We are BALD eagles .,1.4315068493150684,0.0405370053092648,292,200,58,34,False,True,50
821,He’s gone incognito – too embarrassed to be the symbol of American democracy at a time like this.,1.431095406360424,0.0420936611064041,283,197,50,36,False,True,97
821,He's the State Bird of Nevada.,1.4306569343065694,0.0395799043927612,274,181,68,25,False,True,30
821,He flew over the cuckoo’s nest,1.4306569343065694,0.0412341496433872,274,186,58,30,False,False,30
821,Turned 40.,1.4305555555555556,0.0400546337222763,288,195,62,31,False,True,10
821,We're bald eagles; he just needs to accept it.,1.429657794676806,0.0407546205216053,263,175,63,25,False,True,46
821,He hasn’t been the same since he flew in from Graceland,1.4294670846394983,0.0384744641690492,319,218,65,36,False,False,55
821,He’s a bird of a different feather.,1.4291044776119404,0.041904761911534,268,183,55,30,False,True,35
821,I hate those ribald eagles.,1.429054054054054,0.0377611740530236,296,195,75,26,False,True,27
821,"He wants us to call him ""Elvis"".",1.4285714285714286,0.0369637860007825,315,209,77,29,False,True,32
821,It doesn't matter: he is still bald.,1.4285714285714286,0.0396107902301286,280,187,66,27,False,True,36
821,"And there's a jet black Camaro in the driveway, too.",1.4280442804428044,0.0391844674366798,271,178,70,23,False,True,52
821,He’s a bald ego.,1.4274193548387095,0.0436464680857433,248,170,50,28,False,True,16
821,It's tough to be single at his age.,1.4271523178807948,0.0366193317390254,302,197,81,24,False,True,35
821,Elaine...stop it!  You are mated-for-life to me!,1.4270833333333333,0.0400331281587414,288,196,61,31,False,True,48
821,He got tired of being referred to as bald.,1.426282051282051,0.0360787845620749,312,204,83,25,False,True,42
821,That's never gonna fly.,1.4259259259259258,0.04065052030788,270,182,61,27,False,True,23
821,I hear his wife left him,1.4259259259259258,0.038920183051308,270,177,71,22,False,False,24
