contest,caption,mean,precision,votes,not_funny,somewhat_funny,funny,has_question_mark,ends_with_punctuation,caption_length
776,The bad news is he has a terrible addiction to brake fluid. The good news is he can stop any time he wants.,1.3428571428571427,0.0730458725541025,70,51,14,5,False,True,107
776,It started as a night class at the Sr. Center,1.3428571428571427,0.0730458725541025,70,51,14,5,False,False,45
776,Matt tried fly-fishing but didn’t like it.,1.3428571428571427,0.0701542644622687,70,50,16,4,False,True,42
776,"With the latest numbers, who knows when they'll go back to the office. But for now, it's just nice having him here.",1.3428571428571427,0.0639801803087914,70,48,20,2,False,True,115
776,So now I'm kind of wishing I hadn't suggested model trains were childish,1.3428571428571427,0.0730458725541025,70,51,14,5,False,False,72
776,I think Matt is taking this whole work from home thing a bit overboard!,1.3428571428571427,0.0606579326831802,70,47,22,1,False,True,71
776,Matthew's really enjoying his retirement.,1.3425925925925926,0.0544998928821609,108,76,27,5,False,True,41
776,"I have to admit, I did not fully understand the “we come to you” concept.",1.3424657534246576,0.0681880571829592,73,52,17,4,False,True,73
776,Honey be careful. She has a nut allergy.,1.3424657534246576,0.0709233998493564,73,53,15,5,False,True,40
776,At first I encouraged him to work from home.  But . . .,1.3424657534246576,0.0735570944912648,73,54,13,6,False,True,55
776,Matt told me he needed a lift.,1.3424657534246576,0.0681880571829592,73,52,17,4,False,True,30
776,"I suppose that, since my divorce, I've gotten a bit rusty at the art of flirtation; last night I told Matt that I wanted him to come over to fix my flat tire.",1.3424657534246576,0.0623584487842358,73,50,21,2,False,True,158
776,"Matt says he won’t have to work out of our home much longer, but I rather enjoy his click clicks and occasional colorful word.",1.3424657534246576,0.0681880571829592,73,52,17,4,False,True,126
776,These new reality TV shows are so... real,1.3424657534246576,0.0623584487842358,73,50,21,2,False,False,41
776,He only works on domestic cars.,1.3424657534246576,0.0681880571829592,73,52,17,4,False,True,31
776,Life is changed forever thanks to Amazon Automotive.  I was at work and he let himself in!,1.3424657534246576,0.065338301466914,73,51,19,3,False,True,90
776,"Take up a hobby, I said.
It will help you relax, I said.",1.3424657534246576,0.0681880571829592,73,52,17,4,False,True,56
776,We went for a working-class chic decor,1.3424657534246576,0.0735570944912648,73,54,13,6,False,False,38
776,"It's all cash, so much better than day trading.",1.3421052631578947,0.068958750901872,76,55,16,5,False,True,47
776,"Yes, Matt's been working from home since Covid-19, he prefers it now",1.3421052631578947,0.068958750901872,76,55,16,5,False,False,68
776,At least he gets paid overtime.,1.3421052631578947,0.060849632266753,76,52,22,2,False,True,31
776,He’s so happy working from home.,1.3421052631578947,0.0738719413032536,76,57,12,7,False,True,32
776,"I know,but the ambience here is so nice",1.3421052631578947,0.063667534426751,76,53,20,3,False,False,39
776,"Just like everyone, he brings them up in the elevator, one piece at a time.",1.3421052631578947,0.0663658958574657,76,54,18,4,False,True,75
776,....because he makes a lot more money than when he had a law practice...,1.3421052631578947,0.068958750901872,76,55,16,5,False,True,72
776,I’m hoping this whole “work from home” thing is just a phase.,1.3421052631578947,0.0663658958574657,76,54,18,4,False,True,61
776,"So glad 
I paid extra for stain-free carpet since he's working from home!",1.3417721518987342,0.0671342156034877,79,57,17,5,False,True,73
776,And we've converted the second floor into a drive-in theater.,1.3417721518987342,0.0646717323091972,79,56,19,4,False,True,61
776,Maybe the Zoom option would have been better,1.3417721518987342,0.0646717323091972,79,56,19,4,False,False,44
776,"You can't get a housecall from a doctor anymore, but thank God that Matt is still willing to come by.",1.3417721518987342,0.0646717323091972,79,56,19,4,False,True,101
776,This place was a mess wile he was going to chef school.,1.3417721518987342,0.0740318359840204,79,60,11,8,False,True,55
776,My Feng Shui consultant said I needed more metal for harmony and balance.,1.3417721518987342,0.0695095162515082,79,58,15,6,False,True,73
776,"By working at home, Matt figures he’s reduced lewd comments about women by 40%.",1.3414634146341464,0.065434669201353,82,59,18,5,False,True,79
776,"The ad said ""Apartment with garage.""",1.3414634146341464,0.065434669201353,82,59,18,5,False,False,36
776,I'm fine with him working from home as long as he goes out for lunch.,1.3414634146341464,0.0676964552671913,82,60,16,6,False,True,69
776,"My only gripe with him, he's always taking his work home.",1.3414634146341464,0.065434669201353,82,59,18,5,False,True,57
776,We got it at Art Basel.,1.3414634146341464,0.0676964552671913,82,60,16,6,False,True,23
776,I love coffee clutches.,1.3414634146341464,0.0676964552671913,82,60,16,6,False,True,23
776,Since he started working from home - I suggested the lift to open the floor space,1.3414634146341464,0.0606586159501338,82,57,22,3,False,False,81
776,I heard they use Bobby pins sometimes in the most ingenious places!,1.3414634146341464,0.0606586159501338,82,57,22,3,False,True,67
776,"Marsha, please. Bread baking was so 2020",1.3414634146341464,0.0630918521779014,82,58,20,4,False,False,40
776,Let me show you my new ottoman.,1.3411764705882352,0.0660042889202975,85,62,17,6,False,True,31
776,"During Covid, we decided 'the family that works together, stays together.'",1.3411764705882352,0.0616144631254566,85,60,21,4,False,False,74
776,I think this working from home idea has gone too far!,1.3411764705882352,0.0638471151349549,85,61,19,5,False,True,53
776,"This is so fun, we always wager on how many pieces will be left on the floor when he is done with a job.",1.3411764705882352,0.0680931582517072,85,63,15,7,False,True,104
776,I asked him not to work in the bedroom anymore.,1.3411764705882352,0.0568868875629736,85,58,25,2,False,True,47
776,Buying and fixing a car from your couch are two very different things Susan,1.3409090909090908,0.0664174357158957,88,65,16,7,False,False,75
776,It's been so nice having my husband work from home.,1.3409090909090908,0.0644208254155551,88,64,18,6,False,True,51
776,"The commute was brutal, and anyway his bay rent was way cheaper.",1.3409090909090908,0.0602293674839277,88,62,22,4,False,True,64
776,Art installations are so passé ... I prefer mechanical installations.,1.3409090909090908,0.0602293674839277,88,62,22,4,False,True,69
776,"Thanks to COVID, I get to see a lot more of Matt now.",1.3409090909090908,0.0644208254155551,88,64,18,6,False,True,53
776,Matt Jr. lost his job and had to move into the garage.,1.3409090909090908,0.0683557516740826,88,66,14,8,False,True,54
776,"Well, Judy, I guess they didn’t specify who’s home he would work from in that “work from home” letter.",1.3409090909090908,0.0602293674839277,88,62,22,4,False,True,102
776,"So, the boss told everyone to wear a mask if they come in or work from home.",1.3406593406593406,0.0589276997866379,91,64,23,4,False,True,76
776,I almost hope the pandemic never ends.,1.3406593406593406,0.0568178982182893,91,63,25,3,False,True,38
776,I got it for him for his birthday.,1.3406593406593406,0.0648465460510031,91,67,17,7,False,True,34
776,"When the pandemic ended, Matt decided he really liked working from home.",1.3406593406593406,0.0589276997866379,91,64,23,4,False,True,72
776,I really misunderstood what he meant by downsizing.,1.3406593406593406,0.0648465460510031,91,67,17,7,False,True,51
776,He really does work tirelessly.,1.3404255319148937,0.0615390044687492,94,68,20,6,False,True,31
776,When you said come over for a reality show this exceeds all expectations.,1.3384615384615384,0.0768268629055314,65,48,12,5,False,True,73
776,"Anyway, because my car was in the shop, I said I needed a lift.",1.338235294117647,0.0744021949864993,68,50,13,5,False,True,63
776,"Well, he gave up on the Times Saturday crossword puzzle.",1.338235294117647,0.0713912113360931,68,49,15,4,False,True,56
776,"Yes, it's so wonderful that Matt makes house calls""",1.338235294117647,0.0713912113360931,68,49,15,4,False,False,51
776,He thinks he’s entitled to work at home ! I’ll be so happy when this pandemic is over.,1.3380281690140845,0.0749074867967254,71,53,12,6,False,True,86
776,I just wish we didn't have to eat in the garage.,1.3380281690140845,0.072171442352776,71,52,14,5,False,True,48
776,"But, he cleans up the Livingroom every day, that's more 
than I ever did.",1.3380281690140845,0.072171442352776,71,52,14,5,False,True,73
776,"Since the pandemic started, he's been working from home.",1.337837837837838,0.0646152484488702,74,52,19,3,False,True,56
776,Matt loves work-from-home.,1.337837837837838,0.0727037142995181,74,55,13,6,False,True,26
776,"Finally, Matt can work from home!",1.337837837837838,0.0701113173888522,74,54,15,5,False,True,33
776,We tend to spend the former commute time on clean-up.,1.337837837837838,0.0674193116180727,74,53,17,4,False,True,53
776,He likes to keep low overhead.,1.337837837837838,0.0701113173888522,74,54,15,5,False,True,30
776,"First it was Legos. I used to think that was bad, you know, stepping on all the little pieces; but looking back…",1.337837837837838,0.0674193116180727,74,53,17,4,False,False,112
776,It's his job's version of a standing desk.,1.337837837837838,0.0616838478466093,74,51,21,2,False,True,42
776,The landlord doesn’t know we’re both working from home,1.337837837837838,0.0701113173888522,74,54,15,5,False,False,54
776,The therapist told us to spend more time together,1.337837837837838,0.0674193116180727,74,53,17,4,False,False,49
776,The funny things are his name’s not Matt and this isn’t a garage.,1.3376623376623376,0.0682021582133502,77,56,16,5,False,True,65
776,It's our make a living room.,1.3376623376623376,0.0682021582133502,77,56,16,5,False,True,28
776,"On the plus side, working from home has reduced commuting time.",1.3376623376623376,0.0656488452701235,77,55,18,4,False,True,63
776,he says he gets a lot more done now that he's working from home,1.3376623376623376,0.0629921216156623,77,54,20,3,False,False,63
776,"Matt saw this ad that said, ""make $100 an hour working from the comfort of your own home?""",1.3376623376623376,0.0656488452701235,77,55,18,4,True,False,90
776,"When we met, I was an Uptown Girl and he was a Downtown Man... we've made it work by being prepared to compromise.",1.3376623376623376,0.0656488452701235,77,55,18,4,False,True,114
776,Not what I expected when you mentioned having a Matisse,1.3376623376623376,0.0656488452701235,77,55,18,4,False,False,55
776,Now I know what happened to our hydraulic lift.,1.3375,0.0664272467736248,80,58,17,5,False,True,47
776,He just hates commuting,1.3375,0.0664272467736248,80,58,17,5,False,False,23
776,"He is so graceful when he tightens the lugs, isn’t he!",1.3375,0.0664272467736248,80,58,17,5,False,True,54
776,"Turns out, I just needed new brakes!",1.3375,0.0640009641936863,80,57,19,4,False,True,36
776,"I'm just so glad he has a hobby,.",1.3375,0.0614790022814211,80,56,21,3,False,True,33
776,Matt’s been taking this “work from home” thing very seriously.,1.3375,0.0640009641936863,80,57,19,4,False,True,62
776,"Yes, working from home has been a change for Matt",1.3375,0.0614790022814211,80,56,21,3,False,False,49
776,"Fortunately my side hustle is carpet cleaning,so it works out.",1.3375,0.0588490613800802,80,55,23,2,False,True,62
776,Well it has ups and downs.,1.3375,0.0640009641936863,80,57,19,4,False,True,26
776,And I can use the same pole when ~I~ work from home.,1.3375,0.0687679780866544,80,59,15,6,False,True,52
776,"of course, we're GRATEFUL he can work at home, but...",1.3375,0.0640009641936863,80,57,19,4,False,True,53
776,Matty decided to work from home this week,1.3375,0.0640009641936863,80,57,19,4,False,False,41
776,"He resisted at first,however he just loves working from home now.",1.3373493975903614,0.0647722755022496,83,60,18,5,False,True,65
776,Now this is real reality tv.,1.3373493975903614,0.060064390059324,83,58,22,3,False,True,28
776,Matt decided to try out his stay at home business during Covid.,1.3373493975903614,0.0624627033794486,83,59,20,4,False,True,63
776,It's a compromise. I'm using the garage to watch my chick flicks.,1.3373493975903614,0.0670022837969697,83,61,16,6,False,True,65
776,"I know he makes a mess, but he looks so cute in his overall's.",1.3373493975903614,0.0647722755022496,83,60,18,5,False,True,62
776,It runs in the family--his brother Joe the butcher also works from home.,1.3373493975903614,0.0647722755022496,83,60,18,5,False,True,72
776,You are so lucky that Matt has adjusted to working remotely.,1.337209302325581,0.0587383661183107,86,60,23,3,False,True,60
776,He's trying to retire.  He owned a garage for 52-years and finding it difficult to say adios.,1.337209302325581,0.0674135513017877,86,64,15,7,False,True,93
776,"Gosh, Sally, you sure have taken ‘remote’ work to a new level.",1.337209302325581,0.0632249260710025,86,62,19,5,False,True,62
776,Maybe he's taking the work from home thing a little too far.,1.337209302325581,0.0587383661183107,86,60,23,3,False,True,60
776,When he said he wanted to work from home I didn’t realize he would noisy.,1.337209302325581,0.065352804743953,86,63,17,6,False,True,73
776,You should see the new home office I had installed in the garage.,1.337209302325581,0.0610228929621189,86,61,21,4,False,True,65
776,"No, it's nothing to do with the pandemic. Matthew has always worked from home.",1.3370786516853932,0.0617745336637735,89,64,20,5,False,True,78
776,It’s much easier doing it this way than on Zoom.,1.3370786516853932,0.06577855455392,89,66,16,7,False,True,48
776,"Working from home hasn’t been great for our relationship, or my carpet…",1.3370786516853932,0.0552268518443443,89,61,26,2,False,False,71
776,This is what I  get for marrying Matt the mechanic instead of Arnold the accountant.,1.3369565217391304,0.064244616419603,92,68,17,7,False,True,84
776,He's one of the last one in the business that do house calls.,1.3369565217391304,0.062357671506099,92,67,19,6,False,True,61
776,"It's one of the perks in our Witness Protection Program package""!",1.3369565217391304,0.064244616419603,92,68,17,7,False,True,65
776,He has been much happier since I said that our living room could be his man cave,1.3369565217391304,0.0563187763178893,92,64,25,3,False,False,80
776,He says he prefers working from home ...,1.3368421052631578,0.0572034469000154,95,67,24,4,False,True,40
776,"Don't get me wrong, I'm no NIMBY, but this ""Mixed Use Zoning"" has gotten out of hand.",1.3368421052631578,0.0609931362426121,95,69,20,6,False,True,85
776,Matt never believed in working remotely.,1.3368421052631578,0.0572034469000154,95,67,24,4,False,True,40
776,he's still refusing to give up working from home,1.3368421052631578,0.0628022836721988,95,70,18,7,False,False,48
776,My husband thinks it’s better to work at home,1.3364485981308412,0.0546609517821871,107,76,26,5,False,False,45
776,It's so nice to have a man whos good with his hands,1.3333333333333333,0.0639068391025881,75,53,19,3,False,False,51
776,It beats being married to a work from home Funeral Director,1.3333333333333333,0.0639068391025881,75,53,19,3,False,False,59
776,"The lift can be very stimulating,if you catch my drift.",1.3333333333333333,0.0740088392978143,72,54,12,6,False,True,55
776,The agent did say it was a fixer-upper.,1.3333333333333333,0.0649461639976082,78,56,18,4,False,True,39
776,"Look at the bright side, at least you didn't marry that mortician you were dating.",1.3333333333333333,0.071869083514159,75,56,13,6,False,True,82
776,"His own business, and there's no commuting.",1.3333333333333333,0.0623297993338971,66,45,20,1,False,True,43
776,We're finally allowed to sublet.,1.3333333333333333,0.0715564651235153,63,45,15,3,False,True,32
776,"With the covid, Matt bought his work home but now he's so comfortable with it he is thinking of making it permanent.",1.3333333333333333,0.0657342198122179,81,59,17,5,False,True,116
776,We're so lucky the building has a freight elevator.,1.3333333333333333,0.0663215392404403,84,62,16,6,False,True,51
776,It's a special lockdown service during pandemics. They bring everything right to your house!,1.3333333333333333,0.072688412306263,66,48,14,4,False,True,92
776,They used to say the same thing about Pollock's work.,1.3333333333333333,0.0633430791721743,81,58,19,4,False,True,53
776,"Then he asked himself, ""Why can't I work at home too?""",1.3333333333333333,0.0657342198122179,81,59,17,5,True,False,54
776,He said he'd rather work from home.,1.3333333333333333,0.0633430791721743,81,58,19,4,False,True,35
776,His boss said he could work from home.,1.3333333333333333,0.0702728368926306,81,61,13,7,False,True,38
776,"On the plus side, no one has asked me to host a Tupperware party!",1.3333333333333333,0.0713167020233019,72,53,14,5,False,True,65
776,Modern art can be so realistic!,1.3333333333333333,0.0609144903873172,99,73,19,7,False,True,31
776,I just love a man in uniform.,1.3333333333333333,0.0713167020233019,72,53,14,5,False,True,29
776,And that is why you should buy a Tesla..,1.3333333333333333,0.078386180166962,63,47,11,5,False,True,40
776,Things have sure changed since Ed started bringing his work home,1.3333333333333333,0.072688412306263,66,48,14,4,False,False,64
776,The blowtorch is actually kind of soothing.,1.3333333333333333,0.0702728368926306,81,61,13,7,False,True,43
776,Ever since we made the garage into an AirBnb we've been able to spend so much more quality time together.,1.3333333333333333,0.0591238569608123,90,64,22,4,False,True,105
776,The biggest problem is he expects a hot lunch every day.,1.3333333333333333,0.0694075270947238,66,47,16,3,False,True,56
776,"Matt's so busy, he has to bring work home with him.",1.3333333333333333,0.0693166993213382,75,55,15,5,False,True,51
776,He said. “What’s a matter with a little hobby after dinner.”,1.3333333333333333,0.0685188709827531,72,52,16,4,False,False,60
776,"The sign said, ""Labor: $40/hour. $75 if you watch."" That's less than I was paying in rent, so I moved in.",1.3333333333333333,0.0611990061362104,90,65,20,5,False,True,105
776,"Fortunately, he's been able to work from home.",1.3333333333333333,0.0713167020233019,72,53,14,5,False,True,46
776,"I can explain it, but only in a wry New Yorker kind of way.",1.3333333333333333,0.071869083514159,75,56,13,6,False,True,59
776,Oh. You’re right. He’s certainly gotten better at screwing.,1.3333333333333333,0.0693166993213382,75,55,15,5,False,True,59
776,He's so cute when he's handy!,1.3333333333333333,0.072688412306263,66,48,14,4,False,True,29
776,No more inexplicable late nights. I'm happy.,1.3333333333333333,0.065601824471747,72,51,18,3,False,True,44
776,He just really wants to do his part to fix the labor shortage.,1.3333333333333333,0.0611990061362104,90,65,20,5,False,True,62
776,I love it when a man has a hobby.,1.3333333333333333,0.0641224206855636,84,61,18,5,False,True,33
776,"We're very happy, once I got over him bringing his work home.",1.3333333333333333,0.067884423330213,63,44,17,2,False,True,61
776,Matt discovered some new hobbies during the pandemic.,1.3333333333333333,0.0663215392404403,84,62,16,6,False,True,53
776,I caught him watching Gossip Girls in secret. This is his way of re-asserting his masculinity.,1.3333333333333333,0.0693166993213382,75,55,15,5,False,True,94
776,Sure it's a mess but I know where he is at all times.,1.3333333333333333,0.056973174141742,90,63,24,3,False,True,53
776,"Ever since Covid, Marvin prefers to work from home.",1.3333333333333333,0.078386180166962,63,47,11,5,False,True,51
776,"Oh don't worry, I'm sure it's just a phase",1.3333333333333333,0.0758274735818473,66,49,12,5,False,False,42
776,working from home has been hell on the carpets,1.3333333333333333,0.0674611336326669,78,57,16,5,False,False,46
776,Matt's at Home Garage (under investigation),1.3333333333333333,0.0763250850850649,69,52,11,6,False,False,43
776,And that is why we have high ceilings.,1.3333333333333333,0.0618451542316092,84,60,20,4,False,True,38
776,He says it’s an art piece on the current state of politics in America,1.3333333333333333,0.0763250850850649,69,52,11,6,False,False,69
776,It's the future of work. Everything from the comfort of our living rooms.,1.3333333333333333,0.0698856557814612,78,58,14,6,False,True,73
776,It’s a 97 Divorcomobile.,1.3333333333333333,0.0766064266294869,72,55,10,7,False,True,24
776,I changed my husband and fixed my life.,1.3333333333333333,0.0666666666666667,75,54,17,4,False,True,39
776,He so misses Click and Clack.,1.3333333333333333,0.0744983593779457,78,60,10,8,False,True,29
776,He's taken home repairs to a new level.,1.3333333333333333,0.0591238569608123,90,64,22,4,False,True,39
776,The crazy thing is that Matt called him back into the office 2 weeks ago!,1.3333333333333333,0.0633430791721743,81,58,19,4,False,True,73
776,"He gets so much more done at home,  cant believe we didnt think of this before.",1.3333333333333333,0.0693166993213382,75,55,15,5,False,True,79
776,After the lockdown he decided that he preferred to work from home.,1.3333333333333333,0.0623297993338971,78,55,20,3,False,True,66
776,Matt wanted this instead of a man cave.,1.3333333333333333,0.0698856557814612,78,58,14,6,False,True,39
776,"Since the lockdown, he prefers to work from home.",1.3333333333333333,0.0649461639976082,78,56,18,4,False,True,49
776,"It’s funny, Norma. I’d love to write a caption for this cartoon, but it’s too small for my old-ass eyes to see.",1.3333333333333333,0.0693166993213382,75,55,15,5,False,True,111
776,It beats watching him scratch his balls on the couch.,1.3333333333333333,0.072688412306263,66,48,14,4,False,True,53
776,One mans living room is another mans garage,1.3333333333333333,0.0610223215202742,75,52,21,2,False,False,43
776,"He told me to back that thang up so he could get all up in it,",1.3333333333333333,0.0618451542316092,84,60,20,4,False,False,62
776,We’re just avoiding the HOA.,1.3333333333333333,0.0598684340089249,93,67,21,5,False,True,28
776,I don’t think he fully understands what ‘gentrifying the hood’ means,1.3333333333333333,0.065601824471747,72,51,18,3,False,False,68
776,"And he makes house calls, which is great!",1.3333333333333333,0.0570184148906457,84,58,24,2,False,True,41
776,"Wow, working from home really is for everyone!",1.3333333333333333,0.0788416527985443,66,50,10,6,False,True,46
776,"Joan, if the words ‘extended warranty’ come out of your mouth, I’m not going to be responsible for my actions.’",1.3333333333333333,0.0666666666666667,75,54,17,4,False,False,111
776,It's so nice to find a mechanic who still makes house calls.,1.3296703296703296,0.0606334994770947,91,66,20,5,False,True,60
776,Work from home has certainly given him a new zest!,1.3296703296703296,0.0645354301700959,91,68,16,7,False,True,50
776,"We had an extra hydraulic unit in the basement, so the transition for Terrence to work from home was a cinch!",1.3296703296703296,0.0645354301700959,91,68,16,7,False,True,109
776,My decorator said the room required a big statement.,1.3296703296703296,0.0606334994770947,91,66,20,5,False,True,52
776,Yet he still doesn't think it's a good idea I work from home.,1.3295454545454546,0.0598709665061373,88,63,21,4,False,True,61
776,"The garage said that working from home was not an option for them, but we insisted.",1.3295454545454546,0.0620142374800556,88,64,19,5,False,True,83
776,We are so lucky that he can work at home.,1.3295454545454546,0.0620142374800556,88,64,19,5,False,True,41
776,We're just so thrilled Matthew was able to extend his gap year.,1.3295454545454546,0.0620142374800556,88,64,19,5,False,True,63
776,Haha. Hehe. He always brings his work home.  After all he’s in gas and oil.,1.3295454545454546,0.0598709665061373,88,63,21,4,False,True,75
776,Only way to get parking in this building.,1.3294117647058823,0.0634847856541767,85,62,18,5,False,True,41
776,They've gone remote.,1.3294117647058823,0.0612389252415392,85,61,20,4,False,True,20
776,I'm so happy Matt's finally found a hobby!,1.3294117647058823,0.0589075030867962,85,60,22,3,False,True,42
776,"I’ll be honest, Karen. Jiffy Lube’s new WFH policy has not great for our relationship.",1.329268292682927,0.0673293130016522,82,61,15,6,False,True,86
776,The best part is that I can use the recycled oil to cook our chicken.,1.329268292682927,0.0650547635997712,82,60,17,5,False,True,69
776,His boss thought he couldn't work at home during the pandemic!,1.329268292682927,0.0650547635997712,82,60,17,5,False,True,62
776,"It’s a weekly subscription darling! It’s called 4D entertainment…Last week was a cable guy, this week is a mechanic, next week is a beekeeper!",1.329268292682927,0.0673293130016522,82,61,15,6,False,True,142
776,He says it’s performance art.,1.329268292682927,0.0589859047687775,82,60,18,4,False,True,29
776,He's so much happier now that he is working from home.,1.3291139240506329,0.058990531665187,79,55,22,2,False,True,54
776,He wanted the TV in the garage.,1.3291139240506329,0.0616802461973405,79,56,20,3,False,True,31
776,I love having him home!,1.3291139240506329,0.058990531665187,79,55,22,2,False,True,23
776,Matt's great but I think he may have confused working from home with working from YOUR home.,1.3291139240506329,0.0616802461973405,79,56,20,3,False,True,92
776,"""We converted the garage to our family room 12 years ago,                       
   but Matt still gets these bouts of nostalgia.""",1.3291139240506329,0.0616802461973405,79,56,20,3,False,False,130
776,"He can fix anything, anywhere, any time!",1.3291139240506329,0.0667352430175448,79,58,16,5,False,True,40
