contest,caption,mean,precision,votes,not_funny,somewhat_funny,funny,has_question_mark,ends_with_punctuation,caption_length
711,"Yes, it's a home game. Of course it's a home game. Everything's a fricking home game.",2.317636872252564,0.0058212100924792,15014,2262,5749,7003,False,True,85.0
711,I'm really looking forward to the away games.,2.1375661375661377,0.0121912327482633,3591,745,1607,1239,False,True,45.0
711,"3rd month, nobody out.",2.1240714398609137,0.009758664142328,6327,1562,2418,2347,False,True,22.0
711,Well the catcher is wearing a mask but everyone else is just staying six feet apart,2.082110794832494,0.0063767671100104,13701,3345,5904,4452,False,False,83.0
711,I hope to God they find a cure before football season.,2.075056799740344,0.0070159770324813,12324,3355,4707,4262,False,True,54.0
711,"The bases are loaded and, frankly, so am I",2.056835128417564,0.0072130176172232,12070,3506,4388,4176,False,False,42.0
711,They’re all high and inside.,2.046165749656121,0.0075950164861401,11632,3701,3715,4216,False,True,28.0
711,"Look, it got them to put on pants",2.0386516060713027,0.0071987368699144,11332,3154,4601,3577,False,False,33.0
711,"When they said MLB would be back in our living rooms, I had no idea.",2.033014639976098,0.0093248036554031,6694,1841,2791,2062,False,True,68.0
711,Yes... I'd like to cancel my live sports package.,2.0266207328531163,0.0139898142109004,3193,956,1196,1041,False,True,49.0
711,"I’m sure working from home IS nice when you’re married to a chef, Janet.",2.019010160603081,0.0141944226045857,3051,909,1175,967,False,True,72.0
711,It’s like “Field of Dreams” without the field or the dreams.”,1.9857163060387495,0.0092889721880243,7071,2223,2732,2116,False,False,61.0
711,"Yes, he surprised me with a diamond, all right.",1.983225193859788,0.0097075181989463,6319,1935,2555,1829,False,True,47.0
711,"Bottom of the 427th, I think.",1.9690075832509064,0.0144007269715438,3033,1002,1123,908,False,True,29.0
711,"No mother, he has not gotten to first base.",1.9644886363636365,0.0104495056693813,5632,1835,2162,1635,False,True,43.0
711,We're just having game night. What about you?,1.950531426322005,0.0086153478920384,7621,2383,3244,1994,True,True,45.0
711,I'm not so sure about being safe at home.,1.9480050933786075,0.0109636454205894,4712,1463,2031,1218,False,True,41.0
711,I'm praying for a no-hitter.,1.9446499715424015,0.0090641428928364,7028,2279,2877,1872,False,True,28.0
711,"I'd like to order four hot dogs, 2 boxes of Cracker Jack and 2 sheets of drywall.",1.9433317807793824,0.0097253909157032,6441,2172,2469,1800,False,True,81.0
711,"It’s fine honey, we’re wearing masks and gloves.",1.915295387105476,0.0122909992899858,3707,1208,1605,894,False,True,48.0
711,I’m safe at home. How are you?,1.914712357614626,0.007411188795011,10447,3518,4317,2612,True,True,30.0
711,"The last time I got to third base on this sofa, the Pirates were in the World Series.",1.9119687224114013,0.0089226050024952,7929,2902,2831,2196,False,True,85.0
711,Turns out they also come if you don't build it.,1.8997218562435951,0.0096139634263569,6831,2558,2410,1863,False,True,47.0
711,It’s just like being at the ballpark. We even booed the President during the national anthem!,1.89211322770162,0.0106361493889718,5617,2155,1927,1535,False,True,93.0
711,"No, it really does feel like I'm at the ballpark, ignoring the game, and talking to you on my phone.",1.889691963517467,0.0097192706321916,5811,1998,2475,1338,False,True,100.0
711,Depends on what you mean by safe at home.,1.869906868451688,0.0090259396431144,6872,2471,2841,1560,False,True,41.0
711,"Trust me, it’s not the bases that are loaded.",1.8579610538373423,0.0149729433223592,2619,981,1029,609,False,True,45.0
711,The bases are empty. We're loaded.,1.8578352180936992,0.0105142561391692,5571,2195,1984,1392,False,True,34.0
711,The away games are in the garage.,1.8522286821705427,0.0171879362156159,2064,804,761,499,False,True,33.0
711,I'd wish I had been quarantined with a chef,1.8490125952417975,0.009664589002505,6431,2520,2374,1537,False,False,43.0
711,Okay. Tell grandma to start getting loose in the bullpen.,1.8462901439645625,0.0116103521616145,4515,1774,1661,1080,False,True,57.0
711,I have to hang up.  I'm on deck.,1.843435754189944,0.009051397962123,7160,2771,2749,1640,False,True,32.0
711,Three strikes and you still can't go out,1.843040473840079,0.0246724586933921,1013,404,364,245,False,False,40.0
711,Can I call you back? It's the bottom of the ninth.,1.842268286871575,0.0116339659475843,4197,1575,1709,913,True,True,50.0
711,"Janet, you'll never believe the seats I have for this game.",1.841424802110818,0.0122293824653627,3790,1422,1547,821,False,True,59.0
711,"Well, I asked him to pitch in around the house, but he brushed off my signal and threw me a curve.",1.8382419574082465,0.0163107254920628,2207,855,854,498,False,True,98.0
711,"Hang on, the cat is stealing 2nd.",1.830209481808159,0.0257260273203427,907,362,337,208,False,True,33.0
711,"No, I think the real problem will be hockey season.",1.823982175410168,0.0106500847266292,4937,1918,1980,1039,False,True,51.0
711,"I'm sorry, but my husband can't come to the phone right now. He's in the kitchen playing center field.",1.823470411233701,0.0241037498281597,997,392,389,216,False,True,102.0
711,"No, but i am worried about horse racing season",1.8221797323135756,0.013954104962704,3138,1287,1122,729,False,False,46.0
711,"Yes, I said I wish I was high and outside.",1.8197628458498023,0.0128398511368224,3795,1603,1278,914,False,True,42.0
711,"I'm not worried, he can't hit and a walk will put him in the front closet.",1.8178528347406513,0.0119270256954503,4145,1683,1540,922,False,True,74.0
711,"Hold on Cheryl, I think the hot dog guy is at the door.",1.8165222772277227,0.0131151394945306,3232,1249,1327,656,False,True,55.0
711,Still no score. Top of the 189th.,1.8100956645634032,0.0112251652253281,4913,2118,1627,1168,False,True,33.0
711,Harold's dream came true.  He's pitching the home opener.,1.8080865603644647,0.0125258894334763,3512,1384,1424,704,False,True,57.0
711,"I'm the scorekeeper, the beer vendor and third base.",1.8034569277948147,0.0125886114791571,3587,1441,1410,736,False,True,52.0
711,He says he's trying to flatten the curve.,1.7936618089289844,0.0114999686782707,4323,1781,1656,886,False,True,41.0
711,"Seriously, you wouldn’t believe my seats.",1.7921139101861994,0.0108831443249348,4565,1857,1820,888,False,True,41.0
711,"No, I’m not just playing third base, I am third base.",1.7896698615548456,0.0118630101170177,3756,1498,1561,697,False,True,53.0
711,"Yes, he’s working from home too. Why do you ask?",1.7874135312974524,0.0096505340706108,5927,2437,2328,1162,True,True,48.0
711,I’ve been through all 67 pages of the covid rules. The hardest one was telling them they can’t spit.,1.778276033881415,0.0169620185220779,2007,851,750,406,False,True,100.0
711,It could have been worse. Cheryl’s husband is an equestrian.,1.774703557312253,0.0118631084662314,4048,1719,1525,804,False,True,60.0
711,All his pitches have been inside.,1.769335884121345,0.0123435357500387,3659,1554,1401,704,False,True,33.0
711,"...I'm talking to Dr. Fauci and he said ""Grabbing your crotch is okay.""",1.7623587570621468,0.0149590089985292,2832,1316,874,642,False,False,71.0
711,These days they’re all home games,1.760215053763441,0.0167062921276394,1860,759,788,313,False,False,33.0
711,I’ll have to call you back. It’s the bottom of the 9th and the cat is on deck,1.7519816437213185,0.0110745463823247,4794,2156,1673,965,False,False,77.0
711,"Yes, Ted, he's hard at work--in fact, he's pitching a client right now.",1.7518719339013684,0.0119193983244637,3873,1665,1504,704,False,True,71.0
711,"When I agreed he could have the boys here for a game, I thought he meant poker.",1.751170046801872,0.020402802859288,1282,541,519,222,False,True,79.0
711,"It’s not the same without the rest of the crowd, but the beer’s cheaper and no line at the restroom.",1.7501810282404056,0.0138111699597399,2762,1171,1115,476,False,True,100.0
711,"I was going to make cookies, but Amazon delivered the wrong batter.",1.7485714285714289,0.0177759283940205,1925,888,633,404,False,True,67.0
711,How should I know who's on first? I don't even know what day it is anymore.,1.740909090909091,0.0297401977788447,660,300,231,129,True,True,75.0
711,I signed up for ‘relief pitcher’ thinking there’d be margaritas...,1.735239852398524,0.0230736312073542,1084,494,383,207,False,True,66.0
711,"Oh, nothing much, just watching the game.",1.7248104008667389,0.0138879319339147,2769,1230,1073,466,False,True,41.0
711,I’m actually thinking of giving him the videogame console back.,1.72093949044586,0.0145610940876433,2512,1122,971,419,False,True,63.0
711,It’s actually even more boring than on TV.,1.7196092619392185,0.014518195141515,2764,1311,921,532,False,True,42.0
711,"I think the pitcher is Purelling the ball, is that legal?",1.7153574580759048,0.0153948386823454,2266,1030,854,382,True,True,57.0
711,This takes high and inside to a whole new level,1.7146341463414634,0.0214085330227004,1230,572,437,221,False,False,47.0
711,"I thought I missed baseball, but I actually miss him watching baseball.",1.7138613861386138,0.0231532356271247,1010,459,381,170,False,True,71.0
711,"Trust me, the bases aren't the only thing loaded around here.",1.713457556935818,0.0149140182408085,2415,1106,900,409,False,True,61.0
711,"I don't care if you tested positive, I'm coming over.",1.712544438801422,0.0176218532700391,1969,966,603,400,False,True,53.0
711,Can I call you back? I’m in the middle of a game.,1.708125550014667,0.012593616465184,3409,1564,1276,569,True,True,49.0
711,He's 3 and 2 with the cat on deck.,1.7045454545454546,0.0281631341809498,704,331,250,123,False,True,34.0
711,"No, but they did quit spitting.",1.701098901098901,0.034603645183796,455,212,167,76,False,True,31.0
711,One out? I want them ALL out!,1.6969286359530262,0.0162991809108285,2214,1088,709,417,True,True,29.0
711,"Sure I’ll recap...Who has toilet paper is on first, what day it is on second, I don’t know how to make sourdough starter on third.",1.6942098914354644,0.0189826252718865,1658,826,513,319,False,True,130.0
711,It's the bottom of the ninth and two windows are out,1.6922737306843267,0.0158884376467641,2265,1103,756,406,False,False,52.0
711,"Yes, Mom--the boys are six feet apart, and the catcher is wearing a mask.",1.6878048780487804,0.0160659279416686,2050,962,766,322,False,True,73.0
711,“I’d let them play outside but only the catcher has a mask “,1.682051282051282,0.0147479561787717,2340,1098,893,349,False,False,60.0
711,At least it's not hunting season.,1.6808413351623228,0.0162294045743759,2187,1095,697,395,False,True,33.0
711,Bunt...PLEASE BUNT!,1.674986999479979,0.0165950726001424,1923,923,702,298,False,True,19.0
711,"Hi Linda, I was wondering whether we could upgrade our home insurance plan?",1.6743697478991597,0.0191024171248512,1428,680,533,215,True,True,75.0
711,The wife. In the family room. With a baseball bat.,1.6741674167416742,0.0237233722705738,1111,587,299,225,False,True,50.0
711,It's actually not that bad — aside from the spitting.,1.6737343141497187,0.0150738317372054,2311,1114,840,357,False,True,53.0
711,Of course I want them to stop... but our best hitter is up and we're down by two runs.,1.6735099337748345,0.0186910827566131,1510,725,553,232,False,True,86.0
711,I'd be less annoyed if the catcher wasn't the only one wearing a mask.,1.672293364377183,0.0168397851987917,1718,792,697,229,False,True,70.0
711,I'm waiting for the 7th inning stretch so I can vacuum the field.,1.670945945945946,0.0186180675089124,1480,708,553,219,False,True,65.0
711,"Well, I'm hoping for a no hitter!",1.6622516556291391,0.0192512984845171,1359,649,520,190,False,True,33.0
711,I hope there’s a vaccine before football season,1.6620689655172414,0.0176000578170903,1740,862,604,274,False,False,47.0
711,Next pandemic I plan to be married to a book editor.,1.6600768808347062,0.0174966178322943,1821,932,580,309,False,True,52.0
711,I think the cat is stealing signs.,1.6592592592592592,0.0181606074714542,1755,916,524,315,False,True,34.0
711,"I know, Mom, but at some point it went from fantasy to full-on delusion.",1.658250146799765,0.0181715475962083,1703,869,547,287,False,True,72.0
711,The worst part is that they’re charging me $10 for each beer I already had in the fridge.,1.6560900716479017,0.0168996782520661,1954,1004,621,329,False,True,89.0
711,I just wish they'd quit spitting.,1.6554054054054057,0.015906366763992,2220,1140,706,374,False,True,33.0
711,So we agree - I trade you all three for two jumbo paper towels and a player to be named later,1.6554054054054057,0.0300389367288922,592,295,206,91,False,False,93.0
711,Not now. I'm on deck.,1.6523076923076925,0.0175902786519104,1625,789,612,224,False,True,21.0
711,"No, it’s a home game.",1.6521518987341772,0.0164425443843274,1975,990,682,303,False,True,21.0
711,"Do you deliver? Great, I would like a hot dog and a beer please!",1.6473282442748092,0.0166010987734706,1965,1003,653,309,True,True,64.0
711,"Hold on, I have to make another call.",1.647234678624813,0.0278551375013706,669,333,239,97,False,True,37.0
711,The virus has been over for six years?,1.6413949962092491,0.0205112150328692,1319,692,410,217,True,True,38.0
711,I never miss a home game.,1.6412169919632609,0.0172624822863422,1742,879,610,253,False,True,25.0
711,"Well, as Yogi said ‘If the world were perfect, it wouldn’t be.",1.6366336633663363,0.023308227389211,1010,527,323,160,False,True,62.0
711,"No, I’m not stuck at home. I’m stuck on third.",1.6361985472154963,0.0175739386181332,1652,831,591,230,False,True,46.0
711,"I’m not sure about the the bases, but we are all loaded",1.634349030470914,0.0194088785050725,1444,753,466,225,False,False,55.0
711,"Don't worry mom, no one has gotten to third base.",1.6263368983957218,0.0189969240869856,1496,795,468,233,False,True,49.0
711,I miss leaving early.,1.6253071253071254,0.025093659784167,814,418,283,113,False,True,21.0
711,"Well, the homeschooling isn't going so well, but we've nailed the extracurriculars.",1.6241197183098592,0.021181867876574,1136,583,397,156,False,True,83.0
711,"Bottom of the ninth, this pitch will decide who does the dishes",1.6228915662650605,0.0248519402556475,830,428,287,115,False,False,63.0
711,"Oh, I'm not worried...he couldn't hit water if he fell out of a boat.",1.6207729468599037,0.0256615644080707,828,442,258,128,False,True,69.0
711,Just watching the game. You?,1.617737003058104,0.0196614643732136,1308,676,456,176,True,True,28.0
711,It was so much better when I was able to change the channel.,1.615506329113924,0.0279513784848888,632,324,227,81,False,True,60.0
711,"It was either this, or let him keep talking about his sourdough starter.",1.614956245027844,0.0209455108271081,1257,689,366,202,False,True,72.0
711,"Hi Roger, do you think we will be out of quarantine by football season? Yeah? No reason just checking",1.6144767899291896,0.0201454536457293,1271,667,427,177,True,False,101.0
711,This is why we can’t have nice things.,1.6117103235747303,0.029345059468675,649,356,189,104,False,True,38.0
711,"No, not cleaning. I said spring training. You?",1.608008429926238,0.0225673403902669,949,488,345,116,True,True,46.0
711,#97253 on list of things which are not as stupid as injecting disinfectants.,1.6072106261859582,0.0233357852321545,1054,593,283,178,False,True,76.0
711,"No, nothing new here.....just about to order some new lamps, vases, maybe a window or two.",1.606643356643357,0.0213671806969631,1144,612,370,162,False,True,90.0
711,I obviously misunderstood when they said they needed a home base.,1.6056338028169015,0.0209577842570217,1136,603,381,152,False,True,65.0
711,"I didn’t build it, they just came.",1.6051344743276283,0.024812773145217,818,431,279,108,False,True,34.0
711,"Bottom of the 9th and it's Covid-19, sanity 0.",1.604882459312839,0.0221265144650044,1106,614,319,173,False,True,46.0
711,Just another Tuesday.  Saturday is bowling night when things really happen.,1.602829162132753,0.0231475911685305,919,481,322,116,False,True,75.0
711,"I suppose you’re right, Steve is lucky — not everyone can work from home.",1.5996131528046422,0.0214236701516908,1034,535,378,121,False,True,73.0
711,Home games have taken on a whole new meaning this season,1.5957671957671955,0.0226976089263156,945,498,331,116,False,False,56.0
711,"Yes, we're taking precautions - he's not throwing spitballs.",1.5951417004048585,0.0224403053972124,988,534,323,131,False,True,60.0
711,"Yeah, great seats. Third base line.",1.5932377049180328,0.0226342932848749,976,523,327,126,False,True,35.0
711,"Yes, yes, I’m sure. I can be in the office as soon as it’s open.",1.5930359085963004,0.0233455026339495,919,493,307,119,False,True,64.0
711,"Hello, I’d like to place an order for some peanuts and crackerjacks.",1.591858037578288,0.0233629179593977,958,528,294,136,False,True,68.0
711,This gives home games a whole new meaning,1.5887445887445888,0.0236178419870548,924,506,292,126,False,False,41.0
711,I got us amazing seats.,1.588300220750552,0.0240800639079099,906,501,277,128,False,True,23.0
711,It's still boring...,1.5867117117117118,0.0247713985901137,888,501,253,134,False,True,20.0
711,"Helen, I've gotta go. It's the the bottom of the ninth, score's tied, I'm on third, and here comes the three-two pitch.",1.5859375,0.0240383380364713,896,494,279,123,False,True,119.0
711,I guess you could call it a home game.,1.5856031128404668,0.0303406292719124,514,272,183,59,False,True,38.0
711,"Yes, that's right.  Please deliver some peanuts and crackerjacks to apt. 404.",1.583916083916084,0.0241953193155443,858,468,279,111,False,True,77.0
711,"Yes, safe at home.",1.5824436536180309,0.0235308483183643,843,461,279,103,False,True,18.0
711,"He sounds wonderful, Diane, but right now I'm playing the field.",1.5813953488372092,0.0269559117824522,688,376,224,88,False,True,64.0
711,"No, he's not home yet.",1.5806060606060606,0.0247639547011669,825,464,247,114,False,True,22.0
711,"You know, the winning caption always comes out of left field.",1.579656862745098,0.0258042273623487,816,465,229,122,False,True,61.0
711,"So... you said that all of this was caused by a bat, right?",1.579145728643216,0.0258851035876413,796,450,231,115,True,True,59.0
711,"Hold on, Sally. It looks like I might get to third base for the first time in twenty years.",1.5784883720930232,0.037494865283815,344,186,117,41,False,True,91.0
711,Honestly? I'm just so happy to be able to see some live sports.,1.5781637717121588,0.0237043683726689,806,424,298,84,True,True,63.0
711,Can you clarify the infield fly rule for a venue with a ten-foot ceiling?,1.5781637717121588,0.0249709132884757,806,449,250,107,True,True,73.0
711,Janet? This is Donna in 6C. Is your Billy a lefty?,1.574522292993631,0.0259328256943189,785,445,229,111,True,True,50.0
711,"I have to go Mom, I'm doing play by play.",1.5736842105263158,0.0248032855725474,760,411,263,86,False,True,41.0
711,"Oh right, yes, sorry the Yankees vs. Mariners is Apt 4-b",1.5714285714285714,0.0265763363234183,756,433,214,109,False,False,56.0
711,"Well, yeah, but they warned us sports would look different when it came back",1.5689655172413792,0.0295835369083588,522,280,187,55,False,False,76.0
711,"Hold on, Barbara––I have to do the wave.",1.565217391304348,0.0268041884762401,690,386,218,86,False,True,40.0
711,Hold on—our Airbnb host is calling for some reason.,1.5639880952380951,0.027910097258731,672,386,193,93,False,True,51.0
711,"Well, the score is at one broken window and a dead cat",1.5633802816901408,0.0271803177846201,639,351,216,72,False,False,54.0
711,What I approved was 'game night with the guys.',1.5628654970760234,0.0268301409463176,684,383,217,84,False,False,47.0
711,"I was all for father-son bonding, but spitting on the carpet is starting to get to me.",1.561377245508982,0.0264827096986962,668,367,227,74,False,True,86.0
711,I can't say anything. He's got a no-hitter going.,1.558641975308642,0.0271819844481029,648,361,212,75,False,True,49.0
711,Every hit is a home-run now,1.5585996955859969,0.0272481018046105,657,369,209,79,False,False,27.0
711,I'm gonna be late for the Zoom meeting. The game just went into extra innings.,1.5585996955859969,0.0276286284511205,657,376,196,85,False,True,78.0
711,"God, it feels like I'm living in a New Yorker cartoon caption contest.",1.5579937304075235,0.028981615488879,638,374,172,92,False,True,70.0
711,I'm gonna have to let you go. We've got runners in scoring position at the ottoman and china cabinet.,1.5569422776911075,0.0281970759961996,641,368,189,84,False,True,101.0
711,"Oh he's still in a fantasy league, Elaine, it's just a very different fantasy.",1.5559157212317667,0.0276379749175392,617,343,205,69,False,True,78.0
711,I’m managing. How about you?,1.555732484076433,0.0287758450186587,628,367,174,87,True,True,28.0
711,"Well, last week he let me have my book club over.",1.555205047318612,0.0285259562524088,634,367,182,85,False,True,49.0
711,"OK, Sally, let me go, the cat has to use the pitchers mound again.",1.5514950166112955,0.0299668998553396,602,358,156,88,False,True,66.0
711,I was so worried when I overheard him telling his friends that he was a switch hitter,1.5503355704697988,0.0293505902045483,596,347,170,79,False,False,85.0
711,Hello? I’d like to report a hit and run.,1.549828178694158,0.0293385037225994,582,343,161,78,True,True,40.0
711,"Gotta go, Mom. I'm on deck.",1.5495798319327732,0.0285106146549135,595,338,187,70,False,True,27.0
711,Life's been throwing me a lot of curve balls lately.,1.5494505494505495,0.029738520338285,546,310,172,64,False,True,52.0
711,Settlement? Not a chance. You tell your client we're ready to play hardball.,1.5490196078431373,0.028928203802678,561,315,184,62,True,True,76.0
711,I snagged great seats to the home opener.,1.5488215488215489,0.0290415097726525,594,343,176,75,False,True,41.0
711,"Not another screwball, we’ve already got one in the White House!",1.5481099656357389,0.0317166670990253,582,361,123,98,False,True,64.0
711,he's not the only one striking out tonight,1.5474956822107082,0.0295103432178494,579,336,169,74,False,False,42.0
711,So far every pitch has been inside.,1.5474956822107082,0.0293071322195445,579,334,173,72,False,True,35.0
711,"Hello? House that Ruth built, Ruth speaking.",1.546419098143236,0.0373207537484702,377,223,102,52,True,True,44.0
711,"Hi Dad, remember that Ming vase on the mantel?",1.5463917525773196,0.0292977741960613,582,337,172,73,True,True,46.0
711,Oh sorry Mom I was trying to dial the bullpen.,1.5456204379562044,0.0306642528782191,548,322,153,73,False,True,46.0
711,"Yes, it feels like the real thing! I just paid $16 for a beer from my own fridge!",1.5454545454545454,0.0352263999333296,385,219,122,44,False,True,81.0
711,Hey! Pick up your New Yorker! I’m in a cartoon!,1.545219638242894,0.0380221064582957,387,236,91,60,False,True,47.0
711,"...yes, we are homeschooling the kids... they're in PE right now",1.545132743362832,0.0293285127729089,565,324,174,67,False,False,64.0
711,Not good. Only one is wearing a mask.,1.5448028673835126,0.0286086077533138,558,312,188,58,False,True,37.0
711,Yeah it's weird... I just went from spring cleaning to spring training,1.54421768707483,0.0330061052601896,441,252,138,51,False,False,70.0
711,Well Tom Hanks was definitely wrong about one thing.....there IS crying in baseball!,1.5432780847145489,0.0296501110750726,543,310,171,62,False,True,84.0
711,"No, no, no...  I asked you to take me OUT to the ballgame.",1.5432780847145489,0.0291881224900854,543,306,179,58,False,True,58.0
711,"No, even this close it’s really not that exciting",1.5429616087751372,0.0309311339206318,547,325,147,75,False,False,49.0
711,"...And I’ll tell ya, it’s almost as depressing as watching the Mets.",1.5393474088291748,0.0303434848223013,521,300,161,60,False,True,68.0
711,"You know, there is nothing like the atmosphere of an at-home game",1.5391969407265775,0.0303786196716895,523,302,160,61,False,False,65.0
711,What do you mean you don't deliver peanuts?,1.539179104477612,0.0304094689658124,536,313,157,66,True,True,43.0
711,Baseball is OK.  It's the water polo that drives me crazy.,1.537109375,0.0316023991598073,512,304,141,67,False,True,58.0
711,"We're good. Twelve feet to  the batter's box, and the catcher is wearing a mask.",1.537109375,0.030116104237053,512,292,165,55,False,True,80.0
711,Just called to touch base,1.5365384615384616,0.0315891163807583,520,311,139,70,False,False,25.0
711,It's the bottom of the 120th Inning,1.5354330708661417,0.0316722309190342,508,302,140,66,False,False,35.0
711,I’ve had enough of these innings - I need an outing.,1.533203125,0.0303777200545851,512,296,159,57,False,True,52.0
711,Hurry over. I can’t do the wave by myself.,1.5327868852459017,0.0359972881780313,366,212,113,41,False,True,42.0
711,"The AirBNB listing said no parties, it said nothing about playoffs.",1.531746031746032,0.0308639971702672,504,294,152,58,False,True,67.0
711,"Please, PLEASE, take me out to the ball game. Just. Take. Me. Out.",1.5311203319502074,0.0321765588072374,482,286,136,60,False,True,66.0
711,"No, only one of them is wearing a mask.",1.530864197530864,0.0303443557994416,486,276,162,48,False,True,39.0
711,"I know Suzanne, I never thought I’d say this either, but I need them to bring back professional and college sporting events RIGHT NOW",1.5306553911205074,0.0323612872915776,473,280,135,58,False,False,133.0
711,Hello. I'd like to report a hit-and-run.,1.5302713987473904,0.0319216963983231,479,282,140,57,False,True,40.0
711,"Joanne it’s fine, he gets the house in the divorce.",1.5301724137931034,0.0318242070562277,464,269,144,51,False,True,51.0
711,Maureen? Stephanie? Please come pick up your husbands from spring training.,1.528301886792453,0.0304749215192737,477,271,160,46,True,True,75.0
