contest,caption,mean,precision,votes,not_funny,somewhat_funny,funny,has_question_mark,ends_with_punctuation,caption_length
710,Wow!  You almost never see a  Guitarus Strumminansis in the Northern Hemisphere.,1.1585365853658536,0.0474254742547425,82,71,9,2,False,True,80
710,Is it McGuinn or Crosby?,1.1585365853658536,0.0474254742547425,82,71,9,2,True,True,24
710,"Look Janet, even the birds are hosting virtual concerts.",1.1585365853658536,0.0441368495254805,82,70,11,1,False,True,56
710,That's quite a beard!,1.1585365853658536,0.0505003933701469,82,72,7,3,False,True,21
710,It's the Bluebird of Happiness singing the Blues.,1.1585365853658536,0.0474254742547425,82,71,9,2,False,True,49
710,That blues bird is one cool cat.,1.1585365853658536,0.0474254742547425,82,71,9,2,False,True,32
710,Spotting a hawk while it self-isolates is a little eyrie!,1.1585365853658536,0.0441368495254805,82,70,11,1,False,True,57
710,His 'Aria' usually attracts capacity crowd.,1.1585365853658536,0.0533985379274743,82,73,5,4,False,True,43
710,That's the song of the Lesser Flicker Picker!,1.1585365853658536,0.0441368495254805,82,70,11,1,False,True,45
710,I've got the sheltering-in-place blues!,1.1585365853658536,0.0474254742547425,82,71,9,2,False,True,39
710,"No, Sam, that's a strumming bird, not a humming bird",1.1585365853658536,0.0441368495254805,82,70,11,1,False,False,52
710,His stage name is Lynyrd Skynyrd.,1.1585365853658536,0.0441368495254805,82,70,11,1,False,True,33
710,"Nevermind, I thought this was one of the rare ones that writes their own songs.",1.1585365853658536,0.0441368495254805,82,70,11,1,False,True,79
710,"The setlist doesn't include 'Freebird,' I see...",1.1585365853658536,0.0441368495254805,82,70,11,1,False,True,48
710,Not another warbler,1.1585365853658536,0.0505003933701469,82,72,7,3,False,False,19
710,The chicks love his podcast.,1.1585365853658536,0.0474254742547425,82,71,9,2,False,True,28
710,"Request ""freebird""",1.1585365853658536,0.0441368495254805,82,70,11,1,False,False,18
710,"This next song is for all of those scrooges down there. Here's ""Free Riders from a Free Bird.""",1.1585365853658536,0.0441368495254805,82,70,11,1,False,False,94
710,He's singing the blues. Must be mating season.,1.1585365853658536,0.0441368495254805,82,70,11,1,False,True,46
710,"Unlike the mockingbird, the balladbird changes its song based on number of views.",1.1585365853658536,0.0441368495254805,82,70,11,1,False,True,81
710,"Honestly, can this coffee shop get ANY more trendy?",1.1585365853658536,0.0441368495254805,82,70,11,1,True,True,51
710,I am not a fan of Bird Bop,1.1585365853658536,0.0441368495254805,82,70,11,1,False,False,26
710,Hmm I wonder what it’s doing up there?,1.1585365853658536,0.0474254742547425,82,71,9,2,True,True,38
710,He's singing that he's an ol' cowhand from the Rio Grande.,1.1585365853658536,0.0441368495254805,82,70,11,1,False,True,58
710,It's his way of putting the 'blue' in bluebird.....,1.1585365853658536,0.0474254742547425,82,71,9,2,False,True,51
710,"No, that's a Buddy Guy Blues Jay; it lacks the Clapton Cardinal's twang.",1.1585365853658536,0.0441368495254805,82,70,11,1,False,True,72
710,"""It's the first  Charlie bluesbird this year.""",1.1585365853658536,0.0474254742547425,82,71,9,2,False,False,46
710,Never thought I'd add the singer/songwriter to my life list.,1.1585365853658536,0.0505003933701469,82,72,7,3,False,True,60
710,And this bird you cannot chaaaannnnggggee...,1.1585365853658536,0.0441368495254805,82,70,11,1,False,True,44
710,It’s the “She Done Him Wrong” bluebird song.,1.1585365853658536,0.0441368495254805,82,70,11,1,False,True,44
710,Very rare sighting - A Rockin' Robin playing acoustic guitar...,1.1585365853658536,0.0441368495254805,82,70,11,1,False,True,63
710,Is that a balcony contest?,1.1585365853658536,0.0441368495254805,82,70,11,1,True,True,26
710,I didn’t realize there were blues jays here,1.1585365853658536,0.0441368495254805,82,70,11,1,False,False,43
710,The female left him last week over creative differences.,1.1585365853658536,0.0505003933701469,82,72,7,3,False,True,56
710,It's definitely a Mississippi blues jay.,1.1585365853658536,0.0441368495254805,82,70,11,1,False,True,40
710,"It's traditional song now, but you should come in August when they transition to 'hair metal'.",1.1585365853658536,0.0441368495254805,82,70,11,1,False,True,94
710,Oh. I’ll wait. I was looking for the stairway to heaven.,1.1585365853658536,0.0505003933701469,82,72,7,3,False,True,56
710,The Egg Yolk Serenade.,1.1585365853658536,0.0441368495254805,82,70,11,1,False,True,22
710,"Man, Jason Mraz is really flailing these days...",1.1585365853658536,0.0474254742547425,82,71,9,2,False,True,48
710,I'd say that song is his nest egg,1.1585365853658536,0.0405825992733657,82,69,13,0,False,False,33
710,"So much talent, and he wastes it on ""Your Body is a Wonderland.""",1.1585365853658536,0.0474254742547425,82,71,9,2,False,False,64
710,There’s no sound more beautiful than that of a feathered- strummed guitar.,1.1585365853658536,0.0441368495254805,82,70,11,1,False,True,74
710,This nest song goes out to my two biggest fans...,1.1585365853658536,0.0474254742547425,82,71,9,2,False,True,49
710,I do believe it’s a Blues Bird.,1.1585365853658536,0.0441368495254805,82,70,11,1,False,True,31
710,Just doesn't feel like a jazz club anymore.,1.1585365853658536,0.0474254742547425,82,71,9,2,False,True,43
710,Of course he tweets the blues. He just doesn't have a bass player for backup.,1.1585365853658536,0.0441368495254805,82,70,11,1,False,True,77
710,he's on another level.,1.1585365853658536,0.0533985379274743,82,73,5,4,False,True,22
710,Song bird.,1.1585365853658536,0.0474254742547425,82,71,9,2,False,True,10
710,The rare blues-bellied Songbird,1.1585365853658536,0.0505003933701469,82,72,7,3,False,False,31
710,They say he sings like a person.,1.1585365853658536,0.0441368495254805,82,70,11,1,False,True,32
710,Our first warbler of spring-- Does this guy know how to distance himself!,1.1585365853658536,0.0474254742547425,82,71,9,2,False,True,73
710,"I preferred the crowing to ""I woke up this mornin'""",1.1585365853658536,0.0441368495254805,82,70,11,1,False,False,51
710,And tonight on America’s Got Bird Talent....,1.1585365853658536,0.0474254742547425,82,71,9,2,False,True,44
710,"What you're seeing there is 'cantio egregia,' a species native to the southern and midwestern United States.  It's known in common parlance as a ""Bluesbird.""",1.1585365853658536,0.0441368495254805,82,70,11,1,False,False,157
710,"Ferne, looks like the Crested McGuinn left the other Byrds.",1.1585365853658536,0.0441368495254805,82,70,11,1,False,True,59
710,Don't recognize that tweet.,1.1585365853658536,0.0441368495254805,82,70,11,1,False,True,27
710,"Do you think he meant to 
rip that riff from ""Little Wing?""",1.1585365853658536,0.0474254742547425,82,71,9,2,True,False,59
710,The Bluebird of Unhappiness,1.1585365853658536,0.0441368495254805,82,70,11,1,False,False,27
710,It's just a cover.,1.1585365853658536,0.0474254742547425,82,71,9,2,False,True,18
710,"Alas, I believe we've spotted the holy grail of birding ... 
Jimi Hen-drix",1.1585365853658536,0.0441368495254805,82,70,11,1,False,False,74
710,The rare eastern leadbelly warbler!,1.1585365853658536,0.0441368495254805,82,70,11,1,False,True,35
710,They call this the mezzanine?!,1.1585365853658536,0.0474254742547425,82,71,9,2,True,True,30
710,"I know birds' songs are for trying to get laid, Terry. I mean he's playing a guitar for crying out loud, not the drums.",1.1585365853658536,0.0505003933701469,82,72,7,3,False,True,119
710,Clearly a mellow throated warbler but never heard one in that key,1.1585365853658536,0.0441368495254805,82,70,11,1,False,False,65
710,The evolution of the microphone worm is truly an amazing story.,1.1585365853658536,0.0441368495254805,82,70,11,1,False,True,63
710,"No, it's not a new species, it just a magpie wanting to be a starling.",1.1585365853658536,0.0474254742547425,82,71,9,2,False,True,70
710,Look! It's a Robin Redbone in full song.,1.1585365853658536,0.0505003933701469,82,72,7,3,False,True,40
710,It's a delta blues jay.,1.1585365853658536,0.0533985379274743,82,73,5,4,False,True,23
710,I’m sure that’s a blues jay.,1.1585365853658536,0.0441368495254805,82,70,11,1,False,True,28
710,I told you we could find the rare Robert Johnson bird at the crossroads.,1.1585365853658536,0.0441368495254805,82,70,11,1,False,True,72
710,"His name is Jimmy Egret. Somebody called him Jimmy Buffet by mistake, and it went to his head.",1.1585365853658536,0.0441368495254805,82,70,11,1,False,True,94
710,He takes being high literally.,1.1585365853658536,0.0441368495254805,82,70,11,1,False,True,30
710,Quarantined old timer songbird,1.1585365853658536,0.0441368495254805,82,70,11,1,False,False,30
710,"Oh, that’s the bluebird of melancholy.",1.1585365853658536,0.0441368495254805,82,70,11,1,False,True,38
710,"My favorite song bird, by far.",1.1585365853658536,0.0505003933701469,82,72,7,3,False,True,30
710,"Yes, birds can be identified by their singing, but I still don´t think this is a Steven Tyler.",1.1585365853658536,0.0441368495254805,82,70,11,1,False,True,94
710,Looks like one of those strumming birds.,1.1585365853658536,0.0505003933701469,82,72,7,3,False,True,40
710,He looks like an avant-garde Sapsucker but sounds like a bucket of fried chicken.,1.1585365853658536,0.0474254742547425,82,71,9,2,False,True,81
710,Nesting suits his music better than Madison Square,1.1585365853658536,0.0441368495254805,82,70,11,1,False,False,50
710,A raspy throated crooner. Our big year is complete.,1.1585365853658536,0.0474254742547425,82,71,9,2,False,True,51
710,and this bird can sing!,1.1585365853658536,0.0441368495254805,82,70,11,1,False,True,23
710,Yep! It's the often heard but seldom seen Blues-Wailing Strummer.,1.1585365853658536,0.0505003933701469,82,72,7,3,False,True,65
710,"I think it’s a little, too obvious.",1.1585365853658536,0.0441368495254805,82,70,11,1,False,True,35
710,See Bob? Even Woodpeckers get the blues.,1.1585365853658536,0.0405825992733657,82,69,13,0,True,True,40
710,He's tweeting to the flock about social distancing.,1.1585365853658536,0.0441368495254805,82,70,11,1,False,True,51
710,A live bird-watching concert,1.1585365853658536,0.0474254742547425,82,71,9,2,False,False,28
710,I think that’s David Crosby. I heard the Byrds are getting back together,1.1585365853658536,0.0533985379274743,82,73,5,4,False,False,72
710,I recognized it from its song.,1.1585365853658536,0.0474254742547425,82,71,9,2,False,True,30
710,Saw him in ‘83 in Cincinnati - he’s way overproduced now.,1.1585365853658536,0.0474254742547425,82,71,9,2,False,True,57
710,Finally - The Blues Bird,1.1585365853658536,0.0441368495254805,82,70,11,1,False,False,24
710,The Mississippi Blue's song is strong but troubled.,1.1585365853658536,0.0474254742547425,82,71,9,2,False,True,51
710,Am I right?.... is it a blues Jay?,1.1585365853658536,0.0405825992733657,82,69,13,0,True,True,34
710,Okurrr,1.1585365853658536,0.0441368495254805,82,70,11,1,False,False,6
710,"It's the first stop on his rap tour""",1.1585365853658536,0.0474254742547425,82,71,9,2,False,False,36
710,Our first social distancing bird.,1.1585365853658536,0.0441368495254805,82,70,11,1,False,True,33
710,Oh look! It’s Charlie Feathers.,1.1585365853658536,0.0474254742547425,82,71,9,2,False,True,31
710,Bluebird singing the blues.,1.1585365853658536,0.0505003933701469,82,72,7,3,False,True,27
710,All was better before/Back when we were all dinosaur.,1.1585365853658536,0.0441368495254805,82,70,11,1,False,True,53
710,Looks like he's rustling.,1.1585365853658536,0.0405825992733657,82,69,13,0,False,True,25
710,Goin' back to Hibbing? Who writes a song about a town nobody ever hear of.,1.1585365853658536,0.0474254742547425,82,71,9,2,True,True,74
710,Everyone wants a piece of the action.,1.1585365853658536,0.0505003933701469,82,72,7,3,False,True,37
710,I think this mocking bird is mocking your pick up technique Dave.,1.1585365853658536,0.0441368495254805,82,70,11,1,False,True,65
710,"As I said, this species is known for its mating tactics.",1.1585365853658536,0.0441368495254805,82,70,11,1,False,True,56
710,"If he keeps playing free concerts, he'll never get his musician's card.",1.1585365853658536,0.0474254742547425,82,71,9,2,False,True,71
710,'Could you at least buy tickets?',1.1585365853658536,0.0441368495254805,82,70,11,1,True,False,33
710,So Darwinian--that flicker's gone from pecking to plucking.,1.1585365853658536,0.0441368495254805,82,70,11,1,False,True,59
710,"Its a jingle for his new business,
curbside worm pick-up.",1.1585365853658536,0.0474254742547425,82,71,9,2,False,True,57
710,Working from home can be dangerous.,1.1585365853658536,0.0474254742547425,82,71,9,2,False,True,35
710,It looks to me like a Night Owl.,1.1585365853658536,0.0474254742547425,82,71,9,2,False,True,32
710,You were so smart to get the binoculars with Bluetooth ear buds.,1.1585365853658536,0.0441368495254805,82,70,11,1,False,True,64
710,"Well, I suppose it’s a “Blues” Jay.",1.1585365853658536,0.0441368495254805,82,70,11,1,False,True,35
710,"Wow, I've finally seen a nesting blues bird!",1.1585365853658536,0.0441368495254805,82,70,11,1,False,True,44
710,"Yes, you’re right, it is a wailing warbler wannabe!",1.1585365853658536,0.0441368495254805,82,70,11,1,False,True,51
710,I thought you got us front row seats.,1.1585365853658536,0.0505003933701469,82,72,7,3,False,True,37
710,"By gosh, it's a red-headed Willie Warbler.  I'd recognize that call anywhere.",1.1585365853658536,0.0474254742547425,82,71,9,2,False,True,77
710,Must be a BB Kingfisher..,1.1585365853658536,0.0441368495254805,82,70,11,1,False,True,25
710,He’s singing the Covid19 blues,1.1585365853658536,0.0505003933701469,82,72,7,3,False,False,30
710,"Wrong, it’s Jay playing the Blues",1.1585365853658536,0.0474254742547425,82,71,9,2,False,False,33
710,"Finally I have spotted the rare Mute Bird, yet still it makes beautiful music!",1.1585365853658536,0.0474254742547425,82,71,9,2,False,True,78
710,Look! Rockin’ Robin’s to come out of retirement and play for the neighborhood during the lockdown.,1.1585365853658536,0.0441368495254805,82,70,11,1,False,True,98
710,"I guess that is what they mean by ""song bird""",1.1585365853658536,0.0441368495254805,82,70,11,1,False,False,45
710,His is a unique chirp like sound.,1.1585365853658536,0.0405825992733657,82,69,13,0,False,True,33
710,"No, I need a classical guitarist on my Life List.",1.1585365853658536,0.0441368495254805,82,70,11,1,False,True,49
710,It's my first Blues Warbler!,1.1585365853658536,0.0441368495254805,82,70,11,1,False,True,28
710,Definitely a warbler but it’s singing Leonard Cohen.,1.1585365853658536,0.0441368495254805,82,70,11,1,False,True,52
710,"Hey, that's the original version of Rockin' Robin!",1.1585365853658536,0.0505003933701469,82,72,7,3,False,True,50
710,See Ron? Look at that and tell me they're not spies!,1.1585365853658536,0.0474254742547425,82,71,9,2,True,True,52
710,The only other one I ever saw was in the Ken Burns Country Music documentary.,1.1585365853658536,0.0474254742547425,82,71,9,2,False,True,77
710,He probably migrated here from the crossroads in the Mississippi Delta,1.1585365853658536,0.0441368495254805,82,70,11,1,False,False,70
710,"Yup, definitely a hawk. I believe a Leon Redbone.",1.1585365853658536,0.0405825992733657,82,69,13,0,False,True,49
710,It's pictures not in the bird book,1.1585365853658536,0.0505003933701469,82,72,7,3,False,False,34
710,Wow-- it's the rare pickin' chicken!,1.1585365853658536,0.0441368495254805,82,70,11,1,False,True,36
710,"Ooh, a blue-breasted crooner.",1.1585365853658536,0.0441368495254805,82,70,11,1,False,True,29
710,"Listen! That tree is alive with the sound of music!
Mary Grace Dembeck, Bethel CT",1.1585365853658536,0.0505003933701469,82,72,7,3,False,False,81
710,"So, guitars *are* chick magnets!",1.1585365853658536,0.0474254742547425,82,71,9,2,False,True,32
710,It's a flamenco.,1.1585365853658536,0.0474254742547425,82,71,9,2,False,True,16
710,It looks like the Western Meadow Lark !,1.1585365853658536,0.0441368495254805,82,70,11,1,False,True,39
710,I'm pretty sure it's a Charlie Byrd.,1.1585365853658536,0.0474254742547425,82,71,9,2,False,True,36
710,"I told you I heard Dueling Banjos, but how’s he playing both parts?",1.1585365853658536,0.0474254742547425,82,71,9,2,True,True,67
710,Willie is high than normal,1.1585365853658536,0.0533985379274743,82,73,5,4,False,False,26
710,The godfather of birdsong,1.1585365853658536,0.0474254742547425,82,71,9,2,False,False,25
710,Is that turkey in the straw?,1.1585365853658536,0.0474254742547425,82,71,9,2,True,True,28
710,"Well, imitation is the sincerest form of flattery.",1.1585365853658536,0.0441368495254805,82,70,11,1,False,True,50
710,I told you I heard the plaintive cry os a blues jay!,1.1585365853658536,0.0441368495254805,82,70,11,1,False,True,52
710,I don't believe it... it's the elusive Woodypecker,1.1585365853658536,0.0474254742547425,82,71,9,2,False,False,50
710,Must be a blues singer,1.1585365853658536,0.0505003933701469,82,72,7,3,False,False,22
710,"Probably practicing for ""Birds Got Talent"" auditions.",1.1585365853658536,0.0474254742547425,82,71,9,2,False,True,53
710,"Well, that explains what we found in the litter box",1.1585365853658536,0.0533985379274743,82,73,5,4,False,False,51
710,The bluejays have certainly gotten more dramatic this year.,1.1585365853658536,0.0405825992733657,82,69,13,0,False,True,59
710,His signature mating call is a song about the depth of life.,1.1585365853658536,0.0474254742547425,82,71,9,2,False,True,60
710,"Since migratory flying is restricted under quarantine, he's singing the blues",1.1585365853658536,0.0533985379274743,82,73,5,4,False,False,77
710,"I'd rather be blue, thinking of you, I 'd rather be blue over you...
you know the rest.",1.1585365853658536,0.0441368495254805,82,70,11,1,False,True,87
710,"The virus got them singing, didn't I tell you?",1.1585365853658536,0.0474254742547425,82,71,9,2,True,True,46
710,"That's a Rockin' Robin, indeed.",1.1585365853658536,0.0505003933701469,82,72,7,3,False,True,31
710,He started out in a Karoke Treesom,1.1585365853658536,0.0474254742547425,82,71,9,2,False,False,34
710,Just a common songbird.,1.1585365853658536,0.0441368495254805,82,70,11,1,False,True,23
710,It sounds like a rare Southern Blues Jay.,1.1585365853658536,0.0441368495254805,82,70,11,1,False,True,41
710,This one’s by far gotta be the most evolved hummingbird,1.1585365853658536,0.0441368495254805,82,70,11,1,False,False,55
710,That's some real Mississippi Delta warbling.,1.1585365853658536,0.0474254742547425,82,71,9,2,False,True,44
710,"Ah, I think it is a spotted crooner.",1.1585365853658536,0.0441368495254805,82,70,11,1,False,True,36
710,I heard he sold his soul at the cross-grove.,1.1585365853658536,0.0441368495254805,82,70,11,1,False,True,44
710,"Thats interesting! I know that bird is a Dumetella carolinensis, but  he seems to have changed his tune.",1.1585365853658536,0.0405825992733657,82,69,13,0,False,True,104
710,I wonder how he'd be on saxophone.,1.1585365853658536,0.0441368495254805,82,70,11,1,False,True,34
710,"Let's go Carol, I didn't come out here for 'bird-listening'",1.1585365853658536,0.0441368495254805,82,70,11,1,False,False,59
710,"Woody Woodpecker sounds a lot like Woody Guthrie.""",1.1585365853658536,0.0474254742547425,82,71,9,2,False,False,50
710,That there is the elusive Tracy Byrd.,1.1585365853658536,0.0474254742547425,82,71,9,2,False,True,37
710,Looks like some type of warbler.,1.1585365853658536,0.0474254742547425,82,71,9,2,False,True,32
710,"Hmmm, another avian is about to go viral",1.1585365853658536,0.0441368495254805,82,70,11,1,False,False,40
710,Just who does that plucking turkey think he is?,1.1585365853658536,0.0441368495254805,82,70,11,1,True,True,47
710,"I dunno. It’s either this or the co-op, but I think I like the tree lined street better  than Chicken Dropping Way.",1.1585365853658536,0.0474254742547425,82,71,9,2,False,True,115
710,"Honey, why did we pay for that concert that we went to last week?",1.1585365853658536,0.0441368495254805,82,70,11,1,True,True,65
710,I think it’s a bluesbird of happiness.,1.1585365853658536,0.0405825992733657,82,69,13,0,False,True,38
710,"Well, I'll be! A Hootenanny eagle. I thought they were extinct!",1.1585365853658536,0.0441368495254805,82,70,11,1,False,True,63
710,Rare Hysteric Clapton.,1.1585365853658536,0.0474254742547425,82,71,9,2,False,True,22
710,"Ladies and gentlemen, Eric Flapton.",1.1585365853658536,0.0441368495254805,82,70,11,1,False,True,35
710,It's a Nashville sapsucker.,1.1585365853658536,0.0405825992733657,82,69,13,0,False,True,27
710,I hear he's using autotune now.,1.1585365853658536,0.0441368495254805,82,70,11,1,False,True,31
710,"holy cow honey, look! it’s Jason Mraz!",1.1585365853658536,0.0405825992733657,82,69,13,0,False,True,38
710,If he’s singing the blues it’s probably a bluebird.,1.1585365853658536,0.0405825992733657,82,69,13,0,False,True,51
710,"A duck walked up to a lemonade stand
And he said to the man, running the stand
""Hey! (Bum bum bum) Got any grapes?""",1.1585365853658536,0.0474254742547425,82,71,9,2,True,False,115
710,I told you we should've payed more for a better seat.,1.1585365853658536,0.0474254742547425,82,71,9,2,False,True,53
710,"If you look closely, you should discern its blue underbelly, indicating that this is not the more common Bird’s Nest Soup, but the far rarer Bird’s Nest Soul.",1.1585365853658536,0.0441368495254805,82,70,11,1,False,True,158
710,I think it's a Woodpecker Guthrie.,1.1585365853658536,0.0474254742547425,82,71,9,2,False,True,34
710,"Well, I'll be...it's the flipping Johnny Cash bird!",1.1585365853658536,0.0441368495254805,82,70,11,1,False,True,51
710,"If you listen closely, you'll hear a pretty decent Bob Seger cover.",1.1585365853658536,0.0474254742547425,82,71,9,2,False,True,67
710,It's not the color that makes Jay blue. It's his troubled heart.,1.1585365853658536,0.0505003933701469,82,72,7,3,False,True,64
710,"That type plucks strings, not feathers.",1.1585365853658536,0.0405825992733657,82,69,13,0,False,True,39
710,"I woke up this morning, my baby was gone",1.1585365853658536,0.0405825992733657,82,69,13,0,False,False,40
710,"Yep, it's a 'Blues Bird', but not the one of happiness.",1.1585365853658536,0.0441368495254805,82,70,11,1,False,True,55
710,What a sell out.,1.1585365853658536,0.0505003933701469,82,72,7,3,False,True,16
710,That's just another North American Blues Bird.,1.1585365853658536,0.0441368495254805,82,70,11,1,False,True,46
710,Six feet apart.,1.1585365853658536,0.0505003933701469,82,72,7,3,False,True,15
710,It's a bluebird all right. He's singing the isolation blues!,1.1585365853658536,0.0405825992733657,82,69,13,0,False,True,60
710,"Hurry up, it’s just another blues jay.",1.1585365853658536,0.0441368495254805,82,70,11,1,False,True,38
710,A nesting bird making love music for a mate.,1.1585365853658536,0.0474254742547425,82,71,9,2,False,True,44
710,The elusive Little Red Rooster.,1.1585365853658536,0.0474254742547425,82,71,9,2,False,True,31
710,"Listen, Pete, he's singing Melancholy Baby!",1.1585365853658536,0.0474254742547425,82,71,9,2,False,True,43
710,Not what I expected when I mic'ed the neighbor's tree.,1.1585365853658536,0.0441368495254805,82,70,11,1,False,True,54
710,Keep listening. I believe their song gets sadder.,1.1585365853658536,0.0474254742547425,82,71,9,2,False,True,49
710,We found it. Hallelujah.,1.1585365853658536,0.0474254742547425,82,71,9,2,False,True,24
710,solo performance with du(0)(0) attendance,1.1585365853658536,0.0474254742547425,82,71,9,2,False,False,41
710,"Yo bob, I think the bird misses his country music festival.",1.1585365853658536,0.0505003933701469,82,72,7,3,False,True,59
710,It's a Tom Waits warbler.,1.1585365853658536,0.0441368495254805,82,70,11,1,False,True,25
710,"There's always one traveling wilbury who doesn't go anywhere, who just stays put.",1.1585365853658536,0.0441368495254805,82,70,11,1,False,True,81
710,That's definitely the rare Migratorus Chordata - the only song it knows is Freebird' . . .,1.1573033707865168,0.0449118885544538,89,77,10,2,False,True,90
710,"Well, That's certainly one way to do social distancing .",1.1573033707865168,0.0388117572869526,89,75,14,0,False,True,56
710,Nature streaming Live 24/7”,1.1566265060240963,0.0436436553063486,83,71,11,1,False,False,27
710,Is it Key To the Highway or Trouble in Mind?”,1.1566265060240963,0.046889519178274,83,72,9,2,True,False,45
710,"“Blackbird singing in the dead of night, take these sunken eyes and learn to see”",1.1566265060240963,0.0499247971356927,83,73,7,3,False,False,81
710,"They’ll love this.”
“We can’t hear you!”",1.1566265060240963,0.0436436553063486,83,71,11,1,False,False,40
710,“they say he learned to play during lockdown”,1.1566265060240963,0.0401361469031224,83,70,13,0,False,False,45
710,Apparently they’ve abandoned all pretence of inferiority now that the human race is so clearly doomed!,1.1566265060240963,0.0499247971356927,83,73,7,3,False,True,102
710,I said I was looking forward to the retreat - not retweet.,1.1566265060240963,0.0436436553063486,83,71,11,1,False,True,58
710,Can't you tell? That's a Blues Jay.,1.1566265060240963,0.0436436553063486,83,71,11,1,True,True,35
710,"Dylan, man. He never stops reinventing himself.",1.1566265060240963,0.0499247971356927,83,73,7,3,False,True,47
710,Why it’s Bye Bye Birdie singing the blues.,1.1566265060240963,0.046889519178274,83,72,9,2,False,True,42
710,He’s been protesting his eviction forever.,1.1566265060240963,0.0436436553063486,83,71,11,1,False,True,42
710,I watched this bird all the time before he got famous.,1.1566265060240963,0.0436436553063486,83,71,11,1,False,True,54
710,I'm rethinking my stance on extinction.,1.1566265060240963,0.0436436553063486,83,71,11,1,False,True,39
