contest,caption,mean,precision,votes,not_funny,somewhat_funny,funny,has_question_mark,ends_with_punctuation,caption_length
865,Howling at the black hole doesn't have quite the same ring to it.,1.186046511627907,0.0350081646302131,172,145,22,5,False,True,65
865,I guess all the howling finally got to him.,1.186046511627907,0.0359662487171022,172,146,20,6,False,True,43
865,A new moon.  Embrace the calm.,1.185897435897436,0.0325437761796379,156,128,27,1,False,True,30
865,I hope we don't get pooped on!,1.185792349726776,0.0362155669354384,183,157,18,8,False,True,30
865,Looks like one of the theater camp kids finally hit high C,1.185792349726776,0.0327317938241518,183,153,26,4,False,False,58
865,"I’m always being blamed, but that’s where all the homework goes.",1.1857142857142855,0.0425131794880889,140,121,12,7,False,True,64
865,Bet it smells good,1.18562874251497,0.0335723330028186,167,139,25,3,False,False,18
865,Sirius is on the loose!,1.18562874251497,0.0356565741068541,167,141,21,5,False,True,23
865,You're baying at Pink Floyd.,1.18562874251497,0.0376255366848504,167,143,17,7,False,True,28
865,"I think it was Carl Sagan's mutt who said: ""“Our planet is a lonely speck in the great enveloping cosmic dark. In our obscurity, in all this vastness, there is no hint that help will come from elsewhere to save us from ourselves.”",1.18562874251497,0.0376255366848504,167,143,17,7,False,False,230
865,"If somebody calls, don't go.",1.18562874251497,0.0346301373105112,167,140,23,4,False,True,28
865,That’s where bad dogs go.,1.18562874251497,0.0376255366848504,167,143,17,7,False,True,25
865,"Ah Rufus,see the curves of the great ball we can never catch",1.18562874251497,0.0346301373105112,167,140,23,4,False,False,60
865,It’s all my fault. She caught me howling at the sun yesterday. This is terrible. I miss her so much,1.18562874251497,0.0376255366848504,167,143,17,7,False,False,99
865,I’m telling you. There was a giant frisbee up there!”,1.1855670103092784,0.0355501105970888,194,167,18,9,False,False,53
865,"They sent dogs into space, and chimps, and humans.. so why not cats?",1.185430463576159,0.0368805404158182,151,127,20,4,True,True,68
865,Sometimes it does that.,1.185430463576159,0.0356633430936059,151,126,22,3,False,True,23
865,I guess they call it the moon because it kinda looks like someone's butthole.,1.185430463576159,0.038058829226782,151,128,18,5,False,True,77
865,I told you we were late!,1.185430463576159,0.0344031077064514,151,125,24,2,False,True,24
865,“OK…we finally howled it away…now what?”,1.1853932584269662,0.0377432744532629,178,154,15,9,True,False,40
865,That’s five balls we need back.,1.1853932584269662,0.0351299708261748,178,151,21,6,False,True,31
865,Einstein only theorized wormholes. We've discovered dog holes.,1.1853932584269662,0.0342145419109927,178,150,23,5,False,True,62
865,"Oh dear, looks like the cow didn't make it, after all",1.1853932584269662,0.0323059581817574,178,148,27,3,False,False,53
865,I don’t feel like howling tonight. I think I’ll just journal about this.,1.1851851851851851,0.0341651696353481,162,135,24,3,False,True,72
865,Is this the answer to the Universe or are we just hungry?,1.1851851851851851,0.033768902969944,189,160,23,6,True,True,57
865,"Do we howl, or what?",1.1851851851851851,0.0341651696353481,162,135,24,3,True,True,20
865,"If the cat were here, she'd know what it means.",1.1851851851851851,0.0381802555851705,135,113,19,3,False,True,47
865,And that’s where all the squirrels go.,1.1851851851851851,0.0363403534437293,162,137,20,5,False,True,38
865,Now you have to pay monthly for Moon+.,1.1851851851851851,0.0383924961498757,162,139,16,7,False,True,38
865,I hear it's AWESOME in color.,1.184971098265896,0.031794962519264,173,143,28,2,False,True,29
865,So that's what the new moon looks like!,1.184971098265896,0.0348218271631238,173,146,22,5,False,True,39
865,"Apparently, Canis Major was a major bully and was canceled.",1.184971098265896,0.0348218271631238,173,146,22,5,False,True,59
865,So that’s where Pluto buries his bones.,1.1849315068493151,0.0400795437930601,146,125,15,6,False,True,39
865,"One day, I want to sniff that.",1.1849315068493151,0.0336749650959287,146,120,25,1,False,True,30
865,Kind of big for a worm whole if you ask me.,1.184782608695652,0.0325690738931274,184,154,26,4,False,True,43
865,Howling at the black hole just doesn't have the same ring.,1.184782608695652,0.0325690738931274,184,154,26,4,False,True,58
865,"But don't forget Einstein's theory, and I quote.....",1.184782608695652,0.0360323562819071,184,158,18,8,False,True,52
865,"Howling at them may feel good, but it doesn't really solve anything.",1.1847133757961783,0.0370627164337591,157,133,19,5,False,True,68
865,Wait. What?,1.1847133757961783,0.0359442016481258,157,132,21,4,True,True,11
865,"Starry, starry black hole...",1.1845238095238095,0.034441117056244,168,141,23,4,False,True,28
865,"They call it a black hole, but I call it a 'space in space'.",1.1845238095238095,0.0383579788544802,168,145,15,8,False,True,60
865,Hardly worth howling at that.,1.1845238095238095,0.0333901863524627,168,140,25,3,False,True,29
865,I’m howling on the inside.,1.1845238095238095,0.0364521953103146,168,143,19,6,False,True,26
865,I miss the Earth.,1.1843575418994414,0.0331037334594956,179,150,25,4,False,True,17
865,I don’t know what we’re supposed to do now.,1.1843575418994414,0.0340386231742002,179,151,23,5,False,True,43
865,Do you think we ate it?,1.1843575418994414,0.0358353075174604,179,153,19,7,True,True,23
865,"I don't know what they do at their church, but I pray this is a big meatball.",1.1842105263157894,0.0389620614188805,152,130,16,6,False,True,77
865,That's where the howl catcher used to live,1.1842105263157894,0.0378272898086546,152,129,18,5,False,False,42
865,I hear it's full of cats.,1.1842105263157894,0.0378272898086546,152,129,18,5,False,True,25
865,I did NOT dig that one.,1.1842105263157894,0.0378272898086546,152,129,18,5,False,True,23
865,Watch if we don’t get blamed for tearing a hole in the fabric of space-time.,1.1840490797546013,0.0361345829057902,163,138,20,5,False,True,76
865,"Oh well, I didn't feel like howling anyways. But on the brightside now we can see the dog star.",1.1840490797546013,0.0371678415275135,163,139,18,6,False,True,95
865,"Well, let's just bay at the event horizon then.",1.1840490797546013,0.0391526393477147,163,141,14,8,False,True,47
865,Should we sniff it?,1.1839080459770115,0.0336646920658045,174,146,24,4,True,True,19
865,"I knew you were good at digging holes.  But that one . . . oh, my.",1.1839080459770115,0.0365052571015638,174,149,18,7,False,True,66
865,"That, son, is a black hoooowl!",1.1839080459770115,0.0316295740688186,174,144,28,2,False,True,30
865,It's just a black hole.  Don't get sucked in.,1.1837837837837837,0.0333020888703724,185,156,24,5,False,True,45
865,Do you think we’ll get to sniff one in our lifetime?,1.1837837837837837,0.0358509740853949,185,159,18,8,True,True,52
865,Do they expect us to howl at this one?,1.183673469387755,0.0386381826300519,147,125,17,5,True,True,38
865,Are you not seeing what I’m not seeing?,1.1835443037974684,0.036845946426098,158,134,19,5,True,True,39
865,"Screw it, I'll sniff anything once.",1.1835443037974684,0.0389727478913378,158,136,15,7,False,True,35
865,All that cheese just gone!,1.183431952662722,0.0332099768056858,169,141,25,3,False,True,26
865,Black holes matter.,1.183431952662722,0.0352673689932147,169,143,21,5,False,True,19
865,"Yup, so that's the holy place where all dogs go to heaven!!!!!",1.183431952662722,0.0352673689932147,169,143,21,5,False,True,62
865,Should we try to go sniff it?,1.183431952662722,0.0352673689932147,169,143,21,5,True,True,29
865,"Humans call it a Black Hole, I'm just hungry.",1.183431952662722,0.0352673689932147,169,143,21,5,False,True,45
865,"I can dig it.""",1.183431952662722,0.0362523060485571,169,144,19,6,False,False,14
865,Mommy when did Canis Major turn around?,1.183431952662722,0.0381459624351991,169,146,15,8,True,True,39
865,"Now that it’s gone, do we call it a day?",1.183431952662722,0.0342541229280342,169,142,23,4,True,True,40
865,See what happens when you howl at the moon: it gets scared.,1.1833333333333331,0.0329352392032914,180,151,25,4,False,True,59
865,Our barks really are worse than our bites!,1.1833333333333331,0.0356503817745391,180,154,19,7,False,True,42
865,::sniiiiifffffff::,1.1833333333333331,0.0365105870550061,180,155,17,8,False,False,18
865,An infinite void . . . No light. No sound. No behind-the-ear rubs.,1.1833333333333331,0.0338644832798141,180,152,23,5,False,True,66
865,It's a zen moon. You howl to it in silence.,1.1832460732984291,0.0350515847998939,191,164,19,8,False,True,43
865,I know it's still there.  I can smell it.,1.1832460732984291,0.0350515847998939,191,164,19,8,False,True,41
865,What did you expect? It was only a paper moon.,1.1830065359477124,0.0398201889189314,153,132,14,7,True,True,46
865,"So, do we howl? Not howl? I’m so confused…",1.1830065359477124,0.03759852153381,153,130,18,5,True,False,42
865,Maybe that's where you buried that bone.,1.1829268292682926,0.0359311043337037,164,139,20,5,False,True,40
865,I wonder what took those humans so long to figure out what a black hole was.,1.1829268292682926,0.0348744542545438,164,138,22,4,False,True,76
865,"Google says dogs howling at the moon is a myth, but you can't argue with results like this.""",1.1829268292682926,0.0379562597843093,164,141,16,7,False,False,92
865,There! Bury your bone there and they’ll never find it.,1.1829268292682926,0.0389293508281503,164,142,14,8,False,True,54
865,Can someone turn on the moon?,1.1829268292682926,0.0359311043337037,164,139,20,5,True,True,29
865,I guess we made too big a fuss.,1.1828571428571428,0.0324928040175847,175,146,26,3,False,True,31
865,I'll smell you later.,1.1828571428571428,0.0344549735583812,175,148,22,5,False,True,21
865,I just can’t get as excited about howling at a black hole.,1.1828571428571428,0.0353952913238546,175,149,20,6,False,True,58
865,Guess we need to learn anti howling.,1.1828571428571428,0.0334882629874551,175,147,24,4,False,True,36
865,It's a black hole and it takes away bones forever!,1.1827956989247312,0.0364769920025669,186,161,16,9,False,True,50
865,Howling feels hollow.,1.1827956989247312,0.0303926384866588,186,154,30,2,False,True,21
865,"I don’t care if it’s dangerous, I still want to chase it.",1.1827956989247312,0.0340029855932083,186,158,22,6,False,True,57
865,The man in orange wants to put his picture there.,1.1824324324324325,0.0418337288761412,148,129,11,8,False,True,49
865,I didn't understand the ending of Barbie either.,1.1824324324324325,0.0371799168672222,148,125,19,4,False,True,48
865,its called the dog constellation----see the bowl,1.1824324324324325,0.0359223823666571,148,124,21,3,False,False,48
865,"My owner says that black holes are cosmological bodies so dense that not even light can escape, but he also mutters a lot about Mercury being in retrograde and how that negatively impacts him as a Pisces so I don’t know….",1.1824324324324325,0.0429184055509955,148,130,9,9,False,True,221
865,"Is it me, or is that black hole getting bigger?",1.1823899371069182,0.035528408436945,159,134,21,4,True,True,47
865,"Howling isn't quite the same, is it?",1.1823899371069182,0.0343897704290444,159,133,23,3,True,True,36
865,They say we’ll all end up there sooner or later.,1.1823899371069182,0.0366316707503547,159,135,19,5,False,True,48
865,No moon? No cow?  No howl!,1.1823899371069182,0.0387440613999412,159,137,15,7,True,True,26
865,Moon for the misbegotten,1.1823899371069182,0.0366316707503547,159,135,19,5,False,False,24
865,"If we don't bark at the moon every night, it disappears.",1.1823529411764706,0.0370073786979046,170,146,17,7,False,True,56
865,You should have stopped howling at that thing!,1.1823529411764706,0.0350759004095628,170,144,21,5,False,True,46
865,The real estate there is over the moon.,1.1823529411764706,0.0360545757680748,170,145,19,6,False,True,39
865,"It's god's butthole, son. To smell that is to know everything there ever was.",1.1823529411764706,0.0350759004095628,170,144,21,5,False,True,77
865,"No, if it were a black hole we would see the event horizon.",1.1823529411764706,0.037936258676422,170,147,15,8,False,True,59
865,Not much to howl at tonight is there,1.1823204419889504,0.0345911068342508,181,154,21,6,False,False,36
865,Should we try to howl again?,1.1823204419889504,0.0318179604846611,181,151,27,3,True,True,28
865,"It's called a black hole, Pluto. And it's where all the bad puppies go, never to be heard from again.",1.1823204419889504,0.0363224363228655,181,156,17,8,False,True,101
865,I just see a bone.,1.181818181818182,0.0346801745451764,165,139,22,4,False,True,18
865,Maybe he just slipped off?,1.181818181818182,0.0301488154073204,198,165,30,3,True,True,26
865,"Doghole, not wormhole, Rover.",1.181818181818182,0.0337942986018418,154,128,24,2,False,True,29
865,"Well, I guess it's because we were howling at it for so long...it just exploded!",1.181818181818182,0.0367496145081644,165,141,18,6,False,True,80
865,Now that's something to howl about,1.181818181818182,0.0320903528900949,187,157,26,4,False,False,34
865,"Ooooo! O,O,Ooooo!",1.181818181818182,0.0373724755864699,154,131,18,5,False,True,17
865,what's our purpose now?,1.181818181818182,0.0350276612952401,154,129,22,3,True,True,23
865,"Now you've done it. I said give me a howl, not a hole!",1.181818181818182,0.0342743979750562,176,149,22,5,False,True,54
865,"Okay, quantum physics aside, what if it’s not a hole. What if it’s a ball?",1.181818181818182,0.0395786155279403,154,133,14,7,True,True,74
865,You go first.,1.1813186813186811,0.0344151035725508,182,155,21,6,False,True,13
865,Look! Alpo Centauri!,1.1812865497076024,0.0368057765312773,171,147,17,7,False,True,20
865,They said it was a solution to the howling.,1.1812865497076024,0.0386298341347607,171,149,13,9,False,True,43
865,"It's the eyeball of somethin' big, I'm tellin' ya....",1.18125,0.0353240557565852,160,135,21,4,False,True,53
865,"If you look right in the middle, you can see Uranus.",1.1812080536912752,0.0381573722932699,149,127,17,5,False,True,52
865,"Yes, I miss howling, but I'm mastering scat.",1.181159420289855,0.0388062470724191,138,117,17,4,False,True,44
865,That’’s where this thing they used to call Earth was located.,1.1807909604519775,0.033140826337957,177,149,24,4,False,True,61
865,How can we howl when we can't see the moon?,1.1807909604519775,0.0359293525759365,177,152,18,7,True,True,43
865,Yes it could be a giant chocolate donut but sadly it’s probably a peek at the existential void,1.1807909604519775,0.0376738775187995,177,154,14,9,False,False,94
865,Should I howl or not?,1.180722891566265,0.0334126365447171,166,139,24,3,True,True,21
865,I think we drank too much Moonshine.,1.180722891566265,0.0375297439557014,166,143,16,7,False,True,36
865,I think it is a black hole and not a planet because I feel strangely compelled to throw a bone in there and cover it up.,1.180722891566265,0.0384902719074351,166,144,14,8,False,True,120
865,It’s howling at us!,1.180722891566265,0.0355308736330101,166,141,20,5,False,True,19
865,It's like a hole in the sky. A black hole.,1.180722891566265,0.0355308736330101,166,141,20,5,False,True,42
865,"Wow, even the moon is feeling this energy crisis.",1.180722891566265,0.0365439780436219,166,142,18,6,False,True,49
865,"I call it a ""Black Howl""",1.180722891566265,0.0365439780436219,166,142,18,6,False,False,24
865,"Always thought it was overrated, to be honest.  Plus, no more werewolves, which is nice.",1.180722891566265,0.0365439780436219,166,142,18,6,False,True,88
865,I swear it was there two weeks ago.,1.180722891566265,0.0334126365447171,166,139,24,3,False,True,35
865,"No, I'm Canis Major, the big dog, and you're Canis Minor, the little dog.",1.180722891566265,0.0355308736330101,166,141,20,5,False,True,73
865,I could really dig that hole as an astronaut ... a dog can dream,1.180722891566265,0.0323014694826967,166,138,26,2,False,False,64
865,They say it’s the Dog Star but it looks like an empty feed bowl to me.,1.1806451612903226,0.0360037326905522,155,131,20,4,False,True,70
865,It’s the ultimate fetch.,1.1806451612903226,0.0403908094731739,155,135,12,8,False,True,24
865,...another rolling blackout...,1.1806451612903226,0.0382602029369355,155,133,16,6,False,True,30
865,That’s the only hole I’ve seen but haven’t sniffed yet,1.1806451612903226,0.0371491042720294,155,132,18,5,False,False,54
865,It ain’t the same. Howling at an eclipse.,1.1805555555555556,0.0402169449246126,144,124,14,6,False,True,41
865,"Frankly, I always found Pink Floyd 
pretentious and overrated.",1.180232558139535,0.0356654553808481,172,147,19,6,False,True,62
865,"Just when I get my howl perfected, this happens.",1.180232558139535,0.0337049817610774,172,145,23,4,False,True,48
865,Perhaps we should howl at it.,1.180232558139535,0.0346990670122255,172,146,21,5,False,True,29
865,Someday we will go to that big Dog House in the sky,1.180232558139535,0.0337049817610774,172,145,23,4,False,False,51
865,What's next--they neuter us?,1.1801242236024845,0.0339987654573136,161,135,23,3,True,True,28
865,Do you ever feel as if we're all howling over nothing?,1.1801242236024845,0.0372670807453416,161,138,17,6,True,True,54
865,I begged you not to sing.,1.1801242236024845,0.0339987654573136,161,135,23,3,False,True,25
865,"With howling out, now what ?",1.18,0.0354832411524731,150,126,21,3,True,True,28
865,That’s okay. I have a bit of a sore throat anyway.,1.1798561151079137,0.0424116573244266,139,121,11,7,False,True,50
865,Do you think our howls were too piercing?,1.1797752808988764,0.0329697643973121,178,150,24,4,True,True,41
865,You howled too loud.,1.1797752808988764,0.0329697643973121,178,150,24,4,False,True,20
865,"They call it a black hole, but I like to think of it as marrow at the center of a bone.",1.1796407185628743,0.0363406090869245,167,143,18,6,False,True,87
865,Must be a power failure!,1.1796407185628743,0.0353340487620077,167,142,20,5,False,True,24
865,Should we be baying at that thing?,1.1796407185628743,0.0321256968988655,167,139,26,2,True,True,34
865,I bet you could learn the secrets of the universe if you could get close enough to sniff that.,1.1796407185628743,0.0342979610913421,167,141,22,4,False,True,94
865,"Mom told you she loves you to the moon and back,eh?",1.1796407185628743,0.0353340487620077,167,142,20,5,True,True,51
865,I can’t put my paw on it.  I just don’t feel like howling tonight.,1.1796407185628743,0.033229584230479,167,140,24,3,False,True,66
865,I don't feel like howling either.  Let's just talk.,1.1796407185628743,0.0353340487620077,167,142,20,5,False,True,51
865,Maybe now we can have a real conversation,1.1796407185628743,0.0353340487620077,167,142,20,5,False,False,41
865,"Well, this could explain my lack of motivation lately.",1.1794871794871795,0.0357909326387931,156,132,20,4,False,True,54
865,"it doesn't mean there's nothing there, only that there is so much we can't see it",1.1794871794871795,0.036928360985744,156,133,18,5,False,False,81
865,"Black hole or new moon? I dunno, it's all black & white to me.",1.1794871794871795,0.0357909326387931,156,132,20,4,True,True,62
865,"Look at the stars. See their beauty.
And in that beauty, see that doughnut we weren't allowed eat
(Louis Narushima-Johnson, 13)",1.1794871794871795,0.036928360985744,156,133,18,5,False,False,127
865,It’s nothing to sniff at.,1.1794871794871795,0.0357909326387931,156,132,20,4,False,True,25
865,Of course it's serious.,1.1794871794871795,0.036928360985744,156,133,18,5,False,True,23
865,Legend has it that billions of lost tennis balls have slipped into that hole.,1.1793478260869563,0.0331851907068537,184,156,23,5,False,True,77
865,I swear it was just here.,1.179310344827586,0.0399580305649855,145,125,14,6,False,True,25
865,Wow. Look at all the colors!,1.179310344827586,0.0374843077221157,145,123,18,4,False,True,28
865,Maybe we should bark at it.,1.179310344827586,0.0399580305649855,145,125,14,6,False,True,27
865,I heard in there you can run forever.,1.1791907514450868,0.0335257797897713,173,146,23,4,False,True,37
865,You…you think we were a little too loud?,1.1791907514450868,0.0354739986576594,173,148,19,6,True,True,40
865,Howling at it just hasn’t felt the same since the apocalypse.,1.1791907514450868,0.0354739986576594,173,148,19,6,False,True,61
865,Well...It's not like there's nothing else to howl over.,1.1791907514450868,0.0325079155804636,173,145,25,3,False,True,55
865,How do we sniff it?,1.1790123456790125,0.0338065342291582,162,136,23,3,True,True,19
865,I can’t howl at a black hole.,1.1790123456790125,0.0338065342291582,162,136,23,3,False,True,29
865,That must be the 'bad dog' look.,1.1790123456790125,0.0360033919067398,162,138,19,5,False,True,32
865,"'We've either stumbled upon an unexplained mystery of the Universe, or those eye drops aren't doing diddly.'",1.1790123456790125,0.0360033919067398,162,138,19,5,False,False,108
865,Ooops! The Dog Star is missing from our sky tonight!,1.1789473684210523,0.0316253256389222,190,160,26,4,False,True,52
865,When it comes closer we can sniff it and tell what it is.,1.1788079470198676,0.0364980179875326,151,128,19,4,False,True,57
865,Cows!  Who would've thunk?,1.1788079470198676,0.0339927179777839,151,126,23,2,True,True,26
865,supply chain issues,1.1788079470198676,0.0339927179777839,151,126,23,2,False,False,19
865,I don’t know whether to howl or whimper.,1.1788079470198676,0.0339927179777839,151,126,23,2,False,True,40
865,I could tell you a lot more if I could sniff that.,1.1787709497206704,0.0337437317561858,179,152,22,5,False,True,50
865,"I've heard of ""black holes"", but I always thought it was something I dug up in the back yard.",1.1785714285714286,0.0351393703310781,168,143,20,5,False,True,93
865,What have they gone and done this time?,1.1785714285714286,0.0371126305470803,168,145,16,7,True,True,39
865,Betcha I can too jump through it!,1.1785714285714286,0.0396125338875527,140,120,15,5,False,True,33
865,"I knew I was tone deaf, but I really didn't expect it to shatter.",1.1785714285714286,0.0341099596574804,168,142,22,4,False,True,65
865,Is it under the couch?,1.1785714285714286,0.0371126305470803,168,145,16,7,True,True,22
865,"I don't know about you, but I'm not howling at that moon!",1.1783783783783783,0.0338975756932896,185,158,21,6,False,True,57
865,These New Yorker cartoonists are really lacking inspiration,1.178343949044586,0.0399076026518537,157,137,12,8,False,False,59
865,I’m not sure whether to howl or cry.,1.178343949044586,0.0319531145292832,157,130,26,1,False,True,36
865,It's the cosmic dog door.,1.178343949044586,0.0367102001824277,157,134,18,5,False,True,25
865,"Don’t tell 
Aaron Rogers",1.178343949044586,0.0344139530245757,157,132,22,3,False,False,24
865,"“but even if you could fetch it at the speed of light, by the time you got back every stuffed animal you ever loved would be dead. That’s relativity.”",1.178343949044586,0.0388710359019429,157,136,14,7,False,False,150
865,I guess our howling scared it away.,1.1781609195402298,0.0343301608792044,174,148,21,5,False,True,35
865,It's not nothing.  It's like the hole in a bagel.,1.1781609195402298,0.0362138299838972,174,150,17,7,False,True,49
865,I heard they found bones on Mars.,1.178082191780822,0.0372469341760157,146,124,18,4,False,True,33
865,"No, you can't sniff it.",1.178082191780822,0.0384942517371362,146,125,16,5,False,True,23
865,That's not a moon dog.,1.177914110429448,0.0347247051859578,163,138,21,4,False,True,22
865,We finally scared it away.,1.177914110429448,0.033616436280676,163,137,23,3,False,True,26
865,There are thousands of fire hydrants up there.,1.177914110429448,0.0368413609185321,163,140,17,6,False,True,46
865,Don’t be sad. Looks like granddad’s having a great time.,1.177914110429448,0.0324703622735229,163,136,25,2,False,True,56
865,"You say hole,I say doorway.",1.177914110429448,0.0357986803149308,163,139,19,5,False,True,27
865,"Siriusly, it's a black hole.",1.177914110429448,0.0368413609185321,163,140,17,6,False,True,28
865,The hoops are getting harder and harder to jump through.,1.177914110429448,0.0347247051859578,163,138,21,4,False,True,56
865,I'm not sure what we're supposed to bark at.,1.177914110429448,0.0324703622735229,163,136,25,2,False,True,44
865,"So, ""Fetch"" he says.  Do you believe that?",1.1777777777777778,0.0335704375021814,180,153,22,5,True,True,42
865,I used to be able to bay at the moon.  Another pleasure gone.,1.1777777777777778,0.0326328213254244,180,152,24,4,False,True,61
865,It’s where the great dog spirit sniffs.,1.1776315789473684,0.0362761830588685,152,129,19,4,False,True,39
865,So that’s where they threw the ball.,1.1776315789473684,0.0386036035727481,152,131,15,6,False,True,36
865,This totally reminds me of the time we chased that ocelot.,1.1776315789473684,0.0337888251621625,152,127,23,2,False,True,58
865,"Dog, if you're listening, that's the best dogdamn hole I've ever seen.",1.1776315789473684,0.035054572905398,152,128,21,3,False,True,70
865,I  told you that black holes are not just theoretical.,1.1776315789473684,0.0397162005300427,152,132,13,7,False,True,54
865,"Typically, they aren't looking for life that looks like us.",1.1776315789473684,0.0362761830588685,152,129,19,4,False,True,59
865,"If a dog howls at the moon but no moon is around to hear it, are we making a sound?",1.1776315789473684,0.0407984676217532,152,133,11,8,True,True,83
865,I'll bet 3 treats that I can get my head and whole body through that hole.,1.1775147928994083,0.0369075040672527,169,146,16,7,False,True,74
865,How do you howl at a black hole?,1.1775147928994083,0.0349468038625123,169,144,20,5,True,True,32
865,Maybe we bayed too long.,1.1775147928994083,0.0339239844663067,169,143,22,4,False,True,24
865,"If you howl into it, it howls back into you.",1.1775147928994083,0.0378497851329299,169,147,14,8,False,True,44
