contest,caption,mean,precision,votes,not_funny,somewhat_funny,funny,has_question_mark,ends_with_punctuation,caption_length
770,These extended car warranty salesman are aggressive,1.2307692307692308,0.0611163407002719,65,52,11,2,False,False,51
770,Environmental Law is requiring more hands-on experience these days,1.2307692307692308,0.0611163407002719,65,52,11,2,False,False,66
770,"Don’t worry about him, he’s just a friend",1.2307692307692308,0.0611163407002719,65,52,11,2,False,False,41
770,"If a lawyer falls in the woods and no one is there to hear him, does he make a noise? (Don't you dare try it now!)",1.2297297297297298,0.0492344100918896,74,57,17,0,True,False,114
770,Must your accountant track every paper trail?,1.2297297297297298,0.0594535690933109,74,60,11,3,True,True,45
770,The Sierra Club needs to back off!,1.2297297297297298,0.0528607641265423,74,58,15,1,False,True,34
770,G5 can be a mixed blessing.,1.2297297297297298,0.0594535690933109,74,60,11,3,False,True,27
770,They've left only footprints so far...,1.2297297297297298,0.0594535690933109,74,60,11,3,False,True,38
770,"If he's so worried about a slip-and-fall claim, why doesn't he take the lead?",1.2297297297297298,0.0528607641265423,74,58,15,1,True,True,77
770,Any chance you can drop her lesson plan?,1.2297297297297298,0.0528607641265423,74,58,15,1,True,True,40
770,"He's taken ""work from home"" to mean ""work from anywhere"".",1.2297297297297298,0.0562538321449083,74,59,13,2,False,True,57
770,"Your student loan, pay your student loan, how many times did I tell you, but NO you said, they're supposed to wait during the pandemic.",1.2297297297297298,0.0562538321449083,74,59,13,2,False,True,135
770,I think Bill is taking 'remote work' too literally,1.2297297297297298,0.0562538321449083,74,59,13,2,False,False,50
770,He always struggles with letting his guard down at leadership retreats.,1.2297297297297298,0.0562538321449083,74,59,13,2,False,True,71
770,"Yes sir, at this rate, they're bound to figure out where she wants to eat",1.2297297297297298,0.0528607641265423,74,58,15,1,False,False,73
770,It's been uphill ever since my staff quit.,1.2295081967213115,0.063562037261619,61,49,10,2,False,True,42
770,Didn’t Vey tell you this is casual Friday?,1.2295081967213115,0.059107397958426,61,48,12,1,True,True,42
770,They can smell fear.,1.2295081967213115,0.059107397958426,61,48,12,1,False,True,20
770,"Jim, we're here for a casual walk. Let's ditch the suit and tie at the next bend.",1.2295081967213115,0.063562037261619,61,49,10,2,False,True,81
770,"When you get to the top,sacrifice the man to Geico. That’ll cover us for life.",1.2295081967213115,0.0716451586341382,61,51,6,4,False,True,78
770,Don't look at him directly.  He's my micro-aggressive lawyer.,1.2295081967213115,0.063562037261619,61,49,10,2,False,True,61
770,This is the section where a lot of hikers slip and fall.,1.2295081967213115,0.0542884555498133,61,47,14,0,False,True,56
770,Don't look back! The cliff is just around the bend...,1.2295081967213115,0.059107397958426,61,48,12,1,False,True,53
770,"You want to know what's funny? The August 30th issue of the New Yorker with Contest #769 arrived today, two days after that contest closed. In other words, regular subscribers can't play.",1.2295081967213115,0.063562037261619,61,49,10,2,True,True,187
770,"I’m determined to make it to the top, one way or another.",1.2295081967213115,0.063562037261619,61,49,10,2,False,True,57
770,"Before you finish that policy, let’s update the lifespan projections on these two",1.2295081967213115,0.063562037261619,61,49,10,2,False,False,81
770,Just be glad he's not a motivational speaker.,1.2295081967213115,0.063562037261619,61,49,10,2,False,True,45
770,Why is my estate lawyer on this excursion?,1.2295081967213115,0.059107397958426,61,48,12,1,True,True,42
770,"He said he's been trying to reach us about our car's extended warranty.""",1.2295081967213115,0.063562037261619,61,49,10,2,False,False,72
770,Looks like I’ll be a while. At this stage it’s all uphill,1.2295081967213115,0.063562037261619,61,49,10,2,False,False,57
770,My clients need a quote on life insurance.,1.2295081967213115,0.0542884555498133,61,47,14,0,False,True,42
770,"I guess when you bought the 24 hour live coverage policy, I misunderstood.",1.2295081967213115,0.067724298950075,61,50,8,3,False,True,74
770,Is he still closing?,1.2295081967213115,0.059107397958426,61,48,12,1,True,True,20
770,I'm almost at the coffee shop now.,1.2295081967213115,0.063562037261619,61,49,10,2,False,True,34
770,I told about the traffic on this mountain. You should see the back up on Everest.,1.2295081967213115,0.067724298950075,61,50,8,3,False,True,81
770,They said that this would be an easy hike. So how come we are being followed by a personal injury lawyer?,1.2295081967213115,0.063562037261619,61,49,10,2,True,True,105
770,"Look out, its a stalker",1.2295081967213115,0.063562037261619,61,49,10,2,False,False,23
770,I’m trying WeHike since Wework sort of closed,1.2295081967213115,0.059107397958426,61,48,12,1,False,False,45
770,Divorce pending,1.2295081967213115,0.0542884555498133,61,47,14,0,False,False,15
770,"Hey body double, you were supposed to stay at the office while I go hiking",1.2295081967213115,0.059107397958426,61,48,12,1,False,False,74
770,"Technically, I am working remotely.",1.2295081967213115,0.059107397958426,61,48,12,1,False,True,35
770,Did you say ‘left’ at the water cooler?,1.2295081967213115,0.063562037261619,61,49,10,2,True,True,39
770,Is there a reason I can’t sign the life insurance policy when we get back down?,1.2295081967213115,0.067724298950075,61,50,8,3,True,True,79
770,"Not now Dave, i'm buying Machu Pichu.",1.2295081967213115,0.063562037261619,61,49,10,2,False,True,37
770,I think there seems to be a disconnect.,1.2295081967213115,0.059107397958426,61,48,12,1,False,True,39
770,Your lawyer is checking whether this ain't no mountain high enough.,1.2295081967213115,0.063562037261619,61,49,10,2,False,True,67
770,Seems like a lot of effort for a better signal”,1.2295081967213115,0.067724298950075,61,50,8,3,False,False,47
770,"I said Google assistant, not goggle assistant",1.2295081967213115,0.063562037261619,61,49,10,2,False,False,45
770,"Houston, we have a problem!",1.2291666666666667,0.0743743605570779,48,39,7,2,False,True,27
770,I hope he's not billing you for travel time!,1.2291666666666667,0.0681543886010225,48,38,9,1,False,True,44
770,Our realtor is sure urging us to go higher!,1.2291666666666667,0.0613065727543479,48,37,11,0,False,True,43
770,"When I volunteered us for the endurance experiment, I did not realize we'd be so closely monitored.",1.2291666666666667,0.0801128599599918,48,40,5,3,False,True,99
770,I feel like we’re being stalked by a bear market.,1.2285714285714286,0.0544934458475796,70,55,14,1,False,True,49
770,"Honey, I'm not too sure about our personal guide.""",1.2285714285714286,0.0648981638044391,70,58,8,4,False,False,50
770,Does he even know where he is going?,1.2285714285714286,0.0505515278245361,70,54,16,0,True,True,36
770,"Relax, he’s got some snacks in there along with the launch codes.",1.2285714285714286,0.0648981638044391,70,58,8,4,False,True,65
770,Stanley here is our Sherpa. He says the struggle of finding deductions is like the struggle of life itself and we are challenged to go forward and meet it.,1.2285714285714286,0.0581688431661773,70,56,12,2,False,True,155
770,Let your secretary handle it.,1.2285714285714286,0.0581688431661773,70,56,12,2,False,True,29
770,"Unfortunately I can’t turn my camera on, the wifi is down.",1.2285714285714286,0.0544934458475796,70,55,14,1,False,True,58
770,I thought you said the IRS was understaffed.,1.2285714285714286,0.0680136040813604,70,59,6,5,False,True,44
770,"This is taking 'The Good Hands People' too far.""",1.2280701754385963,0.0708768207638058,57,47,7,3,False,False,48
770,"Don’t buy anything he’s recommending, Harold. We’ve been in the no reception zone for the last half hour.",1.2280701754385963,0.0663095566682854,57,46,9,2,False,True,105
770,"He'll get us back.  He's with Hansel, Gretel and Crumb.",1.2280701754385963,0.0751670814760342,57,48,5,4,False,True,55
770,I told you not to drop that gum wrapper!,1.2280701754385963,0.0663095566682854,57,46,9,2,False,True,40
770,I hope Madam Olga was right about one of us getting eaten by a bear.,1.2280701754385963,0.0614035087719298,57,45,11,1,False,True,68
770,"""These two are a hard sell.  If I can't get them to buy a life insurance policy now, I'm giving up.",1.2280701754385963,0.0614035087719298,57,45,11,1,False,True,99
770,Where are you? I'm in my new satellite office.,1.2280701754385963,0.0614035087719298,57,45,11,1,True,True,46
770,She is going to break the glass ceiling!,1.2280701754385963,0.0663095566682854,57,46,9,2,False,True,40
770,"I’m here with the Carmichaels, and agree their life insurance premium increase is warranted.",1.2280701754385963,0.0708768207638058,57,47,7,3,False,True,92
770,Why did we take the Corner Office Trail?,1.2280701754385963,0.0663095566682854,57,46,9,2,True,True,40
770,"...Val-de-ri, Val-de-ra, we'll push him next switchback.",1.2280701754385963,0.0751670814760342,57,48,5,4,False,True,56
770,If we work together now we can make it so they never find the body.,1.2280701754385963,0.0708768207638058,57,47,7,3,False,True,67
770,The four day workweek sounded good on paper,1.2280701754385963,0.0663095566682854,57,46,9,2,False,False,43
770,"No, you hang up.",1.2280701754385963,0.0560698178476117,57,44,13,0,False,True,16
770,I think he is working his way to the top.,1.2280701754385963,0.0560698178476117,57,44,13,0,False,True,41
770,"Dress for the job you want,” they said",1.2280701754385963,0.0614035087719298,57,45,11,1,False,False,38
770,Something about life insurance,1.2278481012658229,0.0538952278235384,79,63,14,2,False,False,30
770,Now I know how Butch and Sundance felt.....,1.2272727272727273,0.0675769596514698,66,55,7,4,False,True,43
770,"When you said our guide is 'economic,' this is not what I thought you meant.""",1.2272727272727273,0.0675769596514698,66,55,7,4,False,False,77
770,These “Vehicle Warranty” people are going a little to far to reach us!,1.2272727272727273,0.0562853806697173,66,52,13,1,False,True,70
770,"Legally , you guys are now out of Afghanistan.",1.2272727272727273,0.0602846957638126,66,53,11,2,False,True,46
770,"Yes, I am still carrying the football.",1.2272727272727273,0.0519792613542605,66,51,15,0,False,True,38
770,There's got to be a better way to protest a tax hike.,1.2272727272727273,0.0675769596514698,66,55,7,4,False,True,53
770,Mr and Mrs Smith will in no way have their vacation interrupted by business calls,1.2272727272727273,0.0519792613542605,66,51,15,0,False,False,81
770,Don't trip.,1.2272727272727273,0.064034717220707,66,54,9,3,False,True,11
770,He’s here in case we need to sue the mountain for damages.,1.2272727272727273,0.0562853806697173,66,52,13,1,False,True,58
770,Tell me exactly how the accidental death clause reads in the policy,1.2272727272727273,0.0675769596514698,66,55,7,4,False,False,67
770,I wonder how much he paid for his shoes.,1.2272727272727273,0.064034717220707,66,54,9,3,False,True,40
770,These upwardly-mobile types are even grumpier on the way down.,1.2266666666666666,0.0587354224454872,75,61,11,3,False,True,62
770,I hope the volcano god accepts bitcoin.,1.2266666666666666,0.055583176317025,75,60,13,2,False,True,39
770,Is it bad to admit I preferred our zoom meetings?,1.2264150943396226,0.0744671903185213,53,44,6,3,True,True,49
770,Perhaps we shouldn't have taken this to the highest court in the land.,1.2264150943396226,0.0694238649817207,53,43,8,2,False,True,70
770,"He's my accountant. I thought you said, 'Tax hike.'",1.2264150943396226,0.0639842451238232,53,42,10,1,False,False,51
770,I want the house and the car… You getting this Throckmorton?,1.2264150943396226,0.0694238649817207,53,43,8,2,True,True,60
770,"Yes, sir. We've found where Joe Bishop-Henchman keeps his unreported capital gains.",1.2264150943396226,0.0744671903185213,53,44,6,3,False,True,83
770,I guess everybody’s working remotely these days,1.2264150943396226,0.0639842451238232,53,42,10,1,False,False,47
770,Just use your stick!,1.2264150943396226,0.0639842451238232,53,42,10,1,False,True,20
770,"If he doesn't shut up I'll give him"" accidental death and dismemberment""",1.2264150943396226,0.0694238649817207,53,43,8,2,False,False,72
770,He is from Morgan and Morgan,1.2264150943396226,0.0694238649817207,53,43,8,2,False,False,28
770,My fitness tracker has to be here somewhere,1.2264150943396226,0.0580370073240412,53,41,12,0,False,False,43
770,"Don't look at him, otherwise he'll know we know he's following us. Keep your eyes straight ahead. When we get to the top we'll ambush him. He'll never know what hit him.",1.2264150943396226,0.0639842451238232,53,42,10,1,False,True,169
770,She said it was a heart-stopping view,1.2264150943396226,0.0639842451238232,53,42,10,1,False,False,37
770,The guy seems suspicious that I am not here for the hike or bringing tents and a weeks worth of food. What do I do now?,1.2264150943396226,0.0694238649817207,53,43,8,2,True,True,119
770,"Hi Rick, I got to the Profit Power Seminar, we’re going on an Abundance Hike. How are the numbers for the day?",1.2264150943396226,0.0639842451238232,53,42,10,1,True,True,110
770,"Rare footage Caught on camera, an apex predator, on the hunt",1.2261904761904765,0.0544918382414928,84,68,13,3,False,False,60
770,"The view is great but,20K an acre is just too  steep.",1.2258064516129032,0.0582639503507595,62,49,12,1,False,True,53
770,"Honey, this isn’t really what I meant when I said “let’s hire a travel agent.”",1.2258064516129032,0.0535337947534374,62,48,14,0,False,False,78
770,Double indemnity is so motivational!,1.2258064516129032,0.0582639503507595,62,49,12,1,False,True,36
770,"Its been so long since Ive been to the office,I think I might have taken a wrong turn.Will be late.",1.2258064516129032,0.0667257774028971,62,51,8,3,False,True,99
770,"Yes dear, still at the office. Be a little late tonight.",1.2258064516129032,0.0626379169532989,62,50,10,2,False,True,56
770,I hope he's calling ahead for take-out.,1.2258064516129032,0.0705772633345441,62,52,6,4,False,True,39
770,"Yeah, he's still following us.",1.2258064516129032,0.0582639503507595,62,49,12,1,False,True,30
770,"Next time you send me out to collect an account, give me a stick!""",1.2258064516129032,0.0535337947534374,62,48,14,0,False,False,66
770,I’m stuck in traffic.,1.2258064516129032,0.0667257774028971,62,51,8,3,False,True,21
770,I told you my husband's lawyer suspected.,1.2258064516129032,0.0626379169532989,62,50,10,2,False,True,41
770,Don’t make eye contact; he might see it as a sign of aggression.,1.2258064516129032,0.0667257774028971,62,51,8,3,False,True,64
770,"When I said leave your work behind I didn’t mean it literally, Jack",1.2258064516129032,0.0626379169532989,62,50,10,2,False,False,67
770,She says the original Theranos business plan is buried on top of the hill.,1.2258064516129032,0.0582639503507595,62,49,12,1,False,True,74
770,I found some locals that tell me this shortcut has a surprise worth my while.,1.2258064516129032,0.0626379169532989,62,50,10,2,False,True,77
770,He did say it was a business trip,1.2258064516129032,0.0626379169532989,62,50,10,2,False,False,33
770,"Don't worry, my agent will turn back soon . . .I got him down to only 10% of everything!",1.2253521126760565,0.0608364998807712,71,58,10,3,False,True,88
770,Why is your actuary following us?,1.2253521126760565,0.0574340076158851,71,57,12,2,True,True,33
770,I need an air tank.  Make it 2,1.2253521126760565,0.0608364998807712,71,58,10,3,False,False,30
770,"yeh, the elevator is out of order again.",1.2253521126760565,0.0574340076158851,71,57,12,2,False,True,40
770,You could have just worn a Fit Bit to count your steps.,1.2253521126760565,0.0538168258437825,71,56,14,1,False,True,55
770,The insurance company said 'Hell no',1.2253521126760565,0.0574340076158851,71,57,12,2,False,False,36
770,"Honey, we can't seem to shake that insurance salesperson.",1.225,0.0469816823987036,80,62,18,0,False,True,57
770,I don't care whether he's from death or taxes. Just ignore him.,1.2247191011235956,0.0570665458115264,89,74,10,5,False,True,63
770,"The right response to ‘hike at your own risk’ isn’t to bring your attorney, Carl",1.2244897959183674,0.0669126380030816,49,39,9,1,False,False,80
770,"Don't look now, but I think your boss is following us!  I don't think he bought your excuse for not coming to work today!",1.2241379310344829,0.0604635423756309,58,46,11,1,False,True,121
770,"No, dear, I really don't think he's talking about us.",1.2241379310344829,0.0652748085724169,58,47,9,2,False,True,53
770,Next time can we go hiking without your alter ego?,1.2241379310344829,0.0604635423756309,58,46,11,1,True,True,50
770,Don’t worry I blend right in.,1.2241379310344829,0.0604635423756309,58,46,11,1,False,True,29
770,You’re the one who wanted a pre-nup….,1.2241379310344829,0.0604635423756309,58,46,11,1,False,True,37
770,The actuary is making me nervous,1.2241379310344829,0.0604635423756309,58,46,11,1,False,False,32
770,I’m working remotely this week. VERY remotely.,1.2241379310344829,0.0604635423756309,58,46,11,1,False,True,46
770,Some of them don’t know the right way to get to the top,1.2241379310344829,0.0697550092231492,58,48,7,3,False,False,55
770,He’s doing it again John...,1.2241379310344829,0.0604635423756309,58,46,11,1,False,True,27
770,The good news is I'm working remotely.  The bad news is that's my divorce attorney.,1.2238805970149254,0.0594749205907834,67,54,11,2,False,True,83
770,"Yes boss, the Smiths have agreed to sign on for the extended warranty as soon as we reach the summit",1.2238805970149254,0.0594749205907834,67,54,11,2,False,False,100
770,They say he makes this commute every day.,1.2238805970149254,0.0594749205907834,67,54,11,2,False,True,41
770,I'll bet we can out hike him.,1.2238805970149254,0.0555426155749475,67,53,13,1,False,True,29
770,"Ignore him, he just wants to sell us insurance""",1.2238805970149254,0.0699579751164994,67,57,5,5,False,False,47
770,He's bringing the malpractice suit against the guide.,1.2238805970149254,0.0555426155749475,67,53,13,1,False,True,53
770,just got permission to lower the premium by 10% if you buy now,1.2238805970149254,0.0631628863625909,67,55,9,3,False,False,62
770,"And I'll tell you again: they keep moving the goalposts.""",1.2238805970149254,0.0555426155749475,67,53,13,1,False,False,57
770,YOU tell him to take a hike.,1.2238805970149254,0.0594749205907834,67,54,11,2,False,True,28
770,"I told you we shouldn't have taken ""Achievement Ridge.""",1.2238805970149254,0.0631628863625909,67,55,9,3,False,False,55
770,It hasn't been the same since Columbia introduced that Sherpa Program.,1.2238805970149254,0.0594749205907834,67,54,11,2,False,True,70
770,Forget it. He'll lose service before we could do it.',1.2238805970149254,0.0555426155749475,67,53,13,1,False,False,53
770,I know. I know. I keep telling them. You gotta buy the policy before the accident.,1.2238805970149254,0.0594749205907834,67,54,11,2,False,True,82
770,His boss told him to take a hike.,1.2238805970149254,0.0555426155749475,67,53,13,1,False,True,33
770,"He’s lost. Metaphorically, that is.",1.2238805970149254,0.0594749205907834,67,54,11,2,False,True,35
770,The CIA pole vault team getting the short end of the stick.,1.2238805970149254,0.0631628863625909,67,55,9,3,False,True,59
770,"Can I call you back, Don? They said to take a hike.",1.2238805970149254,0.0631628863625909,67,55,9,3,True,True,51
770,I know my company just hired those downsizing consultants but this is just creepy,1.2238805970149254,0.0666470873184054,67,56,7,4,False,False,81
770,Yea raise their premiums,1.2238805970149254,0.0594749205907834,67,54,11,2,False,False,24
770,"Forget the suit, I knew a woman would get me outta this mess",1.2238805970149254,0.0594749205907834,67,54,11,2,False,False,60
770,"I'm telling you, he's on retainer.  If one of us falls, he'll take a video and have the lawsuit filed before we get down the mountain!",1.2238805970149254,0.0631628863625909,67,55,9,3,False,True,134
770,"Wow, the surveillance here is top-notch, I thought they’d just send a drone!",1.2238805970149254,0.0666470873184054,67,56,7,4,False,True,76
770,I don’t think he realizes this ain’t  The Corporate Ladder Trail.,1.2238805970149254,0.0555426155749475,67,53,13,1,False,True,65
770,"Don't worry boss, I'll be here when one of them asks for the divorce.",1.2222222222222223,0.052798995923499,63,49,14,0,False,True,69
770,No mountain is too tall for this intrepid slip & fall lawyer.,1.2222222222222223,0.0574435961672574,63,50,12,1,False,True,61
770,I told you Mount Tort was a bad choice,1.2222222222222223,0.0531563312183999,72,57,14,1,False,False,38
770,Didn't I tell you not to deduct these trips as unreimbursed medical expenses?,1.2222222222222223,0.0574435961672574,63,50,12,1,True,True,77
770,"With an injury lawyer following us, I'm not feeling warm and fuzzy about this trail.",1.2222222222222223,0.0682550129815501,54,44,8,2,False,True,84
770,Did you notice that he has no eyes?,1.2222222222222223,0.0682550129815501,54,44,8,2,True,True,35
770,They can't talk now ...they're searching for the Delta variant.,1.2222222222222223,0.0567171213596873,72,58,12,2,False,True,63
770,Did you have to bring the football?,1.2222222222222223,0.0682550129815501,54,44,8,2,True,True,35
770,Alice doesn't know he was laid off.,1.2222222222222223,0.0617397725192135,63,51,10,2,False,True,35
770,They may have just realized they are under surveillance.,1.2222222222222223,0.0629280126616504,54,43,10,1,False,True,56
770,"Otherwise, I think Skip has acclimated smoothly to our retirement home.",1.2222222222222223,0.052798995923499,63,49,14,0,False,True,71
770,Did you have to say that we're an outdoor family on your resume?,1.2222222222222223,0.0493392261985428,72,56,16,0,True,True,64
770,So how real is this Donner party reenactment going to get?,1.2222222222222223,0.0695403843167321,63,53,6,4,True,True,58
770,"Calm down. When we hit the mossy rocks, he's toast in those loafers.",1.2222222222222223,0.0682550129815501,54,44,8,2,False,True,68
770,"Okay, okay! Tell him we'll get the car warranty.",1.2222222222222223,0.0617397725192135,63,51,10,2,False,True,48
770,"If he starts talking about IPO's or ""getting in on the ground floor,"" I'm afraid we might have an accident.",1.2222222222222223,0.0527046276694729,81,65,14,2,False,True,107
770,I can't believe what we do for Wi-Fi.,1.2222222222222223,0.0574435961672574,63,50,12,1,False,True,37
770,He is checking to see if this caption for this cartoon is original and legal.,1.2222222222222223,0.0629280126616504,54,43,10,1,False,True,77
770,"I have to call you back, I am briefcasing the Alps.",1.2222222222222223,0.0702728368926305,45,36,8,1,False,True,51
770,My attorney is only here to negotiate in my behalf should we fail to agree on the best route to the summit.,1.2222222222222223,0.0567171213596873,72,58,12,2,False,True,107
770,"On three, I’ll beat him unconscious with mine then you impale him with yours.",1.2222222222222223,0.0731953469605706,54,45,6,3,False,True,77
770,I told it was a mistake to invite our lawyer.  He’s billing us while on the phone with his other clients.,1.2222222222222223,0.0527046276694729,81,65,14,2,False,True,105
770,These damn insurance salesmen just don't give up!,1.2222222222222223,0.0629280126616504,54,43,10,1,False,True,49
770,They’re on to us Jim. I hoped this day would never come. Activate murderous sentient walking staff!,1.2222222222222223,0.0682550129815501,54,44,8,2,False,True,99
770,What? I wasn't gonna let divorce proceedings get in the way of our vacation!,1.2222222222222223,0.0496903994999952,81,64,16,1,True,True,76
770,"Ugh, anti-social climbers.",1.2222222222222223,0.0731953469605706,54,45,6,3,False,True,26
770,I thought we ditched your wife’s private investigator when we swam across the lake.,1.2222222222222223,0.0695403843167321,63,53,6,4,False,True,83
770,You're the one who wanted whole life insurance.,1.2222222222222223,0.0571062409722273,54,42,12,0,False,True,47
770,"Now, aren't you glad you left your work at home?",1.2222222222222223,0.0657558535859852,63,52,8,3,True,True,48
770,I only WISH I paid him a fifteen dollar hourly wage!,1.2222222222222223,0.0567171213596873,72,58,12,2,False,True,52
770,"When you need your lawyer, cause you know...she's gonna go crazy, when you break up with her.",1.2222222222222223,0.0571062409722273,54,42,12,0,False,True,93
770,"The liability waiver DID read '...trail lawyers will be available..' I thought it was a typo, too.",1.2222222222222223,0.0682550129815501,54,44,8,2,False,True,98
770,The senior hiking trip is progressing as anticipated.,1.2222222222222223,0.0626751194241961,45,35,10,0,False,True,53
770,"Yeah, I just moved to Oregon. You wouldn’t believe my commute to the office!",1.2222222222222223,0.0617397725192135,63,51,10,2,False,True,76
770,Apparently they meant Work From Hike.,1.2222222222222223,0.0571062409722273,54,42,12,0,False,True,37
770,"That’s right Jim, we are calling it climate gentrification!",1.2222222222222223,0.0531563312183999,72,57,14,1,False,True,59
770,Yes! We are making sure to find a place where your next home will not be subject to flash flooding,1.2222222222222223,0.0629280126616504,54,43,10,1,False,False,98
770,"Honey, did you forget to un-check “Always” on location services before you sent it in for repair?",1.2222222222222223,0.0617397725192135,63,51,10,2,True,True,97
770,"The remote office is a journey, not a place",1.2222222222222223,0.0617397725192135,63,51,10,2,False,False,43
770,Typical tailgater. Afraid of open spaces.,1.2207792207792207,0.0573490965345964,77,63,11,3,False,True,41
770,The fingers in the pocket are just a fear tactic.,1.2207792207792207,0.0573490965345964,77,63,11,3,False,True,49
