contest,rank,caption,mean,precision,votes,not_funny,somewhat_funny,funny,has_question_mark,ends_with_punctuation,caption_length
567,2166,Let's talk about my raise.,1.0909090909090908,0.0508197267613588,33,30,3,0,False,True,26
567,2167,You can blame this on all the overtime you've been pushing on me!,1.0909090909090908,0.0508197267613588,33,30,3,0,False,True,65
567,2168,Standing at my desk won't stop me from sleeping at work.,1.0909090909090908,0.0669072792903624,33,31,1,1,False,True,56
567,2169,My real Home/Office has become an airbnb!,1.0909090909090908,0.0508197267613588,33,30,3,0,False,True,41
567,2170,Don't even try!,1.0909090909090908,0.0669072792903624,33,31,1,1,False,True,15
567,2171,This is your Premium Economy?,1.0909090909090908,0.0508197267613588,33,30,3,0,True,True,29
567,2172,Some call it 'manspreading' but I call it comfy!,1.0909090909090908,0.0508197267613588,33,30,3,0,False,True,48
567,2173,"I thought you meant 'soft landing' for the business, not me!",1.0909090909090908,0.0669072792903624,33,31,1,1,False,True,60
567,2174,But everyone I know voted for Hillary.,1.0909090909090908,0.0669072792903624,33,31,1,1,False,True,38
567,2175,"When I say 24/7, I mean 24/7.",1.0909090909090908,0.0508197267613588,33,30,3,0,False,True,29
567,2176,Sleeping on the job? How can you say that?,1.0909090909090908,0.0669072792903624,33,31,1,1,True,True,42
567,2177,I haven't been seeing any downturn!,1.0909090909090908,0.0669072792903624,33,31,1,1,False,True,35
567,2178,Murphy's the name! Selling's my game.,1.0909090909090908,0.0669072792903624,33,31,1,1,False,True,37
567,2179,With our pop-up mattress your salesmen can be out hustling while the competition is still horizontal.,1.0909090909090908,0.0508197267613588,33,30,3,0,False,True,101
567,2180,What am I doing? I’m standing up for myself,1.0909090909090908,0.0669072792903624,33,31,1,1,True,False,43
567,2181,I'm not going to take this lying down anymore!,1.0909090909090908,0.0508197267613588,33,30,3,0,False,True,46
567,2182,I'm still struggling with this telecommuting thing.,1.0909090909090908,0.0669072792903624,33,31,1,1,False,True,51
567,2183,"'Why the smirk! all I said was, ""I'm not taking this demotion lying down.""",1.0909090909090908,0.0508197267613588,33,30,3,0,False,False,74
567,2184,"I ordered a standing desk, but this is what they sent.",1.0909090909090908,0.0669072792903624,33,31,1,1,False,True,54
567,2185,I'm trying to make bed partner.,1.0909090909090908,0.0669072792903624,33,31,1,1,False,True,31
567,2186,You said I should be available 24/7!,1.0909090909090908,0.0669072792903624,33,31,1,1,False,True,36
567,2187,YOU said we can't work from home anymore....,1.0909090909090908,0.0508197267613588,33,30,3,0,False,True,44
567,2188,Just in case all the hotels are booked to the max.,1.0909090909090908,0.0669072792903624,33,31,1,1,False,True,50
567,2189,It's the next phase in having a complete workstation.,1.088235294117647,0.0649646422251048,34,32,1,1,False,True,53
567,2190,You see what I am saying about my working hours?,1.088235294117647,0.0493748270390892,34,31,3,0,True,True,48
567,2191,I've cut my 10 minute power nap down to 5 - doesn't that count towards annual productivity goals?,1.088235294117647,0.0493748270390892,34,31,3,0,True,True,97
567,2192,"Then I said, 'Tell me to make the bed one more time, Clarice.'",1.088235294117647,0.0649646422251048,34,32,1,1,False,False,62
567,2193,But I thought it was Take Your Mattress to Work Day,1.0857142857142856,0.0631315629277073,35,33,1,1,False,False,51
567,2194,Just unwrap. Then touch Sleep Number 11. It's a full night's sleep plus somebody ready to go to work for you in the morning.,1.0833333333333333,0.0467176592151156,36,33,3,0,False,True,124
567,2195,"If you order a ""short"", they package it like this!",1.0769230769230769,0.0432270374576166,39,36,3,0,False,True,50
567,2196,Couldn’t find my trousers anywhere …,1.0689655172413792,0.0689655172413792,29,28,0,1,False,False,36
567,2197,"At these prices, you should include a shelf.",1.0689655172413792,0.0478872465399595,29,27,2,0,False,True,44
567,2198,The new first class upright seating will take some getting used to.,1.0689655172413792,0.0478872465399595,29,27,2,0,False,True,67
567,2199,"My first step, chief, to ""keep the bedroom out of the boardroom.""",1.0689655172413792,0.0478872465399595,29,27,2,0,False,False,65
567,2200,Sleeping on the job,1.0689655172413792,0.0478872465399595,29,27,2,0,False,False,19
567,2201,"Your idea to build a driverless-bed prototype was sound, but it turns out I can’t sleep on a rolling mattress.",1.0689655172413792,0.0689655172413792,29,28,0,1,False,True,110
567,2202,What was I supposed to do with decaf?,1.0689655172413792,0.0689655172413792,29,28,0,1,True,True,37
567,2203,"""The only way to get ahead,"" Tidwell said. Sheesh. Eighty-two hundred dollars later, and do I look like I'm getting ahead?",1.0689655172413792,0.0689655172413792,29,28,0,1,True,True,122
567,2204,"There is no ""one way"" to deal with jetlag.",1.0689655172413792,0.0689655172413792,29,28,0,1,False,True,42
567,2205,"This weekend, Wall Street's occupying me.",1.0689655172413792,0.0689655172413792,29,28,0,1,False,True,41
567,2206,Who has time for pants?,1.0689655172413792,0.0478872465399595,29,27,2,0,True,True,23
567,2207,"Everybody else is getting to work at home, so I thought this would make sense.",1.0689655172413792,0.0689655172413792,29,28,0,1,False,True,78
567,2208,could do my job if there was a head board.,1.0689655172413792,0.0478872465399595,29,27,2,0,False,True,42
567,2209,Who could ask for anything more?,1.0689655172413792,0.0689655172413792,29,28,0,1,True,True,32
567,2210,The boss said I might have to sleep standing up.,1.0689655172413792,0.0478872465399595,29,27,2,0,False,True,48
567,2211,I've been up all night.,1.0689655172413792,0.0478872465399595,29,27,2,0,False,True,23
567,2212,YOU were the one who told me to show up undercover!,1.0689655172413792,0.0478872465399595,29,27,2,0,False,True,51
567,2213,This company's expectations are way too high.,1.0689655172413792,0.0478872465399595,29,27,2,0,False,True,45
567,2214,I had trouble getting out of bed this morning.,1.0689655172413792,0.0689655172413792,29,28,0,1,False,True,46
567,2215,Why do you think I've been laying down on the job?,1.0689655172413792,0.0478872465399595,29,27,2,0,True,True,50
567,2216,I'm just ready for the next derailment!,1.0689655172413792,0.0689655172413792,29,28,0,1,False,True,39
567,2217,The doctor said I had to stay in bed; he never said I couldn't come in.,1.0689655172413792,0.0478872465399595,29,27,2,0,False,True,71
567,2218,I can't even sink an interview in my dreams!,1.0689655172413792,0.0478872465399595,29,27,2,0,False,True,44
567,2219,Sorry I'm late. The Lincoln Tunnel was a nightmare.,1.0689655172413792,0.0478872465399595,29,27,2,0,False,True,51
567,2220,"When I said I was willing to ""eat, breathe, and sleep this company"", I am not sure you really understood the memo boss. Can I go home now?",1.0689655172413792,0.0478872465399595,29,27,2,0,True,True,138
567,2221,"Even as mayor, Bernie Sanders refused to get in bed with big business",1.0689655172413792,0.0478872465399595,29,27,2,0,False,False,69
567,2222,"Dad, can't you see I'm sleep working?!",1.0689655172413792,0.0478872465399595,29,27,2,0,True,True,38
567,2223,Would you believe Spring collection from Serta?,1.0689655172413792,0.0689655172413792,29,28,0,1,True,True,47
567,2224,"I did say ""hit the ground running,"" but this is a little extreme.",1.0689655172413792,0.0478872465399595,29,27,2,0,False,True,65
567,2225,"I told you, I sleep alone!",1.0689655172413792,0.0478872465399595,29,27,2,0,False,True,26
567,2226,I'm working from home today!,1.0689655172413792,0.0689655172413792,29,28,0,1,False,True,28
567,2227,I'll sleep my way to the top if I have to.,1.0689655172413792,0.0478872465399595,29,27,2,0,False,True,42
567,2228,I tried switching to decaf.,1.0689655172413792,0.0689655172413792,29,28,0,1,False,True,27
567,2229,"And then she said, ""is this some cheap stunt to avoid paying for a hotel room ..""",1.0689655172413792,0.0689655172413792,29,28,0,1,False,False,81
567,2230,How much extra for the horizontal?,1.0689655172413792,0.0689655172413792,29,28,0,1,True,True,34
567,2231,The commute was terrible. I had an accident!,1.0689655172413792,0.0478872465399595,29,27,2,0,False,True,44
567,2232,"James why are you on my bed?"" ""Im at work ok, its not as easy as it looks.",1.0689655172413792,0.0478872465399595,29,27,2,0,True,True,74
567,2233,Have you seen my fitted sheet?,1.0689655172413792,0.0689655172413792,29,28,0,1,True,True,30
567,2234,I came as quickly as I could.,1.0689655172413792,0.0478872465399595,29,27,2,0,False,True,29
567,2235,My wife said I need to work on my pillow talk,1.0689655172413792,0.0689655172413792,29,28,0,1,False,False,45
567,2236,The wish that this could be true when you don't get enough sleep.,1.0689655172413792,0.0689655172413792,29,28,0,1,False,True,65
567,2237,No. YOU look tired.,1.0689655172413792,0.0478872465399595,29,27,2,0,False,True,19
567,2238,I thought it was too heavy with the sheets.,1.0689655172413792,0.0689655172413792,29,28,0,1,False,True,43
567,2239,You did say not to lie down on the job.,1.0689655172413792,0.0478872465399595,29,27,2,0,False,True,39
567,2240,I'm not taking this demotion lying down.,1.0689655172413792,0.0478872465399595,29,27,2,0,False,True,40
567,2241,"Now, no one can tell me I woke up on the wrong side of the bed this morning.",1.0689655172413792,0.0478872465399595,29,27,2,0,False,True,76
567,2242,Who said I'm not a standup guy?,1.0689655172413792,0.0478872465399595,29,27,2,0,True,True,31
567,2243,I said I was working from home today.,1.0689655172413792,0.0689655172413792,29,28,0,1,False,True,37
567,2244,You made me get out of house for this?,1.0689655172413792,0.0478872465399595,29,27,2,0,True,True,38
567,2245,The only reason I made it in was because of Uber Bed.,1.0689655172413792,0.0689655172413792,29,28,0,1,False,True,53
567,2246,This is a goofy idea. It will never sell.,1.0689655172413792,0.0689655172413792,29,28,0,1,False,True,41
567,2247,But you said the new office was a live-work space!,1.0689655172413792,0.0478872465399595,29,27,2,0,False,True,50
567,2248,"""I am not laying down on the job!",1.0689655172413792,0.0478872465399595,29,27,2,0,False,True,33
567,2249,Tell Sandman to bring me a dream pronto.,1.0689655172413792,0.0478872465399595,29,27,2,0,False,True,40
567,2250,And the worst part is that I don't have any pants on!,1.0689655172413792,0.0478872465399595,29,27,2,0,False,True,53
567,2251,Sleep setting 11 isn't working out.,1.0689655172413792,0.0478872465399595,29,27,2,0,False,True,35
567,2252,"Sorry I'm late, but getting a seat on the MetroNorth was ridiculous today!",1.0689655172413792,0.0478872465399595,29,27,2,0,False,True,74
567,2253,"It's called efficiency!"" ""Now, kindly untuck me, I don't want to be late for work.",1.0689655172413792,0.0478872465399595,29,27,2,0,False,True,82
567,2254,"Okay, so I got thrown out again.",1.0689655172413792,0.0478872465399595,29,27,2,0,False,True,32
567,2255,In my brief case? Ambien samples. Why do you ask?,1.0689655172413792,0.0478872465399595,29,27,2,0,True,True,49
567,2256,It's called the Sleep-Walker!,1.0689655172413792,0.0689655172413792,29,28,0,1,False,True,29
567,2257,This mug is only 9.99!,1.0689655172413792,0.0689655172413792,29,28,0,1,False,True,22
567,2258,Think of the money we'll save on hotel bills!,1.0689655172413792,0.0478872465399595,29,27,2,0,False,True,45
567,2259,Decaf. Maybe you already guessed.,1.0689655172413792,0.0478872465399595,29,27,2,0,False,True,33
567,2260,You would have to pay me 3x the going price!,1.0689655172413792,0.0478872465399595,29,27,2,0,False,True,44
567,2261,It's perfectly normal. You should try to get one for yourself.,1.0689655172413792,0.0689655172413792,29,28,0,1,False,True,62
567,2262,"I heard, 'Take Your Bed to Work Day'.",1.0689655172413792,0.0478872465399595,29,27,2,0,False,True,37
567,2263,Enough with the evil twin jokes.,1.0689655172413792,0.0478872465399595,29,27,2,0,False,True,32
567,2264,"First day on the job, andI didn't want to be late.",1.0689655172413792,0.0689655172413792,29,28,0,1,False,True,50
567,2265,It's a prototype. I'm supposed to be able to reach the gas pedal.,1.0689655172413792,0.0478872465399595,29,27,2,0,False,True,65
567,2266,H.R. told me I need to practice self care.,1.0689655172413792,0.0478872465399595,29,27,2,0,False,True,42
567,2267,I'll be up all night.,1.0689655172413792,0.0689655172413792,29,28,0,1,False,True,21
567,2268,"Geez, give me a break, I already live at work, now you want to mandate my diet as well ?",1.0689655172413792,0.0478872465399595,29,27,2,0,True,True,88
567,2269,Yo're the one who said come prepared for a long day!,1.0689655172413792,0.0689655172413792,29,28,0,1,False,True,52
567,2270,I'm preparing for the soft landing.,1.0689655172413792,0.0689655172413792,29,28,0,1,False,True,35
567,2271,"This is all your fault, Dad. If you guys would have me a few years earlier I wouldn't have ended up a millennial.",1.0689655172413792,0.0478872465399595,29,27,2,0,False,True,113
567,2272,"Oh, so Johnson's the only one who gets a standing desk?",1.0689655172413792,0.0689655172413792,29,28,0,1,True,True,55
567,2273,"You told me to stay in bed, so I brought my bed with me.",1.0689655172413792,0.0478872465399595,29,27,2,0,False,True,56
567,2274,My twin is running late.,1.0689655172413792,0.0478872465399595,29,27,2,0,False,True,24
567,2275,"""Second breakfast break"".",1.0689655172413792,0.0478872465399595,29,27,2,0,False,True,25
567,2276,You don't see me complaining about working late!,1.0689655172413792,0.0478872465399595,29,27,2,0,False,True,48
567,2277,Next time I get the suite and you get the closet!,1.0689655172413792,0.0689655172413792,29,28,0,1,False,True,49
567,2278,"I made it to the meeting on time, didn't I?!",1.0689655172413792,0.0689655172413792,29,28,0,1,True,True,44
567,2279,'Business casual' is entirely subjective,1.0689655172413792,0.0689655172413792,29,28,0,1,False,False,40
567,2280,welcome to team Mr. Murphy,1.0689655172413792,0.0689655172413792,29,28,0,1,False,False,26
567,2281,Everyone thinks I can instantly dream something up.,1.0689655172413792,0.0689655172413792,29,28,0,1,False,True,51
567,2282,Then don't schedule 7:30 AM meetings!,1.0689655172413792,0.0478872465399595,29,27,2,0,False,True,37
567,2283,"Fine, the prosecution will rest its case!",1.0689655172413792,0.0478872465399595,29,27,2,0,False,True,41
567,2284,Does this make my butt look big?,1.0689655172413792,0.0689655172413792,29,28,0,1,True,True,32
567,2285,"What's woke is work. drink, rest. now!",1.0689655172413792,0.0689655172413792,29,28,0,1,False,True,38
567,2286,What?! Never heard of the google bed.,1.0689655172413792,0.0478872465399595,29,27,2,0,True,True,37
567,2287,I knew I forgot something!,1.0689655172413792,0.0689655172413792,29,28,0,1,False,True,26
567,2288,What is sexually harassing about this?,1.0689655172413792,0.0478872465399595,29,27,2,0,True,True,38
567,2289,...and that is why I feel that I am the right person to be the product manager for Tylenol pm.,1.0689655172413792,0.0689655172413792,29,28,0,1,False,True,94
567,2290,You know I can't get out of bed without that first cup of coffee.,1.0689655172413792,0.0478872465399595,29,27,2,0,False,True,65
567,2291,Can't you wait till I'm out of bed before you get on my case?,1.0689655172413792,0.0689655172413792,29,28,0,1,True,True,61
567,2292,"I said my favorite movie was Tuck Everlasting, then...POOF.",1.0689655172413792,0.0689655172413792,29,28,0,1,False,True,59
567,2293,My cost-cutting employer sees this as a substitute for a hotel room.,1.0689655172413792,0.0478872465399595,29,27,2,0,False,True,68
567,2294,"For now it needs a forklift and driver, but I plan to add wheels.",1.0689655172413792,0.0478872465399595,29,27,2,0,False,True,65
567,2295,"Are you blind, I don't have a bottom sheet.",1.0689655172413792,0.0689655172413792,29,28,0,1,False,True,43
567,2296,I'm in for the long haul.,1.0689655172413792,0.0478872465399595,29,27,2,0,False,True,25
567,2297,You bet I'm angry Mr. Murphy. Your bed is defective.,1.0689655172413792,0.0689655172413792,29,28,0,1,False,True,52
567,2298,Buy this stuff or I'll break your bones!,1.0689655172413792,0.0478872465399595,29,27,2,0,False,True,40
567,2299,My damn doctor said I had to stay in bed.,1.0689655172413792,0.0478872465399595,29,27,2,0,False,True,41
567,2300,this is a merry go round enjoyed it. we will make it hang on away we go where I don't know??,1.0689655172413792,0.0689655172413792,29,28,0,1,True,True,92
567,2301,Put it on rollers and bought it to work. You got a problem with that?,1.0689655172413792,0.0478872465399595,29,27,2,0,True,True,69
567,2302,What jet lag?,1.0689655172413792,0.0689655172413792,29,28,0,1,True,True,13
567,2303,"Why yes, Murphy, I'm stuck in your bed. Now get me out of here!",1.0689655172413792,0.0478872465399595,29,27,2,0,False,True,63
567,2304,"The artist has the imagination of a southern baptist,",1.0689655172413792,0.0478872465399595,29,27,2,0,False,False,53
567,2305,What good is 'anti-gravity comfort' with a 24 hour work day?,1.0689655172413792,0.0689655172413792,29,28,0,1,True,True,60
567,2306,"I'm ready for 24/7, if you are .",1.0689655172413792,0.0478872465399595,29,27,2,0,False,True,32
567,2307,When will you decide who gets the job?,1.0689655172413792,0.0478872465399595,29,27,2,0,True,True,38
567,2308,"Hey, I can do the sleep in my job!",1.0689655172413792,0.0689655172413792,29,28,0,1,False,True,34
567,2309,"Yeah, not exactly my dream job either, but I try to make the best of it..",1.0689655172413792,0.0478872465399595,29,27,2,0,False,True,73
567,2310,It's not my fault. I got stuck in bed.,1.0689655172413792,0.0478872465399595,29,27,2,0,False,True,38
567,2311,"So, this still doesn't say, ""I'm workaholic"" to you?",1.0689655172413792,0.0478872465399595,29,27,2,0,True,True,52
567,2312,How dare you accuse me of sleeping on the job!,1.0689655172413792,0.0478872465399595,29,27,2,0,False,True,46
567,2313,"If you can work at home, why can't you home at work?",1.0689655172413792,0.0689655172413792,29,28,0,1,True,True,52
567,2314,I'm trying to get in touch with our new Murphy Bed account,1.0689655172413792,0.0478872465399595,29,27,2,0,False,False,58
567,2315,"Then they crept under the bed and tied me up with my own blanket. I'm lucky to be here at all, much less late.",1.0689655172413792,0.0689655172413792,29,28,0,1,False,True,110
567,2316,You try living in a pocket protector!,1.0689655172413792,0.0478872465399595,29,27,2,0,False,True,37
567,2317,You can tell him I don't get out of Murphy bed for less than ten thousand.,1.0689655172413792,0.0689655172413792,29,28,0,1,False,True,74
567,2318,I'm multi-tasking!,1.0689655172413792,0.0478872465399595,29,27,2,0,False,True,18
567,2319,Oh! How I hate to get up in the morning.,1.0689655172413792,0.0689655172413792,29,28,0,1,False,True,40
567,2320,"Yes, I'm late! The airline wouldn't let me board!",1.0689655172413792,0.0689655172413792,29,28,0,1,False,True,49
567,2321,What makes you think you're not horizontal?,1.0689655172413792,0.0689655172413792,29,28,0,1,True,True,43
567,2322,It seemed like a good idea at the time.,1.0689655172413792,0.0689655172413792,29,28,0,1,False,True,39
567,2323,"Well, you told me never to fall asleep at my desk again.",1.0689655172413792,0.0478872465399595,29,27,2,0,False,True,56
567,2324,I'm going to sleep my way into that corner office!,1.0689655172413792,0.0478872465399595,29,27,2,0,False,True,50
567,2325,"I'll be boarding with my own blanket, pillow and coffee. What should I say to the cabin crew if they try to impose extra carry on fees?",1.0689655172413792,0.0478872465399595,29,27,2,0,True,True,135
567,2326,Stop trying to change me!,1.0689655172413792,0.0689655172413792,29,28,0,1,False,True,25
567,2327,But I took naps in college all the time!,1.0689655172413792,0.0689655172413792,29,28,0,1,False,True,40
567,2328,What about bathroom breaks?,1.0689655172413792,0.0689655172413792,29,28,0,1,True,True,27
567,2329,This living sculpture stuff always muddles me...Is this a clinomaniacally attached man or have we here some kind of unresolved swaddling fixation???,1.0689655172413792,0.0478872465399595,29,27,2,0,True,True,148
567,2330,"Sorry, doctor's orders.",1.0689655172413792,0.0478872465399595,29,27,2,0,False,True,23
567,2331,I'm upright and dressed; what more do you want?,1.0689655172413792,0.0478872465399595,29,27,2,0,True,True,47
567,2332,This fulfills your promise to 'send me college?',1.0689655172413792,0.0478872465399595,29,27,2,0,True,False,48
567,2333,What? I'm a multitasker.,1.0689655172413792,0.0689655172413792,29,28,0,1,True,True,24
567,2334,I got tired of my standing desk.,1.0689655172413792,0.0478872465399595,29,27,2,0,False,True,32
567,2335,"Since I'm always on my laptop in bed, thought this would be cool.",1.0689655172413792,0.0689655172413792,29,28,0,1,False,True,65
567,2336,Multitasking big time.,1.0689655172413792,0.0478872465399595,29,27,2,0,False,True,22
567,2337,You said that my new promotion had more benefits,1.0689655172413792,0.0478872465399595,29,27,2,0,False,False,48
567,2338,I downloaded the sleep app.,1.0689655172413792,0.0689655172413792,29,28,0,1,False,True,27
567,2339,I gave up my seat for overnight accommodations.,1.0689655172413792,0.0478872465399595,29,27,2,0,False,True,47
567,2340,I call it the Murphy Office.,1.0689655172413792,0.0478872465399595,29,27,2,0,False,True,28
567,2341,Well what else does one wear on the first day as an undercover salesman for Sleep Train?,1.0689655172413792,0.0478872465399595,29,27,2,0,True,True,88
567,2342,This isn't my idea of a working vacation.,1.0689655172413792,0.0478872465399595,29,27,2,0,False,True,41
567,2343,Just relax for once!,1.0689655172413792,0.0478872465399595,29,27,2,0,False,True,20
567,2344,"I know its not exactly Wallace and Gromit, but it will do for now...",1.0689655172413792,0.0478872465399595,29,27,2,0,False,True,68
567,2345,Check out these egyptian weave sheets. Check out these egyptian weave sheets.,1.0689655172413792,0.0478872465399595,29,27,2,0,False,True,77
567,2346,What? It's a total time saver.,1.0689655172413792,0.0478872465399595,29,27,2,0,True,True,30
567,2347,I am working on a study that says the sleeping desk is superior to the standing desk.,1.0689655172413792,0.0478872465399595,29,27,2,0,False,True,85
567,2348,"I didn't get out of bed for this nonsense, jerry!",1.0689655172413792,0.0689655172413792,29,28,0,1,False,True,49
567,2349,But this way I'll never get out of the wrong side of bed again!,1.0689655172413792,0.0478872465399595,29,27,2,0,False,True,63
567,2350,... And then a woman on the 6 Train had the nerve to accuse me of bedspreading!,1.0689655172413792,0.0478872465399595,29,27,2,0,False,True,79
567,2351,I'm not going to take this lying down,1.0689655172413792,0.0478872465399595,29,27,2,0,False,False,37
567,2352,I don't give a sheet.,1.0689655172413792,0.0478872465399595,29,27,2,0,False,True,21
567,2353,"""So you're asking me to become a salaried employee""....",1.0689655172413792,0.0689655172413792,29,28,0,1,False,True,55
567,2354,"I can never get out of bed on Mondays, but I still have to work.",1.0689655172413792,0.0478872465399595,29,27,2,0,False,True,64
567,2355,You said business casual,1.0689655172413792,0.0478872465399595,29,27,2,0,False,False,24
567,2356,I got tired of my standing desk.,1.0689655172413792,0.0689655172413792,29,28,0,1,False,True,32
567,2357,Another damn breakfast-in-bed meeting.,1.0689655172413792,0.0478872465399595,29,27,2,0,False,True,38
567,2358,Haven't you ever seen a power nap before?,1.0689655172413792,0.0478872465399595,29,27,2,0,True,True,41
567,2359,"Armageddeon, sarmageddeon. Bring it on!",1.0689655172413792,0.0478872465399595,29,27,2,0,False,True,39
567,2360,You'll never be Grommit!,1.0689655172413792,0.0689655172413792,29,28,0,1,False,True,24
567,2361,You got me! I will pay my hotel bill when you let me out of this bed.,1.0689655172413792,0.0689655172413792,29,28,0,1,False,True,69
567,2362,"I'm wearing Depends, OK?",1.0689655172413792,0.0478872465399595,29,27,2,0,True,True,24
567,2363,Whaddya mean I can't sleep at work,1.0689655172413792,0.0689655172413792,29,28,0,1,False,False,34
567,2364,"I always doze off at these stupid meetings anyway, so I figured I might as well be comfortable.",1.0689655172413792,0.0478872465399595,29,27,2,0,False,True,95
567,2365,I m NOT sick!,1.0689655172413792,0.0478872465399595,29,27,2,0,False,True,13
567,2366,I'm a morning person.,1.0689655172413792,0.0478872465399595,29,27,2,0,False,True,21
567,2367,I prefer sleeping on the job in the horizontal position...,1.0689655172413792,0.0689655172413792,29,28,0,1,False,True,58
567,2368,It's my new form fitting mattresss...now I can't get it off.,1.0689655172413792,0.0478872465399595,29,27,2,0,False,True,60
567,2369,You order the Casper Accountant?,1.0689655172413792,0.0689655172413792,29,28,0,1,True,True,32
567,2370,"No, I never sleep on the subway. Why do you ask?",1.0689655172413792,0.0478872465399595,29,27,2,0,True,True,48
567,2371,with all this work you give me I don't even have time to sleep,1.0689655172413792,0.0689655172413792,29,28,0,1,False,False,62
567,2372,This is my virtual office.,1.0689655172413792,0.0689655172413792,29,28,0,1,False,True,26
567,2373,"it's called ""being efficient""!",1.0689655172413792,0.0478872465399595,29,27,2,0,False,True,30
567,2374,"I'm sorry, Murphy's law is binding.",1.0689655172413792,0.0478872465399595,29,27,2,0,False,True,35
567,2375,Is this your idea of working from home?,1.0689655172413792,0.0478872465399595,29,27,2,0,True,True,39
567,2376,"What do you mean ""I can't multitask""?!?",1.0689655172413792,0.0478872465399595,29,27,2,0,True,True,39
567,2377,"The reason IS, Sir, I work much more effectively after one of my power naps!!",1.0689655172413792,0.0478872465399595,29,27,2,0,False,True,77
567,2378,is it time to get up?,1.0689655172413792,0.0689655172413792,29,28,0,1,True,True,21
