contest,caption,mean,precision,votes,not_funny,somewhat_funny,funny,has_question_mark,ends_with_punctuation,caption_length
864,Maybe cut the line about following your instincts.,1.8325666973321064,0.0250630453802609,1087,477,315,295,False,True,50
864,The good news is that you have their full attention.,1.7253787878787878,0.0236733268528974,1056,497,352,207,False,True,52
864,You're reading too much into being called the 'dinner speaker.',1.7131578947368422,0.0167187699110171,2280,1147,640,493,False,False,63
864,What do you mean I booked you at the wrong pride event?,1.7035422343324251,0.0190610599306655,1835,964,451,420,True,True,55
864,Be glad you're the AFTER dinner speaker.,1.7025109170305677,0.0180829951372773,1832,902,573,357,False,True,40
864,Just tell them why you've chosen to run.,1.699787460148778,0.0178772216587188,1882,933,581,368,False,True,40
864,No worries. This is an after dinner speech.,1.6986899563318778,0.0226002318334384,1145,559,372,214,False,True,43
864,You got this!  I'll wait in the car.,1.6889383815887156,0.0216097390389589,1347,698,370,279,False,True,36
864,Don't worry. They're probably still full from the keynote speaker.,1.6876215165262476,0.0201435517369995,1543,799,427,317,False,True,66
864,"Relax, it's an after dinner speech.",1.6868225898459783,0.0184111552248077,1753,881,540,332,False,True,35
864,"Actually, I was hoping to address the elephant in the room!",1.682800345721694,0.0232755466866292,1157,604,316,237,False,True,59
864,I'd like to stay but I've got to run.,1.6827094474153297,0.0223635874382488,1122,549,380,193,False,True,37
864,It might help to picture them stuffed and mounted.,1.6820455808782655,0.0179838394981981,1799,900,571,328,False,True,50
864,When you said I would be addressing the Lions’ Club….,1.6748038360941586,0.0230058114116591,1147,595,330,222,False,True,53
864,I highly doubt they’re still hungry after the last two speakers.,1.6679810725552051,0.0220515312002416,1268,671,347,250,False,True,64
864,"Just remember, they are not a captive audience.",1.6666666666666667,0.0255489215283402,861,433,282,146,False,True,47
864,Show a little leg. They go wild.,1.6642402183803455,0.0235827857088736,1099,582,304,213,False,True,32
864,I think you misunderstood the meaning of pride week,1.6640543364681295,0.0178527262582148,1914,1013,531,370,False,False,51
864,Just picture them in their underwear. And in cages.,1.6625421822272215,0.025929420777572,889,466,257,166,False,True,51
864,"Don't worry, if they try anything, I'll distract them with the laser pointer.",1.6618933969769292,0.022472412693595,1257,683,316,258,False,True,77
864,I'd lead with the Zebra joke.,1.6593607305936071,0.0227855263919928,1095,561,346,188,False,True,29
864,It's the Lions Club.  What did you expect?  Gophers?,1.6582278481012658,0.0219954630291263,1264,676,344,244,True,True,52
864,"I thought it was the ""other"" Lions Club.",1.6472795497185742,0.0238056145153058,1066,576,290,200,False,True,40
864,"Maybe don't start with ""let us Pray...""",1.6416416416416415,0.0244027251697191,999,540,277,182,False,False,39
864,"You go first, I insist.",1.6396039603960395,0.0189677845738625,1515,784,493,238,False,True,23
864,Maybe I shouldn’t have introduced you as a fresh up-and-comer.,1.6301498127340823,0.0233048131235652,1068,580,303,185,False,True,62
864,You'll give them plenty of food for thought.,1.6299603174603174,0.0230857334050512,1008,526,329,153,False,True,44
864,"Kill the messenger is just a saying, Larry",1.6292134831460674,0.0231206956521676,1068,576,312,180,False,False,42
864,At least you don’t have to worry about keeping their attention.,1.6231884057971016,0.0222758659389302,1035,534,357,144,False,True,63
864,I just know you’ll leave them hungry for more!,1.6181229773462784,0.0240091233121651,927,492,297,138,False,True,46
864,Open with a great hyena joke.,1.6140350877192982,0.0228514100072821,1026,549,324,153,False,True,29
864,"Yes, we do have to invite the winner on stage.",1.6133828996282529,0.02260709861895,1076,584,324,168,False,True,46
864,Dinner theater,1.608955223880597,0.0240438120275424,1005,565,268,172,False,False,14
864,The way they’re staring at me makes me feel like a piece of meat,1.607242339832869,0.0228462384486129,1077,597,306,174,False,False,64
864,I really hate when I get the speaking slot just before lunch.,1.5954198473282444,0.0223572154342764,1048,572,328,148,False,True,61
864,I think we misunderstood Pride Event.,1.5939957112223015,0.0215631666852917,1399,854,259,286,False,True,37
864,I know.  It's always tougher speaking before lunch.,1.59254327563249,0.0210253424645503,1502,929,256,317,False,True,51
864,What did you think a Lions Club meeting is?,1.5886178861788618,0.0298704566594143,615,347,174,94,True,True,43
864,They'll eat it up!!!  Don't worry!,1.588469184890656,0.0230599418820067,1006,561,298,147,False,True,34
864,"""They never miss a poetry feeding.""",1.5870967741935484,0.0230524571238496,1085,629,275,181,False,False,35
864,I'll be backstage.  Way backstage.,1.5864734299516907,0.0224423442568366,1035,572,319,144,False,True,34
864,"Don't worry, 'lunch is provided' didn't mean you.",1.584942084942085,0.0224313686543684,1036,574,318,144,False,True,49
864,It’ll be over before you know it.,1.5844748858447488,0.0218503311872966,1095,608,334,153,False,True,33
864,Try not to stumble.,1.5794594594594595,0.0236835374193495,925,516,282,127,False,True,19
864,"It’s a pride event , you can’t cancel now it will be all over the news.",1.5790554414784397,0.0236353093976431,974,556,272,146,False,True,71
864,Thanks for stepping up to the plate.,1.575938566552901,0.0229085081347003,1172,714,241,217,False,True,36
864,Appeal to their pride.,1.5756823821339951,0.0238582628595949,1209,781,160,268,False,True,22
864,I'll be right back.,1.5750232991612303,0.0232205417093471,1073,635,259,179,False,True,19
864,I also don't know why the schedule has this time slot as 'Lunch' but don't worry about it,1.5697036223929748,0.0249321783021239,911,538,227,146,False,False,89
864,It’s always hardest to go right before lunch.,1.566600397614314,0.0327917180379188,503,292,137,74,False,True,45
864,I understand it's tough to be presenting right before lunch but you'll do fine.,1.5637065637065637,0.0255333755131709,777,440,236,101,False,True,79
864,I know it's hard to present before lunch.,1.5546218487394958,0.0263836239938074,714,407,218,89,False,True,41
864,And the winner for best impala chaser of the year is…,1.549483013293944,0.0272402599117425,677,391,200,86,False,False,53
864,Just don't break a leg.,1.5472350230414746,0.0242640621104897,868,507,247,114,False,True,23
864,Relax. You have their total attention.,1.5464037122969838,0.0236079391991079,862,491,271,100,False,True,38
864,It’s OK. You are the AFTER dinner speaker.,1.5442708333333333,0.0263982740795643,768,460,198,110,False,True,42
864,Cut right to the chase.,1.5437415881561238,0.027938535937653,743,462,158,123,False,True,23
864,"Remember, no matter what they say, we only have two seats in the Ark",1.5419354838709678,0.0290516492759643,620,369,166,85,False,False,68
864,They've already had lunch...,1.5415335463258786,0.0277561323412408,626,360,193,73,False,True,28
864,I think this might actually be a GOOD time to yell fire in a crowded theater.,1.5404312668463611,0.0270493588855591,742,450,183,109,False,True,77
864,"Don't worry; there is a strict ""no eating"" policy in this theater.",1.5386666666666666,0.0266303268189242,750,452,192,106,False,True,66
864,"My talk today will focus on the deliciousness of hippopotamuses, and their extremely slow movement speed.",1.5383597883597884,0.0266666524143754,756,458,189,109,False,True,105
864,Why don’t you go first.,1.537190082644628,0.0260249519573475,726,424,214,88,False,True,23
864,"It's a roast, but try not to hurt their pride.",1.5356643356643356,0.0272771217194641,715,433,181,101,False,True,46
864,Remember. They can sense fear.,1.533149171270718,0.0260128871178454,724,425,212,87,False,True,30
864,Let's skip the audience participation part of the presentation.,1.532857142857143,0.0265244118136608,700,412,203,85,False,True,63
864,Give them something they can really sink their teeth into.,1.5312024353120244,0.0274861869548617,657,389,187,81,False,True,58
864,This is the last time we’re doing a dinner show.,1.529500756429652,0.0279445593688046,661,399,174,88,False,True,48
864,Get out there and give that audience something to chew on.,1.527736131934033,0.0273478940892614,667,398,186,83,False,True,58
864,Remember. High Energy. You’re the only thing standing between them and lunch,1.527190332326284,0.0275866704879941,662,397,181,84,False,False,76
864,Speak as if your life depends on it,1.5271659324522762,0.0268460845055955,681,404,195,82,False,False,35
864,Psst! This may not be the best audience to pitch your vegan diet program!,1.527102803738318,0.0301301625946427,535,316,156,63,False,True,73
864,It's pride month.,1.5265822784810126,0.0365995754298758,395,242,98,55,False,True,17
864,"Watch out, keep to the script or you’ll literally be eaten alive!",1.522504892367906,0.0313106749512396,511,308,139,64,False,True,65
864,I think I'll wait for you in the car.,1.5224358974358974,0.0299918144639061,624,395,132,97,False,True,37
864,"If you're nervous, just imagine them all as rugs.""",1.5205930807248764,0.0291000141286038,607,371,156,80,False,False,50
864,The lunch slot’s always a tough gig.,1.5203915171288744,0.028699204055072,613,372,163,78,False,True,36
864,Try not to do that deer in the spotlight thing again,1.516566265060241,0.0272882347610591,664,402,181,81,False,False,52
864,I've a better idea.  Start talking about quantum physics.  It will put them all to sleep.,1.516190476190476,0.0306901341872559,525,318,143,64,False,True,89
864,"Fred, after this, they're throwing us a 'meet and greet' luncheon.",1.512014787430684,0.030578945315866,541,333,139,69,False,True,66
864,I'll go start the car.,1.512014787430684,0.030578945315866,541,333,139,69,False,True,22
864,I have to run.,1.5117967332123412,0.0308100674805462,551,344,132,75,False,True,14
864,"Immersion therapy isn’t meant to be comfortable, Verne.",1.5114235500878734,0.0289129815674588,569,342,163,64,False,True,55
864,"I know you’re nervous, but what’s the worst that could happen?",1.510948905109489,0.0309390729105926,548,343,130,75,True,True,62
864,Just imagine them without fur.,1.508896797153025,0.029180086674316,562,340,158,64,False,True,30
864,"Trust me, it can't go any worse for you than the last guy.",1.5047619047619047,0.0337952826365339,420,256,116,48,False,True,58
864,"Don't worry...this is the after-dinner speech, remember?",1.5047438330170777,0.0302548285836626,527,322,144,61,True,True,56
864,Just stand very still while you're speaking.,1.5029585798816567,0.0306337318861211,507,309,141,57,False,True,44
864,Don’t leave the audience wanting more.,1.5020746887966805,0.0322076923982724,482,300,122,60,False,True,38
864,Something tells me we got booked for the wrong Pride Week!,1.5020325203252032,0.0341058039939809,492,324,89,79,False,True,58
864,"The title of your talk, ""Pursue Your Dream"", won't work.",1.5,0.0343558540824773,408,251,110,47,False,True,56
864,"After you, my deer.",1.4987893462469737,0.0335255877807402,413,251,118,44,False,True,19
864,"Remember, hakuna matata.",1.4957264957264955,0.0312176150752069,468,284,136,48,False,True,24
864,Just remind them: no eating allowed in the theater,1.4947589098532494,0.0324602166983717,477,301,116,60,False,False,50
864,"Relax, you're just introducing the wildebeest",1.492929292929293,0.0298392791630879,495,298,150,47,False,False,45
864,Just don’t mention the lunch break.,1.492569002123142,0.0313612786499677,471,289,132,50,False,True,35
864,"When they invited me to speak at 
Pride Week, I guess I misunderstood.",1.4922737306843268,0.035854491226339,453,305,73,75,False,True,70
864,"Don’t be nervous, they can smell fear.",1.487068965517241,0.032428747408041,464,293,116,55,False,True,38
864,"Whatever you do, skip the part that says ‘Now I offer you some food for thought.’",1.4870588235294118,0.0341520741760947,425,270,103,52,False,False,81
864,"You'll be fine, just don't cut to the chase.",1.4852320675105486,0.0461641537292998,237,152,55,30,False,True,44
864,"In this case, speaking right after lunch is a good thing.",1.4834123222748816,0.0336678268791019,422,266,108,48,False,True,57
864,Can't you feel the excitement in the room?,1.4824355971896956,0.0335392590530735,427,270,108,49,True,True,42
864,Just be careful with the laser pointer.,1.481081081081081,0.0363467161280366,370,236,90,44,False,True,39
864,"Don't worry.
I was told they love antelopes.",1.4798657718120805,0.0412199556907288,298,193,67,38,False,True,44
864,They’re just cats.,1.4782608695652173,0.0353239803888251,345,211,103,31,False,True,18
864,Gotta run. Don’t worry. They’re just gonna eat you up.,1.4777517564402811,0.0338590316339572,427,274,102,51,False,True,54
864,"Just don't say, ""Let's cut to the chase.""",1.4768856447688563,0.0343242205929316,411,263,100,48,False,False,41
864,Just wait til you hear the crowd roar,1.4757281553398058,0.0349430562850082,412,268,92,52,False,False,37
864,Just imagine them all as rugs.,1.475195822454308,0.0354163628669036,383,245,94,44,False,True,30
864,"Just relax and be natural, you'll never have to do this again.",1.4739336492890995,0.0481212441950719,211,136,50,25,False,True,62
864,Better cut to the chase quickly.,1.4732620320855614,0.0352390847621239,374,237,97,40,False,True,32
864,Don't worry. The audience will eat you up alive!,1.4730077120822622,0.0342416723033052,389,245,104,40,False,True,48
864,BEFORE I TAKEOFF RUNNING LIKE HELL I'VE BEEN ASKED TO SAY A FEW WORDS,1.4728682170542635,0.0349494857003086,387,247,97,43,False,False,69
864,'If the 'Pride joke' falls flat...run like hell!',1.4723618090452262,0.0358608654411262,398,262,84,52,False,False,49
864,They just finished their dinner. So you should have half an hour.,1.471794871794872,0.0343676209560431,390,247,102,41,False,True,65
864,Please tell me you remembered the laser pointer.,1.4704301075268815,0.0361818095964168,372,241,87,44,False,True,48
864,They seem attentive,1.4704301075268815,0.034959610763157,372,235,99,38,False,False,19
864,"Go on, they’re hungry for more.",1.4695863746958635,0.0327166711174738,411,257,115,39,False,True,31
864,"I still don't think ""Eating Locally Sourced Food"" is a good topic for this audience.",1.4691011235955056,0.0375988555489967,356,234,77,45,False,True,84
864,Maybe lead with you have herpes.,1.4640883977900552,0.0367019672195439,362,237,82,43,False,True,32
864,And afterwards they’re holding a banquet in your honor.,1.464,0.0361482390603716,375,246,84,45,False,True,55
864,You sure they’ll appreciate “The Herbivore’s Dilemma?”,1.4635568513119537,0.0361495685097425,343,218,91,34,True,False,54
864,You only get one chance with this.,1.4635416666666667,0.0339473991537671,384,243,104,37,False,True,34
864,Just relax. You’ve got the laser pointer.,1.463068181818182,0.0376910533266341,352,233,75,44,False,True,41
864,You've been asked to stay for dinner.,1.4613095238095235,0.0376430018963558,336,219,79,38,False,True,37
864,Don’t be nervous- just imagine they’re all vegans.,1.461111111111111,0.0333165644398574,360,221,112,27,False,True,50
864,Just image them with no teeth.,1.4609756097560975,0.0332933595347697,410,263,105,42,False,True,30
864,They are here for the big bucks.,1.46,0.0367465236395317,350,228,83,39,False,True,32
864,Just open with “The only thing that stands between you and dinner is this podium.” They’ll eat it up.,1.4598930481283423,0.0354081059360486,374,243,90,41,False,True,101
864,Just picture them all as rugs.,1.4589235127478757,0.0365126027043916,353,230,84,39,False,True,30
864,Just imagine them wearing clothes,1.4583333333333333,0.0378688524800325,336,221,76,39,False,False,33
864,Our next speaker will discuss the benefits of becoming a vegetarian.,1.458204334365325,0.0382523225882116,323,211,76,36,False,True,68
864,"Relax, you've already got their attention.",1.4579710144927536,0.0369051037723346,345,225,82,38,False,True,42
864,The elevated heavy-metal content in venison. Lead with that.,1.4567901234567902,0.037909060537712,324,211,78,35,False,True,60
864,"thank you for letting us address your first diversity, equity and inclusion conference.",1.4560906515580736,0.0369415457591735,353,233,79,41,False,True,87
864,You've got their attention.,1.4558823529411764,0.0353876226821644,340,215,95,30,False,True,27
864,"Whatever you do, don’t fall off the stage.",1.4551724137931037,0.0422939133086875,290,197,54,39,False,True,42
864,Don’t be nervous. They’re gonna eat you up!”,1.4542772861356932,0.0394186890289822,339,232,60,47,False,False,44
864,"Wake up, dear, you're having that dream again.",1.4536741214057507,0.0393975317385496,313,208,68,37,False,True,46
864,Just be sure to remind them that eating in the auditorium is strictly prohibited,1.452887537993921,0.0403299917766078,329,227,55,47,False,False,80
864,Careful what you say.  It’s a jungle out there.,1.4518072289156627,0.0374627680909385,332,218,78,36,False,True,47
864,"Don’t be nervous, just imagine they are all stuffed.",1.4490445859872612,0.0379685931180837,314,205,77,32,False,True,52
864,Don't worry.  The lunch was served first.,1.4486803519061584,0.0342936695556459,341,214,101,26,False,True,41
864,You need to emphasize this was a meeting to pray…not for prey.,1.4476190476190476,0.03760681740663,315,205,79,31,False,True,62
864,"Next up: ""The Circle of Life is an Outdated Concept : A Persuasive Essay""",1.4448051948051948,0.0384870950609043,308,203,73,32,False,False,73
864,"Okay, so I was wrong about which Lion's Club this is.",1.4447852760736195,0.0394040234540029,326,223,61,42,False,True,53
864,It’ll be okay. You’re the After Dinner Speaker.,1.4440993788819876,0.039771335729639,322,221,59,42,False,True,47
864,Your vegetarian Ted Talk is going to kill!,1.443452380952381,0.035633867646345,336,217,89,30,False,True,42
864,"Remember, after giving the opening remarks, remind everyone about emergency exits and I'll shout, ""Fire!""",1.4405144694533762,0.0381951378853918,311,206,73,32,False,False,105
864,"On the plus side, they'll be highly distracted by the laser pointer.",1.4403973509933774,0.039860037677601,302,204,63,35,False,True,68
864,It's a dinner theater.  Why do you ask?,1.4397163120567376,0.042253472804867,282,194,52,36,True,True,39
864,We should have asked what they meant by dinner theater.,1.4395973154362416,0.0410872879136097,298,205,55,38,False,True,55
864,Just picture them as rugs and you'll be fine.,1.4377682403433476,0.0441459077545125,233,155,54,24,False,True,45
864,"Just pretend they are the voters in the New Yorker Caption Contest.  They aren't going to like whatever you say, so just don't worry about it.",1.4372881355932203,0.0427615062206255,295,209,43,43,False,True,142
864,I'll be waiting for you right outside the stage door.,1.4370860927152318,0.0363793103673896,302,193,86,23,False,True,53
864,Headlights? Do you see headlights?,1.436426116838488,0.0397846262381525,291,195,65,31,True,True,34
864,They want to hear about your plant-based diet.,1.4359861591695502,0.0405806779848403,289,196,60,33,False,True,46
864,It helps to picture them with clothes on.,1.435215946843854,0.0385200629382239,301,200,71,30,False,True,41
864,Just get out there! What’s the worst that could happen?,1.4349442379182156,0.0424829185793529,269,184,53,32,True,True,55
864,Picture them all with clothes on.,1.4349442379182156,0.0411561545098187,269,180,61,28,False,True,33
864,Would like to explain why going vegan is in all our best interest,1.4333333333333331,0.03802051119654,300,198,74,28,False,False,65
864,Don't be nervous.  They're going to eat you up!,1.4333333333333331,0.0424535508081128,300,214,42,44,False,True,47
864,What they’re really hungry for is a fresh approach.,1.4317343173431734,0.0385054756273026,271,175,75,21,False,True,51
864,I just figured out why they call it dinner theater.,1.4296875,0.044407588661847,256,179,44,33,False,True,51
864,There's no need to be nervous about your presentation.  Most of the congregation only came here for the free meal.,1.4291666666666667,0.0431491836024762,240,161,55,24,False,True,114
864,Maybe volunteering to speak at the Lions Club was not your finest idea.,1.429078014184397,0.0406717713168609,282,192,59,31,False,True,71
864,"Trust me, they are gonna eat you up.",1.4280701754385965,0.0421464258064559,285,200,48,37,False,True,36
864,"And remember, don't turn your back on the audience.",1.4229249011857708,0.0387527152618292,253,163,73,17,False,True,51
864,Imagine them fully clothed,1.4226415094339622,0.0418729856352068,265,182,54,29,False,False,26
864,Don’t be dramatic. They won’t eat you alive,1.4202334630350195,0.0410034167591259,257,173,60,24,False,False,43
864,Yes! It's  in bad taste. That's the idea ...,1.4197952218430034,0.0373519781415822,293,194,75,24,False,True,44
864,"I'd keep it short, if I were you.",1.41869918699187,0.0423065647930276,246,167,55,24,False,True,33
864,You have about fifteen seconds to make your case.,1.416326530612245,0.0408046152486006,245,163,62,20,False,True,49
864,Its okay. It's just the audience. They don't bite.,1.416030534351145,0.038555691758337,262,172,71,19,False,True,50
864,"Maybe don’t call it “Eat Prey, Love.”",1.4146341463414631,0.0438157062256062,246,172,46,28,False,False,37
864,I'll be in the car,1.4126984126984128,0.0437520026155143,252,178,44,30,False,False,18
864,Remember - everyone’s looking for good gnus these days,1.4122448979591835,0.0439294549341138,245,172,45,28,False,False,54
864,Open with a joke… and then run like hell.,1.411764705882353,0.0440895678232809,238,166,46,26,False,True,41
864,"On the plus side, you'll never have to do this again.",1.4096916299559472,0.0434602058205353,227,155,51,21,False,True,53
864,Don't be nervous. They just saw the Lion King and they feel pretty good.,1.4094827586206895,0.0410024998261778,232,154,61,17,False,True,72
864,I don’t care what the card says.  I think it’s best if you tell them that “The Lion King” has won again.,1.4090909090909092,0.0480378418577382,220,159,32,29,False,True,104
864,"Keep it short, they haven’t had lunch yet.",1.408906882591093,0.0413118073922035,247,168,57,22,False,True,42
864,I heard it was gonna be a tough crowd,1.4083333333333334,0.0409065961042343,240,161,60,19,False,False,37
864,You're the first speaker after lunch....you should be ok.,1.4066390041493777,0.0428395187947174,241,167,50,24,False,True,57
864,Let's forget about the audience participation part.,1.4054054054054057,0.0459331152488566,222,157,40,25,False,True,51
864,There are some fears you can’t outrun.,1.4045454545454543,0.0475631704098952,220,159,33,28,False,True,38
864,"When you hear the roar of the crowd, run for it.",1.4035087719298245,0.0458657084082595,228,163,38,27,False,True,48
864,That's all now. We have to run.,1.4034334763948495,0.0417177004562119,233,158,56,19,False,True,31
864,"Trust me, it's all about projecting confidence... and maybe not limping or anything.",1.4034334763948495,0.0438789228627364,233,163,46,24,False,True,84
864,It's nearing dinnertime...I'd pick up the pace if I were you!,1.403361344537815,0.0423734113676195,238,164,52,22,False,True,61
864,"What made you think you were the ""after"" dinner speaker?",1.4025974025974026,0.0458227670982103,231,166,37,28,True,True,56
864,"And now,in our next TED talk,Giselle speaks about the benefits of a vegetarian diet.",1.4,0.0461916163533671,220,157,38,25,False,True,84
864,Sure. Tough crowd. But at least you’re not the last speaker before lunch.,1.4,0.0420655234006537,230,157,54,19,False,True,73
864,"It was at this moment that Jerry realized his presentation ""Going Vegan: The key to a happy life"" wasn't going to go very well.",1.4,0.0466987660321336,205,144,40,21,False,True,127
864,Take my wife. Please!,1.399103139013453,0.0448268867572392,223,157,43,23,False,True,21
864,Relax. What's the worst that could happen?,1.398148148148148,0.0449325408946589,216,151,44,21,True,True,42
864,I suggest we cancel the meet and greet.,1.3979591836734695,0.0471476253758734,196,137,40,19,False,True,39
864,What did you expect?  You knew it was pride week.,1.396551724137931,0.0452054987897054,232,167,38,27,True,True,49
864,Just pretend they're in their underwear.,1.39647577092511,0.0424203373672668,227,156,52,19,False,True,40
864,I gave you my word. I’m not throwing you to the wolves.,1.3963133640552996,0.0452367260295767,217,153,42,22,False,True,55
864,"No sweat, it's you, then we all break for lunch.",1.3962264150943395,0.0435187164379815,212,145,50,17,False,True,48
864,Ignore the cat calls.,1.396039603960396,0.0676028119410359,101,72,18,11,False,True,21
864,What did you think they meant when they said we would be performing at the Lion’s Club?,1.3958333333333333,0.0428654265477375,240,169,47,24,True,True,87
864,You know what they say:  never let them smell you sweat.,1.3956043956043955,0.0459376649853853,182,123,46,13,False,True,56
864,Don’t break a leg.,1.3952380952380952,0.0437986751900001,210,144,49,17,False,True,18
864,"Don't worry, they'll eat you right up!",1.394736842105263,0.0418100595167423,228,156,54,18,False,True,38
864,That Steve Jobs quote -- 'Stay hungry. Stay foolish. Never let go of your appetite' -- you might want to skip it.,1.394736842105263,0.0470205986613454,190,132,41,17,False,True,113
864,Be tasteless.,1.3946188340807175,0.0456736393953208,223,160,38,25,False,True,13
864,Is that your will? You better let me hold on to that.,1.3946188340807175,0.0424651307645072,223,153,52,18,True,True,53
864,"Remember how you got over the ""headlights"" thing?",1.3935185185185186,0.0439125780586327,216,150,47,19,True,True,49
864,"Go ahead, it will be over before you know it.",1.3928571428571428,0.0441638297102041,224,158,44,22,False,True,45
