contest,caption,mean,precision,votes,not_funny,somewhat_funny,funny,has_question_mark,ends_with_punctuation,caption_length
865,It's a dog's life here. Do you think it will get any better in the hereafter ?,1.1407407407407408,0.0381480676444324,135,121,9,5,True,True,78
865,Howling at the moon just isn't the same since they painted the moon black.,1.1407407407407408,0.0335201447858383,135,118,15,2,False,True,74
865,"/Users/carolinebergin/Desktop/IMG_3777.jpeg
Why Does This Keep Happening To Me?!",1.1407407407407408,0.0351305910280073,135,119,13,3,True,True,80
865,I wished upon a star but all I got is this black hole.,1.1407407407407408,0.0335201447858383,135,118,15,2,False,True,54
865,But what if he rises right when we’re packing up to leave?,1.1407407407407408,0.0351305910280073,135,119,13,3,True,True,58
865,I'm howl-less.,1.140625,0.0346068594282721,128,112,14,2,False,True,14
865,All dogs mark in Heaven.,1.140625,0.0346068594282721,128,112,14,2,False,True,24
865,I used to dig those!,1.140625,0.0363409715823776,128,113,12,3,False,True,20
865,"I dunno, Mate, looks like Gods getting ready to dump another  opinion on us",1.140625,0.0346068594282721,128,112,14,2,False,False,75
865,It's where cats go when you chase them.,1.140625,0.0363409715823776,128,113,12,3,False,True,39
865,"That, son, is a hole in the Milky Way.",1.140625,0.0363409715823776,128,113,12,3,False,True,38
865,It sure does make you feel small.,1.140625,0.039581930317724,128,115,8,5,False,True,33
865,Someone stole the moon.,1.140495867768595,0.0358020751433272,121,106,13,2,False,True,23
865,Are there bones in the other Universes?,1.140495867768595,0.0376766457026153,121,107,11,3,True,True,39
865,"Yeah, I think I’ll pass on the ‘fetch’ thing…",1.140495867768595,0.0394622690456638,121,108,9,4,False,False,45
865,"It is just the earth casting a shadow on the moon, but you can bark at it anyway.",1.140495867768595,0.0358020751433272,121,106,13,2,False,True,81
865,And this is what is referred to as negative space,1.140495867768595,0.0338237717845969,121,105,15,1,False,False,49
865,Nothing I can say. Total Eclipse of the Bark,1.1403508771929824,0.0371245485372136,114,100,12,2,False,False,44
865,Maybe I have macular degeneration!,1.1403508771929824,0.0429418011902956,114,103,6,5,False,True,34
865,"They say it's a black hole, but all I see is tennis ball.",1.1401869158878504,0.0408182015052251,107,95,9,3,False,True,57
865,You sure it's just one squirrel in there?,1.1401273885350318,0.0292239975394047,157,136,20,1,True,True,41
865,"Oh, shit. You're in big, big trouble, my friend.",1.14,0.0314169477909793,150,131,17,2,False,True,48
865,"Of course I tried to eat it, but it's too far away.",1.14,0.0328102128477414,150,132,15,3,False,True,51
865,My owner told me that if I kept barking I'd be sorry.,1.14,0.0328102128477414,150,132,15,3,False,True,53
865,Looks like the hole in donut,1.14,0.0299589577570406,150,130,19,1,False,False,28
865,And that’s the story of Orion’s Slipper.,1.14,0.0341466766424943,150,133,13,4,False,True,40
865,...you'd think the hole would have been dog-shaped.,1.14,0.0328102128477414,150,132,15,3,False,True,51
865,Imagine sniffing butts with the dog that dug that black hole.,1.14,0.0354327670996783,150,134,11,5,False,True,61
865,How'll we howl now?,1.1398601398601398,0.0307517656798068,143,124,18,1,True,True,19
865,"You think we should, Herb?",1.1398601398601398,0.0307517656798068,143,124,18,1,True,True,26
865,"Hey, what happened to our 'dog star'?",1.1398601398601398,0.0307517656798068,143,124,18,1,True,True,37
865,I just don't see what the howling is all about.,1.1398601398601398,0.0338032129376013,143,126,14,3,False,True,47
865,"I know I’m supposed to say something trite about fearing the vacuum of space right now, but I’m just so overcome in awe at the sheer magnitude of the universe’s butthole and my desire to sniff the absolute crap out of it.",1.1397058823529411,0.0378806664802756,136,122,9,5,False,True,221
865,Al black hole is where your water dish goes.,1.1397058823529411,0.0348866732326629,136,120,13,3,False,True,44
865,Maybe we are color blind?,1.1397058823529411,0.0348866732326629,136,120,13,3,True,True,25
865,Are we allowed to bark at a lunar eclipse?,1.1397058823529411,0.0316103629446946,136,118,17,1,True,True,42
865,And we are alone in the Universe…,1.1397058823529411,0.0332888495951566,136,119,15,2,False,False,33
865,That's one powerful howl,1.1397058823529411,0.0348866732326629,136,120,13,3,False,False,24
865,Someone stole our ball.,1.1397058823529411,0.0378806664802756,136,122,9,5,False,True,23
865,Ctrl+Alt+Undog?,1.1397058823529411,0.0332888495951566,136,119,15,2,True,True,15
865,"It's called a black hole.  It kind of reminds me of Rusty.""",1.1397058823529411,0.0348866732326629,136,120,13,3,False,False,59
865,I guess we could just howl at each other.,1.1397058823529411,0.0332888495951566,136,119,15,2,False,True,41
865,If you did catch it you wouldn’t know what to do with it.,1.1397058823529411,0.0332888495951566,136,119,15,2,False,True,57
865,Maybe it'll come back if you stop barking.,1.1397058823529411,0.0348866732326629,136,120,13,3,False,True,42
865,Doggone it. She threw it too far again.,1.1397058823529411,0.0348866732326629,136,120,13,3,False,True,39
865,Siriusly?!?,1.1395348837209305,0.0343548408938679,129,113,14,2,True,True,11
865,And just like that.,1.1395348837209305,0.0343548408938679,129,113,14,2,False,True,19
865,I never know how to howl at a new moon.,1.1395348837209305,0.0325442938444702,129,112,16,1,False,True,39
865,"Nobody told me that if I howled at the moon, it would actually run away.",1.1395348837209305,0.0343548408938679,129,113,14,2,False,True,72
865,"Does a stellar black hole scare you, too?",1.1395348837209305,0.0360746326918338,129,114,12,3,True,True,41
865,Will it let all the air out?,1.1395348837209305,0.0343548408938679,129,113,14,2,True,True,28
865,"No, I don't see the red-ish star.",1.1395348837209305,0.0343548408938679,129,113,14,2,False,True,33
865,mmmm meatball,1.139344262295082,0.0355260728496578,122,107,13,2,False,False,13
865,That's the Trump Galaxy also known as Hopus Gonus.,1.139344262295082,0.0373842861240266,122,108,11,3,False,True,50
865,That's a sirius black hole!,1.139344262295082,0.0373842861240266,122,108,11,3,False,True,27
865,We weren't howling much anymore so I canceled our monthly subscription.,1.139344262295082,0.0355260728496578,122,107,13,2,False,True,71
865,I think it's the vacuum cleaner.,1.139344262295082,0.0335651434562003,122,106,15,1,False,True,32
865,Wormhole?,1.139240506329114,0.0304079527209334,158,138,18,2,True,True,9
865,Not a caption but to my old eyes I thought at first they were barking at it!,1.1391304347826088,0.0388369364276005,115,102,10,3,False,True,76
865,Nothing causes me to question my purpose like the unfetchable ball,1.1391304347826088,0.036820542225567,115,101,12,2,False,False,66
865,I swear I didn’t do anything!,1.1391304347826088,0.0425842486569262,115,104,6,5,False,True,29
865,‚Mice must have landed on the moon…’,1.1391304347826088,0.036820542225567,115,101,12,2,False,False,36
865,See if we can get our owner to check underneath the table.,1.1390728476821192,0.0312219641646572,151,132,17,2,False,True,58
865,Ghost diggers in the sky..,1.1390728476821192,0.0312219641646572,151,132,17,2,False,True,26
865,Is it a black ball or a black hole?,1.1390728476821192,0.0297743316557834,151,131,19,1,True,True,35
865,"Tell dish and spoon, there'll be no cow jumping tonight.",1.1388888888888888,0.0382607632488486,108,95,11,2,False,True,56
865,Woof woof?,1.1388888888888888,0.0321030403119683,144,126,16,2,True,True,10
865,I feel like howling here could come off as sarcastic,1.1388888888888888,0.0335816958237216,144,127,14,3,False,False,52
865,"Milo, do you think that black hole was created when you tore apart that Roomba who was R2D2 cousin ?",1.1388888888888888,0.0335816958237216,144,127,14,3,True,True,100
865,I hope he doesn't try to sniff us.,1.1388888888888888,0.0349979341036304,144,128,12,4,False,True,34
865,I bet the best bones are buried in there.,1.1388888888888888,0.0382607632488486,108,95,11,2,False,True,41
865,Just think...there may be planets where to dogs pick up the *humans* poop.,1.1388888888888888,0.0376710178489014,144,130,8,6,False,True,74
865,It’s eaten Canis Major!,1.1388888888888888,0.0349979341036304,144,128,12,4,False,True,23
865,I’ve been told a world with endless beef bones exists on the other side.,1.1388888888888888,0.0349979341036304,144,128,12,4,False,True,72
865,I just don’t feel like howling.,1.1388888888888888,0.0349979341036304,144,128,12,4,False,True,31
865,That hole is an electromagnetic zone where gravity is crazy strong.  All the dogs are talking about it.,1.1388888888888888,0.0335816958237216,144,127,14,3,False,True,103
865,Did he say “fetch”?,1.1388888888888888,0.0321030403119683,144,126,16,2,True,True,19
865,There's probably a cat on at least one of those dots up there. Keep barking,1.1386861313868613,0.0346461003647388,137,121,13,3,False,False,75
865,That hole in the sky is where dogs came from a millennium ago and landed here. And here we are. Have you had supper yet?,1.1386861313868613,0.0313953476899366,137,119,17,1,True,True,120
865,Nights like tonight I wonder what we're even howling about most the time.,1.1386861313868613,0.0346461003647388,137,121,13,3,False,True,73
865,Did that black hole swallow the moon?,1.1386861313868613,0.0361620585343165,137,122,11,4,True,True,37
865,Lost a lot of bones in that one.,1.1386861313868613,0.033060702707713,137,120,15,2,False,True,32
865,Look at the hole you dug us into!,1.1386861313868613,0.0376169733550575,137,123,9,5,False,True,33
865,Now we know where all those little baggies go.,1.1386861313868613,0.0361620585343165,137,122,11,4,False,True,46
865,"When it’s full and bright, we howl with reckless abandon. When it’s like this, we’re supposed to get reflect and contemplate quietly.",1.1386861313868613,0.0361620585343165,137,122,11,4,False,True,133
865,Shucks! I really wanted to howl tonight.,1.1386861313868613,0.0346461003647388,137,121,13,3,False,True,40
865,There’ll be no howling tonight!,1.1386861313868613,0.033060702707713,137,120,15,2,False,True,31
865,Wait…the event horizon has shifted,1.1384615384615384,0.0341064420928028,130,114,14,2,False,False,34
865,That's the largest black hole I've ever seen,1.1384615384615384,0.0341064420928028,130,114,14,2,False,False,44
865,My desire to howl at the moon has been eclipsed.,1.1384615384615384,0.0374402265081748,130,116,10,4,False,True,48
865,Looking at the stars again? You can't be Sirius...,1.1384615384615384,0.0358121484500243,130,115,12,3,True,True,50
865,"If the moon was made of cheese ,,
That must have been one big mouse !!",1.1384615384615384,0.0358121484500243,130,115,12,3,False,True,70
865,"Disapointing, but on the other hand, there is that hen house just next door.",1.1384615384615384,0.0374402265081748,130,116,10,4,False,True,76
865,"If it comes any closer, just sniff it and make friends.",1.1384615384615384,0.0341064420928028,130,114,14,2,False,True,55
865,Woof or maybe meow.,1.1384615384615384,0.0358121484500243,130,115,12,3,False,True,19
865,The bones we hid there will drive archeologists nuts!,1.1384615384615384,0.0358121484500243,130,115,12,3,False,True,53
865,"I’ll probably get blamed for digging that one, too.",1.1384615384615384,0.039000399297447,130,117,8,5,False,True,51
865,But where is his tail?,1.1384615384615384,0.0341064420928028,130,114,14,2,True,True,22
865,"Yeah, well, I tried and you can’t get close enough to sniff it.",1.1384615384615384,0.0341064420928028,130,114,14,2,False,True,63
865,Video Rodeo,1.1384615384615384,0.0341064420928028,130,114,14,2,False,False,11
865,Don't turn around. We're not supposed to know we're in a cartoon.,1.1384615384615384,0.0341064420928028,130,114,14,2,False,True,65
865,not tonight sweetie.,1.1384615384615384,0.0323108156482136,130,113,16,1,False,True,20
865,"It’s a mystery where they go, Junior. It’s like that bone we buried last summer.",1.1382113821138211,0.0352542662423857,123,108,13,2,False,True,80
865,Don't we usually hear clapping before the light goes out?,1.1382113821138211,0.03331040778742,123,107,15,1,True,True,57
865,I love howling at the rip in the spacetime continuum.,1.1382113821138211,0.0370964056158251,123,109,11,3,False,True,53
865,Where did all of our cheese go?,1.1382113821138211,0.03331040778742,123,107,15,1,True,True,31
865,Remember Einstein discussing it with us.,1.138157894736842,0.0337208907880122,152,135,13,4,False,True,40
865,Canis Major will chew anything.,1.137931034482759,0.0303565807959638,145,126,18,1,False,True,31
865,"There it is, the great toilet bowl in the sky.",1.137931034482759,0.0385193573178032,116,103,10,3,False,True,46
865,It's the cookie without the gnaw.,1.137931034482759,0.0303565807959638,145,126,18,1,False,True,33
865,"While I appreciate what the artist has done with negative space, it just doesn’t make me howl.",1.137931034482759,0.036120129568898,145,130,10,5,False,True,94
865,I buried a bone in a hole and I can't find it. Do you think it's in that one?,1.137931034482759,0.0365214437104468,116,102,12,2,True,True,77
865,OOOOOppenheimer!!,1.137931034482759,0.0318952573000266,145,127,16,2,False,True,17
865,and this my dear boy is the origin for why so many of us are named Spot.,1.137931034482759,0.0365214437104468,116,102,12,2,False,True,72
865,He threw our food bowl through the space-time continuum.,1.1376811594202898,0.0328356407981175,138,121,15,2,False,True,56
865,You really shouldn't be so negative!,1.1376811594202898,0.0328356407981175,138,121,15,2,False,True,36
865,Luke will know what to do.,1.1376811594202898,0.031183213173533,138,120,17,1,False,True,26
865,"I refuse to howl at a cheap knock off of Rothko's 
""Bark Side in Black.""",1.1376811594202898,0.0359131222844379,138,123,11,4,False,False,72
865,I suppose it could be a doggie door,1.1376811594202898,0.031183213173533,138,120,17,1,False,False,35
865,It'll appear after the trigger warning.,1.1376811594202898,0.031183213173533,138,120,17,1,False,True,39
865,That's what all your hailing at the Moon did!,1.1376811594202898,0.0344088045334329,138,122,13,3,False,True,45
865,It's the Great Dog Bowl constellation,1.1376811594202898,0.0373569120112194,138,124,9,5,False,False,37
865,That’s a serious ‘No Fetch’ zone.,1.1376811594202898,0.0328356407981175,138,121,15,2,False,True,33
865,Wow! Just plain wow.,1.1376811594202898,0.0294381769311384,138,119,19,0,False,True,20
865,"So many stars,not enough teeth",1.1375,0.028713916377093,160,139,20,1,False,False,30
865,"I don't know about you, but I'm not sniffing it.",1.1374045801526718,0.0338615862060624,131,115,14,2,False,True,48
865,It’s been awhile – I don’t think it’s a ball.,1.1374045801526718,0.0355534362964664,131,116,12,3,False,True,45
865,You got a bone?,1.1374045801526718,0.0371683554194048,131,117,10,4,True,True,15
865,"Starlight star bright first star I see tonight, I wish I may I wish .. Squirrel !",1.1374045801526718,0.0320806360331945,131,114,16,1,False,True,81
865,So the Great Sky Dog has turned its back on our world.,1.1374045801526718,0.0320806360331945,131,114,16,1,False,True,54
865,Farewell to the tennis ball in the sky,1.1374045801526718,0.0338615862060624,131,115,14,2,False,False,38
865,Imagine how tough it would  be to fit all that ‘ dark matter ‘ into one of those plastic bags!,1.1374045801526718,0.0320806360331945,131,114,16,1,False,True,94
865,Imagine the bone we could bury in there!,1.1374045801526718,0.0338615862060624,131,115,14,2,False,True,40
865,Elon Musk missed a spot.,1.1374045801526718,0.0371683554194048,131,117,10,4,False,True,24
865,Not even tennis balls can be retrieved from there.,1.1372549019607845,0.0308391182610607,153,134,17,2,False,True,50
865,Howling will be a problem now that the moon has been sucked into black hole.,1.1370967741935485,0.0368129026374894,124,110,11,3,False,True,76
865,Where did the moon go?,1.1370967741935485,0.0385528227780895,124,111,9,4,True,True,22
865,How many bones do you think are buried in there?,1.1370967741935485,0.0385528227780895,124,111,9,4,True,True,48
865,This could mean that pretty soon we'll be responsible for finding our own food.,1.1370967741935485,0.0349865610918789,124,109,13,2,False,True,79
865,Wouldn't you know it? A cat lifts its tail and you're looking at the universe.,1.1370967741935485,0.0349865610918789,124,109,13,2,True,True,78
865,We are doggoners now!,1.1370967741935485,0.0368129026374894,124,110,11,3,False,True,21
865,"Now, slow your howling as we fade to black.",1.1369863013698631,0.0331472103177187,146,129,14,3,False,True,43
865,"Pretty, but that hoop just sucks you in.",1.1369863013698631,0.0285537671416294,146,126,20,0,False,True,40
865,Looks like the Moon forgot to pay its electric bill.,1.1367521367521367,0.036227135956387,117,103,12,2,False,True,52
865,I think we should jump and see what's on the other side.,1.1367521367521367,0.0382069050818079,117,104,10,3,False,True,56
865,You did that by lifting your leg and ... !,1.1367521367521367,0.0319011120017325,117,101,16,0,False,True,42
865,It's called the Kibble Void.,1.1366906474820144,0.0341747196588335,139,123,13,3,False,True,28
865,Howl? No!,1.1366906474820144,0.0326136022114171,139,122,15,2,True,True,9
865,"bummer,I wanted to dance by the light of the moon",1.1366906474820144,0.0309739024769117,139,121,17,1,False,False,49
865,There’s one hole we won’t be blamed for chewing!,1.1366906474820144,0.0356675746065691,139,124,11,4,False,True,48
865,I think that it where they place the big food dish in the sky.,1.1366906474820144,0.0341747196588335,139,123,13,3,False,True,62
865,Did you know that sugar-free dog treats can give you glaucoma?,1.1366906474820144,0.0341747196588335,139,123,13,3,True,True,62
865,That’s where some lower life forms lived until they destroyed it. Our ancestors tried to train them but they didn’t learn.,1.1366906474820144,0.0341747196588335,139,123,13,3,False,True,122
865,Did your howling do that?,1.1366906474820144,0.0341747196588335,139,123,13,3,True,True,25
865,Look. All lights are off. I am glad that we moved to Mars.,1.1366906474820144,0.0356675746065691,139,124,11,4,False,True,58
865,Howling at the hole is just not the same.,1.1363636363636365,0.0320058852842081,154,136,15,3,False,True,41
865,"I guess this means,no more slingshot contests.",1.1363636363636365,0.0352984159945482,132,117,12,3,False,True,46
865,I wonder who dug that black hole?,1.1363636363636365,0.0336201985526595,132,116,14,2,True,True,33
865,"Just think, someone fetched that ball a billion years ago…",1.1363636363636365,0.0397600658984068,110,98,9,3,False,False,58
865,So that’s where that bone went.,1.1363636363636365,0.0352984159945482,132,117,12,3,False,True,31
865,The dark side of the moon.,1.1363636363636365,0.0336201985526595,132,116,14,2,False,True,26
865,"OK, so it's a hole, and it's black...so what?",1.1363636363636365,0.0399118959050554,132,120,6,6,True,True,45
865,You suppose it was a cyst?,1.1363636363636365,0.0369003874333063,132,118,10,4,True,True,26
865,Is this is a cruel trick by Elon Musk?,1.1363636363636365,0.0352984159945482,132,117,12,3,True,True,38
865,Damn squirrel; he’ll eat anything.,1.1363636363636365,0.0369003874333063,132,118,10,4,False,True,34
865,Should I start to bark at it?,1.1363636363636365,0.0318536862814386,132,115,16,1,True,True,29
865,"Sorry, I only see kibble.",1.1360544217687074,0.0314876036098869,147,129,16,2,False,True,25
865,Have you ever wondered WHY we sniff each other’s butts?,1.1360544217687074,0.0343197479787435,147,131,12,4,True,True,55
865,So that is what a black hole looks like!,1.136,0.0347228659438537,125,110,13,2,False,True,40
865,"Huh, so that’s what’s behind the moon",1.136,0.0347228659438537,125,110,13,2,False,False,37
865,No Asta. That's not where you buried your bone.,1.136,0.036533678673511,125,111,11,3,False,True,47
865,Well I'll be damned Joe.  Look what we've done now!,1.136,0.0328122715045807,125,109,15,1,False,True,51
865,It looks like a ball to me.,1.136,0.0328122715045807,125,109,15,1,False,True,27
865,"All dogs go to heaven. Look, there's Spot!",1.136,0.0347228659438537,125,110,13,2,False,True,42
865,that black hole looks inviting,1.136,0.0328122715045807,125,109,15,1,False,False,30
865,You can go for this one.,1.136,0.0328122715045807,125,109,15,1,False,True,24
865,This is Sirius business.,1.136,0.036533678673511,125,111,11,3,False,True,24
865,"Really makes ya think, eh Skippy",1.136,0.0399095752113247,125,113,7,5,False,False,32
865,Wouldn’t that be a great hole to hide bones?,1.135922330097087,0.0391430761330858,103,91,10,2,True,True,44
865,"To a dog, this doesn't mean anything.",1.1357142857142857,0.0323945269090359,140,123,15,2,False,True,37
865,"For some strange reason I don't feel like howling.""",1.1357142857142857,0.0339437814124923,140,124,13,3,False,False,51
865,"Remember that old doggie story about the big picnic and everyone brought something, except the guy with black pepper never showed up? I think I know why.",1.1357142857142857,0.0420574587212769,140,130,1,9,True,True,153
865,Weird. Is it a bark hole?,1.1357142857142857,0.0339437814124923,140,124,13,3,True,True,25
865,We howled too much and killed the moon.,1.1357142857142857,0.0323945269090359,140,123,15,2,False,True,39
865,It's a dog dish moon.,1.1357142857142857,0.0354253471330609,140,125,11,4,False,True,21
865,"You called it, Sparky, but how you gonna sniff the butt of the universe?",1.1355932203389831,0.0338620695799104,118,103,14,1,True,True,72
865,The ancient Greeks thought that look like a ball,1.1355932203389831,0.0397647257147253,118,106,8,4,False,False,48
865,My human says it's a gravitational black hole but I think it's just a black tennis ball.,1.1355932203389831,0.0378994572457591,118,105,10,3,False,True,88
865,"It may be a hole in the universe to some, but for us it is a serious loss of something to howl at.",1.1355932203389831,0.03593750558788,118,104,12,2,False,True,98
865,It heard that the big dipper is full of kibble. It'll be back when it's full.,1.1355932203389831,0.03593750558788,118,104,12,2,False,True,77
865,"Bill,I don’t think they’re coming back.",1.1355932203389831,0.03593750558788,118,104,12,2,False,True,39
865,I don’t know why I can’t catch it.  I just can’t.,1.1355932203389831,0.03593750558788,118,104,12,2,False,True,49
865,I call it the food bowl and imagine that it’s filled with bacon.,1.1355932203389831,0.03593750558788,118,104,12,2,False,True,64
865,Do they ever bark back?,1.135483870967742,0.0318108930430961,155,137,15,3,True,True,23
865,We can start howling again when the lunar eclipse is over!,1.1353383458646618,0.0333822065166191,133,117,14,2,False,True,58
865,His name is Trump.,1.1353383458646618,0.0350470095510437,133,118,12,3,False,True,18
865,You first !,1.1353383458646618,0.0333822065166191,133,117,14,2,False,True,11
865,Our Creator dug that hole.,1.1353383458646618,0.0316298995471921,133,116,16,1,False,True,26
865,I thought we'd see Orion...,1.1353383458646618,0.0297746432188988,133,115,18,0,False,True,27
865,Maybe we need to stop barking?,1.1353383458646618,0.0350470095510437,133,118,12,3,True,True,30
865,I think I know who's behind this?,1.1353383458646618,0.0316298995471921,133,116,16,1,True,True,33
865,Whoa. Someone got a scary horoscope today.,1.1353383458646618,0.0366362395043991,133,119,10,4,False,True,42
865,I’m told that’s where all the lost bones go to.,1.1353383458646618,0.0366362395043991,133,119,10,4,False,True,47
865,Maybe we dug it too deep?,1.1353383458646618,0.0350470095510437,133,118,12,3,True,True,25
865,Laika said it smelled pretty good.,1.1353383458646618,0.0297746432188988,133,115,18,0,False,True,34
865,They say beings called “Earthlings” used to inhabit that planet!,1.1353383458646618,0.0316298995471921,133,116,16,1,False,True,64
865,It's a full black hole on a dog star night.,1.1353383458646618,0.0366362395043991,133,119,10,4,False,True,43
865,Sniff...sniff...,1.135135135135135,0.0312876339282965,148,130,16,2,False,True,16
865,When do we bark?,1.135135135135135,0.0312876339282965,148,130,16,2,True,True,16
865,"It is that time of the month for me to howl but I'm just not in the mood,",1.135135135135135,0.0297823332442886,148,129,18,1,False,False,73
865,Couldn't Van Morrison sing about a Sundance instead?,1.1349206349206349,0.0325687056010844,126,110,15,1,True,True,52
865,It makes people seem insignificant.,1.1349206349206349,0.0396062759227198,126,114,7,5,False,True,35
865,Sirius must have had a BIG pee.,1.1349206349206349,0.0325687056010844,126,110,15,1,False,True,31
865,I don’t know but I’m sure it’s nothing to worry about.,1.1349206349206349,0.0362586381224993,126,112,11,3,False,True,54
865,"Moonco Inc shut down & locked em out, said they howled too much",1.1349206349206349,0.0344630920190605,126,111,13,2,False,False,63
865,"No, we only howl at a full moon, not a new moon.",1.1349206349206349,0.0362586381224993,126,112,11,3,False,True,48
865,I'd love to pee on that one day...,1.1349206349206349,0.0325687056010844,126,110,15,1,False,True,34
865,"That's a black hole, son.",1.1349206349206349,0.0379693687790894,126,113,9,4,False,True,25
865,I barked and it disappeared.,1.1349206349206349,0.0305571015894175,126,109,17,0,False,True,28
865,"An eclipse, or the black hole where all the best bones are buried and lost?",1.1347517730496457,0.033715927160297,141,125,13,3,True,True,75
865,Tell me again about that glaucoma medication?,1.1347517730496457,0.0321783564167708,141,124,15,2,True,True,45
865,Are we supposed to jump through that ?,1.1347517730496457,0.033715927160297,141,125,13,3,True,True,38
865,I miss howling.,1.1347517730496457,0.0321783564167708,141,124,15,2,False,True,15
865,I didn't know whether to bark or howl.,1.1347517730496457,0.0288584888117396,141,122,19,0,False,True,38
