contest,caption,mean,precision,votes,not_funny,somewhat_funny,funny,has_question_mark,ends_with_punctuation,caption_length
821,He flew through Turkey…,1.1704545454545454,0.0490814021910268,88,76,9,3,False,False,23
821,I don't think it is just a comb-over.,1.1704545454545454,0.0434340649874026,88,74,13,1,False,True,37
821,It really reminds you of when you were young ... really?,1.1704545454545454,0.0463438347699413,88,75,11,2,True,True,56
821,Joke’s on him. He’s now in every political ad as the symbol of government excess.,1.1704545454545454,0.0490814021910268,88,76,9,3,False,True,81
821,"You be the judge. 
(Your offer fits the picture)",1.1704545454545454,0.0434340649874026,88,74,13,1,False,False,48
821,I still think Christmas Wishbone is creepy.,1.1704545454545454,0.0463438347699413,88,75,11,2,False,True,43
821,I’ve heard he’s dying his feathers orange next.,1.1704545454545454,0.0403148233467071,88,73,15,0,False,True,47
821,Where's he going to get it cleaned?,1.1704545454545454,0.0490814021910268,88,76,9,3,True,True,35
821,"He doesn’t use his real name, either.",1.1704545454545454,0.0463438347699413,88,75,11,2,False,True,37
821,I think she’d look good in a beret.,1.1704545454545454,0.0403148233467071,88,73,15,0,False,True,35
821,"Next thing you know, he’ll want a hat to keep it dry.",1.1704545454545454,0.0403148233467071,88,73,15,0,False,True,53
821,The King has flew the nest.,1.1704545454545454,0.0403148233467071,88,73,15,0,False,True,27
821,"See, I told you he wasn’t dead.",1.1704545454545454,0.0463438347699413,88,75,11,2,False,True,31
821,The hair plugs make him look like Elvis!,1.1702127659574468,0.0469580191711663,94,81,10,3,False,True,40
821,From bald eagle to rock-a-doodle hair do…,1.1702127659574468,0.0418030425408161,94,79,14,1,False,False,41
821,The pallid orange color on the combover clashes with everything.,1.1702127659574468,0.0469580191711663,94,81,10,3,False,True,64
821,Does she really think no one can tell?,1.1702127659574468,0.0493339250808689,94,82,8,4,True,True,38
821,Elvis Birdly? Never thought I'd see him in person!,1.1702127659574468,0.0493339250808689,94,82,8,4,True,True,50
821,"He keeps tweeting 'Birds of a feather flock together', but don't be fooled--we are more than just feathers!",1.1702127659574468,0.0418030425408161,94,79,14,1,False,True,107
821,You should hear his rendition of Mystery Train.,1.1702127659574468,0.0444553142500922,94,80,12,2,False,True,47
821,I hear he's been looking into Scientology.,1.1702127659574468,0.0444553142500922,94,80,12,2,False,True,42
821,Must have flown too close to that Maple St. roof being tarred.,1.1702127659574468,0.0444553142500922,94,80,12,2,False,True,62
821,He just saw the new Elvis movie.,1.1702127659574468,0.0469580191711663,94,81,10,3,False,True,32
821,He wants to know the weather ahead as we go south.,1.1702127659574468,0.0444553142500922,94,80,12,2,False,True,50
821,You should hear his Elvis impression,1.1702127659574468,0.0444553142500922,94,80,12,2,False,False,36
821,He’s making his hair great again,1.1702127659574468,0.0444553142500922,94,80,12,2,False,False,32
821,He got the makeover because he wants to run for president.,1.1702127659574468,0.0418030425408161,94,79,14,1,False,True,58
821,Still think Elvis is dead?,1.17,0.0403394686042432,100,84,15,1,True,True,26
821,He’s an Elvis impersonator,1.17,0.0450700913168936,100,86,11,3,False,False,26
821,He's always wanted to impersonate Elvis.,1.17,0.0403394686042432,100,84,15,1,False,True,40
821,Worst Elvis rug I've ever seen!,1.17,0.0427702341505506,100,85,13,2,False,True,31
821,He thinks it makes him look like a spring chicken.,1.17,0.0450700913168936,100,86,11,3,False,True,50
821,Snowbird.,1.17,0.0427702341505506,100,85,13,2,False,True,9
821,Just wait until you hear him sing 'On the Wings of a Dove' .,1.17,0.0403394686042432,100,84,15,1,False,True,60
821,Don't bother.  He will just tell us to ask Mom,1.17,0.0427702341505506,100,85,13,2,False,False,46
821,Who's that hanging out on Milo's perch?,1.17,0.0450700913168936,100,86,11,3,True,True,39
821,"It looks so good on nature documentaries, I’ve been thinking of getting one, too.",1.169811320754717,0.0366418231115179,106,88,18,0,False,True,81
821,Stupid MF just made it so it's legal to shoot his ass,1.169811320754717,0.0412554510285621,106,90,14,2,False,False,53
821,It's that time of year again.,1.169811320754717,0.0433786440415932,106,91,12,3,False,True,29
821,His wife left him last week.,1.169811320754717,0.0433786440415932,106,91,12,3,False,True,28
821,"He's had an obsession with Elvis ever since he was hatched. Steve Weiss, Chicago.",1.1690140845070425,0.0530210674993983,71,61,8,2,False,True,81
821,He keeps insisting he’s a very stable genius.,1.1690140845070425,0.0490797220026175,71,60,10,1,False,True,45
821,He thinks it makes the country look younger.,1.1688311688311688,0.0502984850156807,77,66,9,2,False,True,44
821,I heard that headpiece cost him over twenty half-rotten fish!,1.1688311688311688,0.0429698800970655,77,64,13,0,False,True,61
821,Haven’t seen a comb over like that since the last President.,1.1688311688311688,0.0502984850156807,77,66,9,2,False,True,60
821,Do you think George knows it looks like a toupee?,1.1688311688311688,0.0429698800970655,77,64,13,0,True,True,49
821,"He's fine now, but wait till he swoops in on a field mouse.",1.1688311688311688,0.0502984850156807,77,66,9,2,False,True,59
821,Why am I still so uncomfortable with species fluidity?,1.1688311688311688,0.0502984850156807,77,66,9,2,True,True,54
821,He swears it was Made in America,1.1688311688311688,0.0566874288902675,77,68,5,4,False,False,32
821,"I don't know, but I can feel it in my cloaca.",1.1688311688311688,0.0566874288902675,77,68,5,4,False,True,45
821,"I told Grandpa we wanted ""Heron"" for dinner.",1.1688311688311688,0.0502984850156807,77,66,9,2,False,True,44
821,Thats a little out there,1.1686746987951808,0.0447649593913974,83,70,12,1,False,False,24
821,He was always self-conscious.,1.1686746987951808,0.0509079395561651,83,72,8,3,False,True,29
821,"Frankly, he looks more like a doodle than a dandy.",1.1686746987951808,0.0509079395561651,83,72,8,3,False,True,50
821,He looks like foie gras dressed as chicken.,1.1686746987951808,0.0447649593913974,83,70,12,1,False,True,43
821,Elvis Eagle is in the house.,1.1686746987951808,0.0447649593913974,83,70,12,1,False,True,28
821,I’ll give you a pizza crust to knock it off with your wings,1.1686746987951808,0.0509079395561651,83,72,8,3,False,False,59
821,SHALL WE APPROACH THE RARE ELVIS BIRD?,1.1686746987951808,0.0479349554040036,83,71,10,2,True,True,38
821,Me when I talk to a bird about another bird that looks like Elvis Presley:,1.1686746987951808,0.0479349554040036,83,71,10,2,False,False,74
821,Somebody oughta call Larry David about this guy.,1.1686746987951808,0.0479349554040036,83,71,10,2,False,True,48
821,He plays piano.,1.1686746987951808,0.0479349554040036,83,71,10,2,False,True,15
821,Why does Tim always look so good?,1.1686746987951808,0.0509079395561651,83,72,8,3,True,True,33
821,I’m afraid to go near him.,1.1686746987951808,0.0537166330862658,83,73,6,4,False,True,26
821,He’s been hanging around Graceland.,1.1686746987951808,0.0509079395561651,83,72,8,3,False,True,35
821,"Bald Eagle,” it is in the name! Who does he think he is fooling",1.1686746987951808,0.0509079395561651,83,72,8,3,False,False,63
821,"Let him preen while he can, he's young",1.1685393258426966,0.0399052601749081,89,74,15,0,False,False,38
821,"He's campaigning to get us rebranded as ""King"" eagles.",1.1685393258426966,0.0458601681140994,89,76,11,2,False,True,54
821,We're mocking birds. He's mocking Elvis.,1.1685393258426966,0.0458601681140994,89,76,11,2,False,True,40
821,"Yeah, don't worry. It's my fault. I suggested that he lose the comb-over.",1.1685393258426966,0.042985955898878,89,75,13,1,False,True,73
821,Bloody Trump supporters - the Bald-Headed Eagle's not even good enough these days!,1.1685393258426966,0.0535653140025613,89,79,5,5,False,True,82
821,Dave's rogaine treatment is really paying off,1.1685393258426966,0.0458601681140994,89,76,11,2,False,False,45
821,"ever seen him perform? he’s got this thing, where he sort of thrusts and gyrates his cloaca? i gotta admit, i love how it makes me feel in my cloaca",1.1685393258426966,0.042985955898878,89,75,13,1,True,False,148
821,So now we've got an Elvis impersonator.,1.1685393258426966,0.0458601681140994,89,76,11,2,False,True,39
821,I can't resist.  Give me a bad boy any day!,1.1685393258426966,0.0399052601749081,89,74,15,0,False,True,43
821,Okay Mom he isn't much today but he has potential.,1.1685393258426966,0.042985955898878,89,75,13,1,False,True,50
821,Should someone tell him that his toupee is for toucans?,1.1685393258426966,0.042985955898878,89,75,13,1,True,True,55
821,I think it makes him look cuckoo.,1.1685393258426966,0.0511261210075614,89,78,7,4,False,True,33
821,His migratory route is over Vegas and he has adapted.,1.1685393258426966,0.042985955898878,89,75,13,1,False,True,53
821,So much for the National Emblem!,1.1685393258426966,0.0458601681140994,89,76,11,2,False,True,32
821,How do we top that?,1.1685393258426966,0.0458601681140994,89,76,11,2,True,True,19
821,"Sure, I get the insecurities that come with being labeled as bald, but Ned just looks plain ridiculous with a toupee not made from feathers.",1.168421052631579,0.0464956296732457,95,82,10,3,False,True,140
821,"-""Crawbird"" was a real hit, but ""Hound Owl"" don't do much for me",1.168421052631579,0.0385998844753603,95,79,16,0,False,False,64
821,Talk about denial!,1.168421052631579,0.0413994595042573,95,80,14,1,False,True,18
821,"Eagle, Smeagle, I liked him better when he was bald.",1.168421052631579,0.0413994595042573,95,80,14,1,False,True,52
821,"I can live with the hair piece, it’s the sports car I really wish he’d get rid of.",1.168421052631579,0.0440213517849932,95,81,12,2,False,True,82
821,Have you heard his version of 'Hound Dog?',1.168421052631579,0.0464956296732457,95,82,10,3,True,False,42
821,I did not know Elvis wore a rug.,1.168421052631579,0.0413994595042573,95,80,14,1,False,True,32
821,Hunter - - - we have another buyer. Chinese of course. Would $500.000 be acceptable?,1.168421052631579,0.0440213517849932,95,81,12,2,True,True,84
821,He's never been the same since he lost Adaline. He still looks for her every day.,1.168421052631579,0.0413994595042573,95,80,14,1,False,True,81
821,He just went through a breakup.,1.1683168316831682,0.0423780882357083,101,86,13,2,False,True,31
821,He’s always parroting the latest trend.,1.1683168316831682,0.0446533555793255,101,87,11,3,False,True,39
821,"I've seen bad toupees before, but seriously.....",1.1666666666666667,0.0442287410361896,72,60,12,0,False,True,48
821,He hates people calling him a bald eagle.,1.1666666666666667,0.0453863976719122,90,77,11,2,False,True,41
821,It's the new look for fall.,1.1666666666666667,0.042546882418053,90,76,13,1,False,True,27
821,He's flying for president.,1.1666666666666667,0.0453863976719122,90,77,11,2,False,True,26
821,He is trying to disguise the fact that he is only 'partially bald',1.1666666666666667,0.0435956969817163,96,82,12,2,False,False,66
821,"What do you call a bad eagle with a bad toupee?
Cuckoo!",1.1666666666666667,0.0442743925959454,84,71,12,1,True,True,55
821,"It may be tacky, but there's no law against species appropriation.",1.1666666666666667,0.0474034130879283,84,72,10,2,False,True,66
821,What do you think?  Rogaine or implants?,1.1666666666666667,0.0435956969817163,96,82,12,2,True,True,40
821,No one will ever notice.,1.1666666666666667,0.0435956969817163,96,82,12,2,False,True,24
821,It gets worse.  Wait’ll he starts singing.,1.1666666666666667,0.0453863976719122,90,77,11,2,False,True,42
821,Carl loves Baz Lurhmann films.,1.1666666666666667,0.0396140704108561,102,86,15,1,False,True,30
821,"It looks like and elk toupee, right?",1.1666666666666667,0.0405483357490538,108,92,14,2,True,True,36
821,He never could get used to being bald.,1.1666666666666667,0.0462250163521024,78,66,11,1,False,True,38
821,I'm pretty sure it's fake. I wonder where I could get one.,1.1666666666666667,0.0503383085237241,84,73,8,3,False,True,58
821,Hairy eagle just doesn't sound right!,1.1666666666666667,0.0496966042074553,78,67,9,2,False,True,37
821,He prefers being a threatened species.,1.1666666666666667,0.0410034943597201,96,81,14,1,False,True,38
821,It's from Wigs Are Us!,1.1666666666666667,0.0460421876210901,96,83,10,3,False,True,22
821,His one regret - they don't make blue suede shoes in eagle size!,1.1666666666666667,0.0474034130879283,84,72,10,2,False,True,64
821,He should face reality - a bald eagle is BALD!,1.1666666666666667,0.0442441939246956,102,88,11,3,False,True,46
821,Ugh ... He thinks he's Elvis,1.1666666666666667,0.0453863976719122,90,77,11,2,False,False,28
821,We thought he'd left the building...?,1.1666666666666667,0.0462250163521024,78,66,11,1,True,True,37
821,Marketing is pushing an update.,1.1666666666666667,0.0460421876210901,96,83,10,3,False,True,31
821,I don't know. I kinda respect him for fighting the stereotype.,1.1666666666666667,0.0462250163521024,78,66,11,1,False,True,62
821,It would be different if he had it before.,1.1666666666666667,0.0496966042074553,78,67,9,2,False,True,42
821,"I know it's fake, but when he shakes his talons, I get all broody.",1.1666666666666667,0.042546882418053,90,76,13,1,False,True,66
821,He thinks it will keep him from becoming extinct.,1.1666666666666667,0.0460421876210901,96,83,10,3,False,True,49
821,Why's he wearing a rodent on his head?,1.1666666666666667,0.0409067244728179,84,70,14,0,True,True,38
821,"‘I’m telling you it’s a toupee, that’s a bald eagle’",1.1666666666666667,0.0460421876210901,96,83,10,3,False,False,52
821,"He thinks that if ""looks the part"" he, too, can become President of the United States.  That's his Trumpeagle look!",1.1666666666666667,0.0474034130879283,84,72,10,2,False,True,115
821,"He thinks he sings like Elvis, too.",1.1666666666666667,0.0424705992864687,78,65,13,0,False,True,35
821,"He is staying in character for his role in ""Grease"".",1.1666666666666667,0.0462250163521024,78,66,11,1,False,True,52
821,It doesn’t take a hawk to spot that rug,1.1666666666666667,0.052941031372205,78,68,7,3,False,False,39
821,I bet it's a perm.,1.1666666666666667,0.0383548858098911,108,91,16,1,False,True,18
821,You think he'll fly the toupe?,1.1666666666666667,0.0370828466241653,102,85,17,0,True,True,30
821,I think that hairdo is for the birds.,1.1666666666666667,0.0435956969817163,96,82,12,2,False,True,37
821,He thinks he's a bald eagle.,1.1666666666666667,0.0442743925959454,84,71,12,1,False,True,28
821,The comb over just did not work.,1.1666666666666667,0.0409067244728179,84,70,14,0,False,True,32
821,Has she heard of fly away hair?,1.1666666666666667,0.039503788594998,90,75,15,0,True,True,31
821,"No, this is where eagles cruise.",1.1666666666666667,0.0531112703451396,84,74,6,4,False,True,32
821,What a piece,1.1666666666666667,0.0426290722224423,108,93,12,3,False,False,12
821,He said that the chicks no longer go for bald eagles.,1.1666666666666667,0.0409067244728179,84,70,14,0,False,True,53
821,"Ever since he was cuckolded, it's been one mid-life crisis after another with him.",1.1666666666666667,0.0410034943597201,96,81,14,1,False,True,82
821,Just back from Vegas.,1.1666666666666667,0.042546882418053,90,76,13,1,False,True,21
821,"He hates our name, but does his Oscar Wilde look have to include the foliage?",1.1666666666666667,0.0480584330140953,90,78,9,3,True,True,77
821,He thinks he has a new leaf on life.,1.1666666666666667,0.0462250163521024,78,66,11,1,False,True,36
821,He’s not only a client he’s also the president!,1.1666666666666667,0.0480584330140953,90,78,9,3,False,True,47
821,I know. He needs a haircut. But it's the style now.,1.1650485436893203,0.0392609417299765,103,87,15,1,False,True,51
821,That do is for the birds.”,1.1650485436893203,0.0367566883223319,103,86,17,0,False,False,26
821,I think he's wigged out with this 'Bird of Paradise' thing.,1.1649484536082475,0.0455974381777168,97,84,10,3,False,True,59
821,The comb over and dye job just isn’t  cutting it.,1.1649484536082475,0.0406149369538584,97,82,14,1,False,True,49
821,What do you think about his toupee?,1.1649484536082475,0.0431781164025053,97,83,12,2,True,True,35
821,I tried to tell him chicks don't dig it.,1.1649484536082475,0.0406149369538584,97,82,14,1,False,True,40
821,Who does he think he is Elvis Osprey?,1.1649484536082475,0.0406149369538584,97,82,14,1,True,True,37
821,Squalk!,1.164835164835165,0.0449222262762077,91,78,11,2,False,True,7
821,Looks like Thomas didn’t get the memo.,1.164835164835165,0.0449222262762077,91,78,11,2,False,True,38
821,"So I say, 'he who has secrets also has vulnerabilities.'",1.164835164835165,0.042116578320307,91,77,13,1,False,False,56
821,"I don't care what he says, I'm not calling him Elvis.",1.164835164835165,0.0391101767473673,91,76,15,0,False,True,53
821,"Ever since he saw ""Elvis!""",1.164835164835165,0.0449222262762077,91,78,11,2,False,False,26
821,I don't know if I should call it a hairpiece.,1.164835164835165,0.0449222262762077,91,78,11,2,False,True,45
821,"Yes, it's a toupee. Evidently, he doesn't know that 'bald' is from the Old English word, 'balde, meaning 'white,' as in white feathers.",1.164835164835165,0.050064028024234,91,80,7,4,False,True,135
821,What's not obvious is that they're non-binary and non-available.,1.164835164835165,0.0475626603315147,91,79,9,3,False,True,64
821,They’ll never believe we saw Elvis!,1.164835164835165,0.050064028024234,91,80,7,4,False,True,35
821,He really enjoyed that Elvis movie,1.164835164835165,0.042116578320307,91,77,13,1,False,False,34
821,"Elvis the Pelvis knows how to shake, rattle, and roll you in the bushes!",1.1647058823529413,0.0468834266331438,85,73,10,2,False,True,72
821,No comment,1.1647058823529413,0.0468834266331438,85,73,10,2,False,False,10
821,They say he’s the 3rd best Elvis impersonator in Washington state.,1.1647058823529413,0.0437943335152785,85,72,12,1,False,True,66
821,"Elvis has not left the building, but he may fly the coop.",1.1647058823529413,0.0437943335152785,85,72,12,1,False,True,57
821,"The chicks aren't buying his crow-over.""",1.1647058823529413,0.0437943335152785,85,72,12,1,False,False,40
821,It' a toupé. It covers up bald spots caused by stress-induced hair loss.,1.1647058823529413,0.0497811986364662,85,74,8,3,False,True,72
821,He thinks he's Donald Trump..,1.1647058823529413,0.0525193277042008,85,75,6,4,False,True,29
821,But we’re bald eagles!  The rug’s a sacrilege!,1.1647058823529413,0.0468834266331438,85,73,10,2,False,True,46
821,Even his pullet has a mullet.,1.1647058823529413,0.0437943335152785,85,72,12,1,False,True,29
821,Some eagles don't take being called bald very well.,1.1645569620253164,0.049108837742764,79,68,9,2,False,True,51
821,Dapper duck my ass,1.1645569620253164,0.049108837742764,79,68,9,2,False,False,18
821,"He’s an endangered species of Elvis impersonators, if you ask me.",1.1645569620253164,0.049108837742764,79,68,9,2,False,True,65
821,He's next to play Elvis,1.1645569620253164,0.0419825922829797,79,66,13,0,False,False,23
821,"Oh, I think it’s just a phase. Though I’ve heard it’s trendy lately for teenagers to rebel against their own species.",1.1645569620253164,0.0456848771435583,79,67,11,1,False,True,117
821,"I told him very clearly ""Don't bet on the Giants"".",1.1645569620253164,0.0456848771435583,79,67,11,1,False,True,50
821,Presidential hopes? Might as well start denying the results right now.,1.1645569620253164,0.0523091568395843,79,69,7,3,True,True,70
821,"First the guy dates the hot young chick, now the rug.  Get over it Leonard I says,you’re a bald eagle in mid life crisis.",1.1645569620253164,0.0456848771435583,79,67,11,1,False,True,121
821,"Just what we need, another Elvis impersonator!",1.1645569620253164,0.0523091568395843,79,69,7,3,False,True,46
821,He can channel Bryce Harper all he wants.  The Phillies ain't making the playoffs.  Eagles are the only game in town.,1.1645569620253164,0.0456848771435583,79,67,11,1,False,True,117
821,Show some respect. Let him have this.,1.1645569620253164,0.0456848771435583,79,67,11,1,False,True,37
821,"He's not fooling anyone, we all know he's molting.",1.1643835616438356,0.0552209434814969,73,64,6,3,False,True,50
821,Do you think it's a toupee?,1.1643835616438356,0.0516607694017568,73,63,8,2,True,True,27
821,Does it fly off if he flies off?,1.1643835616438356,0.0478363626478469,73,62,10,1,True,True,32
821,"Since the NRA Trumpists have never shot at him, he thought he'd give it a try.",1.1637931034482758,0.0440525199657016,116,102,9,5,False,True,78
821,He refuses to be called bald.,1.1634615384615383,0.0412432286136088,104,89,13,2,False,True,29
821,No one is ever going to buy that he is a Crowned Eagle.,1.1634615384615383,0.0364361209749636,104,87,17,0,False,True,55
821,He opens at the Hotel California.,1.163265306122449,0.0451611359849898,98,85,10,3,False,True,33
821,"Stop staring, it's a wig!",1.163265306122449,0.0427683851428825,98,84,12,2,False,True,25
821,He thinks we can't tell,1.163265306122449,0.0402335846278346,98,83,14,1,False,False,23
821,I told you socialism was worse than it seemed.,1.163265306122449,0.0451611359849898,98,85,10,3,False,True,46
821,Bald eagle privileges revoked,1.163265306122449,0.0402335846278346,98,83,14,1,False,False,29
821,I guess he hasn’t read the employee handbook!,1.163265306122449,0.0427683851428825,98,84,12,2,False,True,45
821,He has relatives in Timbuktu.,1.163265306122449,0.0451611359849898,98,85,10,3,False,True,29
821,The damn hairdo makes him think he sings like Elvis.,1.163265306122449,0.0427683851428825,98,84,12,2,False,True,52
821,I wonder how he combs his hair?,1.1630434782608696,0.0470769412025354,92,80,9,3,True,True,31
821,whats even weirder is there are 3 endangered species on the same tree!,1.1630434782608696,0.0444673683699362,92,79,11,2,False,True,70
821,I never much cared for fat Elvis.,1.1630434782608696,0.0470769412025354,92,80,9,3,False,True,33
821,He’s such a renegade.,1.1630434782608696,0.0444673683699362,92,79,11,2,False,True,21
821,I just alone for the ride,1.1630434782608696,0.041694787522042,92,78,13,1,False,False,25
821,"Handsome yes, but a real Dodo”",1.1630434782608696,0.0470769412025354,92,80,9,3,False,False,30
821,He's lost a lot of modeling contracts.,1.1630434782608696,0.0387242012605665,92,77,15,0,False,True,38
821,I know we mate for life but I still think it would be nice to be married by that Elvis impersonator.,1.1630434782608696,0.0444673683699362,92,79,11,2,False,True,100
821,Claims he's part hawk on his mother's side.,1.1630434782608696,0.0444673683699362,92,79,11,2,False,True,43
821,I'm gonna tell my kids this was Hawkguy!,1.1630434782608696,0.0387242012605665,92,77,15,0,False,True,40
821,"Let's just hope he doesn't insist on the white jumpsuit, too.",1.1630434782608696,0.041694787522042,92,78,13,1,False,True,61
821,That ‘bald eagle’ went to Hair Club for Men!! Why didn’t we think of that?,1.1630434782608696,0.041694787522042,92,78,13,1,True,True,74
821,It looks like Martin is an alopecia denier.,1.1630434782608696,0.041694787522042,92,78,13,1,False,True,43
821,"Now, he's just another Elvis impersonator.",1.1630434782608696,0.0387242012605665,92,77,15,0,False,True,42
821,That jerk just told me about his fantasy of being with twins,1.1630434782608696,0.0470769412025354,92,80,9,3,False,False,60
821,Beats me. He said something about making America great again.,1.1630434782608696,0.0470769412025354,92,80,9,3,False,True,61
821,I think it’s a combover.,1.162790697674419,0.0433244531384763,86,73,12,1,False,True,24
821,That's disrespectful to our troops.,1.162790697674419,0.0463746272326316,86,74,10,2,False,True,35
821,They say this is the new cat fishing.,1.162790697674419,0.0463746272326316,86,74,10,2,False,True,37
821,"He sings like Elvis, too!",1.162790697674419,0.0400426076639686,86,72,14,0,False,True,25
821,"He keeps saying, 'How do you like me now, Jack?'",1.162790697674419,0.0433244531384763,86,73,12,1,True,False,48
821,He looks like a wet poodle. Who's he kidding?,1.162790697674419,0.0519403665119968,86,76,6,4,True,True,45
821,Apparently he's taking a stand against nominative determinism.,1.162790697674419,0.0433244531384763,86,73,12,1,False,True,62
821,The worst part is when he brags about how he caught it himself.,1.162790697674419,0.0492362047906117,86,75,8,3,False,True,63
821,He never did like the name Bald,1.162790697674419,0.0433244531384763,86,73,12,1,False,False,31
821,"Next, he's planning of buying candelabras and a baby grand",1.162790697674419,0.0433244531384763,86,73,12,1,False,False,58
821,"Yep, scarecrow.",1.162790697674419,0.0400426076639686,86,72,14,0,False,True,15
821,So much for tomorrow's Bald is Beautiful rally at Yellowstone.,1.162790697674419,0.0463746272326316,86,74,10,2,False,True,62
821,He thinks it will help him get a mate...,1.162790697674419,0.0463746272326316,86,74,10,2,False,True,40
821,tell him he is not a bald eagle!,1.162790697674419,0.0400426076639686,86,72,14,0,False,True,32
821,He's showing off ! Looking for his own category in the guidebooks.,1.162790697674419,0.0492362047906117,86,75,8,3,False,True,66
821,"Personally, I’ve made my peace with my given name.",1.162790697674419,0.0463746272326316,86,74,10,2,False,True,50
821,Let's at least try to be inclusive and keep this a safe space.,1.162790697674419,0.0400426076639686,86,72,14,0,False,True,62
821,I actually respect how he hasn't tried to fight it and simply owns it.,1.1625,0.045157074666159,80,68,11,1,False,True,70
821,"Hair brained, not feather brained",1.1625,0.045157074666159,80,68,11,1,False,False,33
821,Um… are we the ones who should be worried? Because that is NOT natural.,1.1625,0.0485346998405016,80,69,9,2,True,True,71
