contest,caption,mean,precision,votes,not_funny,somewhat_funny,funny,has_question_mark,ends_with_punctuation,caption_length
736,"Yeah, yeah, new hat. It's nice. You don't have to bring it up every time I see you. Like, I've been up to stuff too you know.",1.1754385964912282,0.0508253127585795,57,47,10,0,False,True,125
736,Fine. You wear that and I'll evolve wings.,1.1754385964912282,0.0668050272444202,57,50,4,3,False,True,42
736,"I know, but the other choice was a MAGA hat.",1.1754385964912282,0.0566549100524176,57,48,8,1,False,True,44
736,"Well, Frank, your obsession with hats has literally got out of hands",1.1754385964912282,0.0566549100524176,57,48,8,1,False,False,68
736,"Sorry, they said only one per customer.",1.1754385964912282,0.0668050272444202,57,50,4,3,False,True,39
736,The last New Year’s Eve hat didn’t work.,1.1754385964912282,0.0566549100524176,57,48,8,1,False,True,40
736,Now that we’re bipeds I think it’s time we start dressing like them too.,1.1754385964912282,0.0566549100524176,57,48,8,1,False,True,72
736,To cover up the quarantine haircut.,1.1754385964912282,0.0668050272444202,57,50,4,3,False,True,35
736,And you say it’s called Google?,1.1754385964912282,0.0619382373747237,57,49,6,2,True,True,31
736,"Make fun of me all you want, Rex.  I’m telling you, in 100 million years herbivorous dorks will rule the world!",1.1754385964912282,0.0508253127585795,57,47,10,0,False,True,111
736,Doing my bit to save the planet”. “Yea but it’s a comet!,1.1746031746031746,0.048212718510326,63,52,11,0,False,True,56
736,"Needed something to cover my head,you notice how chilly it",1.173913043478261,0.061788220580689,69,61,4,4,False,False,58
736,"Sure, rub it in.  You could have shared, you know.",1.173913043478261,0.0503886080777318,69,58,10,1,False,True,50
736,And how to you plan to disappear?,1.173913043478261,0.0503886080777318,69,58,10,1,True,True,33
736,"I heard the humankind is going extinct, so I’m gonna fly back and see if there’s room for all of us out there",1.173913043478261,0.0503886080777318,69,58,10,1,False,False,109
736,2020 got my head spinning,1.171875,0.047531774564537,64,53,11,0,False,False,25
736,Cap your head with vibgyor and fly high,1.1714285714285717,0.0537282040026785,70,60,8,2,False,False,39
736,Wanna get away?,1.1666666666666667,0.0576138619860012,54,46,7,1,True,True,15
736,So you call it a meteorite detector?,1.1666666666666667,0.0576138619860012,54,46,7,1,True,True,36
736,The drones are getting dangerous and this helps a lot.,1.1666666666666667,0.0633890299066702,54,47,5,2,False,True,54
736,Are you sure it works? You haven't taken off yet,1.1666666666666667,0.0511912597361625,54,45,9,0,True,False,48
736,Wilbur that's never going to work.,1.1666666666666667,0.0576138619860012,54,46,7,1,False,True,34
736,Are you the weatherman who knows which way the wind blows?,1.1666666666666667,0.0576138619860012,54,46,7,1,True,True,58
736,is it fashion week already?,1.1666666666666667,0.0511912597361625,54,45,9,0,True,True,27
736,You're a real gas.,1.1666666666666667,0.0576138619860012,54,46,7,1,False,True,18
736,What did you do to Beany Boy?,1.1666666666666667,0.0686802819743444,54,48,3,3,True,True,29
736,Accessories are the key to fashion.,1.1666666666666667,0.0511912597361625,54,45,9,0,False,True,35
736,"This is all the rave, since we entered the Jurassic Period.",1.1666666666666667,0.0576138619860012,54,46,7,1,False,True,59
736,It's my guilty pleasure for 2020.,1.1666666666666667,0.0576138619860012,54,46,7,1,False,True,33
736,"When Trump dofs his own red cap for a wind-power Pride beanie, I'll know he really has conceded.",1.1666666666666667,0.0633890299066702,54,47,5,2,False,True,96
736,It’s the last thing I found cleaning the attic during Covid isolation,1.1666666666666667,0.0576138619860012,54,46,7,1,False,False,69
736,"Take me to the Orange One; I just landed with an important message from Bibi""",1.1666666666666667,0.0576138619860012,54,46,7,1,False,False,77
736,I thought those were extinct?,1.1666666666666667,0.0511912597361625,54,45,9,0,True,True,29
736,"Bet you can’t fly, the arms..I mean blades are too short.",1.1666666666666667,0.0576138619860012,54,46,7,1,False,True,57
736,A meteor just hit. Now would be a great time to roll out some of those life-saving inventions you've been working on.,1.1666666666666667,0.0511912597361625,54,45,9,0,False,True,117
736,Sure.  It makes you look ferocious!,1.1666666666666667,0.0576138619860012,54,46,7,1,False,True,35
736,I’ve heard my crush’s vision was based on movement.,1.1666666666666667,0.0686802819743444,54,48,3,3,False,True,51
736,"You ok, Mike? It seems like you're really spinning out of control.",1.1666666666666667,0.0511912597361625,54,45,9,0,True,True,66
736,"I'm mesmerized by it, but for the life of me, I can't figure out how you even put it on.",1.1666666666666667,0.0511912597361625,54,45,9,0,False,True,88
736,"Switch the beanie with a blond fright wig, and you’ve nailed Beavis’ look. Uncanny.",1.1666666666666667,0.0576138619860012,54,46,7,1,False,True,83
736,"So, that's what you've come up with to get us out of here rather than the wheel!",1.1666666666666667,0.0576138619860012,54,46,7,1,False,True,80
736,Were you hanging out with that Toys-'R-Us Rex again?,1.1666666666666667,0.0576138619860012,54,46,7,1,True,True,52
736,"Sure, it wasn't cheap, but the guy said it's 100% effective at keeping you high and dry during an extinction event. Money-back guarantee.",1.1666666666666667,0.0576138619860012,54,46,7,1,False,True,137
736,I don't care what you say. I'm going to enjoy every moment.,1.1666666666666667,0.0576138619860012,54,46,7,1,False,True,59
736,You're ahead of your time.,1.1666666666666667,0.0511912597361625,54,45,9,0,False,True,26
736,Please! No Caption,1.1666666666666667,0.0511912597361625,54,45,9,0,False,False,18
736,keeps me from grinding my teeth,1.1666666666666667,0.0576138619860012,54,46,7,1,False,False,31
736,"So this is your meteor deflector, eh? Well, I sure hope we never have to test it.",1.1666666666666667,0.0511912597361625,54,45,9,0,True,True,81
736,I keep hoping for lift-off but nothing ever happens.,1.1666666666666667,0.0511912597361625,54,45,9,0,False,True,52
736,"Well, it definitely makes you look more colorful.",1.1666666666666667,0.0511912597361625,54,45,9,0,False,True,49
736,Fly like a bumblebee? I doubt it.,1.1666666666666667,0.0576138619860012,54,46,7,1,True,True,33
736,I think we have a future in flying.,1.1666666666666667,0.0633890299066702,54,47,5,2,False,True,35
736,I’m telling you ~ Flight is the future of this planet,1.1666666666666667,0.0511912597361625,54,45,9,0,False,False,53
736,"The kid went down fine, but this thingamybob got caught in my throat.",1.1666666666666667,0.0633890299066702,54,47,5,2,False,True,69
736,"Great hat, but I think you are two million years a head of your time.",1.1666666666666667,0.0576138619860012,54,46,7,1,False,True,69
736,I've been told it's the only way to fly!,1.1666666666666667,0.0576138619860012,54,46,7,1,False,True,40
736,"You can't turn back the clock, Randy, we're gonna go extinct no matter what you wear.",1.1666666666666667,0.0576138619860012,54,46,7,1,False,True,85
736,Let's hope they don't draw conclusions based on your fossil.,1.1666666666666667,0.0511912597361625,54,45,9,0,False,True,60
736,"As a power source, it's great. As a fashion statement, it sucks.",1.1666666666666667,0.0576138619860012,54,46,7,1,False,True,64
736,"Y’know, keeping souvenirs is a sign of a serial killer...just sayin’.",1.1666666666666667,0.0633890299066702,54,47,5,2,False,True,69
736,I'm afraid it's too little too late.,1.1666666666666667,0.0576138619860012,54,46,7,1,False,True,36
736,And they *didn’t* choose your ‘clog’ line?,1.1666666666666667,0.0576138619860012,54,46,7,1,True,True,42
736,I know what to give you for Christmas.  A Crayolla 64 box to replace that old Crayolla 8 box>,1.1666666666666667,0.0576138619860012,54,46,7,1,False,False,93
736,"Clever, but the birds have already figured out how to fly.",1.1666666666666667,0.0511912597361625,54,45,9,0,False,True,58
736,Nice color.But propellor caps are soon to be extinct...,1.1666666666666667,0.0576138619860012,54,46,7,1,False,True,55
736,I’m afraid that’s not how evolution works.,1.1666666666666667,0.0511912597361625,54,45,9,0,False,True,42
736,"I can’t reach it. And unless you can find a brontosaurus that isn’t scared shitless of you, you’re gonna have to spend the rest of the Cretaceous Period walking around, looking like a dumbfuck.",1.1666666666666667,0.0576138619860012,54,46,7,1,False,True,193
736,"Your kids gave you that beanie, and you still don’t get it!",1.1666666666666667,0.0576138619860012,54,46,7,1,False,True,59
736,"Yeah, it makes you look gay. Why do you ask?",1.1666666666666667,0.0576138619860012,54,46,7,1,True,True,44
736,You win.  That’s hilarious.,1.1666666666666667,0.0511912597361625,54,45,9,0,False,True,27
736,Let me know if you find a warmer climate.,1.1666666666666667,0.0576138619860012,54,46,7,1,False,True,41
736,Make it look like an accident.,1.1666666666666667,0.0633890299066702,54,47,5,2,False,True,30
736,It’s my attempt to put a positive spin on our imminent mass extinction.,1.1666666666666667,0.0511912597361625,54,45,9,0,False,True,71
736,I'm back and I'm telling you! The future is nothing like how we thought it would be !,1.1666666666666667,0.0576138619860012,54,46,7,1,False,True,85
736,You're so 1950's.,1.1666666666666667,0.0633890299066702,54,47,5,2,False,True,17
736,It's not silly. This is how dinosaurs evolved into flying birds.,1.1666666666666667,0.0633890299066702,54,47,5,2,False,True,64
736,I'd take it off your head if I could Kevin.,1.1666666666666667,0.0633890299066702,54,47,5,2,False,True,43
736,Only when I need to cross water.,1.1666666666666667,0.0633890299066702,54,47,5,2,False,True,32
736,Someone has to identify as the immature gender.,1.1666666666666667,0.0511912597361625,54,45,9,0,False,True,47
736,"Lenny, you workin for Amazon now?",1.1666666666666667,0.0633890299066702,54,47,5,2,True,True,33
736,"But,why?",1.1666666666666667,0.0576138619860012,54,46,7,1,True,True,8
736,See you're back from lunch.  Have you seen that Spanky kid?,1.1666666666666667,0.0511912597361625,54,45,9,0,True,True,59
736,I know it looks ridiculous -my arms are too short to take it off.,1.1666666666666667,0.0633890299066702,54,47,5,2,False,True,65
736,I was feeling nostalgic for the Triassic period...,1.1666666666666667,0.0576138619860012,54,46,7,1,False,True,50
736,"Oh, the future? We look GREAT but stuck in glass cases.",1.1666666666666667,0.0633890299066702,54,47,5,2,True,True,55
736,That crazy guy with the banjo at A's games sells them.,1.1666666666666667,0.0576138619860012,54,46,7,1,False,True,54
736,Your crocodile tears won't get you a cool propeller hat.,1.1666666666666667,0.0576138619860012,54,46,7,1,False,True,56
736,I came as soon as I heard your pinned location!,1.1666666666666667,0.0576138619860012,54,46,7,1,False,True,47
736,The evolution of birds - circa 160 million years B.C. (Colourized),1.1666666666666667,0.0576138619860012,54,46,7,1,False,False,66
736,That went out of style eons ago.,1.1666666666666667,0.0633890299066702,54,47,5,2,False,True,32
736,It means I've been selected to move up in the world.,1.1666666666666667,0.0633890299066702,54,47,5,2,False,True,52
736,"Nice colors, but it will never replace wings",1.1666666666666667,0.0576138619860012,54,46,7,1,False,False,44
736,"Whoa T-money, I thought you said you hate tech support.",1.1666666666666667,0.0576138619860012,54,46,7,1,False,True,55
736,Good luck during your freshman year,1.1666666666666667,0.0511912597361625,54,45,9,0,False,False,35
736,Thought I'd fly out of here while I have the chance--that's logic.,1.1666666666666667,0.0633890299066702,54,47,5,2,False,True,66
736,I dunno ...looks kinda reggie...,1.1666666666666667,0.0576138619860012,54,46,7,1,False,True,32
736,The early bird catches the stegosaurus.,1.1666666666666667,0.0633890299066702,54,47,5,2,False,True,39
736,"I know, but the caption said it was ""Hella-cool""",1.1666666666666667,0.0511912597361625,54,45,9,0,False,False,48
736,What do you mean out of fashion - You are out of fashion,1.1666666666666667,0.0576138619860012,54,46,7,1,False,False,56
736,"George, you're the same silly boy I fell in love with in fifth grade!",1.1666666666666667,0.0633890299066702,54,47,5,2,False,True,69
736,"Idiot! You've activated the ""GRAVITY""
function. For ""LIFT,
spin it the other way, if you can reach it...",1.1666666666666667,0.0511912597361625,54,45,9,0,False,True,104
736,Someday you will fly.,1.1666666666666667,0.0576138619860012,54,46,7,1,False,True,21
736,Diane the Pterodactyl said it gives me a 'hypnotic allure.',1.1666666666666667,0.0576138619860012,54,46,7,1,False,False,59
736,The colors' wrong for you.,1.1666666666666667,0.0511912597361625,54,45,9,0,False,True,26
736,"I know, I should have known that the kid did not have good taste.",1.1666666666666667,0.0511912597361625,54,45,9,0,False,True,65
736,Why would you wear a hat from the Paleocene epoch when the theme of the party is Miocene?,1.1666666666666667,0.0576138619860012,54,46,7,1,True,True,89
736,Did he at least taste good?,1.1666666666666667,0.0633890299066702,54,47,5,2,True,True,27
736,"I swear. If the wind blows strongly enough, I fly like a bird!",1.1666666666666667,0.0511912597361625,54,45,9,0,False,True,62
736,Do we really need another keepsake from the 6th Extinction?,1.1666666666666667,0.0511912597361625,54,45,9,0,True,True,59
736,"George, is that you? You look nice in a dress.",1.1666666666666667,0.0633890299066702,54,47,5,2,True,True,46
736,"I thought you were a meanie, not a weenie with a beanie.",1.1666666666666667,0.0633890299066702,54,47,5,2,False,True,56
736,It's a,1.1666666666666667,0.0576138619860012,54,46,7,1,False,False,6
736,You rev me up!,1.1666666666666667,0.0511912597361625,54,45,9,0,False,True,14
736,I know it’s not spinning.  It’s not supposed to spin.  Not ‘til the meteor comes.,1.1666666666666667,0.0511912597361625,54,45,9,0,False,True,81
736,"Yeah kids are gourmet, but I’ve never seen one with that style...",1.1666666666666667,0.0633890299066702,54,47,5,2,False,True,65
736,"Well, whatever spins your propeller!",1.1666666666666667,0.0511912597361625,54,45,9,0,False,True,36
736,"I traded it for some toe fungus, and a cave man to named later.",1.1666666666666667,0.0511912597361625,54,45,9,0,False,True,63
736,"To join Go Green, I had to agree to wear this stupid, wind driven hat.",1.1666666666666667,0.0633890299066702,54,47,5,2,False,True,70
736,"No, wearing that dumb colorful beanie does not qualify you to be considered a dragon of color!",1.1666666666666667,0.0576138619860012,54,46,7,1,False,True,94
736,Oh the hat? JetBlue bought carbon offsets from my Etsy store.,1.1666666666666667,0.0511912597361625,54,45,9,0,True,True,61
736,Did a kid sell you that?  Or did you eat him?,1.1666666666666667,0.0576138619860012,54,46,7,1,True,True,45
736,"Yes, it's impressive, but they won't let you in without a tie.",1.1666666666666667,0.0576138619860012,54,46,7,1,False,True,62
736,How'd you even reach the top of your head?,1.1666666666666667,0.0576138619860012,54,46,7,1,True,True,42
736,"Dude, I keep telling you, you are not Beany and I am not Cecil.",1.1666666666666667,0.0511912597361625,54,45,9,0,False,True,63
736,they both look like they are scared at something and looking at each other,1.1666666666666667,0.0576138619860012,54,46,7,1,False,False,74
736,Never mind how I got it on my head!,1.1666666666666667,0.0511912597361625,54,45,9,0,False,True,35
736,I'm sure your hat will go down as the worst thing to ever happen to the dinosaurs,1.1666666666666667,0.0576138619860012,54,46,7,1,False,False,81
736,"you’ve done it— you’ve found your thing! now, you gotta degrade yourself for money",1.1666666666666667,0.0633890299066702,54,47,5,2,False,False,82
736,Sorry Bro he pterodactyl got there first.,1.1666666666666667,0.0576138619860012,54,46,7,1,False,True,41
736,You really got that at a QAnon party?,1.1666666666666667,0.0576138619860012,54,46,7,1,True,True,37
736,My rudimentary calculations indicate that we have less than one eon before it erupts.,1.1666666666666667,0.0511912597361625,54,45,9,0,False,True,85
736,"Wow, that really does not go with your snake print.",1.1666666666666667,0.0511912597361625,54,45,9,0,False,True,51
736,My arms are to short to get it off.,1.1666666666666667,0.0576138619860012,54,46,7,1,False,True,35
736,"Quit trying to look younger, we're both dinosaurs.""

Andy Mathieson, Los Angeles, Cali",1.1666666666666667,0.0633890299066702,54,47,5,2,False,False,86
736,I'd fly to the moon if my arms were longer,1.1666666666666667,0.0576138619860012,54,46,7,1,False,False,42
736,I don't think this will propel us into the next phase of our evolution.,1.1666666666666667,0.0576138619860012,54,46,7,1,False,True,71
736,"Buddy, a beanie will not make you a Tyrann o Soar Us.",1.1666666666666667,0.0511912597361625,54,45,9,0,False,True,53
736,"I don't think that's what the ""P"" in pterodactyl stands for...",1.1666666666666667,0.0511912597361625,54,45,9,0,False,True,62
736,Are you sure it’s meteor proof?,1.1666666666666667,0.0576138619860012,54,46,7,1,True,True,31
736,Can you fly?,1.1666666666666667,0.0576138619860012,54,46,7,1,True,True,12
736,"That’s cute, Ted. But wearing a pinwheel cap won’t prevent us from dying a horrible death from certain extinction. Besides, it makes you look foolish.",1.1666666666666667,0.0576138619860012,54,46,7,1,False,True,150
736,"Gee Whiz Rex, where did you get that?",1.1666666666666667,0.0576138619860012,54,46,7,1,True,True,37
736,You really think that's going to save you from the eruption?,1.1666666666666667,0.0576138619860012,54,46,7,1,True,True,60
736,"Sorry, Ed. Beanies are inappropriate during an extinction event.",1.1666666666666667,0.0633890299066702,54,47,5,2,False,True,64
736,"I hate to be a meanie, Jeannie, but you look like a weenie with that beanie.”",1.1666666666666667,0.0576138619860012,54,46,7,1,False,False,77
736,"Cute. Not gonna get rid of the extra CO2, man.",1.1666666666666667,0.0511912597361625,54,45,9,0,False,True,46
736,"You've always been ahead of your time, Ralph.",1.1666666666666667,0.0511912597361625,54,45,9,0,False,True,45
736,Oh geez. Is this the first sign of the apocalypse or what?,1.1666666666666667,0.0686802819743444,54,48,3,3,True,True,58
736,"Cute idea, bird brain, but that'll never fly.  We just gotta wing it.",1.1666666666666667,0.0576138619860012,54,46,7,1,False,True,69
736,Did you use the last FastPass at Jurassic Park ?,1.1666666666666667,0.0511912597361625,54,45,9,0,True,True,48
736,"Cecil, I'll explain it one more time - Beany  wears the propeller hat, not you!",1.1666666666666667,0.0511912597361625,54,45,9,0,False,True,79
736,"Officially, I'm an Amazon intern, but I'm told they're grooming me for their drone delivery fleet.",1.1666666666666667,0.0511912597361625,54,45,9,0,False,True,98
736,This...is not cheering me up.,1.1666666666666667,0.0576138619860012,54,46,7,1,False,True,29
736,"Retro hip, maybe. But I think most would call you prehistoric!",1.1666666666666667,0.0511912597361625,54,45,9,0,False,True,62
736,"Your whimsy has no limits.""",1.1666666666666667,0.0511912597361625,54,45,9,0,False,False,27
736,E-volve? That makes more sense,1.1666666666666667,0.0511912597361625,54,45,9,0,True,False,30
736,Don't laugh it's stuck to my head...!!,1.1666666666666667,0.0576138619860012,54,46,7,1,False,True,38
736,The thing is i can’t reach my head to take this off,1.1666666666666667,0.0633890299066702,54,47,5,2,False,False,51
736,"Alex, did you finish your homework?",1.1666666666666667,0.0511912597361625,54,45,9,0,True,True,35
736,"It was suggested that it helps regulate my body temperature but, really, it’s for sexual display.",1.1666666666666667,0.0576138619860012,54,46,7,1,False,True,97
736,My dad volunteered as an extra in Jurassic Park. Stephen Spielberg gave it to him as a token of thanks.,1.1666666666666667,0.0576138619860012,54,46,7,1,False,True,103
736,Your beanie is making me feel there is more than extinction.,1.1666666666666667,0.0576138619860012,54,46,7,1,False,True,60
736,I have to wear it during my first term at Reptile University.,1.1666666666666667,0.0511912597361625,54,45,9,0,False,True,61
736,Cute but what about your image as a serious carnivore?,1.1666666666666667,0.0576138619860012,54,46,7,1,True,True,54
736,Think.. HOW you can escape!!!,1.1666666666666667,0.0576138619860012,54,46,7,1,False,True,29
736,"You didn't buy that at Gucci, did you Carl?",1.1666666666666667,0.0576138619860012,54,46,7,1,True,True,43
736,''I thought it was the Cretaceous period.'',1.1666666666666667,0.0576138619860012,54,46,7,1,False,False,43
736,"Sorry mate,it won’t get you off the ground,but if you add another one you could invent the wheel.",1.1666666666666667,0.0576138619860012,54,46,7,1,False,True,97
736,"If I take it off your head, do I get to keep it?""",1.1666666666666667,0.0576138619860012,54,46,7,1,True,False,49
736,I don't think natural selection matters anyway...  I hear a meteor's coming,1.1666666666666667,0.0576138619860012,54,46,7,1,False,False,75
736,Talk about a rough freshman year! What could possibly be worse?,1.1666666666666667,0.0511912597361625,54,45,9,0,True,True,63
736,I thought those hats went extinct.,1.1666666666666667,0.0511912597361625,54,45,9,0,False,True,34
736,What happened to the kids?,1.1666666666666667,0.0576138619860012,54,46,7,1,True,True,26
736,I bit off more than I could chew.,1.1666666666666667,0.0511912597361625,54,45,9,0,False,True,33
736,This is the only way I can cope with this Cretaceous–Paleogene  extinction event we are going through.,1.1666666666666667,0.0511912597361625,54,45,9,0,False,True,102
736,I'm glad you figured it out.  I heard eating those plastic thingies is really bad for you.,1.1666666666666667,0.0511912597361625,54,45,9,0,False,True,90
736,"Think about it realistically, Mars is a long way away!",1.1666666666666667,0.0576138619860012,54,46,7,1,False,True,54
736,"Scooter, I’m not sure your Q-Anon “anti-extinction-hoax” beanie is gonna save us.",1.1666666666666667,0.0511912597361625,54,45,9,0,False,True,81
736,"Too much happening on earth.  I'm heading out.""  "" But Dad, I thought helicopter parenting was ...""",1.1666666666666667,0.0576138619860012,54,46,7,1,False,False,99
736,Won't paleontologist be surprised when they dig up my ones.,1.1666666666666667,0.0633890299066702,54,47,5,2,False,True,59
736,I don’t think that the laws of physics allow you to fly using that cap.,1.1666666666666667,0.0576138619860012,54,46,7,1,False,True,71
736,I get the feeling you're not taking this virus thing seriously.,1.1666666666666667,0.0576138619860012,54,46,7,1,False,True,63
736,"Um, it’s fun, but I think we’ll evolve into birds another way.",1.1666666666666667,0.0576138619860012,54,46,7,1,False,True,62
736,"Given that we're the predators, I suppose it's okay to compromise our ability to camouflage...",1.1666666666666667,0.0511912597361625,54,45,9,0,False,True,94
736,"Beam me up, Scotty",1.1666666666666667,0.0633890299066702,54,47,5,2,False,False,18
736,It opens doors.,1.1666666666666667,0.0576138619860012,54,46,7,1,False,True,15
736,This is my exit strategy for the next asteroid.,1.1666666666666667,0.0633890299066702,54,47,5,2,False,True,47
736,You sure you will catch more food this way?,1.1666666666666667,0.0633890299066702,54,47,5,2,True,True,43
736,I got it for mating season.,1.1666666666666667,0.0511912597361625,54,45,9,0,False,True,27
736,"Look, no one ever said you weren't silly.",1.1666666666666667,0.0633890299066702,54,47,5,2,False,True,41
736,It sucks that the only coloured object in our monochrome world is that dumb hat.,1.1666666666666667,0.0633890299066702,54,47,5,2,False,True,80
736,I do. What a hat. I like it. I like that party hat.,1.1666666666666667,0.0576138619860012,54,46,7,1,False,True,51
736,"Yes; I did tell you we needed more diversity in our relationship. """,1.1666666666666667,0.0511912597361625,54,45,9,0,False,False,67
736,"– I needed some color. Camouflage was getting so-o-o Cretaceous.
– And what age are we in now, if I may ask?
– With all meaninglessness, I could say that we're making a post-cretaceous breakthrough?
– Oh how existential!",1.1666666666666667,0.0633890299066702,54,47,5,2,True,True,220
736,You discover the secret of time travel and that’s what you bring back?,1.1666666666666667,0.0576138619860012,54,46,7,1,True,True,70
736,"And then she said, 'Do I need to remind you of your attempt at arm extensions?'",1.1666666666666667,0.0576138619860012,54,46,7,1,True,False,79
736,"Help! I've got a big head and little arms! How am I supposed to take this off?""
""Maybe if you spin around in a circle really fast, It'll fly away!",1.1666666666666667,0.0576138619860012,54,46,7,1,True,True,146
736,"Sorry, but I need a bad boy!",1.1666666666666667,0.0633890299066702,54,47,5,2,False,True,28
736,I don't think it will ever get you off the ground.,1.1666666666666667,0.0511912597361625,54,45,9,0,False,True,50
736,"We can stand, walk, talk, think complex thoughts, but a propeller beanie?  Sure, why not?",1.1666666666666667,0.0576138619860012,54,46,7,1,True,True,89
736,I think I can head off the asteroid and we can avoid extinction!,1.1666666666666667,0.0511912597361625,54,45,9,0,False,True,64
736,"Before the ash encases us, I want you to know: I see you.",1.1666666666666667,0.0511912597361625,54,45,9,0,False,True,57
736,One Dina sore finds itself in the Fulcher all of a sudden.,1.1666666666666667,0.0511912597361625,54,45,9,0,False,True,58
736,"Dude, you’re  almost 50 years old. That doesn’t make you look any younger.",1.1666666666666667,0.0576138619860012,54,46,7,1,False,True,74
736,C-. I can't spin it.,1.1666666666666667,0.0485185424782984,60,50,10,0,False,True,20
