contest,caption,mean,precision,votes,not_funny,somewhat_funny,funny,has_question_mark,ends_with_punctuation,caption_length
813,Lord Nelson's mom says tomorrow is better,1.2461538461538462,0.0476790332960425,130,105,18,7,False,False,41
813,"I think it is time for a nap, Leon.",1.2461538461538462,0.0437665221706562,130,102,24,4,False,True,35
813,Always the same sob story - give me quarters or I will die in exile,1.2461538461538462,0.0464115247720679,130,104,20,6,False,False,67
813,Help me with the groceries and I won't exile you to Elba.,1.2461538461538462,0.0501179746677662,130,107,14,9,False,True,57
813,To the Moon Alice!,1.2461538461538462,0.0437665221706562,130,102,24,4,False,True,18
813,We are not changing your sister's name to Josephine.,1.246031746031746,0.046031746031746,126,100,21,5,False,True,52
813,"Nap dear, that horse is not Marengo, and besides, from what I have heard about Russian winters, you would not last a day!",1.246031746031746,0.0431851060987803,126,98,25,3,False,True,121
813,I see your male confidence is in full bloom.,1.246031746031746,0.0446311272067717,126,99,23,4,False,True,44
813,Perhaps I've overindulged you.,1.2459016393442623,0.0470098667528688,122,97,20,5,False,True,30
813,Let's go. Time for your nap-oleon.,1.2459016393442623,0.0484294390738358,122,98,18,6,False,True,34
813,"I know it's only fifty cents, but I assure you, it won't get you places.",1.2459016393442623,0.0455460709089005,122,96,22,4,False,True,72
813,"Sorry sweetie, I’m cutting our expenditures on the military.",1.2457627118644068,0.0465162421308293,118,93,21,4,False,True,60
813,You're already too tall to imitate Napoleon.,1.2457627118644068,0.0495327153027407,118,95,17,6,False,True,44
813,Be glad that pony can't charge into battle.,1.2457627118644068,0.0465162421308293,118,93,21,4,False,True,43
813,Come on short stuff. Get off your high horse and help with the groceries.,1.2457627118644068,0.0480481564018657,118,94,19,5,False,True,73
813,Time for dinner…. You can invade Russia tomorrow!,1.2456140350877194,0.0491527400096235,114,91,18,5,False,True,49
813,"Yeah, yeah, now let's go conquer your homework.",1.2456140350877194,0.0507074673551995,114,92,16,6,False,True,47
813,"Come with me now, or it is off to Elba with you!",1.2456140350877194,0.0458855212480329,114,89,22,3,False,True,48
813,Try not to exhort any strangers.,1.2456140350877194,0.0475472023922403,114,90,20,4,False,True,32
813,"Come on honey, you can engage in delusions of grandeur at home",1.2454545454545454,0.0486453071835961,110,87,19,4,False,False,62
813,"I will get you a sword, if you can spell it.",1.2452830188679245,0.0515898552379356,106,85,16,5,False,True,44
813,What did I tell you about playing with imperialism?,1.2452830188679245,0.0549627346672768,106,87,12,7,True,True,51
813,"If you don't come now, I'll have to start paying royalties to the estate of Jacque-Louis David.",1.2452830188679245,0.049817854672336,106,84,18,4,False,True,95
813,"Yes, but the Lunch Brigade is this way.",1.2452830188679245,0.0479804556547437,106,83,20,3,False,True,39
813,"Make that ""Once more unto Whole Foods,"" Tyler.",1.2452830188679245,0.0460698340079457,106,82,22,2,False,True,46
813,Russia? Dressed like that?,1.2450980392156863,0.0529397383987546,102,82,15,5,True,True,26
813,Round up your prisoners then I'll meet you at the car.,1.2448979591836735,0.040488855009644,147,115,28,4,False,True,54
813,"Wrap it up. Time for your nappy, Nappy.",1.2447552447552448,0.0446230071415309,143,115,21,7,False,True,39
813,I don't think you meet the height requirements.,1.2447552447552448,0.041179286026284,143,112,27,4,False,True,47
813,We are definitely cutting down on your French fries!,1.2446043165467626,0.0431306988183035,139,110,24,5,False,True,52
813,"There is joy in danger, Mother.",1.2446043165467626,0.0443229240361071,139,111,22,6,False,True,31
813,"Hey Little Man, we’re just crossing town, not the Alps.",1.2446043165467626,0.0443229240361071,139,111,22,6,False,True,55
813,I think your French lessons have gone to your head.,1.2444444444444445,0.0439441158082614,135,107,23,5,False,True,51
813,You might want to turn around--you're heading straight towards Waterloo.,1.2444444444444445,0.0451845508297187,135,108,21,6,False,True,72
813,You'll have to lead your troops to victory another time because I'm out of quarters and patience,1.2442748091603053,0.0460941912079632,131,105,20,6,False,False,96
813,"So this is how it all starts, in front of the grocery store.""",1.2442748091603053,0.0448021723917488,131,104,22,5,False,False,61
813,"OK Napoleon, Josephine is waiting for you at home. Do NOT keep her waiting!",1.2442748091603053,0.0473509691053158,131,106,18,7,False,True,75
813,"Ok son,you made your point.",1.2442748091603053,0.0434717705979832,131,103,24,4,False,True,27
813,"After Waterloo,it's time to clean your room",1.2442748091603053,0.0448021723917488,131,104,22,5,False,False,43
813,Don't fall and crack your Bonesapart,1.2442748091603053,0.0460941912079632,131,105,20,6,False,False,36
813,Where's the croissants?,1.2442748091603053,0.0448021723917488,131,104,22,5,True,True,23
813,The exit is that way,1.2440944881889764,0.0457089243574284,127,101,21,5,False,False,20
813,"Mom, not in front of my men!",1.2440944881889764,0.044320665484176,127,100,23,4,False,True,28
813,"C'mon Bonaparte, help me with the shopping cart.",1.2440944881889764,0.0428874924891553,127,99,25,3,False,True,48
813,You need to shift the campaign over to the drugstore now.,1.2440944881889764,0.0457089243574284,127,101,21,5,False,True,57
813,I should have never encouraged you to read Tolstoy.,1.2440944881889764,0.0457089243574284,127,101,21,5,False,True,51
813,"No, Napoleon. This way for bottled water and the loo.",1.2439024390243902,0.0494423971408197,123,100,16,7,False,True,53
813,"I admire your joie de vivre, but I’m double parked.",1.2439024390243902,0.0466689467674269,123,98,20,5,False,True,51
813,I have supplies. Now we conquer Bed Bath and Beyond.,1.2439024390243902,0.0466689467674269,123,98,20,5,False,True,52
813,"If you don’t get off that horse right now, you’re going to meet your Waterloo once we get home.",1.2436974789915969,0.0429744172126887,119,92,25,2,False,True,95
813,I wish they had let me abort you.,1.2436974789915969,0.0461699062308419,119,94,21,4,False,True,33
813,Finish your home work and then you can cross the Alps.,1.2436974789915969,0.0491581117208466,119,96,17,6,False,True,54
813,Moscow is this way.,1.2434782608695651,0.0455348825604945,115,90,22,3,False,True,19
813,50c won't get you to Russia,1.2434782608695651,0.0471803013035604,115,91,20,4,False,False,27
813,"Waterloo, Iowa? Ok, but you won't like it.",1.2434782608695651,0.0503099536243891,115,93,16,6,True,True,42
813,First with the Oedipus and now this?,1.2434782608695651,0.0438277335542383,115,89,24,2,True,True,36
813,"We need to get out of here, Napoleon, the Prussians are marching down aisle 5.",1.2432432432432432,0.0456023622047016,148,121,18,9,False,True,78
813,You'll grow out of that complex.,1.2432432432432432,0.043539845106917,148,119,22,7,False,True,32
813,You are learning way too much from your father!,1.2432432432432432,0.0447327421161998,111,86,23,2,False,True,47
813,I don't care who you think you are. I'm out of quarters.,1.2430555555555556,0.04434462737314,144,116,21,7,False,True,56
813,The last guy who did that ended up in exile…,1.2429906542056075,0.0544948775219186,107,88,12,7,False,False,44
813,The Emperor has no coins,1.2429906542056075,0.0494032837609348,107,85,18,4,False,False,24
813,Your Waterloo can wait till we get home.,1.2429906542056075,0.0494032837609348,107,85,18,4,False,True,40
813,Pose all you want. I’m not painting your portrait.,1.2428571428571429,0.0463147866521478,140,114,18,8,False,True,50
813,"At dawn we take the candy isle, then it’s onward til we conquer the frozen section",1.2426470588235294,0.0460845149648313,136,110,19,7,False,False,82
813,Russia’s the other direction,1.2424242424242424,0.0457810771284485,132,106,20,6,False,False,28
813,"No more, I’m out of Francs!",1.2424242424242424,0.0431808543342196,132,104,24,4,False,True,27
813,You'll need a few more layers for Russia.,1.2424242424242424,0.0499245133968432,99,78,18,3,False,True,41
813,You can cross the Alps on your bike when your homework is done.,1.2424242424242424,0.0519480519480519,99,79,16,4,False,True,63
813,"No, you can’t have a sword. But you can have a Yoo Hoo.",1.2421875,0.0453904942391424,128,102,21,5,False,True,55
813,Who do you think you are?!,1.2421875,0.0480245766186398,128,104,17,7,True,True,26
813,I told you the car is THIS way!,1.2421875,0.0425938255519228,128,100,25,3,False,True,31
813,Your lieutenant will be in the produce aisle when your trusty steed comes to a halt.,1.2421875,0.0467261004507824,128,103,19,6,False,True,84
813,You're not Napoleon. Get off your high horse and help with the groceries.,1.2421052631578948,0.0512241838918181,95,75,17,3,False,True,73
813,Napoleon had a baby dick just like you,1.2420382165605095,0.0473029525441932,157,132,12,13,False,False,38
813,"Waterloo might be that way, but your lunch is coming with me.",1.2419354838709675,0.0463328244815081,124,99,20,5,False,True,61
813,"I'm counting to ten,then it's Waterloo for you young man.",1.2416666666666667,0.0458285584474835,120,95,21,4,False,True,57
813,I don’t have enough quarters for you to invade Belgium.,1.2416666666666667,0.0442741543901795,120,94,23,3,False,True,55
813,"Come on Napoleon, that was your last ride.",1.2416107382550337,0.0388607567798792,149,116,30,3,False,True,42
813,"You'll have to finish conquering the world another day, it's time to go home and take your nap.",1.2413793103448276,0.046818879146703,116,92,20,4,False,True,95
813,It's not polite to point.,1.2413793103448276,0.046818879146703,116,92,20,4,False,True,25
813,"Yes, you'd make a fine president - now get in the car.",1.2413793103448276,0.0483935169421984,116,93,18,5,False,True,54
813,"Right now, you precocious little turd.",1.2413793103448276,0.0472174618538936,145,120,15,10,False,True,38
813,OK Napoleon we are out of quarters.,1.2413793103448276,0.0451894059163464,116,91,22,3,False,True,35
813,That wasn't funny in 2016 and it isn't funny now.,1.2413793103448276,0.049918508786983,116,94,16,6,False,True,49
813,After invading the supermarket maybe you can conquer your homework?,1.2413793103448276,0.0451894059163464,116,91,22,3,True,True,67
813,"No -I didn't get the cookies so dismount the horse, you tyrant.",1.2413793103448276,0.0417400566855126,116,89,26,1,False,True,63
813,"Able, was I unclear?  It's Nap Time!",1.2411347517730495,0.0375283873909871,141,108,32,1,True,True,36
813,"I’m sorry, I can’t fight on the Russian front, I have to make dinner tonight.",1.2411347517730495,0.0425869504724495,141,112,24,5,False,True,77
813,". “The Walmart Greeters are coming, the Walmart Greeters are coming”",1.2410714285714286,0.0461614307502854,112,88,21,3,False,False,68
813,"I got the baguette you asked for, but we will not be invading Russia today.",1.2410714285714286,0.0461614307502854,112,88,21,3,False,True,75
813,"You are overcompensating, young man!",1.2408759124087592,0.0408233576150996,137,107,27,3,False,True,36
813,You’re already too tall.,1.2408759124087592,0.0408233576150996,137,107,27,3,False,True,24
813,"Get it in, son. Inflation’s about to make this ride $1",1.2408759124087592,0.0469388704779864,137,112,17,8,False,False,54
813,"Good job, honey!  We’ll call this your first riding lesson.",1.2407407407407407,0.0507308482422007,108,87,16,5,False,True,59
813,"Read your history books, boy, before you chose your heroes.",1.2407407407407407,0.0507308482422007,108,87,16,5,False,True,59
813,"O.K. Bonaparte, it's Nap time.",1.2407407407407407,0.047196169657259,108,85,20,3,False,True,30
813,"Ask me for fifty centimes one more time 
and somebody's going to be exiled to Elba.",1.2407407407407407,0.0524088659474846,108,88,14,6,False,True,83
813,"It's time to charge to the car, Napoleon !",1.2406015037593985,0.0428937019541687,133,105,24,4,False,True,42
813,I hope you get there before you run out of quarters.,1.2406015037593985,0.0415445363529347,133,104,26,3,False,True,52
813,You'll never handle a Moscow winter in those shorts,1.2406015037593985,0.0428937019541687,133,105,24,4,False,False,51
813,"After you've finished crossing the Alps, you have to go home and clean your room.",1.2403846153846154,0.0483004512394561,104,82,19,3,False,True,81
813,Oui and nay.,1.2403846153846154,0.0501960166479491,104,83,17,4,False,True,12
813,Your empire may await but math homework awaits first.,1.2403846153846154,0.0520225584213935,104,84,15,5,False,True,53
813,Have fun. Marengo dies in 3 minutes.,1.24,0.0487256970025786,125,102,16,7,False,True,36
813,"Come along dear, we have to get to Waterloo Station.",1.24,0.0415816336627665,125,97,26,2,False,True,52
813,The bratty kids are coming. The bratty kids are coming!,1.24,0.0552679423766206,100,82,12,6,False,True,55
813,I'll give you back your phone if you tone-down the imperialism.,1.24,0.0460014025031635,125,100,20,5,False,True,63
813,"No, not to conquer Russia.  We're going home to make sandwiches.",1.24,0.0445768636648379,125,99,22,4,False,True,64
813,"You know the ""Quarter"" Horses are widely considered to be the fastest",1.2397260273972603,0.0448635095004821,146,119,19,8,False,False,69
813,"While you’re crossing the Alps,  I’ll be in the frozen food  aisle.",1.2396694214876034,0.0484253328684488,121,98,17,6,False,True,67
813,Manoeuvre your derrière to the car now please,1.2396694214876034,0.0454920956843731,121,96,21,4,False,False,45
813,Waterloo can wait until next time.,1.2396694214876034,0.0454920956843731,121,96,21,4,False,True,34
813,Give me Skittles or give me Death!,1.2396694214876034,0.0439521299020218,121,95,23,3,False,True,34
813,Giddy up napoleon jr  we’re  running late for dinner,1.2396694214876034,0.0439521299020218,121,95,23,3,False,False,52
813,"I was ready for the Terrible Twos,  not the Tyrannical Threes",1.2396694214876034,0.0469816114728743,121,97,19,5,False,False,61
813,The only things going in that direction are prices,1.2394366197183098,0.0457237140076564,142,116,18,8,False,False,50
813,That is NOT my kid. We will just be leaving in the same car.,1.2394366197183098,0.0411229563526963,142,112,26,4,False,True,60
813,Where is that energy when I ask you to clean your room?,1.2394366197183098,0.0457237140076564,142,116,18,8,True,True,55
813,Sorry.  He’s not the only one chomping at the bit.,1.2393162393162394,0.0464628184024083,117,93,20,4,False,True,50
813,Your plans are not my plans; let’s go.,1.2393162393162394,0.0464628184024083,117,93,20,4,False,True,38
813,Your Napoleon complex won’t get you out of homework!,1.2393162393162394,0.0464628184024083,117,93,20,4,False,True,52
813,Waterloo’s not here! It’s in Iowa!,1.2393162393162394,0.0464628184024083,117,93,20,4,False,True,34
813,"We’re heading for home, not the Alps.",1.2393162393162394,0.0464628184024083,117,93,20,4,False,True,37
813,"Oh, does your ice cream revolution require my 50 cents?",1.2391304347826086,0.0443034980479841,138,111,21,6,True,True,55
813,I thought you liked my Beef Wellington,1.2391304347826086,0.0430930785218547,138,110,23,5,False,False,38
813,Get off that now or I’m sending you into exile,1.238938053097345,0.0474946538397806,113,90,19,4,False,False,46
813,"Well, you do have the same stature as him.",1.238938053097345,0.0440418723213541,113,88,23,2,False,True,42
813,"When you get off, you're being exiled to Elba.",1.238938053097345,0.0537387513340315,113,94,11,8,False,True,46
813,The Revolution will have to wait until after soccer practice.,1.238938053097345,0.0458008114607757,113,89,21,3,False,True,61
813,Keep it up and you'll stunt your growth,1.238938053097345,0.0402943034656304,113,86,27,0,False,False,39
813,"Just in case you weren't aware, Paul Revere was also a dentist.",1.2388059701492538,0.0475869338107734,134,110,16,8,False,True,63
813,"When you’re done storming the Bastille, I’d appreciate some help with these bags.",1.2388059701492538,0.0412724122912714,134,105,26,3,False,True,81
813,So you're conquering Russia single-handedly? Good. Find your own kopeks to put in the slot.,1.2388059701492538,0.0475869338107734,134,110,16,8,True,True,91
813,"Last ride, sweetie. It’s getting colder and you know that never ends well.",1.2388059701492538,0.043907331023518,134,107,22,5,False,True,74
813,Time to face your Waterloo young man.,1.238709677419355,0.0410215909387426,155,124,25,6,False,True,37
813,I can see you’re a complex kid.,1.238532110091743,0.046813302765362,109,86,20,3,False,True,31
813,Hurry up! Our next stop is the Russian Tea Room.,1.238532110091743,0.046813302765362,109,86,20,3,False,True,48
813,I have one word for you: Waterloo.,1.2384615384615385,0.0434140061237124,130,103,23,4,False,True,34
813,You might want to lead off with a call to quarters.,1.2384615384615385,0.0420180359290254,130,102,25,3,False,True,51
813,Get a life!,1.2384615384615385,0.0434140061237124,130,103,23,4,False,True,11
813,You can be such a complex kid sometimes.,1.2384615384615385,0.0447664663792732,130,104,21,5,False,True,40
813,I’d recommend you stay out of Russia.,1.2384615384615385,0.046079248002365,130,105,19,6,False,True,37
813,We will not go 'Onward to candy!',1.238095238095238,0.040190272148074,147,116,27,4,False,False,33
813,No I won't make crepes instead of pancakes.,1.238095238095238,0.0459411343446539,105,82,21,2,False,True,43
813,I’ll be right here when you’re ready to consider diplomacy.,1.238095238095238,0.0456745859363116,126,101,20,5,False,True,59
813,"Enough , already, mon petit colonel",1.238095238095238,0.0456745859363116,126,101,20,5,False,False,35
813,Don't point! It's not polite.,1.238095238095238,0.0397269592659318,126,97,28,1,False,True,29
813,"Look, even Napoleon got off his horse once in awhile to help his mother with the groceries.",1.238095238095238,0.0497683452726118,105,84,17,4,False,True,91
813,Your Waterloo will be that I won't give you two more quarters.,1.2377622377622377,0.0454337056076649,143,117,18,8,False,True,62
813,Let's go.  You won't have any more luck than he did.,1.2377049180327868,0.0494561654427574,122,100,15,7,False,True,52
813,I’m just glad we vacationed in France instead of Germany this summer.,1.2377049180327868,0.0451604175096922,122,97,21,4,False,True,69
813,"No, I won’t pull your finger.",1.2377049180327868,0.0480669252544564,122,99,17,6,False,True,29
813,"For the last time, you're  not invading Moscow.  So calm down.",1.2377049180327868,0.043634622867235,122,96,23,3,False,True,62
813,Get in the car right now or you’re gonna find out what Waterloo means,1.237410071942446,0.044017245050598,139,112,21,6,False,False,69
813,Too bad your reality will grow up to be like mine.,1.237410071942446,0.044017245050598,139,112,21,6,False,True,50
813,Now let's go conquer Duane Reade.,1.2372881355932204,0.0428554299369701,118,92,24,2,False,True,33
813,You could have just told me your history report topic.,1.2372881355932204,0.0461120047099557,118,94,20,4,False,True,54
813,Fine! I'll make Chicken Marengo.,1.2371134020618555,0.0543889752279876,97,79,13,5,False,True,32
813,"If we leave now, you can conquer your brother's room before dinner.",1.237037037037037,0.0410037243079305,135,106,26,3,False,True,67
813,When I grow up I want to be a precedent.,1.237037037037037,0.0448662497392127,135,109,20,6,False,True,40
813,You know Napoleon ate his vegetables.,1.237037037037037,0.0410037243079305,135,106,26,3,False,True,37
813,Why don't you go conquer cleaning your room now.,1.237037037037037,0.0410037243079305,135,106,26,3,False,True,48
813,Ok… but now he needs to conquer his messy room!,1.237037037037037,0.0436167633616693,135,108,22,5,False,True,47
813,"Little Man Syndrome, now only 50 cents",1.237037037037037,0.0423304113685931,135,107,24,4,False,False,38
813,"When you’re done crossing the alps and conquering Europe, I could use a little help with the groceries.",1.237037037037037,0.0472662353555737,135,111,16,8,False,True,103
813,Mosco Street? I think it's in Chinatown.,1.236842105263158,0.0518297877913024,114,94,13,7,True,True,40
813,The British won't come before you finish your homework.,1.236842105263158,0.0471228258608978,114,91,19,4,False,True,55
813,"That's the wrong complex, honey.",1.236641221374046,0.0444607027508771,131,105,21,5,False,True,32
813,You’re still not getting another croissant.,1.236641221374046,0.0444607027508771,131,105,21,5,False,True,43
813,It’s Beef Wellington tonight then off Aunt Helena’s,1.236641221374046,0.0482604758098255,131,108,15,8,False,False,51
813,I think we've charged enough for one mall visit,1.2363636363636363,0.0464364340421496,110,87,20,3,False,False,47
813,Meet me back here in two dollars.,1.2363636363636363,0.0515437621902922,110,90,14,6,False,True,33
813,Are you ready for your nap Emperor?,1.236220472440945,0.0467098906810677,127,103,18,6,True,True,35
813,"Time to go home, Paul. The ice cream is melting, the ice cream is melting!",1.236220472440945,0.0493131082101205,127,105,14,8,False,True,74
813,"No thanks, I’ll stay with the Peloton.",1.2358490566037736,0.0528638706646109,106,87,13,6,False,True,38
813,"That’s not what I meant by “Nappy time”, bud.",1.2358490566037736,0.0493477434439548,106,85,17,4,False,True,45
813,"No,I don't think Napoleon had a Timmy Complex!",1.2358490566037736,0.0493477434439548,106,85,17,4,False,True,46
813,"Napoleon, your time is up.",1.2357723577235773,0.0462959621920562,123,99,19,5,False,True,26
813,Not cute Wellington!,1.2357723577235773,0.0462959621920562,123,99,19,5,False,True,20
813,Only if you 'poser des question en francais' like he would have done.,1.2357723577235773,0.0462959621920562,123,99,19,5,False,True,69
813,They were out of crêpes.,1.2357142857142858,0.0437345941581517,140,113,21,6,False,True,24
813,Hurry up. Your father wants a turn before we go...,1.2357142857142858,0.0448942050725597,140,114,19,7,False,True,50
813,"No, not today. We'll do an invasion next time...",1.2357142857142858,0.0437345941581517,140,113,21,6,False,True,48
813,Go ahead. I hear Waterloo isn't all that great.,1.2356687898089171,0.042519968110349,157,128,21,8,False,True,47
813,It doesn't take Venmo!!,1.2352941176470589,0.0472967918513856,119,96,18,5,False,True,23
813,Waterloo station is this way,1.2352941176470589,0.0505770824707708,102,82,16,4,False,False,28
813,"Fine, French fries and French toast for dinner, now dépêche-toi!",1.2352941176470589,0.0524612078780126,102,83,14,5,False,True,64
813,"Well, at least you're the right size.",1.2352941176470589,0.0444480605759177,102,79,22,1,False,True,37
813,"Sorry, Napoleon. I’m out of quarters.",1.2352941176470589,0.0441828791823121,119,94,22,3,False,True,37
813,"That’s not how reincarnation works, son.",1.2352941176470589,0.045766326771285,119,95,20,4,False,True,40
813,Gonna be rough without that grain from Ukraine...,1.2352941176470589,0.0420541384108376,136,108,24,4,False,True,49
813,No more quarters.  Everything after Austerlitz is a waste.,1.2352941176470589,0.0390864744363377,153,121,28,4,False,True,58
813,There is danger in joy.,1.2352941176470589,0.0425405331365457,119,93,24,2,False,True,23
813,"I don't care that Jimmy's mother let him annex Lombardy, it's not happening.",1.2352941176470589,0.0457749707056029,136,111,18,7,False,True,76
813,You got taken for a ride.,1.2348484848484849,0.0441589987864318,132,106,21,5,False,True,25
813,No! I am not going to give you another two quarters so you can conquer Russia.,1.2348484848484849,0.0414571626116914,132,104,25,3,False,True,78
813,"Why don’t you first conquer the mess in your room, young man?",1.2348484848484849,0.0441589987864318,132,106,21,5,True,True,61
813,"No, I don't want cake!",1.2347826086956522,0.0450957702526206,115,91,21,3,False,True,22
813,The insurrection is this way.,1.2347826086956522,0.043371340691526,115,90,23,2,False,True,29
813,"No, another 50 cents will not get you all the way to Russia.",1.2345679012345678,0.0406443103389384,162,131,24,7,False,True,60
813,No.  I will not drive you to Russia.,1.234375,0.0463802631943413,128,104,18,6,False,True,36
813,"Ralphie, get off the horse or you will be meeting your Waterloo . . .",1.234375,0.0436470597159808,128,102,22,4,False,True,69
813,"Yes, son, posting the revolution on TikTok counts as screen time.""",1.234375,0.0422141484077009,128,101,24,3,False,False,66
813,"No, for the last time, the horse does not make you look short. Get in the car.",1.234375,0.0422141484077009,128,101,24,3,False,True,78
813,You need to conquer picking up your room first!,1.2342342342342345,0.0460654289423789,111,88,20,3,False,True,47
813,Onward to ice cream!,1.2342342342342345,0.0478102908111374,111,89,18,4,False,True,20
813,Find your own 50 cents and I shall return!,1.2342342342342345,0.0442518200738139,111,87,22,2,False,True,42
813,Don't worry.  You won't always be short like him.,1.2340425531914894,0.0410578185645891,141,112,25,4,False,True,49
813,"I'll give you fifty cents to clean your room, not expand your empire.",1.2340425531914894,0.0533171702120192,94,76,14,4,False,True,69
813,How did you know my name was Napoleon?,1.2338709677419355,0.0430128015509903,124,98,23,3,True,True,38
813,"Elijah, you and I both know what 'nap time' means...",1.2338709677419355,0.0473655162322693,124,101,17,6,False,True,52
813,"Honey, it'll take a lot more than 50 cents to make it all the way to Waterloo.",1.2337662337662338,0.0399390586955991,154,123,26,5,False,True,78
813,Sorry but your little war is already over budget!,1.233644859813084,0.050703809095611,107,87,15,5,False,True,49
813,"If your Dad finds out how much money you spent on this ride, you're gonna learn the hard way what Waterloo means.",1.2335766423357664,0.0442760255276012,137,111,20,6,False,True,113
813,"Ok, I'll catch up with you at Waterloo",1.2335766423357664,0.0442760255276012,137,111,20,6,False,False,38
