contest,caption,mean,precision,votes,not_funny,somewhat_funny,funny,has_question_mark,ends_with_punctuation,caption_length
771,Three more dollars and we can order a pizza.,1.8529680365296803,0.0166980147527292,2190,853,806,531,False,True,44.0
771,"When you told me your ex wanted every last dime, I had no idea she would take it this far.",1.8252753977968177,0.0140221514626852,3268,1385,1069,814,False,True,90.0
771,This is  not what I meant when I said I was looking for change.,1.811171171171171,0.0149089513287945,2775,1167,965,643,False,True,63.0
771,Just admit you never bought a ring.,1.8023907358983935,0.0156228834957924,2677,1191,824,662,False,True,35.0
771,I guess I'm not the only one who thinks you're hiding something.,1.7953216374269003,0.0175097983587173,1881,774,718,389,False,True,64.0
771,Why don’t you just admit you never bought me a ring.,1.7952930728241565,0.0167640565982457,2252,990,733,529,False,True,52.0
771,They're still looking for votes.,1.7925281102647803,0.0157519834863978,2757,1288,753,716,False,True,32.0
771,Just admit that you never actually bought me a ring.,1.7861150070126228,0.0209722243833402,1426,632,467,327,False,True,52.0
771,"Now I think about it, my keys might actually be in my bag.",1.7859042553191489,0.0140050980073985,3008,1278,1096,634,False,True,58.0
771,They're searching for the Republican's moral compass. No luck so far.,1.7849553761155972,0.0172730314329437,2353,1133,593,627,False,True,69.0
771,"You see them too, right?",1.7835443037974683,0.0162465547254059,2370,1053,777,540,True,True,24.0
771,"You know there's a ""find my phone"" app, right?",1.7812,0.0151783654294803,2500,1053,941,506,True,True,46.0
771,Just how lucky is that penny?,1.7806176783812566,0.0176298635952977,1878,799,692,387,True,True,29.0
771,"You know the remote is plastic, right?",1.7769662921348317,0.0187263280703466,1780,798,581,401,True,True,38.0
771,"Throw some of your loose change out the front door. Otherwise,they will never go away.",1.7702926559911651,0.018355782122959,1811,808,611,392,False,True,86.0
771,Dating is such a minefield.,1.7689793866264454,0.0128509113453729,3978,1872,1153,953,False,True,27.0
771,"If they find the keys, will you even remember where you parked?",1.7672012415933782,0.0176032288524213,1933,856,671,406,True,True,63.0
771,I’ll bet they can’t even detect irony.,1.7616640746500778,0.0158579321873432,2572,1211,763,598,False,True,38.0
771,This is not what I expected when you said your friends were into metal.,1.7579729139362168,0.0164192636443441,2289,1050,743,496,False,True,71.0
771,"There never was an engagement ring, was there?",1.7554806070826308,0.0330536775509068,593,282,174,137,True,True,46.0
771,"Honey, the remote is in your hand.",1.7461024498886415,0.0183558308945712,1796,829,594,373,False,True,34.0
771,Not sure your Dad and his friends quite grasp the whole Bitcoin thing.,1.7460661964188822,0.0185579202597476,1843,878,555,410,False,True,70.0
771,"O.K., you win. I pawned it.",1.7411702688455457,0.0177400156772199,1897,875,638,384,False,True,27.0
771,I just wish they were vacuums.,1.7335384615384617,0.0188291429751472,1625,742,574,309,False,True,30.0
771,"This new service is a little pricy, but they always find my keys.",1.7331378299120237,0.018343350265531,1705,777,606,322,False,True,65.0
771,Did you consider just looking under the cushions first?,1.731829573934837,0.0183719888976289,1596,701,622,273,True,True,55.0
771,"When you said you were going to look for an engagement ring, I thought you meant at a jewelry store.",1.7196710075394106,0.0198283437464213,1459,680,508,271,False,True,100.0
771,Isn’t it cheaper just to buy a new remote?,1.7194696441032795,0.0201021291965285,1433,672,491,270,True,True,42.0
771,"When the Yogi said to “seek change,” I don’t think this is what he meant.",1.7191166321601103,0.0204176728543271,1449,698,460,291,False,True,73.0
771,"Don't worry about it, I wasn't going to say 'yes' anyway.",1.7170245398773003,0.0223215077099096,1304,660,353,291,False,True,57.0
771,"You looked under the cushions, right ?",1.713907284768212,0.0189518593833109,1510,687,568,255,True,True,38.0
771,"If you’d bought me a bigger engagement ring, we could have found it on our own.",1.713126843657817,0.02072768563126,1356,645,455,256,False,True,79.0
771,When I said I was looking for change I meant we should go to marriage counseling.,1.7058823529411764,0.0224281016678524,1173,569,380,224,False,True,81.0
771,I can't wait for the beaches to reopen,1.7019230769230769,0.0239844473481906,1040,512,326,202,False,False,38.0
771,You do know Bitcoin is virtual.,1.6952380952380952,0.0235038713276129,1050,513,344,193,False,True,31.0
771,Someone finally invented a vacuum cleaner that looks cool enough for guys to use.,1.6933867735470942,0.0245598997750019,998,500,304,194,False,True,81.0
771,If they don't find it is your proposal still valid?,1.6877551020408164,0.0234692291442462,980,465,356,159,True,True,51.0
771,Maybe you should just buy a new remote.,1.6872294372294372,0.0245163835741601,924,446,321,157,False,True,39.0
771,Next time maybe don't mention a reward.,1.6859099804305284,0.0231699105931393,1022,491,361,170,False,True,39.0
771,I think Alexa heard me say “have you seen my keys?”,1.685904550499445,0.0242817907429869,901,425,334,142,True,False,51.0
771,"shhhhhh, I'm sitting on it.",1.6843718079673136,0.0242591158466495,979,485,318,176,False,True,27.0
771,"Two years of this is enough. Just admit it: you didn't lose the ring, you never bought me one.",1.6829268292682926,0.0253355566713227,943,482,278,183,False,True,94.0
771,You're lucky those aren't lie detectors.,1.6820208023774146,0.0304724863993967,673,351,185,137,False,True,40.0
771,"Sometimes, you have to be the change you want.",1.6766826923076923,0.0288641975390747,832,466,169,197,False,True,46.0
771,Sometimes I feel like we're looking for different things.,1.6746231155778897,0.0268650979836793,796,400,255,141,False,True,57.0
771,Not exactly how I imagined it - but if they find it…’yes’.,1.674563591022444,0.0268192272572697,802,404,255,143,False,True,58.0
771,"I think you might be confused about the term ""bitcoin mining.""",1.6742712294043092,0.027473752286701,789,405,236,148,False,False,62.0
771,It feels like it would have been easier to just buy a new remote.,1.6735187424425635,0.0267239347771857,827,423,251,153,False,True,65.0
771,"If they can't find your wedding ring, maybe they can find you a place to sleep.",1.6671309192200556,0.0292830393932341,718,380,197,141,False,True,79.0
771,Just buy another remote.,1.6658163265306123,0.0273277688900809,784,404,238,142,False,True,24.0
771,Can’t you just admit you never bought me a ring?,1.6612021857923498,0.0287399605039486,732,387,206,139,True,True,48.0
771,"No, I said you've lost your mettle.",1.6588579795021965,0.0281652010833717,683,341,234,108,False,True,35.0
771,"See, they can’t find the remote either.",1.6578581363004172,0.0283130036959064,719,372,221,126,False,True,39.0
771,"When you said your friends were into metal, I thought you meant something else.",1.6575342465753424,0.0292184362870727,657,335,212,110,False,True,79.0
771,"Seriously Daryll, it was just a quarter.",1.654232424677188,0.0290600314308443,697,367,204,126,False,True,40.0
771,I’m beginning to think that there are too many retired guys in our apartment building.,1.653555219364599,0.0286328781630888,661,333,224,104,False,True,86.0
771,"It's alright, I wasn't going to say 'yes' anyway.",1.6531531531531531,0.0301605351375916,666,357,183,126,False,True,49.0
771,"I think we need a better investment strategy.""",1.652032520325203,0.0302499215913341,615,317,195,103,False,False,46.0
771,I told you we shouldn't have bought beachfront property.,1.6519823788546255,0.0274337849909261,681,334,250,97,False,True,56.0
771,"Honestly, Honey, I think you misunderstood me when I said we've lost money in our home.",1.65,0.0290144835182037,660,339,213,108,False,True,87.0
771,Are you sure your dad’s golf buddies understand Bitcoin mining?,1.6455108359133126,0.0303507065172273,646,347,181,118,True,True,63.0
771,What exactly is a chick magnet?,1.6445993031358883,0.0308733892617924,574,295,188,91,True,True,31.0
771,"If you would just put your keys on the hook when you come home, none of this would be necessary",1.6422338568935428,0.0303376583075453,573,290,198,85,False,False,95.0
771,Should we tell them we found it already?,1.641025641025641,0.0300555326776337,585,297,201,87,True,True,40.0
771,What makes you think I'm a gold digger?,1.6393162393162393,0.0309328734583493,585,307,182,96,True,True,39.0
771,It might be cheaper to just buy a new remote.,1.6336448598130842,0.0312051781552195,535,273,185,77,False,True,45.0
771,How long before you tell them Bitcoin is a virtual currency?,1.6310861423220977,0.0338602573784631,534,298,135,101,True,True,60.0
771,Maybe you left them in the car?,1.6275303643724697,0.031487681834622,494,247,184,63,True,True,31.0
771,I told you this discussion was a minefield…,1.6265822784810129,0.0331852624641791,474,245,161,68,False,False,43.0
771,How did we used to find the remote?,1.625,0.0331223203638111,504,269,155,80,True,True,35.0
771,"Next time I loose an ear ring, please don't mention it to your dad's friends",1.625,0.0336656218149779,520,287,141,92,False,False,76.0
771,"Dunno what you Tweeted today, but you should probably delete it.",1.623762376237624,0.0339010385684416,505,277,141,87,False,True,64.0
771,"Trust me, they’ll never find the remote",1.6233766233766234,0.0338796678568745,462,242,152,68,False,False,39.0
771,They’re still not as intrusive as your mother.,1.6224489795918366,0.0326323178133515,490,255,165,70,False,True,46.0
771,"see there's no microchip in the vaccine, idiot",1.621782178217822,0.0340309136001905,505,279,138,88,False,False,46.0
771,I’ve sold the mineral rights to our apartment….,1.618942731277533,0.0368370689891991,454,259,109,86,False,True,47.0
771,Anything you want to share?,1.6181434599156117,0.0340463062914453,474,255,145,74,True,True,27.0
771,Let’s just face it - we lost the remote.,1.6174757281553398,0.0322691917832217,515,274,164,77,False,True,40.0
771,I bet theyre in your other pants…,1.6139088729016786,0.0355179583791144,417,221,136,60,False,False,33.0
771,We should’ve been nicer to grandma. Maybe she would’ve told us where it is.,1.61244019138756,0.0367347108454683,418,230,120,68,False,True,75.0
771,Watch out when the music stops”.,1.6105769230769231,0.0372005701997141,416,232,114,70,False,True,32.0
771,We must be sitting on a fortune.,1.6101694915254237,0.0437714539020887,295,163,84,48,False,True,32.0
771,"...and you checked your pockets, right???",1.6100478468899522,0.0348285301311408,418,219,143,56,True,True,41.0
771,Why not just admit that you never bought the ring?,1.609452736318408,0.0379107942380562,402,225,109,68,True,True,50.0
771,You’re really not going to tell them you already found the remote?,1.6085972850678734,0.0341473640255632,442,234,147,61,True,True,66.0
771,"When I said I wanted to look for engagement rings this weekend, this isn't what I had in mind.",1.608272506082725,0.0370994420997729,411,228,116,67,False,True,94.0
771,"I told them once they found my earring, the spare change is theirs.",1.6075,0.0342643325663223,400,203,151,46,False,True,67.0
771,"Well, then you try to find the remote.",1.6069868995633187,0.0340912093155222,458,247,144,67,False,True,38.0
771,You know we could actually just get up to change the channel ourselves without the remote.,1.60613810741688,0.0377532559990317,391,216,113,62,False,True,90.0
771,The agent did say the place has the feel of a beach-front property.,1.6053921568627452,0.0360217031067164,408,220,129,59,False,True,67.0
771,Why can't you just hang your keys on the hook?,1.6031331592689295,0.037127550691644,383,207,121,55,True,True,46.0
771,You say you met them all at the beach?,1.6030150753768844,0.036566945634561,398,216,124,58,True,True,38.0
771,"It would be cool to put a couch on the beach, you said.",1.599483204134367,0.0377536537529403,387,215,112,60,False,True,55.0
771,The search for illegal ballots is getting a little out of hand.,1.5984455958549222,0.0387162850203323,386,220,101,65,False,True,63.0
771,"See…It’s ok honey, all men have a hard time finding it!",1.5966850828729282,0.040193211731469,362,208,92,62,False,True,55.0
771,"You're right--with these guys and the sun lamp, it really does feel like we're at the beach.",1.5964467005076142,0.0343625442487541,394,203,147,44,False,True,92.0
771,When this is over we either resize my ring or get rid of the shag carpet.,1.594900849858357,0.0360039170501994,353,181,134,38,False,True,73.0
771,Airbnb described this place as ‘a real hidden treasure.’,1.593984962406015,0.0356853568227105,399,215,131,53,False,False,56.0
771,Lets wait a little bit more until we tell we them that bitcoins aren‘t real coins,1.5917808219178082,0.0395838032983161,365,209,96,60,False,False,81.0
771,How long before they discover that metal detectors can detect metal detectors?,1.5913978494623655,0.0391831494106644,372,213,98,61,True,True,78.0
771,How about leave your keys by the front door from now on?,1.5905292479108637,0.0389326918776522,359,201,104,54,True,True,56.0
771,The new find my phone update might be a little too much,1.5894428152492668,0.0369766970772905,341,178,125,38,False,False,55.0
771,Breathe! I promise they will find the remote before kickoff.,1.5887573964497042,0.0395128267952159,338,187,103,48,False,True,60.0
771,Are you sure you’re not sitting on it?,1.5887323943661973,0.037841301629245,355,193,115,47,True,True,38.0
771,"The ad just said ‘Family of golden retrievers looking for good home’, so I thought why not?",1.5880758807588076,0.0390799708603667,369,211,99,59,True,True,91.0
771,"Actually, Craig, the change I was looking for was a new boyfriend.",1.5872576177285318,0.0389834455400472,361,204,102,55,False,True,66.0
771,"Oh for crying out loud, Carl, it's been in your damn hand the entire time.",1.587209302325581,0.0409005722665951,344,199,88,57,False,True,74.0
771,The listing said the property was a gold mine,1.5865102639296187,0.0383705037743017,341,185,112,44,False,False,45.0
771,"You know, we may be sitting on a gold mine here.",1.5855072463768116,0.0366860646935875,345,181,126,38,False,True,48.0
771,Do you ever get the feeling that you’re sitting on a gold mine?,1.5852941176470587,0.0393560951590597,340,189,103,48,True,True,63.0
771,The IRS is really taking audits to the next level.”,1.5847953216374269,0.039833059534233,342,193,98,51,False,False,51.0
771,"While we're waiting for one of them to find the ring, are you at all interested in my answer?",1.5847457627118644,0.0391934688419015,354,200,101,53,True,True,93.0
771,This happens every time we bring the couch to the beach.,1.5843023255813953,0.0392263684902434,344,192,103,49,False,True,56.0
771,"Maybe I shouldn't have listed the place as a ""hidden treasure.""",1.583815028901734,0.0399032679070415,346,197,96,53,False,False,63.0
771,"Ignore them.  The good stuff is under the cushions.""",1.5823529411764703,0.0395943027693536,340,191,100,49,False,False,52.0
771,We've been dating 2 years and my team sees no evidence of a ring.,1.5818181818181818,0.0409758136910543,330,189,90,51,False,True,65.0
771,"Oh, they're in my purse.",1.5813953488372092,0.0422584745415788,301,170,87,44,False,True,24.0
771,"When it stops raining, they'll go back to the beach.",1.5811965811965811,0.0375735228172422,351,191,116,44,False,True,52.0
771,They're checking for conversational landmines.,1.5807453416149069,0.0417771262126592,322,186,85,51,False,True,46.0
771,I told you bringing the sofa to the beach was a bad idea.,1.5804416403785488,0.0415814078467819,317,181,88,48,False,True,57.0
771,You’re sure this is how to mine Bitcoin?,1.5763239875389408,0.0419050883795732,321,187,83,51,True,True,40.0
771,Did you really have to tell everyone that you got rich mining bitcoin from home?,1.5760517799352751,0.0419473523846165,309,177,86,46,True,True,80.0
771,So this is Android's version of find my iPhone,1.5759493670886076,0.0417106115687477,316,182,86,48,False,False,46.0
771,Why don't you tell them you found it?,1.5757575757575757,0.0432632224546549,297,172,79,46,True,True,37.0
771,"Next time, read the entire invitation and make sure it doesn't mention a theme.",1.57566765578635,0.0387836644209078,337,187,106,44,False,True,79.0
771,You're probably sitting on them.,1.575221238938053,0.0390617852224721,339,190,103,46,False,True,32.0
771,THIS is your plan for retirement?,1.5751445086705202,0.0391055908763239,346,196,101,49,True,True,33.0
771,So…you still can’t find the remote?,1.575,0.0413098620452109,320,184,88,48,True,True,35.0
771,"When you said you needed change, I thought you meant something else.",1.5741324921135649,0.0404013781648375,317,178,96,43,False,True,68.0
771,"That’s not how Bitcoin mining works, Kenny.",1.5739644970414202,0.0402626540223204,338,195,92,51,False,True,43.0
771,"Alright fine then, next week we'll hang out with YOUR friends",1.573717948717949,0.0418943593851509,312,180,85,47,False,False,61.0
771,"If they don't find it, we'll try a colonoscopy.",1.5736196319018405,0.042093978862574,326,193,79,54,False,True,47.0
771,"You know, we can just buy another remote.",1.5723905723905724,0.0424869572431501,297,170,84,43,False,True,41.0
771,Sure you're not sitting on it?,1.5723076923076924,0.0379371661789611,325,175,114,36,True,True,30.0
771,This isn't what I expected when you said your friends were into heavy metal.,1.5718390804597702,0.0383073781883048,348,195,107,46,False,True,76.0
771,Your realtor sure does a thorough appraisal.,1.5709779179810726,0.0416359011603892,317,184,85,48,False,True,44.0
771,Next time hang your keys on the hook.,1.5694915254237287,0.0407931035131286,295,163,96,36,False,True,37.0
771,"We can’t do this every time that you lose your airpods, Steve.",1.5689655172413792,0.0427433953748474,290,166,83,41,False,True,62.0
771,"The Airbnb host did describe this place as a ""Hidden Treasure"".",1.568561872909699,0.0414849288559744,299,169,90,40,False,True,63.0
771,"John, the remote is made of plastic.",1.5672131147540984,0.0424233729283313,305,178,81,46,False,True,36.0
771,"All I said at group was ""money burns a hole in your pocket"" and their eyes lit up.",1.5664335664335665,0.0414788817967569,286,159,92,35,False,True,82.0
771,"When they said that marriage was full of land mines, I thought they were speaking metaphorically.",1.5663082437275986,0.0452087031625203,279,166,68,45,False,True,97.0
771,Lost your wedding ring somewhere in the apartment. Still sticking with that story?,1.5659722222222223,0.0429881228276067,288,166,81,41,True,True,82.0
771,I tried explaining mining cryptocurrency to my dad and his friends,1.5649350649350648,0.0403175582941646,308,173,96,39,False,False,66.0
771,The co-op board leased the mineral rights of units 4J to 4Q,1.564625850340136,0.0434024719120914,294,173,76,45,False,False,59.0
771,"You realize that the remote is in your hand, right.",1.5638629283489096,0.0407939137522919,321,186,89,46,False,True,51.0
771,...and if they don't find the remote?,1.5633333333333332,0.0394777312821661,300,164,103,33,True,True,37.0
771,Just how much plutonium did you spill?,1.5628930817610065,0.043896362549176,318,197,63,58,True,True,38.0
771,Humor me and just check under the cushions,1.5620689655172413,0.0419348815107993,290,165,87,38,False,False,42.0
771,"They overheard me saying, 'You're sitting on a gold mine.'",1.562043795620438,0.0409515661184327,274,149,96,29,False,False,58.0
771,"Next time you lose your keys, keep it off Twitter.",1.561837455830389,0.0421325622539402,283,160,87,36,False,True,50.0
771,Not what I expected when you told me you had a beach house.,1.5608108108108107,0.0398843675362642,296,163,100,33,False,True,59.0
771,"It's not going to work, the remote is plastic.",1.56,0.0439822610076425,275,160,76,39,False,True,46.0
771,I asked them to try to find your magnetic  personality.,1.5591397849462365,0.0432037135164615,279,161,80,38,False,True,55.0
771,You can’t just get up and look for them yourself?,1.5590277777777777,0.0424571542496951,288,166,83,39,True,True,49.0
771,Maybe next time I lose an earring you will be a little more supportive.,1.55893536121673,0.0435748541509499,263,149,81,33,False,True,71.0
771,I thought we decided on the Roomba.,1.558303886925795,0.0409440487740505,283,157,94,32,False,True,35.0
771,"No, I said the irony was lost on you.",1.5580524344569289,0.044690838980266,267,156,73,38,False,True,37.0
771,I guess they can’t find any magnetism between us either.,1.556701030927835,0.0418516830284676,291,167,86,38,False,True,56.0
771,A normal person finds their own car keys.,1.556701030927835,0.0421338683576085,291,168,84,39,False,True,41.0
771,The new find my remote feature is really nice.,1.555956678700361,0.0425447944386506,277,158,84,35,False,True,46.0
771,"I'm not walking barefoot until we have three negative Lego sweeps.""",1.5543478260869563,0.0459398676981098,276,169,61,46,False,False,67.0
771,Should I tell them I just vacuumed?,1.5539568345323742,0.0408800304376145,278,154,94,30,True,True,35.0
771,This vacation rental is a little too close to the beach.,1.5536912751677852,0.0405653641892236,298,169,93,36,False,True,56.0
771,Will you marry me when they find it?,1.5535714285714286,0.04370167634372,280,165,75,40,True,True,36.0
771,"No, I haven't looked under the cushions.  I thought you had.",1.5534351145038168,0.0447193825499062,262,153,73,36,False,True,60.0
771,"If you had purchased the larger ring,this wouldn’t be necessary.",1.5533333333333332,0.0419888325476457,300,176,82,42,False,True,64.0
771,I hope they find the ring soon otherwise the answer is NO.,1.5528169014084507,0.0446467003982758,284,172,67,45,False,True,58.0
771,You're the one who wanted a beach house.,1.5522388059701493,0.0426674747099894,268,152,84,32,False,True,40.0
771,Shall we just get it over with and hand them some nickels?,1.552188552188552,0.0417779128402348,297,173,84,40,True,True,58.0
771,Wouldn't it be easier to just buy another remote?,1.5513307984790874,0.0465101476290405,263,160,61,42,True,True,49.0
771,When are you going to just admit you didn't actually get me an engagement ring.,1.5513307984790874,0.0452448189078851,263,156,69,38,False,True,79.0
771,I'd probably look between the cushions first,1.551155115511551,0.0406164516901487,303,174,91,38,False,False,44.0
771,They'll never find it.  I'm sitting on it.,1.551094890510949,0.0435369534784489,274,160,77,37,False,True,42.0
771,"Thank your friends for finding my keys...and molly's old dog tag, the lost nail clippers, and the 53 cents but tell them it's time to go.",1.55,0.0428293987685272,280,163,80,37,False,True,137.0
771,.. so you lost your Bitcoins in this room ?,1.549618320610687,0.0450619314297725,262,155,70,37,True,True,43.0
771,I've invited them to stay until they find the engagement ring you promised me.,1.5494505494505495,0.0460668062209883,273,168,60,45,False,True,78.0
771,Now I'm convinced that there is a national coin shortage.,1.5487364620938628,0.0410121604208107,277,155,92,30,False,True,57.0
771,OK--I'm finally getting the hint that you're looking for a ring!,1.5476190476190477,0.0457565968109479,252,149,68,35,False,True,64.0
771,Well this is one first date I’ll never forget “,1.5475285171102662,0.043959391963039,263,153,76,34,False,False,47.0
771,"Honey, I told you not to invite them over. They are not your real friends. They are gold-diggers.",1.547244094488189,0.0461611962623176,254,152,65,37,False,True,97.0
771,Now do you understand when I say my family is always hovering?,1.5471698113207548,0.0433813084956383,265,153,79,33,True,True,62.0
771,They go away when the tide comes in,1.546816479400749,0.0431381426957033,267,154,80,33,False,False,35.0
771,I hired them to look for that ring you promised me.,1.546816479400749,0.0450539796844072,267,160,68,39,False,True,51.0
771,Watch what happens when I turn on my vibrator.,1.5465587044534412,0.047520838164808,247,150,59,38,False,True,46.0
771,I wish you would just hang you keys on the hook by the door.,1.546468401486989,0.0435403285348116,269,157,77,35,False,True,60.0
771,This was once beachfront property.,1.546468401486989,0.0412500170205733,269,150,91,28,False,True,34.0
771,....and you thought beachfront property would be peaceful..,1.5461254612546125,0.0423405419692593,271,155,84,32,False,True,59.0
771,The broker did say we were sitting on a gold mine.,1.5454545454545454,0.0435153182368106,253,144,80,29,False,True,50.0
771,Seriously? THIS is your way of telling me you lost your wedding ring?!,1.544776119402985,0.0396443406550982,268,145,100,23,True,True,70.0
771,"If your penny is really that lucky, how did you lose it in the first place?",1.5444015444015444,0.0471001253795744,259,160,57,42,True,True,75.0
771,Maybe we should look under the cushions.,1.5436507936507935,0.0418006461515207,252,139,89,24,False,True,40.0
771,The realtor was right.  We're sitting on a goldmine.,1.542857142857143,0.0438220801338771,245,139,79,27,False,True,52.0
771,Isn't the remote plastic?,1.5426356589147288,0.0439421363461601,258,150,76,32,True,True,25.0
771,If they don’t find my IUD you’re on your own tonight.,1.541501976284585,0.0459840623788677,253,152,65,36,False,True,53.0
771,We haven’t left in 18 months. Why do you even need your keys.,1.541501976284585,0.0459840623788677,253,152,65,36,False,True,61.0
771,I miss the old days when all we had to do to find loose change was dig in the cushions.,1.5413223140495869,0.0430496950027799,242,135,83,24,False,True,87.0
771,"Babe, I don’t think this is how crypto mining works.",1.5407725321888412,0.0434095771619327,233,129,82,22,False,True,52.0
771,The lie detector test is next.,1.5403225806451613,0.044918914327179,248,145,72,31,False,True,30.0
771,Your new Locate Phone App is a bit extreme,1.5394736842105263,0.0474736060679104,228,135,63,30,False,False,42.0
