contest,caption,mean,precision,votes,not_funny,somewhat_funny,funny,has_question_mark,ends_with_punctuation,caption_length
813,"C’mon pumpkin, the most successful generals win the hearts and minds at home first.",1.1538461538461535,0.043986558394954,91,79,10,2,False,True,83
813,I know they're coming; it's a dinner party.,1.1538461538461535,0.0404632223345296,104,90,12,2,False,True,43
813,I returned from my time-out to fulfill my glorious purpose,1.1538461538461535,0.043986558394954,91,79,10,2,False,False,58
813,"Better dismount, little General, or Josephine will banish you to a small Mediterranean island.",1.1538461538461535,0.043986558394954,91,79,10,2,False,True,94
813,We have not time to cross the Alps today!,1.1538461538461535,0.041117114140373,91,78,12,1,False,True,41
813,"Mom, history is written by the winners. If you want to be a winner, I will need two quarters.",1.1538461538461535,0.0380317871133111,91,77,14,0,False,True,93
813,"Sorry, Mom.  Can't come home until after we invade Russia!",1.1538461538461535,0.0466799481965538,91,80,8,3,False,True,58
813,I'll meet you at the Old North Church.,1.1538461538461535,0.043986558394954,91,79,10,2,False,True,38
813,"Napoleon,no,you may not go to Russia . Russian Winters are very very cold.",1.1538461538461535,0.0355507998070557,104,88,16,0,False,True,74
813,"Ok you win, I can’t think of one.",1.1538461538461535,0.0485450073770014,78,68,8,2,False,True,33
813,"OK,I bought some water; now where’s the loo?",1.1538461538461535,0.0380317871133111,91,77,14,0,True,True,44
813,It’s time to quit- Remember the pigeons?,1.1538461538461535,0.0466799481965538,91,80,8,3,True,True,40
813,"Oh honey, you’re too small for that complex.",1.1538461538461535,0.041117114140373,91,78,12,1,False,True,44
813,"Mom, l need 50 cents therefore l can conquer Russia",1.1538461538461535,0.0492261902632449,91,81,6,4,False,False,51
813,"Let's go get you a napoleon, Bonaparte.",1.153061224489796,0.0393296469210688,98,84,13,1,False,True,39
813,History is written by quarters.,1.153061224489796,0.0419191431527499,98,85,11,2,False,True,31
813,"No, you cannot go to Elba!",1.153061224489796,0.0393296469210688,98,84,13,1,False,True,26
813,You can ride that thing to Elba for all I care.,1.153061224489796,0.0365571838523037,98,83,15,0,False,True,47
813,I'm running away from home. Try and catch me.,1.153061224489796,0.0393296469210688,98,84,13,1,False,True,45
813,"Nap time for Napoleon, Giddy Up Sir !!",1.153061224489796,0.0419191431527499,98,85,11,2,False,True,38
813,I'm not spending 50 cents just so you can neat your Waterloo.,1.153061224489796,0.0419191431527499,98,85,11,2,False,True,61
813,"Hey Jimmy, your mom is waiting for you outside.",1.153061224489796,0.0393296469210688,98,84,13,1,False,True,47
813,Good luck as You aren’t going to get far with 50c ! And I’m not going to give it to you anyway !,1.153061224489796,0.0419191431527499,98,85,11,2,False,True,96
813,"In Where The Wild Things Are Part II, Max leads readers on another imaginary adventure –– this time, in a Kmart.",1.152941176470588,0.0426892961903475,85,73,11,1,False,True,112
813,"Keep pointing at UFO's,and nobody's going to believe you're Napoleon.",1.152941176470588,0.0426892961903475,85,73,11,1,False,True,69
813,I remember when 50 cents could take people places.,1.152941176470588,0.0426892961903475,85,73,11,1,False,True,50
813,"You may go onward, but not upward.",1.152941176470588,0.0426892961903475,85,73,11,1,False,True,34
813,"Enjoy, Emmanuel! Your chauffeur will bring you back to l'Élysée when it's over.",1.152941176470588,0.045852895808718,85,74,9,2,False,True,79
813,"Im your mom! Not Marie Louise,and for the last time let",1.1523809523809525,0.0377502695838623,105,90,14,1,False,False,55
813,"OK! OK! I have the provisions for the troops at Valley Forge.
Jeez, Billy, ease up on the History Channel, will you.",1.1523809523809525,0.0401027809111097,105,91,12,2,False,True,116
813,Quando linguam Latinam disces?,1.1523809523809525,0.0352410651159141,105,89,16,0,True,True,30
813,"More quarters, NOW, Queen Mother, or I'll have you guillotined,  into bite sized M&Ms !",1.1523809523809525,0.0377502695838623,105,90,14,1,False,True,87
813,Don’t act up or when we get home you’re exiled.,1.1521739130434785,0.0487168918255152,92,82,6,4,False,True,47
813,"No more rides, hun. All I've got left are francs.",1.1521739130434785,0.0407020996930237,92,79,12,1,False,True,49
813,We agreed to divide up the dollar-based order.,1.1521739130434785,0.0376532784254103,92,78,14,0,False,True,46
813,"Hey Napoleon, if you want some ice cream, you better help with these bags.",1.1521739130434785,0.043537942793157,92,80,10,2,False,True,74
813,"You can ride it again, it's your allowance.",1.1518987341772151,0.0444542352441043,79,68,10,1,False,True,43
813,Ok mom…so… you go get your prescription refills and I’ll hold them off here…oh and maybe pick up a roll of quarters…!,1.1518987341772151,0.0479661232117135,79,69,8,2,False,True,117
813,"Come along, now — all that crusading is going to make you hungry.",1.1518987341772151,0.0479661232117135,79,69,8,2,False,True,65
813,"OK, I see we're going to need another little conversation about cultural appropriation son!",1.1517857142857142,0.040527850483687,112,98,11,3,False,True,91
813,You're going to be exiled to your room for the rest of the day if you don't get off of there right now!,1.1515151515151516,0.0415223508511923,99,86,11,2,False,True,103
813,The reason most people fail instead of succeed is that they trade what they want most for what they want at the moment.,1.1515151515151516,0.0415223508511923,99,86,11,2,False,True,119
813,"C'mon shorty, time to go!",1.1515151515151516,0.0389610389610389,99,85,13,1,False,True,25
813,Come on General. The British already left.,1.1515151515151516,0.0439345955198796,99,87,9,3,False,True,42
813,"”You might want to come home soon, Emperor, I’m making Chicken Marengo for dinner",1.1515151515151516,0.0415223508511923,99,86,11,2,False,False,81
813,You can wait to conquer other lands until after you do your homework when we get home.,1.1515151515151516,0.0389610389610389,99,85,13,1,False,True,86
813,You’re still mowing the yard.,1.1515151515151516,0.0389610389610389,99,85,13,1,False,True,29
813,The Ice Cream Shoppe is this way.,1.1515151515151516,0.0439345955198796,99,87,9,3,False,True,33
813,Vote for Pedro!,1.1515151515151516,0.0462211179741614,99,88,7,4,False,True,15
813,let's go now or waterloo awaits,1.1515151515151516,0.0439345955198796,99,87,9,3,False,False,31
813,Forget Moscow; you have homework to do Napoleon,1.1515151515151516,0.0389610389610389,99,85,13,1,False,False,47
813,"For the last time Napoleon, you can’t be the emperor of France when you grow up!",1.1515151515151516,0.0389610389610389,99,85,13,1,False,True,80
813,No taxation without representation!,1.1511627906976745,0.0453514678811848,86,75,9,2,False,True,35
813,I'm going to be elected President again in 2024!,1.1511627906976745,0.0453514678811848,86,75,9,2,False,True,48
813,"For your information, I am not Jose'phine Bonaparte!
And I'm not going to give you a half-dollar, buckaroo!",1.1511627906976745,0.0453514678811848,86,75,9,2,False,True,107
813,"Good, get that Napoleon complex out of the way now before you get older.",1.1511627906976745,0.0453514678811848,86,75,9,2,False,True,72
813,You can invade Russia but I'm going home.,1.1511627906976745,0.0453514678811848,86,75,9,2,False,True,41
813,"Yes, you're short and you have great ambition, but I know Napoleon, and you're no Napoleon.",1.1511627906976745,0.0510289257325016,86,77,5,4,False,True,91
813,Come along dear. You know this ride doesn't end well!,1.1511627906976745,0.0453514678811848,86,75,9,2,False,True,53
813,"For the last time, no.  We’re going to Safeway, not Austerlitz.",1.1511627906976745,0.0453514678811848,86,75,9,2,False,True,63
813,"I told your father that naming you Napoleon was a mistake, let's go!",1.150943396226415,0.0374200623412415,106,91,14,1,False,True,68
813,Galaxy supper is served at 6:00.,1.150943396226415,0.039748655133722,106,92,12,2,False,True,32
813,Let’s go. You’re not China.,1.150943396226415,0.0374200623412415,106,91,14,1,False,True,27
813,".....
I’ll go for five:  Kehinde Wiley.
.....",1.150943396226415,0.0374200623412415,106,91,14,1,False,True,45
813,And I thought Napoleon complexes were over.,1.1506849315068493,0.0503837362801687,73,64,7,2,False,True,43
813,"You and Biden really know how to deal with the Russians, don't you?",1.1505376344086022,0.0402953001061551,93,80,12,1,True,True,67
813,"I hope you realize that if you keep this up, you’re headed for a long “time-out” on the coin-operated island of St. Helena on the other side of the parking lot.",1.1505376344086022,0.0457298523071995,93,82,8,3,False,True,160
813,Men are ruled by toys!,1.1505376344086022,0.0430983213285818,93,81,10,2,False,True,22
813,It doesn't take francs.,1.1505376344086022,0.0457298523071995,93,82,8,3,False,True,23
813,Is this ride only for short kids?,1.1505376344086022,0.0430983213285818,93,81,10,2,True,True,33
813,Let’s go Chad!  You can storm the Capital another day!,1.1505376344086022,0.0482179788329505,93,83,6,4,False,True,54
813,"Time for you to get off your high horse and mow the lawn,if you want more quarters to ride.",1.1505376344086022,0.0372821286938999,93,79,14,0,False,True,91
813,Oh yeah? If you don,1.1505376344086022,0.0402953001061551,93,80,12,1,True,False,19
813,You're not short enough for that gesture.,1.1505376344086022,0.0430983213285818,93,81,10,2,False,True,41
813,I invested the 50 cents inside because you said an army marches on it's stomach.,1.1505376344086022,0.0402953001061551,93,80,12,1,False,True,80
813,Time's up. Get off the throne or throw in two more quarters.,1.1505376344086022,0.0372821286938999,93,79,14,0,False,True,60
813,Let’s Joey.  You already have a tricycle.,1.1505376344086022,0.0430983213285818,93,81,10,2,False,True,41
813,You how can you play with the machine all the time.  Just leave it alone.,1.1505376344086022,0.0372821286938999,93,79,14,0,False,True,73
813,"C’mon general, before you get yourself blown apart.",1.1505376344086022,0.0430983213285818,93,81,10,2,False,True,51
813,50 cents for directions to Mall's Water-Loo,1.1505376344086022,0.0482179788329505,93,83,6,4,False,False,43
813,Waterloo’s the other way.,1.15,0.0411329453348431,100,87,11,2,False,True,25
813,Damn inflation!  This used to be a quarter!,1.15,0.0439360870678698,80,69,10,1,False,True,43
813,"No, we live by my Code, Napoleon!",1.15,0.0385992097056273,100,86,13,1,False,True,33
813,"I don’t care how much of the known world you’ve conquered, I won’t buy Poptarts for breakfast.",1.15,0.0474007958059564,80,70,8,2,False,True,94
813,I'm not tall enough for other rides.,1.15,0.0401736736014135,80,68,12,0,False,True,36
813,You check in with the Calvary and I will pull the car around.,1.15,0.0439360870678698,80,69,10,1,False,True,61
813,"Weeeeeeee!”
“He really is little.",1.15,0.0385992097056273,100,86,13,1,False,True,33
813,"Text me when you’re ready to come home, ok?",1.1495327102803738,0.0394006819698034,107,93,12,2,True,True,43
813,"Hurry up, you don't do well when it gets cold",1.1495327102803738,0.0394006819698034,107,93,12,2,False,False,45
813,"Hey Napoleon,let go home.  I need some corn that needs shucked.",1.1495327102803738,0.0415782332830623,107,94,10,3,False,True,63
813,Do you need another 50 cents for your left wing thoughts?,1.1495327102803738,0.0394006819698034,107,93,12,2,True,True,57
813,Napoleon must be turning in his grave.,1.1494252873563218,0.0417754067801899,87,75,11,1,False,True,38
813,I still want to go to Russia.,1.1494252873563218,0.0417754067801899,87,75,11,1,False,True,29
813,"Yes, that is the way to Alba, good luck get over Styx .",1.1494252873563218,0.0448608160649388,87,76,9,2,False,True,55
813,"Next quarter, you're taking Spanish.",1.1494252873563218,0.0417754067801899,87,75,11,1,False,True,36
813,We've already sent a sizeable donation to Ukraine,1.1494252873563218,0.0448608160649388,87,76,9,2,False,False,49
813,"“Our trains here”, she was overheard to say, that day at Waterloo station",1.1494252873563218,0.0448608160649388,87,76,9,2,False,False,73
813,I'm done with funding trans-Alpine expansionism,1.1494252873563218,0.0417754067801899,87,75,11,1,False,False,47
813,Napoleon Piaffing the Alps,1.1494252873563218,0.0417754067801899,87,75,11,1,False,False,26
813,"Remember,Waterloo came next.",1.1494252873563218,0.0477472619568306,87,77,7,3,False,True,28
813,"One way or the other, it's Nap time.",1.1494252873563218,0.0417754067801899,87,75,11,1,False,True,36
813,The children are coming!,1.1494252873563218,0.0477472619568306,87,77,7,3,False,True,24
813,I  said go west young man,1.1494252873563218,0.0477472619568306,87,77,7,3,False,False,25
813,The real enemy is your unwashed laundry.,1.1494252873563218,0.0448608160649388,87,76,9,2,False,True,40
813,I'll meet you at Waterloos...I mean at Walgreens,1.1494252873563218,0.0417754067801899,87,75,11,1,False,False,48
813,No one likes a little Napoleon!,1.1494252873563218,0.0477472619568306,87,77,7,3,False,True,31
813,My Josephine is THAT way!,1.1494252873563218,0.0417754067801899,87,75,11,1,False,True,25
813,All roads lead to Rome but yours might be the more scenic route,1.1494252873563218,0.0417754067801899,87,75,11,1,False,False,63
813,"After you conquer Europe, you can conquer your homework.",1.149122807017544,0.0378601192027208,114,99,13,2,False,True,56
813,I’m going to seize the vegetable assets because they’re good for you,1.149122807017544,0.0378601192027208,114,99,13,2,False,False,68
813,This motherfucker…,1.148936170212766,0.0452690849254874,94,83,8,3,False,False,18
813,"Is that the ""1812 Overture?""",1.148936170212766,0.0426674284505853,94,82,10,2,True,False,28
813,Oh good grief.  Get over yourself.,1.148936170212766,0.0426674284505853,94,82,10,2,False,True,34
813,Pony riding complex,1.148936170212766,0.0426674284505853,94,82,10,2,False,False,19
813,"For fifty cents' more, you'll receive a print of Grant 




Wood's famous Painting.""",1.148936170212766,0.0426674284505853,94,82,10,2,False,False,84
813,I wouldn't be in any hurry... Waterloo's that way.,1.148936170212766,0.0398964766762762,94,81,12,1,False,True,50
813,"Get in the car, you little autocrat!",1.148936170212766,0.0426674284505853,94,82,10,2,False,True,36
813,If you help me with the shopping I’ll buy you a real one.,1.148936170212766,0.0398964766762762,94,81,12,1,False,True,57
813,"Think of your room as ""Rubicon""",1.148648648648649,0.0458674766038889,74,64,9,1,False,False,31
813,Ready for your victory dish?,1.148648648648649,0.0458674766038889,74,64,9,1,True,True,28
813,"You're already too tall for that . .and he ends up poisoned on this crappy island, peeing every twenty minutes",1.1485148514851484,0.0431119624892619,101,89,9,3,False,False,110
813,"The Invasion Of Shop Rite, 1998",1.1485148514851484,0.0355609603882534,101,86,15,0,False,False,31
813,"No, that's not a ""MAGA"" hat and you're too young to vote for Trump!",1.1485148514851484,0.0382439760709465,101,87,13,1,False,True,67
813,"I've told you once and I've told you twice.  Now get off 
your damned high horse and help me carry these bags.",1.1485148514851484,0.0382439760709465,101,87,13,1,False,True,110
813,Something tells me you didn't watch Napoleon Dynamite.,1.1485148514851484,0.0431119624892619,101,89,9,3,False,True,54
813,Give me climatic stability or give me death,1.1485148514851484,0.0382439760709465,101,87,13,1,False,False,43
813,"Let’s hop along now, Cassidy.",1.148148148148148,0.0468485579284204,81,71,8,2,False,True,29
813,"Honey, relax, the doctor says you’re still growing.",1.148148148148148,0.0500342818003937,81,72,6,3,False,True,51
813,"You can conquer Trafalgar another time Little Napoleon, come on and get in the car.",1.148148148148148,0.0412147135853814,108,95,10,3,False,True,83
813,"While escaping here seems like a great option, you won't get very far on that!",1.148148148148148,0.0434297755539206,81,70,10,1,False,True,78
813,"You better get used to this ride.  This is what adulthood feels like.  You invest time, money, effort.  You even disguise your identity.  The result is plenty of activity but you go nowhere.""",1.148148148148148,0.0434297755539206,81,70,10,1,False,False,191
813,"For the last time, you were named after Napoleon Dynamite.",1.148148148148148,0.0397177973880133,81,69,12,0,False,True,58
813,"That ride is a little complex for you, isn't it?",1.148148148148148,0.0434297755539206,81,70,10,1,True,True,48
813,When you remember the Alamo but forgot the milk.,1.148148148148148,0.0367765153714786,108,93,14,1,False,True,48
813,We can be Napoleon just for one day,1.148148148148148,0.0434297755539206,81,70,10,1,False,False,35
813,"I said, ""Time for your Nap, Leon.""",1.1477272727272727,0.0380417081484083,88,75,13,0,False,False,34
813,We have “a land war in Asia” at home.,1.1477272727272727,0.0472320930979117,88,78,7,3,False,True,37
813,Did you forget to buy the brancy?,1.1477272727272727,0.0443805993487705,88,77,9,2,True,True,33
813,Running late for Austerlitz?  You were the one who insisted on being paid your allowance in francs.,1.1477272727272727,0.0413328510836402,88,76,11,1,True,True,99
813,"Why do I have to wear this silly hat again?""",1.1477272727272727,0.0443805993487705,88,77,9,2,True,False,44
813,"Lower the minimum age for employment,"" they said. ""Apply for an internship at Blackwater,"" they said",1.1477272727272727,0.0443805993487705,88,77,9,2,False,False,100
813,"Alright, time to cross the Aldi.",1.1477272727272727,0.0380417081484083,88,75,13,0,False,True,32
813,"Get your buns in the car, Little Napoleon, or when we get home you'll learn about ""Bonaparte's Retreat!""",1.1477272727272727,0.0380417081484083,88,75,13,0,False,False,104
813,Hey there “pirate”,1.1477272727272727,0.0413328510836402,88,76,11,1,False,False,18
813,Imperialism Summer Sales 2022,1.1477272727272727,0.0443805993487705,88,77,9,2,False,False,29
813,"You climb off that horse this instant or I will exile you to Elba, young man.",1.1477272727272727,0.0413328510836402,88,76,11,1,False,True,77
813,Help me with the bags or you’ll face your Waterloo.,1.1473684210526316,0.0365610782362717,95,81,14,0,False,True,51
813,"No, you're not Napoleon or Pegasus. C'mon home and  eat dinner.",1.1473684210526316,0.0395053997262686,95,82,12,1,False,True,63
813,J'en ai marre de ce petit morveux de merde !,1.1473684210526316,0.0365610782362717,95,81,14,0,False,True,44
813,"The second your ride ends, it's on to the Battle of the New England Thruway at rush hour.",1.1473684210526316,0.0395053997262686,95,82,12,1,False,True,89
813,You'll never get anywhere in life.,1.1473684210526316,0.0422450088562631,95,83,10,2,False,True,34
813,"Some Emperor you are, Napoleon!",1.1473684210526316,0.0422450088562631,95,83,10,2,False,True,31
813,Wouldn’t you rather be doing the downward dog?,1.1473684210526316,0.0448174624337348,95,84,8,3,True,True,46
813,Which way is to France?,1.1470588235294117,0.0403754915644375,102,89,11,2,True,True,23
813,"Wish, you could give me a ride home!",1.1470588235294117,0.0378951614101994,102,88,13,1,False,True,36
813,It's going to cost more than that to take the Ukraine!,1.1470588235294117,0.0378951614101994,102,88,13,1,False,True,54
813,"Oh yeah, you look like the conquering hero now, but do not forget what I said about going east into the Russian winter  Mr. Smarty-Pants.",1.1470588235294117,0.0403754915644375,102,89,11,2,False,True,137
813,"It's not that we have to go, it's more that your particular style of leadership does not inspire me to stay.",1.1470588235294117,0.0427120285146335,102,90,9,3,False,True,108
813,You can cross the Alps after you help me make dinner.,1.1470588235294117,0.0403754915644375,102,89,11,2,False,True,53
813,Encourage the youth they said.,1.1470588235294117,0.0427120285146335,102,90,9,3,False,True,30
813,Keep in France and be home for dinner,1.1466666666666667,0.0411253120509898,75,64,11,0,False,False,37
813,So reincarnation is true,1.1466666666666667,0.0526533225197837,75,67,5,3,False,False,24
813,"Moscow, sure. But first we have to stop at the dry cleaners.",1.1466666666666667,0.0411253120509898,75,64,11,0,False,True,60
813,Napoleon Kaufman averaged 4.9 yards per carry in a truncated NFL career,1.146341463414634,0.0429349038421541,82,71,10,1,False,False,71
813,Maybe you'll get your bit of colored ribbon once we fight our way home.,1.146341463414634,0.0494533539048636,82,73,6,3,False,True,71
813,"So, let me get this straight -you're Napoleon, I'm Wellington and you are pointing at Waterloo?",1.146341463414634,0.0429349038421541,82,71,10,1,True,True,95
813,"Cavalry also ride on their stomach, young man.",1.146341463414634,0.0463089633892549,82,72,8,2,False,True,46
813,"The rest of us are having Pizza tonight, what are your plans?",1.146341463414634,0.0463089633892549,82,72,8,2,True,True,61
813,You've met your Waterloo.,1.146341463414634,0.0392720237024104,82,70,12,0,False,True,25
813,Get off of there or you'll develop a complex!,1.146341463414634,0.0429349038421541,82,71,10,1,False,True,45
813,"Waterloo,promise to love you forevermore",1.146341463414634,0.0463089633892549,82,72,8,2,False,False,40
813,"I left your selfie stick at home, Little Corporal.",1.146341463414634,0.0429349038421541,82,71,10,1,False,True,50
813,I knew this was the wrong complex.,1.146067415730337,0.0408994937600029,89,77,11,1,False,True,34
813,The quarters are in -- you'll hear ABBA singing in a moment.,1.146067415730337,0.0408994937600029,89,77,11,1,False,True,60
813,Josephine will be waiting in the car,1.146067415730337,0.043910490827793,89,78,9,2,False,False,36
813,Have you made it to Moscow yet?,1.146067415730337,0.0376484524902597,89,76,13,0,True,True,31
813,"Just pretend Mom, it's cheap! I can show a picture to my French history class for extra credit.",1.146067415730337,0.0376484524902597,89,76,13,0,False,True,95
813,You have just wasted your 50 cents,1.146067415730337,0.0408994937600029,89,77,11,1,False,False,34
813,Wait here when you're done. I'm going to the throne.,1.146067415730337,0.0408994937600029,89,77,11,1,False,True,52
813,Keep it up and you're going back to the nuthouse.,1.146067415730337,0.0408994937600029,89,77,11,1,False,True,49
813,Come down from your high horse and finish your code at home.,1.146067415730337,0.0376484524902597,89,76,13,0,False,True,60
813,Not now! I’m Ukraine-bound!,1.146067415730337,0.0376484524902597,89,76,13,0,False,True,27
813,No more Johnson vaccines for you!,1.1458333333333333,0.0443747168675589,96,85,8,3,False,True,33
813,A little advise Emperor- avoid Waterloo.,1.1458333333333333,0.0362107823753356,96,82,14,0,False,True,40
813,You call that cosplay?,1.1458333333333333,0.0362107823753356,96,82,14,0,True,True,22
813,"mom wrong
earth stupid
going sky
horsey fly!",1.1458333333333333,0.0418308170068669,96,84,10,2,False,True,44
813,"No, Napoleon, I’m not giving you a quarter.",1.1458333333333333,0.0418308170068669,96,84,10,2,False,True,43
813,"Steven, I don’t know why I give you quarters for that machine.”
“Never interrupt your enemy when he is making a mistake, mother!",1.1458333333333333,0.0418308170068669,96,84,10,2,False,True,128
813,"You said watermelon,not Waterloo .",1.1458333333333333,0.0362107823753356,96,82,14,0,False,True,34
813,It was the best 20 dollars she'd spent in years,1.145631067961165,0.0445117921056173,103,92,7,4,False,False,47
813,It only works if you deposit a gold Napoleon coin.,1.145631067961165,0.0423194072188415,103,91,9,3,False,True,50
813,Well if it's that far you should take your damn bag.,1.144736842105263,0.0485001261290494,76,67,7,2,False,True,52
813,Waterloo looking at?,1.144736842105263,0.0447368421052631,76,66,9,1,True,True,20
813,"Vini,vidi,vici! Oh,wait…",1.144736842105263,0.0447368421052631,76,66,9,1,False,False,24
813,Ok lil' Napolean...I have treats here or would you rather rule France?,1.144578313253012,0.0424510923948176,83,72,10,1,True,True,70
813,Edit my backdrop and rally the troops mama! We have lands to conquer and misinformed peoples to lead!,1.144578313253012,0.0457815858810471,83,73,8,2,False,True,101
813,A little Napoleon especially marches on his stomach.,1.144578313253012,0.0388360256108036,83,71,12,0,False,True,52
813,The Napoleonic Nines.,1.144578313253012,0.0457815858810471,83,73,8,2,False,True,21
813,"After you conquer Whole Foods, come help me load the groceries.",1.144578313253012,0.0388360256108036,83,71,12,0,False,True,63
813,"Hey kid, don’ get any big ideas that ride only lasts two minutes",1.144578313253012,0.0424510923948176,83,72,10,1,False,False,64
813,"Waterloo is this way, sweetheart.",1.144578313253012,0.0388360256108036,83,71,12,0,False,True,33
813,You can’t pull it off because we’re not French.,1.144578313253012,0.0388360256108036,83,71,12,0,False,True,47
813,"Give it up, you're already too tall to be Napoleon!",1.144578313253012,0.0457815858810471,83,73,8,2,False,True,51
813,Ukraine just called and said they didn't need you.,1.144578313253012,0.0457815858810471,83,73,8,2,False,True,50
813,Would you prefer time out in your room or the South Atlantic?,1.144578313253012,0.0457815858810471,83,73,8,2,True,True,61
813,You’re about the right size,1.144578313253012,0.0424510923948176,83,72,10,1,False,False,27
813,I've bought Beef Wellington for dinner.,1.1444444444444444,0.0404750539257196,90,78,11,1,False,True,39
813,"Hey Napoleon, unless you brought a lot of change with you, you'll never make it to Moscow",1.1444444444444444,0.0404750539257196,90,78,11,1,False,False,89
813,We are not going to Waterloo!,1.1444444444444444,0.0404750539257196,90,78,11,1,False,True,29
813,"Whatcha doin""?",1.1444444444444444,0.0404750539257196,90,78,11,1,True,True,14
813,"’Moscow or Bust’ might not be the best slogan to rally your troops, Jeremy!",1.1444444444444444,0.0404750539257196,90,78,11,1,False,True,75
