contest,caption,mean,precision,votes,not_funny,somewhat_funny,funny,has_question_mark,ends_with_punctuation,caption_length
682,I don't know but everybody yells Geronimo.,1.2053571428571428,0.0423307304777935,112,91,19,2,False,True,42
682,I never thought I would be the first to leave.,1.2053571428571428,0.0423307304777935,112,91,19,2,False,True,46
682,"My heart will go on, Rose!",1.2053571428571428,0.0441901109260744,112,92,17,3,False,True,26
682,My Fall is done. See you next Spring.,1.2053571428571428,0.0476918884655355,112,94,13,5,False,True,37
682,This is a madhouse!”,1.2053571428571428,0.0423307304777935,112,91,19,2,False,False,20
682,I had fun. Let's try to do this again next year.,1.2053571428571428,0.0383424102141907,112,89,23,0,False,True,48
682,"Remember, I want my remains mulched.",1.2053571428571428,0.0459743522470292,112,93,15,4,False,True,36
682,"Lief, I'm so sorry to be leaving you.",1.2053571428571428,0.0476918884655355,112,94,13,5,False,True,37
682,All I ever wanted was to not be like everyone else.,1.2053571428571428,0.0441901109260744,112,92,17,3,False,True,51
682,I was hoping not to leave without you!,1.2053571428571428,0.0441901109260744,112,92,17,3,False,True,38
682,"Remember what Whitman wrote ""I stop somewhere waiting for you.""",1.2053571428571428,0.0403858339261236,112,90,21,1,False,False,63
682,"Oh boy, looks like I’m falling into a pattern.",1.2053571428571428,0.0383424102141907,112,89,23,0,False,True,46
682,...then you turn right onto 3rd St.,1.2053571428571428,0.0383424102141907,112,89,23,0,False,True,35
682,And away we go!,1.2053571428571428,0.0441901109260744,112,92,17,3,False,True,15
682,O Henry -- It's up to you now!,1.2053571428571428,0.0403858339261236,112,90,21,1,False,True,30
682,"Let it be recorded in the Autumn Annuals, ""I fell for you.'",1.2053571428571428,0.0423307304777935,112,91,19,2,False,False,59
682,"Strange, I'm getting this funny feeling of deja vu...",1.2053571428571428,0.0403858339261236,112,90,21,1,False,True,53
682,I guess summer vacation's over!,1.2053571428571428,0.0423307304777935,112,91,19,2,False,True,31
682,"See you next Spring! Same tree, same limb",1.2053571428571428,0.0441901109260744,112,92,17,3,False,False,41
682,"Gotta go, I think I left the stove on.",1.2053571428571428,0.0403858339261236,112,90,21,1,False,True,38
682,I'm going to drift by that window so they can dream of summer kisses.,1.2053571428571428,0.0441901109260744,112,92,17,3,False,True,69
682,If all your friends jumped off a br...,1.2053571428571428,0.0423307304777935,112,91,19,2,False,True,38
682,I'm calling a lawyer.,1.2053571428571428,0.0383424102141907,112,89,23,0,False,True,21
682,"Hope to see you in a wreath.  
Otherwise, I’ll meet you in the compost pile”.",1.2053571428571428,0.0441901109260744,112,92,17,3,False,True,77
682,It's time to make like a tree and leave.,1.2053571428571428,0.0459743522470292,112,93,15,4,False,True,40
682,“When breeze comes to blast ....  looks like you’ll be last.”,1.2053571428571428,0.0441901109260744,112,92,17,3,False,False,61
682,Look me up on 'Rakebook'.,1.2053571428571428,0.0459743522470292,112,93,15,4,False,True,25
682,You win—the oak’s all yours; I just couldn’t bear another one of your  ‘leaf’ or ‘fall’ jokes.,1.2053571428571428,0.0338879049113833,112,92,19,1,False,True,94
682,The party was over a long time ago.  Why are we always the last to leave?,1.2053571428571428,0.0403858339261236,112,90,21,1,True,True,73
682,Goodbye. I must leave you now.,1.2053571428571428,0.0423307304777935,112,91,19,2,False,True,30
682,"With some luck, we'll end up in the same compost.",1.2053571428571428,0.0403858339261236,112,90,21,1,False,True,49
682,"In the larger scheme of things, a compost pile wouldn't be such a bad deal !""",1.2053571428571428,0.0383424102141907,112,89,23,0,False,False,77
682,This beats a no deal Brexit.,1.2053571428571428,0.0423307304777935,112,91,19,2,False,True,28
682,"Remember, Frankie, we’re leaves, not stays!",1.2053571428571428,0.0423307304777935,112,91,19,2,False,True,43
682,Sorry Janet. I'm leaving you for a perennial.,1.2053571428571428,0.0441901109260744,112,92,17,3,False,True,45
682,"Tell me - my memory's failing, Are we Falling Leaves or Autumn Leaves?",1.2053571428571428,0.0459743522470292,112,93,15,4,True,True,70
682,Just don’t think I’ve fallen for you.,1.2053571428571428,0.0423307304777935,112,91,19,2,False,True,37
682,"Ashes to ashes, compost to compost.",1.2053571428571428,0.0403858339261236,112,90,21,1,False,True,35
682,What a waste. My rent is paid up through the end of the month.,1.2053571428571428,0.0383424102141907,112,89,23,0,False,True,62
682,Everything doesn’t always have to be your idea.,1.2053571428571428,0.0403858339261236,112,90,21,1,False,True,47
682,"Oh no, the rake said it would be fine, but he said I could just check out what the ground is like, and if I don't like it I can come on back",1.2053571428571428,0.0423307304777935,112,91,19,2,False,False,140
682,Don't worry...I'll meet you in the compost heap!,1.2035398230088497,0.0438349897536935,113,93,17,3,False,True,48
682,They herd us up and destroy us in one blow. Call it a “pile”.,1.2035398230088497,0.0438349897536935,113,93,17,3,False,True,61
682,My stupid therapist said calling it “autumn” would make this easier!,1.2035398230088497,0.0400680758324664,113,91,21,1,False,True,68
682,"My dear Rowen, you’re  not the first to fall for me, or the last.",1.2035398230088497,0.0419937913721939,113,92,19,2,False,True,65
682,Next time I'm coming back as a pine needle!,1.2035398230088497,0.0400680758324664,113,91,21,1,False,True,43
682,bottomofthepilenearthestreet - see you there!,1.2035398230088497,0.0400680758324664,113,91,21,1,False,True,45
682,Act like a tree and Leave.,1.2035398230088497,0.0438349897536935,113,93,17,3,False,True,26
682,It's not that I don't love you. It's that damn photosynthesis.,1.2035398230088497,0.0400680758324664,113,91,21,1,False,True,62
682,I'm blown away by how much I've enjoyed hanging out with you,1.2035398230088497,0.0456019093854795,113,94,15,4,False,False,60
682,"I thought ""make like a tree and leave"" was just an saying!",1.2035398230088497,0.0419937913721939,113,92,19,2,False,True,58
682,I don't want to leave! You mean the world to me!,1.2035398230088497,0.0380450113421091,113,90,23,0,False,True,48
682,This is no time to hang about!,1.2035398230088497,0.0438349897536935,113,93,17,3,False,True,30
682,My wish was to join the rest anyway!,1.2035398230088497,0.0456019093854795,113,94,15,4,False,True,36
682,We'll meet again in the After Leaf,1.2035398230088497,0.0419937913721939,113,92,19,2,False,False,34
682,We'll always have this lovely tree in an upper east side neighborhood.,1.2035398230088497,0.0438349897536935,113,93,17,3,False,True,70
682,I hope it doesnt mulch.....,1.2035398230088497,0.0419937913721939,113,92,19,2,False,True,27
682,I've got it! I've got the answer!!,1.2035398230088497,0.0400680758324664,113,91,21,1,False,True,34
682,"Darn, I didn't even start to spend down my nest egg yet",1.2035398230088497,0.0419937913721939,113,92,19,2,False,False,55
682,This is why my favorite season is Spring.,1.2035398230088497,0.0380450113421091,113,90,23,0,False,True,41
682,"I'll see you later, on the ground.",1.2035398230088497,0.0400680758324664,113,91,21,1,False,True,34
682,"If reincarnation is real, see you next spring.",1.2035398230088497,0.0456019093854795,113,94,15,4,False,True,46
682,You get the idea.,1.2035398230088497,0.0438349897536935,113,93,17,3,False,True,17
682,I suppose I'm not the first to fall for you.,1.2035398230088497,0.0438349897536935,113,93,17,3,False,True,44
682,Don't kick me out. I promise I'll turn over a new leaf.,1.2035398230088497,0.0419937913721939,113,92,19,2,False,True,55
682,Good-bye Sloopy. Hang on !,1.2035398230088497,0.0438349897536935,113,93,17,3,False,True,26
682,Think of me as someone who leaves you.,1.2035398230088497,0.0438349897536935,113,93,17,3,False,True,38
682,"I need to branch out, there are thousands below.",1.2035398230088497,0.0438349897536935,113,93,17,3,False,True,48
682,"Sad? Yes. But, just get over it.",1.2035398230088497,0.0380450113421091,113,90,23,0,True,True,32
682,"Don't keep us waiting, the more the merrier!",1.2035398230088497,0.0438349897536935,113,93,17,3,False,True,44
682,"I’ll  meet you in the tool box for
the winter. It’s isolated.",1.2035398230088497,0.0473028746747653,113,95,13,5,False,True,61
682,"I don't care what ""everybody"" says, it's not Fall until I say it's FAAAAAAAAA!",1.2035398230088497,0.0419937913721939,113,92,19,2,False,True,78
682,I didn’t realize “Fall” was so literal!,1.2035398230088497,0.0380450113421091,113,90,23,0,False,True,39
682,And here I thought being green was sustainable.,1.2035398230088497,0.0400680758324664,113,91,21,1,False,True,47
682,I’ll see you in the bag!,1.2035398230088497,0.0419937913721939,113,92,19,2,False,True,24
682,I'm falling for a rakish young man.,1.2035398230088497,0.0438349897536935,113,93,17,3,False,True,35
682,See you in hell,1.201834862385321,0.0427952487863065,109,89,18,2,False,False,15
682,Come on! We're gonna be late for the big rake up.,1.201834862385321,0.0447362043985559,109,90,16,3,False,True,49
682,It's JUNE!,1.201834862385321,0.0447362043985559,109,90,16,3,False,True,10
682,Goodbye and good luck with that mulch thing you wanted to do.,1.201834862385321,0.0386218071569268,109,87,22,0,False,True,61
682,I only loved you as a function of proximityyyyyyyyyy,1.201834862385321,0.0465963802166744,109,91,14,4,False,False,52
682,Why do you always get to be last?,1.2,0.0404313687580535,110,89,20,1,True,True,33
682,It's not you! I simply have to follow my destiny.,1.2,0.0436435780471984,105,86,17,2,False,True,49
682,Parting is such leaf sorrow.,1.2,0.0436435780471984,105,86,17,2,False,True,28
682,The Rise And Fall Of Leaf Erikson,1.2,0.0471404520791031,100,83,14,3,False,False,33
682,I'm sorry I gotta go! I just have really bad FOMO.,1.1981981981981982,0.0440010047905148,111,92,16,3,False,True,50
682,"'So long, it's been good to know yuh . . .'",1.1981981981981982,0.0458245413111257,111,93,14,4,False,False,43
682,"as they say in old country, sorry to leaf you",1.1981981981981982,0.0420985541173891,111,91,18,2,False,False,45
682,"I'll be known as the penultimate leaf!""",1.19811320754717,0.0432710409703594,106,87,17,2,False,False,39
682,Damn it! I thought this year I’d get to see Winter.,1.19811320754717,0.0432710409703594,106,87,17,2,False,True,51
682,Have you ever thought that they know something you don't?,1.19811320754717,0.0411422953582,106,86,19,1,True,True,57
682,It is my time to participate in 'the fall.',1.19811320754717,0.0432710409703594,106,87,17,2,False,False,43
682,"Promise me you'll survive. That you won't give up, no matter what happens, no matter how hopeless. Promise me now, Rose, and never let go of that promise.",1.19811320754717,0.045299862096652,106,88,15,3,False,True,154
682,"I know we talked about this day, but...",1.19811320754717,0.0432710409703594,106,87,17,2,False,True,39
682,Blower or Rake ? Wonder what's in our destiny!,1.19811320754717,0.045299862096652,106,88,15,3,True,True,46
682,Remember your training!,1.19811320754717,0.0411422953582,106,86,19,1,False,True,23
682,New England! I will wait for you!!!,1.19811320754717,0.0388972228831854,106,85,21,0,False,True,35
682,I'll see you next year. Same time; Same place?,1.19811320754717,0.045299862096652,106,88,15,3,True,True,46
682,I'll leaf you alone.,1.19811320754717,0.0411422953582,106,86,19,1,False,True,20
682,Bye!  I'm leafing you.,1.19811320754717,0.0411422953582,106,86,19,1,False,True,22
682,I hope the compost pile is organic!,1.19811320754717,0.0411422953582,106,86,19,1,False,True,35
682,"You were always the best of us, Bob!",1.19811320754717,0.0388972228831854,106,85,21,0,False,True,36
682,Betcha ten you go first,1.19811320754717,0.0388972228831854,106,85,21,0,False,False,23
682,"As they say in Proverbs, ""Pride goeth before destruction and a haughty spirit before the fall """,1.19811320754717,0.0411422953582,106,86,19,1,False,False,95
682,"Come on. If you wait too long, I can't guarantee that I can save you a place.",1.19811320754717,0.0411422953582,106,86,19,1,False,True,77
682,Grounded,1.19811320754717,0.0411422953582,106,86,19,1,False,False,8
682,"Yeah?  Well, I won’t miss the seasons.",1.19811320754717,0.0388972228831854,106,85,21,0,True,True,38
682,"But I am not ""reddy"" yet!",1.19811320754717,0.0388972228831854,106,85,21,0,False,True,25
682,It’s all in the landing,1.19811320754717,0.0388972228831854,106,85,21,0,False,False,23
682,'Meet me in the rake!',1.19811320754717,0.045299862096652,106,88,15,3,False,False,22
682,"It's a far, far better thing I doooo...........",1.19811320754717,0.0432710409703594,106,87,17,2,False,True,47
682,"If I can, I’ll send you a sign that all is well with me down there.",1.19811320754717,0.0411422953582,106,86,19,1,False,True,67
682,"'To you, all that I leave behind...'",1.19811320754717,0.0411422953582,106,86,19,1,False,False,36
682,Laying on the ground is so degrading.,1.19811320754717,0.0432710409703594,106,87,17,2,False,True,37
682,"In case something happens to me, the password for my account is.....",1.19811320754717,0.0411422953582,106,86,19,1,False,True,68
682,My time has come to leaf you alone!,1.19811320754717,0.0411422953582,106,86,19,1,False,True,35
682,"Just hold on, I'm going home.",1.19811320754717,0.0388972228831854,106,85,21,0,False,True,29
682,I’ll see you next year,1.19811320754717,0.0472416344477289,106,89,13,4,False,False,22
682,"Well, I thought it would be better to have loved and lost than to have never loved at all; but now I’m not so SUUURRREE",1.19811320754717,0.0411422953582,106,86,19,1,False,False,119
682,I knew it was a mistake to join the Cabinet!,1.19811320754717,0.0411422953582,106,86,19,1,False,True,44
682,"Im sorry Tod, but these streets need me!",1.19811320754717,0.0432710409703594,106,87,17,2,False,True,40
682,"Next year, I really hope to reincarnate on a pine tree.",1.19811320754717,0.0388972228831854,106,85,21,0,False,True,55
682,We're the last two. Goodbye!,1.19811320754717,0.0432710409703594,106,87,17,2,False,True,28
682,Nothing gold can stay.,1.19811320754717,0.045299862096652,106,88,15,3,False,True,22
682,"Look Mom, no hands!",1.19811320754717,0.045299862096652,106,88,15,3,False,True,19
682,Honey I'll wait you in the car.,1.19811320754717,0.0432710409703594,106,87,17,2,False,True,31
682,see you in front of the car,1.19811320754717,0.0432710409703594,106,87,17,2,False,False,27
682,"Quod Infirmum Fuit Heres, Now  Leaf  Me  Alone.""",1.19811320754717,0.045299862096652,106,88,15,3,False,False,48
682,"Don't worry, we're all getting together later.",1.19811320754717,0.045299862096652,106,88,15,3,False,True,46
682,And they were roommates.,1.19811320754717,0.0411422953582,106,86,19,1,False,True,24
682,I guess this means we are separating,1.19811320754717,0.0411422953582,106,86,19,1,False,False,36
682,I don't want people peeping me anymore,1.19811320754717,0.0388972228831854,106,85,21,0,False,False,38
682,"You remind me of O'Henry's  ""The Last Leaf""",1.19811320754717,0.0411422953582,106,86,19,1,False,False,43
682,Apocalypse!,1.19811320754717,0.045299862096652,106,88,15,3,False,True,11
682,Ah my dearest Rupert: All that poetry we read together -- but now we see that October is the cruelest month.,1.19811320754717,0.0432710409703594,106,87,17,2,False,True,108
682,I don't like dropping in unannounced!,1.19811320754717,0.0411422953582,106,86,19,1,False,True,37
682,"Even with all the chaos, you have proven to be stronger than all of us. You are committed and don't have attachment issues. Stay strong my friend. May we meet again.",1.19811320754717,0.0411422953582,106,86,19,1,False,True,165
682,"Welp, it’s been real.",1.19811320754717,0.0388972228831854,106,85,21,0,False,True,21
682,"Before the I hit the ground and the wind takes me, remember me when I was green and young.",1.19811320754717,0.0411422953582,106,86,19,1,False,True,90
682,"Why didn't you tell me? I'll be waiting for you next door, by the fireplug.",1.19811320754717,0.0411422953582,106,86,19,1,True,True,75
682,I can see my second cousin down there,1.19811320754717,0.0388972228831854,106,85,21,0,False,False,37
682,This cartoon is in color....don't say anything 'off-color.',1.19811320754717,0.0432710409703594,106,87,17,2,False,False,59
682,At least you won't be the last rose of summer.,1.19811320754717,0.0432710409703594,106,87,17,2,False,True,46
682,You hanging around for it bit Harry?,1.19811320754717,0.0411422953582,106,86,19,1,True,True,36
682,I guess we'll pick up this conversation next year.,1.19811320754717,0.0388972228831854,106,85,21,0,False,True,50
682,It's time for this Orange One to join the rest of the Cabinet!,1.19811320754717,0.0411422953582,106,86,19,1,False,True,62
682,"We were unique as a couple, but now I must join the anonymous multitude.",1.19811320754717,0.045299862096652,106,88,15,3,False,True,72
682,Our father was a maple!,1.19811320754717,0.0411422953582,106,86,19,1,False,True,23
682,The secret to staying on is AAAGGH!!!,1.19811320754717,0.0388972228831854,106,85,21,0,False,True,37
682,What was that thing you said about pride?,1.19811320754717,0.0388972228831854,106,85,21,0,True,True,41
682,"It's not you, it's me. And the changing seasons.",1.19811320754717,0.0432710409703594,106,87,17,2,False,True,48
682,Do you think the fallen will charge us with collusion?,1.19811320754717,0.0388972228831854,106,85,21,0,True,True,54
682,I thought we agreed this was a Trust Fall!,1.19811320754717,0.0411422953582,106,86,19,1,False,True,42
682,Stay alive.  No matter what occurs.  I will find you!,1.19811320754717,0.0388972228831854,106,85,21,0,False,True,53
682,"Well, looks like you're the last of our kind.",1.19811320754717,0.0411422953582,106,86,19,1,False,True,45
682,Can you believe this shit?,1.19811320754717,0.0411422953582,106,86,19,1,True,True,26
682,You are the last leaf on the tree.,1.19811320754717,0.0411422953582,106,86,19,1,False,True,34
682,Do you come here wafting?,1.19811320754717,0.0411422953582,106,86,19,1,True,True,25
682,"Like you said, “This must be the end of the Tourist Season""",1.19811320754717,0.0388972228831854,106,85,21,0,False,False,59
682,"I'll be ""leave""ing now",1.19811320754717,0.0432710409703594,106,87,17,2,False,False,22
682,You’re always the last to go.,1.19811320754717,0.0388972228831854,106,85,21,0,False,True,29
682,"Leafing you?  Fear not, my love.  We two shall meet anon in mulch time.",1.19811320754717,0.045299862096652,106,88,15,3,True,True,71
682,"Well, it's either this or a corn maze.",1.19811320754717,0.0388972228831854,106,85,21,0,False,True,38
682,Don't forget to put the trash out before you leave!,1.19811320754717,0.0411422953582,106,86,19,1,False,True,51
682,Look at the state of this yard! Absolutely unbeleafable.,1.19811320754717,0.0388972228831854,106,85,21,0,False,True,56
682,Come on!  Nobody's going to call you a lemming!,1.19811320754717,0.0388972228831854,106,85,21,0,False,True,47
682,To hell with autumn dignity!  GERONIMO!,1.19811320754717,0.0411422953582,106,86,19,1,False,True,39
682,"The moment I saw you in orange, I fell.",1.19811320754717,0.0388972228831854,106,85,21,0,False,True,39
682,It pains me to say this but I must leaf you now.,1.19811320754717,0.0432710409703594,106,87,17,2,False,True,48
682,"I'll see you on the other side, brother.",1.19811320754717,0.0388972228831854,106,85,21,0,False,True,40
682,Oh no! It's October!,1.19811320754717,0.0388972228831854,106,85,21,0,False,True,20
682,This is we're called 'leaves' '',1.19811320754717,0.0432710409703594,106,87,17,2,False,False,32
682,I think I'll just drop by some old neighbors.,1.19811320754717,0.0432710409703594,106,87,17,2,False,True,45
682,See you next May as a darling bud!,1.19811320754717,0.0411422953582,106,86,19,1,False,True,34
682,I'm just so tired of being ogled by the leaf peepers!,1.19811320754717,0.0388972228831854,106,85,21,0,False,True,53
682,I'm sorry to LEAVE you all alone!,1.19811320754717,0.0388972228831854,106,85,21,0,False,True,33
682,The inseparable leaves-we fall together in this autumn and shall rise thereafter in this cold lights.,1.19811320754717,0.0388972228831854,106,85,21,0,False,True,101
682,"I hate to leave you, but I must.",1.19811320754717,0.0411422953582,106,86,19,1,False,True,32
682,But I didn’t get your number!,1.19811320754717,0.045299862096652,106,88,15,3,False,True,29
682,"OH, TOM!",1.19811320754717,0.0411422953582,106,86,19,1,False,True,8
682,My STEM has failed me!,1.19811320754717,0.0411422953582,106,86,19,1,False,True,22
682,I was puuusheddd....,1.19811320754717,0.0432710409703594,106,87,17,2,False,True,20
682,I’’ll race you to the ground!,1.19811320754717,0.0388972228831854,106,85,21,0,False,True,29
682,Looks like your it ! Good luck .,1.19811320754717,0.045299862096652,106,88,15,3,False,True,32
682,Fall means fall. Now get with the program.,1.19811320754717,0.0411422953582,106,86,19,1,False,True,42
682,I swore I’d never fall for you.,1.19811320754717,0.0388972228831854,106,85,21,0,False,True,31
682,I hope to see you at the big compost in the sky...,1.19811320754717,0.0432710409703594,106,87,17,2,False,True,50
682,"Well Fred, you ready to caress his damn window!",1.19811320754717,0.0432710409703594,106,87,17,2,False,True,47
682,"Oh Henry, you're the last leaf!",1.19811320754717,0.0411422953582,106,86,19,1,False,True,31
682,"Finally, we discover our true colors and then there lies our fate.",1.19811320754717,0.0388972228831854,106,85,21,0,False,True,66
682,I thought the apples would be the end of the lay-offs,1.19811320754717,0.0411422953582,106,86,19,1,False,False,53
682,I regret not showing my true colors!,1.1962616822429906,0.0407980094676278,107,87,19,1,False,True,36
682,What happened to 'if I fall you'll catch me!?,1.1962616822429906,0.0407980094676278,107,87,19,1,True,True,45
682,Hold that thought.,1.1962616822429906,0.0449126826523529,107,89,15,3,False,True,18
682,"OK, I'll be the fall guy.",1.1962616822429906,0.0407980094676278,107,87,19,1,False,True,25
682,Winter is Coming?,1.1962616822429906,0.0407980094676278,107,87,19,1,True,True,17
682,I’ll see you at the bonfire.,1.1962616822429906,0.0407980094676278,107,87,19,1,False,True,28
682,"Well, you finally achieved that ""naturally windswept"" look.",1.1962616822429906,0.0449126826523529,107,89,15,3,False,True,59
682,My green card's been rev-oak-ed!,1.1962616822429906,0.0407980094676278,107,87,19,1,False,True,32
682,"Bye Walt, it’s time for Leaves Of Grass.",1.1962616822429906,0.0407980094676278,107,87,19,1,False,True,40
682,Sic transit gloria mundi...,1.1962616822429906,0.0429047004391804,107,88,17,2,False,True,27
682,"Goodbye, Wellenough",1.1962616822429906,0.0449126826523529,107,89,15,3,False,False,19
682,See you inside the Street Sweeper,1.1962616822429906,0.0429047004391804,107,88,17,2,False,False,33
682,"LODFOB. Last one down, first one burned!",1.1962616822429906,0.0429047004391804,107,88,17,2,False,True,40
682,I never told you it was forever.,1.1962616822429906,0.0407980094676278,107,87,19,1,False,True,32
682,I never thought I would fall for you!,1.1962616822429906,0.0309698983450062,107,88,19,0,False,True,37
682,Tell my twig I love her!,1.1962616822429906,0.0407980094676278,107,87,19,1,False,True,24
682,Didn't I tell you fall fashion gets dropped really quickly back on May Day this year?,1.1962616822429906,0.0385764414282278,107,86,21,0,True,True,85
682,"Ashes, ashes, all fal down.",1.1962616822429906,0.0429047004391804,107,88,17,2,False,True,27
682,Parting is such sweet sorrow that I’ll say goodbye till I be mulch,1.1962616822429906,0.0429047004391804,107,88,17,2,False,False,66
682,"You're the last one hanging on, you win the car!",1.1962616822429906,0.0429047004391804,107,88,17,2,False,True,48
682,"If you really loved me,Ted, you'd take the plunge with me.",1.1962616822429906,0.0407980094676278,107,87,19,1,False,True,58
682,"Olly olly oxen free!""",1.1962616822429906,0.0429047004391804,107,88,17,2,False,False,21
682,Queue Roger Williams.,1.1962616822429906,0.0429047004391804,107,88,17,2,False,True,21
682,Blow me away!,1.1962616822429906,0.0429047004391804,107,88,17,2,False,True,13
682,"Well, they say it's a long, long time from May to December, but we'll never know.",1.1962616822429906,0.0449126826523529,107,89,15,3,False,True,81
682,It will be a re-leaf  to join our friends down below.,1.1962616822429906,0.0449126826523529,107,89,15,3,False,True,53
682,The rest is silence.,1.1962616822429906,0.0407980094676278,107,87,19,1,False,True,20
682,Must be sweeps week.,1.1962616822429906,0.0449126826523529,107,89,15,3,False,True,20
682,Gravity is not your friend.,1.1962616822429906,0.0385764414282278,107,86,21,0,False,True,27
682,Don’t worry you won’t feel a thing when the power mulcher gets you.,1.1962616822429906,0.0429047004391804,107,88,17,2,False,True,67
682,I never meant to leave you this way.,1.1962616822429906,0.0468346539037722,107,90,13,4,False,True,36
682,"It's true, I'm falling for you.",1.1962616822429906,0.0429047004391804,107,88,17,2,False,True,31
682,"I will find you! No matter how long it takes, no matter how far. I will find you!",1.1962616822429906,0.0429047004391804,107,88,17,2,False,True,81
682,That's fall for you.,1.1962616822429906,0.0468346539037722,107,90,13,4,False,True,20
682,3 pm at the corner,1.1962616822429906,0.0407980094676278,107,87,19,1,False,False,18
682,I think they took me off my chlorophyll too soon.,1.1962616822429906,0.0449126826523529,107,89,15,3,False,True,49
682,I just knew I'd go first when I saw my face spots in a mirror.,1.1962616822429906,0.0385764414282278,107,86,21,0,False,True,62
682,"I've always told you you're drop dead beautiful, Leslie.",1.1962616822429906,0.0449126826523529,107,89,15,3,False,True,56
