contest,caption,mean,precision,votes,not_funny,somewhat_funny,funny,has_question_mark,ends_with_punctuation,caption_length
776,This open concept living lets us enjoy our  personal spaces together.,1.1833333333333331,0.0605607817506705,60,51,7,2,False,True,69
776,"Yeah, some customers think that it's their home we'll be working from but otherwise, it's been great.",1.1833333333333331,0.0605607817506705,60,51,7,2,False,True,101
776,It's been so nice having Matt working from home this past year!,1.1833333333333331,0.0557013153780045,60,50,9,1,False,True,63
776,"No need to worry Martha, our carpet is getting replaced next week.",1.1833333333333331,0.0605607817506705,60,51,7,2,False,True,66
776,He's been working at home since the beginning the pandemic and I think he rather likes it.,1.1830985915492958,0.0578273958277662,71,61,7,3,False,True,90
776,"At first it was because of Covid, but then we just decided to keep this work from home thing going.",1.181818181818182,0.0524863881081477,66,55,10,1,False,True,99
776,Believe it or not this is actually easier than doing it over zoom..,1.181818181818182,0.0640439090268579,55,47,6,2,False,True,67
776,It's been so nice having my husband work from home during the pandemic.,1.181818181818182,0.0567540430528044,66,56,8,2,False,True,71
776,Matt's auto repair business started out as just a model car displayed as our dinning table centerpiece.,1.181818181818182,0.0585510171563209,55,46,8,1,False,True,103
776,"When he told me he'd be working from home for a while, I didn't realize this is what he meant.",1.181818181818182,0.0585510171563209,55,46,8,1,False,True,94
776,Ever since covid he decided to work at home.,1.181818181818182,0.0746572667357698,44,38,4,2,False,True,44
776,Add “mechanical failure” to the list of life’s disappointments,1.181818181818182,0.0588178762927845,44,36,8,0,False,False,62
776,Who says you can’t teach an old dog new tricks?,1.181818181818182,0.0585510171563209,55,46,8,1,True,True,47
776,There's nothing like a home business,1.181818181818182,0.0524863881081477,55,45,10,0,False,False,36
776,"Matt always welcomes ""overtime.""",1.181818181818182,0.0585510171563209,55,46,8,1,False,False,32
776,I see you're on a roll today.,1.181818181818182,0.0524863881081477,55,45,10,0,False,True,29
776,I don't know why he insists on taking his work home,1.181818181818182,0.0585510171563209,55,46,8,1,False,False,51
776,Legos aren't really for little kids anymore.,1.181818181818182,0.0513896854445167,77,65,10,2,False,True,44
776,"The Nextdoor rec said Matt's Garage makes you feel right at home!""",1.181818181818182,0.0588178762927845,44,36,8,0,False,False,66
776,Hmmm -- I'm not so sure house calls are always a good idea.,1.181818181818182,0.0585510171563209,55,46,8,1,False,True,59
776,Matt's decided to continue working from home.,1.181818181818182,0.0640439090268579,55,47,6,2,False,True,45
776,The upside is the stains give the carpet a nice bargello effect.,1.181818181818182,0.0585510171563209,55,46,8,1,False,True,64
776,"So I gave Matt a pair of coveralls for his retirement,something to wear while he tinkered around the house",1.181818181818182,0.0640439090268579,55,47,6,2,False,False,106
776,"Not quite what I had in mind when I asked him to fix things around the house, but it's a start.",1.181818181818182,0.0524863881081477,55,45,10,0,False,True,95
776,"The carpet cleaners are coming tomorrow anyway, so why not?",1.181818181818182,0.0672058406987413,44,37,6,1,True,True,59
776,He takes his zoom meetings so literally.,1.181818181818182,0.0640439090268579,55,47,6,2,False,True,40
776,Working from home just suits him.,1.181818181818182,0.0672058406987413,44,37,6,1,False,True,33
776,He is working from home during. Covid19,1.181818181818182,0.0746572667357698,44,38,4,2,False,False,39
776,"It started during the covid lockdown, and now it just makes sense for him to keep working at home.",1.181818181818182,0.0672058406987413,44,37,6,1,False,True,98
776,I didn't realize that brake linings could be a hobby.,1.181818181818182,0.0585510171563209,55,46,8,1,False,True,53
776,Why?  Because I asked Matt to spend less time at work.,1.181818181818182,0.0524863881081477,55,45,10,0,True,True,54
776,"It's OK, Matt just works on domestic models.""",1.181818181818182,0.0588178762927845,44,36,8,0,False,False,45
776,"Everybody wins.This way we save the cost of a taxi if we leave the car at the shop, and Matt saves on rent.",1.181818181818182,0.0640439090268579,55,47,6,2,False,True,107
776,Matthew has enjoyed working from home so much that he's decided he's never going back.,1.181818181818182,0.0524863881081477,55,45,10,0,False,True,86
776,the commute is shorter but we're still fine tuning our WFH situation,1.181818181818182,0.0524863881081477,55,45,10,0,False,False,68
776,He was the only mechanic I could find that would do a house call.,1.181818181818182,0.0585510171563209,55,46,8,1,False,True,65
776,"Matt bakes amazing oarmeal cookies too, have some please.",1.181818181818182,0.0640439090268579,55,47,6,2,False,True,57
776,"Matthew, Luke, and John took notes from Mark.",1.181818181818182,0.0640439090268579,55,47,6,2,False,True,45
776,The pandemic sure has changed the way business is done!,1.181818181818182,0.0585510171563209,55,46,8,1,False,True,55
776,He hates the commute and has always wanted to work at home. So … hey.,1.181818181818182,0.0814296624633012,44,39,2,3,False,True,69
776,Working from home has it's advantages and a few disadvantages.,1.181818181818182,0.0585510171563209,55,46,8,1,False,True,62
776,These new mobile mechanic’s are awesome,1.181818181818182,0.0478395283258379,66,54,12,0,False,False,39
776,It’s so nice that he can work from home.,1.181818181818182,0.0672058406987413,44,37,6,1,False,True,40
776,I'm so glad we bought this condo just before the pandemic.,1.181818181818182,0.0524863881081477,55,45,10,0,False,True,58
776,The auto-tune on the radio is on the fritz.,1.181818181818182,0.0588178762927845,44,36,8,0,False,True,43
776,I missed the window for telling him to take it outside.,1.181818181818182,0.0588178762927845,44,36,8,0,False,True,55
776,He’s working ar home now.,1.181818181818182,0.0640439090268579,55,47,6,2,False,True,25
776,And that's how you watch a low budget car chase movie in 3D.,1.181818181818182,0.0746572667357698,44,38,4,2,False,True,60
776,I guess Carvana fixes car from home too,1.181818181818182,0.0478395283258379,66,54,12,0,False,False,39
776,the COVID delivery services have gotten a little out of hand,1.181818181818182,0.0524863881081477,66,55,10,1,False,False,60
776,The pandemic has made us closer than ever.  I love Matty the Hunk!,1.1805555555555556,0.0535382977928062,72,61,9,2,False,True,66
776,"Pandemic work from home is challenging but the tax write-off is worth it"".

Lloyd Berkowitz
Boca Raton, F",1.180327868852459,0.0596354898612384,61,52,7,2,False,False,105
776,Something something work from home something something cut down on the commute something something nice to see him during the day.,1.180327868852459,0.0548629525596115,61,51,9,1,False,True,130
776,He's working on my car in my living room.,1.180327868852459,0.0596354898612384,61,52,7,2,False,True,41
776,"He heard that ""homemade"" is in demand these days",1.180327868852459,0.0596354898612384,61,52,7,2,False,False,48
776,"Since the Pandemic,it's just easier to work from home.",1.180327868852459,0.0596354898612384,61,52,7,2,False,True,54
776,He also does back surgery in the comfort of your home.,1.180327868852459,0.0548629525596115,61,51,9,1,False,True,54
776,Isn't it wonderful that Matt has such a useful hobby?,1.180327868852459,0.0548629525596115,61,51,9,1,True,True,53
776,"He was home-schooled, now he's home-employed.",1.180327868852459,0.0640534131676179,61,53,5,3,False,True,45
776,Matt's working from home during the pandemic.,1.180327868852459,0.0548629525596115,61,51,9,1,False,True,45
776,"The pandemic has brought us closer together, and his saving tons in overhead",1.180327868852459,0.0548629525596115,61,51,9,1,False,False,76
776,'Johnny was quite upset when I did not allow him to buy the new widescreen for that stand.',1.180327868852459,0.0596354898612384,61,52,7,2,False,False,91
776,He says  everyone's doing shop at home these days.,1.180327868852459,0.0548629525596115,61,51,9,1,False,True,50
776,He's still doing his best to work from home.,1.180327868852459,0.0548629525596115,61,51,9,1,False,True,44
776,His CEO (you know--Matt) said they could all work remotely now.,1.180327868852459,0.0640534131676179,61,53,5,3,False,True,63
776,We decided to trend with working at home.,1.180327868852459,0.0596354898612384,61,52,7,2,False,True,41
776,It’s a shame I can’t take that junk in the trunk for a spin.,1.180327868852459,0.0681856863707718,61,54,3,4,False,True,60
776,"Oh, yes. Did I tell you I have a a statue of a car repair-man in my living room? It's totally abstract and realistic, isn't it? It makes you look at a life in a different way. Anyways..",1.18,0.0618754509363077,50,42,7,1,True,True,185
776,Matt always brings unfinished work home with him.,1.18,0.0618754509363077,50,42,7,1,False,True,49
776,"With COVID, it's nice to find someone who makes house calls.",1.18,0.0548839220351387,50,41,9,0,False,True,60
776,"He really wanted to work from home, but there's no 5G or high-speed internet out here. So...",1.18,0.0618754509363077,50,42,7,1,False,True,92
776,I think he likes you.,1.18,0.0681534882392946,50,43,5,2,False,True,21
776,"He said ""If you can work from home,Madge,so can I.""",1.18,0.0548839220351387,50,41,9,0,False,False,51
776,I'll be glad when Matt stops working from home.,1.18,0.0548839220351387,50,41,9,0,False,True,47
776,My husband decided he's going to work at home too.,1.18,0.0548839220351387,50,41,9,0,False,True,50
776,"The garage wants him back but since the pandemic, he prefers working from home",1.18,0.0618754509363077,50,42,7,1,False,False,78
776,"It's the best TV money can buy, 10W-40 resolution!",1.18,0.0681534882392946,50,43,5,2,False,True,50
776,"Oh, but Helen, it’ll look good as new, once he runs it through the dishwasher!",1.18,0.0681534882392946,50,43,5,2,False,True,78
776,"But payment to Matt's is totally ""touchless"".",1.18,0.0681534882392946,50,43,5,2,False,True,45
776,"Since Covid, Matt's been working from home.",1.18,0.0548839220351387,50,41,9,0,False,True,43
776,"If it weren't for the pandemic, he never would have thought of working from home",1.18,0.0618754509363077,50,42,7,1,False,False,80
776,So then I said “why not bring your work home?”,1.18,0.0548839220351387,50,41,9,0,True,False,46
776,Matt always takes his work home,1.18,0.0548839220351387,50,41,9,0,False,False,31
776,"Ever since the shelter-in-place order began,Matt’s been loving working from home",1.18,0.0548839220351387,50,41,9,0,False,False,80
776,I can’t tell you how nice it is to have him home and working remotely…,1.18,0.0618754509363077,50,42,7,1,False,False,70
776,It grew with a broken transistor radio.,1.18,0.0548839220351387,50,41,9,0,False,True,39
776,I think it’s time for Matt to go back to the office,1.18,0.0681534882392946,50,43,5,2,False,False,51
776,It turns out he found that he prefers working at home,1.18,0.0618754509363077,50,42,7,1,False,False,53
776,Matt's customers love how he treats their cars like family.,1.18,0.0681534882392946,50,43,5,2,False,True,59
776,"Oh you know Matt, always bringing his work home with him.",1.18,0.0548839220351387,50,41,9,0,False,True,57
776,Matt said he can work from home during the pandemic.,1.18,0.0681534882392946,50,43,5,2,False,True,52
776,He claims it wasn't considered an essential business.,1.18,0.0548839220351387,50,41,9,0,False,True,53
776,"Matt's here until he
can afford a place of his own.",1.18,0.0618754509363077,50,42,7,1,False,True,51
776,He's always wanted something more in his own wheelhouse.,1.18,0.0618754509363077,50,42,7,1,False,True,56
776,You’ll be one of two sublets… there’s Matt now!,1.18,0.0681534882392946,50,43,5,2,False,True,47
776,We still aren't sure if the whole pivot to working from home was the right choice for Matt!,1.18,0.0548839220351387,50,41,9,0,False,True,91
776,When he said he was going to work from home I didn’t expect this!,1.18,0.0548839220351387,50,41,9,0,False,True,65
776,"Although he works from home now, he never works in pyjamas. Such a gentleman.",1.18,0.0618754509363077,50,42,7,1,False,True,77
776,"This DIY kit, is all inclusive",1.18,0.0618754509363077,50,42,7,1,False,False,30
776,I signed up for a 30 day free trial of that new 4D streaming service.,1.18,0.0618754509363077,50,42,7,1,False,True,69
776,"He tried, but could never leave his work at the office!",1.1794871794871795,0.0722848137157467,39,33,5,1,False,True,55
776,It a Car,1.1794871794871795,0.0722848137157467,39,33,5,1,False,False,8
776,"The homey setting beats the usual waiting room and courtesy car.... and, Suzie, check out the loo!",1.1794871794871795,0.0722848137157467,39,33,5,1,False,True,98
776,It's his shortest commute ever!,1.1794871794871795,0.0507800941632973,78,66,10,2,False,True,31
776,Here  B &B stands for Brakes and Breakfast.,1.1791044776119404,0.0559663800931995,67,57,8,2,False,True,43
776,"I won’t go to Matt’s garage because of Covid, but I'm so lucky he’s an anti-vaxxer.",1.1791044776119404,0.0471981740323638,67,55,12,0,False,True,83
776,"He said he wasn’t feeling manly enough. I asked him to do it outside, but he said the cold gives him the sniffles.",1.1791044776119404,0.0559663800931995,67,57,8,2,False,True,114
776,I really like this gig economy.,1.1785714285714286,0.0575875553449896,56,47,8,1,False,True,31
776,Last week it was computers.,1.1785714285714286,0.0575875553449896,56,47,8,1,False,True,27
776,He feels he should be able to work at home like everyone else.,1.1785714285714286,0.0575875553449896,56,47,8,1,False,True,62
776,"Damn, who knew, designer break shoes!",1.1785714285714286,0.0679339961235429,56,49,4,3,False,True,37
776,Matt has FOMO on the WFH trend.,1.1785714285714286,0.0575875553449896,56,47,8,1,False,True,31
776,Matt is so much happier now that he's able to work from home.,1.1785714285714286,0.0575875553449896,56,47,8,1,False,True,61
776,"We,ve been spending a lot more time together, since he’s been working from home!",1.1785714285714286,0.0575875553449896,56,47,8,1,False,True,80
776,He said he wanted to try working from home.,1.1785714285714286,0.0516427718200872,56,46,10,0,False,True,43
776,Matt started working from home when Covid-19 hit.,1.1785714285714286,0.0575875553449896,56,47,8,1,False,True,49
776,"Matt says we can deduct the mortgage and get new carpet at the same time!""",1.1785714285714286,0.0516427718200872,56,46,10,0,False,False,74
776,I did it for the bumcrack. Imagine my disappointment when he showed up in coveralls.,1.1785714285714286,0.0575875553449896,56,47,8,1,False,True,84
776,It's so rare to find a practitioner who makees house calls anymore!,1.1785714285714286,0.0575875553449896,56,47,8,1,False,True,67
776,Matt’s the best at giving roll in cleanses!,1.1785714285714286,0.0575875553449896,56,47,8,1,False,True,43
776,"Work from home"" sounds like a great thing, but try stump removal! We decided it would be best if Jim tried something new and so far it's really working out.",1.1785714285714286,0.0575875553449896,56,47,8,1,False,True,156
776,Ha! Do not ask ME to endorse the concept of the “multipurpose” room.,1.1785714285714286,0.0575875553449896,56,47,8,1,False,True,68
776,"Matt, could you make a batch of your delicious savory scones?",1.1785714285714286,0.0629736228905634,56,48,6,2,True,True,61
776,At first I found it difficult having him working from home but I've grown to appreciate his oily allure.,1.1785714285714286,0.0516427718200872,56,46,10,0,False,True,104
776,"Cheryl, I told you that you should've slept with the masseuse",1.1785714285714286,0.0575875553449896,56,47,8,1,False,False,61
776,He didn't used to bring his work home but now I'm used to it.,1.1785714285714286,0.0516427718200872,56,46,10,0,False,True,61
776,"He’s meaner than a junkyard dog, but oh how I love the way he turns a wrench.",1.1785714285714286,0.0629736228905634,56,48,6,2,False,True,77
776,"For the Oct 11 contest 

Hope Halley brought his Saxaphone",1.1785714285714286,0.0575875553449896,56,47,8,1,False,False,58
776,"As Matt can tell you, I'm not always the easiest person to live with.",1.1785714285714286,0.0483973197252313,56,48,7,1,False,True,69
776,He loves to work from home!,1.1785714285714286,0.0575875553449896,56,47,8,1,False,True,27
776,"And as it turns out, constantly crashing my car so I can live in his waiting room is half the price of an apartment!",1.1785714285714286,0.0629736228905634,56,48,6,2,False,True,116
776,"Aw look at him, he’s all grown up",1.1785714285714286,0.0629736228905634,56,48,6,2,False,False,33
776,"Yes, Matt takes his hobbies seriously.",1.1785714285714286,0.0575875553449896,56,47,8,1,False,True,38
776,Is there a drive-thru in the kitchen too?,1.1785714285714286,0.0575875553449896,56,47,8,1,True,True,41
776,"Love lifts us up where we belong, eh Janice?",1.1785714285714286,0.0516427718200872,56,46,10,0,True,True,44
776,Oh ...!? Just don't give a damn ?! He  had an argument at home with his wife !?!,1.1785714285714286,0.0679339961235429,56,49,4,3,True,True,80
776,"Honey, I don’t think he quite understood what “work from home” means.",1.1785714285714286,0.0516427718200872,56,46,10,0,False,True,69
776,"On Monday, we spent two hours looking for the wrench that was under Grandma's old dresser, but otherwise that's fine with me.",1.1777777777777778,0.065819533566242,45,38,6,1,False,True,125
776,"With the pandemic, he figured so many are working from home now, why not?",1.1777777777777778,0.0576377479502509,45,37,8,0,True,True,73
776,Isn't it great? He got the jumpsuit on Etsy and the instructions on youTube!,1.1777777777777778,0.065819533566242,45,38,6,1,True,True,76
776,"Yes, it's a bit of a pandemic hobby he's picked up.",1.1777777777777778,0.0576377479502509,45,37,8,0,False,True,51
776,It's just until they finish remodeling the shop.,1.1777777777777778,0.065819533566242,45,38,6,1,False,True,48
776,"Oh, no, dear, he's an artist! He simply must work when the muse demands.",1.1777777777777778,0.065819533566242,45,38,6,1,False,True,72
776,Since COVID he works from home….sigh,1.1777777777777778,0.065819533566242,45,38,6,1,False,False,36
776,"Well, no, it's not ideal...  But his liability insurance premium went down when he stopped doing repairs by Zoom and got his remote work agreement approved!",1.1777777777777778,0.065819533566242,45,38,6,1,False,True,156
776,I have always encouraged Matt to develop a hobby.,1.1777777777777778,0.0730911212732345,45,39,4,2,False,True,49
776,That’s our baby!,1.1777777777777778,0.0576377479502509,45,37,8,0,False,True,16
776,Our Matty outgrew his Legos already.,1.1777777777777778,0.065819533566242,45,38,6,1,False,True,36
776,I guess he just got too used to working at home!,1.1777777777777778,0.065819533566242,45,38,6,1,False,True,48
776,Of course before Covid I hardly saw anything of him at all...,1.1777777777777778,0.0576377479502509,45,37,8,0,False,True,61
776,Matt’s such a fanatic about bringing his work home with him!,1.1777777777777778,0.065819533566242,45,38,6,1,False,True,60
776,He was jealous I was working from home.,1.1777777777777778,0.065819533566242,45,38,6,1,False,True,39
776,I didn’t realize Matt worked from home,1.1777777777777778,0.065819533566242,45,38,6,1,False,False,38
776,I should have never agreed to his idea of starting a home office.,1.1777777777777778,0.0576377479502509,45,37,8,0,False,True,65
776,"Sing it with me, Laurie. “It’s so nice to have a man around the house.”",1.1777777777777778,0.0730911212732345,45,39,4,2,False,False,71
776,"Yes, they approved him to work remotely.  No, it wasn't because of Covid.  It was his B.O.",1.1777777777777778,0.0576377479502509,45,37,8,0,False,True,90
776,He really commits to this charades thing.,1.1777777777777778,0.0730911212732345,45,39,4,2,False,True,41
776,"This whole working from home thing has really brought us closer together.""",1.1777777777777778,0.065819533566242,45,38,6,1,False,False,74
776,Matt when you're done changing the tire could pass me the milk?,1.1774193548387095,0.0540491263913043,62,52,9,1,True,True,63
776,"I wanted a pool table there, but if he's happy, I'm happy.",1.1774193548387095,0.0540491263913043,62,52,9,1,False,True,58
776,He just can't leave his work at work!,1.1774193548387095,0.0540491263913043,62,52,9,1,False,True,37
776,Don't you just love concierge service?!,1.1774193548387095,0.058737796974655,62,53,7,2,True,True,39
776,"Well, he always wanted to work from home!",1.1774193548387095,0.063078915044636,62,54,5,3,False,True,41
776,"What the hell, working from home is in.",1.1774193548387095,0.058737796974655,62,53,7,2,False,True,39
776,"Oh no, he's always worked from home. He's just in the living room for a Zoom call.",1.1774193548387095,0.0540491263913043,62,52,9,1,False,True,82
776,"He does great work, for a good price, and makes house calls!",1.1774193548387095,0.0540491263913043,62,52,9,1,False,True,60
776,All I said was to put the brakes on our relationship.,1.1774193548387095,0.0540491263913043,62,52,9,1,False,True,53
776,"Oh he’s no John Travolta, that’s for sure Miriam, but Matt’s so much more, and then some!",1.1774193548387095,0.063078915044636,62,54,5,3,False,True,89
776,Matt is much happier working at home.,1.1764705882352942,0.0539126552347745,51,42,9,0,False,True,37
776,"Yeah, we decided to keep working from home after the pandemic.",1.1764705882352942,0.0607526799405084,51,43,7,1,False,True,62
776,In-home delivery is the way of the future.,1.1764705882352942,0.0607526799405084,51,43,7,1,False,True,42
776,Matt decided to take his work home tonight,1.1764705882352942,0.0539126552347745,51,42,9,0,False,False,42
776,"He got bugged driving up and down this same old strip
So he found a new place where the kids are hip",1.1764705882352942,0.0539126552347745,51,42,9,0,False,False,100
776,Working from home has its limits;  Matt couldn’t figure out how to do a lube job on zoom.,1.1764705882352942,0.0668969494479685,51,44,5,2,False,True,89
776,I told he has to stop bringing his work home,1.1764705882352942,0.0539126552347745,51,42,9,0,False,False,44
776,It's great they do house calls now.,1.1764705882352942,0.0607526799405084,51,43,7,1,False,True,35
776,His working from home has definitely given us more time together.,1.1764705882352942,0.0607526799405084,51,43,7,1,False,True,65
776,I get to see so much more of Matt now that he's working from home.,1.1764705882352942,0.0607526799405084,51,43,7,1,False,True,66
776,"The sculpture is a little large and inconvenient, I admit.",1.1764705882352942,0.0539126552347745,51,42,9,0,False,True,58
776,I would have brought it in but my car wasn’t working,1.1764705882352942,0.0607526799405084,51,43,7,1,False,False,52
776,We’re homeschooling.,1.1764705882352942,0.0607526799405084,51,43,7,1,False,True,20
776,He took the work from home option,1.1764705882352942,0.0607526799405084,51,43,7,1,False,False,33
776,I don’t know how I’ll cope when he doesn’t have to work from home anymore.,1.1764705882352942,0.0668969494479685,51,44,5,2,False,True,74
776,"Matt really likes to bring home work with him”
Lenin Saenz, Brooklyn, NY",1.1764705882352942,0.0607526799405084,51,43,7,1,False,False,72
776,He is working from home office.,1.1764705882352942,0.0668969494479685,51,44,5,2,False,True,31
776,He's one of those guys who brings his work home!,1.1764705882352942,0.0510692366476834,68,57,10,1,False,True,48
776,At least it keeps him busy,1.1764705882352942,0.0539126552347745,51,42,9,0,False,False,26
776,We're so lucky Matt is able to work from home.,1.1764705882352942,0.0539126552347745,51,42,9,0,False,True,46
776,I imagine this is what everyone's WFH looks like during the COVID,1.1764705882352942,0.0539126552347745,51,42,9,0,False,False,65
776,...and he even cleans the bathroom.,1.1764705882352942,0.0539126552347745,51,42,9,0,False,True,35
776,"Yes, I too wish I knew how he got that in here!",1.1764705882352942,0.0539126552347745,51,42,9,0,False,True,47
776,That’s New York real estate for am I right?,1.1764705882352942,0.0465734405965753,68,56,12,0,True,True,43
776,They take in home repairs to a whole new level,1.1764705882352942,0.0607526799405084,51,43,7,1,False,False,46
776,They said it would be neat working from home.,1.1764705882352942,0.0607526799405084,51,43,7,1,False,True,45
776,NYC is crazy,1.1764705882352942,0.0539126552347745,51,42,9,0,False,False,12
776,and the great thing is I only have to pay for three tires instead of four.,1.1756756756756757,0.0485178627857396,74,62,11,1,False,True,74
776,The therapist said he should find a hobby that kept him home.,1.1754385964912282,0.0619382373747237,57,49,6,2,False,True,61
776,"He's going to change the name to Matt's Living Room, but other than that it's business as usual.",1.1754385964912282,0.0508253127585795,57,47,10,0,False,True,96
776,Working from home has really changed our relationship.,1.1754385964912282,0.0566549100524176,57,48,8,1,False,True,54
776,"It's an adjustment, but it's been nice having him work from home.",1.1754385964912282,0.0619382373747237,57,49,6,2,False,True,65
776,He's very comfortable in his home office.,1.1754385964912282,0.0566549100524176,57,48,8,1,False,True,41
776,Jerry finds working from home relaxing because the boss isn't always breathing down his neck.,1.1754385964912282,0.0566549100524176,57,48,8,1,False,True,93
776,The NASH was my favorite,1.1754385964912282,0.0668050272444202,57,50,4,3,False,False,24
776,Matt use to never work from home until covid.,1.1754385964912282,0.0508253127585795,57,47,10,0,False,True,45
776,He's got everything but the kitchen sink in that tool box.,1.1754385964912282,0.0508253127585795,57,47,10,0,False,True,58
