contest,caption,mean,precision,votes,not_funny,somewhat_funny,funny,has_question_mark,ends_with_punctuation,caption_length
864,And the Oscar for Best Actor goes to…”Simba”.,1.1228070175438596,0.043859649122807,57,50,7,0,False,True,45
864,Just hoof it,1.1228070175438596,0.043859649122807,57,50,7,0,False,False,12
864,The speech is great.  Just remind them: it’s a jungle out there.,1.1228070175438596,0.043859649122807,57,50,7,0,False,True,64
864,I forgot to fact-check ChatGPT.,1.1228070175438596,0.0504998538336087,57,51,5,1,False,True,31
864,I was told they're vegan-curious.,1.1228070175438596,0.0504998538336087,57,51,5,1,False,True,33
864,"You need to delete 'La jungle, c'est moi' from your manifesto.",1.1228070175438596,0.043859649122807,57,50,7,0,False,True,62
864,"You’re a natural influencer.  I was a skeptic too, and now I can’t go three days without my seitan fajitas!",1.1228070175438596,0.043859649122807,57,50,7,0,False,True,107
864,"To be honest, I didn't expect this turnout when I announced you were getting roasted",1.1228070175438596,0.043859649122807,57,50,7,0,False,False,84
864,The slot right before lunch is always the worst,1.1228070175438596,0.0563631231680426,57,52,3,2,False,False,47
864,Don't worry. They are TED talk junkies!,1.1228070175438596,0.043859649122807,57,50,7,0,False,True,39
864,"Cedric, the best way to calm your nerves is to picture them naked...
Oh, wait. Well, good luck!",1.1224489795918366,0.0555786892461503,49,44,4,1,False,True,95
864,"Don't worry they're all from the zoo, so you've a captive audience.",1.1224489795918366,0.0473143800790597,49,43,6,0,False,True,67
864,Relax.  Forget about the worst case scenario.,1.1216216216216215,0.0428212003892668,74,66,7,1,False,True,45
864,You'll be alright--just don't wander into lyin' territory.,1.1216216216216215,0.0428212003892668,74,66,7,1,False,True,58
864,Don't worry -- they already had a large lunch in the hotel restaurant.,1.1216216216216215,0.0428212003892668,74,66,7,1,False,True,70
864,They're smiling for the taste of you.,1.1216216216216215,0.0382546984804765,74,65,9,0,False,True,37
864,The FEAR in my eyes should be ruined by the HOPE in the eyes of my crowd.,1.1216216216216215,0.0469455903117995,74,67,5,2,False,True,73
864,"Remember, imagine them all in their underwear!",1.1216216216216215,0.0382546984804765,74,65,9,0,False,True,46
864,I think it's cultural,1.121212121212121,0.0458799056377558,66,59,6,1,False,False,21
864,Read extra slowly that line about how a gazelle meat contains twice the cholesterol than a zebra's.,1.121212121212121,0.0458799056377558,66,59,6,1,False,True,99
864,I think they're really looking forward to this!,1.121212121212121,0.0458799056377558,66,59,6,1,False,True,47
864,"Don't worry, they'll eat it all up.",1.121212121212121,0.0507066682747924,66,60,4,2,False,True,35
864,Our keynote presentation on ‘Vegan Diets for Cats’ has been postponed because the speaker was eaten.,1.121212121212121,0.0458799056377558,66,59,6,1,False,True,100
864,"Just picture them wearing clothes""",1.121212121212121,0.0458799056377558,66,59,6,1,False,False,34
864,Remember: just imagine your audience clothed.,1.121212121212121,0.040481665913459,66,58,8,0,False,True,45
864,"Wait a minute !  
First move the podium way back.",1.121212121212121,0.0458799056377558,66,59,6,1,False,True,49
864,"Don't be, they came here for you!",1.121212121212121,0.040481665913459,66,58,8,0,False,True,33
864,Break a leg... but not a compound fracture. They'll smell it.,1.121212121212121,0.040481665913459,66,58,8,0,False,True,61
864,I hope they don't think we're dinner.,1.121212121212121,0.0458799056377558,66,59,6,1,False,True,37
864,Just imagine them with their clothes off.,1.121212121212121,0.0458799056377558,66,59,6,1,False,True,41
864,Just close your eyes and imagine them all naked.,1.121212121212121,0.040481665913459,66,58,8,0,False,True,48
864,"Go ahead, go tell them:
""live and let live"" is modern these days.",1.121212121212121,0.040481665913459,66,58,8,0,False,True,65
864,Go ahead and give your paper on the imporance of a vegetarian diet for feline Longevity.,1.121212121212121,0.0458799056377558,66,59,6,1,False,True,88
864,Start with the bit where you purr.,1.121212121212121,0.040481665913459,66,58,8,0,False,True,34
864,Not to worry.  After a show like this they all already have dinner plans.,1.121212121212121,0.0458799056377558,66,59,6,1,False,True,73
864,"And, now, the award for the tiger most likely to befriend its prey rather than eating goes to ...",1.121212121212121,0.0458799056377558,66,59,6,1,False,True,97
864,Go on. They all ate at the buffet that was provided before the presentation. It'll be okay.,1.121212121212121,0.0458799056377558,66,59,6,1,False,True,91
864,I would avoid taking your beta blocker before this speech.,1.121212121212121,0.040481665913459,66,58,8,0,False,True,58
864,Just vamp at the end -- lunch is running a little late.,1.121212121212121,0.040481665913459,66,58,8,0,False,True,55
864,"Too many applicants 
I am worried about the reaction when I announce I filled the position at the Bronx Zoo
Pam Sutton, Chatham NJ",1.121212121212121,0.0458799056377558,66,59,6,1,False,False,130
864,They want to hear your poetry.,1.121212121212121,0.040481665913459,66,58,8,0,False,True,30
864,Go ahead. It’s OK to be vulnerable.,1.121212121212121,0.040481665913459,66,58,8,0,False,True,35
864,Am I being thrown to the lions,1.121212121212121,0.040481665913459,66,58,8,0,False,False,30
864,I feel prey of fears,1.121212121212121,0.040481665913459,66,58,8,0,False,False,20
864,"Relax, they're vegetarians.  I think.",1.1206896551724137,0.0554232802355917,58,53,3,2,False,True,37
864,"Stop the President,  he is about to read a memo from Obama!",1.1206896551724137,0.0431487964717558,58,51,7,0,False,True,59
864,I recommend a quick exit.,1.1206896551724137,0.0431487964717558,58,51,7,0,False,True,25
864,Imagine them all as hairless cats.,1.1206896551724137,0.0554232802355917,58,53,3,2,False,True,34
864,Don't be nervous. They're impressed that you have the courage to do this.,1.1206896551724137,0.0554232802355917,58,53,3,2,False,True,73
864,It’s OK. They need to know red meat is bad for them.,1.1206896551724137,0.0431487964717558,58,51,7,0,False,True,52
864,good luck! This looks like a tough audience!,1.1206896551724137,0.0554232802355917,58,53,3,2,False,True,44
864,Just be ready to run.,1.1206896551724137,0.0431487964717558,58,51,7,0,False,True,21
864,You'll be fine. What are you so jumpy about?,1.1206896551724137,0.0431487964717558,58,51,7,0,True,True,44
864,"Don't worry, they all said they were vegan at the door.",1.1206896551724137,0.049666682137193,58,52,5,1,False,True,55
864,Don’t worry- they just ate a herd of water buffalo.,1.1206896551724137,0.049666682137193,58,52,5,1,False,True,51
864,Be sure to project to the rear row so the whole room can grasp you.,1.1206896551724137,0.0431487964717558,58,51,7,0,False,True,67
864,I told you not to hit that vape pen.,1.1206896551724137,0.0431487964717558,58,51,7,0,False,True,36
864,First tell them about all our vegetarian options on the menu,1.1206896551724137,0.049666682137193,58,52,5,1,False,False,60
864,"It's ok Jeremy, we've been playing Hakuna Matata on repeat for the past half hour - just give your speech on Vegan Empowerment and let's get the fuck outta here.",1.1206896551724137,0.049666682137193,58,52,5,1,False,True,161
864,Don't be nervous. Just remember you're the GOAT.,1.1206896551724137,0.049666682137193,58,52,5,1,False,True,48
864,Don't worry -- the worst they'll do is eat you.,1.1206896551724137,0.0431487964717558,58,51,7,0,False,True,47
864,Don’t be nervous. Just picture them with no fur on.,1.1206896551724137,0.049666682137193,58,52,5,1,False,True,51
864,"There's nothing to worry about. Just begin with a little prey...er, I mean prayer.",1.1206896551724137,0.0431487964717558,58,51,7,0,False,True,82
864,"Just remember, they're more afraid of you than you are of them.",1.1206896551724137,0.049666682137193,58,52,5,1,False,True,63
864,Don't be nervous - they've already eaten,1.1206896551724137,0.0431487964717558,58,51,7,0,False,False,40
864,Your talk on how to mate with a Lion will be excellent,1.1206896551724137,0.0431487964717558,58,51,7,0,False,False,54
864,"Just picture them in a less formal setting, like a gourmet diner with friends",1.1206896551724137,0.0431487964717558,58,51,7,0,False,False,77
864,"Just remember, this is an eat on the run audience.",1.1206896551724137,0.0431487964717558,58,51,7,0,False,True,50
864,"If you're nervous about public speaking, just imagine them in their underwear.",1.1206896551724137,0.049666682137193,58,52,5,1,False,True,78
864,"Just do what you do best,  go sell.",1.1206896551724137,0.0431487964717558,58,51,7,0,False,True,35
864,I know it's a tough crowd. Just stay calm—and don't look them in the eyes.,1.1206896551724137,0.049666682137193,58,52,5,1,False,True,74
864,I didn’t expect so many hungry reporters for our news conference today!,1.1206896551724137,0.0431487964717558,58,51,7,0,False,True,71
864,"You realize, don’t you, that no matter what you say, they are going to eat you alive.",1.1206896551724137,0.049666682137193,58,52,5,1,False,True,85
864,Waiting patiently for dinner.,1.1206896551724137,0.0431487964717558,58,51,7,0,False,True,29
864,Just remember to roar how we rehearsed.,1.1206896551724137,0.049666682137193,58,52,5,1,False,True,39
864,"I'm telling you, there's nothing to worry about. The audience has been dying to meat you.",1.1206896551724137,0.0431487964717558,58,51,7,0,False,True,89
864,"If you can just make it through the primary, the election numbers look great.",1.1206896551724137,0.0431487964717558,58,51,7,0,False,True,77
864,Don't worry they've turned vegan just for the conference,1.1206896551724137,0.0431487964717558,58,51,7,0,False,False,56
864,"I stand before you as you await your lunch, with a LOT of trepidation",1.1206896551724137,0.049666682137193,58,52,5,1,False,False,69
864,"Know thy enemies, darling!",1.1206896551724137,0.0431487964717558,58,51,7,0,False,True,26
864,"It's okay, you just warm them up for me.",1.1206896551724137,0.0431487964717558,58,51,7,0,False,True,40
864,You’ll be fine. Go out their and present them with their 1 month sobriety pins like we practiced.,1.1206896551724137,0.0554232802355917,58,53,3,2,False,True,97
864,Don't worry--they'll lap you up!,1.120481927710843,0.0359481389331235,83,73,10,0,False,True,32
864,"Picture them naked, it helps, but make sure you hightail it out of here after the talk.",1.12,0.0377760112641213,75,66,9,0,False,True,87
864,Don't worry. You'll be famous. They will lionize you.,1.12,0.0422775045075674,75,67,7,1,False,True,53
864,"Don't fluff your lions, they might get overfriendly.",1.12,0.0545108115095397,50,45,4,1,False,True,52
864,That’s too old for these critters sake.,1.12,0.0463437994530848,75,68,5,2,False,True,39
864,Just imagine the audience is vegan.,1.12,0.0464230765979197,50,44,6,0,False,True,35
864,Be sure to throw them some red meat.,1.12,0.0545108115095397,50,45,4,1,False,True,36
864,Selling your own to the wolves,1.1194029850746268,0.0452261419606484,67,60,6,1,False,False,30
864,"Just imagine they're all in their underwear... Oh right, lions don't wear underwear.  You're screwed.",1.1194029850746268,0.0452261419606484,67,60,6,1,False,True,101
864,"On second thought, don't make eye contact with your audience.",1.1194029850746268,0.0399139058759117,67,59,8,0,False,True,61
864,Your in luck we fed them beforehand.,1.1194029850746268,0.0452261419606484,67,60,6,1,False,True,36
864,Make sure you’re correct or they’ll eat us alive- and I mean that literally!,1.1194029850746268,0.0399139058759117,67,59,8,0,False,True,76
864,"Ignore the growling, just picture them fur-less and in their underwear.",1.1194029850746268,0.0399139058759117,67,59,8,0,False,True,71
864,"Don't worry.  They love you, a lot.",1.1194029850746268,0.0399139058759117,67,59,8,0,False,True,35
864,Relax. Just don't tell any bald head jokes.,1.1194029850746268,0.0452261419606484,67,60,6,1,False,True,43
864,It will be OK just visualize!,1.1194029850746268,0.0399139058759117,67,59,8,0,False,True,29
864,You'll be alright.  Just don't mention that hunger is a red meat issue.,1.1194029850746268,0.0452261419606484,67,60,6,1,False,True,71
864,"I said, ""pray""",1.1194029850746268,0.0399139058759117,67,59,8,0,False,False,14
864,It’s nature. You can’t reverse the Food Web.,1.1194029850746268,0.0399139058759117,67,59,8,0,False,True,44
864,Just keep on reading. I am going to try to slip out the back door.,1.1194029850746268,0.0452261419606484,67,60,6,1,False,True,66
864,They're hungry for your dissertation (I hope),1.1194029850746268,0.0399139058759117,67,59,8,0,False,False,45
864,Don’t go. They’ll make minced meat out of us.,1.1194029850746268,0.0399139058759117,67,59,8,0,False,True,45
864,They’re here for the red meat.,1.1194029850746268,0.0452261419606484,67,60,6,1,False,True,30
864,Get out there! You’re sure to be a killing!,1.1194029850746268,0.0399139058759117,67,59,8,0,False,True,43
864,"Big applause for Earl, who will sing “Homeless on the Range.”",1.1194029850746268,0.0452261419606484,67,60,6,1,False,False,61
864,"O.K., you've got the lion's share of the speech.",1.1194029850746268,0.0452261419606484,67,60,6,1,False,True,48
864,"Nothing to worry about. When you're done, just remind them of the wildebeest buffet in the lobby.",1.1194029850746268,0.0452261419606484,67,60,6,1,False,True,97
864,It helps to imagine your audience in their underwear before they devour you.,1.1194029850746268,0.0452261419606484,67,60,6,1,False,True,76
864,"I have drawn up a peace treaty for impalas and lions.

Susan Hanna, Columbus, Ohio",1.1194029850746268,0.0452261419606484,67,60,6,1,False,False,82
864,Breaking a leg is the best case scenario,1.1194029850746268,0.0399139058759117,67,59,8,0,False,False,40
864,Just imagine they aren’t wearing any clothes.,1.1194029850746268,0.0452261419606484,67,60,6,1,False,True,45
864,This isn’t the audience the promoters promised us!,1.1194029850746268,0.0452261419606484,67,60,6,1,False,True,50
864,Just look in their eyes and forget about their big toothy smiles.,1.1194029850746268,0.0399139058759117,67,59,8,0,False,True,65
864,Better lead with the announcement that complimentary tuna fish will be available in the lobby.,1.1194029850746268,0.0399139058759117,67,59,8,0,False,True,94
864,"Go ahead, they’re hungry for what you have to share!",1.119047619047619,0.039375364944759,84,75,8,1,False,True,52
864,See-your entire fan club turned out.,1.11864406779661,0.0488604554261294,59,53,5,1,False,True,36
864,Remember to leave them hungry for more.,1.11864406779661,0.0424604588824107,59,52,7,0,False,True,39
864,Don't emphasize how fast we can run.  Point out the slowness of all the other animals.,1.11864406779661,0.0488604554261294,59,53,5,1,False,True,86
864,Wrap it up.,1.11864406779661,0.0488604554261294,59,53,5,1,False,True,11
864,Don't think of them as hostile; think of them as hungry for your content.,1.11864406779661,0.0488604554261294,59,53,5,1,False,True,73
864,Maybe skip that 'thorn in the paw' joke.,1.11864406779661,0.0424604588824107,59,52,7,0,False,True,40
864,Annual meeting of the Association of meat producers. The president asks advisor: “Are you sure it is absolutely necessary to talk about price increase right now?”,1.11864406779661,0.0488604554261294,59,53,5,1,True,False,162
864,You'll do great. Just don't let them vote on anything.,1.11864406779661,0.0424604588824107,59,52,7,0,False,True,54
864,"Lions and Tigers and Mikes, oh, my!",1.11864406779661,0.0488604554261294,59,53,5,1,False,True,35
864,"Relax, it's not like they can smell fear!",1.11864406779661,0.0424604588824107,59,52,7,0,False,True,41
864,Trust me. Use the joke about 'Who is this skinny guy with a funny name.',1.11864406779661,0.0424604588824107,59,52,7,0,False,False,72
864,Picture them all as vegetarians!,1.11864406779661,0.0424604588824107,59,52,7,0,False,True,32
864,"Hurry up, the 'Meet & Greet is immediately after you're done.""",1.11864406779661,0.0488604554261294,59,53,5,1,False,False,62
864,The influence of critics entirely depends on whether you are viewed as the appetizer or the main course.,1.11864406779661,0.0424604588824107,59,52,7,0,False,True,104
864,"Tough crowd, tonight.  During Q and A, it's okay to be evasive, very  evasive.",1.11864406779661,0.0545141966866675,59,54,3,2,False,True,78
864,"C’mon, it’s just public speaking",1.11864406779661,0.0488604554261294,59,53,5,1,False,False,32
864,You have nothing to worry about. They’re actors—they want to be loved even more than they want to be fed.,1.11864406779661,0.0424604588824107,59,52,7,0,False,True,105
864,Did you see that we are item number three on their on their DoorDash account?,1.11864406779661,0.0424604588824107,59,52,7,0,True,True,77
864,This audience should be very receptive to your thesis on the circle of life.,1.11864406779661,0.0424604588824107,59,52,7,0,False,True,76
864,"Look at it this way, public speaking ain’t such a big deal now, is it?",1.11864406779661,0.0488604554261294,59,53,5,1,True,True,70
864,I suspect that any utterance will be highly palatable to this audience.,1.11864406779661,0.0488604554261294,59,53,5,1,False,True,71
864,Just avoid the word ‘pray’ so there’s no misunderstanding.,1.11864406779661,0.0424604588824107,59,52,7,0,False,True,58
864,"Just remember, one false step and you're lunch.",1.11864406779661,0.0424604588824107,59,52,7,0,False,True,47
864,No Worries ... we've edited out the unsettling parts so you'll only be saying what they want to hear ...,1.11864406779661,0.0488604554261294,59,53,5,1,False,True,104
864,I know they're a tough crowd. Just keep your eyes on them.,1.11864406779661,0.0424604588824107,59,52,7,0,False,True,58
864,"Lions, check; Tigers, check; but no Bears- you’ll have them eating out of your hand…..",1.11864406779661,0.0424604588824107,59,52,7,0,False,True,86
864,It will be fine - just pretend they’re all hairless,1.11864406779661,0.0424604588824107,59,52,7,0,False,False,51
864,Don't worry. They will love your speech on veganism.,1.11864406779661,0.0424604588824107,59,52,7,0,False,True,52
864,"See, I told you we'd get a full audience with the free doughnut treat!",1.11864406779661,0.0424604588824107,59,52,7,0,False,True,70
864,It's easy!  Just present your fear honestly and they'll respond.,1.11864406779661,0.0488604554261294,59,53,5,1,False,True,64
864,"« just picture them naked, you’ll be fine »",1.11864406779661,0.0488604554261294,59,53,5,1,False,False,43
864,"On Today's 5⭐Menu:  Braised WARTHOG bellies, w/ Premium Road~Kill parts & Serengeti cream of broccoli soup.  Unfortunately, we are & will be fresh out of antelope, for the foreseeable future.  Bon Appètit‼️",1.11864406779661,0.0488604554261294,59,53,5,1,False,False,206
864,"Start with ""An introduction to veganism""",1.11864406779661,0.0424604588824107,59,52,7,0,False,False,40
864,Just imagine that they're naked.,1.118421052631579,0.0417473825764589,76,68,7,1,False,True,32
864,How much cheese is too much cheese to eat before public speaking?,1.118421052631579,0.0373090707335732,76,67,9,0,True,True,65
864,"Start by saying, ""Welcome to Vegetarian 101""",1.118421052631579,0.0417473825764589,76,68,7,1,False,False,44
864,"You can do it,the words are all right there. Just imagine they",1.118279569892473,0.0400136207687996,93,84,7,2,False,False,62
864,What are you so scared about?,1.118279569892473,0.0369775033815525,93,83,9,1,True,True,29
864,Just imagine they’re all declawed.”,1.1176470588235294,0.0393617414775415,68,60,8,0,False,False,35
864,"Just picture them without any fur on.""",1.1176470588235294,0.0445906745286408,68,61,6,1,False,False,38
864,"Just remember, there is no love sincerer than the love of food.",1.1176470588235294,0.0445906745286408,68,61,6,1,False,True,63
864,Don’t be nervous. They’ll just eat you up.,1.1176470588235294,0.0455645099553813,51,45,6,0,False,True,42
864,They love jokes about goats being eaten by lions,1.1176470588235294,0.0445906745286408,68,61,6,1,False,False,48
864,You only need to run your mouth this time.,1.1176470588235294,0.0393617414775415,68,60,8,0,False,True,42
864,One slip you are their meals,1.1176470588235294,0.0393617414775415,68,60,8,0,False,False,28
864,"Trust me, it's nothing out of the ordinary - fear of public speaking is a common form of anxiety.",1.1176470588235294,0.0455645099553813,51,45,6,0,False,True,97
864,They prey on nervousness.,1.1176470588235294,0.0393617414775415,68,60,8,0,False,True,25
864,Don't report that hyenas are smarter than lions.,1.1176470588235294,0.0455645099553813,51,45,6,0,False,True,48
864,"Don’t worry, the overwhelming majority are vegetarians.",1.1176470588235294,0.0393617414775415,68,60,8,0,False,True,55
864,Don' be afraid.  Audiences don't bite.  Pick just one to look at and then imagine him naked.  You'll be fine.,1.1176470588235294,0.0393617414775415,68,60,8,0,False,True,109
864,Just try to imagine them naked.,1.1176470588235294,0.0455645099553813,51,45,6,0,False,True,31
864,"Look, just by being here they're showing that they're willing to listen.",1.1176470588235294,0.0603717816405515,51,47,2,2,False,True,72
864,"Normally I'd say 'Break a leg,' but tonight ... not so much.",1.1176470588235294,0.0455645099553813,51,45,6,0,False,True,60
864,"Don't worry, they can't get you from behind the podium",1.1176470588235294,0.0534830654783758,51,46,4,1,False,False,54
864,Make this good or they’ll eat you alive.,1.1176470588235294,0.0492677360723378,68,62,4,2,False,True,40
864,"No need to be nervous, these predators won’t pounce if you stumble. They’re vegetarians.",1.1176470588235294,0.0534830654783758,51,46,4,1,False,True,88
864,They look hungry out there.,1.1176470588235294,0.0445906745286408,68,61,6,1,False,True,27
864,Stress the part about a heart-healthier life in the jungle and this 'Meat Eaters Anonymous' concept could really take off.,1.1176470588235294,0.0445906745286408,68,61,6,1,False,True,122
864,"Don’t be nervous, the audience will just eat you up!",1.1176470588235294,0.0393617414775415,68,60,8,0,False,True,52
864,Sharing what they’ve learned from their diversity trainings was not always comfortable….,1.1176470588235294,0.0534830654783758,51,46,4,1,False,True,88
864,You told me there was catering after the presentation,1.1176470588235294,0.0393617414775415,68,60,8,0,False,False,53
864,Don’t worry! They’re MUCH more scared of you than you are of them!,1.1176470588235294,0.0492677360723378,68,62,4,2,False,True,66
864,Just pretend they're vegetarian.,1.1168831168831168,0.036853453360789,77,68,9,0,False,True,32
864,Nerves! Don't be silly! Everyone in the audience is here because they love you!,1.1168831168831168,0.0451852190869129,77,70,5,2,False,True,79
864,they're not gonna eat you!,1.1168831168831168,0.036853453360789,77,68,9,0,False,True,26
864,"Remember, no lunch breaks during your ""Veganism for Newbies"" lecture.",1.1166666666666667,0.0480798927085171,60,54,5,1,False,True,69
864,"If you slip up, they’re going to eat you alive",1.1166666666666667,0.0417935919902811,60,53,7,0,False,False,46
864,"Remember, imagine that your audience is naked ... and declawed ... and defanged ...",1.1166666666666667,0.0480798927085171,60,54,5,1,False,True,83
864,"Relax, they're going to eat it up.",1.1166666666666667,0.0417935919902811,60,53,7,0,False,True,34
864,"Herb, I don't think, ""Bring it on!"" is the correct choice for your opening line",1.1166666666666667,0.0480798927085171,60,54,5,1,False,False,79
864,"I'd tell you to just picture them all naked, but none of them are wearing any clothes.",1.1166666666666667,0.0417935919902811,60,53,7,0,False,True,86
864,Remembering they're all naked might not help.,1.1166666666666667,0.0480798927085171,60,54,5,1,False,True,45
864,Just imagine that they're all in their underwear.,1.1166666666666667,0.0417935919902811,60,53,7,0,False,True,49
864,"I'm sure your speech on ""The Ethics of Being a Good Vegetarian"" will be fabulous.",1.1166666666666667,0.0417935919902811,60,53,7,0,False,True,81
864,"Just imagine they're all buck naked""",1.1166666666666667,0.0480798927085171,60,54,5,1,False,False,36
864,THE AWARD FOR TOP MALE PREDITOR GOES TO.,1.1166666666666667,0.0480798927085171,60,54,5,1,False,True,40
864,Just give them something to wet their appetite.,1.1166666666666667,0.0480798927085171,60,54,5,1,False,True,47
864,"We’ll then, picture them naked in a cage.",1.1166666666666667,0.0417935919902811,60,53,7,0,False,True,41
864,And we don't need wickets!,1.1166666666666667,0.0417935919902811,60,53,7,0,False,True,26
864,"And in closing, may we invite you all to join us in the dining room for dinner?",1.1166666666666667,0.0417935919902811,60,53,7,0,True,True,79
864,"Don, don’t worry just imagine them with clothes on.",1.1166666666666667,0.0417935919902811,60,53,7,0,False,True,51
864,"Go for it, tiger!",1.1166666666666667,0.0417935919902811,60,53,7,0,False,True,17
864,Don't worry — not ALL lions!,1.1166666666666667,0.0417935919902811,60,53,7,0,False,True,28
864,Just don't make any sudden moves and you'll be fine.,1.1166666666666667,0.0480798927085171,60,54,5,1,False,True,52
864,"You first, and give 'em your all.",1.1166666666666667,0.0417935919902811,60,53,7,0,False,True,33
864,"Now,now  I wouldn’t throw you to the lions.",1.1166666666666667,0.0417935919902811,60,53,7,0,False,True,43
864,"Remember, DO NOT LOOK LIKE A DEER IN THE HEADLIGHTS !!",1.1166666666666667,0.0417935919902811,60,53,7,0,False,True,54
864,You'll be fine. Just don't run away.,1.1166666666666667,0.0417935919902811,60,53,7,0,False,True,36
864,"Slow and steady wins the - well, you know what I mean.",1.1166666666666667,0.0417935919902811,60,53,7,0,False,True,54
864,"Don't worry. If they start eating you, I'll use the distraction to run away like a coward.""",1.1166666666666667,0.0480798927085171,60,54,5,1,False,False,91
