contest,caption,mean,precision,votes,not_funny,somewhat_funny,funny,has_question_mark,ends_with_punctuation,caption_length
677,I don't know why I have a sudden urge to open all my tuna cans.,1.3,0.0423373691930506,160,118,36,6,False,True,63
677,"I'll get off the counter if you will be my forever slave. 
Oh wait, you already are...",1.3,0.0404378551086251,160,116,40,4,False,True,86
677,"Sleep is but a glint of death. Life wasted. Time unspent. I free you from your personal tempest. Arise, awakened and renewed. Arise, my servant. Heed your new master and purpose. Life is servitude. Cat is god. Hail.",1.3,0.045036672687849,160,121,30,9,False,True,215
677,"Cat food...can opener...open can...pour cat food in 'Kitty's' bowl...give bowl to 'Kitty'...""Cat food....can opener...",1.3,0.0432558572032728,160,119,34,7,False,True,118
677,"Now, retrieve the salmon from the fridge and return to bed until further instruction from me.",1.3,0.045036672687849,160,121,30,9,False,True,93
677,Must. Find. Catnip.,1.3,0.0432558572032728,160,119,34,7,False,True,19
677,How the cat got your tongue,1.3,0.0423373691930506,160,118,36,6,False,False,27
677,"You’re getting sleepy, very sleepy. 
Now get me a can of food and open it.",1.3,0.0441552435684731,160,120,32,8,False,True,74
677,Never teach your cat hypnosis.,1.3,0.045036672687849,160,121,30,9,False,True,30
677,"You are now under my spell.  Open the refrigerator and take out  the tuna fish. Then return to your bed. When you awake in the morning, you will feel rested and refreshed. You will have no memory of what occurred.",1.3,0.0441552435684731,160,120,32,8,False,True,213
677,"Sometimes karma sucks, doesn't it?  Now get me some warm milk and put on another cat video.",1.3,0.045036672687849,160,121,30,9,True,True,91
677,Thank you for letting me know the dog wants to go out running in the street without his collar. I'll let him out right now.,1.3,0.0441552435684731,160,120,32,8,False,True,123
677,Yes master... open tuna can now.,1.3,0.0437078638060768,160,122,29,9,False,True,32
677,"You will now leave the faucet dripping...dripping very, very slowly",1.3,0.0413985081613748,160,117,38,5,False,False,67
677,Last time ..I house sit... for a hypnotist..,1.3,0.0441552435684731,160,120,32,8,False,True,44
677,I've been a bad little doggie and I crave your discipline...,1.3,0.0467497015091536,160,123,26,11,False,True,60
677,"What the pussy wants, the pussy gets",1.3,0.045036672687849,160,121,30,9,False,False,36
677,Another innocent seized from sleep by the dreaded catpurr beam.,1.3,0.0459011790588619,160,122,28,10,False,True,63
677,"You know what to do, Fred",1.3,0.0459011790588619,160,122,28,10,False,False,25
677,"You are in a deep catnap, open the fridge and pass the smoked salmon ..",1.3,0.0423373691930506,160,118,36,6,False,True,71
677,Tuuuuu-naaa.....tuuuuu-naaa.....tuuuuu-naaa,1.3,0.0432558572032728,160,119,34,7,False,False,43
677,catalepsy,1.3,0.0413985081613748,160,117,38,5,False,False,9
677,"You know, as a cartoonist, I sometimes regret I gave you a superpower.",1.3,0.0413985081613748,160,117,38,5,False,True,70
677,Now show me where you hide the cat food!,1.3,0.0441552435684731,160,120,32,8,False,True,40
677,Powers of  Purr-suasion,1.3,0.0489258215863269,150,116,23,11,False,False,23
677,I am opening the gourmet cat food can....I am opening the gourmet cat food can... I am opening...,1.3,0.0404378551086251,160,116,40,4,False,True,97
677,You will buy canned food with more gravy.,1.3,0.0432558572032728,160,119,34,7,False,True,41
677,A little Ambien and autosuggestion gets kitty the snack every time.,1.3,0.045036672687849,160,121,30,9,False,True,67
677,Pets nowadays just do whatever they want with you.,1.3,0.0413985081613748,160,117,38,5,False,True,50
677,You-will-open-the-fridge-lift-out-the-plate-of-Sole-Walewska-take-the-film-off-it-put-it-on-the-floor-have-a-sip-of-milk-and-go-back-to-bed,1.3,0.0432558572032728,160,119,34,7,False,False,139
677,You WILL keep filling my bowl with catnip.,1.3,0.0467497015091536,160,123,26,11,False,True,42
677,"Following his death, Freud's experiments with hypnotism continued despite his reincarnation as a cat",1.3,0.0441552435684731,160,120,32,8,False,False,100
677,"You summoned me, Your Aloofness?",1.3,0.045036672687849,160,121,30,9,True,True,32
677,"Yes, Jim, you will make me an Instagram account and make all of your friends follow it.",1.3,0.0384446019797792,160,119,36,5,False,True,87
677,Tweety Bird should be free.  Tweety Bird should be free.  Tweety Bird should be ...,1.3,0.0441552435684731,160,120,32,8,False,True,83
677,"Finally, the chicken leg is on the top shelf.
I’ll wait here.",1.3,0.0432558572032728,160,119,34,7,False,True,61
677,"Good boy, treats are in the second drawer.",1.3,0.0394538182383518,160,115,42,3,False,True,42
677,Now open the fridge and unscrew the pickled herring,1.3,0.0404378551086251,160,116,40,4,False,False,51
677,"Of all the pills her human took, Whiskers found the one that induced sleep-petting to be the most effective.",1.3,0.0423373691930506,160,118,36,6,False,True,108
677,"No, Mel...you're sleepwalking. I know a catnap when I see one !",1.3,0.0467497015091536,160,123,26,11,False,True,63
677,Must...build...tuna...castle...,1.3,0.0404378551086251,160,116,40,4,False,True,31
677,Yes human. Use thumbs. Wet food. Yum yums.,1.3,0.0432558572032728,160,119,34,7,False,True,42
677,Tomcatatonia,1.3,0.0423373691930506,160,118,36,6,False,False,12
677,He’s obviously in a catatonic state.,1.3,0.0432558572032728,160,119,34,7,False,True,36
677,I better wake him up before he mistakes me for a throw pillow again.,1.3,0.0432558572032728,160,119,34,7,False,True,68
677,"I must put the left over tuna in the cat's dish, I must put the left over tuna in the cat's dish.",1.3,0.0441552435684731,160,120,32,8,False,True,97
677,"...slowly, slowly, ... one small step,  ...now reach to the left...",1.3,0.0394538182383518,160,115,42,3,False,True,67
677,"You will open the fridge doors, remove the plate of left-over mahi mahi and place it on the floor.",1.3,0.0394538182383518,160,115,42,3,False,True,98
677,"Well, well, Jim. Let's investigate how many lives you really got.",1.3,0.0423373691930506,160,118,36,6,False,True,65
677,Schrödinger's cat discusses the folly of his experiment.,1.3,0.0441552435684731,160,120,32,8,False,True,56
677,And don't forget the sour cream with that salmon.,1.3,0.0459011790588619,160,122,28,10,False,True,49
677,OPEN THE FRIDGE.  TAKE OUT BROILED CHICKEN &FISH. PLACE IN KITTY'S BOWL.....,1.3,0.0441552435684731,160,120,32,8,False,True,76
677,...now the cat would have TEN lives.,1.3,0.0441552435684731,160,120,32,8,False,True,36
677,And I thought 'Catatonia' was just a cute name.,1.3,0.0317220634287257,160,123,32,5,False,True,47
677,You had me at Meow.,1.2981366459627328,0.04479483986276,161,122,30,9,False,True,19
677,"Hey, how's that Ambien working for you? My cat's getting fat...",1.2974683544303798,0.042600970327117,158,117,35,6,True,True,63
677,"I'm playing along, but know that it is fully my idea to feed you at this absurd hour.",1.2974683544303798,0.040664374612737,158,115,39,4,False,True,85
677,Garfield could never do this.,1.2972972972972974,0.0454386189032425,148,111,30,7,False,True,29
677,Am I your catamite?,1.2972972972972974,0.0454386189032425,148,111,30,7,True,True,19
677,The power of the pussy,1.2972972972972974,0.0464391725937418,148,112,28,8,False,False,22
677,You really are the cat's pajamas.,1.2894736842105263,0.0444080964455871,152,115,30,7,False,True,33
677,Now continue to the open window and let’s see if you also have nine lives.,1.2894736842105263,0.0424004985635689,152,113,34,5,False,True,74
677,The origin of Paul's catatonia.,1.2894736842105263,0.04537860074596,152,116,28,8,False,True,31
677,That's why I just take little cat naps during the day.,1.2894736842105263,0.0444080964455871,152,115,30,7,False,True,54
677,It’s the 3rd night of slipping my captor Ambien...my plan is finally ready to be implemented!!,1.2894736842105263,0.0413601729046015,152,112,36,4,False,True,94
677,Fish. Get fish. Fish...,1.2894736842105263,0.0402929960037456,152,111,38,3,False,True,23
677,"Forget Meow Mix. You have a sudden desire for liver, chicken liver, and give most of it to your feline friend.",1.2894736842105263,0.0434159032404013,152,114,32,6,False,True,110
677,I must...clean...the litter box.,1.2894736842105263,0.0413601729046015,152,112,36,4,False,True,32
677,Must put dog outside.,1.2894736842105263,0.0413601729046015,152,112,36,4,False,True,21
677,What’s the matter?  Cat got your tongue?,1.2894736842105263,0.0444080964455871,152,115,30,7,True,True,40
677,When you adopt a cat named Ambien,1.2894736842105263,0.0444080964455871,152,115,30,7,False,False,33
677,"Feed me, Seymour, feed me.",1.2894736842105263,0.0444080964455871,152,115,30,7,False,True,26
677,Catwalk innovation for NYFW 2019.,1.2894736842105263,0.0413601729046015,152,112,36,4,False,True,33
677,Must ... open ... all the ... tuna.,1.2894736842105263,0.0434159032404013,152,114,32,6,False,True,35
677,I see you got into my catnip.,1.2894736842105263,0.0444080964455871,152,115,30,7,False,True,29
677,"Ok, this is the last time I give the cat catnip.",1.2894736842105263,0.0413601729046015,152,112,36,4,False,True,48
677,Must-take-you-off-senior-cat-food.,1.2894736842105263,0.046328779191793,152,117,26,9,False,True,34
677,"Now veeery slowly, open a can of tuna...",1.2894736842105263,0.0424004985635689,152,113,34,5,False,True,40
677,Take out the fish..take out the fish.. Take out the fish..,1.2894736842105263,0.04537860074596,152,116,28,8,False,True,58
677,Tuuunaaa.,1.2894736842105263,0.0444080964455871,152,115,30,7,False,True,9
677,Oh goody! He's taking  Ambien again.,1.2894736842105263,0.0444080964455871,152,115,30,7,False,True,36
677,"Now turn left at the refrigerator,get out the milk and pour it in a bowl and put it on the counter ,then turnaround and walk  back to the bedroom and when you hear a meow you will fall into a deep sleep.",1.2894736842105263,0.0391967747552931,152,110,40,2,False,True,203
677,She was right ... her pussy is ... very powerful.,1.2894736842105263,0.046328779191793,152,117,26,9,False,True,49
677,You WILL give me TWO cans of wet food this morning,1.2894736842105263,0.0434159032404013,152,114,32,6,False,False,50
677,Open the cabinet and place my catnip on the counter. Return to bed with no memory of this.,1.2894736842105263,0.0413601729046015,152,112,36,4,False,True,90
677,You WILL find the can opener.,1.2894736842105263,0.0434159032404013,152,114,32,6,False,True,29
677,... and when you awaken you will  have no memory of feeding me your leftover salmon.,1.2894736842105263,0.0413601729046015,152,112,36,4,False,True,84
677,You missed my 4:30 AM feeding!,1.2894736842105263,0.0424004985635689,152,113,34,5,False,True,30
677,Guess I was only allowed a cat-nap,1.2894736842105263,0.0444080964455871,152,115,30,7,False,False,34
677,"For the kingdom the power and the tuna are yours, forever and ever, amen.",1.2894736842105263,0.0402929960037456,152,111,38,3,False,True,73
677,Feline control mechanism #37: sleep feeding.,1.2894736842105263,0.0444080964455871,152,115,30,7,False,True,44
677,"Nightly, the voice calls...I must give...grain free tuna treats...",1.2894736842105263,0.04537860074596,152,116,28,8,False,True,66
677,"Now that I've got him, what do I do with him?",1.2894736842105263,0.0386370025150353,152,117,29,6,True,True,45
677,Hypno-cat,1.2894736842105263,0.046328779191793,152,117,26,9,False,False,9
677,"Fixta-puss frigatorium mangio!
Fixta-puss frigatorium mangio!!",1.2894736842105263,0.0444080964455871,152,115,30,7,False,True,62
677,He's not sleepwalking; he's catnotised.,1.2894736842105263,0.0472598577774266,152,118,24,10,False,True,39
677,This will be a cat-astrophic event for you my purrrsonal servant.,1.2894736842105263,0.0424004985635689,152,113,34,5,False,True,65
677,"For the last time Mittens, you were not in The Last Supper.",1.2894736842105263,0.04537860074596,152,116,28,8,False,True,59
677,That's it...sleep walk right over to the treats. Such a good person!,1.2894736842105263,0.0391967747552931,152,110,40,2,False,True,68
677,Now THAT was a weird tuna dream!,1.2894736842105263,0.04537860074596,152,116,28,8,False,True,32
677,"The lox is in the crisper, under the arugula, put it on the counter, don’t bother slicing it, then turn around and go back to bed.",1.2894736842105263,0.0434159032404013,152,114,32,6,False,True,130
677,Will you stop this if I apologize for that laser toy?,1.2894736842105263,0.0434159032404013,152,114,32,6,True,True,53
677,"A new metaphysical state somewhere between hunger, dreaming, and cat videos was discovered.",1.2894736842105263,0.0424004985635689,152,113,34,5,False,True,91
677,"Tuna, tuna, tuna; don't care if it's dolphin-free.",1.2894736842105263,0.04537860074596,152,116,28,8,False,True,50
677,Since he’s been taking Ambien I get my sleep walking snack.,1.2894736842105263,0.0472598577774266,152,118,24,10,False,True,59
677,Now who’s the cat’s meow?,1.2894736842105263,0.0402929960037456,152,111,38,3,True,True,25
677,Why do I have this sudden urge to open a can of tuna?,1.2894736842105263,0.0444080964455871,152,115,30,7,True,True,53
677,I wonder what Freud would say about this.,1.2894736842105263,0.0391967747552931,152,110,40,2,False,True,41
677,No wonder the Pharaohs worshipped cats.,1.2894736842105263,0.0444080964455871,152,115,30,7,False,True,39
677,I will open the fridge.  I will get out the tuna.,1.2894736842105263,0.0413601729046015,152,112,36,4,False,True,49
677,One Ambien too many.,1.2887323943661972,0.0453413406359093,142,107,29,6,False,True,20
677,Now open the fridge and get me some shrimp.,1.2887323943661972,0.0442260901481752,142,106,31,5,False,True,43
677,Opposoble thumbs would be so much easier.,1.2887323943661972,0.0485335711983231,142,110,23,9,False,True,41
677,"(Catnosis at work) OK, Dave now open the fridge and grab the milk",1.2887323943661972,0.0474933407163115,142,109,25,8,False,False,65
677,"Open sardine tin, open sardine tin, open sardine tin.",1.2887323943661972,0.0442260901481752,142,106,31,5,False,True,53
677,"Sorry, your x-ray vision doesn’t impress me at 3:30 a.m.",1.2887323943661972,0.0464298103757555,142,108,27,7,False,True,56
677,I'll believe it' s for real when he eats the Purina.,1.2887323943661972,0.0485335711983231,142,110,23,9,False,True,52
677,Tuna. Must … have … tuna.,1.2887323943661972,0.043081979166787,142,105,33,4,False,True,25
677,The power of toxoplasmosis compels you...,1.2887323943661972,0.0474933407163115,142,109,25,8,False,True,41
677,The true cause of catatonic schizophrenia.,1.2887323943661972,0.0474933407163115,142,109,25,8,False,True,42
677,Catatonic mind-control,1.2887323943661972,0.0464298103757555,142,108,27,7,False,False,22
677,You are herewith ordered to immediately provide cat treats.,1.2887323943661972,0.043081979166787,142,105,33,4,False,True,59
677,New Study Shows Sleepwalking May Actually Be Caused by Hypnotization from Your Cat Wanting a Midnight Snack,1.2887323943661972,0.0464298103757555,142,108,27,7,False,False,107
677,The motion sensor hidden in the stuffed cat registers 'intruder'. Automated reporting is passed to headquarters. Armed response is initiated. Things go rapidly downhill from there.,1.2887323943661972,0.0464298103757555,142,108,27,7,False,True,180
677,Who knew my Cat Scan would give us such a connection,1.2887323943661972,0.0464298103757555,142,108,27,7,False,False,52
677,Thaaat's right!  Toooppp draaawer!,1.2887323943661972,0.0453413406359093,142,107,29,6,False,True,34
677,"You WILL make a Catnip &
Cheese sandwhich - 
for ME, for ME!!",1.2887323943661972,0.0442260901481752,142,106,31,5,False,True,61
677,FEED ME!,1.2887323943661972,0.0474933407163115,142,109,25,8,False,True,8
677,"Yes, take the milk. Now spill it.",1.2887323943661972,0.0464298103757555,142,108,27,7,False,True,33
677,You want tuna .... you want tuna .... you want tuna ....,1.2887323943661972,0.0474933407163115,142,109,25,8,False,True,56
677,My human on Ambien is such fun to mess with,1.2887323943661972,0.0464298103757555,142,108,27,7,False,False,43
677,"Good human, now open the fridge and get me some tuna.",1.2887323943661972,0.0453413406359093,142,107,29,6,False,True,53
677,"All those failed experiments with mice but, ha, I should have known all along it would work with Albert.",1.2887323943661972,0.0464298103757555,142,108,27,7,False,True,104
677,Now go take the plastic off the furniture—we’re gonna party tonight.,1.2887323943661972,0.0453413406359093,142,107,29,6,False,True,68
677,...feed steak...feed steak...feed ...,1.2887323943661972,0.043081979166787,142,105,33,4,False,True,37
677,It might be a sleep-walking cat burglar.,1.2887323943661972,0.0453413406359093,142,107,29,6,False,True,40
677,"I could have had a tabby, but no, I pick the hell cat.",1.2887323943661972,0.0442260901481752,142,106,31,5,False,True,54
677,My cats will always be the boss of me.”,1.2887323943661972,0.0464298103757555,142,108,27,7,False,False,39
677,I'm already catatonic.,1.2887323943661972,0.0464298103757555,142,108,27,7,False,True,22
677,I won't let you sleep until you give me catnip,1.2887323943661972,0.0419066439608378,142,104,35,3,False,False,46
677,"Good, very good. Now human, open five different cans of food for me to choose from.",1.2887323943661972,0.0464298103757555,142,108,27,7,False,True,83
677,"Just a little further, then a sharp left ...",1.2887323943661972,0.043081979166787,142,105,33,4,False,True,44
677,"You'll post about me on social media, you'll post about me...",1.2887323943661972,0.0474933407163115,142,109,25,8,False,True,61
677,"Now, where did you hide the catnip?",1.2887323943661972,0.0464298103757555,142,108,27,7,True,True,35
677,"Fluffy, using her mental powers to extract another midnight snack from her sleeping master, put a new spin on catatonia . . .",1.2887323943661972,0.0442260901481752,142,106,31,5,False,True,125
677,Tonight I want extra catnip with that Tuna Sandwich.,1.2887323943661972,0.0464298103757555,142,108,27,7,False,True,52
677,Suggestion: you will put your pet cat in your next cartoon.,1.2887323943661972,0.0453413406359093,142,107,29,6,False,True,59
677,"Hocus Pocus! Bring me Tuna or Meat, whatever is closest!",1.2887323943661972,0.0442260901481752,142,106,31,5,False,True,56
677,"I was happier when he hissed, scratched, and peed on everything.",1.2887323943661972,0.0495519692255489,142,111,21,10,False,True,64
677,"Phil, trust me. I know catatonic behavior when I see it. You really should see a doctor.",1.2887323943661972,0.0442260901481752,142,106,31,5,False,True,88
677,Hypno-kitty strikes again!,1.2887323943661972,0.043081979166787,142,105,33,4,False,True,26
677,"Yes, master. The Tuna Delight or the Chicken and Carrots.",1.2887323943661972,0.043081979166787,142,105,33,4,False,True,57
677,"Fuck you and your laser pointer, Susan.",1.2887323943661972,0.0485335711983231,142,110,23,9,False,True,39
677,It’s about time...after 7 lives of practice!,1.2887323943661972,0.0474933407163115,142,109,25,8,False,True,44
677,I feel certain that I will regret not filming this.,1.2887323943661972,0.0453413406359093,142,107,29,6,False,True,51
677,I miss when I was the master.,1.2887323943661972,0.0453413406359093,142,107,29,6,False,True,29
677,And all these years I thought it was the Ambien.,1.2887323943661972,0.0453413406359093,142,107,29,6,False,True,48
677,"You are totally in my power”, get me the lobster salad”",1.2887323943661972,0.0442260901481752,142,106,31,5,False,False,55
677,Must get tuna. Must get tuna.,1.2887323943661972,0.0453413406359093,142,107,29,6,False,True,29
677,So that is where my Smart Phone went.,1.2887323943661972,0.0474933407163115,142,109,25,8,False,True,37
677,"You will feed the cat, pet the cat, love the cat....",1.2887323943661972,0.0464298103757555,142,108,27,7,False,True,52
677,Don't get so excited; I just have to pee.,1.2887323943661972,0.0485335711983231,142,110,23,9,False,True,41
677,You are feeling sleepy...when I click my paws you will get me some milk,1.2887323943661972,0.0453413406359093,142,107,29,6,False,False,71
677,Get salmon for cat.Get salmon for cat.Get salmon for cat.,1.2887323943661972,0.0464298103757555,142,108,27,7,False,True,57
677,"Open the refrigerator, open the refrigerator, open the refri....",1.2887323943661972,0.0442260901481752,142,106,31,5,False,True,64
677,The can of tuna beckons you....,1.2887323943661972,0.0464298103757555,142,108,27,7,False,True,31
677,"Yes, that's right, go to the refrigerator and get the cat some treats.""",1.2887323943661972,0.0442260901481752,142,106,31,5,False,False,71
677,"Luke, I'm your great-great-great-great-great-great-great-great grandfather's cat.",1.2887323943661972,0.0505498543518851,142,112,19,11,False,True,81
677,All that laser pointer training has finally paid off.,1.2887323943661972,0.0464298103757555,142,108,27,7,False,True,53
677,Jim appeared catatonic as he made his way to the kitchen.,1.2885906040268456,0.0418327867068703,149,110,35,4,False,True,57
677,Must .... kill ... dog.,1.2885906040268456,0.0449673904998291,149,113,29,7,False,True,23
677,Thank goodness they will never really understand  our power.,1.2885906040268456,0.040734350640403,149,109,37,3,False,True,60
677,Are those my pajamas?,1.2885906040268456,0.0459647792329227,149,114,27,8,True,True,21
677,"Yes, that's a good human. Now relinquish all of your prized possessions, so that I may tear them apart while I make you watch.",1.2885906040268456,0.0449673904998291,149,113,29,7,False,True,126
677,You will cook me a chicken...and remember to buy more of the catnip you bought from the fortune teller.,1.2885906040268456,0.0439473717848623,149,112,31,6,False,True,103
677,"Ha ha Pavlov, who's salivating now? I learned a few things while you were obsessing over that dog.",1.2885906040268456,0.0439473717848623,149,112,31,6,True,True,98
677,Snacks outside tonight Jon-boy. Open the screen door.,1.2885906040268456,0.0429031090392026,149,111,33,5,False,True,53
677,"I will feed the cat.
I will feed the cat.
I will feed the cat.",1.2885906040268456,0.0449673904998291,149,113,29,7,False,True,62
677,The good stuff is in the fridge,1.2885906040268456,0.0449673904998291,149,113,29,7,False,False,31
677,Must...open...three...cans...of...tuna...,1.2885906040268456,0.0418327867068703,149,110,35,4,False,True,41
677,"Yes, John. Come into the kitchen...and fix me a snack. You know the kind...the albacore tuna.",1.2885906040268456,0.0429031090392026,149,111,33,5,False,True,93
677,"Yes Master, catnaps are for cats.",1.2885906040268456,0.0396054617512294,149,108,39,2,False,True,33
677,"You are in my power.
The can opener is on the right",1.2885906040268456,0.040734350640403,149,109,37,3,False,False,51
677,"More tuna...yes, master...",1.2885906040268456,0.0429031090392026,149,111,33,5,False,True,26
677,Tuna...you want tuna...a plate of tuna...on the counter...,1.2885906040268456,0.0418327867068703,149,110,35,4,False,True,58
677,Why we prefer dogs.,1.2885906040268456,0.0459647792329227,149,114,27,8,False,True,19
677,The cat is the king. Long live the cat.,1.2885906040268456,0.0449673904998291,149,113,29,7,False,True,39
677,"Excellent, now go get some milk.",1.2885906040268456,0.0439473717848623,149,112,31,6,False,True,32
677,You keep waking me up like this and I'll make you into an outdoor cat.,1.2885906040268456,0.0488348758023704,149,117,21,11,False,True,70
677,"You will find the dog, and you will dispose of the dog.",1.2885906040268456,0.040734350640403,149,109,37,3,False,True,55
677,"Lord Fluffyboots the Second commands breakfast. If it's not salmon, I send it back. If it's in the dog's dish again, I send it back. Katpish?",1.2885906040268456,0.0449673904998291,149,113,29,7,True,True,141
677,"I am a cat person, I am a cat person, I am a cat person...",1.2885906040268456,0.0449673904998291,149,113,29,7,False,True,58
677,The difference between men and  cats is that cats never sleep........... walk.,1.2885906040268456,0.0396054617512294,149,108,39,2,False,True,78
677,Tuna salad...tuna salad...tuna salad...,1.2885906040268456,0.040734350640403,149,109,37,3,False,True,39
677,Catatonia is a beautiful thing.,1.2885906040268456,0.0429031090392026,149,111,33,5,False,True,31
677,"The spray bottle has been eliminated, Master.",1.2885906040268456,0.040734350640403,149,109,37,3,False,True,45
677,I will get you your milk and then get rid of the dog.,1.2885906040268456,0.0439473717848623,149,112,31,6,False,True,53
677,You will open the draw.  The one where you hide the catnip.  You will then place the catnip on the counter on front of the cat.  Return to your bed. You will do this every night from now on.,1.2885906040268456,0.0449673904998291,149,113,29,7,False,True,190
677,...and then when I tap your nose three times you'll wake up and won't remember any of this.,1.2885906040268456,0.0429031090392026,149,111,33,5,False,True,91
677,I have this thing for cats!,1.2885906040268456,0.040734350640403,149,109,37,3,False,True,27
677,I...will...take...you...to...the...Cats...movie.,1.2885906040268456,0.0429031090392026,149,111,33,5,False,True,48
677,The tuna's in the fridge. The tuna's in the fridge.,1.2857142857142858,0.0462960374401278,147,113,26,8,False,True,51
677,You will feed me the left over ahi tuna...,1.2857142857142858,0.0420781563545208,147,109,34,4,False,True,42
677,Must. Open. Door. Close. Door. Open. Door....,1.2857142857142858,0.045278417844953,147,112,28,7,False,True,45
677,"Catatonic man, catatonic.",1.2857142857142858,0.045278417844953,147,112,28,7,False,True,25
677,You will now feed me canned food ON the counter.,1.2857142857142858,0.045278417844953,147,112,28,7,False,True,48
677,"When I scratch you, you will awake and get me cream.",1.2857142857142858,0.0409558699343568,147,108,36,3,False,True,52
677,Zap!  I command you to get a buncha 50-something liberal mofos to compete at captioning this shit.,1.2857142857142858,0.0442373955203808,147,111,30,6,False,True,98
