contest,caption,mean,precision,votes,not_funny,somewhat_funny,funny,has_question_mark,ends_with_punctuation,caption_length
770,He thinks that free roaming can get him to the very top.,1.1694915254237288,0.0548764212474833,59,50,8,1,False,True,56
770,He's listing a 24 hour climbing exception to our life insurance,1.1694915254237288,0.0599656163553342,59,51,6,2,False,False,63
770,"Jill, your coach is on the line about soccer practice.  Jack, come home with me, and I'll help you with your Accounting 101 homework!",1.1694915254237288,0.0599656163553342,59,51,6,2,False,True,133
770,"If you're not gonna say anything Greg, maybe we should split up",1.1694915254237288,0.0492642677098457,59,49,10,0,False,False,63
770,"So busy !to let your wife be mine ?""",1.1694915254237288,0.0548764212474833,59,50,8,1,True,False,36
770,Last insurance life contract and I come back honey!,1.1694915254237288,0.0599656163553342,59,51,6,2,False,True,51
770,Better to cut down on real estate agents.,1.1694915254237288,0.0492642677098457,59,49,10,0,False,True,41
770,When helicopter parenting goes too far,1.1694915254237288,0.0599656163553342,59,51,6,2,False,False,38
770,No honey this wasn’t because of the vaccine,1.1694915254237288,0.0548764212474833,59,50,8,1,False,False,43
770,"Josh, you said mining Bitcoin was easy and profitable but I'm not sure if I'm succeeding",1.1694915254237288,0.0492642677098457,59,49,10,0,False,False,88
770,Does he think this is the corporate ladder he's climbing?,1.1694915254237288,0.0548764212474833,59,50,8,1,True,True,57
770,He's taking work-from-home a bit too far!,1.1692307692307693,0.0468694523344382,65,54,11,0,False,True,41
770,I think he's from the IRS,1.1692307692307693,0.0468694523344382,65,54,11,0,False,False,25
770,I hope we’ll be able to get away from et al. for a while.,1.1692307692307693,0.0468694523344382,65,54,11,0,False,True,57
770,"Just ignore him, he’ll eventually lose signal.",1.1692307692307693,0.0517447078733604,65,55,9,1,False,True,46
770,Aa ab laut chalein (now it’s time to go back),1.1692307692307693,0.0468694523344382,65,54,11,0,False,False,45
770,"What kind of corporate ladder is this, again",1.1692307692307693,0.0561986122930863,65,56,7,2,False,False,44
770,"They say before they agree to buy the mountain, they want to check out the from from the top.”",1.1690140845070425,0.0447929081990965,71,59,12,0,False,False,94
770,Yes hello! This is the Nordic Walking advice line..,1.1690140845070425,0.0490797220026175,71,60,10,1,False,True,51
770,Hybrid Work Environment,1.1688311688311688,0.0429698800970655,77,64,13,0,False,False,23
770,"Yes sir, Mr Trump, but they insist that the sign said 'Campaign Trail'.",1.1666666666666667,0.0511912597361625,54,45,9,0,False,True,71
770,I’ve got the “football” but I think the President is the one trying to make a pass.”,1.1666666666666667,0.0576138619860012,54,46,7,1,False,False,84
770,I think claiming the hiking gear was a mistake !,1.1666666666666667,0.0540279623494249,60,51,8,1,False,True,48
770,The corporate stooge is not six feet apart.  What's the hourly updated guideline say about that again?,1.1666666666666667,0.0543606727544534,48,40,8,0,True,True,102
770,"Is this what you call ""Leaving the office behind you?""",1.1666666666666667,0.0553999374471945,66,57,7,2,True,False,54
770,Looking for Life!!!,1.1666666666666667,0.0590253544423353,60,52,6,2,False,True,19
770,I thought travel insurance might be useful. No wonder that premium was so high.,1.1666666666666667,0.0511912597361625,54,45,9,0,False,True,79
770,I told you our portfolio has been keeping pace.,1.1666666666666667,0.0540279623494249,60,51,8,1,False,True,47
770,"Our Hut reservation was in the No-Sat-Phone bunkhouse, right?",1.1666666666666667,0.0462250163521024,66,55,11,0,True,True,61
770,With all his Zoom meetings Bob got used to wear flip-flops everywhere he goes.,1.1666666666666667,0.0576138619860012,54,46,7,1,False,True,78
770,They said 'Buy 1000.',1.1666666666666667,0.0462250163521024,66,55,11,0,False,False,21
770,"This mountain’s a total loser, unworthy of an inspiring quote.",1.1666666666666667,0.0511912597361625,54,45,9,0,False,True,62
770,I think he wants your hat,1.1666666666666667,0.0576138619860012,54,46,7,1,False,False,25
770,"Don't worry, honey. He's on retainer.",1.1666666666666667,0.0540279623494249,60,51,8,1,False,True,37
770,Don't blink,1.1666666666666667,0.0511912597361625,54,45,9,0,False,False,11
770,Never a follower but a leader be.,1.1666666666666667,0.0485185424782984,60,50,10,0,False,True,33
770,"I mean, honey, you cannot complain. They literally ensure you're over the hills and far away.",1.1666666666666667,0.0485185424782984,60,50,10,0,False,True,93
770,"We’re making a positive ascent, not needing positive assent!",1.1666666666666667,0.0687614164172528,48,42,4,2,False,True,60
770,"I suspect Bill thought I said  ""price hike.""",1.1666666666666667,0.0511912597361625,54,45,9,0,False,False,44
770,"When you said ""there's going to be a tax hike"" this is not what I imagined.",1.1666666666666667,0.0633890299066702,54,47,5,2,False,True,75
770,Why am I the only one getting life insurance,1.1666666666666667,0.0540279623494249,60,51,8,1,False,False,44
770,Look like our shareholders are hiking up our prices.,1.1666666666666667,0.0543606727544534,48,40,8,0,False,True,52
770,"I know we hired him to protect our assets,but why is he starring at my. butt?",1.1666666666666667,0.0553999374471945,66,57,7,2,True,True,77
770,You'll get paid once we make a successful dinosaur park.,1.1666666666666667,0.0540279623494249,60,51,8,1,False,True,56
770,"They each want the other to hike their life insurance. A lot.”
Erica A. Weingast, New York Cit",1.1666666666666667,0.0636314719180355,60,53,4,3,False,False,94
770,"You're right, my career is going nowhere.",1.1666666666666667,0.0485185424782984,60,50,10,0,False,True,41
770,Working remotely in not saving us any  travel time.,1.1666666666666667,0.0633890299066702,54,47,5,2,False,True,51
770,Isn’t there something inconsistent about “wilderness getaway” and “attorney?”,1.1666666666666667,0.0633890299066702,54,47,5,2,True,False,77
770,Are you sure the walking sticks are a write-off,1.1666666666666667,0.0511912597361625,54,45,9,0,False,False,47
770,The corporate ladder is a metaphor!,1.1666666666666667,0.0484501583111509,72,61,10,1,False,True,35
770,"Hold on while I put you on speaker.  So, first they sign and then I push them over, right?",1.1666666666666667,0.0510191395747968,66,56,9,1,True,True,90
770,"…….shrimp-kabobs, shrimp creole, shrimp gumbo. Pan fried, deep fried, stir-fried. There's pineapple shrimp, lemon shrimp, coconut shrimp, pepper shrimp, shrimp soup, shrimp stew, shrimp salad, shrimp and potatoes, shrimp burger, shrimp ……….",1.1666666666666667,0.0484501583111509,72,61,10,1,False,True,240
770,He's got a stick all right; you just can't see it.,1.1666666666666667,0.0510191395747968,66,56,9,1,False,True,50
770,I needed the right moment and setting to tell you I want a divorce.  Now you know why I wanted my lawyer along on this hike.,1.1666666666666667,0.0553999374471945,66,57,7,2,False,True,124
770,"Send the helicopter to the summit for my pick-up, and I’ll be back in in the office for the meeting by 3 p.m.",1.1666666666666667,0.0619807031664841,48,41,6,1,False,True,109
770,How many team building hours are required?,1.1666666666666667,0.0511912597361625,54,45,9,0,True,True,42
770,Does he really think he can sue a mountain for being too far to the left?,1.1666666666666667,0.0484501583111509,72,61,10,1,True,True,73
770,How does he even have service out here?,1.1666666666666667,0.0462250163521024,66,55,11,0,True,True,39
770,Sisyphus re-boot? Why do you ask?,1.1666666666666667,0.0633890299066702,54,47,5,2,True,True,33
770,I’m not breaking the rules by being a woman in pants!,1.1666666666666667,0.0543606727544534,48,40,8,0,False,True,53
770,"Really, Roger, when they said we'd have a tracking Chip if we got the COVID vaccine, I wasn't expecting THIS!",1.1666666666666667,0.0687614164172528,48,42,4,2,False,True,109
770,He is trying to get pizza by helicopter.,1.1666666666666667,0.0485185424782984,60,50,10,0,False,True,40
770,I really think it's time our son started working from his own office.,1.1666666666666667,0.0511912597361625,54,45,9,0,False,True,69
770,Don't look the life-insurance agent in the eye. He'll wander off in a few minutes.,1.1666666666666667,0.0540279623494249,60,51,8,1,False,True,82
770,He's taking that brother's keeper thing a little too far.,1.1666666666666667,0.0576138619860012,54,46,7,1,False,True,57
770,"Yeah, he's been following me ever since I started screening Spam Risk calls...",1.1666666666666667,0.0576138619860012,54,46,7,1,False,True,78
770,"I am supposedly making a house call;  you have a GPS ???

I am a doctor who needs an airlift PRONTO !!!",1.1666666666666667,0.0484501583111509,72,61,10,1,True,True,103
770,"I can see Pakistan from this mountain top, and I'm leading the others to safety",1.1666666666666667,0.0576138619860012,54,46,7,1,False,False,79
770,Looks like his career is an uphill climb.,1.1666666666666667,0.0540279623494249,60,51,8,1,False,True,41
770,Boss?? I found ‘em. I’ll bring them back to the office ASAP.,1.1666666666666667,0.0543606727544534,48,40,8,0,True,True,60
770,This new crop of insurance adjusters is really dedicated.,1.1666666666666667,0.0462250163521024,66,55,11,0,False,True,57
770,These people told me I could use their hotspot and now we’re lost.,1.1666666666666667,0.0540279623494249,60,51,8,1,False,True,66
770,This threesomes not working,1.1666666666666667,0.0540279623494249,60,51,8,1,False,False,27
770,"Martha, watch your left. It’s one of those New Yorker cartoons coming through.",1.1666666666666667,0.0485185424782984,60,50,10,0,False,True,78
770,Now you know how great work-from-home is. You could have work-life balance anytime anywhere.,1.1666666666666667,0.0576138619860012,54,46,7,1,False,True,92
770,"Yes sir, I'll give them oxys before I break the news.",1.1666666666666667,0.0484501583111509,72,61,10,1,False,True,53
770,"… Biden, you’re coming back for us right? Hello? Hello?",1.1666666666666667,0.0511912597361625,54,45,9,0,True,True,55
770,"Hey,Bill, do you remember how to get to work?",1.1666666666666667,0.0576138619860012,54,46,7,1,True,True,45
770,"Wow his corporate life is so cool, Wow his family life is so cool!!",1.1666666666666667,0.0388148339826387,60,51,9,0,False,True,67
770,You were right. I definitely feel more connected with nature,1.1666666666666667,0.0510191395747968,66,56,9,1,False,False,60
770,"Jim I’ll have to call you back, this Dutch Uber is getting bumpy",1.1666666666666667,0.0540279623494249,60,51,8,1,False,False,64
770,"Honey I will get back to you in a bit, let me sell off an insurance policy to these amateur trekkers. .",1.1645569620253164,0.0456848771435583,79,67,11,1,False,True,103
770,"Yes, I'm with them now. They're just making sure their hike to their second home is worth the money",1.1643835616438356,0.0478363626478469,73,62,10,1,False,False,99
770,"Next time you hire a sherpa, make sure it's not his other job!",1.164179104477612,0.0503134225718837,67,57,9,1,False,True,62
770,Looks like the park rangers were first in line for that infrastructure money.,1.164179104477612,0.0503134225718837,67,57,9,1,False,True,77
770,"Gotta call you back, looks like this deal is heading south.",1.164179104477612,0.0546234796151849,67,58,7,2,False,True,59
770,So WFH now means work from hike?,1.164179104477612,0.0503134225718837,67,57,9,1,True,True,32
770,"This guy is clueless, he is calling an Uber?",1.164179104477612,0.0546234796151849,67,58,7,2,True,True,44
770,He's been following us from Texas for the last six weeks...,1.164179104477612,0.0503134225718837,67,57,9,1,False,True,59
770,It’s a different type of ladder these days.,1.164179104477612,0.0455977681090133,67,56,11,0,False,True,43
770,"We’ll push him off and make it look like an accident” “Ok, but you’re telling the cops this time",1.164179104477612,0.0503134225718837,67,57,9,1,False,False,96
770,We're heading up the mountain. I'll call you back when we get to the top and the signal is better.,1.1639344262295082,0.0581139255569198,61,53,6,2,False,True,98
770,This is the last safari I ever go on with an insurance salesman.,1.1639344262295082,0.0532050773536091,61,52,8,1,False,True,64
770,Roger is on the phone getting our prenup in order before we reach the peak.,1.1639344262295082,0.0581139255569198,61,53,6,2,False,True,75
770,"If he says our lifestyle is 'tantalizingly telegenic' one more time, I'm kicking him down the slope.",1.1639344262295082,0.0532050773536091,61,52,8,1,False,True,100
770,So this is where the Fuller Brush men went.,1.1639344262295082,0.0581139255569198,61,53,6,2,False,True,43
770,"Oh, it's Take Your Work to Home Day! Well, at least he's not a terrorist.",1.1639344262295082,0.0477946876626663,61,51,10,0,False,True,73
770,I thought we booked the quiet trail.,1.1639344262295082,0.0581139255569198,61,53,6,2,False,True,36
770,"Why is that lawyer following us?
He must be a personal injury attorney.

Cal Bellamy, Munster, IN",1.1639344262295082,0.0532050773536091,61,52,8,1,True,False,97
770,Maybe you could pitch our hazard insurance policy to them...,1.1639344262295082,0.0477946876626663,61,51,10,0,False,True,60
770,I've heard of protective fathers but really!,1.1639344262295082,0.0532050773536091,61,52,8,1,False,True,44
770,"Doesn't he know ""remote work, flexible schedule"" is meant to be a perk, not a demand?",1.1639344262295082,0.0532050773536091,61,52,8,1,True,True,85
770,They oughta stop calling it a ‘9-to-5.’,1.1639344262295082,0.0532050773536091,61,52,8,1,False,False,39
770,"Random exercise checks performed by our insurance agents ensure that our clients stay healthy, and your health insurance rates stay low!",1.1639344262295082,0.0532050773536091,61,52,8,1,False,True,136
770,So I suggested to the justices that they follow precedent and they told me to take a hike.,1.1639344262295082,0.0581139255569198,61,53,6,2,False,True,90
770,"I couldn’t bring my external monitor, but otherwise it’s fine.",1.1639344262295082,0.0477946876626663,61,51,10,0,False,True,62
770,"No, I said Lois and Clark.",1.1636363636363636,0.056637760682328,55,47,7,1,False,True,26
770,Just hold on. I'll have a better signal soon.,1.1636363636363636,0.0503431749267762,55,46,9,0,False,True,45
770,Why so paranoid?,1.1636363636363636,0.056637760682328,55,47,7,1,True,True,16
770,I don’t know why you asked him to come- there’s nobody out here to sue.,1.1636363636363636,0.0503431749267762,55,46,9,0,False,True,71
770,"I know we just took out that new life insurance policy on  me, but why did your lawyer join the hike?",1.1636363636363636,0.062299571495391,55,48,5,2,True,True,101
770,The client told me I should take a hike.,1.1636363636363636,0.0503431749267762,55,46,9,0,False,True,40
770,"Please let me get you up to speed, things are looking up from where I'm standing.",1.1636363636363636,0.056637760682328,55,47,7,1,False,True,81
770,Must be the guru's caseworker.,1.1636363636363636,0.056637760682328,55,47,7,1,False,True,30
770,Stop rustling those sticks! I’m trying to close a business deal. I’m buying Bed Bath & Beyond - and getting rid of the Beyond! We will trap our customers behind a veil of ignorance. They must never suspect there is ANYTHING beyond beds and baths.,1.1636363636363636,0.056637760682328,55,47,7,1,False,True,246
770,I hope he’s not checking on my life insurance policy!,1.1636363636363636,0.0503431749267762,55,46,9,0,False,True,53
770,Hello EMS? I need a trekking pole ASAP,1.1636363636363636,0.056637760682328,55,47,7,1,True,False,38
770,We're definitely lost. He's been telling us to circle back for hours!,1.1636363636363636,0.056637760682328,55,47,7,1,False,True,69
770,Hi Kanye. I have those two massive sticks you requested for the listening party. What? Oh you said ‘two massive pr—-‘ ok my mistake. Wait I can fix this! How about I send you a rapist and a homophobe,1.1636363636363636,0.0503431749267762,55,46,9,0,True,False,199
770,He’s noting irregularities,1.1636363636363636,0.062299571495391,55,48,5,2,False,False,26
770,What? I thought you love the “Just in case” life moto.,1.1636363636363636,0.056637760682328,55,47,7,1,True,True,54
770,Don’t look down,1.1636363636363636,0.056637760682328,55,47,7,1,False,False,15
770,We’re going green on bitcoin mining,1.1636363636363636,0.0503431749267762,55,46,9,0,False,False,35
770,"Don't worry, he's just counting MY steps.""",1.1636363636363636,0.056637760682328,55,47,7,1,False,False,42
770,"I said ‘navigate,’ not ‘negotiate.’",1.1636363636363636,0.0503431749267762,55,46,9,0,False,False,35
770,The natives don't fear grizzlies or pandas- their only worry is a bear market.,1.163265306122449,0.06742934558367,49,43,4,2,False,True,78
770,"Yes, we will settle the budget at the summit!",1.163265306122449,0.0533482555828507,49,41,8,0,False,True,45
770,"Bob, what did you say your friend does? I swear he just said something about a courtesy call about a warranty.",1.163265306122449,0.0607978331010866,49,42,6,1,True,True,110
770,I think they are either truffle hunting or about to go pole vaulting.,1.163265306122449,0.0607978331010866,49,42,6,1,False,True,69
770,"When he said we would take the business to new heights, this isn’t what I expected.",1.163265306122449,0.06742934558367,49,43,4,2,False,True,83
770,"See, isn't this nicer than climbing the corporate ladder?",1.163265306122449,0.0533482555828507,49,41,8,0,True,True,57
770,"Honey, if you pass gas one more time..,",1.163265306122449,0.0533482555828507,49,41,8,0,False,False,39
770,As long as they don't cross their chopsticks I'll be fine,1.163265306122449,0.0607978331010866,49,42,6,1,False,False,57
770,I really over this work from anywhere thing.,1.163265306122449,0.0607978331010866,49,42,6,1,False,True,44
770,"Honey, what's that saying about the tax man again?",1.163265306122449,0.06742934558367,49,43,4,2,True,True,50
770,The evil wizard at the top of this mountain summoned more lawyers for this weekend.,1.163265306122449,0.0607978331010866,49,42,6,1,False,True,83
770,At least it’s not a six story walk-up,1.163265306122449,0.0533482555828507,49,41,8,0,False,False,37
770,"No, you're coming in just fine. Thank God for the new cell tower.",1.163265306122449,0.0533482555828507,49,41,8,0,False,True,65
770,"I'm monitoring their every step, but I believe they are getting suspicious, especiaaly the husband.",1.163265306122449,0.0533482555828507,49,41,8,0,False,True,99
770,The pandemic really has ruined everything.,1.163265306122449,0.0533482555828507,49,41,8,0,False,True,42
770,You speak softly; we’ll carry the big sticks.,1.163265306122449,0.0607978331010866,49,42,6,1,False,True,45
770,Sorry I’m running late. The line at Starbucks is horrendous.,1.163265306122449,0.0607978331010866,49,42,6,1,False,True,60
770,I know you said to try new things but this throuple just isn’t working for me,1.163265306122449,0.0607978331010866,49,42,6,1,False,False,77
770,These summer sales guys won’t quit,1.163265306122449,0.0533482555828507,49,41,8,0,False,False,34
770,tried micro-dosing like those silicon valley CEOs...anyway I'm going to be late getting into the office,1.163265306122449,0.0607978331010866,49,42,6,1,False,False,103
770,"We’ve tried everything in Afghanistan but this, Karen.
Operation ‘Can I Speak To Your Manager’ is a Go!",1.163265306122449,0.06742934558367,49,43,4,2,False,True,103
770,Jim regrets moving out of the city now that his company ended their work-from-home policy.,1.163265306122449,0.0607978331010866,49,42,6,1,False,True,90
770,"Well,it could be connected to the fact that I just bumped your life insurance up to $10million",1.162790697674419,0.0659728505364627,43,37,5,1,False,False,94
770,Tell him to stop looking at my butt,1.162790697674419,0.0738907079406966,43,38,3,2,False,False,35
770,"I can confirm,the reports of unseasonal elbow patches are correct.",1.162790697674419,0.0659728505364627,43,37,5,1,False,True,66
770,Can I get same day delivery on that stick?,1.1625,0.045157074666159,80,68,11,1,True,True,42
770,I think I'm lost.,1.162162162162162,0.0472377580505781,74,63,10,1,False,True,17
770,Just ignore him.  He's one of those summit chasers.,1.162162162162162,0.0431413089590404,74,62,12,0,False,True,51
770,"Is that Fisher investment guy is not going to give up, is he",1.162162162162162,0.0431413089590404,74,62,12,0,False,False,60
770,. “It’s one of those bonding meetings. “,1.162162162162162,0.027394758583763,74,64,10,0,False,False,40
770,"$100 says all 3 ""winners"" reference the high line.",1.161764705882353,0.0496267637408336,68,58,9,1,False,True,50
770,I’m covering mental health week….what was the gross margin again?,1.161764705882353,0.0496267637408336,68,58,9,1,True,True,65
770,Covid is going to be an uphill battle if you don't wear your masks and get the vaccine.,1.161764705882353,0.0538683324613161,68,59,7,2,False,True,87
770,Let me just double check that this is included in your policy.,1.161764705882353,0.0496267637408336,68,58,9,1,False,True,62
770,- You’re almost NOT there.,1.161764705882353,0.0538683324613161,68,59,7,2,False,True,26
770,Not what I expected when they said we'd have a counselor guiding our hike.,1.1612903225806452,0.0524066412601862,62,53,8,1,False,True,74
770,If you trip me I'll have you in court in a New York second.,1.1612903225806452,0.0470917754857602,62,52,10,0,False,True,59
770,Sheesh.  He's taken the concept of working remotely to a whole new level.,1.1612903225806452,0.0524066412601862,62,53,8,1,False,True,73
770,His office is now in a treehouse.,1.1612903225806452,0.0470917754857602,62,52,10,0,False,True,33
770,"I hope you understand sir,the dung of this species is now trending big time.",1.1612903225806452,0.057230033880354,62,54,6,2,False,True,76
770,Nature hikes like this allow one to escape the rat race.,1.1612903225806452,0.0524066412601862,62,53,8,1,False,True,56
770,I’ll be a bit late to the meeting. Using a more environmentally conscious GPS.,1.1612903225806452,0.057230033880354,62,54,6,2,False,True,78
770,It was over a year ago and he posed with a fish in his profile pic.,1.1612903225806452,0.0524066412601862,62,53,8,1,False,True,67
770,I asked him to come so the predators don’t get near us.,1.1612903225806452,0.0524066412601862,62,53,8,1,False,True,55
770,New Yorkers commuting to work after Hurricane Ida,1.1612903225806452,0.044195304654623,62,54,7,1,False,False,49
770,We are convinced the grass is greener on the other side,1.1612903225806452,0.0524066412601862,62,53,8,1,False,False,55
770,Texas on the line - they’re saying she needs to head back to the bottom…,1.1612903225806452,0.0524066412601862,62,53,8,1,False,False,72
770,"I said I told the insurance guy "" double or nothing, if we make it down alive"".",1.1607142857142858,0.0663363415035953,56,50,3,3,False,True,79
770,Roger that.  She's ahead by a walking stick.,1.1607142857142858,0.0556938857091182,56,48,7,1,False,True,44
770,looks like our insurance rates are increasing,1.1607142857142858,0.0556938857091182,56,48,7,1,False,False,45
770,These Boomers really can’t get over not working in an office.,1.1607142857142858,0.0556938857091182,56,48,7,1,False,True,61
770,They're accident-prone.,1.1607142857142858,0.0556938857091182,56,48,7,1,False,True,23
770,I think he's lost in thought. Either that or we're really lost.,1.1607142857142858,0.0556938857091182,56,48,7,1,False,True,63
770,Don’t see another option: I am following this strange couple up the mountain…,1.1607142857142858,0.0612467105625353,56,49,5,2,False,False,77
770,I'm traveling with the Whitmores.  They always take their accountant to keep track of business expenses.,1.1607142857142858,0.0556938857091182,56,48,7,1,False,True,104
770,"Businessman: ""Ah, the climb seems risky""

Farmer: ""Says the innovative challenged risk taker""",1.1607142857142858,0.0495223005930629,56,47,9,0,False,False,93
770,Next time don't mention our mountain hiking trip to the insurance agent.  Ok?,1.1607142857142858,0.0612467105625353,56,49,5,2,True,True,77
770,"He's not carrying a Big Stick and NOT speaking softly. 
What should we do! Smite Him?",1.1607142857142858,0.0556938857091182,56,48,7,1,True,True,85
770,They said the reception will be better at the top..,1.1607142857142858,0.0495223005930629,56,47,9,0,False,True,51
770,I told you. This hike means business.,1.1607142857142858,0.0495223005930629,56,47,9,0,False,True,37
770,I don't want to think that we can't make a go of it but ..,1.1607142857142858,0.0495223005930629,56,47,9,0,False,True,58
770,Did you bring the buzzard spray?,1.1607142857142858,0.0556938857091182,56,48,7,1,True,True,32
770,"I thought you said HR didn's really care about employees.

Rosann Cahill, St. Paul MN",1.1607142857142858,0.0556938857091182,56,48,7,1,False,False,85
770,His GPS says the Goldman Sachs conference room is at the top of the mountain.,1.1607142857142858,0.0556938857091182,56,48,7,1,False,True,77
770,Let’s talk “next steps.”,1.1607142857142858,0.0495223005930629,56,47,9,0,False,False,24
770,Tourists usually decompress by day three.,1.16,0.0661476394445156,50,44,4,2,False,True,41
770,"I'm not guilty! Nobody believes me. They are watching my every movement! I'm not a criminal! ... When we get to the top, distract him so I can push him.",1.16,0.0596588943366317,50,43,6,1,False,True,152
770,"I know he said he could work from anywhere, I just didn’t think he’d press his suit.",1.16,0.0596588943366317,50,43,6,1,False,True,84
770,Tell them we're going up on appeal.,1.16,0.0596588943366317,50,43,6,1,False,True,35
770,Just ignore the booty caller.,1.16,0.0503680150188285,75,65,8,2,False,True,29
770,Your remote location is just over the next peak Mr. President. Can your football guy keep up?,1.16,0.0596588943366317,50,43,6,1,True,True,93
