contest,caption,mean,precision,votes,not_funny,somewhat_funny,funny,has_question_mark,ends_with_punctuation,caption_length
844,"No, aeration isn't entirely non-invasive.",1.2065217391304348,0.0451626658066878,92,74,17,1,False,True,41
844,"Just to be sure, we're going to need a five-ounce sample.",1.2065217391304348,0.0451626658066878,92,74,17,1,False,True,57
844,This will only hurt a little.,1.2065217391304348,0.0501741912664799,92,76,13,3,False,True,29
844,"I'll be the first to admit it, Vinny -- you're getting screwed.",1.2065217391304348,0.0525008667784131,92,77,11,4,False,True,63
844,Are you just going to sit there and wine all day?,1.2065217391304348,0.0501741912664799,92,76,13,3,True,True,49
844,You may feel a slight pushing sensation during the procedure.,1.2065217391304348,0.0424355374600959,92,73,19,0,False,True,61
844,You've come through the examination with flying colours. Whad'ya say we celebrate?,1.2065217391304348,0.0525008667784131,92,77,11,4,True,True,82
844,Wait a minute!  I thought the guidelines said I didn't need this for ten years.,1.2065217391304348,0.0477342426985695,92,75,15,2,False,True,79
844,While invasive this test is recommended for those as well aged as you.,1.2065217391304348,0.0424355374600959,92,73,19,0,False,True,70
844,"Yes, it'll help you breathe but the corkage fee is all out-of-pocket.",1.2065217391304348,0.0501741912664799,92,76,13,3,False,True,69
844,I took your case to an oenologist and guess what? We're in complete agreement.,1.2061855670103092,0.0506362956298672,97,81,12,4,True,True,78
844,"You want to know if it’s treatable, for someone of your vintage?
It’s not only treatable, it’s going to be quite enjoyable.",1.2061855670103092,0.0506362956298672,97,81,12,4,True,True,123
844,Not to worry. The corking fee is covered by your HMO.,1.2061855670103092,0.0438144329896907,97,78,18,1,False,True,53
844,Remain distilled and breathe.,1.2061855670103092,0.0462004455661469,97,79,16,2,False,True,29
844,I see you getting screwed in the very near future....,1.2061855670103092,0.0438144329896907,97,78,18,1,False,True,53
844,Constipation?  Feeling bottled up?  I have just the cure.,1.2061855670103092,0.0484691427901599,97,80,14,3,True,True,57
844,"I will need a blood sample after all, Mr. Chianti. You’ll pair nicely with my next patient, Mr. Parmigiana.",1.2061855670103092,0.0462004455661469,97,79,16,2,False,True,107
844,This is gonna hurt you more than it is me!,1.2061855670103092,0.0438144329896907,97,78,18,1,False,True,42
844,You are about to give birth to a healthy rosé.,1.2061855670103092,0.0527144294042695,97,82,10,5,False,True,46
844,Would you prefer a colonoscopy?,1.2058823529411764,0.0576036818760468,68,56,10,2,True,True,31
844,I think I can help you lose some weight.,1.2058823529411764,0.0425781346788589,102,82,19,1,False,True,40
844,Hi! I'm Doctor Sokol and I've come to take your temperature.,1.2058823529411764,0.0425781346788589,102,82,19,1,False,True,60
844,You’ll love the new you after the decanting procedure.,1.2058823529411764,0.0493985935035409,68,54,14,0,False,True,54
844,"I promise you'll only feel a little pinch.""

Barbara Frankel, Davis, C",1.2058823529411764,0.0469166460252739,102,84,15,3,False,False,70
844,Screwed again?,1.2054794520547945,0.0583868121120749,73,61,9,3,True,True,14
844,....but you'll breathe so much better when it's over...,1.2054794520547945,0.0550318301059084,73,60,11,2,False,True,55
844,Afterwards just breathe.....then cough,1.2054794520547945,0.0583868121120749,73,61,9,3,False,False,38
844,The good news is that we can rule constipation out.,1.2054794520547945,0.0583868121120749,73,61,9,3,False,True,51
844,Just lie back and relax.  You might feel just a slight pinch.,1.2053571428571428,0.0423307304777935,112,91,19,2,False,True,61
844,I understand you're having trouble breathing.,1.205128205128205,0.0460167423779546,78,62,16,0,False,True,45
844,Having trouble breathing?,1.205128205128205,0.049502938418637,78,63,14,1,True,True,25
844,It's a win-win.  You'll feel less bottled up.  And I'll be smashed.,1.205128205128205,0.0558259937491491,78,65,10,3,False,True,67
844,"You were assigned red but you've always felt white, so I'm going to make you the first trans wine.",1.205128205128205,0.0587328009810563,78,66,8,4,False,True,98
844,Cheese probe?,1.205128205128205,0.052759276388894,78,64,12,2,True,True,13
844,"It's nothing, simply a back scratcher",1.2048192771084338,0.0535516046376283,83,69,11,3,False,False,37
844,Take off your pants.,1.2048192771084338,0.0535516046376283,83,69,11,3,False,True,20
844,Don’t worry. It’s just like a normal rectal exam.,1.2048192771084338,0.0535516046376283,83,69,11,3,False,True,49
844,I promise I won’t screw you up!,1.2048192771084338,0.0477499490965608,83,67,15,1,False,True,31
844,No worries! Some corks get a kick out of it!,1.2048192771084338,0.0535516046376283,83,69,11,3,False,True,44
844,Trust me. I have the solution to relieve your headache.,1.2048192771084338,0.0507337757218453,83,68,13,2,False,True,55
844,This will only sting for a second.,1.2048192771084338,0.0535516046376283,83,69,11,3,False,True,34
844,I have just the thing to relieve your alchohol dependence.,1.2048192771084338,0.0535516046376283,83,69,11,3,False,True,58
844,You are about to be screwed.,1.2048192771084338,0.0587834252132822,83,71,7,5,False,True,28
844,"Remember that old saying, ""I'd rather have a bottle in front of me ...""",1.2048192771084338,0.0562283978033804,83,70,9,4,False,False,71
844,I promise to be gentle.,1.2048192771084338,0.0477499490965608,83,67,15,1,False,True,23
844,"Did I say glass?  Oh, ha!  I meant vial. We just need a vial",1.2048192771084338,0.0562283978033804,83,70,9,4,True,False,60
844,"so I says to the rabbi, the priest..",1.2048192771084338,0.0535516046376283,83,69,11,3,False,True,36
844,"It's just a routine cork up, nothing serious",1.2048192771084338,0.0535516046376283,83,69,11,3,False,False,44
844,"If you think you're about to get screwed now, just wait until you see the bill.",1.2045454545454546,0.0539918791764455,88,74,10,4,False,True,79
844,Someone told me it's your birthday.  How many years has it been?,1.2045454545454546,0.0586309564710598,88,76,6,6,True,True,64
844,"Oh quit your whining, see what I did there? But really this is going to hurt.",1.2045454545454546,0.0461673473078404,88,71,16,1,True,True,77
844,Time to uncork? Or wait for the fuller body?,1.2045454545454546,0.0489147930313159,88,72,14,2,True,True,44
844,"You’ll feel a small pinch, but after the pressure is released, you’ll feel so much better.",1.2045454545454546,0.0489147930313159,88,72,14,2,False,True,90
844,You'll only feel a little pinch.,1.2045454545454546,0.0489147930313159,88,72,14,2,False,True,32
844,I think you’re a great candidate for a revolutionary weight-loss program.,1.2045454545454546,0.0539918791764455,88,74,10,4,False,True,73
844,"Does it help to know you will be served at the indictment party?""",1.2045454545454546,0.0461673473078404,88,71,16,1,True,False,65
844,This calls for a corkectomy.,1.2045454545454546,0.0489147930313159,88,72,14,2,False,True,28
844,We send the sample to the lab for analysis with aged gouda.,1.2045454545454546,0.0461673473078404,88,71,16,1,False,True,59
844,I'm afraid that everyday can't be a rosé day.,1.2045454545454546,0.0489147930313159,88,72,14,2,False,True,45
844,"Well yes, it is like acupuncture, in a roundabout sort of way. 😁",1.2045454545454546,0.0539918791764455,88,74,10,4,False,False,64
844,Typically you have to wait for insurance to get screwed this big.,1.2045454545454546,0.0563591699447179,88,75,8,5,False,True,65
844,This will only hurt just a drop,1.2045454545454546,0.0489147930313159,88,72,14,2,False,False,31
844,"I apologize for the long wait, but I am now ready to serve you.",1.2043010752688172,0.0420354593989229,93,74,19,0,False,True,63
844,So what do you think doctor? Am I screwed?,1.2043010752688172,0.0519807292144392,93,78,11,4,True,True,42
844,The good news is that we won't be using any needles...,1.2043010752688172,0.0472703715690037,93,76,15,2,False,True,54
844,"The prune juice isn't working, Doc. I need some relief.",1.2043010752688172,0.0472703715690037,93,76,15,2,False,True,55
844,"You aren’t going to cork, but you are still screwed.",1.2043010752688172,0.0472703715690037,93,76,15,2,False,True,52
844,Now just turn you head and cough.,1.2043010752688172,0.0562983515838432,93,80,7,6,False,True,33
844,Ever have a corkonoscopy?,1.2043010752688172,0.0519807292144392,93,78,11,4,True,True,25
844,"Just one more little procedure,and then we can have a drink.",1.2043010752688172,0.0472703715690037,93,76,15,2,False,True,60
844,Top or bottom?,1.2043010752688172,0.0472703715690037,93,76,15,2,True,True,14
844,You’ll be happy to know that there is no co-pay for this procedure,1.2043010752688172,0.0496814061693936,93,77,13,3,False,False,66
844,"I assure you, there’ll be no corkage fee.",1.2043010752688172,0.0496814061693936,93,77,13,3,False,True,41
844,"No, but I drank a lot of beer in college.",1.2043010752688172,0.0447295644688732,93,75,17,1,False,True,41
844,Now you are going to feel a tiny pinch.,1.2040816326530612,0.0457749589849691,98,80,16,2,False,True,39
844,"I can remove that, but your insurance won't cover the corking fee.",1.2040816326530612,0.0457749589849691,98,80,16,2,False,True,66
844,"I’ve done this a thousand times.
You’ll feel clean as a whistle.",1.2040816326530612,0.0480181247634725,98,81,14,3,False,True,64
844,We need a little larger blood draw than usual.,1.2040816326530612,0.0457749589849691,98,80,16,2,False,True,46
844,You’ll just feel a minor pinch.,1.2040816326530612,0.0457749589849691,98,80,16,2,False,True,31
844,"Now, we need to check this bitter aftertaste that you're experiencing",1.2040816326530612,0.0457749589849691,98,80,16,2,False,False,69
844,I'll need you to bend over.,1.203883495145631,0.0504297603344327,103,87,11,5,False,True,27
844,Relax!  This will hurt me more than it hurts you.,1.203883495145631,0.0444078652953465,103,84,17,2,False,True,49
844,The good news is I don't need to check your prostate today.,1.2037037037037035,0.0487987568205456,108,91,12,5,False,True,59
844,"Don't worry, it's just a quick little stick. You won't feel it at all!",1.2037037037037035,0.0469920035825515,108,90,14,4,False,True,70
844,Unfortunately your insurance doesn’t cover cork removal.,1.2037037037037035,0.0469920035825515,108,90,14,4,False,True,56
844,"Oh, don't worry.  No finger this time.",1.2037037037037035,0.0451129486309011,108,89,16,3,False,True,38
844,You won't even notice it!,1.203125,0.0636976033506681,64,54,7,3,False,True,25
844,It has to come out!,1.203125,0.0553653427746596,64,52,11,1,False,True,19
844,You will breathe better after this.,1.2028985507246377,0.0568410766098355,69,57,10,2,False,True,35
844,It’s happy hour for everyone… except you.,1.2028985507246377,0.052958951374245,69,56,12,1,False,True,41
844,So your insurance doesn't cover twist offs.,1.2028985507246377,0.0568410766098355,69,57,10,2,False,True,43
844,Ve haf vays to relieve your liquid assets blockage.,1.2027027027027026,0.0576592966877983,74,62,9,3,False,True,51
844,"Why Mr. Cabernet, what a nice long nose you have...",1.2027027027027026,0.0543540361664704,74,61,11,2,False,True,51
844,I like a full body with a great bouquet.,1.2027027027027026,0.0576592966877983,74,62,9,3,False,True,40
844,You did say you wanted a leading role.,1.2027027027027026,0.0576592966877983,74,62,9,3,False,True,38
844,please face your label towards me and it will all be over in mere seconds.,1.2027027027027026,0.0508343191224236,74,60,13,1,False,True,74
844,"Cheer up--your body's fine, and your nose is even finer!",1.2027027027027026,0.0508343191224236,74,60,13,1,False,True,56
844,"It’s not too painful, although it might make you whine.",1.2027027027027026,0.0508343191224236,74,60,13,1,False,True,55
844,"So, how did the prep go?",1.2027027027027026,0.0508343191224236,74,60,13,1,True,True,24
844,Ever heard of trephining?,1.2025316455696202,0.0489412302990869,79,64,14,1,True,True,25
844,This procedure beats antacids!,1.2025316455696202,0.0489412302990869,79,64,14,1,False,True,30
844,So you requested dance therapy.  Let's start with a quick Twist.,1.2025316455696202,0.0489412302990869,79,64,14,1,False,True,64
844,"I'll have this bottle open faster than you can say ""malpractice""!",1.2025316455696202,0.0580426899588362,79,67,8,4,False,True,65
844,We need to test for secondary and tertiary aromas.,1.2025316455696202,0.0521518357108488,79,65,12,2,False,True,50
844,This is a minimally invasive procedure,1.2025316455696202,0.0551759359941857,79,66,10,3,False,False,38
844,Did you drink all of the prep stuff?,1.2025316455696202,0.0521518357108488,79,65,12,2,True,True,36
844,And now for your corkonoscopy!,1.2025316455696202,0.0580426899588362,79,67,8,4,False,True,30
844,It's relatively non-invasive and the side effects include permanent loss of cork and contents. But your complexion will be much clearer!,1.2025316455696202,0.0551759359941857,79,66,10,3,False,True,136
844,"The Rhône Valley is out of network, but this procedure is free to anyone over 50.",1.2025316455696202,0.0489412302990869,79,64,14,1,False,True,81
844,You'll be fine once we've relieved the pressure on your brain,1.2025316455696202,0.0580426899588362,79,67,8,4,False,False,61
844,"No,really,it won’t hurt a bit.",1.2025316455696202,0.0551759359941857,79,66,10,3,False,True,30
844,"Take a deep breath, this won’t hurt a bit",1.2025316455696202,0.0521518357108488,79,65,12,2,False,False,41
844,Given your age we’ll need a full body exam.,1.2023809523809523,0.0529663992060461,84,70,11,3,False,True,43
844,You'll just feel a burning sensation.,1.2023809523809523,0.055608463182317,84,71,9,4,False,True,37
844,A frontal lobotomy on a bottle in front of me!,1.2023809523809523,0.0529663992060461,84,70,11,3,False,True,46
844,Remember when I described how wine can cause headaches?,1.2023809523809523,0.0501854332671282,84,69,13,2,True,True,55
844,"Don't worry, I've done this procedure a million times.  And I graduated at the bottom of my glass!",1.2023809523809523,0.0581305677775813,84,72,7,5,False,True,98
844,I'm with the government and I'm here to help.,1.2023809523809523,0.0501854332671282,84,69,13,2,False,True,45
844,"Oh I'm not a doctor. I'm a sommelier, and I'll be serving you after your routine corkectomy.",1.2023809523809523,0.0581305677775813,84,72,7,5,False,True,92
844,"No, I'm quite sure you won't need a repeat in 5 years.",1.2023809523809523,0.0441005016629023,84,67,17,0,False,True,54
844,"Now just breathe.""",1.2023809523809523,0.0441005016629023,84,67,17,0,False,False,18
844,I prefer to think of it as a release of your inner goodness!,1.2023809523809523,0.0472410412624924,84,68,15,1,False,True,60
844,It's just a quick procedure to drain excess fluid.,1.2023809523809523,0.0529663992060461,84,70,11,3,False,True,50
844,"The nurse said you are at room temperature, so that's very exciting.",1.2023809523809523,0.055608463182317,84,71,9,4,False,True,68
844,I'm your designated doctor.,1.2023809523809523,0.0501854332671282,84,69,13,2,False,True,27
844,Good news. I’ve got something for that ‘bottled-up’ feeling you’ve been complaining about.,1.2023809523809523,0.0441005016629023,84,67,17,0,False,True,90
844,"I’m under a lot of pressure. I need something to take the edge off. Relax, this will help you breathe a little easier.",1.2023809523809523,0.055608463182317,84,71,9,4,False,True,118
844,"I’m really afraid of needles. Don’t worry, we won’t be using any needles today.",1.2023809523809523,0.0529663992060461,84,70,11,3,False,True,79
844,"After all, you can't spell terroir without terror",1.202247191011236,0.0509856257680422,89,74,12,3,False,False,49
844,Just bend forward; it won't hurt a bit.,1.202247191011236,0.0509856257680422,89,74,12,3,False,True,39
844,"This should relieve your constipation and, trust me, won't hurt a bit",1.202247191011236,0.0484166440394796,89,73,14,2,False,False,69
844,"As luck would have it, you are my last patient on what has been a very busy Friday.",1.202247191011236,0.0534312329061573,89,75,10,4,False,True,83
844,I'm just going to take a little fluid off your brain.,1.202247191011236,0.0484166440394796,89,73,14,2,False,True,53
844,It's the most effective treatment for your tannic attacks.,1.202247191011236,0.0484166440394796,89,73,14,2,False,True,58
844,"But Doc, I said ""shrewd!""",1.202247191011236,0.0509856257680422,89,74,12,3,False,False,25
844,"Trust me, it works for any age. It'll relieve that stuffy, congested feeling.",1.202247191011236,0.0509856257680422,89,74,12,3,False,True,77
844,This might tickle a little but trust me you’re going to feel 25 ounces lighter when we’re done!,1.202247191011236,0.0509856257680422,89,74,12,3,False,True,95
844,"Yes, fine is a good way to describe how you're aging, however, there is one more test...",1.202247191011236,0.0509856257680422,89,74,12,3,False,True,88
844,A corkectomy is like a vasectomy….with just a bit more leakage.,1.202247191011236,0.0484166440394796,89,73,14,2,False,True,63
844,In med school I did a rotation as a sommelier.,1.202247191011236,0.0484166440394796,89,73,14,2,False,True,46
844,Your cork isn't the only thing that's going to get screwed tonight!,1.202247191011236,0.0484166440394796,89,73,14,2,False,True,67
844,"Turn around, and cough for me",1.202247191011236,0.0484166440394796,89,73,14,2,False,False,29
844,"Good News!

You've just been selected to receive our wine lobotomy of the month.",1.202127659574468,0.0491980697282263,94,78,13,3,False,True,80
844,I’m here to help you pour out your feelings of  despair,1.202127659574468,0.0491980697282263,94,78,13,3,False,False,55
844,I have just the right tool to help you breathe.,1.202127659574468,0.0443045016468201,94,76,17,1,False,True,47
844,May I buy you dinner?,1.202127659574468,0.0557386029893012,94,81,7,6,True,True,21
844,Let’s relieve some of that pressure you’ve been feeling.”,1.202127659574468,0.0491980697282263,94,78,13,3,False,False,57
844,Try to relax as much as possible. It'll just be a little pinch.,1.202127659574468,0.0468152695771182,94,77,15,2,False,True,63
844,Just take a deep breath and breathe.,1.202127659574468,0.0491980697282263,94,78,13,3,False,True,36
844,A routine decanting is recommended every five years.,1.202127659574468,0.0491980697282263,94,78,13,3,False,True,52
844,It's widely recommended for a wine or your bottle age.,1.202020202020202,0.0475753002073146,99,82,14,3,False,True,54
844,"Don't worry, we've done this procedure many times, and I can assure you we've never screwed up...""",1.202020202020202,0.0453570956580135,99,81,16,2,False,False,98
844,"Don't be scared, I just have a few screws loose.",1.202020202020202,0.0496945897769771,99,83,12,4,False,True,48
844,Congratulations! You are old enough to get screwed.,1.202020202020202,0.0475753002073146,99,82,14,3,False,True,51
844,It won't hurt. I'm a Proctologist,1.202020202020202,0.0405583530232473,99,79,20,0,False,False,33
844,"No, I won't be using this to check your prostrate.",1.202020202020202,0.0475753002073146,99,82,14,3,False,True,50
844,"I prefer to have a bottle in front of me, than a...",1.202020202020202,0.0430246796994966,99,80,18,1,False,True,51
844,Surgery? Give me a moment to breathe...,1.2,0.0483918603888994,80,65,14,1,True,True,39
844,"Relax, it won't hurt a bit!",1.2,0.054540659551419,80,67,10,3,False,True,27
844,Only one last time I get to screw you.,1.2,0.0402015126103684,100,80,20,0,False,True,38
844,Time to check your legs!,1.2,0.0436435780471984,105,86,17,2,False,True,24
844,"The good news is, having a glass of red wine is good for MY heart...",1.2,0.0479283693574423,90,74,14,2,False,True,68
844,"I think I can help you with your breathing problem, Mr. Merlot.",1.2,0.0522773302173933,70,57,12,1,False,True,63
844,I have just the thing to remove that congestion so you can breathe.,1.2,0.0412568498503517,95,76,19,0,False,True,67
844,"We've developed a new, experimental treatment to help you open up.",1.2,0.0467426352442802,85,69,15,1,False,True,66
844,"Now, if you could please bend over...",1.2,0.0515580046947248,80,66,12,2,False,True,37
844,"Fortunately,  we have the latest technology for your, ahem, examination...",1.2,0.049648625302195,85,70,13,2,False,True,74
844,You are in peak condition!,1.2,0.0536924844171219,75,62,11,2,False,True,26
844,Just think of it as a shorter colonoscopy.,1.2,0.0515580046947248,80,66,12,2,False,True,42
844,What makes you think you will be screwed?,1.2,0.0523936831995583,85,71,11,3,True,True,41
844,"Trust me, bottling it all up is bad for your vintage",1.2,0.0573684516132894,80,68,8,4,False,False,52
844,It is just a little pinch.,1.2,0.049648625302195,85,70,13,2,False,True,26
844,It sounds like you're a bit stopped up. I've got just the thing!,1.2,0.0467426352442802,85,69,15,1,False,True,64
844,The other doctors are in the lunch room. Let’s go get a second opinion.,1.2,0.054540659551419,80,67,10,3,False,True,71
844,I  have a surprise for you on your 25th birthday!,1.2,0.0536924844171219,75,62,11,2,False,True,49
844,Are you ready for your Opening?,1.2,0.0504659932964838,90,75,12,3,True,True,31
844,"Once screwed, the juice will start flowing",1.2,0.0515580046947248,80,66,12,2,False,False,42
844,"It was at this moment, I knew I was screwed.",1.2,0.0487239177075788,95,79,13,3,False,True,44
844,I think you'll breathe better if we take a look inside and see whats bottling you up,1.2,0.0515580046947248,80,66,12,2,False,False,84
844,"Don’t worry, it’s just a little something to help you breathe.",1.2,0.0483918603888994,80,65,14,1,False,True,62
844,Great news. You don't need a colonoscopy today.,1.2,0.0596747568453769,70,59,8,3,False,True,47
844,"You may hear a small pop, but that nothing to worry about",1.2,0.0573684516132894,80,68,8,4,False,False,57
844,You may experience a little discomfort but it will help you breathe.,1.2,0.0436435780471984,105,86,17,2,False,True,68
844,Patients usually get used to the screw cap very quickly after cork replacement surgery.,1.2,0.0569494797451499,75,63,9,3,False,True,87
844,You only feel empty after a corkotomy,1.2,0.0467426352442802,85,69,15,1,False,False,37
844,"You should be feeling high, not low",1.2,0.0467426352442802,85,69,15,1,False,False,35
844,"As your psychiatrist, I say you must release your spirits.",1.2,0.0515580046947248,80,66,12,2,False,True,58
844,Don't worry! I won't screw you with a big bill.,1.2,0.0523936831995583,85,71,11,3,False,True,47
844,I have something that will letyou breathe.,1.2,0.0483918603888994,80,65,14,1,False,True,42
844,"I can perform a procedure that will make you breath easier, but it may leave you feeling a bit empty.",1.2,0.0536924844171219,75,62,11,2,False,True,101
844,"No, no, there's absolutely nothing to whine about.",1.2,0.0438872626773184,95,77,17,1,False,True,50
844,As far as medical conditions go yours is a corker but what the hell let’s just screw it.,1.2,0.0573684516132894,80,68,8,4,False,True,88
844,"Now, now. No whining.",1.2,0.0483918603888994,80,65,14,1,False,True,21
844,I expect to be kissed first.,1.2,0.0515580046947248,80,66,12,2,False,True,28
844,"Yeah, you're screwed!",1.2,0.0515580046947248,80,66,12,2,False,True,21
844,It's called a taste test.,1.2,0.0523936831995583,85,71,11,3,False,True,25
844,"Well, it certainly gives new meaning to ""wine nose"".",1.2,0.0523936831995583,85,71,11,3,False,True,52
844,No health insurance? Not to worry.,1.2,0.0545964214099169,65,53,11,1,True,True,34
844,I want to see what you got in your head,1.2,0.0502247202333922,75,61,13,1,False,False,39
844,"Uh,that was definitely not on my Fetlife profile.",1.2,0.0515580046947248,80,66,12,2,False,True,49
844,"We all agree on the prognosis. You have a coastal California cab with a fruity, berry nose, and a toasty finish that needs to be removed immediately.",1.2,0.054540659551419,80,67,10,3,False,True,149
844,I want you to just breathe!,1.2,0.0479283693574423,90,74,14,2,False,True,27
844,"I'll give you some time to chill, then open you up for a few tests.",1.2,0.0450035160370409,80,64,16,0,False,True,67
844,"Not to worry, you will begin breathing almost immediately.",1.2,0.0483918603888994,80,65,14,1,False,True,58
844,"Don't worry, soon you'll be able to breathe.",1.2,0.0588348405414552,65,54,9,2,False,True,44
844,"It was widely successful in clinical trial, reducing bottle neck pain in 1990 vintages and earlier.",1.2,0.0463686962404749,95,78,15,2,False,True,99
844,"It comes with age, Willie. I promise it won't hurt.",1.2,0.0573684516132894,80,68,8,4,False,True,51
844,You will good as nouveau after this  procedure.,1.2,0.0464990554975277,75,60,15,0,False,True,47
844,"Well, Mr. Noir, I’m happy to report that you’re a universal donor.",1.2,0.054540659551419,80,67,10,3,False,True,66
844,Unfortunately it’s a shame you don’t have a screw top.,1.2,0.0515580046947248,80,66,12,2,False,True,54
844,Not to worry. I never work from the rear.,1.2,0.0438872626773184,95,77,17,1,False,True,41
844,Guess what - you won't be saving yourself for your wedding!,1.2,0.049648625302195,85,70,13,2,False,True,59
844,"Yes, it’s invasive, but you’ll be 8 ounces lighter in no time.",1.2,0.0515580046947248,80,66,12,2,False,True,62
844,Being a sommelier is my side hustle.,1.2,0.0504659932964838,90,75,12,3,False,True,36
844,"Actually, lobotomies for your condition have increased significantly since 2020",1.2,0.0476556635780289,105,88,13,4,False,False,79
844,Congratulations!! Your cancer is in remission.,1.2,0.0550019098216926,85,72,9,4,False,True,46
844,"I’d rather have a bottle in front of me than a frontal lobotomy. You’ll get the opposite, I’m afraid",1.2,0.0515580046947248,80,66,12,2,False,False,100
844,"'Don't be upset Mon Ami, you're not the only one who has screwed up' .",1.2,0.0463686962404749,95,78,15,2,False,True,70
844,"This process will help you unwind, Ma'am",1.2,0.054540659551419,80,67,10,3,False,False,40
