contest,caption,mean,precision,votes,not_funny,somewhat_funny,funny,has_question_mark,ends_with_punctuation,caption_length
813,"Sign the treaty, I’m out of quarters.",1.8087431693989071,0.0140767940802128,3111,1313,1080,718,False,True,37
813,"You have a choice. Stay here and face the  harsh Russian winter with your entire army stranded and in disarray, or come home for lunch.",1.808575803981623,0.0153946329606447,2612,1106,900,606,False,True,135
813,"You know he lost, right?",1.7749155405405406,0.0160564100702211,2368,1049,803,516,True,True,24
813,Does somebody need to be put in exile?,1.7411847672778562,0.0143690572011512,2836,1292,986,558,True,True,38
813,Let's go. Mommy doesn't have enough quarters to invade Russia.,1.740789910388317,0.0141558645943645,3013,1401,992,620,False,True,62
813,No.  No quarter will be given,1.7398936170212769,0.0182287216732876,1880,895,579,406,False,False,29
813,I will give you no quarter.,1.739622641509434,0.0138900516432271,3180,1497,1014,669,False,True,27
813,"'Cause je suis la maman, that's why.",1.731614135625597,0.0167331963324189,2094,970,716,408,False,True,36
813,C'mon. We have to pick up Josephine from daycare,1.7311546840958605,0.0159128133122719,2295,1058,796,441,False,False,48
813,"Get over it, Donald. You lost the school election.",1.730140186915888,0.0159545247205216,2568,1279,703,586,False,True,50
813,You'll be happy to know that we're having Beef Wellington for dinner.,1.7300850734725444,0.0151662099516523,2586,1212,860,514,False,True,69
813,He ended up on a lonely island with no TV or iphone.,1.720316622691293,0.0282121607968171,758,364,242,152,False,True,52
813,"If Napoleon listens to his mother he’ll avoid another a long, hungry march home.",1.718094157685763,0.0176789525923429,1763,804,652,307,False,True,80
813,Just stay out of Belgium until I finish shopping.,1.7077464788732395,0.0148425057310246,2556,1202,899,455,False,True,49
813,You know how it ended for him don't you?,1.7038216560509554,0.0305257731163655,628,304,206,118,True,True,40
813,"Well, at least you fit the height requirement.",1.7016627078384798,0.0164511485052126,2105,1007,719,379,False,True,46
813,"Your supply line, with the ice cream, is going this way.",1.6978851963746224,0.0169359590317381,1986,956,674,356,False,True,56
813,"Let’s go before you fall off 
and break a Bonaparte",1.6967919972404275,0.0146311858889808,2899,1472,834,593,False,False,51
813,"When I was a kid, conquering all of Europe and crowning yourself Emperor only cost 10¢.",1.6945606694560669,0.0145652969587147,2629,1257,918,454,False,True,87
813,"The British may be coming, but I'm leaving.",1.691171418756441,0.0139706471454827,2911,1415,980,516,False,True,43
813,You can't invade Russia today. Soccer practice at 2:30.,1.6875876577840112,0.0138984074974044,2852,1370,1003,479,False,True,55
813,If you don't get in the car you're going to have bigger problems than Waterloo.,1.6859430604982206,0.0157829518825429,2248,1093,768,387,False,True,79
813,Now you know why its called a quarter horse!,1.6818502824858756,0.0143907320007978,2832,1424,885,523,False,True,44
813,"You've conquered Austria and Prussia, that's all we have time for.",1.6810751907010535,0.0138532762891681,2753,1306,1019,428,False,True,66
813,The Russian invasion will have to wait; I'm out of quarters.,1.6779359430604983,0.0136353021044533,2810,1332,1051,427,False,True,60
813,We have to go. You can invade Russia tomorrow.,1.675932699341624,0.0139442531789814,2734,1313,994,427,False,True,46
813,Why can't you pretend to be an American fascist like other boys your age?,1.6745937376139517,0.0152502312308789,2523,1284,776,463,True,True,73
813,Get off before you develop a complex.,1.6744755244755245,0.0141360320555683,2860,1434,923,503,False,True,37
813,No more quarters? Then you've met your Waterloo.,1.6739446870451238,0.0165357190271141,2061,1026,681,354,True,True,48
813,"I don't 
have enough change for
you to  conquer the world.""",1.6716101694915255,0.0139606936611346,2832,1399,964,469,False,False,59
813,"I'm all out of quarters,you can try to cross the Alps next week when you get your allowance.",1.6712608473711077,0.016484323828439,1959,949,705,305,False,True,92
813,First you need to learn how to cross the street by yourself.,1.6667931688804554,0.0143611443397327,2635,1301,911,423,False,True,60
813,Your revolution is out of funding.,1.6632696390658177,0.015418940859595,2355,1189,770,396,False,True,34
813,"I know, but you’ll serve your country even better after your nap.",1.6582278481012658,0.0185388602535679,1580,791,538,251,False,True,65
813,"Your choice, kiddo, Waterloo or an ice cream cone?",1.6536661466458658,0.0283239683570484,641,314,235,92,True,True,50
813,Now now don’t get short with me,1.652080344332855,0.0143610627608851,2788,1455,848,485,False,False,31
813,"No Jeremy, I said I'll meet you in the ""eggs aisle""",1.6517894736842105,0.0154222260835984,2375,1228,746,401,False,False,51
813,Just be sure and take that off before we get to the therapist's office.,1.65,0.0446440092017247,280,144,90,46,False,True,71
813,"OK, one more ... but I'm not paying for a land war in Asia.",1.6428831452493629,0.0143099471570385,2747,1438,852,457,False,True,59
813,No more binge-watching the History channel.,1.635510645976182,0.0138288167438232,2771,1423,935,413,False,True,43
813,"Sometimes, heroes carry groceries.",1.6339326878745966,0.0152342518128955,2169,1088,787,294,False,True,34
813,"Careful, you don't want to break a bone apart",1.6333333333333333,0.016303752994022,2160,1161,630,369,False,False,45
813,Now let’ s conquer the mess in your room.,1.6276978417266188,0.0153554509131929,2224,1151,750,323,False,True,41
813,"Don’t call me Josephine, I’m your mother>",1.6270793036750484,0.0146034469240326,2585,1374,801,410,False,False,41
813,"If  Waterloo means anything to you, you better get into the car right now.",1.625792023853895,0.0141673381421387,2683,1412,863,408,False,True,74
813,"We can't wait for you to conquer Europe, you have a violin lesson and I have a yoga class.",1.6244897959183673,0.0186452819704277,1470,755,512,203,False,True,90
813,"- Come on, Donald! It’s time to go.",1.6213499281953088,0.0168844258052971,2089,1167,546,376,False,True,35
813,I’ll pick you up after Waterloo.,1.6184404119666502,0.0162339960103939,2039,1085,647,307,False,True,32
813,That’s your last ride. It’s nearly winter.,1.6035182679296347,0.0264250405461245,739,395,242,102,False,True,42
813,Time to get off your high horse.,1.600577478344562,0.016025912795191,2078,1135,638,305,False,True,32
813,No matter how much you thirst for global domination you still have to go back to school.,1.590987868284229,0.0291017649258289,577,307,199,71,False,True,88
813,"Donald, it's time to go home.",1.5895170789163722,0.0186187194760485,1698,991,413,294,False,True,29
813,"Let's go Napoleon, Waterloo is this way.",1.5888544891640868,0.0175953768266494,1615,872,535,208,False,True,40
813,"Come on, Leon.  We need to seize the parking lot.",1.5846994535519126,0.0184420682837828,1830,1107,376,347,False,True,49
813,Moscow is the other direction!,1.5825747724317296,0.0179542012898788,1538,836,508,194,False,True,30
813,I’m going to count to trois.,1.57960981749528,0.0189400064765309,1589,927,403,259,False,True,28
813,"If we leave now, I’ll get you a treaty.",1.574310692669805,0.0191168694668998,1487,855,410,222,False,True,39
813,"Remember, like all conquerors, your time is limited.",1.5622202327663384,0.0215874631295369,1117,642,322,153,False,True,52
813,Do you even know how to pillage?,1.5605658709106984,0.020793873734544,1131,634,360,137,True,True,32
813,Why can't you have gender confusion like the rest of your friends?,1.5482456140350878,0.0243316597837037,912,545,234,133,True,True,66
813,The 23andMe results really got to your head.,1.544468546637744,0.0223104805339595,922,517,308,97,False,True,44
813,"If you’re done conquering Europe, I could use some help with these bags.",1.5408479834539814,0.0230925761421459,967,573,265,129,False,True,72
813,And I'm Marie Antoinette. Now get into the car.,1.5398138572905895,0.024137057118343,967,597,218,152,False,True,47
813,Look both ways before you cross the Alps.,1.5390374331550802,0.0245031035060361,935,577,212,146,False,True,41
813,"Get to the car now, or you're history.",1.5352112676056338,0.0238360526061658,852,496,256,100,False,True,38
813,"Let's go, Winter is coming!",1.5300480769230769,0.0246248581853971,832,497,229,106,False,True,27
813,I will give no quarters.,1.528323699421965,0.0251189652158374,865,536,201,128,False,True,24
813,Not until you've conquered your homework.,1.5211097708082026,0.0250545164991572,829,509,208,112,False,True,41
813,Napoleon wouldn't have had fifty cents either. He was always a little short.,1.5169811320754718,0.026297146945071,795,503,173,119,False,True,76
813,There will be no quarter given to you either.,1.5149700598802396,0.0277396590184138,668,412,168,88,False,True,45
813,And I say it's time to put the Nap in Napoleon.,1.5130674002751032,0.0266773216960222,727,451,179,97,False,True,47
813,I bet Mrs. Bonaparte didn't have to ask her son for help with the groceries.,1.5098039215686274,0.0268183672673003,612,358,196,58,False,True,76
813,"Sorry, but I give no quarter.",1.5045731707317074,0.0280463898303644,656,412,157,87,False,True,29
813,"It's nap time, Napoleon.""",1.5044910179640718,0.0273377131792967,668,414,171,83,False,False,25
813,"Just come off it, Donald.",1.5023255813953489,0.0289963442729062,645,415,136,94,False,True,25
813,I didn’t bring enough quarters for you to cross the Alps.,1.499219968798752,0.0274114662117181,641,395,172,74,False,True,57
813,"The Alps may await, but so does your bath.",1.4992175273865416,0.0284401168247236,639,405,149,85,False,True,42
813,"Sorry, I do not have enough quarters to get you over the Alps.",1.4991423670668953,0.0292223831854557,583,364,147,72,False,True,62
813,"If you don't come now, your room will be Elba for a week.",1.4972375690607735,0.0290137351079714,543,329,158,56,False,True,57
813,You'd better retreat. I'm out of quarters.,1.4939759036144578,0.0271278609710058,664,415,170,79,False,True,42
813,You can conqueror Europe on your own time. Mommy’s got ice cream melting.,1.491349480968858,0.0283716985113219,578,356,160,62,False,True,73
813,You cross the Alps while Mommy stops in Boucherie and conquers a Bourbon.,1.490299823633157,0.0293100121656543,567,356,144,67,False,True,73
813,"Get in the car little man, or Whole Foods will be your Waterloo.",1.4892086330935252,0.0293012391410409,556,347,146,63,False,True,64
813,"Fine, go ahead and conquer. But your supply line is heading home.",1.4882882882882882,0.0303208562476207,555,356,127,72,False,True,65
813,Look both ways before crossing the Alps.,1.4876325088339222,0.0299792723437582,566,363,130,73,False,True,40
813,Let’s go home and eat cake.,1.4871794871794872,0.0283277978721431,585,364,157,64,False,True,27
813,Making you get off your little horse and get in the car is not going to give you a complex.,1.4864341085271318,0.0297315602697401,516,318,145,53,False,True,91
813,"No. L'état, c'est Mom.",1.485655737704918,0.0324271201205879,488,315,109,64,False,True,22
813,"No more quarters!
And stop calling me Josephine.",1.4856046065259116,0.029272267129037,521,319,151,51,False,True,48
813,"The British may be coming, but your ride is leaving.",1.4827586206896552,0.0310004742650253,493,310,128,55,False,True,52
813,"Because mommy is the Empress and the Empress rules, that's why.”",1.481818181818182,0.0303055140561841,550,355,125,70,False,False,64
813,"He didn’t win, you know.",1.4813614262560777,0.0283761242153045,617,396,145,76,False,True,24
813,Can you get off the horse? Of CORSICAN !,1.4807339449541284,0.0301802300269221,545,350,128,67,True,True,40
813,I give you no quarter. Let’s go.,1.4791288566243197,0.0291500893276141,551,347,144,60,False,True,32
813,"Liberty, equality, and get in the car right now.",1.4785992217898831,0.0310529383071813,514,331,120,63,False,True,48
813,I’m taking you out of Military School.,1.4779874213836477,0.0314808755005187,477,302,122,53,False,True,38
813,Try conquering the mess in your bedroom first.,1.477859778597786,0.0279602816034625,542,330,165,47,False,True,46
813,"Actually, I outrank you. Let’s go.",1.4751491053677932,0.0310498531912027,503,323,121,59,False,True,34
813,"For the last time, your hipster father thought it was a unique name. It means nothing about your past life.",1.4730021598272138,0.029441372573876,463,279,149,35,False,True,107
813,I give no quarter.,1.4725050916496945,0.0301277341306009,491,307,136,48,False,True,18
813,You can cross the Alps after lunch.,1.4702258726899384,0.0309909265534579,487,311,123,53,False,True,35
813,You and what army?,1.4691629955947136,0.0324878638922395,454,293,109,52,True,True,18
813,"come on now, were late for your therapist.",1.4672897196261685,0.0332906124631196,428,276,104,48,False,True,42
813,Napoleon at least acted like he was a big boy.,1.4645669291338583,0.0321588466443568,508,342,96,70,False,True,46
813,"C'mon, I think we've both charged enough.",1.4617224880382775,0.0336940393099361,418,272,99,47,False,True,41
813,I buy him one baguette and the kid thinks he’s Napoleon,1.4616977225672878,0.0304629119282886,483,308,127,48,False,False,55
813,"Honestly Billy, the doctor said you were 
normal height for your age!",1.4601769911504423,0.0316562030356132,452,290,116,46,False,True,69
813,I give you no quarter.,1.4596412556053813,0.0310035651831866,446,281,125,40,False,True,22
813,"Let's go, Donald!",1.459605026929982,0.0296545686131175,557,368,122,67,False,True,17
813,Napoleon's greatest tactical blunder was not listening to his mother.,1.45852534562212,0.032439431033219,434,280,109,45,False,True,69
813,"Yes, dear. Remember to invade the restroom before we leave.",1.4572748267898383,0.033141898350366,433,284,100,49,False,True,59
813,Napoleon didn't listen to his Mother and look how that turned out,1.4564755838641188,0.0314428266945067,471,307,113,51,False,False,65
813,Napoleon Crossing his Mother,1.4540816326530612,0.0343807928976464,392,256,94,42,False,False,28
813,"Young man, when we get home you go straight into exile.",1.4534005037783375,0.0340608260394944,397,259,96,42,False,True,55
813,"I'm your Waterloo, young man.",1.4531590413943356,0.0323309423549144,459,304,102,53,False,True,29
813,"If I wanted to deal with a Napoleon complex, I wouldn’t have divorced your father.",1.4527363184079602,0.0342954284491672,402,265,92,45,False,True,82
813,You can't invade Poland if I'm out of quarters.,1.451834862385321,0.0334324582325613,436,291,93,52,False,True,47
813,Let’s go Napoleon…Elba is waiting.,1.450602409638554,0.0329679069761512,415,270,103,42,False,True,34
813,"Nice try, but the ice cream you want is actually Neapolitan.",1.4494117647058824,0.0332449918571254,425,281,97,47,False,True,60
813,They didn’t have 'flaky puff pastry layered with rich vanilla cream.' I got Oreos.,1.4492099322799097,0.0337932465386231,443,301,85,57,False,True,82
813,Let’s pretend Russia is in this direction.,1.4491315136476426,0.0315936006077043,403,253,119,31,False,True,42
813,Call me Josephine once more and you're walking home.,1.4478371501272265,0.0354113526076555,393,265,80,48,False,True,52
813,I don't care what 23 and Me found. Get in the car.,1.4474327628361858,0.0343695142497219,409,274,87,48,False,True,50
813,Sometimes I wish you inherited your father's inferiority complex.,1.4473684210526316,0.0345530480001534,380,249,92,39,False,True,65
813,No more History Channel for you.,1.446524064171123,0.0334865552204941,374,239,103,32,False,True,32
813,I’m not waiting for them to finish your portrait.,1.4464285714285714,0.0321955886220226,392,248,113,31,False,True,49
813,"I've got the provisions for your retreat, emperor.",1.4463840399002494,0.0320824662978427,401,255,113,33,False,True,50
813,"Even Napolean had to listen to his mother, now let's go.",1.4462616822429906,0.0315368371894264,428,275,115,38,False,True,56
813,"No, you can’t invade Russia today. I have Pilates.",1.4452214452214451,0.0314804303211835,429,276,115,38,False,True,50
813,And I’m Joan of Arc. Come on—we’re late.,1.4450704225352111,0.0351964638252593,355,231,90,34,False,True,40
813,Rally the troops after your sister’s swim lesson.,1.445054945054945,0.0345691397173786,364,236,94,34,False,True,49
813,"Either way, this doesn’t end well for you.",1.4447236180904524,0.0335907188036313,398,261,97,40,False,True,42
813,"Emperor or not, your bedtime is still 8 o'clock.",1.4433497536945812,0.0331042157088942,406,266,100,40,False,True,48
813,"Lest you forget, Napoleon's penis is in a jar in New Jersey.",1.4429347826086956,0.036990990271061,368,252,69,47,False,True,60
813,We can do this the easy way or the Waterloo way.,1.4414893617021276,0.0343854626586788,376,247,92,37,False,True,48
813,"Don, Jr,  go find your brother Eric",1.440251572327044,0.0381043976604583,318,212,72,34,False,False,35
813,Keep that up and you're going to wish the British were coming,1.440191387559809,0.0324022414509703,418,274,104,40,False,False,61
813,You need to conquer your homework first.,1.4390934844192635,0.0341535780007144,353,227,97,29,False,True,40
813,"Do as you're told Emperor, or I will gladly send you into exile.",1.4384615384615385,0.0328810269524219,390,253,103,34,False,True,64
813,Stop re-enacting up.,1.438423645320197,0.0327127592719954,406,266,102,38,False,True,20
813,NO! You can't go to Moscow,1.4379746835443037,0.0329755847664358,395,258,101,36,False,False,26
813,"France might be that way, but the car is this way.",1.4376590330788803,0.0338693447275124,393,261,92,40,False,True,50
813,"You're one minute away from exile, young man!",1.4373333333333334,0.0346386833444688,375,249,88,38,False,True,45
813,Your father wants his hat back.,1.4357541899441342,0.034488800829598,358,234,92,32,False,True,31
813,I don't have enough quarters for you to cross the Alps.,1.434108527131783,0.0342339051119456,387,259,88,40,False,True,55
813,Non means no!,1.4339080459770115,0.0349471718708174,348,228,89,31,False,True,13
813,Spain will still be there tomorrow.,1.4328767123287671,0.0337800528772884,365,238,96,31,False,True,35
813,Russia's the other way. You're attacking Canada.,1.4322766570605188,0.0364092836161613,347,234,76,37,False,True,48
813,Everything is a battle with you,1.4318936877076411,0.0387875236242754,301,202,68,31,False,False,31
813,You know what else Napoleon was good at? Unloading the groceries.,1.43042071197411,0.0391341324558545,309,211,63,35,True,True,65
813,And I'm Joan of Arc but the groceries aren't going to carry themselves to the car.,1.430340557275542,0.0365816569777774,323,214,79,30,False,True,82
813,Keep it up and winter will be the least of your concerns.,1.4281767955801106,0.0339509237444204,362,238,93,31,False,True,57
813,If you're going to conquer Russia too you'll need more than fifty-cents...,1.4281609195402298,0.0360809088495389,348,235,77,36,False,True,74
813,"Okay, Napoleon, time to conquer your homework.",1.428125,0.0368141134333561,320,213,77,30,False,True,46
813,"All emperors run out of time, dear.",1.4281045751633987,0.0374532532166313,306,203,75,28,False,True,35
813,"That doesn't qualify as a ""History Report""",1.4265129682997115,0.034496654367195,347,228,90,29,False,False,42
813,That’s enough imperialism for today.,1.4233128834355828,0.0352410725675867,326,214,86,26,False,True,36
813,"It's tine to go home, dear. You'll have to invade Russia tomorrow.",1.421787709497207,0.0346345619835448,358,240,85,33,False,True,66
813,I'm the only dictator around here. Get off the horse.,1.4208955223880595,0.0375367346328473,335,232,65,38,False,True,53
813,That's not really what fight for change means.,1.4203389830508475,0.0401596557359022,295,205,56,34,False,True,46
813,"You have about as much chance of winning the Battle of Waterloo as I have of winning the NEW YORKER Cartoon Caption Contest. Now get off your high horse and help Mommy carry the groceries.""",1.4198250728862971,0.0377925214702833,343,241,60,42,False,False,189
813,"Yes, victory is ours. Now get in the car.",1.4183976261127595,0.0351632196531312,337,225,83,29,False,True,41
813,"No, you can't have another 50 cents to escape from Elba.",1.4182389937106918,0.0358245439731014,318,211,81,26,False,True,56
813,"Very exciting, but did you notice that the horse isn't going anywhere?",1.416949152542373,0.0365267164877858,295,194,79,22,True,True,70
813,"Come on,Your Highness - it’s time to put the “Nap” in Napoleon.",1.4166666666666667,0.0390327089452399,312,218,58,36,False,True,63
813,"Fine, hurry up and go to the bathroom. And stop calling it the ""water loo""!",1.4154302670623145,0.0363771732987281,337,231,72,34,False,True,75
813,"You know, Napoleon didn't take his blankie to Waterloo.",1.415335463258786,0.0384009011139149,313,217,62,34,False,True,55
813,"I'll only be a minute, so don't start anything.",1.413919413919414,0.0415550821468188,273,191,51,31,False,True,47
813,That's it. No more Fox News.,1.4136690647482015,0.0406789981980539,278,193,55,30,False,True,28
813,"When you're finished at Waterloo,, meet me at the checkout line.",1.412751677852349,0.03464498593667,298,192,89,17,False,True,64
813,Just look both ways before you cross the Alps.,1.4119601328903657,0.035361907341461,301,197,84,20,False,True,46
813,"Yes, you’re quite the little tyrant.",1.409375,0.034196422725109,320,210,89,21,False,True,36
813,Help me with the bags or I'm sending you to Elba.,1.4092526690391458,0.038386354870186,281,190,67,24,False,True,49
813,You are acting more and more like your father,1.4087591240875912,0.0397545640691021,274,188,60,26,False,False,45
813,You got about a minute and a half left to conquer the rest of Europe.,1.4067796610169492,0.0394804317732326,295,207,56,32,False,True,69
813,School starts next week. No revolution is going to change that.,1.40625,0.0376984922926396,288,195,69,24,False,True,63
813,"We're not retreating, just advancing in a different direction.",1.4054982817869417,0.0377327595295225,291,198,68,25,False,True,62
813,"Allons-y, mon peu general! Sans moi - no dinner!",1.404833836858006,0.0352535272863643,331,225,78,28,False,True,48
813,It’s fun now but wait until winter comes.,1.404109589041096,0.0394608769760153,292,205,56,31,False,True,41
813,"That’s right, Timmy. Dress for the job you want - not the job you have.",1.4035087719298245,0.0392347876223835,285,198,59,28,False,True,71
813,"I'm warning you, this is not going to end well.",1.403125,0.0352716833140804,320,216,79,25,False,True,47
813,"If you keep that up, you are going to develop a complex.",1.4018987341772151,0.0364099816907652,316,217,71,28,False,True,56
813,Courage isn't having the 50c to go on - it is going on when you don't have 50c,1.4014869888475836,0.0388195192414061,269,183,64,22,False,False,78
813,You can't go to Waterloo. It's almost time for dinner.,1.4014084507042253,0.0393167262708991,284,198,58,28,False,True,54
813,Okay.  Conquer Europe!  I’m heading home.,1.4008620689655171,0.0431360900437176,232,161,49,22,False,True,41
813,"Well, at least you’re passed your Robespierre phase.",1.4007220216606495,0.035897768930755,277,182,79,16,False,True,52
813,"With an attitude like that young man, you can just go straight to exile.",1.4006514657980456,0.0362902388009928,307,209,73,25,False,True,72
813,"Ok Napoleon. You can go to Waterloo, but I'm going to Macy's.",1.4006514657980456,0.0347927114841846,307,204,83,20,False,True,61
813,Waterloo is the other direction.,1.4006024096385543,0.0366637120719737,332,233,65,34,False,True,32
813,We'll see how you handle a two-front war when your dad gets home.,1.4,0.0426615364374171,245,172,48,25,False,True,65
813,At least this is better than the last time when you were Lady Godiva.,1.398648648648649,0.0401781790032781,296,213,48,35,False,True,69
813,Russia? In the winter?,1.398406374501992,0.0399520354955272,251,171,60,20,True,True,22
813,I think Elba is that direction.,1.3979591836734695,0.0367655730435402,294,200,71,23,False,True,31
813,"The insurrection was two years ago honey, it's time to move on.",1.3976833976833978,0.0413110489594982,259,182,51,26,False,True,63
813,It’s time to conquer your homework.,1.3972602739726028,0.0339463372581852,292,190,88,14,False,True,35
813,Conquer quickly.  I'm out of change.,1.3964912280701751,0.0378891538776925,285,196,65,24,False,True,36
813,Fifty cents per minute beats my therapist.”,1.3962962962962964,0.0427275188694125,270,197,39,34,False,False,43
813,Let's go conquer lunch.”,1.396078431372549,0.0402623936600352,255,176,57,22,False,False,24
813,"Conquer the world with your own money, mister.",1.3956043956043955,0.0390571665115159,273,189,60,24,False,True,46
813,Put your hand in your shirt.,1.3951048951048952,0.0371267705379776,286,195,69,22,False,True,28
813,You can cross the Alps tomorrow. I have yoga class in an hour.,1.3944223107569722,0.0414771460587663,251,176,51,24,False,True,62
813,"Sorry Tim, I already spent my spare quarters on the Louisiana Territory.",1.3941605839416058,0.038596305963385,274,189,62,23,False,True,72
813,Stop calling me Josephine!,1.3941368078175895,0.0365226267065379,307,212,69,26,False,True,26
813,Dismount or it's Elba for you.,1.3940520446096654,0.0394558932122192,269,187,58,24,False,True,30
813,"If you’re done conquering Europe, I could use some help loading the car.",1.3940520446096654,0.038746391453684,269,185,62,22,False,True,72
813,I'll give you a buck to invade Russia again. Another ten if you get it right.,1.393333333333333,0.0368168607263316,300,207,68,25,False,True,77
813,"Dreams of empire may be that way, but the Oreos are heading home.",1.3929961089494165,0.0407603799718741,257,180,53,24,False,True,65
813,"""I know destiny lies that way. But the car lies this way. Let's go.",1.39297124600639,0.0357290935267665,313,215,73,25,False,True,67
813,"I don’t have any more quarters, and my name isn’t Josephine",1.3924050632911391,0.0360471210810914,316,219,70,27,False,False,59
