contest,caption,mean,precision,votes,not_funny,somewhat_funny,funny,has_question_mark,ends_with_punctuation,caption_length
783,Don't worry about everyone else. What about you? Does broccoli like broccoli,1.2741935483870968,0.0476826064400123,124,95,24,5,True,False,76
783,Might I suggest it would be healthier to think of yourself as the forgiving tree?,1.2738095238095235,0.0618865545403169,84,66,13,5,True,True,81
783,I have no self-esteam.,1.2736842105263158,0.0506223424931902,95,71,22,2,False,True,22
783,It's time for you to be the RECEVING tree.,1.2736842105263158,0.0527881210617628,95,72,20,3,False,True,42
783,You look stalked!,1.2736842105263158,0.054868478117812,95,73,18,4,False,True,17
783,Is it realistic to think that being an entrée would solve all of your problems?,1.2736842105263158,0.0527881210617628,95,72,20,3,True,True,79
783,Maybe it is time for you to branch out.,1.2736842105263158,0.0506223424931902,95,71,22,2,False,True,39
783,Would you happen to have a pillow for my head? The arm of this couch is killing me.,1.2736842105263158,0.0588088277593745,95,75,14,6,True,True,83
783,What exactly is it about children that concerns you?,1.2736842105263158,0.054868478117812,95,73,18,4,True,True,52
783,"Remember, you were just a sapling back then.",1.2735849056603774,0.0511028750629446,106,81,21,4,False,True,44
783,You’re having an existential crisis because no one was there to hear?,1.2735849056603774,0.0545058976472569,106,83,17,6,True,True,69
783,"Im listening, but you seem reluctant to reveal whether you’re cruciferous or deciduous.",1.2735849056603774,0.0528317930702345,106,82,19,5,False,True,87
783,You’re broccoli.. everyone hates you,1.2735849056603774,0.0528317930702345,106,82,19,5,False,False,36
783,"Which state of being troubles  you the  most, frozen, steamed, or raw?",1.2735042735042734,0.0523876306091307,117,92,18,7,True,True,70
783,SuperFoods are allowed to have CrapDays.,1.2735042735042734,0.0494948422381894,117,90,22,5,False,True,40
783,So when will you put down roots?,1.2734375,0.0479845311027172,128,99,23,6,True,True,32
783,You should be happy you’re an oak.  It’s a lot easier to spell than eucalyptus.,1.2727272727272727,0.0576609390232869,88,68,16,4,False,True,79
783,"Relax, close your eyes, and remember when you were just an acorn.",1.2727272727272727,0.0469900264184044,132,102,24,6,False,True,65
783,You feel Alfredo is smothering you?”,1.2727272727272727,0.0511574030791943,121,95,19,7,True,False,36
783,So you say you did fall in the forest?,1.2727272727272727,0.0481675746488732,110,83,24,3,True,True,38
783,Please tell me more about this recurring dream where you turn into a bunch of farts?,1.2727272727272727,0.0620262035655466,88,70,12,6,True,True,84
783,"I think you will need to find a new therapist.  
Truth be told, I just don't like Broccoli.",1.2727272727272727,0.0533715498092551,99,76,19,4,False,True,91
783,Stop stalking me.,1.2727272727272727,0.0546565451993271,110,87,16,7,False,True,17
783,It appears the diet-change therapy is working well!,1.2727272727272727,0.0498690376781787,110,84,22,4,False,True,51
783,Let’s get to the root of the problem,1.2727272727272727,0.0497929597731969,121,94,21,6,False,False,36
783,"Before we start, who is your barber?",1.2727272727272727,0.0571034889968524,99,78,15,6,True,True,36
783,I don't think your stalking her is going to help anything.,1.2727272727272727,0.0598833608684492,88,69,14,5,False,True,58
783,You seem to be overburdened with carbon sequestration. May I suggest seeing a climatologist or possibly an environmentalist,1.2727272727272727,0.0498690376781787,110,84,22,4,False,False,123
783,"In a sense, we’re all ‘just a side.’",1.2727272727272727,0.0552690274233926,99,77,17,5,False,False,36
783,"I need more friends. I'm not sure I can absorb any more carbon, Doc.",1.2727272727272727,0.0533715498092551,99,76,19,4,False,True,68
783,But the important thing is that I can hear you NOW.,1.2727272727272727,0.0481675746488732,110,83,24,3,False,True,51
783,It's funny you say that about your hair...,1.2727272727272727,0.046945252681302,121,92,25,4,False,True,42
783,"Hey I know you! My kids hate you.
…
To be honest, I’m not a fan either.",1.2719298245614037,0.0518035049357627,114,89,19,6,False,True,71
783,We need to get to your roots,1.2718446601941749,0.0501172711123673,103,78,22,3,False,False,28
783,So why do feel that children don't like you?,1.2718446601941749,0.0501172711123673,103,78,22,3,True,True,44
783,Let's get to the roots of your problem,1.2718446601941749,0.0519818071333624,103,79,20,4,False,False,38
783,"Just because you think everyone hates you, doesn’t make it true.",1.2718446601941749,0.0501172711123673,103,78,22,3,False,True,64
783,Have you considered branching out of your comfort zone?,1.2718446601941749,0.053781741157661,103,80,18,5,True,True,55
783,Why do you think people don't want to hug you?,1.2717391304347827,0.0559487105356188,92,71,17,4,True,True,46
783,No one is Stalking you. buttering up?  Absolutely!,1.2717391304347827,0.0537714298429854,92,70,19,3,True,True,50
783,Your problem is that you are a tree.,1.2717391304347827,0.0559487105356188,92,71,17,4,False,True,36
783,A lot of us want to return to our roots.,1.2717391304347827,0.0537714298429854,92,70,19,3,False,True,40
783,"After steaming, you could control it better with a little butter.",1.2717391304347827,0.0580443774524099,92,72,15,5,False,True,65
783,You need to put down roots.,1.2717391304347827,0.0559487105356188,92,71,17,4,False,True,27
783,"Instead of fearing the steamer, might you not see it as a seven-minute passage to a truer, more uh, flavorful, you?",1.2717391304347827,0.0559487105356188,92,71,17,4,True,True,115
783,I don't think dogs have anything against you personally.,1.271604938271605,0.0608893594847293,81,63,14,4,False,True,56
783,Tell me more about the chirpy voices in your head.,1.271604938271605,0.0633731494701757,81,64,12,5,False,True,50
783,Veg out all you want.  I was a couch potato for years.,1.271186440677966,0.0505811753710787,118,92,20,6,False,True,54
783,"Wow, so it sounds like that really uprooted your life.",1.271186440677966,0.0519934597191227,118,93,18,7,False,True,54
783,How old were you when you first heard about 'shelf-life'?,1.2710280373831775,0.0506875552695496,107,82,21,4,True,True,57
783,"And after you fell in the forest, tell me, did you feel unheard?",1.2710280373831775,0.0489172006143902,107,81,23,3,True,True,64
783,No prescription is going to make others like you. But there's an over the counter device called a deep fryer...,1.2710280373831775,0.0489172006143902,107,81,23,3,False,True,111
783,"Given your nature, I think the ""stalker"" charge was inevitable.",1.2710280373831775,0.0506875552695496,107,82,21,4,False,True,63
783,"I'm curious. When you fell in the forest, did it make a sound?",1.2710280373831775,0.0523981297610784,107,83,19,5,True,True,62
783,"Everyone may be talking about his crust, but Cauliflower will never top a baked potato like you.",1.2708333333333333,0.0523130897264264,96,73,20,3,False,True,96
783,"So you're telling me that, when you fell, nobody was around but you made a sound?",1.2708333333333333,0.0601153253270851,96,77,12,7,True,True,81
783,"Unfortunately, foot-shaming has become a real problem in your community.",1.2708333333333333,0.0523130897264264,96,73,20,3,False,True,72
783,"Yes, we'll definitely work on finding your roots.",1.2708333333333333,0.0523130897264264,96,73,20,3,False,True,49
783,"Brock, these feelings you’re having for broccolini are a little concerning. After all, she is your first cousin.",1.2705882352941176,0.0589075030867962,85,66,15,4,False,True,112
783,"So, you say you fell and nobody heard?",1.2705882352941176,0.0564799245316686,85,65,17,3,True,True,38
783,I understand. When did you stop self-identifying as cruciferous?,1.2705882352941176,0.0564799245316686,85,65,17,3,True,True,64
783,"Frankly, I think you're a most attractive tree and I NEVER said you look like broccoli!",1.2704918032786885,0.0480438161544407,122,94,23,5,False,True,87
783,Can you tell me more about your roots?,1.2702702702702702,0.0494787671036207,111,85,22,4,True,True,38
783,"You know, everyone has that feeling of being stuck in place sometimes.",1.2702702702702702,0.0460494089700835,111,83,26,2,False,True,70
783,It's actually normal to feel down after becoming an empty-nester.,1.2702702702702702,0.0511072260829572,111,86,20,5,False,True,65
783,You have Desparagus.,1.2702702702702702,0.054217606785018,111,88,16,7,False,True,20
783,I think the problem stems from your roots.,1.2702702702702702,0.0511072260829572,111,86,20,5,False,True,42
783,One of my problems is that I hear birds singing in my head all the time.,1.2702702702702702,0.0646732947984549,74,58,12,4,False,True,72
783,You remind me of my salad days.,1.2702702702702702,0.0526853748368052,111,87,18,6,False,True,31
783,So how did you feel after you fell in the forest and nobody heard you?,1.27,0.0547814758929521,100,78,17,5,True,True,70
783,I can't discuss previous patients but be thankful you're not kale.,1.27,0.0565953205047051,100,79,15,6,False,True,66
783,Good session. I'm starting you on grated cheese applied topically and gradually adding butter sauce.,1.27,0.0529054808029366,100,77,19,4,False,True,100
783,Do you ever feel rootless?,1.27,0.0547814758929521,100,78,17,5,True,True,26
783,"How long will it take to get to the roots of your problem?
Let's say three days a week for about seven years.""",1.27,0.0529054808029366,100,77,19,4,True,False,110
783,I got nothing.,1.27,0.0565953205047051,100,79,15,6,False,True,14
783,"That's funny, you don't look Deciduous.",1.27,0.0529054808029366,100,77,19,4,False,True,39
783,So you say you're a broccoholic??,1.27,0.0529054808029366,100,77,19,4,True,True,33
783,"Ok…so, you fell in the forest, 
and then what happened?",1.2696629213483146,0.0614018332262938,89,71,12,6,True,True,55
783,People just keep remarking how healthy I am.,1.2696629213483146,0.0592859385405714,89,70,14,5,False,True,44
783,I AM here to listen. But I need more from you than a few rustles here and there.,1.2696629213483146,0.0524283765140299,89,67,20,2,False,True,80
783,It sounds like you really hated yourself as a kid.,1.2692307692307692,0.0550489788548266,104,82,16,6,False,True,50
783,"The senior George Bush has sadly passed on, so why do you continue to hold this grudge?",1.2692307692307692,0.0550489788548266,104,82,16,6,True,True,87
783,Conditioner might help.,1.2692307692307692,0.0497018166750555,104,79,22,3,False,True,23
783,When did all this hugging start to bother you?,1.2692307692307692,0.051545873532097,104,80,20,4,True,True,46
783,Do you realize that covering yourself in cheese is your way if seeking outside validation rather than self approval?,1.2692307692307692,0.0550489788548266,104,82,16,6,True,True,116
783,So you want to be a tree in Brooklyn?,1.26890756302521,0.0529670562057095,119,95,16,8,True,True,37
783,"First off, a haircut.",1.2688172043010753,0.0510291122856655,93,70,21,2,False,True,21
783,I can't tell yet whether you are a fruit tree or a nut tree,1.2688172043010753,0.0486848663340721,93,69,23,1,False,False,59
783,"Dude, nice hair",1.2688172043010753,0.0554209209780587,93,72,17,4,False,False,15
783,There is no chance you are going to become a Louisville Slugger.,1.2685185185185186,0.0552010728394295,108,86,15,7,False,True,64
783,Your fear of butter is actually quite rational,1.2685185185185186,0.0485270787963912,108,82,23,3,False,False,46
783,And how is your effort to become an avocado working for you?,1.2682926829268293,0.0462842579920987,123,94,25,4,True,True,60
783,Sounds like you’ve been sitting on a pile of dirt!,1.2682926829268293,0.0550075423582234,82,62,18,2,False,True,50
783,Would you like some cheese?,1.268041237113402,0.0538776931968218,97,75,18,4,True,True,27
783,"In my professional opinion, it's good that children don't want to eat you.",1.268041237113402,0.0558353154957798,97,76,16,5,False,True,74
783,"And how does that make you feel,  to lose all your leaves?",1.268041237113402,0.0558353154957798,97,76,16,5,True,True,58
783,What you have is a fear of putting down roots.,1.268041237113402,0.0497318063175474,97,73,22,2,False,True,46
783,Your feelings of inadequacy seem to be deeply rooted.,1.268041237113402,0.0497318063175474,97,73,22,2,False,True,53
783,Let me give you the truncated version...,1.2678571428571428,0.0522685848684257,112,88,18,6,False,True,40
783,"I think if you branch out more, people will be more accepting.",1.2678571428571428,0.0457001566807727,112,84,26,2,False,True,62
783,"OK let's pick up where we left off, you had a bad dream where you were being stalked.",1.2678571428571428,0.0490943443015333,112,86,22,4,False,True,85
783,It’s a classic case of cauliflower envy,1.2678571428571428,0.0507063093043919,112,87,20,5,False,False,39
783,Then mother said no vegetables- no dessert.,1.2678571428571428,0.0507063093043919,112,87,20,5,False,True,43
783,"I'm sorry Mr. Broccoli, but you must simply stop thinking of yourself as a tree.",1.2674418604651163,0.0583034624690735,86,67,15,4,False,True,80
783,"I’m sorry, but I still can’t understand why you broke off your relationship with beef.",1.2674418604651163,0.0559079236304225,86,66,17,3,False,True,86
783,So you are here for some treetment?,1.2674418604651163,0.0583034624690735,86,67,15,4,True,True,35
783,Deep breath please... for all of us.,1.2674418604651163,0.0559079236304225,86,66,17,3,False,True,36
783,Let's talk about your last soy sauce nightmare.,1.2674418604651163,0.0507789356153724,86,64,21,1,False,True,47
783,"But how can they, if you don’t like yourself?",1.2674418604651163,0.0606043855434586,86,68,13,5,True,True,45
783,"Would it be comforting to acknowledge that ""stalk"" has more than one meaning?",1.2673267326732671,0.0505241616719725,101,77,21,3,True,True,77
783,You’re talking apples and oranges,1.2673267326732671,0.052447218368907,101,78,19,4,False,False,33
783,I can see this relationship is eating you up,1.2673267326732671,0.0505241616719725,101,77,21,3,False,False,44
783,I think  we can get to the root cause of your problems.,1.2673267326732671,0.052447218368907,101,78,19,4,False,True,55
783,I did not realize your problems stemmed from your head.,1.2673267326732671,0.0560959028681793,101,80,15,6,False,True,55
783,Let’s try to get to the root cause.,1.2672413793103448,0.0479845030904252,116,89,23,4,False,True,35
783,Your identity crisis is understandable. I can’t tell if you are a tree or broccoli.,1.2672413793103448,0.0510133571900296,116,91,19,6,False,True,83
783,You're making progress. I feel confident you'll see real change by fall.,1.2666666666666666,0.0565332202670058,90,70,16,4,False,True,72
783,And your brother E-Coli has not been receptive?,1.2666666666666666,0.0492929247437442,105,80,22,3,True,True,47
783,"Well, what would ""easy being green"" look like to you?",1.2666666666666666,0.0498363334397601,120,94,20,6,True,True,53
783,And why do you feel that cauliflower has taken over?,1.2666666666666666,0.0519290786889498,90,68,20,2,True,True,52
783,"Sorry I can't help you. There is no billable code for ""Clearcut Anxiety Syndrome.""",1.2666666666666666,0.0528780937259731,105,82,18,5,False,False,82
783,"Frankly, your dreams of being eaten alive are driven by a severe, irrational anxiety. I'm prescribing Prozac and a zesty lemon-garlic vinaigrette""",1.2666666666666666,0.0545824420417681,105,83,16,6,False,False,146
783,So you’re feeling raw. Let’s go with that.,1.2666666666666666,0.0565332202670058,90,70,16,4,False,True,42
783,How are you doing with branching out?,1.2666666666666666,0.0473987578596976,105,79,24,2,True,True,37
783,I think you've got a stalker.,1.2666666666666666,0.0542799880584039,90,69,18,3,False,True,29
783,"So even in childhood, you didn't like you?",1.2666666666666666,0.0519290786889498,90,68,20,2,True,True,42
783,Your inability to become pizza crust does not define you.,1.2666666666666666,0.0610223215202742,75,58,14,3,False,True,57
783,You’re not a kid anymore. It’s okay to like yourself.,1.2666666666666666,0.0469419650835052,120,92,24,4,False,True,53
783,Talk about what's it's like being yew,1.2666666666666666,0.0484107850412487,120,93,22,5,False,False,37
783,"So, you're initially firm, but when you get steamed up, you get limp?",1.2666666666666666,0.0528780937259731,105,82,18,5,True,True,69
783,"Not my area, but I can refer you to the top topiarist in town.",1.2666666666666666,0.0610223215202742,75,58,14,3,False,True,62
783,It’s called root cause analysis,1.2666666666666666,0.0492929247437442,105,80,22,3,False,False,31
783,Somebody spotted a worm and sent you here to have your head examined,1.2660550458715596,0.0463448233299462,109,82,25,2,False,False,68
783,"So, you think you're being stalked?",1.2660550458715596,0.0547477485931747,109,87,15,7,True,True,35
783,So tell me of this dream where your DNA is spliced with a frog,1.2660550458715596,0.0531735019602241,109,86,17,6,False,False,62
783,So what is it that has you so steamed up?,1.2660550458715596,0.0515512041120908,109,85,19,5,True,True,41
783,"You can’t go everywhere with Cheese, it’s just not healthy.",1.2659574468085106,0.0505642649522463,94,71,21,2,False,True,59
783,Would you say you are more depressed in the fall?,1.2659574468085106,0.0549026965546439,94,73,17,4,True,True,49
783,It all started with George H. W. Bush.......,1.2659574468085106,0.0527780777365578,94,72,19,3,False,True,44
783,I'm going to go out on a limb here. You have to decide what you want to be ... broccoli or tree?,1.2659574468085106,0.0505642649522463,94,71,21,2,True,True,96
783,Only a chicken would refer to you as his side dish.,1.2659574468085106,0.0569481052220043,94,74,15,5,False,True,51
783,How soon will you be branching out?,1.2659574468085106,0.0482489822768916,94,70,23,1,True,True,35
783,"But your terror when vegans approach is not irrational.""",1.2659574468085106,0.0569481052220043,94,74,15,5,False,False,56
783,I believe your ancestors are a bag of mixed nuts.,1.2659574468085106,0.0549026965546439,94,73,17,4,False,True,49
783,"You know I'm a chef, right?",1.2658227848101269,0.0667044539764516,79,64,9,6,True,True,27
783,"Frankly, you need to put down roots.",1.2658227848101269,0.0616469325323679,79,62,13,4,False,True,36
783,Just imagine life as a cauliflower....,1.2654867256637168,0.0533600748177124,113,90,16,7,False,True,38
783,I think the issue is some early floret anxiety.,1.2654867256637168,0.0453559094283922,113,85,26,2,False,True,47
783,Let’s talk about your relationship with birds.,1.2654867256637168,0.0453559094283922,113,85,26,2,False,True,46
783,Have I not tree-ed you right?,1.2654867256637168,0.0503114495792134,113,88,20,5,True,True,29
783,You seem to feel uprooted.,1.2654867256637168,0.0470657660404204,113,86,24,3,False,True,26
783,Can you recall when you first imagined that everyone hates you?,1.2654867256637168,0.0533600748177124,113,90,16,7,True,True,63
783,Unfortunately Rootlessness isn’t covered by your insurance…however we have a significant deciduous discount,1.2654867256637168,0.0453559094283922,113,85,26,2,False,False,107
783,So you fell in the forest and no one cared.,1.2653061224489797,0.0533951846260542,98,76,18,4,False,True,43
783,"Well, I believe you. Let's explore the sound you made.",1.2653061224489797,0.0533951846260542,98,76,18,4,False,True,54
783,I just feel so raw inside.,1.2653061224489797,0.0533951846260542,98,76,18,4,False,True,26
783,So you say you're confused about whether you're a tree or broccoli.,1.2653061224489797,0.0553302736029312,98,77,16,5,False,True,67
783,Let’s talk about your roots.,1.2653061224489797,0.0492976558246009,98,74,22,2,False,True,28
783,You have to branch out - pack your trunk and leave.,1.2653061224489797,0.0571999354256631,98,78,14,6,False,True,51
783,"You've shared a lot today Jared, thank you for that raw emotion.",1.2653061224489797,0.0513872776621375,98,75,20,3,False,True,64
783,"Branching out may work for you. But whatever you decide to do, I'm rooting for you.",1.2651515151515151,0.0479270115574911,132,104,21,7,False,True,83
783,Trust me.  Changing your name to Rabe will make you bitter.,1.2650602409638554,0.0620075956534202,83,66,12,5,False,True,59
783,"Yes, I did say to stretch before you leaf.",1.2650602409638554,0.0544368150970188,83,63,18,2,False,True,42
783,It's time you branched out.,1.2650602409638554,0.0516672863390043,83,62,20,1,False,True,27
783,"If you're so healthy, why are you calling yourself ""the worst vegetable""?",1.2650602409638554,0.0570721052544705,83,64,16,3,True,True,73
783,"I always thought I had a good head on my shoulders, Doc, but these days, I just don't know...",1.2650602409638554,0.0595909687658097,83,65,14,4,False,True,93
783,So was your mother always deciduous?,1.2650602409638554,0.0595909687658097,83,65,14,4,True,True,36
783,Have you tried hugging yourself?,1.264957264957265,0.0476274136033978,117,90,23,4,True,True,32
783,"I know it's tough for your social life Mr. Broccoli, but the reality is most people will probably always avoid you.",1.264957264957265,0.0476274136033978,117,90,23,4,False,True,115
783,If you're delusional then why is there sap on my couch?,1.2647058823529411,0.0573241244950459,102,82,13,7,True,True,55
783,And steamed here means angry?,1.2647058823529411,0.0500949798489222,102,78,21,3,True,True,29
783,How does it make you feel when children say they hate you?,1.2647058823529411,0.0649766860965886,68,53,12,3,True,True,58
783,"Since Fall is almost here, I’d like a six month retainer.",1.2647058823529411,0.053831042416005,102,80,17,5,False,True,57
783,It's been over 30 years since Bush Sr. brought your career to a halt. You've got to let it go!,1.2647058823529411,0.0500949798489222,102,78,21,3,False,True,94
783,"I'm wondering when you fell in that forest and you were all alone, if you had the feeling that you weren't making a sound.",1.2647058823529411,0.053831042416005,102,80,17,5,False,True,122
783,I feel like everyone’s trying to cut me down,1.2647058823529411,0.0481182911718509,102,77,23,2,False,False,44
783,I sense you're feeling uprooted.,1.2647058823529411,0.0500949798489222,102,78,21,3,False,True,32
783,"So, the annual sap run has left you drained?",1.2647058823529411,0.0519965774530288,102,79,19,4,True,True,44
783,"So, you say you’re feeling stalked?",1.264367816091954,0.0577113403163306,87,68,15,4,True,True,35
783,"Yes, I'm sure hair care products can be a challenge for you.",1.264367816091954,0.0577113403163306,87,68,15,4,False,True,60
783,"Sure, broccoli is good for everyone, but you want to know what's in it for broccoli.",1.264367816091954,0.0553470016780077,87,67,17,3,False,True,84
783,Whoa!Seems to be a deeply rooted problem.,1.264367816091954,0.052877049732218,87,66,19,2,False,True,41
783,"No, no cheese sauce...so many people like you exactly the way you are!",1.264367816091954,0.0553470016780077,87,67,17,3,False,True,70
783,I know I told you to add bulk and fiber but that is ridiculous.,1.2641509433962264,0.0488904505315823,106,81,22,3,False,True,63
783,What is it that has you so steamed this week?,1.2641509433962264,0.0506948781682949,106,82,20,4,True,True,45
783,Stop worrying about what children think of you.,1.2641509433962264,0.0524372500405525,106,83,18,5,False,True,47
783,Looks like you could use a hug.,1.2641509433962264,0.0524372500405525,106,83,18,5,False,True,31
783,Are you looking to explore your roots?,1.2641509433962264,0.0506948781682949,106,82,20,4,True,True,38
783,I think you'll feel better if you start branching out more.,1.2641509433962264,0.0524372500405525,106,83,18,5,False,True,59
783,"Is that two ""cs"" and one 'l?""",1.2641509433962264,0.0488904505315823,106,81,22,3,True,False,29
783,"Don't you think you should branch out a bit, and give the stalking routine a rest?",1.264,0.0497010417233592,125,99,19,7,True,True,82
783,"Yes, prejudice is a terrible thing.",1.2637362637362637,0.0559852693759495,91,71,16,4,False,True,35
783,Stop saying you're a head case. We don't use that term in here.,1.2637362637362637,0.0537601166562852,91,70,18,3,False,True,63
783,"I understand your anger, but I do ask that you not refer to them as 'birches'.",1.2637362637362637,0.0581253011286641,91,72,14,5,False,True,78
783,The important thing is that YOU love your stalk.,1.2637362637362637,0.0537601166562852,91,70,18,3,False,True,48
783,I am going to need you to work on your roots,1.2636363636363637,0.0527433756435252,110,87,17,6,False,False,44
783,Why don’t you share with me the path you took from sapling to full canopy?,1.2636363636363637,0.0494798174156732,110,85,21,4,True,True,74
783,"So, You aren't satisfied with your arborist. 
I think that coif is stunning on you.",1.2636363636363637,0.0477644916239619,110,84,23,3,False,True,83
783,"Well, to tell you the truth, I have been concerned about some clients stalking me ...",1.2636363636363637,0.0527433756435252,110,87,17,6,False,True,85
783,"First, you need to unload your foliage and ease your feelings. Think of the fall season and relax!",1.263157894736842,0.046709173278225,114,87,24,3,False,True,98
783,"If a tree lay on my couch and complained, but I zoned out, did it utter a sound?",1.263157894736842,0.0522945536311624,95,73,19,3,True,True,80
783,"I have to say, that is quite the head of hair!",1.263157894736842,0.0522945536311624,95,73,19,3,False,True,46
783,Why the wooden expression?,1.263157894736842,0.0543937910539062,95,74,17,4,True,True,26
783,I am sure Groot will have tree friends again,1.263157894736842,0.0543937910539062,95,74,17,4,False,False,44
783,Maybe it's time to branch out.,1.263157894736842,0.0501074462904371,95,72,21,2,False,True,30
783,Have you tried letting off some steam?,1.263157894736842,0.046709173278225,114,87,24,3,True,True,38
783,"No, I don’t know why children do not like you.",1.2627118644067796,0.0487835007328129,118,92,21,5,False,True,46
