contest,caption,mean,precision,votes,not_funny,somewhat_funny,funny,has_question_mark,ends_with_punctuation,caption_length
821,I'm just not sure the world is ready for squawkabilly.,1.2685185185185186,0.0536105229977827,108,85,17,6,False,True,54
821,It's your turn to tell Jim that he isn't a hound dog.,1.2682926829268293,0.0462842579920987,123,94,25,4,False,True,53
821,Has he sent his daily tweets to his flock?,1.2682926829268293,0.0462842579920987,123,94,25,4,True,True,42
821,Every Halloween he does this Elvis thing and wins first prize,1.2682926829268293,0.0504189706544428,123,97,19,7,False,False,61
821,Your turn,1.2682926829268293,0.0448213399683047,123,93,27,3,False,False,9
821,It makes sense when you see him playing a guitar.,1.2682926829268293,0.0477023328486559,123,95,23,5,False,True,49
821,That look doesn’t fly with me.,1.268041237113402,0.0558353154957798,97,76,16,5,False,True,30
821,Covering up insecurities IS pretty patriotic in a way.,1.2678571428571428,0.0507063093043919,112,87,20,5,False,True,54
821,Ever since he got that Elvis toupee he has been insufferable.,1.2678571428571428,0.0522685848684257,112,88,18,6,False,True,61
821,Some symbol of America he is!,1.2678571428571428,0.0507063093043919,112,87,20,5,False,True,29
821,Not to mention he’s dating a chick half his age.,1.2678571428571428,0.0522685848684257,112,88,18,6,False,True,48
821,Birds can have a Mid Life Crisis.,1.2677165354330708,0.0480188935257549,127,99,22,6,False,True,33
821,Of course his name is Elvis.  Why am I not surprised?,1.2677165354330708,0.0480188935257549,127,99,22,6,True,True,53
821,At least we convinced him to ditch the Orange one,1.2677165354330708,0.0493031288296257,127,100,20,7,False,False,49
821,I’m sure it’s a comb over,1.267605633802817,0.0434680443292432,142,109,28,5,False,False,25
821,"Well, he's trying to set a new standard for the national symbol",1.2673267326732671,0.0485249534845261,101,76,23,2,False,False,63
821,He’s hoping to attract a cougar.,1.2673267326732671,0.052447218368907,101,78,19,4,False,True,32
821,"Just tell him that you want him, you need him, and you love him.",1.2673267326732671,0.0543022146566419,101,79,17,5,False,True,64
821,He looks like he thinks he is entitled,1.2672413793103448,0.0463959858107764,116,88,25,3,False,False,38
821,Look what landed on his head.,1.2672413793103448,0.0495220917805002,116,90,21,5,False,True,29
821,I tried to tell him it's just what some humans call us.,1.2672413793103448,0.0495220917805002,116,90,21,5,False,True,55
821,So he's just an eagle now?,1.2672413793103448,0.0479845030904252,116,89,23,4,True,True,26
821,Is that a nest on his head,1.2672413793103448,0.0479845030904252,116,89,23,4,False,False,26
821,"I keep trying to tell him it's just a name, but he won't listen.",1.2672413793103448,0.0495220917805002,116,90,21,5,False,True,64
821,He has a million subscribers.,1.2672413793103448,0.0495220917805002,116,90,21,5,False,True,29
821,You should see his orange toupee!,1.267175572519084,0.0482511869105364,131,103,21,7,False,True,33
821,How's that going to look when he gets in the jetstream?,1.267175572519084,0.0482511869105364,131,103,21,7,True,True,55
821,There's something different about Mary.,1.267175572519084,0.04945317836471,131,104,19,8,False,True,39
821,"He expects America will be great again, again.",1.2671232876712328,0.0415694647052617,146,111,31,4,False,True,46
821,Worst comb-over ever.,1.2666666666666666,0.0484107850412487,120,93,22,5,False,True,21
821,"Now, who gets stoned?",1.2666666666666666,0.0519290786889498,90,68,20,2,True,True,21
821,Don’t judge him until you hear ‘Love me tender’,1.2666666666666666,0.0469419650835052,120,92,24,4,False,False,47
821,"He may look like Elvis, but he don't SING like Elvis!",1.2666666666666666,0.0525715909549718,120,96,16,8,False,True,53
821,In homage to Zelenskyy.,1.2666666666666666,0.0498363334397601,120,94,20,6,False,True,23
821,Will this affect our species?,1.2666666666666666,0.0562351594857982,105,84,14,7,True,True,29
821,It’s crazy what going vegan can do to your head.,1.2666666666666666,0.0473987578596976,105,79,24,2,False,True,48
821,And he wonders why he can't get a date.,1.2666666666666666,0.0492929247437442,105,80,22,3,False,True,39
821,He said he identifies as a Hummingbird now,1.266187050359712,0.0485162386873077,139,111,19,9,False,False,42
821,Ever since he got the you know what. He's been you know  what.,1.2661290322580645,0.0473655162322693,124,96,23,5,False,True,62
821,He claims his good looks saved us from extinction.,1.2661290322580645,0.0473655162322693,124,96,23,5,False,True,50
821,Try flying with that thing on.,1.2661290322580645,0.0487300982095344,124,97,21,6,False,True,30
821,The Elvis has landed.,1.2660550458715596,0.0547477485931747,109,87,15,7,False,True,21
821,"We may be birds of a feather,but he likes to stand out.",1.2660550458715596,0.0531735019602241,109,86,17,6,False,True,55
821,He can't wear that and still want to be called the national bird.,1.2660550458715596,0.0498761664535171,109,84,21,4,False,True,65
821,"He may be handsome, but he’s not very good in the nest.",1.2660550458715596,0.0547477485931747,109,87,15,7,False,True,55
821,He must be running for office.,1.2660550458715596,0.0481428843630233,109,83,23,3,False,True,30
821,He tweeted that he's the reincarnation of Elvis.,1.2660550458715596,0.0531735019602241,109,86,17,6,False,True,48
821,Definitely a rug.,1.265625,0.0450344014938955,128,98,26,4,False,True,17
821,That high-pitched squawk will take some getting used to .....,1.265625,0.0463802631943413,128,99,24,5,False,True,61
821,You know Miguel was never comfortable being a bald eagle. From as early as I can remember he flew with a totally different crowd.,1.2654867256637168,0.0533600748177124,113,90,16,7,False,True,129
821,"He says it's his ""thinking-cap"" for telepathically declassifying Top-Secret documents.",1.2654867256637168,0.0518581697677116,113,89,18,6,False,True,86
821,He didn’t like the adjective.,1.2654867256637168,0.048715645801597,113,87,22,4,False,True,29
821,Clearly he's not from our branch of the family.,1.2654867256637168,0.048715645801597,113,87,22,4,False,True,47
821,He’s lookin’ fly… hah,1.2653061224489797,0.0571999354256631,98,78,14,6,False,False,21
821,Her therapist thought it might assist with her transitioning,1.2651515151515151,0.0502823953172454,132,106,17,9,False,False,60
821,"Through fans like him, the spirit of Elvis will never die.",1.2651515151515151,0.0502823953172454,132,106,17,9,False,True,58
821,And he’s started shaking his tail feather every time he screeches…,1.2651515151515151,0.0467047964970189,132,103,23,6,False,False,66
821,I cant stand it - he thinks it makes him look more patriotic.,1.2651515151515151,0.0467047964970189,132,103,23,6,False,True,61
821,I don't think I want to be the national bird anymore.,1.264957264957265,0.0506270180753774,117,92,19,6,False,True,53
821,"So far as I'm concerned, the hair-piece eagle is not as rare as it ought to be.",1.264957264957265,0.0520620512036582,117,93,17,7,False,True,79
821,Got tired of being confused with a Bald Eagle!,1.2647058823529411,0.0556050194529111,102,81,15,6,False,True,46
821,Elvis has flown out of the building.,1.2647058823529411,0.0480958716195692,136,108,20,8,False,True,36
821,Winters at Graceland.,1.2647058823529411,0.053831042416005,102,80,17,5,False,True,21
821,"If you think that's weird, you should see him wearing blue suede shoes.",1.2647058823529411,0.0500949798489222,102,78,21,3,False,True,71
821,Not only that...he just picked up a guitar,1.2644628099173554,0.0480595862954819,121,94,22,5,False,False,42
821,"I wonder with all the money spent on the hair, he still has enough to pay the lawyers?",1.2644628099173554,0.0521818644299793,121,97,16,8,True,True,86
821,"Before Elvis, he always wore a crew cut",1.2644628099173554,0.0508449203810645,121,96,18,7,False,False,39
821,"Do you want to tell him, or should I?",1.2644628099173554,0.0494718594933001,121,95,20,6,True,True,37
821,He claims it’s a hit with all the chicks.,1.2644628099173554,0.0480595862954819,121,94,22,5,False,True,41
821,Once the poor guy started growing hair he lost all his confidence.,1.2641509433962264,0.0506948781682949,106,82,20,4,False,True,66
821,I told you not to complement his singing,1.2641509433962264,0.0488904505315823,106,81,22,3,False,False,40
821,He thinks it will help him meet chicks.,1.2641509433962264,0.0506948781682949,106,82,20,4,False,True,39
821,I think he's having a flydentity crisis.,1.2641509433962264,0.0541235596679725,106,84,16,6,False,True,40
821,"He refers to himself as the ""Millennial Falcon.""",1.264,0.0470332757976527,125,97,23,5,False,False,48
821,"It’s all quite sordid, you know. His wife left him for a Golden Eagle",1.264,0.0470332757976527,125,97,23,5,False,False,69
821,Do I call him Wig Eagle now?,1.264,0.0509826029783848,125,100,17,8,True,True,28
821,"I’ve always said, just go gracefully.",1.264,0.0456409550096571,125,96,25,4,False,True,37
821,Is he compensating for something or does he have a date?,1.2638888888888888,0.0451472931629876,144,113,24,7,True,True,56
821,He says pompadour is the new bald,1.2637362637362637,0.0581253011286641,91,72,14,5,False,False,33
821,It won't catch on at the Treasury.,1.2637362637362637,0.0537601166562852,91,70,18,3,False,True,34
821,She’s not like other girls,1.2636363636363637,0.0494798174156732,110,85,21,4,False,False,26
821,I heard he headed the Graceland migration,1.2636363636363637,0.0527433756435252,110,87,17,6,False,False,41
821,He said he's hoping it helps with his Canadian citizenship.,1.2635658914728682,0.047361819418023,129,101,22,6,False,True,59
821,"Big deal. Apparently, I can talk!",1.2635658914728682,0.0486237181794355,129,102,20,7,False,True,33
821,"Yeah, the Rogaine worked great, but then he had to push it with Giuliani hair dye.",1.2635658914728682,0.0460653655969174,129,100,24,5,False,True,82
821,It's his mother's.,1.2635658914728682,0.0498536859279324,129,103,18,8,False,True,18
821,"Well, let's put it this way...I don't think they'll be changing our image on the dollar anytime soon.",1.2635658914728682,0.0486237181794355,129,102,20,7,False,True,101
821,He’s running for President.,1.263157894736842,0.0638631766660837,95,79,7,9,False,True,27
821,"If you want to get on his good side,just mention how presidential you think he looks.",1.263157894736842,0.0501074462904371,95,72,21,2,False,True,85
821,You’ve got to admit it makes him look years younger.,1.263157894736842,0.0438710397603508,133,102,27,4,False,True,52
821,So when are you getting yours?,1.263157894736842,0.0501074462904371,95,72,21,2,True,True,30
821,Yup retired!  No more flying.  He’s driving a red Corvette!,1.263157894736842,0.0463951555958137,133,104,23,6,False,True,59
821,He says his name is Elvis.,1.263157894736842,0.046709173278225,114,87,24,3,False,True,26
821,"'The Presley's tried to adopt him.""",1.263157894736842,0.0438710397603508,133,102,27,4,False,False,35
821,He bitterly resented being described as a bald eagle.,1.2627118644067796,0.0516677757121088,118,94,17,7,False,True,53
821,"The Republicans wanted to use him in their ads, but Trump did not like the bald look?",1.2627118644067796,0.0457176206780266,118,90,25,3,True,True,85
821,"Uh, yea.  You can find anything on Amazon…",1.2627118644067796,0.0502463381291868,118,93,19,6,False,False,42
821,He never could deal with being bald.,1.2627118644067796,0.0487835007328129,118,92,21,5,False,True,36
821,Johnny thinks he's some kind of hawkahawka burning dove.,1.2627118644067796,0.0487835007328129,118,92,21,5,False,True,56
821,Someone needs to tell him that we’re not literally bald.,1.2626262626262623,0.0529209836100786,99,77,18,4,False,True,56
821,He says it's natural.  He doesn't use hair coloring.  At least it's not orange.,1.2622950819672132,0.0491125396521135,122,96,20,6,False,True,79
821,It's not Rogaine. Guess again.,1.2622950819672132,0.0447838426268754,122,93,26,3,False,True,30
821,"He claims his great-grandfather knew the Birdman of Alcatraz.""",1.2621359223300972,0.0515533783403437,103,80,19,4,False,False,62
821,"Oh yeah, that'll really fool the chicks!",1.2621359223300972,0.0515533783403437,103,80,19,4,False,True,40
821,Well he ain’t ever caught a rabbit and he ain’t no friebd of mine,1.2621359223300972,0.0551224603632833,103,82,15,6,False,False,65
821,The eagle has landed... a new job at Rogaine.,1.2621359223300972,0.0515533783403437,103,80,19,4,False,True,45
821,He identifies as a Senator.,1.2621359223300972,0.0533677639348154,103,81,17,5,False,True,27
821,That’s my cousin Vinny. He’s dating a young chick.,1.2621359223300972,0.0568229975063029,103,83,13,7,False,True,50
821,Do you think we should tell him?!,1.2620689655172417,0.0448717730941221,145,114,24,7,True,True,33
821,Quick! Get him a mirror!,1.261904761904762,0.0480457076404931,126,99,21,6,False,True,24
821,He says he got it at Liberace's estate sale.,1.261904761904762,0.0453257296544411,126,97,25,4,False,True,44
821,He snatched it right off Trump's head.,1.261904761904762,0.0564768028960631,84,65,16,3,False,True,38
821,Don’t tell him Elvis is dead.,1.261744966442953,0.0440511274304561,149,117,25,7,False,True,29
821,I heard a thousand baby crows died to make it.,1.2615384615384615,0.0444322109059675,130,100,26,4,False,True,46
821,He hates being a bald eagle,1.2615384615384615,0.0482908181658063,130,103,20,7,False,False,27
821,He used to have a comb over,1.2612612612612613,0.0538626148600275,111,89,15,7,False,False,27
821,He did it on a dare when we were migrating through Graceland.,1.2612612612612613,0.0473917780248747,111,85,23,3,False,True,61
821,He recently got a hair transplant!,1.2612612612612613,0.0490895181088505,111,86,21,4,False,True,34
821,Why? Why won't you let an Elvis impersonator marry us?,1.2612612612612613,0.0538626148600275,111,89,15,7,True,True,54
821,"Not only is that a wig, he also had a beak job!",1.2612612612612613,0.0473917780248747,111,85,23,3,False,True,47
821,Seriously I think he uses conditioner.,1.2612612612612613,0.0523199877270579,111,88,17,6,False,True,38
821,Locks are his love language.”,1.2612612612612613,0.0473917780248747,111,85,23,3,False,False,29
821,He was Guliani;s bord.,1.2611940298507462,0.0472912365756323,134,106,21,7,False,True,22
821,His wig is a bald faced lie.,1.2611940298507462,0.0435866780673898,134,103,27,4,False,True,28
821,He heard that guy from the U.S. Mint was in town.,1.2611940298507462,0.044855538739205,134,104,25,5,False,True,49
821,"I mean, around these parts, he kind of is the king.",1.2608695652173914,0.0479749434374281,115,89,22,4,False,True,51
821,I don't know...I kinda like it.,1.2608695652173914,0.0495393833138963,115,90,20,5,False,True,31
821,We call him the Ego Eagle,1.2608695652173914,0.0463577382594072,115,88,24,3,False,False,25
821,What’s a “hound dog?”,1.2608695652173914,0.0463457263853149,138,109,22,7,True,False,21
821,"American toupee, my rear tail feathers, we both know it's made in China.",1.2608695652173914,0.0495393833138963,115,90,20,5,False,True,72
821,"He says in a former life he was Elvis. Which is kind of sad, cause all he can do now is screech.",1.2608695652173914,0.0539612490868336,115,93,14,8,False,True,96
821,Really? Make Eagles Great Again?,1.2608695652173914,0.055447545442538,92,72,16,4,True,True,32
821,What the flock?,1.2608695652173914,0.0495393833138963,115,90,20,5,True,True,15
821,I'm waiting for an updraft,1.2608695652173914,0.0596004478345679,92,74,12,6,False,False,26
821,I heard he just bought a Porsche,1.2608695652173914,0.0495393833138963,115,90,20,5,False,False,32
821,Nothing attracts me like a great head of nesting material .,1.2605042016806722,0.0484221702998622,119,93,21,5,False,True,59
821,Seriously?  His biggest concern is going bald?,1.2605042016806722,0.0484221702998622,119,93,21,5,True,True,46
821,HairClub for Birds of Prey.,1.2605042016806722,0.0484221702998622,119,93,21,5,False,True,27
821,well... look who just got back from Graceland,1.2605042016806722,0.0484221702998622,119,93,21,5,False,False,45
821,I think becoming a national symbol has gone to his head.,1.2604166666666667,0.0596862992056426,96,78,11,7,False,True,56
821,You can always tell the vain ones in the group.,1.2604166666666667,0.0496584643821707,96,73,21,2,False,True,47
821,Are you gonna tell him he looks like a cockatiel?,1.2604166666666667,0.0538939660446639,96,75,17,4,True,True,49
821,I told you we shouldn’t have named him Elvis.,1.2601626016260163,0.0444694138896517,123,94,26,3,False,True,45
821,Another one lost to Hair Club for Eagles.,1.2601626016260163,0.047371814556113,123,96,22,5,False,True,41
821,I dunno. It could be the Liberace. Could be the Marv Albert.,1.2601626016260163,0.0501063754125996,123,98,18,7,False,True,60
821,He also bought a Ferrari and started dating an eagle that could be his daughter.,1.26,0.0543464382782842,100,79,16,5,False,True,80
821,"If we knock off his wig, humans legally can't pick it up.",1.2598425196850394,0.0490028024078126,127,101,19,7,False,True,57
821,Baldy eagle no more.,1.2598425196850394,0.0450146810825144,127,98,25,4,False,True,20
821,"Vanity of vanities, all is vanity, and there is nothing new under the rug.",1.2596153846153846,0.0473242046023177,104,79,23,2,False,True,74
821,"Since his baby left him, he's found a new branch to dwell.",1.2596153846153846,0.0546480222037949,104,83,15,6,False,True,58
821,It all started when he ate a peanut butter and banana sandwich.,1.2596153846153846,0.0546480222037949,104,83,15,6,False,True,63
821,No wonder Mom left!!!,1.2596153846153846,0.0511174464934844,104,81,19,4,False,True,21
821,His Mother Was a Hairyer’s Hawk.,1.2595419847328244,0.0479623387430503,131,104,20,7,False,True,32
821,I think I heard his mother say she wanted him to be some kind of a Cardinal,1.2595419847328244,0.0479623387430503,131,104,20,7,False,False,75
821,He's had this Liberace thing going on for a while now.,1.2595419847328244,0.0441369063416797,131,101,26,4,False,True,54
821,"""He does Elvis videos for Tik Tok.",1.2592592592592593,0.0481041948646985,108,83,22,3,False,True,34
821,He’s always been an Elvis fan.,1.2592592592592593,0.046979481028384,135,107,21,7,False,True,30
821,He was hired to do a Trump campaign video. They said baldness projects weakness.,1.2592592592592593,0.0515766817140973,108,85,18,5,False,True,80
821,I'm not sure what he is anymore.,1.2592592592592593,0.0515766817140973,108,85,18,5,False,True,32
821,"Donald believes it makes him more virile, more attractive, more intelligent.   He’s always had an unusual relationship with reality.",1.2592592592592593,0.0548296874849175,108,87,14,7,False,True,132
821,"He needs it on his chest, not his head.",1.2589928057553956,0.0437265861459816,139,108,26,5,False,True,39
821,"If he gets the gig, they’re going to have change all the flagpoles.",1.2589928057553956,0.0449029926679421,139,109,24,6,False,True,67
821,He's practicing his Elvis crone.,1.2589285714285714,0.0487051376163351,112,87,21,4,False,True,32
821,Most of us get over it…,1.2589285714285714,0.0503295697488197,112,88,19,5,False,False,23
821,He flew in from Vegas last night.,1.2589285714285714,0.0503295697488197,112,88,19,5,False,True,33
821,Some people just can't accept that they're bald.,1.2586206896551724,0.0476127080021102,116,90,22,4,False,True,48
821,It's a Magabird.  You can tell by their distinctive toupees.,1.2586206896551724,0.0549235391312369,116,95,12,9,False,True,60
821,"' I heard he has candelabra in his nest.""",1.2586206896551724,0.0506637941557551,116,92,18,6,False,False,41
821,"He can wear all the wigs he wants to, nobody's going to stop calling him bald.",1.2586206896551724,0.0476127080021102,116,90,22,4,False,True,78
821,Don't say anything. He thinks he looks ten years younger.,1.2586206896551724,0.0460113564874255,116,89,24,3,False,True,57
821,"He’s not just an eagle, he’s also a customer.",1.2586206896551724,0.0521224047386341,116,93,16,7,False,True,45
821,He just turned fifty.,1.2586206896551724,0.0476127080021102,116,90,22,4,False,True,21
821,What other hairbrained ideas do you think he’ll come up with?,1.2584269662921348,0.0565615221999478,89,70,15,4,True,True,61
821,I guess Elvis has left the building.,1.2583333333333333,0.0495014830625995,120,95,19,6,False,True,36
821,"Well, I think he looks quite rugged.",1.2583333333333333,0.0450580598580313,120,92,25,3,False,True,36
821,I liked him better when he was bald.,1.2583333333333333,0.0465863153788631,120,93,23,4,False,True,36
821,He shows up at all the karaoke nests around here.,1.2583333333333333,0.04347611684317,120,91,27,2,False,True,49
821,"Yeah, it looks stupid, but he won the Elvis contest in Vegas.",1.2580645161290325,0.0497449141454479,124,99,18,7,False,True,61
821,"""They told him it's a more humane tracking method than banding.""",1.2580645161290325,0.048408946898032,124,98,20,6,False,False,64
821,Don't you think it's a little too obvious?,1.2580645161290325,0.048408946898032,124,98,20,6,True,True,42
821,"Elvis look alike, my tail feathers",1.2580645161290325,0.0470350485937347,124,97,22,5,False,False,34
821,"Well at least it isn't orange, like the other guy's""",1.2578125,0.0473797869493744,128,101,21,6,False,False,52
821,You should see him shake his tail feather.,1.2577319587628866,0.0553773964587055,97,77,15,5,False,True,42
821,He's been listening to the vulture's music.,1.2577319587628866,0.0534029906114091,97,76,17,4,False,True,43
821,"He's a rock star, Sweety.  You'd look ridiculous",1.2577319587628866,0.0513527289824001,97,75,19,3,False,False,48
821,"It's so off brand you might think irony, but I don't think that's what he's going for.",1.2577319587628866,0.0572837906466311,97,78,13,6,False,True,86
821,He's a real chick magnet.,1.2577319587628866,0.0553773964587055,97,77,15,5,False,True,25
821,I say carpet diem!,1.2575757575757576,0.047638195332599,132,105,20,7,False,True,18
821,He's at the age that he needs to do a feather comb over.,1.2574257425742574,0.0574257425742574,101,82,12,7,False,True,56
821,He’s going through a mid-flight crisis.,1.2574257425742574,0.055674914532711,101,81,14,6,False,True,39
821,He’s asked that we call him Bold Eagle.,1.2574257425742574,0.0538672099355859,101,80,16,5,False,True,39
821,"He's not only the owner, he's also a client.",1.2574257425742574,0.0538672099355859,101,80,16,5,False,True,44
821,He’ll never pull off a full Elvis with that beak of his.,1.2571428571428571,0.0524641364136346,105,83,17,5,False,True,56
821,"He said ""No I'm not. I *was* bald.",1.2571428571428571,0.0541815078488837,105,84,15,6,False,True,34
821,For his 30th reunion he got Botox.,1.2569444444444444,0.0437936459808965,144,113,25,6,False,True,34
821,Let’s use his hair for our nest.,1.256880733944954,0.0440161635216801,109,82,26,1,False,True,32
821,"Are you going to tell him he looks like Wayne Newton, or am I?",1.256880733944954,0.0494682387708498,109,85,20,4,True,True,62
821,He has delusions of Elvis,1.256880733944954,0.0511566350769606,109,86,18,5,False,False,25
821,Are you sure we're related?,1.256880733944954,0.0459055259906124,109,83,24,2,True,True,27
821,"You don't need an Eagle eye, to spot that thing on his head.",1.2566371681415929,0.0514928239049716,113,90,17,6,False,True,60
821,He's wearing a slug.,1.2566371681415929,0.0514928239049716,113,90,17,6,False,True,20
821,"Trump is bald, you know.",1.2566371681415929,0.0499347884827136,113,89,19,5,False,True,24
821,"And for some reason, he wants us to call him ""Liberace.""",1.2566371681415929,0.0483265484792601,113,88,21,4,False,False,56
821,With a wig like that he’s gonna have hell toupee.,1.2566371681415929,0.0449377309410271,113,86,25,2,False,True,49
821,I say he's wearing a rug.,1.2566371681415929,0.0499347884827136,113,89,19,5,False,True,25
821,Same feathers but we won’t flock together,1.2566371681415929,0.0483265484792601,113,88,21,4,False,False,41
821,It's between a comb over and a come over,1.2566371681415929,0.0466629132719252,113,87,23,3,False,False,40
821,Just listen to him.  It's obvious he's not the real Elvis.,1.2564102564102564,0.0487900253273966,117,92,20,5,False,True,58
821,"He said he loves being an Eagle, but he hates being bald.",1.2564102564102564,0.0472557335687456,117,91,22,4,False,True,57
821,He just flew in; says he's looking for his own sanctuary.,1.2564102564102564,0.0487900253273966,117,92,20,5,False,True,57
821,I didn't vote for him then and I'm not voting for him now.,1.2564102564102564,0.0472557335687456,117,91,22,4,False,True,58
821,He’s dating a hot chick,1.2564102564102564,0.0425332982695548,156,123,26,7,False,False,23
821,He thinks he'll get more chicks this way.,1.256198347107438,0.0462490050817486,121,94,23,4,False,True,41
821,He said he's just quietly quitting.,1.256198347107438,0.0491370793262636,121,96,19,6,False,True,35
821,"He took the ""bald"" part really personally",1.256198347107438,0.0447351028189235,121,93,25,3,False,False,41
821,He looks like an ass with that rug in his head. Not an Eagle.,1.256,0.0453004308175768,125,97,24,4,False,True,61
821,The First Amendment has clearly gone to his head.,1.256,0.0480644728295972,125,99,20,6,False,True,49
821,Should we tell him it's a Trump comb-over?,1.255813953488372,0.0483234792239987,129,103,19,7,True,True,42
821,He hasn't taken that wig off ever since he got back from seeing Elvis.,1.255813953488372,0.0470535292332518,129,102,21,6,False,True,70
821,Don't fall for it.  It's fake!,1.255813953488372,0.060063911495953,86,69,12,5,False,True,30
821,But you don't notice when I do my talons.,1.255813953488372,0.0444048032456961,129,100,25,4,False,True,41
821,French eagles prefer a toupee,1.255639097744361,0.0496675382763771,133,108,16,9,False,False,29
821,He thought he would pick up more chicks if he wasn’t bald.,1.2554744525547443,0.0427545506032209,137,106,27,4,False,True,58
821,"Not gonna help him get the worm, Norman.",1.25531914893617,0.0544016982757331,94,74,16,4,False,True,40
