contest,caption,mean,precision,votes,not_funny,somewhat_funny,funny,has_question_mark,ends_with_punctuation,caption_length
771,You’re the first metallophobic I’ve dated since Black Sabbath broke up.,1.169811320754717,0.0586238473980282,53,45,7,1,False,True,71.0
771,Why don't you just tell them it rolled under the couch?,1.169811320754717,0.0586238473980282,53,45,7,1,True,True,55.0
771,You outsourced finding the remote?,1.169811320754717,0.0520678987362905,53,44,9,0,True,True,34.0
771,They’re looking for the good in our relationship…,1.169811320754717,0.0586238473980282,53,45,7,1,False,False,49.0
771,Are you sure this is the silent party you saw on face book?,1.169811320754717,0.0586238473980282,53,45,7,1,True,True,59.0
771,I swear the gold earrings your mother gave to me were fake,1.169811320754717,0.0645170123973668,53,46,5,2,False,False,58.0
771,"Babe, your earring back is here somewhere",1.169811320754717,0.0586238473980282,53,45,7,1,False,False,41.0
771,Ideas are funny. Are you sure you had it when you woke up this morning?,1.1694915254237288,0.0548764212474833,59,50,8,1,True,True,71.0
771,"So that's what ""heavy metal party""  really meant.",1.1694915254237288,0.0599656163553342,59,51,6,2,False,True,49.0
771,I am beginning to think this is a trust issue with you,1.1694915254237288,0.0599656163553342,59,51,6,2,False,False,54.0
771,I hired them to find my missing Scrabble Tile. It's the Z.,1.1694915254237288,0.0548764212474833,59,50,8,1,False,True,58.0
771,I don't have the heart to tell them that I use Venmo.,1.1694915254237288,0.0492642677098457,59,49,10,0,False,True,53.0
771,You asked me to marry you...so where's the ring?,1.1694915254237288,0.0492642677098457,59,49,10,0,True,True,48.0
771,"Bro, when you said you were getting into metal, this isn’t what I had in mind.",1.1694915254237288,0.0548764212474833,59,50,8,1,False,True,78.0
771,"Honey, where’d I put my keys?",1.1694915254237288,0.0492642677098457,59,49,10,0,True,True,29.0
771,Just visually trying out hobbies.,1.1694915254237288,0.0548764212474833,59,50,8,1,False,True,33.0
771,They’re checking to see if the vaccine sheds.,1.1694915254237288,0.0599656163553342,59,51,6,2,False,True,45.0
771,"Heavy Metal Convention, my ass!",1.1694915254237288,0.0646554613379181,59,52,4,3,False,True,31.0
771,Little do they know there’s only fluff down there,1.1694915254237288,0.0548764212474833,59,50,8,1,False,False,49.0
771,There’s gold in them there carpets,1.1692307692307693,0.0517447078733604,65,55,9,1,False,False,34.0
771,"It’s been a tough year, so I tried to embrace a hobby where I could really find myself; you know?",1.1692307692307693,0.0561986122930863,65,56,7,2,True,True,97.0
771,You got a hole in your pocket?,1.1690140845070425,0.0490797220026175,71,60,10,1,True,True,30.0
771,"So far they've only found Jazz, Hip Hop and Reggae.",1.1690140845070425,0.0447929081990965,71,59,12,0,False,True,51.0
771,I posted on TikTok that I found a a 1905 Indian head penny. They pay $5 an hour. I plant a new one each day - they cost three bucks.,1.1688311688311688,0.0502984850156807,77,66,9,2,False,True,132.0
771,My attitude is so metal.,1.1666666666666667,0.0543606727544534,48,40,8,0,False,True,24.0
771,I think these guys that their job to seriously!,1.1666666666666667,0.0619807031664841,48,41,6,1,False,True,47.0
771,Have you tried a Find Me app?,1.1666666666666667,0.0633890299066702,54,47,5,2,True,True,29.0
771,"See, this is why I don't use bitcoin.",1.1666666666666667,0.0633890299066702,54,47,5,2,False,True,37.0
771,Didn't you see the dentist last week?,1.1666666666666667,0.0619807031664841,48,41,6,1,True,True,37.0
771,So that nose ring had sentimental value. Boo hoo. Just buy a new one.,1.1666666666666667,0.0633890299066702,54,47,5,2,False,True,69.0
771,"It would be much easier if you put your spare change in a jar.""",1.1666666666666667,0.0633890299066702,54,47,5,2,False,False,63.0
771,You need to fix that hole in your pocket.,1.1666666666666667,0.0511912597361625,54,45,9,0,False,True,41.0
771,I guess I’m sitting next to the mother lode.,1.1666666666666667,0.0543606727544534,48,40,8,0,False,True,44.0
771,I don't think this is where you lost your motivation,1.1666666666666667,0.0619807031664841,48,41,6,1,False,False,52.0
771,"It was my great, great,great grandmother's engagement ring.",1.1666666666666667,0.0540279623494249,60,51,8,1,False,True,59.0
771,I call it 'Scroungecoin'.,1.1666666666666667,0.0619807031664841,48,41,6,1,False,True,25.0
771,I told you not to take your phone apart. We've never gonna find that screw.,1.1666666666666667,0.0633890299066702,54,47,5,2,False,True,75.0
771,"If you got one there'd be a half dozen guys looking for that penny I dropped. Or, why aren't you helping them look for the engagement ring you gave me?",1.1666666666666667,0.0511912597361625,54,45,9,0,True,True,151.0
771,Before long they'll find out all the money is under the cushions.,1.1666666666666667,0.0619807031664841,48,41,6,1,False,True,65.0
771,lost your car keys again?,1.1666666666666667,0.0619807031664841,48,41,6,1,True,True,25.0
771,It's just one BB.  Let the vacuum get it.,1.1666666666666667,0.0633890299066702,54,47,5,2,False,True,41.0
771,Should we tell them the loose coins are most likely in the couch?,1.1666666666666667,0.0582025246474648,42,35,7,0,True,True,65.0
771,I think I lost my will to live somewhere around here!,1.1666666666666667,0.0576138619860012,54,46,7,1,False,True,53.0
771,Dude. You know they’re going to come for your fillings.,1.1666666666666667,0.0582025246474648,42,35,7,0,False,True,55.0
771,Is this what you meant when you said you play a lot of Minesweeper?,1.1666666666666667,0.0510191395747968,66,56,9,1,True,True,67.0
771,I sure hope they don't detect the metal plate in my head.,1.1666666666666667,0.0674460826228564,42,36,5,1,False,True,57.0
771,I told you being a couch potato would pay off.,1.1666666666666667,0.0576138619860012,54,46,7,1,False,True,46.0
771,"Sure you lost some change out of your pocket, but this is ridiculous!",1.1666666666666667,0.0755672829139675,42,37,3,2,False,True,69.0
771,"Dear, is this your idea of a live band?",1.1666666666666667,0.0576138619860012,54,46,7,1,True,True,39.0
771,I still prefer the real world beach,1.1666666666666667,0.0576138619860012,54,46,7,1,False,False,35.0
771,Shoot me if I ever do that.,1.1666666666666667,0.0674460826228564,42,36,5,1,False,True,27.0
771,"Jeez, how far would you go just to find your keys?",1.1666666666666667,0.0619807031664841,48,41,6,1,True,True,50.0
771,There’s got to be an easier way to find your lost earring!,1.1666666666666667,0.0755672829139675,42,37,3,2,False,True,58.0
771,I know you said your blogs are golden but this is getting out of hand.,1.1666666666666667,0.0687614164172528,48,42,4,2,False,True,70.0
771,So the Taliban really is asking for help to find the mines they buried.,1.1666666666666667,0.0540279623494249,60,51,8,1,False,True,71.0
771,"I know that ring was expensive, but this search seems excessive to me.",1.1666666666666667,0.0543606727544534,48,40,8,0,False,True,70.0
771,The digging part only happens if we find gold,1.1666666666666667,0.0543606727544534,48,40,8,0,False,False,45.0
771,"So maybe it’s time we talk about your ex.


Jonathan Broder, Philadelphia

Broderj58@gmail.com",1.1666666666666667,0.0687614164172528,48,42,4,2,False,False,94.0
771,I have some minor things I would like to talk to you about.,1.1666666666666667,0.0543606727544534,48,40,8,0,False,True,59.0
771,So...why in the name of God did your cardiologist used this absurd transparent pacemaker..,1.1666666666666667,0.0590253544423353,60,52,6,2,False,True,90.0
771,"Yeah,  this is the special covid  carpet  disinfectant squad.  We  forgot to put a mask on it.",1.1666666666666667,0.0576138619860012,54,46,7,1,False,True,94.0
771,Sorry—I found out too late…house is built on sandy landfill.,1.1666666666666667,0.0511912597361625,54,45,9,0,False,True,60.0
771,Do you think the heavy metals might be in our vaccines ?!,1.1666666666666667,0.0510191395747968,66,56,9,1,True,True,57.0
771,Friends of yours?,1.1666666666666667,0.0511912597361625,54,45,9,0,True,True,17.0
771,OVERREACTING? I don't think so! Your mother will go bonkers if we don't find the earrings she loaned to me.,1.1666666666666667,0.0576138619860012,54,46,7,1,True,True,107.0
771,Well? It was a pretty big diamond earring.,1.1666666666666667,0.0576138619860012,54,46,7,1,True,True,42.0
771,"It’s the latest thing in virtual reality, and the bonus is it finds lost coins.",1.1666666666666667,0.0576138619860012,54,46,7,1,False,True,79.0
771,"I think you have enough white friends now, don't you?",1.1666666666666667,0.0674460826228564,42,36,5,1,True,True,53.0
771,We're going to have to move in a minute so they can check for coins under the cushions.,1.1666666666666667,0.0540279623494249,60,51,8,1,False,True,87.0
771,are you sure your friends are blind?,1.1666666666666667,0.0619807031664841,48,41,6,1,True,True,36.0
771,"I remember when they took away your video games, your parents told you ""knowledge was a treasure.""  But I'm not sure this is going to help.",1.1666666666666667,0.0511912597361625,54,45,9,0,False,True,139.0
771,Yua really are rich,1.1666666666666667,0.0543606727544534,48,40,8,0,False,False,19.0
771,You said you wanted to listen to Heavy Metal,1.1666666666666667,0.0485185424782984,60,50,10,0,False,False,44.0
771,"I got the coins in the cushions,before they came.",1.1666666666666667,0.0749310163443809,48,43,2,3,False,True,49.0
771,Not sure this is the best way to find the key to my heart.,1.1666666666666667,0.0619807031664841,48,41,6,1,False,True,58.0
771,"How many times do you have to be told, keep your ring on your finger.",1.1666666666666667,0.0576138619860012,54,46,7,1,False,True,69.0
771,I'm getting the vibe you're a Heavy Metal fan.,1.1666666666666667,0.0510191395747968,66,56,9,1,False,True,46.0
771,I've been meaning to tell you I need some change too.,1.1666666666666667,0.0636314719180355,60,53,4,3,False,True,53.0
771,"When you said 'watch my boys metal-detect and chill,' you really meant it, huh?",1.1666666666666667,0.0576138619860012,54,46,7,1,True,True,79.0
771,We have all of our remotes.,1.1666666666666667,0.0619807031664841,48,41,6,1,False,True,27.0
771,I’m detecting a little apprehension with you over this baby thing”,1.1666666666666667,0.0496966042074553,78,67,9,2,False,False,66.0
771,"Where some of the big firms mine for data, we’re really more metal detecting.",1.1666666666666667,0.0543606727544534,48,40,8,0,False,True,77.0
771,"Just because i’m a gold digger, doesn’t mean that i’m sitting on a gold mine",1.1666666666666667,0.0582025246474648,42,35,7,0,False,False,76.0
771,Silent discos aren’t as fun as I thought they would be…,1.1666666666666667,0.0590253544423353,60,52,6,2,False,False,55.0
771,Landlord knows we can’t afford an increase…,1.1666666666666667,0.0576138619860012,54,46,7,1,False,False,43.0
771,"I invited them, apparently you need  some help finding my engagement ring!",1.1666666666666667,0.0749310163443809,48,43,2,3,False,True,74.0
771,They must be looking for M-E-T-T-L-E. Nothing's going beep near you.,1.1666666666666667,0.0540279623494249,60,51,8,1,False,True,68.0
771,All I said was I thought I'd dropped some bitcoins down the back of the couch,1.1666666666666667,0.0543606727544534,48,40,8,0,False,False,77.0
771,Your fantasy league draft nights get weirder every year.,1.1666666666666667,0.0687614164172528,48,42,4,2,False,True,56.0
771,Social distancing device for our neck down generation novice!,1.1666666666666667,0.0576138619860012,54,46,7,1,False,True,61.0
771,‘when are we going to tell them that you already found it in the cushions?’,1.1666666666666667,0.0576138619860012,54,46,7,1,True,False,75.0
771,Wouldn't it be cheaper to just tell her you lost your ring again?,1.1666666666666667,0.0687614164172528,48,42,4,2,True,True,65.0
771,I thought we were going to listen to heavy metal music,1.1666666666666667,0.0674460826228564,42,36,5,1,False,False,54.0
771,So this beachfront views,1.1666666666666667,0.0619807031664841,48,41,6,1,False,False,24.0
771,I think they've got Bitcoin mining all wrong,1.1666666666666667,0.0511912597361625,54,45,9,0,False,False,44.0
771,This is not what I intended when I said I wanted to get a beach house,1.1666666666666667,0.0755672829139675,42,37,3,2,False,False,69.0
771,At least now no one can complain that millennials are on their phones too much,1.1666666666666667,0.0576138619860012,54,46,7,1,False,False,78.0
771,"Can we get some space, to clean",1.1666666666666667,0.0619807031664841,48,41,6,1,False,False,31.0
771,"That’s why I asked if you had a working remote, not if you were working remote.",1.1666666666666667,0.0511912597361625,54,45,9,0,False,True,79.0
771,"I am sure, you didn't check deeply in my purse for the keys.",1.1666666666666667,0.0510191395747968,66,56,9,1,False,True,60.0
771,I guess they heard we were watching “The Sound of Metal” tonight!,1.1666666666666667,0.0511912597361625,54,45,9,0,False,True,65.0
771,Global Cleaning,1.1643835616438356,0.0516607694017568,73,63,8,2,False,False,15.0
771,I don't think they'll be able to find your conscience,1.164179104477612,0.0503134225718837,67,57,9,1,False,False,53.0
771,"Dude,  so what if they find anything!",1.164179104477612,0.0503134225718837,67,57,9,1,False,True,37.0
771,Still looking for the jar of coins you hid under the house?,1.1639344262295082,0.0532050773536091,61,52,8,1,True,True,59.0
771,I hope the body you buried around here did not contain any metal with it?,1.1639344262295082,0.0626392563099764,61,54,4,3,True,True,73.0
771,They keep 50% of what they find.,1.1639344262295082,0.0532050773536091,61,52,8,1,False,True,32.0
771,Don’t drop your phone this time,1.1639344262295082,0.0532050773536091,61,52,8,1,False,False,31.0
771,They're helping me look for the remote batteries.,1.1639344262295082,0.0581139255569198,61,53,6,2,False,True,49.0
771,There are so many gold diggers nowadays,1.1639344262295082,0.0581139255569198,61,53,6,2,False,False,39.0
771,At least they’re wearing headphones so we can hear the TV.,1.1636363636363636,0.0503431749267762,55,46,9,0,False,True,58.0
771,"They may find change, but gold I highly doubt.",1.1636363636363636,0.0503431749267762,55,46,9,0,False,True,46.0
771,Why aren't you wearing your wedding ring?,1.1636363636363636,0.056637760682328,55,47,7,1,True,True,41.0
771,"They’re on to you, Sergeant.",1.1636363636363636,0.056637760682328,55,47,7,1,False,True,28.0
771,One shows up and the rest follow. Happens every time.,1.1636363636363636,0.0503431749267762,55,46,9,0,False,True,53.0
771,"The ""Curse of Oak Island""...had finally reached their living rooms.",1.1636363636363636,0.062299571495391,55,48,5,2,False,True,67.0
771,"Well, it's been over six weeks so they're just searching for wire coat hangers.",1.1636363636363636,0.062299571495391,55,48,5,2,False,True,79.0
771,Have you checked down the back of the couch?,1.1636363636363636,0.062299571495391,55,48,5,2,True,True,44.0
771,They're rehearsing VR curling.,1.1636363636363636,0.056637760682328,55,47,7,1,False,True,30.0
771,Really I’m just looking for a heart of gold.,1.1636363636363636,0.062299571495391,55,48,5,2,False,True,44.0
771,Anyone know the wifi code here?,1.1636363636363636,0.062299571495391,55,48,5,2,True,True,31.0
771,"I’ve actually just been sitting on the remote, but the nursing home nearby  needed help with some environmental enrichment",1.1636363636363636,0.062299571495391,55,48,5,2,False,False,122.0
771,Did you have them when you left the house?,1.1636363636363636,0.056637760682328,55,47,7,1,True,True,42.0
771,I think the downstairs neighbors are playing Heavy Metal.,1.1636363636363636,0.056637760682328,55,47,7,1,False,True,57.0
771,"It was a bad idea to bring the lounge chair to the beach, don't you think Steve?",1.1636363636363636,0.062299571495391,55,48,5,2,True,True,80.0
771,My heart isn't made of metal.,1.1636363636363636,0.062299571495391,55,48,5,2,False,True,29.0
771,They said they were a heavy metal band.,1.1636363636363636,0.056637760682328,55,47,7,1,False,True,39.0
771,They're getting ready to go to the beach.,1.1636363636363636,0.062299571495391,55,48,5,2,False,True,41.0
771,"Does your dad know there's an update to the ""Find My Phone"" app?",1.1636363636363636,0.056637760682328,55,47,7,1,True,True,64.0
771,I still say we should've adopted that Golden Retriever instead...,1.1636363636363636,0.056637760682328,55,47,7,1,False,True,65.0
771,"Walter, you could stop being a Luddite and be TechSavy
in just eight short months.",1.1636363636363636,0.0503431749267762,55,46,9,0,False,True,82.0
771,"Just relax, I'm sure they will find your metallic gold contacts in time for your audition.",1.1636363636363636,0.056637760682328,55,47,7,1,False,True,90.0
771,Maybe that last piercing was a bad idea after all,1.1636363636363636,0.062299571495391,55,48,5,2,False,False,49.0
771,I didn’t realize that this is what you meant when you said you always search out heavy metal.,1.1636363636363636,0.056637760682328,55,47,7,1,False,True,93.0
771,Do you think they'll find the dollar coin I lost?,1.1636363636363636,0.0503431749267762,55,46,9,0,True,True,49.0
771,"We’ve been on this couch together for the whole pandemic, darlin’. I don’t think I need to ‘prove my mettle’ anymore.",1.1636363636363636,0.062299571495391,55,48,5,2,False,True,117.0
771,They said this is the only way to find my lost metal detector.,1.1636363636363636,0.062299571495391,55,48,5,2,False,True,62.0
771,"they don't know, it's my BUTT, it's the BOMB and there will be no survivors""",1.1636363636363636,0.062299571495391,55,48,5,2,False,False,76.0
771,I told them that the game of Musical Chairs is over,1.1636363636363636,0.056637760682328,55,47,7,1,False,False,51.0
771,I’m always looking for stuff too,1.1636363636363636,0.062299571495391,55,48,5,2,False,False,32.0
771,"‘Invest in gold,’ you said. ‘It’s a safe investment,’ you said.",1.1636363636363636,0.056637760682328,55,47,7,1,False,True,63.0
771,I’m not picking up any chemistry either,1.1636363636363636,0.056637760682328,55,47,7,1,False,False,39.0
771,This is your idea of a beach party?,1.163265306122449,0.06742934558367,49,43,4,2,True,True,35.0
771,All this to find a gold filling?,1.163265306122449,0.0533482555828507,49,41,8,0,True,True,32.0
771,"Actually, they're just killing time till we get off the couch.",1.163265306122449,0.06742934558367,49,43,4,2,False,True,62.0
771,Are you sure you had an engagement ring with you?,1.163265306122449,0.0533482555828507,49,41,8,0,True,True,49.0
771,"The next time you sell on Craigslist, could you be less creative with your language.",1.163265306122449,0.0533482555828507,49,41,8,0,False,True,84.0
771,The counselor said we should work on conversational landmines,1.163265306122449,0.0533482555828507,49,41,8,0,False,False,61.0
771,Those “cash-for-gold” commercials are beginning to annoy me!!,1.163265306122449,0.0533482555828507,49,41,8,0,False,True,61.0
771,Bitcoin is really bringing metal detecting back.,1.163265306122449,0.06742934558367,49,43,4,2,False,True,48.0
771,"Honey, I said that I could die for some onion rings, not that I lost my diamond ring.",1.163265306122449,0.0607978331010866,49,42,6,1,False,True,85.0
771,Why are they having such trouble locating the bars?,1.163265306122449,0.0607978331010866,49,42,6,1,True,True,51.0
771,"We should install a nickel-plated floor, you said. It will last forever,you said.",1.163265306122449,0.0607978331010866,49,42,6,1,False,True,81.0
771,The reward for my bitcoin.,1.163265306122449,0.0607978331010866,49,42,6,1,False,True,26.0
771,Do they know metal detectors don't work to find missing bitcoin?,1.163265306122449,0.0607978331010866,49,42,6,1,True,True,64.0
771,Maybe we should get up and look under the cushions.,1.163265306122449,0.0533482555828507,49,41,8,0,False,True,51.0
771,Our chips must be malfunctioning since the government goons can't detect us.,1.163265306122449,0.06742934558367,49,43,4,2,False,True,76.0
771,"When I called to complain about the WiFi, I didn't expect this.",1.163265306122449,0.0607978331010866,49,42,6,1,False,True,63.0
771,Someone told them this was Oak Island instead of Oak Street.,1.163265306122449,0.0607978331010866,49,42,6,1,False,True,60.0
771,These guys are idiots.,1.163265306122449,0.0533482555828507,49,41,8,0,False,True,22.0
771,They’re mining bitcoin,1.163265306122449,0.0533482555828507,49,41,8,0,False,False,22.0
771,Let’s hope they find it soon because you’re changing the channel this time.,1.163265306122449,0.0533482555828507,49,41,8,0,False,True,75.0
771,Unemployed and desperate. They're hoping to find gold!,1.163265306122449,0.06742934558367,49,43,4,2,False,True,54.0
771,You sure it was a doubloon in the cushions?,1.163265306122449,0.0607978331010866,49,42,6,1,True,True,43.0
771,Is this the new Pokemon Go?,1.163265306122449,0.0607978331010866,49,42,6,1,True,True,27.0
771,Did you check the cushions yet?,1.163265306122449,0.0533482555828507,49,41,8,0,True,True,31.0
771,I think they found our mining business.,1.163265306122449,0.0607978331010866,49,42,6,1,False,True,39.0
771,I guess it is what they call the golden hour,1.163265306122449,0.0607978331010866,49,42,6,1,False,False,44.0
771,Didn’t you say this beach house would be relaxing?,1.163265306122449,0.0607978331010866,49,42,6,1,True,True,50.0
771,I tried telling them the concept of crypto currency but they insisted my millions were around here somewhere. You’ll get used to it after a while.,1.163265306122449,0.0607978331010866,49,42,6,1,False,True,146.0
771,"What are they looking for?
For my golden heart.",1.163265306122449,0.0607978331010866,49,42,6,1,True,True,47.0
771,"Oh, that! We are trying to figure out the social class of the new neighbors downstairs.”",1.163265306122449,0.06742934558367,49,43,4,2,False,False,88.0
771,Well the coins had to keep coming from somewhere ?,1.163265306122449,0.0533482555828507,49,41,8,0,True,True,50.0
771,A good conversation topic is like gold.,1.162790697674419,0.0738907079406966,43,38,3,2,False,True,39.0
771,I do try to let my hobbies take over my life.,1.162790697674419,0.0659728505364627,43,37,5,1,False,True,45.0
771,Wouldn't have been much easier to buy me another wedding ring?,1.162790697674419,0.0659728505364627,43,37,5,1,True,True,62.0
771,Do you actually think there is anything left worth finding after COVID-19?,1.162790697674419,0.0659728505364627,43,37,5,1,True,True,74.0
771,Tell me again why you thought sub-leasing from Forrest Fenn was a good idea.,1.162790697674419,0.0569648777391436,43,36,7,0,False,True,76.0
771,"Don't worry, I'm sure the remote is around here somewhere.",1.162790697674419,0.0569648777391436,43,36,7,0,False,True,58.0
771,"Have you noticed, I keep losing things?",1.162790697674419,0.0659728505364627,43,37,5,1,True,True,39.0
771,I told them I found a quarter in your couch and they overreacted.,1.162790697674419,0.0569648777391436,43,36,7,0,False,True,65.0
771,"This isn't what I had in mind by,""What's mine is yours.""",1.162790697674419,0.0569648777391436,43,36,7,0,False,False,56.0
771,They visit every now and again to check for any loose change,1.162790697674419,0.0569648777391436,43,36,7,0,False,False,60.0
771,Heavy metal?,1.162790697674419,0.0659728505364627,43,37,5,1,True,True,12.0
771,Did you check the door?,1.162790697674419,0.0569648777391436,43,36,7,0,True,True,23.0
771,They did say it included an expansive beach area.,1.162790697674419,0.0738907079406966,43,38,3,2,False,True,49.0
771,"Don’t worry, they’re just friends. I’m not old enough for them.",1.162790697674419,0.0659728505364627,43,37,5,1,False,True,63.0
771,"Does this qualify as encroachment to privacy""",1.162790697674419,0.0738907079406966,43,38,3,2,False,False,45.0
771,"Me minesweeping when she said ""it's OKAY"".",1.162790697674419,0.0659728505364627,43,37,5,1,False,True,42.0
771,My father keeps saying that I need to prove my metal in this tough cruel world.,1.162790697674419,0.0659728505364627,43,37,5,1,False,True,79.0
771,No strings attached,1.162790697674419,0.0659728505364627,43,37,5,1,False,False,19.0
771,The couple in the apartment below have an insanely happy marriage and I want to know why.,1.162162162162162,0.0823228237950318,37,33,2,2,False,True,89.0
771,"My parents said there used to be stuff called ""change"" you could find in your sofa.",1.162162162162162,0.0614332508873237,37,31,6,0,False,True,83.0
771,They should check the Dogecoin run.,1.162162162162162,0.0823228237950318,37,33,2,2,False,True,35.0
771,They're bullsh.. detectors. Got something you wanna tell me?,1.162162162162162,0.0823228237950318,37,33,2,2,True,True,60.0
771,"I agree to let your brother stay with us, you didn't say he is president of the metals detector club and he host the monthly meetings. .",1.162162162162162,0.0823228237950318,37,33,2,2,False,True,136.0
771,I wonder how much weed they’ll pick up with those things?,1.161764705882353,0.0496267637408336,68,58,9,1,True,True,57.0
771,They heard people used to find conversation here.,1.161764705882353,0.0496267637408336,68,58,9,1,False,True,49.0
771,Here's to hoping they can find us something we can both agree to watch.,1.161764705882353,0.0496267637408336,68,58,9,1,False,True,71.0
771,"I know the money is all in the couch, but maybe they'll find your earring.",1.1612903225806452,0.057230033880354,62,54,6,2,False,True,74.0
771,When you said we were moving to Saxon Fields I thought it was an apartment complex.,1.1612903225806452,0.0524066412601862,62,53,8,1,False,True,83.0
771,Hold on to your change,1.1612903225806452,0.0470917754857602,62,52,10,0,False,False,22.0
771,Told you we should have checked granmaws pockets befote we buried her under the house!,1.1612903225806452,0.0616773662514789,62,55,4,3,False,True,86.0
771,Why didn't you tell them you already found the change?!,1.1607142857142858,0.0556938857091182,56,48,7,1,True,True,55.0
