contest,rank,caption,mean,precision,votes,not_funny,somewhat_funny,funny,has_question_mark,ends_with_punctuation,caption_length
567,1102,"My wife short-sheeted me, and I didn't want to be late for work.",1.1702127659574468,0.076456858356832,47,42,2,3,False,True,64
567,1103,The bed got up on the wrong side of me this morning.,1.1702127659574468,0.0632100658866106,47,40,6,1,False,True,52
567,1104,Hopefully the home office deduction still exists in the new tax code!,1.1702127659574468,0.0632100658866106,47,40,6,1,False,True,69
567,1105,I warned you that we're going to the mattresses on this.,1.1702127659574468,0.0632100658866106,47,40,6,1,False,True,56
567,1106,It helps me get a jump on the traffic,1.1702127659574468,0.0554115786563254,47,39,8,0,False,False,37
567,1107,"I'm Som Nambulist, your productivity consultant.",1.1702127659574468,0.0701468588718922,47,41,4,2,False,True,48
567,1108,The office is no place for your pillow talk!,1.1702127659574468,0.076456858356832,47,42,2,3,False,True,44
567,1109,"It's called ""life-hacking"", Dave.",1.1702127659574468,0.0701468588718922,47,41,4,2,False,True,33
567,1110,This is what you get for calling a 6 a.m. meeting.,1.1702127659574468,0.0632100658866106,47,40,6,1,False,True,50
567,1111,"What, you think I slept my way to the top?",1.1702127659574468,0.0554115786563254,47,39,8,0,True,True,42
567,1112,But you said you wanted more efficiency out of your employees!,1.1702127659574468,0.0632100658866106,47,40,6,1,False,True,62
567,1113,I'm erect and ready for business. Think this will satisfy her?,1.1702127659574468,0.0701468588718922,47,41,4,2,True,True,62
567,1114,thought i'd make it a bit easier for you and management to fuck me over and over and over like you always do,1.1702127659574468,0.076456858356832,47,42,2,3,False,False,108
567,1115,I know I am late! I couldn't get out of bed.,1.1702127659574468,0.0632100658866106,47,40,6,1,False,True,44
567,1116,This aint my idea of pillow talk.,1.1702127659574468,0.0632100658866106,47,40,6,1,False,True,33
567,1117,What?! I'm multi-tasking!,1.1702127659574468,0.0632100658866106,47,40,6,1,True,True,25
567,1118,A working breakfast in bed is too a thing.,1.1702127659574468,0.0701468588718922,47,41,4,2,False,True,42
567,1119,"Well, if you're gonna make us use standing desks!",1.1702127659574468,0.0701468588718922,47,41,4,2,False,True,49
567,1120,what makes you think I can't multitask?,1.1702127659574468,0.0701468588718922,47,41,4,2,True,True,39
567,1121,"It's called memory foam, this should help increase my production.",1.1702127659574468,0.0632100658866106,47,40,6,1,False,True,65
567,1122,I told you I wasn't getting out of bed for this.,1.1702127659574468,0.0632100658866106,47,40,6,1,False,True,48
567,1123,I am not lying,1.1702127659574468,0.0632100658866106,47,40,6,1,False,False,14
567,1124,I'm the new intern for the 24/7 shift.,1.1702127659574468,0.076456858356832,47,42,2,3,False,True,38
567,1125,"I thought you said we were ""going to the mattresses"".",1.1702127659574468,0.0701468588718922,47,41,4,2,False,True,53
567,1126,What made you think I was kidding?,1.1702127659574468,0.0632100658866106,47,40,6,1,True,True,34
567,1127,Now you can't accuse me of getting out on the wrong side.,1.1702127659574468,0.076456858356832,47,42,2,3,False,True,57
567,1128,And then the Genie just disappeared!,1.1702127659574468,0.0554115786563254,47,39,8,0,False,True,36
567,1129,The employee manual only says that I cannot lie down in my office.,1.1702127659574468,0.0701468588718922,47,41,4,2,False,True,66
567,1130,Upside: No commuting. Downside: I catch a lot of sheet.,1.1702127659574468,0.0701468588718922,47,41,4,2,False,True,55
567,1131,"Sorry not sorry, dad, but I’m gonna bail on Bring Your Millennial to Work Day.",1.1702127659574468,0.0701468588718922,47,41,4,2,False,True,78
567,1132,"What!!? You said today was ""business casual!!",1.1702127659574468,0.0632100658866106,47,40,6,1,True,True,45
567,1133,I'm fed up with these millennials always asking for a better work/life balance!,1.1702127659574468,0.0554115786563254,47,39,8,0,False,True,79
567,1134,I thought I'd take a sick day at work.,1.1702127659574468,0.0632100658866106,47,40,6,1,False,True,38
567,1135,I'm working from bed today.,1.1702127659574468,0.0632100658866106,47,40,6,1,False,True,27
567,1136,Don't knock it til you've tried it.,1.1702127659574468,0.0632100658866106,47,40,6,1,False,True,35
567,1137,Restroom breaks are the only problem.,1.1702127659574468,0.0632100658866106,47,40,6,1,False,True,37
567,1138,"You said we were going to pull all-nighters, right?",1.1702127659574468,0.0632100658866106,47,40,6,1,True,True,51
567,1139,I had a dream about work last night.,1.1702127659574468,0.0632100658866106,47,40,6,1,False,True,36
567,1140,The doctor told me not to get out of bed.,1.1702127659574468,0.0632100658866106,47,40,6,1,False,True,41
567,1141,I forgot my pants.,1.1702127659574468,0.0632100658866106,47,40,6,1,False,True,18
567,1142,"If the blanket's over my head, don't disturb me.",1.1702127659574468,0.0701468588718922,47,41,4,2,False,True,48
567,1143,You have a lot of a nerve staying awake on the job!,1.1702127659574468,0.0701468588718922,47,41,4,2,False,True,51
567,1144,"Yeah, I know; I have a tendency to get ahead of myself.""",1.1702127659574468,0.0701468588718922,47,41,4,2,False,False,56
567,1145,"At our meeting you didn't finish ""Goodnight Moon""!",1.1702127659574468,0.0632100658866106,47,40,6,1,False,True,50
567,1146,My wife says men are bad at multi-tasking. I'm out to prove her wrong.,1.1702127659574468,0.0632100658866106,47,40,6,1,False,True,70
567,1147,"Sorry I'm late, but I just couldn't get out of bed",1.1702127659574468,0.0554115786563254,47,39,8,0,False,False,50
567,1148,"Before condemning it, I thought I should at least experience life as a pocket protector.",1.1702127659574468,0.0554115786563254,47,39,8,0,False,True,88
567,1149,"So you can't think of one goddam funny thing to say? I'm walking around in a bed at work and you don't think thats funny? Because let me tell you something it's funny ok, it's funny!",1.1702127659574468,0.0554115786563254,47,39,8,0,True,True,182
567,1150,"C'mon - a couple weeks ago, Woodbridge got that hamster-wheel desk.",1.1702127659574468,0.0554115786563254,47,39,8,0,False,True,67
567,1151,"Again, I was downsized, so I now have a position working out of my bed.",1.1702127659574468,0.0632100658866106,47,40,6,1,False,True,71
567,1152,What side did I get up on now?,1.1702127659574468,0.0632100658866106,47,40,6,1,True,True,30
567,1153,What? What's the problem? I choose comfort as my lifestyle!,1.1702127659574468,0.076456858356832,47,42,2,3,True,True,59
567,1154,My doctor put me on bed rest to reduce work stress.,1.1702127659574468,0.0822843883734952,47,43,0,4,False,True,51
567,1155,I thought it was bring your bed to work day?!,1.1702127659574468,0.0632100658866106,47,40,6,1,True,True,45
567,1156,My chiropractor said I should work at a sleeping desk.,1.1702127659574468,0.0701468588718922,47,41,4,2,False,True,54
567,1157,"If it's all the same to you, I thought I'd work from the office this morning.",1.1702127659574468,0.0632100658866106,47,40,6,1,False,True,77
567,1158,No one at the office has my back.,1.1702127659574468,0.0701468588718922,47,41,4,2,False,True,33
567,1159,I don't see how this qualifies as sleeping on the job,1.1702127659574468,0.0554115786563254,47,39,8,0,False,False,53
567,1160,NOW who got up on the wrong side of the bed? Huh?,1.1702127659574468,0.0632100658866106,47,40,6,1,True,True,49
567,1161,Everyone says naps help productivity.,1.1702127659574468,0.0554115786563254,47,39,8,0,False,True,37
567,1162,The company's future: 24/7.,1.1702127659574468,0.0632100658866106,47,40,6,1,False,True,27
567,1163,"If you're not floating in the air, then I must be standing up.",1.1702127659574468,0.0701468588718922,47,41,4,2,False,True,62
567,1164,I’m just living the dream.,1.1702127659574468,0.0554115786563254,47,39,8,0,False,True,26
567,1165,I'm ready for court.,1.1702127659574468,0.0701468588718922,47,41,4,2,False,True,20
567,1166,I thought we valued work-life balance.,1.1702127659574468,0.0701468588718922,47,41,4,2,False,True,38
567,1167,"If you can excuse me, I'm trying to work.",1.1702127659574468,0.0632100658866106,47,40,6,1,False,True,41
567,1168,"He said, ""You can leave anytime you like, but you can never check out.""",1.1702127659574468,0.0632100658866106,47,40,6,1,False,False,71
567,1169,"I know getting dressed in bed is odd, but how did you get stuck to my ceiling?",1.1702127659574468,0.0701468588718922,47,41,4,2,True,True,78
567,1170,I'm flying United.,1.1702127659574468,0.076456858356832,47,42,2,3,False,True,18
567,1171,AS SEEN ON TV......ALL - IN - ONE TRAVEL PACKAGE ....$19.95 X 5.,1.1702127659574468,0.076456858356832,47,42,2,3,False,True,64
567,1172,I'm duct taping myself to the next United Airlines flight.,1.1702127659574468,0.076456858356832,47,42,2,3,False,True,58
567,1173,Sorry Boss. Just couldn't get out of bed this morning.,1.1702127659574468,0.0701468588718922,47,41,4,2,False,True,54
567,1174,"Life is prioritization, Collins.",1.1702127659574468,0.076456858356832,47,42,2,3,False,True,32
567,1175,My doctor told me to stay in bed.,1.1702127659574468,0.0632100658866106,47,40,6,1,False,True,33
567,1176,"Treadmill desks were, oh, so 21st century.",1.1702127659574468,0.0701468588718922,47,41,4,2,False,True,42
567,1177,Torn between work and home,1.1702127659574468,0.0701468588718922,47,41,4,2,False,False,26
567,1178,Murphy's Law not Murphy Bed!,1.1702127659574468,0.076456858356832,47,42,2,3,False,True,28
567,1179,You told me to save money on overhead.,1.1702127659574468,0.0701468588718922,47,41,4,2,False,True,38
567,1180,I have a doctor's note!,1.1666666666666667,0.0674460826228564,42,36,5,1,False,True,23
567,1181,"Well, you did tell me I'd have to pull and all nighter.",1.1590909090909092,0.0792618017181585,44,40,1,3,False,True,55
567,1182,I will now be available 24 hours a day,1.1590909090909092,0.0557780051123632,44,37,7,0,False,False,38
567,1183,"Well, you said ""Be prepared to work thru the night""! I'm prepared!!",1.1590909090909092,0.064562127495507,44,38,5,1,False,True,67
567,1184,Look. Casual Friday was YOUR idea.,1.1590909090909092,0.064562127495507,44,38,5,1,False,True,34
567,1185,And now you know why my clothes look like they've been slept in!,1.1590909090909092,0.0557780051123632,44,37,7,0,False,True,64
567,1186,"Yes, I'm a morning person. Duh.",1.1590909090909092,0.064562127495507,44,38,5,1,False,True,31
567,1187,I blame daylight saving time.,1.1590909090909092,0.0557780051123632,44,37,7,0,False,True,29
567,1188,"Well how about you give me ""your"" definition of blanket purchase orders.",1.1590909090909092,0.0722865876852504,44,39,3,2,False,True,72
567,1189,Of course you beat me at racquetball!,1.1590909090909092,0.0722865876852504,44,39,3,2,False,True,37
567,1190,"Home office, office home. Same diff.",1.1590909090909092,0.0792618017181585,44,40,1,3,False,True,36
567,1191,My wife says I'm married to my job.,1.1590909090909092,0.0722865876852504,44,39,3,2,False,True,35
567,1192,Tell me the story about best practices for cash flow management.,1.1590909090909092,0.0722865876852504,44,39,3,2,False,True,64
567,1193,"I know you expect us to ""eat & sleep"" our work, but I need a desk!",1.1590909090909092,0.064562127495507,44,38,5,1,False,True,66
567,1194,What?! Some things are easier to take lying down.,1.1590909090909092,0.064562127495507,44,38,5,1,True,True,49
567,1195,What do you mean this isn't a realistic lifestyle?,1.1590909090909092,0.0722865876852504,44,39,3,2,True,True,50
567,1196,"Like I said, I can do this job in my sleep.",1.1590909090909092,0.0722865876852504,44,39,3,2,False,True,43
567,1197,But I have completely eliminated my commuting expenses.,1.1590909090909092,0.064562127495507,44,38,5,1,False,True,55
567,1198,"If the market sours, I've got something to fall back on.",1.1590909090909092,0.0722865876852504,44,39,3,2,False,True,56
567,1199,Haven't heard of it? It's called work-life integration.,1.1590909090909092,0.0722865876852504,44,39,3,2,True,True,55
567,1200,Why not? You've always accused me of being asleep on the job...,1.1590909090909092,0.0557780051123632,44,37,7,0,True,True,63
567,1201,You think I need more face time at the office and I think I need to be able to work from home. This way we both win.,1.1590909090909092,0.0722865876852504,44,39,3,2,False,True,116
567,1202,Wake up! That tie doesn't go with that mattress.,1.1590909090909092,0.064562127495507,44,38,5,1,False,True,48
567,1203,Ask me how to save more on your car insurance.,1.1590909090909092,0.0722865876852504,44,39,3,2,False,True,46
567,1204,"I hate ""Commute From Bed Day.""",1.1590909090909092,0.0722865876852504,44,39,3,2,False,False,30
567,1205,Just tell 'em I'll be ready 24/7.,1.1590909090909092,0.0557780051123632,44,37,7,0,False,True,33
567,1206,"The language in my contract clearly says to strive to make this my ""dream"" job.",1.1590909090909092,0.0557780051123632,44,37,7,0,False,True,79
567,1207,This is how I work at home.,1.1590909090909092,0.0722865876852504,44,39,3,2,False,True,27
567,1208,You told me to stay in bed.,1.1590909090909092,0.0792618017181585,44,40,1,3,False,True,27
567,1209,"As a millennium, if I happen to fall asleep at work, I have a right to be comfortable.",1.1590909090909092,0.0722865876852504,44,39,3,2,False,True,86
567,1210,I know that the company is trimming costs but couldn't I get a futon?,1.1590909090909092,0.064562127495507,44,38,5,1,True,True,69
567,1211,"Dickinsheets, the name is Dickinsheets.",1.1590909090909092,0.064562127495507,44,38,5,1,False,True,39
567,1212,We pulled out of NAP-TA.,1.1590909090909092,0.0557780051123632,44,37,7,0,False,True,24
567,1213,I am here for my sleep study.,1.1590909090909092,0.0557780051123632,44,37,7,0,False,True,29
567,1214,It's a Murphy Bed Desk; I'll fold up and you'll never even know I'm sleeping.,1.1590909090909092,0.064562127495507,44,38,5,1,False,True,77
567,1215,"""I told you, it's the flu. Now do you believe me?",1.1590909090909092,0.0557780051123632,44,37,7,0,True,True,49
567,1216,Why.....do I look like I slept here?,1.1590909090909092,0.064562127495507,44,38,5,1,True,True,36
567,1217,No I didn't get out of bed on the wrong side! I just feel like I've been up all night.,1.1590909090909092,0.064562127495507,44,38,5,1,False,True,86
567,1218,"What do you mean, you think I'm sleeping on the job? Whatever gave you that idea?",1.1590909090909092,0.0792618017181585,44,40,1,3,True,True,81
567,1219,I took your advise. I am embracing work-life integration.,1.1590909090909092,0.064562127495507,44,38,5,1,False,True,57
567,1220,I'm virtical integration!,1.1590909090909092,0.0722865876852504,44,39,3,2,False,True,25
567,1221,I'm dressing for the job I want.,1.1590909090909092,0.0792618017181585,44,40,1,3,False,True,32
567,1222,I thought you promised me Business Class this time.,1.1590909090909092,0.0722865876852504,44,39,3,2,False,True,51
567,1223,"No, I've never heard of the legendary Nap-man!",1.1590909090909092,0.0557780051123632,44,37,7,0,False,True,46
567,1224,Monday Morning .,1.1590909090909092,0.0722865876852504,44,39,3,2,False,True,16
567,1225,Keith describes his latest nightmare.,1.1590909090909092,0.064562127495507,44,38,5,1,False,True,37
567,1226,"My God, man, are you blind? It's a CALIFORNIA King!",1.1590909090909092,0.064562127495507,44,38,5,1,True,True,51
567,1227,That's the last time I stay at a Military Inn!,1.1590909090909092,0.064562127495507,44,38,5,1,False,True,46
567,1228,Bring Your Bed to Work Day has one major flaw...,1.1590909090909092,0.064562127495507,44,38,5,1,False,True,48
567,1229,I can work 24/7.,1.1590909090909092,0.0792618017181585,44,40,1,3,False,True,16
567,1230,And we'll close the deal with a slumber party.,1.1590909090909092,0.064562127495507,44,38,5,1,False,True,46
567,1231,I thought this is what you meant when you said work life balance!,1.1590909090909092,0.0722865876852504,44,39,3,2,False,True,65
567,1232,They cut my travel budget.,1.1590909090909092,0.064562127495507,44,38,5,1,False,True,26
567,1233,"Yes, this is how I sleep and, more interestingly, why are you floating horizontally above me?",1.1590909090909092,0.0722865876852504,44,39,3,2,True,True,93
567,1234,I really am the President of Mattress Firm.,1.1590909090909092,0.0722865876852504,44,39,3,2,False,True,43
567,1235,"You laugh, but my hotel expenses are zero.",1.1590909090909092,0.0722865876852504,44,39,3,2,False,True,42
567,1236,This is the best management could come up with for an ADA accommodation for my narcolepsy?,1.1590909090909092,0.064562127495507,44,38,5,1,True,True,90
567,1237,"Pajamas, I don't need no stinkin pajamas.",1.1590909090909092,0.0557780051123632,44,37,7,0,False,True,41
567,1238,"I know, Tom, but it's what the Millennials want.",1.1590909090909092,0.064562127495507,44,38,5,1,False,True,48
567,1239,I feel I'm ready for whatever today throws at me!,1.1590909090909092,0.064562127495507,44,38,5,1,False,True,49
567,1240,But... they're my comfort items!,1.1590909090909092,0.0722865876852504,44,39,3,2,False,True,32
567,1241,Just pulled an 'all nighter'.,1.1590909090909092,0.0792618017181585,44,40,1,3,False,True,29
567,1242,"As a matter of fact, I did get up on the wrong side of the bed.",1.1590909090909092,0.0557780051123632,44,37,7,0,False,True,63
567,1243,"I don't need a big office Mr. Murphy, just give me a hole in the wall.",1.1590909090909092,0.064562127495507,44,38,5,1,False,True,70
567,1244,No! Working from home has not changed my habits.,1.1590909090909092,0.064562127495507,44,38,5,1,False,True,48
567,1245,I'm planning to sleep on the job.,1.1590909090909092,0.064562127495507,44,38,5,1,False,True,33
567,1246,"Sleep Schmeep--I'm living the dream, man!",1.1590909090909092,0.0557780051123632,44,37,7,0,False,True,41
567,1247,What? You said it was casual Friday!,1.1590909090909092,0.064562127495507,44,38,5,1,True,True,36
567,1248,I just can't stop working,1.1590909090909092,0.0722865876852504,44,39,3,2,False,False,25
567,1249,I've decided to make the most of this narcolepsy and get a sleeping desk.,1.1590909090909092,0.064562127495507,44,38,5,1,False,True,73
567,1250,How can you expect me to fall asleep holding all this crap?,1.1590909090909092,0.0722865876852504,44,39,3,2,True,True,59
567,1251,I'm not going to lie down and take it anymore.,1.1590909090909092,0.064562127495507,44,38,5,1,False,True,46
567,1252,"Multitasking is the key to success, Jim!",1.1590909090909092,0.064562127495507,44,38,5,1,False,True,40
567,1253,I plan on utilizing every second of my afternoon power nap.,1.1590909090909092,0.064562127495507,44,38,5,1,False,True,59
567,1254,Where am I supposed to put my laptop?,1.1590909090909092,0.0557780051123632,44,37,7,0,True,True,37
567,1255,It's all about work and personal life balance boss,1.1590909090909092,0.0722865876852504,44,39,3,2,False,False,50
567,1256,What? Bedder late than never.,1.1590909090909092,0.0722865876852504,44,39,3,2,True,True,29
567,1257,Push my 8.30 to 9.30 and tell Johnson Super Glue Wednesdays are cancelled moving forward.,1.1590909090909092,0.0792618017181585,44,40,1,3,False,True,89
567,1258,Would you please push me to the nearest Starbucks?,1.1590909090909092,0.064562127495507,44,38,5,1,True,True,50
567,1259,Standing desk? No this is my new bed-desk...,1.1590909090909092,0.0722865876852504,44,39,3,2,True,True,44
567,1260,What do you mean I didn’t win Employee of the Month?!?!?!,1.1590909090909092,0.0722865876852504,44,39,3,2,True,True,57
567,1261,I get more work done before I get out of bed than most people do all night long.,1.1590909090909092,0.064562127495507,44,38,5,1,False,True,80
567,1262,I'm defending a client who works nights.,1.1590909090909092,0.0722865876852504,44,39,3,2,False,True,40
567,1263,This is supposedly how they do it in Europe.,1.1590909090909092,0.0722865876852504,44,39,3,2,False,True,44
567,1264,Inspired by my pet turtle.,1.1590909090909092,0.0722865876852504,44,39,3,2,False,True,26
567,1265,"Doctor's orders, Sir: ""Stay in bed till you are no longer contagious.""",1.1590909090909092,0.064562127495507,44,38,5,1,False,False,70
567,1266,So you're saying I can't sleep in the office?,1.1590909090909092,0.064562127495507,44,38,5,1,True,True,45
567,1267,I'm not wearing any pants,1.1590909090909092,0.064562127495507,44,38,5,1,False,False,25
567,1268,If it weren't for the suit-and-tie pajamas I'd feel pretty silly working today.,1.1590909090909092,0.0722865876852504,44,39,3,2,False,True,79
567,1269,I'm pulling an all-morninger.,1.1590909090909092,0.064562127495507,44,38,5,1,False,True,29
567,1270,This is what they came up with to save money when we go on business trips !,1.1590909090909092,0.064562127495507,44,38,5,1,False,True,75
567,1271,"It's called a 24/7 mattress, for a longer lasting sleep.",1.1590909090909092,0.0722865876852504,44,39,3,2,False,True,56
567,1272,"If you want to get ahead in this world, Baxter, you'll have to learn how to multi-task.",1.1590909090909092,0.064562127495507,44,38,5,1,False,True,87
567,1273,I told you it was a tuck-in acquisition.,1.1590909090909092,0.0722865876852504,44,39,3,2,False,True,40
567,1274,"So then she says, 'untuck yourself'.",1.1590909090909092,0.064562127495507,44,38,5,1,False,True,36
567,1275,"The Starbucks line was just so long. Oh, and traffic, yes, traffic was terrible this morning.",1.1590909090909092,0.0792618017181585,44,40,1,3,False,True,93
567,1276,No stupid sleep study's gonna cut into my billable hours!,1.1590909090909092,0.0557780051123632,44,37,7,0,False,True,57
567,1277,"Clearly, your maids didn't read the ""do not disturb"" sign.",1.1590909090909092,0.064562127495507,44,38,5,1,False,True,58
567,1278,I was part of the very early layoffs.,1.1590909090909092,0.064562127495507,44,38,5,1,False,True,37
567,1279,Sleeping is not billable in and of itself. That's why I always bring work with.,1.1590909090909092,0.064562127495507,44,38,5,1,False,True,79
567,1280,Deal with it. I do my best work in bed.,1.1590909090909092,0.064562127495507,44,38,5,1,False,True,39
567,1281,I don't do trust falls.,1.1590909090909092,0.064562127495507,44,38,5,1,False,True,23
567,1282,"OK, no man-spreading. Nothing about bedspreading.",1.1590909090909092,0.0722865876852504,44,39,3,2,False,True,49
567,1283,Are you in my dream or am I in yours?,1.1590909090909092,0.0722865876852504,44,39,3,2,True,True,37
567,1284,I hate it when the sheets are tucked too tight.,1.1590909090909092,0.064562127495507,44,38,5,1,False,True,47
567,1285,I am a daydream believer.,1.1590909090909092,0.0722865876852504,44,39,3,2,False,True,25
567,1286,Okay. I agree to work late!,1.1590909090909092,0.0722865876852504,44,39,3,2,False,True,27
567,1287,I left my pants in Houston.,1.1590909090909092,0.0557780051123632,44,37,7,0,False,True,27
567,1288,But wait there's more! You also get these handy set of kitchen knives!,1.1590909090909092,0.0557780051123632,44,37,7,0,False,True,70
567,1289,This is my interpretation of casual Friday.,1.1590909090909092,0.0722865876852504,44,39,3,2,False,True,43
567,1290,I needed a more supportive work environment.,1.1590909090909092,0.064562127495507,44,38,5,1,False,True,44
567,1291,My hourly salary mustn't be lower than my sleep number.,1.1590909090909092,0.064562127495507,44,38,5,1,False,True,55
567,1292,"I'll power nap my way, you power nap yours.",1.1590909090909092,0.064562127495507,44,38,5,1,False,True,43
567,1293,"Hell yes, I'm fired up and ready to go!",1.1590909090909092,0.064562127495507,44,38,5,1,False,True,39
567,1294,Face it. There is NOTHING funny about this.,1.1590909090909092,0.064562127495507,44,38,5,1,False,True,43
567,1295,Doesn't this fit within casual Friday guidelines?,1.1590909090909092,0.064562127495507,44,38,5,1,True,True,49
567,1296,I thought we were going to the mattresses?,1.1590909090909092,0.064562127495507,44,38,5,1,True,True,42
567,1297,What? Do I have bed head?,1.1590909090909092,0.064562127495507,44,38,5,1,True,True,25
567,1298,I told you I wasn't going to take this laying down!,1.1590909090909092,0.064562127495507,44,38,5,1,False,True,51
567,1299,"The doctor recommended bed rest, but you told me that I had no sick leave.",1.1590909090909092,0.0557780051123632,44,37,7,0,False,True,74
567,1300,"Well, your HAIRCUT is ""ridiculous,"" Dave!",1.1590909090909092,0.064562127495507,44,38,5,1,False,True,41
567,1301,"John, I am trying to relax at work just like you said I should.",1.1590909090909092,0.0557780051123632,44,37,7,0,False,True,63
567,1302,It's the latest micro apartment/office.,1.1590909090909092,0.0722865876852504,44,39,3,2,False,True,39
567,1303,I do not want to travel united again,1.1590909090909092,0.064562127495507,44,38,5,1,False,False,36
567,1304,Let's put this deal to bed right now.,1.1590909090909092,0.0557780051123632,44,37,7,0,False,True,37
567,1305,Don't just stand there. Butter me some toast.,1.1590909090909092,0.064562127495507,44,38,5,1,False,True,45
567,1306,Standing desks are for deadbeat slackers,1.1590909090909092,0.0792618017181585,44,40,1,3,False,False,40
567,1307,I am just following the new requirement of the office to use a stand up desk.,1.1590909090909092,0.064562127495507,44,38,5,1,False,True,77
567,1308,What are you staring at? I told you I have the shortest commute in the office.,1.1590909090909092,0.064562127495507,44,38,5,1,True,True,78
567,1309,"When I asked what the dresscode was during our video interview you said, and I quote, ""what you're in now is fine.""",1.1590909090909092,0.0722865876852504,44,39,3,2,False,False,115
567,1310,Doctors orders! You can take it up with HR.,1.1590909090909092,0.0557780051123632,44,37,7,0,False,True,43
567,1311,I don't know why I even bothered getting out of bedroom today!,1.1590909090909092,0.0792618017181585,44,40,1,3,False,True,62
567,1312,I do my best work in the sack.,1.1590909090909092,0.0722865876852504,44,39,3,2,False,True,30
567,1313,I refuse to take this lying down!,1.1590909090909092,0.0722865876852504,44,39,3,2,False,True,33
