contest,caption,mean,precision,votes,not_funny,somewhat_funny,funny,has_question_mark,ends_with_punctuation,caption_length
844,You can leave your label on.,1.7877721574664611,0.011663957253112,4547,1991,1530,1026,False,True,28
844,First the good news...you've aged well.,1.7799145299145298,0.0163752935869596,2340,1048,759,533,False,True,39
844,"The good news is, you've aged well . . . .",1.7782956058588548,0.0199040907763202,1502,650,535,317,False,True,42
844,It's standard procedure at your age,1.7755231452124287,0.0194326186483573,1577,686,559,332,False,False,35
844,"It's a routine procedure, but I would recommend someone drive me home afterwards.",1.7583932853717026,0.0195582491937847,1668,782,507,379,False,True,81
844,"It's like acupuncture, but... with a twist.",1.7516853932584269,0.0189758440434499,1780,846,530,404,False,True,43
844,Good news. I found a way to stop your aging.,1.744812783210112,0.012441913760417,4193,2032,1199,962,False,True,44
844,I’m afraid you need glasses.,1.7370408513559903,0.0150391492596685,2913,1443,793,677,False,True,28
844,You must be my 5 o'clock,1.7271107944424653,0.0148501461436406,2807,1356,861,590,False,False,24
844,"Oh, this? Just a little something to help you breathe.",1.7229676400947118,0.0211536328509144,1267,583,452,232,True,True,54
844,"You won't be able to drive after this, and neither will I.",1.698842788597234,0.0130331576544464,3543,1760,1090,693,False,True,58
844,"Relax, I've performed this procedure thousands of times.""",1.69782480893592,0.0182458792921386,1701,816,583,302,False,False,57
844,I’m detecting subtle notes of fear and distrust.,1.691734921816828,0.0145879610027331,2686,1309,896,481,False,True,48
844,The good news is that you were born in a very good year.,1.6901041666666667,0.0191039428793947,1536,742,528,266,False,True,56
844,Don't worry!  I've done hundreds of these procedures.,1.683447749809306,0.020696312022033,1311,641,444,226,False,True,53
844,Relax.  It's just something to help you breathe.,1.6825588412794206,0.0181408943905511,1657,798,587,272,False,True,48
844,"It’s a minor procedure, and afterwards we’ll both feel much better.",1.674060382008626,0.0186798472845098,1623,810,532,281,False,True,67
844,"Actually, you ARE the anesthesia.",1.672811059907834,0.0193839024312736,1519,763,490,266,False,True,33
844,"It IS a slightly invasive procedure, but we can do it right here in the office.",1.671988388969521,0.0199305297880597,1378,677,476,225,False,True,79
844,I have something that can help you breathe,1.6645253390435404,0.019428026277323,1401,684,503,214,False,False,42
844,Keeping things bottled up is dangerous.,1.661394680086269,0.0197674716655573,1391,693,476,222,False,True,39
844,You are going to feel just a little prick before we start.,1.6446540880503144,0.0205596615171278,1272,648,428,196,False,True,58
844,Once I leave the room you can pour it into this cup.,1.641801548205489,0.0203140758702725,1421,762,406,253,False,True,52
844,I'm happy to report you're full-bodied with an excellent nose.,1.6415770609318996,0.0195176998108774,1395,710,475,210,False,True,62
844,"I recommend we run some routine tests -- tannins, structure, undertones of blackberry, that sort of thing.",1.6385110952040085,0.0197985366317925,1397,726,450,221,False,True,106
844,We’ve got to get to the bottom of this.,1.637362637362637,0.0222234262066848,1092,564,360,168,False,True,39
844,"You'll feel a slight prick, but then you can breathe.",1.637012987012987,0.0186016366333075,1540,791,517,232,False,True,53
844,I've called a close female colleague of mine over for a second opinion.,1.6368460955269144,0.0209505867494721,1319,708,382,229,False,True,71
844,"Yes, I do have something that will help you breathe.",1.6363636363636365,0.0187236146559739,1441,721,523,197,False,True,52
844,I think I see what's stopping you up...,1.6305732484076434,0.0195833724205439,1413,740,455,218,False,True,39
844,Now open wide and I'll say 'ahh.',1.62397476340694,0.0191622757258272,1585,871,439,275,False,False,33
844,"Trust me, you’ll breathe more freely after this.",1.621135873472322,0.0191268175761919,1391,717,484,190,False,True,48
844,"But I'm a screw-top, Doctor. Did you even examine me?",1.6209510682288075,0.0200704939774579,1451,803,395,253,True,True,53
844,Here we are…just a little something to help you breathe.,1.6156996587030716,0.0185326692986474,1465,758,512,195,False,True,56
844,This shouldn't hurt but you may feel a bit empty when we're finished.,1.6151582045621782,0.0194439001368922,1359,711,460,188,False,True,69
844,We'll both be feeling better in no time.,1.6149323927101704,0.0180754406263075,1701,926,504,271,False,True,40
844,"Relax, it'll help you breathe.",1.614306784660767,0.019227627693215,1356,702,475,179,False,True,30
844,I’ve found a way to relieve some of that pressure.,1.613938053097345,0.0238994567558811,904,475,303,126,False,True,50
844,You'll feel much more relaxed once we let you breathe.,1.611344537815126,0.0188660775938131,1428,748,487,193,False,True,54
844,Close your eyes and think of France.,1.6102675343456254,0.0201876271447395,1383,764,394,225,False,True,36
844,"Really, it’s a routine procedure. After a twist and a pop, we’ll let you breathe.",1.6081277213352685,0.01929435991626,1378,729,460,189,False,True,81
844,I just think that some fresh air would do you good.,1.6078112286411717,0.0202515340014675,1229,645,421,163,False,True,51
844,It's just a quick jab and twist and you'll find it so much easier to breathe.,1.6056445461479787,0.0198268136202723,1311,698,432,181,False,True,77
844,Don't look so concerned Mr. Vino.  Eventually we all get screwed.,1.6021069692058347,0.0216873517367157,1234,701,323,210,False,True,65
844,It's just a little check that we have to do when you're over fifty.,1.600702576112412,0.0252608580504429,854,471,253,130,False,True,67
844,"Hello, you must be my five o' clock.",1.5986062717770035,0.0203096035600216,1435,828,355,252,False,True,36
844,"This may look nasty, but it'll help you breathe.",1.5970790378006874,0.020699454784122,1164,619,395,150,False,True,48
844,I have something which will help you breathe,1.5931882686849574,0.0216476546096906,1057,564,359,134,False,False,44
844,"The upside is, you'll be able to breathe.",1.5876418663303908,0.0249880201814462,793,427,266,100,False,True,41
844,Welcome to Doctors Without Bordeauxes.,1.5865921787709498,0.0223532202281614,1253,758,255,240,False,True,38
844,The good news is that you've aged well.,1.5797356828193834,0.0216723436808951,1135,641,330,164,False,True,39
844,I’m confident I can get to the bottom of this.,1.579447322970639,0.0218250037092773,1158,665,315,178,False,True,46
844,You'll feel a little pop and then I just need you to breathe!,1.5741935483870968,0.0229833470206828,1085,640,267,178,False,True,61
844,"With all that wine in you, you’re not going to feel a thing",1.5719381688466112,0.0246686248504859,841,472,257,112,False,False,59
844,I'll have the nurse bring in a little cup.,1.5718562874251496,0.0232315765596043,1002,577,277,148,False,True,42
844,"On second thought, don't lie down.",1.564499484004128,0.0261255016496135,969,623,145,201,False,True,34
844,The good news is that you've aged very well.,1.5628930817610065,0.0233271623556144,954,547,277,130,False,True,44
844,The good news is you've aged very well.,1.559652928416486,0.0239533837390006,922,536,256,130,False,True,39
844,Trust me.  I'll have it out before dinner time.,1.5531400966183575,0.0349061272251113,414,238,123,53,False,True,47
844,There is a way to stop the aging process.,1.549140049140049,0.0249976017549013,814,473,235,106,False,True,41
844,"After the procedure, we’ll both need someone to drive us home.",1.5481770833333333,0.0265816447138016,768,460,195,113,False,True,62
844,"Don’t worry, you’ll only get better with age.",1.5474339035769828,0.0270164896619565,643,362,210,71,False,True,45
844,It’s a simple same day surgery and you should find that you can breathe much better afterward.,1.5435139573070606,0.0277482626365211,609,345,197,67,False,True,94
844,Generally it's recommended once you reach a certain age.,1.5363636363636364,0.0280465323201587,660,395,176,89,False,True,56
844,I have a little something to relieve the pressure.,1.5350404312668464,0.0288802358620195,742,482,123,137,False,True,50
844,I’ll need to take a sample.,1.5340393343419063,0.0281818154635159,661,399,171,91,False,True,27
844,"This is really a simple procedure, but afterward you'll need a pair of glasses.",1.5323383084577114,0.0313213820246137,603,385,115,103,False,True,79
844,I have just the thing to stop the aging process.,1.531782945736434,0.0289694289650509,645,396,155,94,False,True,48
844,I'd be happy to remove it.,1.5303030303030305,0.0268001129761416,660,384,202,74,False,True,26
844,"Trust me, I have just the thing to help you breathe.",1.5271317829457365,0.0292025516565101,516,293,174,49,False,True,52
844,"Oh, we can stop the aging process right away.",1.5252525252525253,0.0302405087446627,594,369,138,87,False,True,45
844,Don't worry. I will personally get to the bottom of this.,1.5206185567010309,0.0279020914216533,582,338,185,59,False,True,57
844,Good news! You’re at 98.6.,1.5204262877442274,0.0290227494671692,563,333,167,63,False,True,26
844,You may experience mild discomfort.,1.5193798449612403,0.0294710270826892,516,299,166,51,False,True,35
844,I understand you donated your body to science.,1.5165562913907285,0.0328625619238494,453,273,126,54,False,True,46
844,"The bad news is that your caption will be buried in the crowdsource voting by the Caption Contest Facebook Group, which votes as a block for its member's captions, so that other funnier captions are never seen by most voters.",1.5145631067961165,0.0357671595293921,515,355,55,105,False,True,225
844,"If you were a screw top, it would be an out patient treatment.",1.5118829981718465,0.0308732942302768,547,341,132,74,False,True,62
844,Don't worry - I do this procedure every evening.,1.51183970856102,0.0296884985125063,549,332,153,64,False,True,48
844,I'm going to need a sample.,1.5092250922509225,0.0292840331698979,542,324,160,58,False,True,27
844,I'm sure we can fix this pressure you feel inside.,1.5091277890466532,0.0300623623434037,493,290,155,48,False,True,50
844,You ARE the anesthesia.,1.5088062622309195,0.030328286542153,511,307,148,56,False,True,23
844,It's going to have to come out eventually...,1.5087719298245614,0.0311102214015594,513,315,135,63,False,True,44
844,You have aged very well.,1.5072992700729928,0.028935277891329,548,327,164,57,False,True,24
844,And it's guaranteed to stop the aging process!,1.5072992700729928,0.0303971630186374,548,340,138,70,False,True,46
844,My bill isn't the only way you're going to get screwed here.,1.5071283095723014,0.0322819736000207,491,306,121,64,False,True,60
844,Just lean over.....this won't hurt a bit,1.506122448979592,0.0310145647849719,490,296,140,54,False,False,40
844,Would you mind removing your label?,1.505399568034557,0.0316102451889953,463,278,136,49,True,True,35
844,It's just to help you breathe.,1.5047258979206048,0.0301700196240922,529,323,145,61,False,True,30
844,I've got something that will make us both feel better.,1.5020491803278688,0.0309735568352564,488,296,139,53,False,True,54
844,It's a standard test we do when you reach a certain age.,1.5,0.0326510080271492,468,292,118,58,False,True,56
844,"Sir, you are the anesthesia.",1.499001996007984,0.0317958496016105,501,315,122,64,False,True,28
844,My wife and I would love to have you for dinner tonight.,1.49890590809628,0.0322134313044634,457,280,126,51,False,True,56
844,"Trust me, I’ll have you breathing in no time.",1.4979508196721312,0.0307006542781415,488,296,141,51,False,True,45
844,Don't worry.  It's a simple procedure that we recommend for anyone of your vintage.,1.4969450101832993,0.0322832847188148,491,311,116,64,False,True,83
844,How's this for openers?,1.4965986394557824,0.0326021299351737,441,270,123,48,True,True,23
844,"Trust me ... my staff and I will definitely get to the bottom of this!""",1.493801652892562,0.0326352700266316,484,309,111,64,False,False,71
844,"Let's get to the bottom of this, shall we?",1.4935344827586208,0.0315600525871816,464,284,131,49,True,True,42
844,One of us will soon feel much better.,1.4933333333333334,0.0324287046599047,450,278,122,50,False,True,37
844,"After the procedure, I want you to focus on breathing,",1.493273542600897,0.0329500340581604,446,278,116,52,False,False,54
844,You may feel drained after the procedure.,1.4932432432432432,0.0316458977450458,444,268,133,43,False,True,41
844,Don’t think of it as the end; think of it as a grand opening!,1.4914004914004917,0.0345911476874529,407,255,104,48,False,True,61
844,You won't feel a thing. Then I won't feel a thing.,1.4875283446712018,0.0330680075691185,441,277,113,51,False,True,50
844,You'll be my final patient of the day.,1.4869976359338062,0.0317264610983367,423,254,132,37,False,True,38
844,Relax!  I’ve done this procedure hundreds of times!,1.4847826086956522,0.032491025732557,460,291,115,54,False,True,51
844,"It's a standard procedure, usually performed around 5 o'clock.",1.484560570071259,0.0330507456968504,421,261,116,44,False,True,62
844,"Don't worry, it's just something to help you breathe.",1.4845132743362832,0.0321641549195016,452,282,121,49,False,True,53
844,Sometimes the old therapies are still the best,1.484375,0.0349750324737586,384,240,102,42,False,False,46
844,It's nothing serious. You just need some over decanter medication.,1.4835164835164836,0.0387984688569132,364,242,68,54,False,True,66
844,I’ll need my other glasses for this.,1.482185273159145,0.0337254721831652,421,266,107,48,False,True,36
844,"I've done this procedure a thousand times.""",1.4811715481171548,0.0310153309733792,478,298,130,50,False,False,43
844,The good news is you’ll breathe easier!,1.4804597701149425,0.0316055114408896,435,266,129,40,False,True,39
844,This will allow you to release everything that has been fermenting inside you for years.,1.4804469273743015,0.039097202104461,358,239,66,53,False,True,88
844,I'll have you breathing in no time.,1.4799107142857142,0.0306250791988145,448,271,139,38,False,True,35
844,You might feel a little pop,1.479899497487437,0.0336899851671853,398,247,111,40,False,False,27
844,"I promise, we'll both feel much better shortly.",1.4782608695652173,0.0304828804989052,437,262,141,34,False,True,47
844,You'll be breathing better in no time.,1.4775,0.0322309083588112,400,242,125,33,False,True,38
844,I have something that will help you breathe better.,1.4748743718592965,0.0347906470575446,398,255,97,46,False,True,51
844,It's time for your annual corknoscopy.,1.4746835443037976,0.038922274127952,316,202,78,36,False,True,38
844,Just the tip,1.4746835443037976,0.039435114727903,316,204,74,38,False,False,12
844,Trust me. I've done this thousands of times.,1.4739884393063585,0.0368693965195138,346,220,88,38,False,True,44
844,Once I remove that blockage we’ll both feel better.,1.4730941704035874,0.0333827933756291,446,290,101,55,False,True,51
844,Cheer up!  You're my only patient who gets better with age.,1.4722955145118737,0.0356875934416669,379,244,91,44,False,True,59
844,"Relax, I'll get to the bottom of this.",1.4722955145118737,0.0344940822303415,379,238,103,38,False,True,38
844,"Don't worry, we just need a small sample for tasting... I mean testing.",1.471830985915493,0.0342321760482846,426,278,95,53,False,True,71
844,I'll be feeling better shortly.,1.4710982658959535,0.0373148982407733,346,223,83,40,False,True,31
844,The good news is your body’s in great shape. The bad news is it’s my anniversary.,1.46978021978022,0.038383344449426,364,245,67,52,False,True,81
844,I recommend a frontal unbottleme.,1.46875,0.0402878917807563,320,213,64,43,False,True,33
844,I’m afraid it will have to be removed.,1.468253968253968,0.0339361772117825,378,236,107,35,False,True,38
844,You may feel drained afterward. That's normal.,1.4680232558139534,0.0363200006712395,344,218,91,35,False,True,46
844,"Just to help you breathe.""",1.4673629242819843,0.0336171252991025,383,239,109,35,False,False,26
844,It'll be over soon and then you can breathe,1.4668304668304668,0.0333060884219275,407,258,108,41,False,False,43
844,I've got just the thing to help you breathe,1.4664879356568363,0.03569878517893,373,241,90,42,False,False,43
844,Don't worry.  I 've done this procedure a thousand times.,1.4655172413793105,0.0362391786921634,348,222,90,36,False,True,57
844,One of us will feel better after this,1.4651810584958218,0.0360809857343218,359,231,89,39,False,False,37
844,"Believe me, it will help you breathe!",1.4638069705093837,0.0344589343890414,373,236,101,36,False,True,37
844,This is a normal procedure for a patient your age,1.462809917355372,0.0355689078692269,363,233,92,38,False,False,49
844,You were right to be concerned about your age.,1.461756373937677,0.0349447836046104,353,222,99,32,False,True,46
844,"Either way, you're screwed!",1.4615384615384617,0.0377124030486583,338,221,78,39,False,True,27
844,"Actually, there are benefits to aging.",1.461340206185567,0.0334908075108675,388,245,107,36,False,True,38
844,I have something that will help you breathe!,1.4611260053619304,0.0348669577287181,373,239,96,38,False,True,44
844,"When you wake up, I'll be asleep.",1.4603658536585369,0.0375814617172031,328,212,81,35,False,True,33
844,I'm here to serve you.,1.460122699386503,0.0374986669691684,326,210,82,34,False,True,22
844,"You'll just hear a little ""pop""",1.459016393442623,0.0359742700989495,366,239,86,41,False,False,31
844,Do I look like someone who would screw you?,1.457142857142857,0.0378351058436055,350,234,72,44,True,True,43
844,I promise this will help you breathe.,1.4567164179104477,0.0352616698577309,335,210,97,28,False,True,37
844,At your vintage this is a mandatory procedure,1.4548022598870056,0.0381399646691583,354,240,67,47,False,False,45
844,Just a simple procedure to drain some fluid and we'll all feel better.,1.4539877300613495,0.0359342139137356,326,206,92,28,False,True,70
844,I've arranged for a second opinion... and cheese.,1.4511041009463723,0.0397768745890513,317,214,63,40,False,True,49
844,"Don't worry, I'm going to get to the bottom of this.",1.4507936507936507,0.0373507614531123,315,203,82,30,False,True,52
844,"You'll just feel a little squeeze and a pinch, then the pressure should start to subside.",1.4490445859872612,0.0382356335059551,314,206,75,33,False,True,89
844,"First, we'll have you pee in a glass.”",1.4489164086687307,0.0394551571756404,323,219,63,41,False,False,38
844,You'll have to wait 50 more years for your appointment,1.4481605351170568,0.0384817834961386,299,194,76,29,False,False,54
844,You’re holding up very well for a mediocre vintage.,1.4470198675496688,0.0358228361828726,302,188,93,21,False,True,51
844,You’ll breathe much better after the procedure.,1.4462025316455696,0.0369749008046201,316,204,83,29,False,True,47
844,It's a normal procedure for a wine of your age.,1.4448051948051948,0.0376537119734361,308,200,79,29,False,True,47
844,"Not a real Bordeaux?  Well, I'm not a real doctor!",1.443478260869565,0.0368488091094579,345,230,77,38,True,True,50
844,"It’s a simple procedure. First you’ll feel a slight pinch, next a gentle tugging sensation, after which you can relax and breathe freely!",1.4430769230769231,0.0380179548571295,325,217,72,36,False,True,137
844,"You’ll be fine, but I’ll feel fantastic.",1.441860465116279,0.0379765851594291,301,196,77,28,False,True,40
844,The good news is that I'll feel better after you have this procedure.,1.4402730375426622,0.0396057966526227,293,195,67,31,False,True,69
844,"Don't worry, I'll get to the bottom of it.",1.4397163120567376,0.0391530912633368,282,184,72,26,False,True,42
844,I’ve performed this procedure countless times.,1.4392857142857145,0.036656166829073,280,175,87,18,False,True,46
844,"Sorry, but your sulfites came back high.",1.4391891891891893,0.0375170453557932,296,191,80,25,False,True,40
844,It's time we remove that obstruction.,1.4387755102040816,0.0376946411242824,294,190,79,25,False,True,37
844,"You’ll feel a little sting, then a sense of being screwed",1.4385382059800664,0.0407723003286958,301,207,56,38,False,False,57
844,"Once it comes out, you'll be able to breathe.",1.4383561643835616,0.0387954747887367,292,192,72,28,False,True,45
844,You'll feel no pain and shortly after nor will I.,1.4383116883116882,0.0390011180404456,308,207,67,34,False,True,49
844,I'm afraid it's going to have to come out.,1.4382022471910112,0.0424082723335178,267,181,55,31,False,True,42
844,"Good news, the corkage fee is in-network!",1.4372759856630823,0.0394405857839556,279,183,70,26,False,True,41
844,"Really, you would be amazed by how often I perform this procedure.",1.436923076923077,0.0374846499861765,325,217,74,34,False,True,66
844,"There's a small corkage fee, but your insurance should cover it""",1.4363636363636365,0.0411571774214749,275,185,60,30,False,False,64
844,It's a routine procedure for those of your vintage.,1.4356435643564356,0.0368851246440174,303,196,82,25,False,True,51
844,Relax. I've done this hundreds of times. You'll just feel a little drained.,1.435483870967742,0.0379847384229147,310,206,73,31,False,True,75
844,"So, Fred, the next part of your annual exam could leave you feeling a bit drained.",1.435374149659864,0.0370538803567763,294,189,82,23,False,True,82
844,There is one procedure I always recommend at your age.,1.4345047923322685,0.0368913910025319,313,205,80,28,False,True,54
844,I have something to relieve the pressure.,1.4342105263157894,0.0367915109559984,304,197,82,25,False,True,41
844,"You might feel a slight pop, but don't worry, I've done this a thousand times.",1.4341637010676156,0.0382364191276992,281,182,76,23,False,True,78
844,Shortly after the procedure you’ll be the life of the party.,1.4334470989761092,0.0404449830366631,293,200,59,34,False,True,60
844,I see you've anesthetized yourself.,1.4327868852459016,0.0400700598633163,305,210,58,37,False,True,35
844,I've got just the thing to relieve that blockage.,1.4309623430962344,0.0428845636944218,239,159,57,23,False,True,49
844,"We're going to need a rather large sample, I'm afraid.",1.4301470588235294,0.0417805611273538,272,186,55,31,False,True,54
844,I've got something that will help you breathe.,1.4301470588235294,0.0404609044763815,272,182,63,27,False,True,46
844,Don’t worry. This is routine procedure for a bottle your age.,1.429553264604811,0.038533651561909,291,193,71,27,False,True,61
844,"Given your age, there is a procedure that we like to perform.",1.429553264604811,0.0391438537144278,291,195,67,29,False,True,61
844,The corkage fee should be covered by your insurer.,1.4292035398230087,0.0450864474220792,226,153,49,24,False,True,50
844,I'm here to help you breathe.,1.4291845493562232,0.0423785786655182,233,153,60,20,False,True,29
844,"Luckily, I can remove it.",1.4291187739463602,0.0413339852844264,261,175,60,26,False,True,25
844,I have just the thing to relieve the pressure you've been under.,1.429054054054054,0.0383629350577812,296,197,71,28,False,True,64
844,It’s just a pinch. Then a pop. Then a glub glub glub.,1.4285714285714286,0.0389122766904158,287,191,69,27,False,True,53
844,Let’s get you to open up,1.4280155642023349,0.0403124741610297,257,169,66,22,False,False,24
844,You're the perfect age for this procedure.,1.4265232974910391,0.0390449217270405,279,185,69,25,False,True,42
844,"""Your procedure is scheduled for 5 o'clock somewhere.",1.4262948207171315,0.0421317331140258,251,169,57,25,False,True,53
844,You will feel a little prick and then a slight tug.,1.42570281124498,0.0412108443219399,249,165,62,22,False,True,51
844,"You have options, but you'll be screwed either way.",1.4251012145748987,0.0426185253881195,247,167,55,25,False,True,51
844,Think of the next procedure as a breathing exercise.,1.424812030075188,0.039322579955915,266,175,69,22,False,True,52
844,It’s nothing.  Everyone from Bordeaux gets this procedure at your age.,1.4246031746031746,0.042744540575693,252,172,53,27,False,True,70
844,I’d like to check out your tannins.,1.424561403508772,0.0374680607210484,285,186,77,22,False,True,35
844,"Well, the good news is that you don’t have to bend over.",1.424,0.0410809759663202,250,166,62,22,False,True,56
844,This will only hurt for a second and then you will be able to breathe.,1.4234527687296417,0.0392808536033338,307,212,60,35,False,True,70
844,"After you're opened, I will say ahhh.",1.4233576642335766,0.0395305651758844,274,183,66,25,False,True,37
844,It’s a recommended procedure at your age.,1.4232209737827717,0.0388465436633061,267,175,71,21,False,True,41
844,I'll just need a few samples.,1.4226415094339622,0.0415302198593917,265,181,56,28,False,True,29
844,I’ve got a little something here that will help you breathe.,1.4217391304347826,0.0435929756831601,230,155,53,22,False,True,60
844,I’m glad to see you’re aging well,1.4204545454545454,0.0391333602568044,264,174,69,21,False,False,33
844,You'll notice a remarkable improvement in breathing.,1.4190140845070425,0.0368497259634872,284,185,79,20,False,True,52
844,"When people say 'screw it,' they're talking about me.",1.41869918699187,0.0423065647930276,246,167,55,24,False,True,53
844,You may feel a bit of pressure...and hear a pop.,1.4186046511627908,0.0419689120988262,258,177,54,27,False,True,48
844,I think it's time you opened up.,1.4184100418410042,0.0451896518512196,239,168,42,29,False,True,32
844,Good news. I know what's causing the blockage.,1.4175824175824177,0.0409295285037485,273,188,56,29,False,True,46
844,You'd be amazed at the things people swallow!,1.416289592760181,0.0439000954043727,221,149,52,20,False,True,45
844,"Don’t worry, this is a standard procedure for a bottle of your vintage.",1.4155844155844155,0.0434065813274782,231,157,52,22,False,True,71
844,Proctological examinations are an important part of health care.,1.4147465437788018,0.0449423620225124,217,148,48,21,False,True,64
