contest,caption,mean,precision,votes,not_funny,somewhat_funny,funny,has_question_mark,ends_with_punctuation,caption_length
783,So you’re board with your life.,1.1578947368421053,0.0421052631578947,76,64,12,0,False,True,31
783,"It's not you darling, it's me.",1.1578947368421053,0.0421052631578947,76,64,12,0,False,True,30
783,Autumn can be depressing for a lot of us.,1.1578947368421053,0.0421052631578947,76,64,12,0,False,True,41
783,I am sorry but the truth is that nobody likes you.,1.1578947368421053,0.0497454276447643,76,66,8,2,False,True,50
783,Explain to me why you think you're just vegetating?,1.1578947368421053,0.0421052631578947,76,64,12,0,True,True,51
783,"Son, it’s time that I told you that your mother was a couch potato.",1.1578947368421053,0.0460839492511006,76,65,10,1,False,True,67
783,"I cautioned you,Ms. Erenbach about following trends and algorithms.",1.1578947368421053,0.0421052631578947,76,64,12,0,False,True,67
783,"If I were you, I’d be streamed, too!",1.1578947368421053,0.0421052631578947,76,64,12,0,False,True,36
783,"It just feels like no one likes ME for ME, you know?",1.1578947368421053,0.0404780766113642,95,81,13,1,True,True,52
783,I don't know why you feel rootless!,1.1578947368421053,0.0421052631578947,76,64,12,0,False,True,35
783,I think she’s right you do have to grow up and set down roots.,1.1578947368421053,0.0460839492511006,76,65,10,1,False,True,62
783,I can’t tell you it will be easy to get a good haircut.,1.1578947368421053,0.0421052631578947,76,64,12,0,False,True,55
783,Everyone's been a sap for some girl.,1.1578947368421053,0.0460839492511006,76,65,10,1,False,True,36
783,So you think being a vegan is why no one likes you?,1.1573033707865168,0.0449118885544538,89,77,10,2,True,True,51
783,Forget the apples. Soon he'll want your branches.,1.1573033707865168,0.0449118885544538,89,77,10,2,False,True,49
783,I'd say you're flowering into a much bitter person.,1.1573033707865168,0.0449118885544538,89,77,10,2,False,True,51
783,"Hey tree, believe me you are the last one of your species",1.1573033707865168,0.0419727902171692,89,76,12,1,False,False,57
783,To grow out of this you need your feet in the ground!,1.1573033707865168,0.0449118885544538,89,77,10,2,False,True,53
783,"She actually said, ""root and branch""?",1.1573033707865168,0.0419727902171692,89,76,12,1,True,True,37
783,Have you considered any other explanations besides envy?,1.1573033707865168,0.0419727902171692,89,76,12,1,True,True,56
783,So you thought “The Crown” was complete rubbish?,1.1571428571428573,0.0524185823803322,70,61,7,2,True,True,48
783,And then that was it - I couldn't beleaf she left me.,1.1571428571428573,0.0438126742948566,70,59,11,0,False,True,53
783,In my opinion your problems stem from the roots.,1.1571428571428573,0.0438126742948566,70,59,11,0,False,True,48
783,"If a tree lays on a couch, does it talk about it's problems?",1.1571428571428573,0.0438126742948566,70,59,11,0,True,True,60
783,"Oh, I know, but I think you might still taste the same if you just shave off your top.",1.1571428571428573,0.0483076505722999,70,60,9,1,False,True,86
783,I'm going to suggest a hugger,1.1571428571428573,0.0483076505722999,70,60,9,1,False,False,29
783,"I understand, but what are your primary feelings, being steamed or boiled?",1.1571428571428573,0.0438126742948566,70,59,11,0,True,True,74
783,I just feel like branching out.,1.1571428571428573,0.0438126742948566,70,59,11,0,False,True,31
783,"I'm sorry. But, having the same hairstyle is just not enough to base a relationship.",1.1571428571428573,0.0483076505722999,70,60,9,1,False,True,84
783,Wow Dr. WONGS hair elixir really does work.,1.1571428571428573,0.0483076505722999,70,60,9,1,False,True,43
783,What I hear you saying is that you’re not dealing well with the move and are really feeling uprooted.,1.1571428571428573,0.0483076505722999,70,60,9,1,False,True,101
783,"No,I said your inner sappling,not your inner sap.",1.1571428571428573,0.0483076505722999,70,60,9,1,False,True,49
783,What's at the root of your bitterness?,1.1571428571428573,0.0483076505722999,70,60,9,1,True,True,38
783,So it all started with Joyce Kilmer.,1.1571428571428573,0.0438126742948566,70,59,11,0,False,True,36
783,In my professional opinion we should trade places.,1.1571428571428573,0.0483076505722999,70,60,9,1,False,True,50
783,Maybe you just need to blow off some steam,1.1571428571428573,0.0438126742948566,70,59,11,0,False,False,42
783,I'm so sorry but our time is up.,1.1571428571428573,0.0438126742948566,70,59,11,0,False,True,32
783,"Yes, I'm afraid our salad days are behind us.",1.1571428571428573,0.0438126742948566,70,59,11,0,False,True,45
783,"Trevor, if you keep barking at me, we’ll never get to the root of the problem.",1.1571428571428573,0.0483076505722999,70,60,9,1,False,True,78
783,How long have you felt this feeling of being uprooted?,1.1571428571428573,0.0483076505722999,70,60,9,1,True,True,54
783,Your problem is you haven,1.1571428571428573,0.0562297648377788,70,62,5,3,False,False,25
783,"I realize the implication, but their meatballs are tasty.",1.1566265060240963,0.0436436553063486,83,71,11,1,False,True,57
783,I've been called that name too -- but you shouldn't let it annoy you because in your case it's appropriate.,1.1566265060240963,0.0436436553063486,83,71,11,1,False,True,107
783,Sometimes when I’m sitting in this chair I like to pretend I’m a starship captain exploring the galaxy. Would you like to pretend with me Mr. Broccoli?,1.1566265060240963,0.0499247971356927,83,73,7,3,True,True,151
783,"It might be best not to enter the beauty contest, sis.",1.1566265060240963,0.0436436553063486,83,71,11,1,False,True,54
783,It’s not my fault I always have a morning wood,1.1566265060240963,0.046889519178274,83,72,9,2,False,False,46
783,"If you're feeling excluded, try branching out to other species - like rabbits.",1.1566265060240963,0.0436436553063486,83,71,11,1,False,True,78
783,"And tell me, is this ""veggie monster"" in the room?",1.1566265060240963,0.0436436553063486,83,71,11,1,True,True,50
783,"No, Alex Haley's bestselling book wasn't about Oak trees.",1.1566265060240963,0.046889519178274,83,72,9,2,False,True,57
783,Have you heard the term cultural appropriation?,1.1566265060240963,0.0401361469031224,83,70,13,0,True,True,47
783,"No, you don't have to be chocolate covered for people to like you. But if you want to wear chocolate for yourself, that's ok, too.",1.1566265060240963,0.0436436553063486,83,71,11,1,False,True,130
783,Accept it you are just a fruit tree,1.1566265060240963,0.0436436553063486,83,71,11,1,False,False,35
783,How long have you dream't about turning over a new leaf?,1.15625,0.0508789315395201,64,55,8,1,True,True,56
783,"I think it's time for you to start acting like a Potato, if you care so much about other's opinion.""",1.15625,0.0427357368224111,96,83,11,2,False,False,100
783,You just have to be patient.,1.15625,0.0555400524003616,64,56,6,2,False,True,28
783,Forget about deodorant. Just stay out of the hot tub.,1.15625,0.0457453159194624,64,54,10,0,False,True,53
783,"No Mr. Jobe, I don't think not getting a woody is a physical problem.",1.15625,0.0555400524003616,64,56,6,2,False,True,69
783,So you always feel like your stomach is in knots?,1.15625,0.0427357368224111,96,83,11,2,True,True,49
783,I just want kids not to be afraid of me anymore.,1.15625,0.0508789315395201,64,55,8,1,False,True,48
783,"No, you do not have Asperger syndrome. But you may have something similar.",1.15625,0.0508789315395201,64,55,8,1,False,True,74
783,"You say that Broccolini, being more mild and sweet, has you feeling less respected and you ought to be steamed.",1.155844155844156,0.0455277215879749,77,66,10,1,False,True,111
783,THE SMELL OF URINE IS A PHENOMENON WHICH YOU CANNOT AVOID.,1.155844155844156,0.0491379378143853,77,67,8,2,False,True,58
783,I'd call it the cloud of unknowing,1.155844155844156,0.0455277215879749,77,66,10,1,False,False,34
783,"It's not you, it's me, I don't feel the same since I stopped being a vegan!",1.155844155844156,0.041605407501116,77,65,12,0,False,True,75
783,Your fear of Harvest seems well founded. Talk more about your sprouthood.,1.155844155844156,0.0455277215879749,77,66,10,1,False,True,73
783,You can't control the aphids--you only have control over yourself.,1.155844155844156,0.0455277215879749,77,66,10,1,False,True,66
783,So what if you feel no one likes you? You don't need external validation.,1.155844155844156,0.0491379378143853,77,67,8,2,True,True,73
783,One day your kids will appreciate you.,1.155844155844156,0.041605407501116,77,65,12,0,False,True,38
783,I'm trying to keep it together,1.155844155844156,0.041605407501116,77,65,12,0,False,False,30
783,"Be proud of being green.  Don’t listen to the cauliflower, they’re tasteless.",1.155844155844156,0.0491379378143853,77,67,8,2,False,True,77
783,Why do you wonder why they call you Carrot Top?,1.155844155844156,0.0491379378143853,77,67,8,2,True,True,47
783,"Now, we know that's not true - lots of people like you.",1.155844155844156,0.0455277215879749,77,66,10,1,False,True,55
783,You can't stay a potted plant forever.  It's time to take root and fulfill your destiny's as a fall foliage destination.,1.155844155844156,0.0491379378143853,77,67,8,2,False,True,120
783,"While going green was indeed a resolution, this isn't exactly what I envisioned.",1.155844155844156,0.041605407501116,77,65,12,0,False,True,80
783,"Okay! You were kicked out of the Botanical Garden, think Christmas tree at Walmart!",1.155844155844156,0.0491379378143853,77,67,8,2,False,True,83
783,"Oh, I miss staying rooted.,",1.155844155844156,0.0491379378143853,77,67,8,2,False,False,27
783,"Don't worry. Tree nuts is not, like, NUTS nuts.",1.155844155844156,0.041605407501116,77,65,12,0,False,True,47
783,I understand the doom and gloom posturing but don't you think the black cloud metaphor is a bit overdone?,1.155844155844156,0.041605407501116,77,65,12,0,True,True,105
783,"What do you mean 'what kind of wood would I be if I were made of wood?""",1.155844155844156,0.0455277215879749,77,66,10,1,True,False,71
783,The Apple doesn’t fall far from the tree…,1.155844155844156,0.0525004803055042,77,68,6,3,False,False,41
783,It's just ignorance when they say you're cauliflower -- THEY'RE the ones who are green with envy!,1.155844155844156,0.0455277215879749,77,66,10,1,False,True,97
783,We’re leaving in 10 minutes! Have you packed your trunk?,1.155844155844156,0.041605407501116,77,65,12,0,True,True,56
783,Hang in there; you'll feel brighter in the fall.,1.155844155844156,0.041605407501116,77,65,12,0,False,True,48
783,You need to get your hair under cohnyto;.  Try Vaseline.,1.155844155844156,0.041605407501116,77,65,12,0,False,True,56
783,Couldn’t we go outside and veg out?,1.155844155844156,0.041605407501116,77,65,12,0,True,True,35
783,"First we need to get to the root of your problem,then we can branch out,wood you agree?",1.155844155844156,0.0455277215879749,77,66,10,1,True,True,87
783,Is it the dip?,1.155844155844156,0.0491379378143853,77,67,8,2,True,True,14
783,"Yes, I agree, the feet are a problem.",1.155844155844156,0.0455277215879749,77,66,10,1,False,True,37
783,"You say, you know little of your father, but your mother's roots come from a basketful of nutjobs...eh-hem, pun unintended.",1.155844155844156,0.0455277215879749,77,66,10,1,False,True,123
783,"Look, every one tops out.""",1.155844155844156,0.041605407501116,77,65,12,0,False,False,26
783,No shame in that--I miss the hugs too.,1.155844155844156,0.0491379378143853,77,67,8,2,False,True,38
783,What happened? Did you lose your root-wad?”,1.1555555555555554,0.0444444444444444,90,78,10,2,True,False,43
783,"And when your parents forced you to eat your broccoli,how did it make you feel?",1.1555555555555554,0.0471698689007362,90,79,8,3,True,True,79
783,I keep telling you I’m not a therapist. Now stop stalking me and just be-leaf in yourself!,1.1555555555555554,0.0415405916163694,90,77,12,1,False,True,90
783,"I realize you're in a vegetative state, but for me to help you, you're going to have to talk more.",1.1555555555555554,0.0415405916163694,90,77,12,1,False,True,98
783,So tell me about this recurring nightmare you have about smelling smoke,1.1555555555555554,0.0471698689007362,90,79,8,3,False,False,71
783,"... You gotta get back out there, plant your feet in the ground and show 'em that Groot's got nothin' on you.",1.1555555555555554,0.0415405916163694,90,77,12,1,False,True,109
783,"Why do you look so weird?

I'm from France.",1.1555555555555554,0.0444444444444444,90,78,10,2,True,True,43
783,"What’s your problem Mr. “B”?   ""Since my family has been growing on this planet we’ve never been respected.""",1.1555555555555554,0.0415405916163694,90,77,12,1,True,False,108
783,"So when you fell in the forest and no one was around to hear you, how did that make you feel?",1.1551724137931034,0.0538967001579833,58,50,7,1,True,True,93
783,I assume that you are unvaccinated.,1.1549295774647887,0.0476738049630548,71,61,9,1,False,True,35
783,"Doctor: I see you have a new look Betty.
Betty: My boyfriend cheated, and I went for a new hairstyle. Do you think it’s too much?",1.1549295774647887,0.0517223952130692,71,62,7,2,True,True,129
783,"The fault is not in yourself. It's in the underlings, rooting around for oil deposits.",1.1549295774647887,0.0589918226572122,71,64,3,4,False,True,86
783,Have you ever thought about bell bottoms and maybe some love beads?,1.1549295774647887,0.0432478576664078,71,60,11,0,True,True,67
783,"Maybe, I should lie down now...",1.1549295774647887,0.0432478576664078,71,60,11,0,False,True,31
783,...and in the autumn?,1.1549295774647887,0.0432478576664078,71,60,11,0,True,True,21
783,Is it sad that your my best client?,1.1549295774647887,0.0476738049630548,71,61,9,1,True,True,35
783,What was the first memory of your shadow?,1.1549295774647887,0.0517223952130692,71,62,7,2,True,True,41
783,We all must wrestle with our inevitable return to dirt.,1.1549295774647887,0.0432478576664078,71,60,11,0,False,True,55
783,I hear people like to party with trees!,1.1549295774647887,0.0432478576664078,71,60,11,0,False,True,39
783,"So, you're angry that when you fell in the forest, no one heard you?",1.1549295774647887,0.0476738049630548,71,61,9,1,True,True,68
783,"I don't care! I love you, and I'll marry you whether you're broccoli or  a tree.",1.1549295774647887,0.0476738049630548,71,61,9,1,False,True,80
783,"Well, what does cruciferous mean to you?",1.1549295774647887,0.0432478576664078,71,60,11,0,True,True,40
783,"So, you feel everyone is throwing shade on YOU?",1.1549295774647887,0.0432478576664078,71,60,11,0,True,True,47
783,And you are treed off because?,1.1549295774647887,0.0476738049630548,71,61,9,1,True,True,30
783,"Yes, it takes a long time to say anything in Old Entish. But your insurance only pays for half an hour.",1.1549295774647887,0.0476738049630548,71,61,9,1,False,True,103
783,And how does that make you feel?,1.1549295774647887,0.0554763071364565,71,63,5,3,True,True,32
783,I prefer it if you broccosit.,1.1547619047619049,0.0463654557243119,84,73,9,2,False,True,29
783,At least you don’t have roots here to keep you from moving on.,1.1547619047619049,0.0463654557243119,84,73,9,2,False,True,62
783,I could have been a Louisville Slugger,1.1547619047619049,0.0463654557243119,84,73,9,2,False,False,38
783,Have you ever thought about taking a dip in Good Seasons Zesty Italian Salad Dressing?,1.1547619047619049,0.0493621030464464,84,74,7,3,True,True,86
783,When did you first start to believe you were a mushroom?,1.1547619047619049,0.0463654557243119,84,73,9,2,True,True,56
783,Having spiders in your foliage is not really a psychiatric issue. You should see an arborist instead.,1.1547619047619049,0.0431612528997741,84,72,11,1,False,True,101
783,How did you feel when your parents abandoned you at the salad bar?,1.1547619047619049,0.0493621030464464,84,74,7,3,True,True,66
783,"‘Yes,  New York  can be a very hard place to put down roots.’",1.1547619047619049,0.0431612528997741,84,72,11,1,False,False,61
783,I suggest we skip the roots theme this week. Let's turn over a new leaf.,1.1538461538461535,0.0547317287336835,65,57,6,2,False,True,72
783,"When I count to three, you will be dormant.",1.1538461538461535,0.0518615278817878,78,69,6,3,False,True,43
783,"They said your new client is Ed Wood. Yeah, right.",1.1538461538461535,0.043986558394954,91,79,10,2,False,True,50
783,I think you’d feel less stressed about your roots if you’d branch out a bit.,1.1538461538461535,0.0380317871133111,91,77,14,0,False,True,76
783,Don’t worry. You’ll find your cheddar”,1.1538461538461535,0.0449846352461904,78,67,10,1,False,False,38
783,You think you've got it tough? I'm Polish!,1.1538461538461535,0.0492261902632449,91,81,6,4,True,True,42
783,And I thought it was tough living with you when you were blue.,1.1538461538461535,0.041117114140373,78,66,12,0,False,True,62
783,If you don't put down roots you will always feel like a leaf in the wind.,1.1538461538461535,0.041117114140373,78,66,12,0,False,True,73
783,When did you first start feeling that you were being stalked?,1.1538461538461535,0.0501477108092511,65,56,8,1,True,True,61
783,"Honey, I had a suspicion that vegan and Afro might be a bad idea. But I would have never guessed this.",1.1538461538461535,0.0485450073770014,78,68,8,2,False,True,102
783,"Being broccoli doesn't mean that everyone hates you. Many of us really love you! Now get up and come with me to the kitchen, mom wants for you to join us for dinner.",1.1538461538461535,0.0449846352461904,78,67,10,1,False,True,165
783,How can I expect them to like me when I don’t even like myself?,1.1538461538461535,0.041117114140373,78,66,12,0,True,True,63
783,Help me Doc. I don’t know if I’m a tree or broccoli.,1.1538461538461535,0.041117114140373,78,66,12,0,False,True,52
783,You're the first walking tree since Birnam Wood came to Dunsinane!,1.1538461538461535,0.041117114140373,78,66,12,0,False,True,66
783,"So with your split personality, what are you now - broccolini or broccoli rabe?",1.1538461538461535,0.0501477108092511,65,56,8,1,True,True,79
783,I'm prescribing an extended visit to Central Park for your urban rootlessness.,1.1538461538461535,0.0547317287336835,65,57,6,2,False,True,78
783,I fell in the forest and no-one was around to hear it.,1.1538461538461535,0.041117114140373,78,66,12,0,False,True,54
783,Now I can see the root of your problem.,1.1538461538461535,0.0485450073770014,78,68,8,2,False,True,39
783,Don’t think of yourself as a puny tree.  Think of yourself as a magnificent head of broccoli!,1.1538461538461535,0.0547317287336835,65,57,6,2,False,True,93
783,You must have seen climate change coming.. Now I have tree remedies ...,1.1538461538461535,0.0485450073770014,78,68,8,2,False,True,71
783,All my troubles started with President George H. W.  Bush.,1.1538461538461535,0.0518615278817878,78,69,6,3,False,True,58
783,You do have a lot of leaves for a tree your age.,1.1538461538461535,0.0518615278817878,78,69,6,3,False,True,48
783,"no, your bark doesn’t make you look fat",1.1538461538461535,0.0501477108092511,65,56,8,1,False,False,39
783,Your envy has gone to your head.,1.1538461538461535,0.0449846352461904,78,67,10,1,False,True,32
783,You need to find our roots…,1.1538461538461535,0.0451001515367637,65,55,10,0,False,False,27
783,Forget about the bullying.  You should be proud of your low carbon footprint.,1.1538461538461535,0.0547317287336835,65,57,6,2,False,True,77
783,Tell me why you believe that you are a spontaneous symbolic manifestation sent from my unconscious to inform me that I need to take a holiday.,1.1538461538461535,0.0637243745830395,52,46,4,2,False,True,142
783,"I'm about to start dinner. But first, would you like to join me in the sauna?",1.1538461538461535,0.0501477108092511,65,56,8,1,True,True,77
783,And what would you say is the root of the problem?,1.1538461538461535,0.0449846352461904,78,67,10,1,True,True,50
783,"Bro, I don't care if he's your cousin. Shooting a cauliflower in the stalk will absolutely land you behind bars!""",1.1538461538461535,0.0404632223345296,104,90,12,2,False,False,113
783,You need to get out of your head.,1.152941176470588,0.0392716687245308,85,72,13,0,False,True,33
783,Your problem stems from the fact that you were stalked as a young sprout.,1.152941176470588,0.0426892961903475,85,73,11,1,False,True,73
783,I love your foliage. Who's your arborist?,1.152941176470588,0.0426892961903475,85,73,11,1,True,True,41
783,"Don't just lay there like a bump on a log. Say something!
Anita Barlow, Edmond, OK",1.152941176470588,0.0426892961903475,85,73,11,1,False,False,82
783,"So, people think you are good for them. It's nothing to get steamed about.

Perhaps it would be helpful to think about how the other vegetables feel about the stir-fry.",1.152941176470588,0.0426892961903475,85,73,11,1,False,True,168
783,"I want to go back to something you talked about before, this feeling of rejection.",1.152941176470588,0.0426892961903475,85,73,11,1,False,True,82
783,Your problems all go back to your roots/.,1.152941176470588,0.0426892961903475,85,73,11,1,False,True,41
783,Have you ever had a feeling of being rootless in everyday life?,1.152941176470588,0.0392716687245308,85,72,13,0,True,True,63
783,Now tell me why you feel like you are a spud.,1.152941176470588,0.0426892961903475,85,73,11,1,False,True,45
783,"In your case, starting by exploring your roots may get us off on the wrong foot",1.152941176470588,0.0392716687245308,85,72,13,0,False,False,79
783,Would you please keep your roots off the couch?,1.152941176470588,0.0426892961903475,85,73,11,1,True,True,47
783,I think you're suffering from Seasonal Affective Disorder.,1.1527777777777777,0.0510443447020826,72,63,7,2,False,True,58
783,"Sorry, I had the munchies.  You were saying?...",1.1527777777777777,0.0426972190266123,72,61,11,0,True,True,47
783,You say your from cloud nine,1.1527777777777777,0.0470562303987024,72,62,9,1,False,False,28
783,"So your parents told you looking like a piece of broccoli was okay, right?",1.1527777777777777,0.0426972190266123,72,61,11,0,True,True,74
783,So last session you said you were feeling rootless…,1.1527777777777777,0.0470562303987024,72,62,9,1,False,False,51
783,"Since our last session, is your organic lifestyle agreeing with you?",1.1527777777777777,0.0510443447020826,72,63,7,2,True,True,68
783,"Okay now, let's go back to your deep seeded fear of leaf blowers.",1.1527777777777777,0.0426972190266123,72,61,11,0,False,True,65
783,"Your pain is a BROCCO-LIE! It's the law of human nature that you are bittten!""",1.1527777777777777,0.0426972190266123,72,61,11,0,False,False,78
783,"Well, if for nothing else, we might want to consider the seasonal effect.  Perhaps you should try going deciduous?",1.1527777777777777,0.0426972190266123,72,61,11,0,True,True,114
783,Your bark is worse than your height.,1.1527777777777777,0.0470562303987024,72,62,9,1,False,True,36
783,Finally you can see the roots of your problems.,1.1527777777777777,0.0426972190266123,72,61,11,0,False,True,47
783,"I know this is  a tough season for you, losing so many of your cousins at the same time.",1.1527777777777777,0.0470562303987024,72,62,9,1,False,True,88
783,It sounds like you are at a time in life when you'd like to put down some roots!,1.152542372881356,0.0530405671749312,59,51,7,1,False,True,80
783,It's my first year out of grad school so I guess they think of me as green.,1.1521739130434785,0.043537942793157,92,80,10,2,False,True,75
783,"I just don't understand, why don't the children ever take our feelings into consideration?",1.1521739130434785,0.0407020996930237,92,79,12,1,True,True,90
783,Dressing up like Mother Nature is not going to get you any girlfriends!,1.1518987341772151,0.0479661232117135,79,69,8,2,False,True,71
783,Always being the last one left on the veggie plater isn’t something to be ashamed of.,1.1518987341772151,0.0444542352441043,79,68,10,1,False,True,85
783,"Your not a "" couch potato"" Your broccoli!",1.1518987341772151,0.0512378660834386,79,70,6,3,False,True,41
783,I think you're being stalked.,1.1518987341772151,0.0406399936800568,79,67,12,0,False,True,29
783,"My guess; that a tree, broccoli or broccolini.",1.1518987341772151,0.0479661232117135,79,69,8,2,False,True,46
783,So how long have you felt there was a cloud over your head?,1.1518987341772151,0.0444542352441043,79,68,10,1,True,True,59
783,"It doesn't matter what others think, you need to start by liking yourself.",1.1518987341772151,0.0479661232117135,79,69,8,2,False,True,74
783,So what should we stalk about?,1.1518987341772151,0.0479661232117135,79,69,8,2,True,True,30
783,"When you fell in the forest, did you make a sound?",1.1518987341772151,0.0444542352441043,79,68,10,1,True,True,50
783,Don’t worry…there’s no chopping allowed in here.,1.1518987341772151,0.0406399936800568,79,67,12,0,False,True,48
783,"Well, I can't deny it -- everybody does hate you.",1.1518987341772151,0.0444542352441043,79,68,10,1,False,True,49
783,"I don't know which of us should be on that couch, hatred is a terrible thing.",1.1518987341772151,0.0444542352441043,79,68,10,1,False,True,77
783,How does the other vegetables making fun of your broccoli fro make you feel?,1.1518987341772151,0.0512378660834386,79,70,6,3,True,True,76
783,"If you are what you eat, does that mean I identify with being broccoli?",1.1518987341772151,0.0444542352441043,79,68,10,1,True,True,71
783,You stir me up.,1.1518987341772151,0.0444542352441043,79,68,10,1,False,True,15
783,"'Well, alcoholism can be a very difficult disease to deal with on your own.'

'But Doctor, I'm not drunk. I'm steaming.'",1.1518987341772151,0.0512378660834386,79,70,6,3,False,False,120
783,"Of course I'm attracted to collards, but I've learned that there are over fifty shades of green.",1.1518987341772151,0.0406399936800568,79,67,12,0,False,True,96
