contest,caption,mean,precision,votes,not_funny,somewhat_funny,funny,has_question_mark,ends_with_punctuation,caption_length
684,You say you want a r-evolution...,1.2926829268292683,0.0499656116811301,123,93,24,6,False,True,33
684,We're out of chairs. Whose lap do you want to sit on?,1.2926829268292683,0.0499656116811301,123,93,24,6,True,True,53
684,It’s come to our attention that there’s not enough white males here.,1.2926829268292683,0.0486136023078385,123,92,26,5,False,True,68
684,Now to address the elephant in the room...,1.2926829268292683,0.0538182349640333,123,96,18,9,False,True,42
684,"Let’s welcome Jim, our newest hire.  He has yet to drink the Kool-Aid.",1.2926829268292683,0.0499656116811301,123,93,24,6,False,True,70
684,This is our new recruit. I thought you would all like to have him in for lunch.,1.2926829268292683,0.0499656116811301,123,93,24,6,False,True,79
684,"Sorry, bud, humans don't get a chair until they stop destroying their planet.",1.2916666666666667,0.0507587159566206,120,91,23,6,False,True,77
684,Dave here would like to ask whoever’s been taking his pepperoni pizza from the break room to please stop..,1.2916666666666667,0.0521200850725884,120,92,21,7,False,True,106
684,Twelve angry men?,1.2913907284768211,0.0465966715440644,151,116,26,9,True,True,17
684,"Him? This year we've cut out the middle man for our ""magic"" meat.",1.2905405405405406,0.045229673108559,148,112,29,7,True,True,65
684,"Alright, that's lunch.  Great work everyone.",1.2905405405405406,0.0481820435388414,148,115,23,10,False,True,44
684,I’m happy that a candidate is finally seeking the support of actual deplorables!,1.2905405405405406,0.0481820435388414,148,115,23,10,False,True,80
684,"Do I have a consensual tweet, grunt, growl and/or galactic hiss on his 'out of cage' privileges?",1.2905405405405406,0.0472184355545753,148,114,25,9,True,True,96
684,I think its time to address the intern in the room.,1.2905405405405406,0.0442017495824529,148,111,31,6,False,True,51
684,"So, Deke is going to inherit the earth.",1.2905405405405406,0.045229673108559,148,112,29,7,False,True,39
684,Let's face it. We're aren't FAKE NEWS anymore!,1.2905405405405406,0.0462347487596109,148,113,27,8,False,True,46
684,People like him used to sit in all your seats.,1.2905405405405406,0.0442017495824529,148,111,31,6,False,True,46
684,Who ordered the human with dressing?,1.2905405405405406,0.0481820435388414,148,115,23,10,True,True,36
684,"All those opposed to draining the swamp, signify by raising whatever.""",1.2905405405405406,0.045229673108559,148,112,29,7,False,False,70
684,Faculty meeting after long day at school,1.2905405405405406,0.0481820435388414,148,115,23,10,False,False,40
684,"Meet Jason, our new diversity consultant.",1.2905405405405406,0.045229673108559,148,112,29,7,False,True,41
684,"Everybody, Dinner. Dinner, everybody.",1.2905405405405406,0.0442017495824529,148,111,31,6,False,True,37
684,"Dave, our apologies but the condo board decided you would just be too evolved for the building.",1.2905405405405406,0.0462347487596109,148,113,27,8,False,True,95
684,What I actually said was 'Fred  IS lunch'...,1.2905405405405406,0.0442017495824529,148,111,31,6,False,True,44
684,Give Bob your lunch orders.,1.2905405405405406,0.0431493453344618,148,110,33,5,False,True,27
684,Bob has been elected to join the Foreign Intelligence Committee. Let’s do our best to make sure he doesn’t feel alienated.,1.2905405405405406,0.0472184355545753,148,114,25,9,False,True,122
684,Gary from HR is here to talk about appropriate workplace conduct.,1.2905405405405406,0.0442017495824529,148,111,31,6,False,True,65
684,"And now, we have a representative from the “Human” race. Please, don’t eat him.",1.2905405405405406,0.0462347487596109,148,113,27,8,False,True,79
684,"I know, but he was much easier to train than the monkey",1.2905405405405406,0.0442017495824529,148,111,31,6,False,False,55
684,"Meet Bob Smith, our new diversity consultant.",1.2905405405405406,0.0442017495824529,148,111,31,6,False,True,45
684,This is Jerry from Human Resources,1.2905405405405406,0.0481820435388414,148,115,23,10,False,False,34
684,"Bob here is our new Head of Sales! Or lunch, if that doesn't work out.
Peter Dolch, Chappaqua, NY",1.2905405405405406,0.0472184355545753,148,114,25,9,False,False,97
684,"Aliens say hi to bob, the feast will begin shortly, so start saying by to bob",1.2905405405405406,0.045229673108559,148,111,29,7,False,False,77
684,"Hideous creatures of the universe, I have found the vilest of us all. He's a lawyer.",1.2905405405405406,0.0481820435388414,148,115,23,10,False,True,84
684,Todd's here to help us imagine more realistic nightmares.,1.2905405405405406,0.0431493453344618,148,110,33,5,False,True,57
684,"You'll be happy to know, tech support has arrived.",1.2885906040268456,0.0469409805127516,149,115,25,9,False,True,50
684,"Well fellows ... this is what my mother would have called a ""motley crew!""",1.2882882882882882,0.0533671893780341,111,85,20,6,False,False,74
684,"Everyone, meet Keith.  He’s our diversity hire.",1.2881355932203389,0.0512083383629915,118,90,22,6,False,True,47
684,"Sorry House committees, Trump is running late.",1.2876712328767124,0.0434233089589416,146,109,32,5,False,True,46
684,"Gentlemen please meet Irwin, our lunch.",1.2876712328767124,0.0444978322194829,146,110,30,6,False,True,39
684,Jim will be joining us because the company feels he'll be delicious.,1.2876712328767124,0.0444978322194829,146,110,30,6,False,True,68
684,"He didn't get the ""clothing optional Fridays"" memo.",1.2876712328767124,0.0444978322194829,146,110,30,6,False,True,51
684,Wow! Who dressed YOU today?,1.2876712328767124,0.0465725637560611,146,112,26,8,True,True,27
684,"And now for the scariest one of all, please welcome our attorney.",1.2876712328767124,0.0475760129277553,146,113,24,9,False,True,65
684,This is Bob; he'll be leading our transition management team.,1.2876712328767124,0.0434233089589416,146,109,32,5,False,True,61
684,"He may be a white male, but he's Our White Male.",1.2876712328767124,0.0434233089589416,146,109,32,5,False,True,48
684,Who invited the weird-o?,1.2876712328767124,0.0465725637560611,146,112,26,8,True,True,24
684,We're sorry but you're a little too creepy for this group.,1.2876712328767124,0.0444978322194829,146,110,30,6,False,True,58
684,Are we all going to just ignore the 167 pound human in the room?,1.2876712328767124,0.042321512846945,146,108,34,4,True,True,64
684,No worries!  Area 52 is three doors down on the left.,1.2876712328767124,0.0465725637560611,146,112,26,8,False,True,53
684,And to expand our diversity training . . .,1.2876712328767124,0.0465725637560611,146,112,26,8,False,True,42
684,"This is Bert, our new affirmative action hire.",1.2876712328767124,0.0434233089589416,146,109,32,5,False,True,46
684,Who invited this monster?,1.2876712328767124,0.0455470128935237,146,111,28,7,True,True,25
684,"Look, here comes lunch.",1.2876712328767124,0.0444978322194829,146,110,30,6,False,True,23
684,"Now, when we bring in the cable news cameras, it is essential that you express your adulation effusively.",1.2876712328767124,0.0434233089589416,146,109,32,5,False,True,105
684,"I promise, we're just PRETENDING to drain the swamp.",1.2876712328767124,0.0475760129277553,146,113,24,9,False,True,52
684,Allow me to introduce our new employee who helps us meet our Homo sapiens quota.,1.2876712328767124,0.042321512846945,146,108,34,4,False,True,80
684,Pat's preferred pronoun is They.,1.2876712328767124,0.0444978322194829,146,110,30,6,False,True,32
684,It’s time our company branches out and opens its doors to the white man.,1.2876712328767124,0.0475760129277553,146,113,24,9,False,True,72
684,"This is our latest prototype, just in time for the 2020 elections.",1.2857142857142858,0.0442373955203808,147,111,30,6,False,True,66
684,He’s the only one qualified for Human Resources.,1.2857142857142858,0.045278417844953,147,112,28,7,False,True,48
684,It's ok! He's here legally.,1.2857142857142858,0.0462960374401278,147,113,26,8,False,True,27
684,This is our year to win!,1.2857142857142858,0.0420781563545208,147,109,34,4,False,True,24
684,You have a problem with the appetizer?,1.2857142857142858,0.0420781563545208,147,109,34,4,True,True,38
684,We've agreed not to eat or drink any part of the intern until he's read the minutes from our last meeting.,1.2857142857142858,0.0420781563545208,147,109,34,4,False,True,106
684,"Grezelzip has informed me that he has decided to identify as 'human'.""",1.2857142857142858,0.0472917650629924,147,114,24,9,False,False,70
684,"It's that time of year again. 
Max is here will be explaining your new insurance options.",1.2857142857142858,0.0472917650629924,147,114,24,9,False,True,89
684,"I'd like you to welcome, Brad.  His species went extinct on a planet he calls ""Earth"".",1.2857142857142858,0.0472917650629924,147,114,24,9,False,True,86
684,Who let this weirdo in?,1.2857142857142858,0.0431712775153928,147,110,32,5,True,True,23
684,"Hey, who’s the freak in the suit?",1.2857142857142858,0.0431712775153928,147,110,32,5,True,True,33
684,"We're getting a lot of criticism for a lack of diversity on our board, so we hired a white, middle-aged man.",1.2857142857142858,0.0462960374401278,147,113,26,8,False,True,108
684,"Ted's here to join us for lunch""",1.2857142857142858,0.045278417844953,147,112,28,7,False,False,32
684,Well. This is embarrassing.,1.2857142857142858,0.0431712775153928,147,110,32,5,False,True,27
684,Nightmares are up 20% this quarter.,1.2857142857142858,0.0462960374401278,147,116,22,9,False,True,35
684,I see the diversity training is coming along nicely.,1.2857142857142858,0.045278417844953,147,112,28,7,False,True,52
684,"Everyone, welcome our new diversity hire, Reggie.",1.2857142857142858,0.0409558699343568,147,108,36,3,False,True,49
684,Look intimidating. His worst nightmare is a pointless meeting.,1.2857142857142858,0.0482669555999632,147,115,22,10,False,True,62
684,"He’s a Rhodes Scholar, got his law degree from Harvard and has a PhD in Public Policy. I also understand he’ll be quite delicious.",1.2857142857142858,0.0431712775153928,147,110,32,5,False,True,130
684,He's probably harmless. Just don't make eye contact.,1.2857142857142858,0.0472917650629924,147,114,24,9,False,True,52
684,"This is Barry, our new immigration lawyer.",1.2857142857142858,0.0420781563545208,147,109,34,4,False,True,42
684,"Just remember, four legs good, two legs . . .",1.2857142857142858,0.045278417844953,147,112,28,7,False,True,45
684,"This is Noah to my left, who will be detailing the travel arrangements.",1.2857142857142858,0.045278417844953,147,112,28,7,False,True,71
684,Another one from HR?,1.2857142857142858,0.0442373955203808,147,111,30,6,True,True,20
684,Is anybody going to eat this last one?,1.2857142857142858,0.0472917650629924,147,114,24,9,True,True,38
684,"This is our new hire, hu-man.",1.2857142857142858,0.045278417844953,147,112,28,7,False,True,29
684,"Don't worry, guys. He's a monster alright.",1.2857142857142858,0.0409558699343568,147,108,36,3,False,True,42
684,"Here at MONSTER, Inc. we are committed to diversity.",1.2847222222222223,0.0437011403764974,144,108,31,5,False,True,52
684,Ralph suggests yellow chiffon,1.2844827586206895,0.0516678854533469,116,89,21,6,False,False,29
684,Jim will oversee the next phase of our diversity outreach.,1.2844827586206895,0.0530989211255882,116,90,19,7,False,True,58
684,"Welcome to the 80th annual 'How to Trick not Treat', conference!",1.2844827586206895,0.0471147033820271,116,86,27,3,False,True,64
684,"I'd like to introduce Bob, who is either a new intern or brunch.",1.283687943262411,0.0394057185183893,141,102,38,1,False,True,64
684,"Gentleman, this is our new image consultant James, who made Bernie Madoff  almost seem human.",1.283687943262411,0.0464834743485558,141,108,26,7,False,True,93
684,"Mr. Dershowitz, here, believes that we may be able to use Lawrence v. Texas to finally come out of the closet...",1.283687943262411,0.0453805714476925,141,107,28,6,False,True,112
684,Let's take a break....I see lunch has arrived.,1.283687943262411,0.0430901615189789,141,105,32,4,False,True,46
684,We have one year to run those Facebook ads and win this thing!,1.283687943262411,0.0486142739604355,141,110,22,9,False,True,62
684,"Meet our inclusion and diversity officer.""",1.283687943262411,0.0475608085518587,141,109,24,8,False,False,42
684,"So, that's the final decision.  We will all get behind the mammal.",1.283687943262411,0.0453805714476925,141,107,28,6,False,True,66
684,I call the first meeting of ex-cabinet members to order!,1.283687943262411,0.0464834743485558,141,110,23,8,False,True,56
684,"Please welcome Ned, he's here to liven up the meeting.",1.283687943262411,0.0464834743485558,141,108,26,7,False,True,54
684,Meet Bob. Our new Head of Diversity.,1.283687943262411,0.0464834743485558,141,108,26,7,False,True,36
684,"Welcome to the Committee, Frank. Ork will show you where the wild things are.",1.283687943262411,0.0453805714476925,141,107,28,6,False,True,77
684,"No it's cool guys, he's a politician",1.283687943262411,0.0442501880484751,141,106,30,5,False,False,36
684,Jim’s a debt collector. He’s here to help with your scare tactics.,1.283687943262411,0.0496453900709219,141,111,20,10,False,True,66
684,You guys remember Mikey? He was that scary monster over our beds all those years ago.,1.283687943262411,0.0475608085518587,141,109,24,8,True,True,85
684,"Ah, I see lunch has just arrived.",1.283687943262411,0.0464834743485558,141,108,26,7,False,True,33
684,"Bob, recognizing his inexcusable omission, tried to explain the absence of donuts.",1.283687943262411,0.0464834743485558,141,108,26,7,False,True,82
684,There's one in every crowd!,1.283687943262411,0.0418980297524593,141,104,34,3,False,True,27
684,The guy from planet Omega was even uglier.,1.283687943262411,0.0430901615189789,141,105,32,4,False,True,42
684,"Remember, we’re government contractors.",1.283687943262411,0.0475608085518587,141,109,24,8,False,True,39
684,"Gentlemen, we have achieved Diversity.”",1.283687943262411,0.0442501880484751,141,106,30,5,False,False,39
684,Ok boomer.,1.283687943262411,0.0464834743485558,141,108,26,7,False,True,10
684,"This is our new colleague. I expect that you will make him feel welcome, even though he is a monster.",1.283687943262411,0.0486142739604355,141,110,22,9,False,True,101
684,"But guys, think how he'll up our diversity profile!",1.283687943262411,0.0453805714476925,141,107,28,6,False,True,51
684,I think Monsters & Steve Inc. has a nice ring to it.,1.283687943262411,0.0486142739604355,141,110,22,9,False,True,52
684,We’re going to build a wall.,1.283687943262411,0.0430901615189789,141,105,32,4,False,True,28
684,It's time we all addressed the elephant in the room.,1.283687943262411,0.0464834743485558,141,108,26,7,False,True,52
684,"Folks, meet the new star of our latest horror film!",1.283687943262411,0.0442501880484751,141,109,26,6,False,True,51
684,"All in favor, say ‘Grvbbzzztklks.’",1.283687943262411,0.0464834743485558,141,108,26,7,False,False,34
684,"He might not be much to look at, but his work is out of this world.",1.283687943262411,0.0464834743485558,141,108,26,7,False,True,67
684,"Take your ""Human to Work Day""",1.283687943262411,0.0475608085518587,141,109,24,8,False,False,29
684,Now Cosgrove here will walk us through the empathy phase.,1.283687943262411,0.0475608085518587,141,109,24,8,False,True,57
684,"Uh oh, here comes Doug. Be nice. He’s sensitive about his appearance.",1.283687943262411,0.0453805714476925,141,107,28,6,False,True,69
684,I see you all got the message to come as you are.,1.283687943262411,0.0453805714476925,141,107,28,6,False,True,49
684,Does anyone have questions for Phil about our health care plan?,1.283687943262411,0.0475608085518587,141,109,24,8,True,True,63
684,Well I say it’s time we relaxed the no coat rule,1.283687943262411,0.0453805714476925,141,107,28,6,False,False,48
684,Please meet today's menu option.,1.283687943262411,0.0442501880484751,141,106,30,5,False,True,32
684,"Welcome to the meeting for nightmares. This is Ben, the IRS agent.",1.283687943262411,0.0475608085518587,141,109,24,8,False,True,66
684,Everyone meet Greg...he’ll be leading our new Human Resources department,1.283687943262411,0.0453805714476925,141,107,28,6,False,False,72
684,Dave here has just been hired to address the lack of diversity on our team. I'm sure we will benefit by his views as a male.,1.283687943262411,0.0453805714476925,141,107,28,6,False,True,124
684,I get it! Dino's dressed up as a human being for Halloween!,1.283687943262411,0.0475608085518587,141,109,24,8,False,True,59
684,"And now, your final test for inherent bias.",1.283687943262411,0.0475608085518587,141,109,24,8,False,True,43
684,"All those in favor of eating Alfred, say aye""",1.283687943262411,0.0486142739604355,141,110,22,9,False,False,45
684,Stop drooling. He's not organic.,1.283687943262411,0.0453805714476925,141,107,28,6,False,True,32
684,"George here is in marketing, obviously.",1.283687943262411,0.0442501880484751,141,108,27,6,False,True,39
684,Voting to decide Herb's admission to the Odd Fellow's Club.,1.283687943262411,0.0448189435799447,141,108,27,6,False,True,59
684,Is he the new diversity hire?,1.283687943262411,0.0453805714476925,141,107,28,6,True,True,29
684,I think we all know what a great job Ed has done as Vice President for Diversity.,1.283687943262411,0.0453805714476925,141,107,28,6,False,True,81
684,"Bad news, team. They drained our swamp.",1.283687943262411,0.0442501880484751,141,106,30,5,False,True,39
684,Upper management here has long-been committed to diversity.,1.283687943262411,0.0442501880484751,141,106,30,5,False,True,59
684,Look at the nose on this guy!,1.2833333333333334,0.0504646940028668,120,92,22,6,False,True,29
684,So The first step in our new on boarding policy is for each of us to share our Myers Briggs type.,1.2831858407079646,0.0540242526259059,113,88,18,7,False,True,97
684,Here's Richard from 23 and Me to go over the geneology results.,1.2831858407079646,0.0540242526259059,113,88,18,7,False,True,63
684,Our test group is not satisfied with new design of your chairs.,1.282758620689655,0.0476491892601704,145,113,23,9,False,True,63
684,Please offer a biped-friendly seat to our guest and state your pronouns.,1.282758620689655,0.0486439171712617,145,114,21,10,False,True,72
684,I thought a middle-aged white guy might help diversify the board.,1.282758620689655,0.043443106181527,145,109,31,5,False,True,65
684,"In the grand scheme of things, we're all God's children.",1.2826086956521738,0.0564224199975994,92,70,18,4,False,True,56
684,"So we’re clear! We put all humans, except Dick here, in terrariums.",1.2818181818181815,0.0518736808276143,110,84,21,5,False,True,67
684,"Well, Horace. Maybe if you didn't take so much time tying the perfect Windsor knot, there would be place for you to sit.",1.2818181818181815,0.0579491281054039,110,88,13,9,False,True,120
684,And this is Steve from The Diversity & Inclusion program.,1.2816901408450705,0.0472669243758879,142,110,24,8,False,True,57
684,"I will now turn it over to Bob, who will talk about the new company-wide dress code.",1.2808988764044944,0.0597679459737431,89,69,15,5,False,True,84
684,The test results on the new drug we slipped into the last meeting's water are in,1.2805755395683454,0.0479251242567425,139,108,23,8,False,False,80
684,This is Ted. He'll be our lunch today.,1.2805755395683454,0.0468247063041393,139,107,25,7,False,True,38
684,Bob has a different take on our complete world domination strategy.,1.2805755395683454,0.0445423875803518,139,105,29,5,False,True,67
684,I hired them on Monster.com,1.2805755395683454,0.0479251242567425,139,108,23,8,False,False,27
684,'The judge wants to know if you've reached a decision'.,1.2805755395683454,0.0445423875803518,139,105,29,5,False,True,55
684,He always hits Reply All.,1.2805755395683454,0.0445423875803518,139,105,29,5,False,True,25
684,Let's everyone welcome my new lead attorney to our White House anti-impeachment war room.,1.2805755395683454,0.0445423875803518,139,105,29,5,False,True,89
684,This is our new intern Raj.  Please don't eat him.,1.2805755395683454,0.0421366285106871,139,103,33,3,False,True,50
684,"Yes, at this morning's meeting, we have one very weird looking guest.",1.2805755395683454,0.0479251242567425,139,108,23,8,False,True,69
684,Thank you all for agreeing to serve. This is by far the most competent Cabinet assembled over the last 3 years.,1.2805755395683454,0.0468247063041393,139,107,25,7,False,True,111
684,This earthling is a fine specific for the prehistoric alien doll,1.2805755395683454,0.0456977976046285,139,106,27,6,False,False,64
684,I second the motion to eat the pizza looking dude.,1.2805755395683454,0.0415134105437026,139,105,30,4,False,True,50
684,Yes he’s edible.  More importantly he’s my new assistant.,1.2805755395683454,0.049000836213064,139,109,21,9,False,True,57
684,And now a word from our Diversity Officer.,1.2805755395683454,0.0421366285106871,139,103,33,3,False,True,42
684,Our appetizer this evening is Neil.,1.2805755395683454,0.0456977976046285,139,106,27,6,False,True,35
684,"Watch it!  Here comes one, now.",1.2805755395683454,0.0382452901490068,139,100,39,0,False,True,31
684,I'd like to call the diversity committee to order.,1.2805755395683454,0.0433561976746458,139,104,31,4,False,True,50
684,"Greetings, fellow mutants!",1.2805755395683454,0.0445423875803518,139,105,29,5,False,True,26
684,I think we can assure Human Resources that we will not again celebrate our success by eating our Diversity Officer.,1.2805755395683454,0.0468247063041393,139,107,25,7,False,True,115
684,"Gross, he's wearing a tie!",1.2805755395683454,0.0433561976746458,139,104,31,4,False,True,26
684,Forget about where the wild things are - let's focus on where the wild things lunch.,1.2805755395683454,0.0456977976046285,139,106,27,6,False,True,84
684,"This is Arnold.  He's part of our diversity initiative.""  --Gerard Black Laurelton, New Yor",1.2805755395683454,0.0433561976746458,139,104,31,4,False,False,91
684,"So we've hired Marv, here, to be the new fresh face of the company.",1.2805755395683454,0.0408806928475086,139,104,31,3,False,True,67
684,Hard to remember that far back but  before B school I’m pretty sure I looked like him too,1.2805755395683454,0.0468247063041393,139,107,25,7,False,False,89
684,Seems Mr. Butterworth was the only chap who didn't take those funny little candies my teenage son offered us.,1.2805755395683454,0.0468247063041393,139,107,25,7,False,True,109
684,"Don't worry, he doesn't understand a word we're saying",1.2805755395683454,0.0468247063041393,139,107,25,7,False,False,54
684,All in favor of this affirmative action admission please raise your appendage.,1.2805755395683454,0.0433561976746458,139,106,28,5,False,True,78
684,Each of us would like a slice of Impeachment Pie... and a box of wine.,1.2805755395683454,0.0456977976046285,139,106,27,6,False,True,70
684,So this is the White House Zoo,1.2805755395683454,0.0468247063041393,139,107,25,7,False,False,30
684,And now for a real scare; Gary from accounting has some news.,1.2805755395683454,0.0456977976046285,139,106,27,6,False,True,61
684,"He may not look like a monster, but you should see him when the wifi is slow",1.2805755395683454,0.0479251242567425,139,108,23,8,False,False,76
684,"And for you, Gwendoline, there’s Tofu a la Grecque.",1.2805755395683454,0.0479251242567425,139,108,23,8,False,True,51
684,So is the Board serious about our diversity mission statement?,1.2805755395683454,0.0421366285106871,139,103,33,3,True,True,62
684,All in favor of Dennis Kucinich as 2024 US President say 'aye'.,1.2805755395683454,0.0479251242567425,139,108,23,8,False,True,63
684,He looks harmless enough,1.2805755395683454,0.0421366285106871,139,103,33,3,False,False,24
684,He says we should wear suits so we blend in.,1.2805755395683454,0.0445423875803518,139,105,29,5,False,True,44
684,"I'll let Bob explain the science, but the good news is devolution is happening.  And it's happening now.",1.2805755395683454,0.0456977976046285,139,106,27,6,False,True,104
684,We need to reach the Human market.,1.2805755395683454,0.0408806928475086,139,102,35,2,False,True,34
684,"He may look harmless, but he’s got a sharp tongue",1.2805755395683454,0.0445423875803518,139,105,29,5,False,False,49
684,"I know $50,000 a month sounds like a lot for a board member, but it's worth it if you consider he knows nothing about our planet or our business.",1.2805755395683454,0.0479251242567425,139,108,23,8,False,True,145
684,I don't care what the law says. We shouldn't have to admit anyone to our club that doesn't look like us!,1.2805755395683454,0.0456977976046285,139,106,27,6,False,True,104
684,I've called you all here today to discuss the climate crisis.,1.2805755395683454,0.0468247063041393,139,107,25,7,False,True,61
684,"Hi Everyone, this is Benny from accounting who is going to tutor us on how to use macros in Excel.",1.2805755395683454,0.0445423875803518,139,105,29,5,False,True,98
684,"Once again, scaremonger of the month goes to algebra guy.",1.2805755395683454,0.0445423875803518,139,105,29,5,False,True,57
684,"Good news, everyone! My son Jerry's brought over one his Democrat friends again!",1.2805755395683454,0.0445423875803518,139,105,29,5,False,True,80
684,I suggest we adjourn for lunch.,1.2805755395683454,0.0468247063041393,139,107,25,7,False,True,31
684,And the NEW float for the Macy's Thanksgiving Day Parade is Leonard the Accountant!!,1.2805755395683454,0.049000836213064,139,109,21,9,False,True,84
684,"If our new board member would kindly remove his clothes, we can begin.",1.2805755395683454,0.0468247063041393,139,107,25,7,False,True,70
684,"Area 51 humor; ""A priest, a rabbi, and an imam walk into a spaceship.""",1.280373831775701,0.0527741977188775,107,82,20,5,False,False,70
684,I hear that new guy's a real monster.,1.2785714285714285,0.0454144522261668,140,107,27,6,False,True,37
