contest,caption,mean,precision,votes,not_funny,somewhat_funny,funny,has_question_mark,ends_with_punctuation,caption_length
844,No need to worry.  I've done this procedure many times.,1.2644628099173554,0.0480595862954819,121,94,22,5,False,True,55
844,"You say you feel nervous, but I think it's just the wine talking.",1.264367816091954,0.0577113403163306,87,68,15,4,False,True,65
844,This won’t involve any bottle-y fluids!,1.264367816091954,0.0502859242932008,87,65,21,1,False,True,39
844,"A bottle in front of me, or a frontal lobotomy?",1.264367816091954,0.0553470016780077,87,67,17,3,True,True,47
844,This is just to help you breathe.,1.2641509433962264,0.0506948781682949,106,82,20,4,False,True,33
844,This is the best and only way to check your legs.,1.2641509433962264,0.0524372500405525,106,83,18,5,False,True,49
844,It's just a part of the aging process!,1.2641509433962264,0.0450653649108356,106,79,26,1,False,True,38
844,"Don't worry, sampling a little fluid will still leave you full bodied.",1.2641509433962264,0.0506948781682949,106,82,20,4,False,True,70
844,"Don't worry, this will all be over right after dinner.",1.264,0.0534536277775479,125,102,13,10,False,True,54
844,I have good news and bad news...,1.2637362637362637,0.04900764893868,91,68,22,1,False,True,32
844,Don't worry about the copay.  You've aged into Medicare.,1.2636363636363637,0.0511376378304785,110,86,19,5,False,True,56
844,The chart says your have aged enough.,1.2636363636363637,0.0511376378304785,110,86,19,5,False,True,37
844,You'll seem much better after you've been allowed to breathe for an hour.,1.2635658914728682,0.0447313522774565,129,99,26,4,False,True,73
844,"Don't be afraid. If you can relax after a little prick and a gentle twist, you'll soon breathe better and fulfill your purpose in life.",1.2635658914728682,0.0498536859279324,129,103,18,8,False,True,135
844,"Don't worry, I just need to get your white and red counts.",1.2635658914728682,0.0486237181794355,129,102,20,7,False,True,58
844,Relax! You just need to breathe.,1.263157894736842,0.0522945536311624,95,73,19,3,False,True,32
844,"Unfortunately, the ""Rabbit"" is not covered by your insurance.",1.263157894736842,0.0583661960100448,95,76,13,6,False,True,61
844,Close your eyes.,1.263157894736842,0.0514539896772854,114,90,18,6,False,True,16
844,You're my last patient of the day!,1.263157894736842,0.0499225165490003,114,89,20,5,False,True,34
844,We need to open you before you go sour.,1.263157894736842,0.046709173278225,114,87,24,3,False,True,39
844,After a tiny prick you will feel a great release of pressure and a long awaited outpouring of joy.,1.263157894736842,0.0543937910539062,95,74,17,4,False,True,98
844,At least you won't have to bend over.,1.263157894736842,0.0450165688742519,114,86,26,2,False,True,37
844,"Ah, is it somebody’s first colonoscorkpy",1.263157894736842,0.0514539896772854,114,90,18,6,False,False,40
844,I've got just the thing to relieve that tension headache.,1.2627118644067796,0.0530511413513507,118,95,15,8,False,True,57
844,It's just a routine procedure. I do it every evening.,1.2626262626262623,0.0529209836100786,99,77,18,4,False,True,53
844,You'll hear a pop and it will all be over.,1.2626262626262623,0.0584727260876041,99,80,12,7,False,True,42
844,"On the other hand, getting older does have some advantages.",1.2626262626262623,0.0509361113844813,99,76,20,3,False,True,59
844,"Don’t worry, I’ll pull it out before anything happens.",1.2622950819672132,0.0491125396521135,122,96,20,6,False,True,54
844,Just close your eyes and think of Napa Valley.,1.2621359223300972,0.0515533783403437,103,80,19,4,False,True,46
844,I've got something to help with your breathing.,1.2621359223300972,0.0477180888144474,103,78,23,2,False,True,47
844,It's your alcohol level that I'm actually most concerned about.,1.2621359223300972,0.0515533783403437,103,80,19,4,False,True,63
844,"Of course you're screwed by your medical insurance, but there's no reason to whine about it.",1.2621359223300972,0.0551224603632833,103,82,15,6,False,True,92
844,Don't Worry... You Will Not Feel A Thing.,1.2621359223300972,0.0568229975063029,103,83,13,7,False,True,41
844,"Tried Ex-Lax? This is way better! 
Lean over, please.",1.2621359223300972,0.0515533783403437,103,80,19,4,True,True,53
844,I'm a pulmonologist and I'm here to help you breathe.,1.261904761904762,0.0564768028960631,84,65,16,3,False,True,53
844,"Here, Let me help you uncork your potential",1.261904761904762,0.0453257296544411,126,97,25,4,False,False,43
844,"The last time you were here, you were just a bottle of water. Did you get religion?",1.261904761904762,0.050619741965403,126,101,17,8,True,True,83
844,Someone of your age and complexion - it's to be expected.,1.2616822429906542,0.0466407207564425,107,81,24,2,False,True,57
844,Peel your foil and cough for me please.,1.2616822429906542,0.0484942530196683,107,82,22,3,False,True,39
844,We're going to need to run a LOT of tests.,1.2615384615384615,0.0457545839273973,130,101,24,5,False,True,42
844,"Don’t worry, I practiced this procedure frequently in med school.",1.2615384615384615,0.0444322109059675,130,100,26,4,False,True,65
844,Just a routine drill and fill.,1.2613636363636365,0.0523589765937231,88,67,19,2,False,True,30
844,You might feel a little stick,1.2613636363636365,0.0593730704065671,88,70,13,5,False,False,29
844,Let's just say you're going to wish we hadn't aged you so long.,1.2613636363636365,0.0571308014091301,88,69,15,4,False,True,63
844,"Mr Pino, you had an excellent check up. Not too sweet. Not too dry. 
We just need to relieve a bit of pressure due to your aging process.",1.2613636363636365,0.0615336859724565,88,71,11,6,False,True,137
844,I'd like to keep you overnight for oxidation.,1.2612612612612613,0.0538626148600275,111,89,15,7,False,True,45
844,"I assure you, Mr. Merlot, this will be a smooth extraction.",1.2612612612612613,0.0507304736027501,111,87,19,5,False,True,59
844,"Trust me, it's a routine procedure.",1.2612612612612613,0.0490895181088505,111,86,21,4,False,True,35
844,"It won’t hurt.
Stop wining !",1.2612612612612613,0.0490895181088505,111,86,21,4,False,True,28
844,It's just so you can breath.,1.2612612612612613,0.0538626148600275,111,89,15,7,False,True,28
844,Let it decant a while before we jump into surgery,1.2612612612612613,0.0490895181088505,111,86,21,4,False,False,49
844,"I’m about to lose my license to legally practice medicine, but it’ll be worth it.",1.2612612612612613,0.0523199877270579,111,88,17,6,False,True,81
844,"Don't worry, you'll just feel a little pinch.",1.2611940298507462,0.0472912365756323,134,106,21,7,False,True,45
844,You need to open up more.,1.2608695652173914,0.050957307710706,92,70,20,2,False,True,25
844,The good news is that you are not a screw top.,1.2608695652173914,0.0463577382594072,115,88,24,3,False,True,46
844,Not all wines are meant to age.,1.2608695652173914,0.0463577382594072,115,88,24,3,False,True,31
844,I’m told you’re having trouble opening up.,1.2608695652173914,0.0485567262681928,92,69,22,1,False,True,42
844,You can't see the twist ending- it's a real corker.,1.2608695652173914,0.0479749434374281,115,89,22,4,False,True,51
844,"Come on now, act your age.",1.2608695652173914,0.0495393833138963,115,90,20,5,False,True,26
844,"Your insurance covers the procedure, but this hospital charges a corking fee ...which I'll waive for a patient of your refinement, Mr Bordeaux.",1.2608695652173914,0.0615719491759065,92,75,10,7,False,True,143
844,Don't worry I have the perfect procedure to help you breathe,1.2605042016806722,0.045385535911283,119,91,25,3,False,False,60
844,We'll just need to remove a little fluid from your chest cavity.,1.2604166666666667,0.0538939660446639,96,75,17,4,False,True,64
844,"Since you couldn’t fill the cup, this is our only option.",1.2604166666666667,0.0496584643821707,96,73,21,2,False,True,57
844,"Come on, live a little.",1.2601626016260163,0.0501063754125996,123,98,18,7,False,True,23
844,"We've received your test results, and I'm sorry to say, you're screwed.",1.2601626016260163,0.047371814556113,123,96,22,5,False,True,71
844,Don't Whine,1.26,0.0484507455822379,100,76,22,2,False,False,11
844,I swear I'll stop at one glass.,1.26,0.0504925236990086,100,77,20,3,False,True,31
844,"I know you're nervous, but in a few twists you'll be able to breathe.",1.26,0.0504925236990086,100,77,20,3,False,True,69
844,Depends how you define ‘invasive’.,1.26,0.0561743318211757,100,80,14,6,False,True,34
844,"Don't worry, just breathe.",1.26,0.0524548868220602,100,78,18,4,False,True,26
844,This won’t hurt a bit. Now bend over.,1.26,0.0561743318211757,100,80,14,6,False,True,37
844,"I feel like I'm passed my peak, Doc.""
""Nonsense, you're in your prime and that's reason to celebrate.",1.26,0.0561743318211757,100,80,14,6,False,True,101
844,"Don’t worry, it’s a simple procedure that should help you breathe.",1.26,0.0524548868220602,100,78,18,4,False,True,66
844,The prep is the worst part.,1.26,0.0484507455822379,100,76,22,2,False,True,27
844,Is this your first colonoscopy?,1.2596153846153846,0.0529121898375067,104,82,17,5,True,True,31
844,Now just lean forward and cough.,1.2596153846153846,0.0563303899167454,104,84,13,7,False,True,32
844,This is not going to hurt a bit.,1.2596153846153846,0.0546480222037949,104,83,15,6,False,True,32
844,"Congratulations, it’s graduation day.",1.2596153846153846,0.0546480222037949,104,83,15,6,False,True,37
844,Open wide and say ‘fwoomp.’,1.2596153846153846,0.0529121898375067,104,82,17,5,False,False,27
844,"So, I hear that you're having trouble breathing.",1.2596153846153846,0.0492573531427353,104,80,21,3,False,True,48
844,I promise I won't screw you!,1.2596153846153846,0.0511174464934844,104,81,19,4,False,True,28
844,It's a simple procedure and then you can breathe.,1.2596153846153846,0.0511174464934844,104,81,19,4,False,True,49
844,"So, you have trouble breathing.",1.2592592592592593,0.0602919281337026,81,64,13,4,False,True,31
844,Nervous? I've got just the thing to open You up!,1.2592592592592593,0.0462703284735766,108,82,24,2,True,True,48
844,Let me pick your brain for a minute...,1.2592592592592593,0.0515766817140973,108,85,18,5,False,True,38
844,The gold standard is to check your terroir.,1.2592592592592593,0.0602919281337026,81,64,13,4,False,True,43
844,Your terroir is good. I'll let you breathe for a while and  then I'll check your nose.,1.2589285714285714,0.0452817856149227,112,85,25,2,False,True,86
844,Unfortunately your insurance didn't cover the screw top transplant.,1.2589285714285714,0.0487051376163351,112,87,21,4,False,True,67
844,"Indeed, you are a serious wine, though I'm guessing at this point you'd rather be a screw-off.",1.2589285714285714,0.0503295697488197,112,88,19,5,False,True,94
844,The procedure actually has a very high success rate for individuals of your vintage.,1.2589285714285714,0.0519031863374154,112,89,17,6,False,True,84
844,All men your age need this procedure.,1.2589285714285714,0.0503295697488197,112,88,19,5,False,True,37
844,"Hey, it’s five o’clock somewhere",1.2589285714285714,0.0487051376163351,112,87,21,4,False,False,32
844,This procedure will really open up the 'real' you!,1.2589285714285714,0.0519031863374154,112,89,17,6,False,True,50
844,…but the good news is it’s covered by your insurance plan!,1.2589285714285714,0.0487051376163351,112,87,21,4,False,True,58
844,"Well, it's sort of like a colonoscopy endoscope ... but with a twist.",1.258823529411765,0.0583453957351663,85,67,14,4,False,True,69
844,"I'm afraid I have some bad news... I'm an oenologist, not an oncologist.",1.258823529411765,0.0629635552770729,85,69,10,6,False,True,72
844,This will only hurt for a minute but you're going to make a lot of people happy.,1.2586206896551724,0.0506637941557551,116,92,18,6,False,True,80
844,"Don’t worry, I’ll feel better when it’s over!",1.2586206896551724,0.0535412935333024,116,94,14,8,False,True,45
844,This will only be a small prick.,1.2584269662921348,0.0587755766325466,89,71,13,5,False,True,32
844,I can make it so any wine in the world has a good nose.,1.2584269662921348,0.0542571947179543,89,69,17,3,False,True,55
844,You have a fine cork to be screwed & it won't hurt a bit.,1.2583333333333333,0.0480660046497299,120,94,21,5,False,True,57
844,You're gonna blow your cork when you hear this idea.,1.2583333333333333,0.0495014830625995,120,95,19,6,False,True,52
844,"Just a quick pinch, then relief!",1.2580645161290325,0.0549197761779837,93,73,16,4,False,True,32
844,You seem bottled up. Fear not. Relief is possible.,1.2580645161290325,0.0497449141454479,124,99,18,7,False,True,50
844,"Don’t worry about size, you can self-anesthetize.",1.2580645161290325,0.0504843900037096,93,71,20,2,False,True,49
844,This might hurt.,1.2580645161290325,0.0504843900037096,93,71,20,2,False,True,16
844,"Don’t worry, this has become a routine procedure for me.",1.2580645161290325,0.0497449141454479,124,99,18,7,False,True,56
844,It’s just a minor extraction.,1.2580645161290325,0.0549197761779837,93,73,16,4,False,True,29
844,A little something to numb the pain…,1.2580645161290325,0.0549197761779837,93,73,16,4,False,False,36
844,"At your age,it really would be best to open up",1.2580645161290325,0.0504843900037096,93,71,20,2,False,False,46
844,im gonna screw you,1.2580645161290325,0.048408946898032,124,98,20,6,False,False,18
844,You are going to put that where?,1.2580645161290325,0.0549197761779837,93,73,16,4,True,True,32
844,It is a minimally invasive proceedure.,1.2577319587628866,0.0534029906114091,97,76,17,4,False,True,38
844,Spit it out or else.,1.2577319587628866,0.0553773964587055,97,77,15,5,False,True,20
844,I’m afraid your test results showed notes of vanilla…,1.2577319587628866,0.0553773964587055,97,77,15,5,False,False,53
844,"I'm afraid I have some bad news for you, but some very GOOD news for the monthly hospital board meeting...",1.2574257425742574,0.0574257425742574,101,82,12,7,False,True,106
844,We made need a pair of lips to control the bleeding.,1.2574257425742574,0.0459303505138344,101,76,24,1,False,True,52
844,"Don't be a whiner, it will just be a little pinch!",1.2574257425742574,0.0500563352861962,101,78,20,3,False,True,50
844,"Let's help you breathe then, shall we?",1.2574257425742574,0.0519966970514886,101,79,18,4,True,True,38
844,You have a $15 corkage copay.,1.2574257425742574,0.0519966970514886,101,79,18,4,False,True,29
844,We'll have that out in no time!,1.2574257425742574,0.0500563352861962,101,78,20,3,False,True,31
844,Let’s talk about your deductible.,1.2574257425742574,0.0538672099355859,101,80,16,5,False,True,33
844,We can do this the easy way or the hard way.,1.2571428571428571,0.0506886123944844,105,82,19,4,False,True,44
844,The less aggressive option is to be boxed.,1.2571428571428571,0.0524641364136346,105,83,17,5,False,True,42
844,"Great news, the lab results confirmed that you'll pair nicely with my dinner.",1.256880733944954,0.0477201423068111,109,84,22,3,False,True,77
844,"Relax, we just need to air you out a bit!",1.256880733944954,0.0494682387708498,109,85,20,4,False,True,41
844,Let's just get rid of that nasty cork.,1.256880733944954,0.0559167712615799,109,89,12,8,False,True,38
844,You really do not want your life to slowly sip away.,1.256880733944954,0.0477201423068111,109,84,22,3,False,True,52
844,There's just one blockage to clear.,1.2566371681415929,0.0483265484792601,113,88,21,4,False,True,35
844,Just relax and bend over.,1.2566371681415929,0.0530050820827917,113,91,15,7,False,True,25
844,We just need to draw a little red stuff.,1.2566371681415929,0.0499347884827136,113,89,19,5,False,True,40
844,Just sit back and unwind.,1.2566371681415929,0.0530050820827917,113,91,15,7,False,True,25
844,I promise that you will breathe easier after this treatment.,1.2566371681415929,0.0466629132719252,113,87,23,3,False,True,60
844,I learned this procedure as a young medical student in France.,1.2564102564102564,0.0617102718703418,78,62,12,4,False,True,62
844,"Do you mind if I bring in some residents to observe? 
They've only ever opened screw tops.",1.2564102564102564,0.0502775177169253,117,93,18,6,True,True,90
844,"Don't worry, I am a connoisseur.",1.2564102564102564,0.0472557335687456,117,91,22,4,False,True,32
844,I think you'll be amused by my presumption.,1.256198347107438,0.050519240013558,121,97,17,7,False,True,43
844,No worries - I've done 100s of these procedures!,1.256198347107438,0.0477148982801343,121,95,21,5,False,True,48
844,Your old friend Box O'Wine had no complaints...,1.2560975609756098,0.0570555644212121,82,64,15,3,False,True,47
844,We're out...of merlot.,1.2560975609756098,0.0570555644212121,82,64,15,3,False,True,22
844,"Just trust me, you won't feel a thing",1.256,0.0480644728295972,125,99,20,6,False,False,37
844,Well it's good news! My next patient is a steak.,1.256,0.0480644728295972,125,99,20,6,False,True,48
844,"Smile!  It's a party, and you're invited.",1.256,0.0480644728295972,125,99,20,6,False,True,41
844,Don't worry. I'm here to help you breathe.,1.255813953488372,0.0577414552377767,86,68,14,4,False,True,42
844,You will feel a small pinch.,1.255813953488372,0.0577414552377767,86,68,14,4,False,True,28
844,"If you had a twist cap, the procedure would be completely noninvasive.",1.255813953488372,0.0501326462429786,86,65,20,1,False,True,70
844,No worries - just a jab and some pressure and we’ll get you breathing in no time.,1.255813953488372,0.0483234792239987,129,103,19,7,False,True,81
844,"We’ll just drain some excess liquid from your cranium, and you’ll be good as nouveau!",1.2555555555555555,0.0560031903654951,90,71,15,4,False,True,85
844,Just a little prick and all that pressure will be gone.,1.2555555555555555,0.0602970406519967,90,73,11,6,False,True,55
844,We're just going to take a little sample to prove to the police that your alcohol content is below the legal limit.,1.2555555555555555,0.0581897346724593,90,72,13,5,False,True,115
844,We’re just going to pop you into hospital and tidy up your insides”,1.2555555555555555,0.0581897346724593,90,72,13,5,False,False,67
844,"It’s just as bad on your part, you’re talking to a human❕",1.2555555555555555,0.0537277343741252,90,70,17,3,False,False,57
844,We'll have you breathing feely in no time.,1.25531914893617,0.052256714170322,94,73,18,3,False,True,42
844,It's a routine procedure,1.25531914893617,0.052256714170322,94,73,18,3,False,False,24
844,"Don't worry.  With current recycling laws, you'll be reincarnated in no time.",1.25531914893617,0.0564652581211586,94,75,14,5,False,True,77
844,"That smell? Oh, it's just a roast liver with some fava beans, why do you ask...?",1.25531914893617,0.0603811773113063,94,77,10,7,True,True,80
844,I will warn you after two glasses I become a total bitch.,1.25531914893617,0.0544016982757331,94,74,16,4,False,True,57
844,"This is going to hurt me, more than it’s going to hurt you.",1.25531914893617,0.0564652581211586,94,75,14,5,False,True,59
844,Your whining because you keep your emotions bottled up.,1.2551020408163265,0.0508940155459119,98,76,19,3,False,True,55
844,I wish you'd be more open with me.,1.2551020408163265,0.0508940155459119,98,76,19,3,False,True,34
844,"Now if you were under 10 bucks a bottle, 
I wouldn't have made you come in today.",1.2551020408163265,0.0548724675027206,98,78,15,5,False,True,81
844,I'm going to help you breathe a little.,1.2551020408163265,0.0508940155459119,98,76,19,3,False,True,39
844,"Nowadays, cork replacement is a lot more common than you’d think.",1.2551020408163265,0.0529206410969513,98,77,17,4,False,True,65
844,"It’s just a quick procedure and I promise, we’ll BOTH feel a lot better.",1.2551020408163265,0.0567572121017403,98,79,13,6,False,True,72
844,Turn your label and cough,1.2551020408163265,0.0487832694954194,98,75,21,2,False,False,25
844,"No need to worry, I do this procedure every afternoon at the club.",1.2549019607843137,0.051546223005715,102,80,18,4,False,True,66
844,This will definitely take care of the crick in your neck.,1.2549019607843137,0.0496273719371679,102,79,20,3,False,True,57
844,"You can trust me, I'm a mixologist.",1.2549019607843137,0.0455477982328477,102,77,24,1,False,True,35
844,Of course a corkendectomy is a real medical procedure.,1.2547169811320755,0.0502667113901763,106,83,19,4,False,True,54
844,"Oh yes, I have a great way to improve your breathing.",1.2547169811320755,0.05372272622101,106,85,15,6,False,True,53
844,It's a simple out-patient procedure...It will free up the tightness and help you breathe much more easily,1.2547169811320755,0.05372272622101,106,85,15,6,False,False,105
844,"Shaking in your sentiment, are you?",1.2547169811320755,0.0502667113901763,106,83,19,4,True,True,35
844,And you are going to put that WHERE?,1.2547169811320755,0.0484463389191187,106,82,21,3,True,True,36
844,This should only take a few seconds.,1.2547169811320755,0.0502667113901763,106,83,19,4,False,True,36
844,"No, no. That’s just the wine talking.",1.2547169811320755,0.0465548411590992,106,81,23,2,False,True,37
844,I take that back.  It IS kind of brain surgery for you.,1.2545454545454546,0.0507432064440892,110,87,18,5,False,True,55
844,It's the only way to tell if you've gone bad,1.2545454545454546,0.0473419650779496,110,85,22,3,False,False,44
844,We're having a little retirement party for Nurse Jenkins.,1.2545454545454546,0.0507432064440892,110,87,18,5,False,True,57
844,"Okay, it’s time for your corkotomy.",1.2545454545454546,0.0523610415444564,110,88,16,6,False,True,35
844,I promise you’ll be able to breathe better after the procedure contest,1.2545454545454546,0.0490720626103553,110,86,20,4,False,False,70
844,"You just need to breathe, Mr. Malbec.",1.2545454545454546,0.0523610415444564,110,88,16,6,False,True,37
844,A routine procedure to release the pressure.,1.2542372881355932,0.0498969540470499,118,94,18,6,False,True,44
844,This won't hurt...much.,1.2542372881355932,0.0453333471987319,118,91,24,3,False,True,23
844,I hope you're not a twist-top!,1.2542372881355932,0.0484235631849743,118,93,20,5,False,True,30
844,Give it 3 years and you should be fine!,1.2542372881355932,0.0513280680994096,118,95,16,7,False,True,39
844,Trust me. You won’t feel a thing.,1.2542372881355932,0.0437063818749226,118,90,26,2,False,True,33
844,Don't worry. This won't hurt as much as the bill.,1.2540983606557377,0.0459163949418894,122,95,23,4,False,True,49
844,"Not everything gets better with age, I’m afraid!",1.2540983606557377,0.0473687483615881,122,96,21,5,False,True,48
844,Colonoscopy. Why?,1.2531645569620251,0.0636148811953879,79,64,10,5,True,True,17
844,You're going to feel a little pinch.,1.2530120481927711,0.0564483476705805,83,65,15,3,False,True,36
844,Do you mind if we get started? I've got a 200 lb aged Gouda waiting for me next door.,1.2528735632183907,0.0571495943170743,87,69,14,4,True,True,85
844,It's a simple procedure that will help you breathe.,1.2527472527472527,0.0532082016349229,91,71,17,3,False,True,51
844,"Now, before we do this, I will have to do a blood test.",1.2526315789473683,0.0538930570846854,95,75,16,4,False,True,55
844,Just wait till you see your bill!,1.2526315789473683,0.0578998267130406,95,77,12,6,False,True,33
844,The good news is we don't need to use the stirrups.,1.2526315789473683,0.049563426742571,95,73,20,2,False,True,51
844,This shouldn’t hurt. You may experience a slight hangover.,1.2526315789473683,0.0598026261892704,95,78,10,7,False,True,58
844,"No worries, you have already the anesthesia.",1.2526315789473683,0.0517735206085088,95,74,18,3,False,True,44
844,Can you please bend over and cough for me.,1.2526315789473683,0.0559323320420903,95,76,14,5,False,True,42
844,"Breathe, I promise not to screw it up",1.2526315789473683,0.0559323320420903,95,76,14,5,False,False,37
844,"On the bright side, at least you don't have to wear one of those humiliating paper gowns.",1.2525252525252526,0.0597932160320365,99,82,9,8,False,True,89
844,"So, Let's talk about that yeast infusion you had about 20 years ago.....",1.2525252525252526,0.0562400440689901,99,80,13,6,False,True,72
844,I'll be honest. You're gonna feel a little pinch.,1.2525252525252526,0.0524467008524855,99,78,17,4,False,True,49
844,Relax. You won't really feel screwed until you see the size of your co-pay.,1.2525252525252526,0.0543764608410296,99,79,15,5,False,True,75
844,"C’mon, it’s just your cork.",1.2525252525252526,0.0524467008524855,99,78,17,4,False,True,27
844,"They call me 'the grapist for' a reason, you know.",1.2524271844660195,0.0547017363040833,103,83,14,6,False,True,50
844,"While the procedure’s experimental, my colleagues and I feel it will relieve your fear of ships.",1.2524271844660195,0.0564149569155292,103,84,12,7,False,True,96
844,"This is not exactly brain surgery, but it should relieve the pressure.",1.2524271844660195,0.049205464405722,103,80,20,3,False,True,70
844,You may hear a slightly marvelous popping sound.,1.2523364485981308,0.0515898839389324,107,85,17,5,False,True,48
844,Tests would indicate your cork comes out more than once a week.,1.2523364485981308,0.0461790958667127,107,82,23,2,False,True,63
844,I highly recommend the procedure for someone your age.,1.2523364485981308,0.0480504384821013,107,83,21,3,False,True,54
844,"Now bend over, and no whining.",1.2523364485981308,0.0498515835413216,107,84,19,4,False,True,30
844,"The operation will be quick, painless, 
and pairs well with ribeye.",1.2523364485981308,0.0480504384821013,107,83,21,3,False,True,67
844,"In my profession, we consider it unhealthy to keep all that bottled up",1.2523364485981308,0.0549016175658134,107,87,13,7,False,False,70
844,Don't whine... it's just a sting.,1.2523364485981308,0.0498515835413216,107,84,19,4,False,True,33
844,"Now, you’ll feel some slight pressure",1.2523364485981308,0.0532714920767917,107,86,15,6,False,False,37
844,The good news is you’ve reached a fine-vintage year… the bad news is that you’ve exceeded your shelf life.,1.2522522522522523,0.0534914759234883,111,90,14,7,False,True,106
