contest,rank,caption,mean,precision,votes,not_funny,somewhat_funny,funny,has_question_mark,ends_with_punctuation,caption_length
567,3049,Im all ready for work. just tilt my bed out the window and i'll turn out in my office in about two seconds.,1.04,0.0408248290463863,25,24,1,0,False,True,107
567,3050,They overbooked.,1.04,0.0408248290463863,25,24,1,0,False,True,16
567,3051,So it turns out there are no lay-flat seats on the subway.,1.04,0.0408248290463863,25,24,1,0,False,True,58
567,3052,"No, no, as you can see I'm not stuck in bed. I'm here ready for work",1.04,0.0408248290463863,25,24,1,0,False,False,68
567,3053,"You'd bedder get used to it, cause it's here to lay.",1.04,0.0408248290463863,25,24,1,0,False,True,52
567,3054,I hate 7 AM meetings.,1.04,0.0408248290463863,25,24,1,0,False,True,21
567,3055,I started it when I became responsible for my own travel expenses.,1.04,0.0408248290463863,25,24,1,0,False,True,66
567,3056,"You must understand, I have not been sleeping on the job!",1.04,0.0408248290463863,25,24,1,0,False,True,57
567,3057,It's not your turn for an other 15 min.,1.04,0.0408248290463863,25,24,1,0,False,True,39
567,3058,I'm mad too - I have mattress attachment disorder.,1.04,0.0408248290463863,25,24,1,0,False,True,50
567,3059,"And, your point is?",1.04,0.0408248290463863,25,24,1,0,True,True,19
567,3060,"I wanted a firm mattress, not a mattress firm.",1.04,0.0408248290463863,25,24,1,0,False,True,46
567,3061,"All right, all right, your glue IS the best.",1.04,0.0408248290463863,25,24,1,0,False,True,44
567,3062,"I'd like to speak with Mr. Murphy, please.",1.04,0.0408248290463863,25,24,1,0,False,True,42
567,3063,The website said it was a 24/7 type of position,1.04,0.0408248290463863,25,24,1,0,False,False,47
567,3064,"No, standing desks were just a fad. Sleeping desks are the future!",1.04,0.0408248290463863,25,24,1,0,False,True,66
567,3065,"It's the Holy Trinity: coffee, work, and sleep.",1.04,0.0408248290463863,25,24,1,0,False,True,47
567,3066,Of course it's not all positive.,1.04,0.0408248290463863,25,24,1,0,False,True,32
567,3067,I stayed in bed for this?!?,1.04,0.0408248290463863,25,24,1,0,True,True,27
567,3068,This is where I come up with all my ideas.,1.04,0.0408248290463863,25,24,1,0,False,True,42
567,3069,"""I call it the 'Life Compactor.'",1.04,0.0408248290463863,25,24,1,0,False,False,32
567,3070,I don't know......the sequence of daily routines just confuses me.,1.04,0.0408248290463863,25,24,1,0,False,True,66
567,3071,"It's called the ""vertical living detox.""",1.04,0.0408248290463863,25,24,1,0,False,False,40
567,3072,So I fell asleep in a few meetings. I think this punishment is excessive.,1.04,0.0408248290463863,25,24,1,0,False,True,73
567,3073,Go ahead... guess the thread count.,1.04,0.0408248290463863,25,24,1,0,False,True,35
567,3074,But I still need to incorporate a lavatory.,1.04,0.0408248290463863,25,24,1,0,False,True,43
567,3075,The Board told me to put my crazy ideas to bed.,1.04,0.0408248290463863,25,24,1,0,False,True,47
567,3076,Experiment #32 in the Sleep-Working disorder study.,1.04,0.0408248290463863,25,24,1,0,False,True,51
567,3077,I chose early retirement.,1.04,0.0408248290463863,25,24,1,0,False,True,25
567,3078,I'm microdosing sleep.,1.04,0.0408248290463863,25,24,1,0,False,True,22
567,3079,"Well, it goes with my stand-up desk.",1.04,0.0408248290463863,25,24,1,0,False,True,36
567,3080,You wouldn't believe what a time saver this new vertical mattress is.,1.04,0.0408248290463863,25,24,1,0,False,True,69
567,3081,"Power naps at my desk treadmill, see?",1.04,0.0408248290463863,25,24,1,0,True,True,37
567,3082,Stop treating me like a high-priced pocket protector!,1.04,0.0408248290463863,25,24,1,0,False,True,53
567,3083,...and it still can't get any thing done.,1.04,0.0408248290463863,25,24,1,0,False,True,41
567,3084,"I've come to the realization that you do not, in fact, have my back.",1.04,0.0408248290463863,25,24,1,0,False,True,68
567,3085,"No, I haven't thought about how I'll sleep. Why do you ask?",1.04,0.0408248290463863,25,24,1,0,True,True,59
567,3086,At your service day or night.,1.04,0.0408248290463863,25,24,1,0,False,True,29
567,3087,"I'm in bed, like the doctor said.",1.04,0.0408248290463863,25,24,1,0,False,True,33
567,3088,"I've booked so many miles by now, I probably could afford a studio in Queens.",1.04,0.0408248290463863,25,24,1,0,False,True,77
567,3089,Power naps are the new power lunch.,1.04,0.0408248290463863,25,24,1,0,False,True,35
567,3090,It's called Airbnb - spartan but very convenient.,1.04,0.0408248290463863,25,24,1,0,False,True,49
567,3091,How can you say I'm homeless? This is my home.,1.04,0.0408248290463863,25,24,1,0,True,True,46
567,3092,Because it's the only way to get anything done in this sweatshop of an office.,1.04,0.0408248290463863,25,24,1,0,False,True,78
567,3093,No one ever said this was what Murphy's Law meant.,1.04,0.0408248290463863,25,24,1,0,False,True,50
567,3094,I haven't quite figured out this power nap thing.,1.04,0.0408248290463863,25,24,1,0,False,True,49
567,3095,This didn't even work for college kids!,1.04,0.0408248290463863,25,24,1,0,False,True,39
567,3096,This wasn't exactly the post-layoff soft landing I had envisioned.,1.04,0.0408248290463863,25,24,1,0,False,True,66
567,3097,"Murphy, I bet you think you are so funny.",1.04,0.0408248290463863,25,24,1,0,False,True,41
567,3098,Sorry I'm late. I couldn't get out of bed.,1.04,0.0408248290463863,25,24,1,0,False,True,42
567,3099,It's power nap attire Friday!,1.04,0.0408248290463863,25,24,1,0,False,True,29
567,3100,I punched the wrong app--- I got the moving van instead of a taxi.,1.04,0.0408248290463863,25,24,1,0,False,True,66
567,3101,I enjoy airport sleeping pods as much as the next guy ... but I specifically asked for 'No Tuck' and they tucked me anyway.,1.04,0.0408248290463863,25,24,1,0,False,True,123
567,3102,Think 'casual Monday'.,1.04,0.0408248290463863,25,24,1,0,False,True,22
567,3103,The kids call it woke Jeremy!,1.04,0.0408248290463863,25,24,1,0,False,True,29
567,3104,Hey! It's a cabinet position!,1.04,0.0408248290463863,25,24,1,0,False,True,29
567,3105,I told you there's no such thing as bring your bed to work day,1.04,0.0408248290463863,25,24,1,0,False,False,62
567,3106,"Introducing the Google, self-driving bed. ""When you can't get up in the morning.""",1.04,0.0408248290463863,25,24,1,0,False,False,81
567,3107,The new standing workstations have given me a back-ache.,1.04,0.0408248290463863,25,24,1,0,False,True,56
567,3108,I told you. I'm not a morning person.,1.04,0.0408248290463863,25,24,1,0,False,True,37
567,3109,I'm taking the 'casting couch' to a whole new level.,1.04,0.0408248290463863,25,24,1,0,False,True,52
567,3110,"So today is NOT ""Bring Your Bed To Work"" Day?",1.04,0.0408248290463863,25,24,1,0,True,True,45
567,3111,"This new mattress makes me a ""stand up"" guy in the morning""",1.04,0.0408248290463863,25,24,1,0,False,False,59
567,3112,I am standing on my own two feet...NOT childish!,1.04,0.0408248290463863,25,24,1,0,False,True,48
567,3113,"They said I couldn't work from home, but I could bring my home to work.",1.04,0.0408248290463863,25,24,1,0,False,True,71
567,3114,Who are you yelling at. I got stuck.,1.04,0.0408248290463863,25,24,1,0,False,True,36
567,3115,It's the best sleep I've ever had at work.,1.04,0.0408248290463863,25,24,1,0,False,True,42
567,3116,It was impossible on the subway.,1.04,0.0408248290463863,25,24,1,0,False,True,32
567,3117,Product testing IS work.,1.04,0.0408248290463863,25,24,1,0,False,True,24
567,3118,I didn't want to wake up on the wrong side of the bed!,1.04,0.0408248290463863,25,24,1,0,False,True,54
567,3119,Go to work? Stay in bed? Couldn't decide.,1.04,0.0408248290463863,25,24,1,0,True,True,41
567,3120,"But Detective, you said we could put this case to bed!",1.04,0.0408248290463863,25,24,1,0,False,True,54
567,3121,It lets me hit the ground running.,1.04,0.0408248290463863,25,24,1,0,False,True,34
567,3122,And you call this First Class?,1.04,0.0408248290463863,25,24,1,0,True,True,30
567,3123,"Like it or not, it outperforms our retirement plan.",1.04,0.0408248290463863,25,24,1,0,False,True,51
567,3124,There was no right side today.,1.04,0.0408248290463863,25,24,1,0,False,True,30
567,3125,And you thought you got me out of bed.,1.04,0.0408248290463863,25,24,1,0,False,True,38
567,3126,Whaddya mean there's no nap time?!,1.04,0.0408248290463863,25,24,1,0,True,True,34
567,3127,Don't judge me. I'm in my comfort zone.,1.04,0.0408248290463863,25,24,1,0,False,True,39
567,3128,And the worst part is my reflux is no better.,1.04,0.0408248290463863,25,24,1,0,False,True,45
567,3129,"Hal I appreciate your concern, but I can negotiate our company's merger in my sleep.",1.04,0.0408248290463863,25,24,1,0,False,True,84
567,3130,Well of course I know what I'm doing. Haven't you ever heard of multi-tasking?,1.04,0.0408248290463863,25,24,1,0,True,True,78
567,3131,She says 'lean in.' I say 'tuck in.',1.04,0.0408248290463863,25,24,1,0,False,False,36
567,3132,"Well, your airline seats blow.",1.04,0.0408248290463863,25,24,1,0,False,True,30
567,3133,"You told me I shouldn't bring my work home, so I thought I'd bring my home to work.",1.04,0.0408248290463863,25,24,1,0,False,True,83
567,3134,"So she goes, 'Sixty-nine? You mean you want beef with broccoli?'",1.04,0.0408248290463863,25,24,1,0,True,False,64
567,3135,Work! Sleep! Work! It’s called multitasking!,1.04,0.0408248290463863,25,24,1,0,False,True,44
567,3136,"Yes, you can bounce a coin off of it.",1.04,0.0408248290463863,25,24,1,0,False,True,37
567,3137,It's the new 100 day severance package,1.04,0.0408248290463863,25,24,1,0,False,False,38
567,3138,I'm here for the orientation class.,1.04,0.0408248290463863,25,24,1,0,False,True,35
567,3139,It's the next best thing to working from home.,1.04,0.0408248290463863,25,24,1,0,False,True,46
567,3140,Turning in like this saves 17 point 4 minutes in the morning.,1.04,0.0408248290463863,25,24,1,0,False,True,61
567,3141,I can't afford to lose sleep.,1.04,0.0408248290463863,25,24,1,0,False,True,29
567,3142,It's definitely your day to set the coffeemaker,1.04,0.0408248290463863,25,24,1,0,False,False,47
567,3143,"I'm willing to sleep my way to the top, Mr. Jenkins. Hop in.",1.04,0.0408248290463863,25,24,1,0,False,True,60
567,3144,My Problem? This is what double-overtime looks like.,1.04,0.0408248290463863,25,24,1,0,True,True,52
567,3145,"But Dad, addiction to coffee is just a myth.",1.04,0.0408248290463863,25,24,1,0,False,True,44
567,3146,So they gave me a few trinkets! That doesn't mean I'm in bed with them!,1.04,0.0408248290463863,25,24,1,0,False,True,71
567,3147,I'm ready 24x7. 24x7!,1.04,0.0408248290463863,25,24,1,0,False,True,21
567,3148,That’s right. I’m going to the mattresses! Capiche?,1.04,0.0408248290463863,25,24,1,0,True,True,51
567,3149,The deal's got to be big enough to make me want to get out of bed in the morning.,1.04,0.0408248290463863,25,24,1,0,False,True,81
567,3150,This might have been easier in Jesus day.,1.04,0.0408248290463863,25,24,1,0,False,True,41
567,3151,Sir! This is the best I can do today!,1.04,0.0408248290463863,25,24,1,0,False,True,37
567,3152,I assumed that you would appreciate the latest fad in pajamas.,1.04,0.0408248290463863,25,24,1,0,False,True,62
567,3153,Now you're just being a jerk.,1.04,0.0408248290463863,25,24,1,0,False,True,29
567,3154,Where's my breakfast in bed?,1.04,0.0408248290463863,25,24,1,0,True,True,28
567,3155,Some days you just can't get out of bed.,1.04,0.0408248290463863,25,24,1,0,False,True,40
567,3156,I'll sleep on it.,1.04,0.0408248290463863,25,24,1,0,False,True,17
567,3157,This foreplay is terrible but at least it's productive.,1.04,0.0408248290463863,25,24,1,0,False,True,55
567,3158,"Or, we could have a nap room.",1.04,0.0408248290463863,25,24,1,0,False,True,29
567,3159,"It's a terrible idea for a bed, Murphy!",1.04,0.0408248290463863,25,24,1,0,False,True,39
567,3160,24/7 My way.,1.04,0.0408248290463863,25,24,1,0,False,True,12
567,3161,I am celebrating Bob Mankoff Day.,1.04,0.0408248290463863,25,24,1,0,False,True,33
567,3162,Please return mattress to downright position.,1.04,0.0408248290463863,25,24,1,0,False,True,45
567,3163,I'm sorry. I just can't seem to get out of bed in the morning.,1.04,0.0408248290463863,25,24,1,0,False,True,62
567,3164,This is a really lame sleepaway camp.,1.04,0.0408248290463863,25,24,1,0,False,True,37
567,3165,"Mr. Murphy, why don't you get me out of YOUR bed?!",1.04,0.0408248290463863,25,24,1,0,True,True,50
567,3166,You can't tell me I got off the wrong side of the bed.,1.04,0.0408248290463863,25,24,1,0,False,True,54
567,3167,What's your problem? I cut out two and a half hours off my commute this way!,1.04,0.0408248290463863,25,24,1,0,True,True,76
567,3168,So I can't work from home ?,1.04,0.0408248290463863,25,24,1,0,True,True,27
567,3169,This time maybe I'll get some sleep on the train.,1.04,0.0408248290463863,25,24,1,0,False,True,49
567,3170,"I'm here aren't I!, What more do you want??",1.04,0.0408248290463863,25,24,1,0,True,True,43
567,3171,You sure this will cure my insomnia?,1.04,0.0408248290463863,25,24,1,0,True,True,36
567,3172,I can do this job in my sleep!,1.04,0.0408248290463863,25,24,1,0,False,True,30
567,3173,Sales pitch? Yes sirree! Murphy's the name. Easy get-up-and-go beds my game.,1.04,0.0408248290463863,25,24,1,0,True,True,76
567,3174,I asked room service to get me up.,1.04,0.0408248290463863,25,24,1,0,False,True,34
567,3175,"Yes, I get it. Cover the Asian markets. But there has to be some give and take.",1.04,0.0408248290463863,25,24,1,0,False,True,79
567,3176,"No, no, I'm just fine with the new no-telecommuting policy.",1.04,0.0408248290463863,25,24,1,0,False,True,59
567,3177,But you said demonstrate some work/life balance!,1.04,0.0408248290463863,25,24,1,0,False,True,48
567,3178,"The Turtle Mattress is so comfortable, you'll wear it everywhere. With this TV offer, you get the cup, pillow, and briefcase free.",1.04,0.0408248290463863,25,24,1,0,False,True,130
567,3179,So where's my breakfast?,1.04,0.0408248290463863,25,24,1,0,True,True,24
567,3180,So what if I sleep on the job?,1.04,0.0408248290463863,25,24,1,0,True,True,30
567,3181,Your dress code didn't say anything about beds.,1.04,0.0408248290463863,25,24,1,0,False,True,47
567,3182,I said decaf. This coffee is keeping me up.,1.04,0.0408248290463863,25,24,1,0,False,True,43
567,3183,"Comes in really handy during long, boring meetings.",1.04,0.0408248290463863,25,24,1,0,False,True,51
567,3184,"Well, it IS raining and it IS Monday.",1.04,0.0408248290463863,25,24,1,0,False,True,37
567,3185,I knew working from home was a bad idea.,1.04,0.0408248290463863,25,24,1,0,False,True,40
567,3186,"You call this a ""sleeper seat?",1.04,0.0408248290463863,25,24,1,0,True,True,30
567,3187,When I'm finally gone I don't want anyone to say he always wished he had spent more time at the office.,1.04,0.0408248290463863,25,24,1,0,False,True,103
567,3188,"OK, so it's not ideal. But I still argue it's multi-tasking.",1.04,0.0408248290463863,25,24,1,0,False,True,60
567,3189,"All I said to the Judge was ""As Counsel with complete Sertatude I.....""",1.04,0.0408248290463863,25,24,1,0,False,False,71
567,3190,My dreams are so lifelike.,1.04,0.0408248290463863,25,24,1,0,False,True,26
567,3191,Im starting a GoFundMe for my new Bed and breakfast idea...,1.04,0.0408248290463863,25,24,1,0,False,True,59
567,3192,A good night's sleep helps you prepare for the day.,1.04,0.0408248290463863,25,24,1,0,False,True,51
567,3193,I plan to dream about my boss taking me out for a beer.,1.04,0.0408248290463863,25,24,1,0,False,True,55
567,3194,"I'm telling you, the Murphy people like to meet this way.",1.04,0.0408248290463863,25,24,1,0,False,True,57
567,3195,"Power naps and standing desks are proven productivity enhancers... what's not to like?!""",1.04,0.0408248290463863,25,24,1,0,True,False,88
567,3196,It's just about maximizing efficiency. I've got to get my sleep in whenever I can.,1.04,0.0408248290463863,25,24,1,0,False,True,82
567,3197,It's cool. I'm a psychosomatic workaholic.,1.04,0.0408248290463863,25,24,1,0,False,True,42
567,3198,what do you mean halloween was last week?,1.04,0.0408248290463863,25,24,1,0,True,True,41
567,3199,"I take my work to bed with me, I may as well take my bed to work.",1.04,0.0408248290463863,25,24,1,0,False,True,65
567,3200,I think these early morning staff meetings are counterproductive.,1.04,0.0408248290463863,25,24,1,0,False,True,65
567,3201,Why do you think I’d take this lying down!,1.04,0.0408248290463863,25,24,1,0,False,True,42
567,3202,"""It's called a ""Motel Three"".",1.04,0.0408248290463863,25,24,1,0,False,True,29
567,3203,"Look, I'm ready to work.",1.04,0.0408248290463863,25,24,1,0,False,True,24
567,3204,"Joe, how long have you been sleeping on the job?",1.04,0.0408248290463863,25,24,1,0,True,True,48
567,3205,Fed-ex should be here soon and then I'm off to L.A.,1.04,0.0408248290463863,25,24,1,0,False,True,51
567,3206,I have trouble getting a seat on the subway.,1.04,0.0408248290463863,25,24,1,0,False,True,44
567,3207,I have insomnia!,1.04,0.0408248290463863,25,24,1,0,False,True,16
567,3208,"I don't care how close to bed it is, give me some dang coffee.",1.04,0.0408248290463863,25,24,1,0,False,True,62
567,3209,"It's the new logo for ""Bed & Breakfast"". Waddya think?",1.04,0.0408248290463863,25,24,1,0,True,True,54
567,3210,I've heard of flying standby but this is ridiculous!,1.04,0.0408248290463863,25,24,1,0,False,True,52
567,3211,"Sorry I'm late, I just couldn't get out of bed today.",1.04,0.0408248290463863,25,24,1,0,False,True,53
567,3212,"Give me your honest opinion Syd, do you think it's patentable?",1.04,0.0408248290463863,25,24,1,0,True,True,62
567,3213,I told you that I require a hypoallergenic pillow!,1.04,0.0408248290463863,25,24,1,0,False,True,50
567,3214,"If we're going to the mattresses, I want my memory foam.",1.04,0.0408248290463863,25,24,1,0,False,True,56
567,3215,Are you just going to stand there? My ass isn't going to wipe itself.,1.04,0.0408248290463863,25,24,1,0,True,True,69
567,3216,"Either I'm late or you're in my house. Either way, I'm prepared.",1.04,0.0408248290463863,25,24,1,0,False,True,64
567,3217,"Yeah, I got my mug, my briefcase, and my bed in case you intend to bore me to sleep again with more exhortations to increase fucking staff productivity.",1.04,0.0408248290463863,25,24,1,0,False,True,152
567,3218,"I'm only 26, and you expect me to know what a Murphy Bed is?",1.04,0.0408248290463863,25,24,1,0,True,True,60
567,3219,I asked for that just rolled out of bed look.,1.04,0.0408248290463863,25,24,1,0,False,True,45
567,3220,"I know John, but telecommuting really suits me!",1.04,0.0408248290463863,25,24,1,0,False,True,47
567,3221,"Look, I'm done negotiating. Let's put this deal to bed.",1.04,0.0408248290463863,25,24,1,0,False,True,55
567,3222,"What, you've never picked the wrong sleep number?!?",1.04,0.0408248290463863,25,24,1,0,True,True,51
567,3223,I just got demoted out of HR. That woman can't take a joke.,1.04,0.0408248290463863,25,24,1,0,False,True,59
567,3224,I have a hard stop at 11:00 P.M.,1.04,0.0408248290463863,25,24,1,0,False,True,32
567,3225,She knows Willie Nelson's exwife.,1.04,0.0408248290463863,25,24,1,0,False,True,33
567,3226,"Tis"" Blessed to be prepared!",1.04,0.0408248290463863,25,24,1,0,False,True,28
567,3227,"It's an Office Cozy. Shark Tank, here I come!",1.04,0.0408248290463863,25,24,1,0,False,True,45
567,3228,"I put on a suit and tie. But nooo, you are never satisfied.",1.04,0.0408248290463863,25,24,1,0,False,True,59
567,3229,"I know I'm late Jim, but I just couldn't pull myself out of bed this morning!",1.04,0.0408248290463863,25,24,1,0,False,True,77
567,3230,I can't find my pants.,1.04,0.0408248290463863,25,24,1,0,False,True,22
567,3231,You said I could work from home.,1.04,0.0408248290463863,25,24,1,0,False,True,32
567,3232,Who says I don't know how to relax?,1.04,0.0408248290463863,25,24,1,0,True,True,35
567,3233,"Multitasking, Cheeves, it's how I get things done.",1.04,0.0408248290463863,25,24,1,0,False,True,50
567,3234,I'm ready for power nap.,1.04,0.0408248290463863,25,24,1,0,False,True,24
567,3235,Why can't we just put this matter to rest?,1.04,0.0408248290463863,25,24,1,0,True,True,42
567,3236,Cut 20 minutes off my commute. I operate it with my Smartphone,1.04,0.0408248290463863,25,24,1,0,False,False,62
567,3237,Is this the flight to London?,1.04,0.0408248290463863,25,24,1,0,True,True,29
567,3238,This saves a lot of time in the morninng.,1.04,0.0408248290463863,25,24,1,0,False,True,41
567,3239,She never said anything about taking home to work.,1.04,0.0408248290463863,25,24,1,0,False,True,50
567,3240,I haaven't got time for this. I have a nap to Make it quick. I have a nap to catch.,1.04,0.0408248290463863,25,24,1,0,False,True,83
567,3241,"I'm taking 'work/life balance' to the next level, with an emphasis on work.",1.04,0.0408248290463863,25,24,1,0,False,True,75
567,3242,"I don't want to hear your crack about me waking up on the wrong side of the bed again, Larry!",1.04,0.0408248290463863,25,24,1,0,False,True,93
567,3243,"What can I say?--This is what it looks like when you tell the doctor you'll stay in bed, and your boss you'll be a work!",1.04,0.0408248290463863,25,24,1,0,True,True,120
567,3244,"When the boss said, 'Let's put this project to bed for now,' I'm wondering if maybe I took him too literally.",1.04,0.0408248290463863,25,24,1,0,False,True,109
567,3245,Make it quick. I have a nap to catch.,1.04,0.0408248290463863,25,24,1,0,False,True,37
567,3246,I am not going to this lying down...,1.04,0.0408248290463863,25,24,1,0,False,True,36
567,3247,The company promised I would sleep in my own bed every night.,1.04,0.0408248290463863,25,24,1,0,False,True,61
567,3248,It's my new efficiency-wear; it saves me 18 minutes a days!,1.04,0.0408248290463863,25,24,1,0,False,True,59
567,3249,This is my first day back after a year of 'work from home.',1.04,0.0408248290463863,25,24,1,0,False,False,59
567,3250,No tuck.,1.04,0.0408248290463863,25,24,1,0,False,True,8
567,3251,"If you rather, I can just work at home.",1.04,0.0408248290463863,25,24,1,0,False,True,39
567,3252,Who says you can't do it big AND stay in bed?,1.04,0.0408248290463863,25,24,1,0,True,True,45
567,3253,"Backstab once, shame on you.",1.04,0.0408248290463863,25,24,1,0,False,True,28
567,3254,You told me to multi-task.,1.04,0.0408248290463863,25,24,1,0,False,True,26
567,3255,"Lyft, Uber, either one's OK.",1.04,0.0408248290463863,25,24,1,0,False,True,28
567,3256,"""Lackadaisical attitude""?!! I won't take this lying down!",1.04,0.0408248290463863,25,24,1,0,True,True,57
567,3257,Its the latest thing in office sharing-- Bedbnb,1.04,0.0408248290463863,25,24,1,0,False,False,47
567,3258,"Don't bring your work home with you, they said. Now, look at me!",1.04,0.0408248290463863,25,24,1,0,False,True,64
567,3259,Beats getting up on the wrong side.,1.04,0.0408248290463863,25,24,1,0,False,True,35
567,3260,I thought you'd be proud to interview me while I'm wearing the tie you bought me.,1.04,0.0408248290463863,25,24,1,0,False,True,81
567,3261,So you're saying you refuse to carry to my cubicle?,1.04,0.0408248290463863,25,24,1,0,True,True,51
567,3262,Why don't you sleep on it and then decide?,1.04,0.0408248290463863,25,24,1,0,True,True,42
567,3263,My two world's just aren't getting married.,1.04,0.0408248290463863,25,24,1,0,False,True,43
567,3264,The hardest part was getting a seat on the bus.,1.04,0.0408248290463863,25,24,1,0,False,True,47
567,3265,"What's next, a catheter?",1.04,0.0408248290463863,25,24,1,0,True,True,24
567,3266,I thought it was bring your bed to work day?!,1.04,0.0408248290463863,25,24,1,0,True,True,45
567,3267,"Child, what do you mean child? It's 'Take your bed to work day' today.",1.04,0.0408248290463863,25,24,1,0,True,True,70
567,3268,My doctor said to catch up on sleep.,1.04,0.0408248290463863,25,24,1,0,False,True,36
567,3269,"I told you to wear madras, not mattress.",1.04,0.0408248290463863,25,24,1,0,False,True,40
567,3270,My sleep tracker said I haven't spent enough time in bed.,1.04,0.0408248290463863,25,24,1,0,False,True,57
567,3271,This is my answer to the latest rent increase.,1.04,0.0408248290463863,25,24,1,0,False,True,46
567,3272,You're late again Murphy.,1.04,0.0408248290463863,25,24,1,0,False,True,25
567,3273,What?! Haven't you ever had a day when it's hard to get out of bed?,1.04,0.0408248290463863,25,24,1,0,True,True,67
567,3274,Get off my ceiling and let me get some work done.,1.04,0.0408248290463863,25,24,1,0,False,True,49
567,3275,"Wanted to come to work. But, I couldn't get out of bed !",1.04,0.0408248290463863,25,24,1,0,False,True,56
567,3276,"Seriously, what the hell's so ""Fox News"" about how I'm dressed?!",1.04,0.0408248290463863,25,24,1,0,True,True,64
567,3277,This way I can say I've slept with the entire office.,1.04,0.0408248290463863,25,24,1,0,False,True,53
567,3278,You call this a spread sheet?,1.04,0.0408248290463863,25,24,1,0,True,True,29
567,3279,"""I am working overtime tonight""!",1.04,0.0408248290463863,25,24,1,0,False,True,32
567,3280,Home office.,1.04,0.0408248290463863,25,24,1,0,False,True,12
567,3281,This is the kit for the new intern when you have to pull an all nighter.,1.04,0.0408248290463863,25,24,1,0,False,True,72
567,3282,"""Rather than bringing the office home"".............",1.04,0.0408248290463863,25,24,1,0,False,True,51
567,3283,"Well, what do you expect when you demand a 7 AM meeting?",1.04,0.0408248290463863,25,24,1,0,True,True,56
567,3284,Didn't they offer you a work-life balance too?,1.04,0.0408248290463863,25,24,1,0,True,True,46
567,3285,"As you requested, I stood up for the standing desk. I intend to take THIS one lying down!""",1.04,0.0408248290463863,25,24,1,0,False,False,90
567,3286,You haven't worked the night shift yet?,1.04,0.0408248290463863,25,24,1,0,True,True,39
567,3287,What makes you think I've been sleeping on the job?,1.04,0.0408248290463863,25,24,1,0,True,True,51
