contest,caption,mean,precision,votes,not_funny,somewhat_funny,funny,has_question_mark,ends_with_punctuation,caption_length
771,Oh yeah? Well one time I rocked so hard that TEN guys with metal detectors showed up.,1.2407407407407407,0.0744661183686601,54,44,7,3,True,True,85.0
771,"Boomers have social security, large pensions, huge stock market returns and excellent real estate gains all after holding long term, well paying jobs during a great economy and yet they still complain that they need to find a few more dollars for their retirement funds.",1.2407407407407407,0.069616023768444,54,43,9,2,False,True,270.0
771,Are you hiding something from me?”,1.24,0.0785584404849572,50,41,6,3,True,False,34.0
771,"If we just lift the couch cushions, do you think our friends would still hang out with us?",1.24,0.0785584404849572,50,41,6,3,True,True,90.0
771,Are you sure your keys aren't in your other pants?,1.24,0.0835927933618731,50,42,4,4,True,True,50.0
771,"Should we get up and let
them feel a sense of accomplishment?",1.24,0.0473968843539809,100,78,20,2,True,True,61.0
771,I'm getting the feeling that the carpeting is a little outdated.,1.24,0.0835927933618731,50,42,4,4,False,True,64.0
771,So where's the ring? Once upon a time I heard tell of a ring.,1.24,0.0564409920676948,75,59,14,2,True,True,61.0
771,Maybe we should look under the couch first.,1.24,0.0785584404849572,50,41,6,3,False,True,43.0
771,I didn't know you were worth that much!,1.24,0.0731785627135182,50,40,8,2,False,True,39.0
771,whose fathers are these,1.24,0.0564409920676948,75,59,14,2,False,False,23.0
771,Are you sure you dropped your quarter here?,1.24,0.0531528477621399,75,58,16,1,True,True,43.0
771,In case you lose your keys again.,1.24,0.0731785627135182,50,40,8,2,False,True,33.0
771,When's the last time you remember chewing it?,1.2394366197183098,0.0583639753156484,71,56,13,2,True,True,45.0
771,You must lose your keys often.,1.2394366197183098,0.0617152177470609,71,57,11,3,False,True,30.0
771,And you think it made its way under the floor?,1.2394366197183098,0.0617152177470609,71,57,11,3,True,True,46.0
771,"If you'd bought me a larger engagement ring, it would be easier to find.",1.2394366197183098,0.0617152177470609,71,57,11,3,False,True,72.0
771,Watch what happens when I press “rewind”.,1.2394366197183098,0.0617152177470609,71,57,11,3,False,True,41.0
771,"They're homing in on your nerves of steel, iron will, and leaden personality.",1.2394366197183098,0.0583639753156484,71,56,13,2,False,True,77.0
771,My parents hired them to get me out of my Heavy Metal phase.,1.2394366197183098,0.0648936251760423,71,58,9,4,False,True,60.0
771,Don’t they know we spent all of our money on avocado toast?,1.2394366197183098,0.0583639753156484,71,56,13,2,True,True,59.0
771,"Oh don’t worry about them, honey. I’m just initiating phase two of backup plan ‘in case public loan forgiveness doesn’t pan out.",1.2394366197183098,0.0548082031061417,71,55,15,1,False,True,128.0
771,who the fuck are all these fuckers?,1.2394366197183098,0.0648936251760423,71,58,9,4,True,True,35.0
771,"If they don't find the car keys, can't we just take
our bicycle built for two?",1.2391304347826086,0.0773022339309831,46,37,7,2,True,True,78.0
771,Don't look down.,1.2391304347826086,0.0833175788510424,46,38,5,3,False,True,16.0
771,I said you're a real treasure and they come out of the woodwork.,1.2391304347826086,0.0773022339309831,46,37,7,2,False,True,64.0
771,"Man, I just don't know if I can get into metal",1.2391304347826086,0.0707774808526074,46,36,9,1,False,False,46.0
771,They think they found Jimmy Hoffa,1.2391304347826086,0.0773022339309831,46,37,7,2,False,False,33.0
771,And they said virtual reality metal detecting wouldn’t work.,1.2391304347826086,0.0833175788510424,46,38,5,3,False,True,60.0
771,This feels worse than being audited.  ⭐️⭐️⭐️⭐️⭐️,1.2391304347826086,0.0707774808526074,46,36,9,1,False,False,48.0
771,What? I lost my keys and task-rabbited it.,1.2391304347826086,0.0707774808526074,46,36,9,1,True,True,42.0
771,You just had to tell everybody that you had the world's best Pez collection!,1.2388059701492538,0.0641175432874391,67,54,10,3,False,True,76.0
771,"Were you at the bar again, bragging about that Nazi-treasure?",1.2388059701492538,0.0641175432874391,67,54,10,3,True,True,61.0
771,"Told you not to binge on the Twilight Zone.
It was an ant, not an alien in a mini land rover.",1.2388059701492538,0.0604878113576863,67,53,12,2,False,True,93.0
771,You have a magnetic personality,1.2388059701492538,0.0604878113576863,67,53,12,2,False,False,31.0
771,"Ted, I know it was a Buffalo Nickle, but this is overkill.",1.2388059701492538,0.0604878113576863,67,53,12,2,False,True,58.0
771,"I was thinking what better way to desensitize a little from all the social anxiety AND find some spare change, in the process.",1.2388059701492538,0.0604878113576863,67,53,12,2,False,True,126.0
771,I just lost one of my earrings…,1.2388059701492538,0.0524805416711362,67,51,16,0,False,False,31.0
771,Brought some help to find out if there is still some love between us.,1.2388059701492538,0.0708210944984882,67,56,6,5,False,True,69.0
771,Should we tell them about Black Sabbath?,1.2388059701492538,0.0566258888536812,67,52,14,1,True,True,40.0
771,"No Netflix, no nookie",1.2388059701492538,0.0708210944984882,67,56,6,5,False,False,21.0
771,Is this about yours or mine?,1.238095238095238,0.0667982024736064,63,51,9,3,True,True,28.0
771,No more shags.,1.238095238095238,0.0628487635805799,63,50,11,2,False,True,14.0
771,You never know what you׳lol find in shag carpeting.,1.238095238095238,0.0667982024736064,63,51,9,3,False,True,51.0
771,You ever get the feeling you're missing something?,1.238095238095238,0.0628487635805799,63,50,11,2,True,True,50.0
771,I tried telling them that all the loose change is actually between the couch cushions- but they are too engrossed listening to podcasts.,1.238095238095238,0.0628487635805799,63,50,11,2,False,True,136.0
771,"I'll take that one. The rest of you, GET OUT !",1.238095238095238,0.0667982024736064,63,51,9,3,False,True,46.0
771,Are you listening to Metallica?,1.238095238095238,0.0667982024736064,63,51,9,3,True,True,31.0
771,I am pretty sure you left your keys at the restaurant,1.238095238095238,0.0667982024736064,63,51,9,3,False,False,53.0
771,"If you knew how my ex-wife felt about me, you would understand why I am so careful""",1.238095238095238,0.0586339007188704,63,49,13,1,False,False,83.0
771,I’ve been searching for a heart of gold,1.238095238095238,0.0586339007188704,63,49,13,1,False,False,39.0
771,"My penny dropped yesterday, but I can’t find it anymore…",1.238095238095238,0.0628487635805799,63,50,11,2,False,False,56.0
771,They promised not to metal,1.2375,0.0596502199004933,80,65,11,4,False,False,26.0
771,How hard could it be to find the remote?,1.2375,0.051076233666644,80,62,17,1,True,True,40.0
771,Do you think they know we’re in Hell?,1.2375,0.0596502199004933,80,65,11,4,True,True,37.0
771,"Next time you want to watch a beach front sunset, let’s keep the furniture on the deck.",1.2375,0.0596502199004933,80,65,11,4,False,True,87.0
771,You're the one that wanted to live by the beach.,1.2372881355932204,0.0698122348177164,59,48,8,3,False,True,48.0
771,I told you the Village People went heavy metal.,1.2372881355932204,0.0654927064206396,59,47,10,2,False,True,47.0
771,"Y'know, if they ask us to get up off the couch we'll be out our our life savings.",1.2372881355932204,0.0654927064206396,59,47,10,2,False,True,81.0
771,They're looking for Itty Bitty Bit Coin,1.2372881355932204,0.0698122348177164,59,48,8,3,False,False,39.0
771,Is this what you meant when you said you wanted to start a Heavy Metal group?,1.2372881355932204,0.0608674055497373,59,46,12,1,True,True,77.0
771,"Don’t you think that your offering a $10,000 reward to find your old high school ring was a little over the top?",1.2372881355932204,0.0738796431108588,59,49,6,4,True,True,112.0
771,"The beach was closed.  I felt sorry for them.  So I told them to come over. I told them, I'm sure something will turn up, and they took me at my word.",1.2372881355932204,0.0698122348177164,59,48,8,3,False,True,150.0
771,"I don’t give a damn what your gold crown cost, I want them out of here by morning.",1.2372881355932204,0.0654927064206396,59,47,10,2,False,True,82.0
771,Do they know virus transmissions happens through nose and mouth and not through ears?,1.2372881355932204,0.0738796431108588,59,49,6,4,True,True,85.0
771,Which reminds me. It's your turn to vacuum.,1.2372881355932204,0.0698122348177164,59,48,8,3,False,True,43.0
771,"They do understand that the only thing below us is old Mr. Wilson in 1706, don't they?",1.2372881355932204,0.0654927064206396,59,47,10,2,True,True,86.0
771,It’s always between the cushions on the sofa.,1.2372881355932204,0.0654927064206396,59,47,10,2,False,True,45.0
771,"You never listen!  
I TOLD you I always lose my ear rings.  
But you somehow NEEDED to spend your inheritance on them!",1.2372881355932204,0.0608674055497373,59,46,12,1,False,True,118.0
771,"No, the ping-pong club is still the weirdest.",1.2372881355932204,0.0608674055497373,59,46,12,1,False,True,45.0
771,"1:“You think they’re looking for money to secure their retirement?”
2:”What’s retirement?”",1.2372881355932204,0.0738796431108588,59,49,6,4,True,False,90.0
771,"I knew Susan B's were rare, but this is ridiculous.",1.2372881355932204,0.0654927064206396,59,47,10,2,False,True,51.0
771,I said I wanted to WATCH The Beach.,1.2372881355932204,0.0698122348177164,59,48,8,3,False,True,35.0
771,This new crowd phone finding app is pretty slick,1.2372881355932204,0.0698122348177164,59,48,8,3,False,False,48.0
771,"I'm afraid our relationship has entered the ""navigate a minefield"" stage.",1.236842105263158,0.0588438941447312,76,61,12,3,False,True,73.0
771,BEEP BEEP BEEP BEEP BEEP BEEP BEEP BEEP BEEP BEEP BEEP BEEP,1.236842105263158,0.0617533891466597,76,62,10,4,False,False,59.0
771,I have the money but not the time to look for my keys.,1.236842105263158,0.0525437864276208,76,59,16,1,False,True,54.0
771,I still say it's not a beach chair.,1.2363636363636363,0.0578144970555724,55,42,13,0,False,True,35.0
771,They are looking for conversational landmines.,1.2363636363636363,0.0684785909360739,55,44,9,2,False,True,46.0
771,I wish your family would stop watching that 'Curse of Oak Island' show.,1.2363636363636363,0.0633712611772045,55,43,11,1,False,True,71.0
771,There used to be a beach here.,1.2363636363636363,0.0776924627193107,55,46,5,4,False,True,30.0
771,This conversation is a literal minefield.,1.2363636363636363,0.0684785909360739,55,44,9,2,False,True,41.0
771,OK! I over reacted to you losing an earring.,1.2363636363636363,0.0732305816581489,55,45,7,3,False,True,44.0
771,These ones are called millennial detectors.,1.2363636363636363,0.0684785909360739,55,44,9,2,False,True,43.0
771,I misplaced my iPhone again.,1.2363636363636363,0.0732305816581489,55,45,7,3,False,True,28.0
771,Tinder is full of gold diggers these days.,1.2363636363636363,0.0732305816581489,55,45,7,3,False,True,42.0
771,Daddy wants to be sure you don't have any piercings.,1.2363636363636363,0.0684785909360739,55,44,9,2,False,True,52.0
771,all ye outs in free!,1.2363636363636363,0.0684785909360739,55,44,9,2,False,True,20.0
771,Are 5 enough?,1.2363636363636363,0.0684785909360739,55,44,9,2,True,True,13.0
771,I told you we shouldn’t have put all that metal in the floor.,1.2363636363636363,0.0732305816581489,55,45,7,3,False,True,61.0
771,Karl! Seriously did they check underneath the couch?,1.2363636363636363,0.0578144970555724,55,42,13,0,True,True,52.0
771,"Babe, it’s just a juul.",1.2363636363636363,0.0732305816581489,55,45,7,3,False,True,23.0
771,"Honey, I feel bad. When should we tell the boomers that this isn’t how you start crypto mining?",1.2363636363636363,0.0732305816581489,55,45,7,3,True,True,95.0
771,I hope when they find the joke it’s golden.,1.2363636363636363,0.0684785909360739,55,44,9,2,False,True,43.0
771,"Even when we bring our couch to the beach, we are still not the weirdest people here.",1.2363636363636363,0.0684785909360739,55,44,9,2,False,True,85.0
771,Now you've done it. Got us planted in the middle of a treasure hunting utopia.,1.2361111111111112,0.0576436613028875,72,57,13,2,False,True,78.0
771,It's a great service.  I'll never have to worry about losing my keys again.,1.2361111111111112,0.0640723364788622,72,59,9,4,False,True,75.0
771,They're trying to locate your gumption.,1.2361111111111112,0.0576436613028875,72,57,13,2,False,True,39.0
771,Maybe we should just tell mom we lost her favorite necklace,1.2361111111111112,0.0541438397389098,72,56,15,1,False,False,59.0
771,You said you were into metal.,1.2352941176470589,0.0662036981024867,51,40,10,1,False,True,29.0
771,See what happens when you lose a Bitcoin!,1.2352941176470589,0.0662036981024867,51,40,10,1,False,True,41.0
771,"Relax.  Our code word for ""pot"" was ""bomb.""",1.2352941176470589,0.0662036981024867,51,40,10,1,False,False,43.0
771,I know that ring is here somewhere,1.2352941176470589,0.0666442834568862,68,56,8,4,False,False,34.0
771,I hired them to find the financial gains you have been hiding from me.,1.2352941176470589,0.0771463355800235,51,42,6,3,False,True,70.0
771,This polyamory shit sucks.,1.2352941176470589,0.0771463355800235,51,42,6,3,False,True,26.0
771,"No offense, I verify all on-line dating profiles.  So far it appears that your ""animal magnetism"" was faked.",1.2352941176470589,0.0662036981024867,51,40,10,1,False,True,108.0
771,If they're really mining bitcoin then where are their shovels?,1.2352941176470589,0.0632651480256502,68,55,10,3,True,True,62.0
771,You never what can be found under a rug”,1.2352941176470589,0.0662036981024867,51,40,10,1,False,False,40.0
771,They are looking for a real bitcoin,1.2352941176470589,0.0718835403130327,51,41,8,2,False,False,35.0
771,These are my five dads.,1.2352941176470589,0.0662036981024867,51,40,10,1,False,True,23.0
771,You said your apartment needed a more polished look.,1.2352941176470589,0.0518221406966591,68,52,16,0,False,True,52.0
771,"I don't know, I still think Find My iPhone was a better idea.",1.2352941176470589,0.0599884648657974,51,39,12,0,False,True,61.0
771,You need to focus on what happens after they find the IKEA wrench.,1.2352941176470589,0.0662036981024867,51,40,10,1,False,True,66.0
771,Don't tell them I'm sitting on a fortune.,1.2352941176470589,0.055897368714088,68,53,14,1,False,True,41.0
771,"I swear to God: if there's even a trace of Metallica left, it's over.",1.2352941176470589,0.0632651480256502,68,55,10,3,False,True,69.0
771,I guess now's a good time to mention I lost my wedding ring...,1.2352941176470589,0.0596950365770309,68,54,12,2,False,True,62.0
771,"They’re friends trying to help, though they really didn’t buy the lost engagement ring story, either.",1.2352941176470589,0.0718835403130327,51,41,8,2,False,True,101.0
771,Think they’ll notice if we get up?,1.2352941176470589,0.055897368714088,68,53,14,1,True,True,34.0
771,"Honey, I actually wanted to get nailed. Dont feel like a line was crossed.",1.2352941176470589,0.0771463355800235,51,42,6,3,False,True,74.0
771,I told you my friends were metal heads.,1.2352941176470589,0.055897368714088,68,53,14,1,False,True,39.0
771,These old people will never look up from their stupid devices.,1.2352941176470589,0.0666442834568862,68,56,8,4,False,True,62.0
771,They're from my new subscription plan to help find lost keys.,1.2352941176470589,0.0662036981024867,51,40,10,1,False,True,61.0
771,"Relax, they’re just looking for a new covid strain",1.2352941176470589,0.0662036981024867,51,40,10,1,False,False,50.0
771,"I could’ve find the remote, though",1.2352941176470589,0.0662036981024867,51,40,10,1,False,False,34.0
771,What makes you think we are sitting on a goldmine?,1.234375,0.0578302605709019,64,50,13,1,True,True,50.0
771,"Not exactly what I meant when I said, 'The penny dropped.'""",1.234375,0.0658513669543913,64,52,9,3,False,False,59.0
771,You told me couples therapy was private!,1.234375,0.0619707252154608,64,51,11,2,False,True,40.0
771,Hey Jim are they checking under us next?,1.234375,0.0695157124382225,64,53,7,4,True,True,40.0
771,My dad is into heavy metal.,1.234375,0.0695157124382225,64,53,7,4,False,True,27.0
771,"Sure they know where it is, but they're paid by the hour. Do you see what I mean about capitalism?",1.234375,0.0533695352393729,64,49,15,0,True,True,98.0
771,I don’t know if this counts as something we can post to TikTok.,1.234375,0.0619707252154608,64,51,11,2,False,True,63.0
771,If only we had invested in Bitcoin.,1.234375,0.0658513669543913,64,52,9,3,False,True,35.0
771,"I know you dropped a tack, but is this overkill?",1.234375,0.0658513669543913,64,52,9,3,True,True,48.0
771,"We should have been more specific about our heavy metal event,bro.",1.234375,0.0619707252154608,64,51,11,2,False,True,66.0
771,"Alexa , “Clean my aura” !!",1.234375,0.0619707252154608,64,51,11,2,False,True,26.0
771,I'm into heavy metals,1.234375,0.0658513669543913,64,52,9,3,False,False,21.0
771,"As hard as they tried, they could not find a clear path for his response to her question, “So what are your thoughts on feminism, religion, politics and woman’s right to choose?”",1.234375,0.0658513669543913,64,52,9,3,True,False,178.0
771,If they find my keys do you think they’ll give them back?,1.234375,0.0533695352393729,64,49,15,0,True,True,57.0
771,"No babe, they say they can find anything. Even in the depths of despair",1.234375,0.0619707252154608,64,51,11,2,False,False,71.0
771,OMG! 'Lost Treasure Chest' was the name of the stain on the new wood floor! Tell these people to go home!,1.234375,0.0658513669543913,64,52,9,3,False,True,105.0
771,They can't help you navigate this one. Now who is she?,1.2340425531914894,0.0816842024739688,47,39,5,3,True,True,54.0
771,This won't work!!! Lost love is not magnetic.,1.2340425531914894,0.069441847422151,47,37,9,1,False,True,45.0
771,Are you sure it was a Millard  Fillmore silver dollar?,1.2340425531914894,0.0816842024739688,47,39,5,3,True,True,54.0
771,I told you we shouldn't book our honeymoon on the Jolly Roger!,1.2340425531914894,0.0816842024739688,47,39,5,3,False,True,62.0
771,I put in a craigslist ad for someone who could give me the change I needed.,1.2340425531914894,0.0816842024739688,47,39,5,3,False,True,75.0
771,Did you bother to look under the cushions ?,1.2340425531914894,0.0816842024739688,47,39,5,3,True,True,43.0
771,"The more we talk, I’m beginning to think we’re on to something really big.",1.2340425531914894,0.0816842024739688,47,39,5,3,False,True,74.0
771,"Honey,maybe we should get up and just look under the cushions for my ring!",1.2340425531914894,0.0624267634368288,47,36,11,0,False,True,74.0
771,Their gymnasium is quarantined so I told them  you wouldn't mind if they practiced up here.,1.2340425531914894,0.0758105504109079,47,38,7,2,False,True,91.0
771,A penney for your thoughts.,1.2337662337662338,0.0637624819139786,77,64,8,5,False,True,27.0
771,Lost your keys again?,1.2333333333333334,0.0645132433593152,60,48,10,2,True,True,21.0
771,"I told them you lost 50,000 in bitcoin over the weekend -- I don't think they quite understand the concept of crypto-currency.",1.2333333333333334,0.0645132433593152,60,48,10,2,False,True,126.0
771,You do realize that our marriage will still be a minefield?,1.2333333333333334,0.0687526750036001,60,49,8,3,True,True,59.0
771,Ever since that guy found the doubloon they’ve been swarming.,1.2333333333333334,0.0599748848879745,60,47,12,1,False,True,61.0
771,"I'm now having serious doubts about this ""lost"" engagement ring.",1.2333333333333334,0.0727454608313335,60,50,6,4,False,True,64.0
771,Why did we bring the couch to the beach again?,1.2333333333333334,0.0687526750036001,60,49,8,3,True,True,46.0
771,You could have just said you didn’t like the ring,1.2333333333333334,0.0645132433593152,60,48,10,2,False,False,49.0
771,You’re telling me the robotic termites you designed for the Pentagon got loose in the house,1.2333333333333334,0.0645132433593152,60,48,10,2,False,False,91.0
771,I’m beginning to think that building our house over an abandoned silver mine wasn’t such a good idea.,1.2333333333333334,0.0727454608313335,60,50,6,4,False,True,101.0
771,"Once they find the chick magnet, no more Saturday nights spent on the sofa watching Beavis & Butthead, bro!",1.2333333333333334,0.0645132433593152,60,48,10,2,False,True,107.0
771,so no one's found the Afikommen yet?,1.2333333333333334,0.0687526750036001,60,49,8,3,True,True,36.0
771,beep beep,1.2333333333333334,0.0645132433593152,60,48,10,2,False,False,9.0
771,Hiring these guys was cheaper than a new pair of air buds,1.2333333333333334,0.0687526750036001,60,49,8,3,False,False,57.0
771,The landlord is upping the rent if they find anything.,1.2333333333333334,0.0645132433593152,60,48,10,2,False,True,54.0
771,'We'll find the roach',1.2333333333333334,0.0645132433593152,60,48,10,2,False,False,22.0
771,Don't you just love life on the Gold Coast?,1.2333333333333334,0.0599748848879745,60,47,12,1,True,True,43.0
771,Guess these bomb techs need something to do now that we are out of Afghanistan,1.2333333333333334,0.0599748848879745,60,47,12,1,False,False,78.0
771,Honey! I lost the phone!!,1.2333333333333334,0.0687526750036001,60,49,8,3,False,True,25.0
771,I give up on finding my earring.,1.2328767123287672,0.0632712623769452,73,60,9,4,False,True,32.0
771,There really must be a change shortage!,1.2328767123287672,0.0662100456621004,73,61,7,5,False,True,39.0
771,Did you hide it in your shoe?,1.2328767123287672,0.0569404744901366,73,58,13,2,True,True,29.0
771,"A cufflink, really?",1.2328767123287672,0.0534948607938811,73,57,15,1,True,True,19.0
771,This isn’t what I expected when you said you were into heavy metal,1.2328767123287672,0.0569404744901366,73,58,13,2,False,False,66.0
771,"Dude, these guys are so metal.",1.2321428571428572,0.0623723185591891,56,44,11,1,False,True,30.0
771,Still can't fond your keys?,1.2321428571428572,0.0623723185591891,56,44,11,1,True,True,27.0
771,"Well they work for free and we get 50% back, so I figured it was a win-win.",1.2321428571428572,0.0764091491282354,56,47,5,4,False,True,75.0
771,Something tells me we’re not fully prepared for this meeting.,1.2321428571428572,0.0623723185591891,56,44,11,1,False,True,61.0
771,"If you can think of a better way to find my bitcoin, I'd like to hear it.",1.2321428571428572,0.056929390240001,56,43,13,0,False,True,73.0
771,You didn't tell me your friends were into heavy metal.,1.2321428571428572,0.056929390240001,56,43,13,0,False,True,54.0
771,They're actually searching for my emotions.,1.2321428571428572,0.0673769750864464,56,45,9,2,False,True,43.0
771,I shouldn't have told Dad I lost my filling.,1.2321428571428572,0.07203476536472,56,46,7,3,False,True,44.0
771,It's 10pm - do YOU know where your keys are?,1.2321428571428572,0.07203476536472,56,46,7,3,True,True,44.0
771,We need to get out more......,1.2321428571428572,0.056929390240001,56,43,13,0,False,True,29.0
771,I told you to stop making that beeping noise!,1.2321428571428572,0.0673769750864464,56,45,9,2,False,True,45.0
771,Bitcoins are trending,1.2321428571428572,0.07203476536472,56,46,7,3,False,False,21.0
771,"Still can't find the remote, huh?",1.2321428571428572,0.0673769750864464,56,45,9,2,True,True,33.0
771,"Yes, they ARE all gold diggers. But I am not my family.",1.2321428571428572,0.0673769750864464,56,45,9,2,False,True,55.0
771,"When I said losing my virginity would be a golden moment for me, you thought it would be funny to call your wise guy friends?",1.2321428571428572,0.0673769750864464,56,45,9,2,True,True,125.0
771,Maybe you should quit referring to me as your treasure,1.2321428571428572,0.07203476536472,56,46,7,3,False,False,54.0
771,We could just get up and turn it on manually.,1.2321428571428572,0.0623723185591891,56,44,11,1,False,True,45.0
771,Am I the first woman you offered a ring to?,1.2321428571428572,0.0673769750864464,56,45,9,2,True,True,43.0
771,Please just buy a new AirPod.,1.2321428571428572,0.0623723185591891,56,44,11,1,False,True,29.0
771,Looking for my will to go back to the office,1.2321428571428572,0.0673769750864464,56,45,9,2,False,False,44.0
771,‘I thought you said you wanted some change in our relationship!’,1.2321428571428572,0.056929390240001,56,43,13,0,False,False,64.0
771,I thought we were going to LISTEN to hard metal…,1.2321428571428572,0.0673769750864464,56,45,9,2,False,False,48.0
771,I knew the reward money for my vaccine chip was set too high,1.2321428571428572,0.07203476536472,56,46,7,3,False,False,60.0
771,Online vs inPerson learning,1.2318840579710144,0.058922288817144,69,55,12,2,False,False,27.0
771,"I  told them we lived over a metal band, not a band of metal.",1.2318840579710144,0.058922288817144,69,55,12,2,False,True,61.0
771,"And you're still looking for loose change underneath the couch cushions, Bob!!!",1.2318840579710144,0.055186761636695,69,54,14,1,False,True,79.0
771,Did you check under the couch cushions?,1.2318840579710144,0.058922288817144,69,55,12,2,True,True,39.0
771,Sure you didn't leave your keys at the office?,1.2318840579710144,0.058922288817144,69,55,12,2,True,True,46.0
771,I told you that your getting that gold tooth would bring nothing but trouble.,1.2318840579710144,0.058922288817144,69,55,12,2,False,True,77.0
771,When you invited me over to see if we had a magnetic attraction I had no idea you had this in mind,1.2318840579710144,0.0511793044153576,69,53,16,0,False,False,98.0
771,Pokemon GO has really stepped it up,1.2318840579710144,0.058922288817144,69,55,12,2,False,False,35.0
771,You should probably remove any piercings beforehand... my last partner had quite a lot.,1.2318840579710144,0.058922288817144,69,55,12,2,False,True,87.0
771,I out-sourced the search for that lost key.,1.2317073170731707,0.0583285724933086,82,67,11,4,False,True,43.0
