contest,caption,mean,precision,votes,not_funny,somewhat_funny,funny,has_question_mark,ends_with_punctuation,caption_length
834,They recommend the beef.,1.7019328585961342,0.0126991223781692,3932,2007,1090,835,False,True,24
834,Your eggs should be out any minute now.,1.7002237136465324,0.0135492390550134,3129,1508,1051,570,False,True,39
834,Our early bird specials.,1.6819747416762345,0.0148678502431479,2613,1302,840,471,False,True,24
834,We'll have those crumbs on your table cleaned up in no time.,1.6422885572139303,0.0119407756056329,4020,2128,1202,690,False,True,60
834,This is our early bird special.,1.6311072564324949,0.0128377170355796,3459,1859,1017,583,False,True,31
834,They just wanted to thank you for being vegan,1.6296296296296295,0.0202518812508637,1377,738,411,228,False,False,45
834,The birds recommend the fish.,1.628221377270807,0.0154385768184861,2367,1271,705,391,False,True,29
834,From our new Roof to Table menu...,1.6276803118908385,0.0166985543980249,2052,1111,594,347,False,True,34
834,Your eggs will be right out,1.627402046418767,0.0117354802659302,4007,2130,1240,637,False,False,27
834,Care for a cockatiel?,1.6146158650843223,0.0134509333675679,3202,1782,872,548,True,True,21
834,Who had the wings?”,1.6109470815353168,0.0110778886471737,4403,2379,1358,666,True,False,19
834,May I introduce tonight’s specials?,1.602059580728209,0.0139948814779242,2719,1480,841,398,True,True,35
834,We just had these flown in.,1.601966221325939,0.0113604239950332,3967,2119,1308,540,False,True,27
834,"Yes, sir, all of our poultry is free-range.""",1.5876288659793814,0.0114511214322736,4171,2355,1181,635,False,False,44
834,Are you going to finish those croissant crumbs?,1.5853833293527586,0.0114261077253093,4187,2372,1179,636,True,True,47
834,You asked for separate bills?,1.5824812542603954,0.0135566985896931,2934,1659,841,434,True,True,29
834,Or do you think your eggs should come first?,1.5792854275391408,0.0148025914022509,2491,1424,691,376,True,True,44
834,"These are locally sourced, I assure you...Central Park, in fact.",1.57821482602118,0.0127316515034559,3305,1876,947,482,False,True,64
834,Where would you like your eggs?,1.5762644364794902,0.014609131286076,2511,1430,715,366,True,True,31
834,It's best when we don't tell you their names,1.5730077120822623,0.0117924739112558,3890,2237,1077,576,False,False,44
834,My true love gave these to me.,1.5685681904042312,0.0139106239195479,2647,1495,799,353,False,True,30
834,I understand you have a complaint about the way the eggs were made.,1.5677136972193615,0.0119041500559854,3884,2271,1021,592,False,True,67
834,We have some special tweets for desert.,1.5641129032258063,0.0145291695926332,2480,1425,711,344,False,True,39
834,I'm not your waiter.  I'm just here to pick up chicks.,1.56244160697602,0.013178980088851,3211,1905,806,500,False,True,54
834,"In lieu of cell phone coverage, we are pleased to provide a quaint but reliable message service.",1.5530353569046031,0.0181108813359443,1499,853,463,183,False,True,96
834,Thank you for not asking about our lobster selection.,1.5509181969949917,0.0148929889366134,2396,1416,640,340,False,True,53
834,It's our third day of Christmas Special.,1.5461196759864124,0.0116304831465179,3827,2253,1058,516,False,True,40
834,"Oh, don’t worry about the crumbs. Our busbirds will take care of it.",1.5408942202835332,0.0132049070963924,2751,1581,852,318,False,True,68
834,Our special for this evening: three French hens,1.5369609856262834,0.0159785077221271,1948,1144,562,242,False,False,47
834,Have you had a chance to become acquainted with the specials?,1.536850921273032,0.0206748779989659,1194,709,329,156,True,True,61
834,It’s the Chef’s last day. He’s giving everyone the bird.,1.5358527131782946,0.0157581157975934,2064,1230,562,272,False,True,56
834,They're much quicker than a busboy at cleaning up crumbs.,1.5345786963434025,0.0138624816377053,2516,1466,755,295,False,True,57
834,We have three turtle doves left over from the holidays.,1.5287195292799105,0.0117339219042964,3569,2114,1023,432,False,True,55
834,It's arm to table.,1.5286057692307693,0.0107532207938407,4160,2443,1235,482,False,True,18
834,We have three specials for you to choose from this evening...,1.5248713550600344,0.0143255255265384,2332,1375,690,267,False,True,61
834,Think of them as chicken with a better sense of direction.,1.522088353413655,0.0139685792581512,2490,1484,712,294,False,True,58
834,This fresh.,1.5220588235294117,0.0184009215321637,1496,907,397,192,False,True,11
834,Today's special is Three French Hens,1.5210218201170835,0.0158358264128882,1879,1108,563,208,False,False,36
834,Who’s feeling peckish?,1.5171014492753625,0.0118662886060539,3450,2073,970,407,True,True,22
834,Welcome to game night.,1.516337386018237,0.0136449893954011,2632,1589,727,316,False,True,22
834,I'm training them to recite the specials.,1.5141643059490084,0.0133058435946177,2824,1725,746,353,False,True,41
834,"Indeed sir. Locally sourced, sustainable cuisine is our mission, now say hello to tonight’s special.",1.5118300338000965,0.0149446288831105,2071,1231,620,220,False,True,100
834,"No, I ordered the 2 turtle doves my wife ordered the 3 French hens…you’ve got this all mixed up!….we’ll just take a partridge in a pear tree",1.5046142488002954,0.0136316910022953,2709,1685,681,343,False,False,140
834,Our menu is arm to table.,1.4893390191897655,0.012662362034431,2814,1720,811,283,False,True,25
834,May I tell you about tonight’s special on wings?,1.4621768273220557,0.0125144876399726,3133,2064,690,379,True,True,48
834,Care for some fresh eggs?,1.4582514734774066,0.0143690008608513,2036,1278,583,175,True,True,25
834,Before you order....some magic!,1.4577586206896551,0.0138086033377227,2320,1483,612,225,False,True,31
834,"Our special today is popcorn and sunflower seeds, with a side of millet, served at the foot of a miniature statue of a man on a horse.",1.4575835475578407,0.0139871207926323,2334,1509,582,243,False,True,134
834,Here’s your squab tartar. Would either of you like more coffee?,1.4457070707070707,0.0171014100030423,1584,1049,364,171,True,True,63
834,Here's the non-alcoholic flight you ordered.,1.439001413094677,0.0144053375074792,2123,1397,520,206,False,True,44
834,A three-egg omelette? There’s a bit of a wait.,1.425042111173498,0.0154756347896556,1781,1186,433,162,True,True,46
834,They recommend the pot roast.,1.4217199558985667,0.0156586194840101,1814,1231,401,182,False,True,29
834,I thought you said you wanted to pick up the chick.,1.407378939277479,0.0178036147993847,1301,882,308,111,False,True,51
834,They respectfully request you don't order their eggs scrambled.,1.3965217391304348,0.0183965000956463,1150,780,284,86,False,True,63
834,The accordion player is out sick so we thought we would try this little trio.,1.3953488372093024,0.0183228091733702,1118,752,290,76,False,True,77
834,This one has an eggy aroma with a hint of subway.,1.3942307692307692,0.0192968251763304,1040,707,256,77,False,True,49
834,The eggs might take awhile.,1.3936944219886822,0.0178887737330129,1237,847,293,97,False,True,27
834,You’re just in time for our “early bird specials”.,1.3905899925317402,0.0181274442698618,1339,951,253,135,False,True,50
834,What did you think “farm to table” meant?,1.3888888888888888,0.018744676650026,1206,849,245,112,True,True,41
834,Our chef insists that we present what you’ve ordered before he begins cooking. I recommend skipping the pork in the next course.,1.382943143812709,0.0194128136771467,1196,866,202,128,False,True,128
834,I'm talking FRESH!!,1.3812010443864229,0.0187763584730483,1149,808,244,97,False,True,19
834,This is what it sounds like when doves cry.,1.3768736616702355,0.020973846060001,934,664,188,82,False,True,43
834,Sidewalk to table.,1.3763440860215057,0.0190997435169507,1116,792,228,96,False,True,18
834,I’m just doing this until my magic career takes off.,1.374412041392286,0.0187051357896782,1063,738,252,73,False,True,52
834,You didn’t ask for the chick?,1.3741865509761388,0.0204725603235673,922,647,205,70,True,True,29
834,"Of course, these are just floor models.",1.3680709534368072,0.0203270786898995,902,633,206,63,False,True,39
834,They requested to speak with you regarding the Cornish hen you ordered as an entrée.,1.3677811550151977,0.0196951286300482,987,698,215,74,False,True,84
834,It's farm-to-table. Farm-to-kitchen-to-table is extra.,1.366120218579235,0.0216597296879603,915,670,155,90,False,True,54
834,"Yes, Sir. We are cage free.",1.3650627615062765,0.0206042772215813,956,690,183,83,False,True,27
834,They wanted to know if you enjoyed the bird's nest soup. And to remind you that they're homeless now.,1.359712230215827,0.0271855637616631,556,406,100,50,False,True,101
834,Choosing your lobster proved so popular we decided to offer a fresh quail option.,1.3573806881243062,0.0202622897952555,901,642,196,63,False,True,81
834,We’ve got a special on perch today.,1.3559718969555037,0.0303806188127143,427,310,82,35,False,True,35
834,We recommend the cracker.,1.3555045871559632,0.0201961638449075,872,617,200,55,False,True,25
834,They're part of our arm-to-table menu.,1.3487241798298906,0.0210202981221241,823,592,175,56,False,True,38
834,"Picking your own lobster worked so well for us, we are now doing it with our poultry selection  too",1.3471428571428572,0.0225424769115135,700,502,153,45,False,False,99
834,May I recommend the squab?,1.344155844155844,0.0211869233221018,770,551,173,46,True,True,26
834,the squab is particularly fresh tonight!,1.3436018957345972,0.0201316361061592,844,603,192,49,False,True,40
834,We hope you will give us a good tweet about our service,1.342143906020558,0.0228261713293778,681,492,145,44,False,False,55
834,They wanted to see their eternal resting place.,1.342064714946071,0.0237922137600437,649,473,130,46,False,True,47
834,The chef would like you to get to know each other a little first.,1.3419972640218878,0.0214052310822735,731,521,170,40,False,True,65
834,Three French Hens,1.3400250941028855,0.0211151831726348,797,578,167,52,False,False,17
834,"Don’t worry, it’s a sanitary napkin.",1.338006230529595,0.022997755305256,642,462,143,37,False,True,36
834,I am SO glad you asked about our Early Bird Special!,1.3376436781609196,0.0227181002860933,696,508,141,47,False,True,52
834,"Yeah, I mentioned the special is perch and now they won’t leave me alone",1.336884154460719,0.0225245660208529,751,557,135,59,False,False,72
834,"Can I draw your attention to tonight’s specials, which are currently going cheep",1.335978835978836,0.0218563399600522,756,554,150,52,False,False,80
834,"Today's Meet Your Dinner specials:  Chippy with apricots, Snooky Terrine, and our famous, Tweety Pie.",1.3357664233576645,0.0235916641376459,685,509,122,54,False,True,101
834,"Yes, sir. They're fresh.",1.3357348703170029,0.02265182250977,694,507,141,46,False,True,24
834,Are you sure it wasn’t their cookie?,1.3333333333333333,0.0249739611097181,606,451,108,47,True,True,36
834,And for my next trick…..,1.3333333333333333,0.0232386710926739,630,457,136,37,False,True,24
834,May I offer you a conversation starter?,1.3323076923076924,0.0228481409581796,650,472,140,38,True,True,39
834,"Oh, I don’t work here.",1.328729281767956,0.0218436457440936,724,531,148,45,False,True,22
834,"Would you like a napkin, sir?",1.3264604810996563,0.0239508280423983,582,425,124,33,True,True,29
834,They’ll come stuffed with bread scraps and shiny things.,1.3249211356466877,0.0232567842426241,634,467,128,39,False,True,56
834,"As part of our initiative to source locally, today’s special is 100% Arm-to-Table.",1.3231017770597735,0.0230576042017056,619,453,132,34,False,True,82
834,I’ll bring the check while my colleagues clean up those crumbs.,1.3227513227513228,0.0254545619756872,567,426,99,42,False,True,63
834,They also recommend the fish.,1.3222748815165877,0.0223734157129448,633,460,142,31,False,True,29
834,Would you like to hear the specials repeated three times?,1.317109144542773,0.0220327851009873,678,501,139,38,True,True,57
834,Good evening.  I'm Brett.  I'll be your server tonight.  Have you dined at Just Pigeons before?,1.3163751987281398,0.0236019013853294,629,472,115,42,True,True,95
834,"on the left we have wild caught Central Park pigeon, in the middle a Bronx variety, and on the right, an earthy Queens sample",1.3141891891891893,0.0251647070550574,592,453,92,47,False,False,125
834,Thankfully we are fresh out of lobster.,1.3114754098360657,0.0243278839142025,488,354,116,18,False,True,39
834,The towel? Isn't it obvious?,1.3114406779661016,0.0283928917931663,472,364,69,39,True,True,28
834,May I clean the breadcrumbs?,1.3099510603588906,0.0238339076067761,613,464,108,41,True,True,28
834,"Of course not, they’re just to alert us if we have another gas leak in the kitchen",1.3084922010398614,0.025201884891628,577,443,90,44,False,False,82
834,We’ve decided these come before the eggs,1.3083700440528634,0.0279643072323093,454,346,76,32,False,False,40
834,"Tastes like chicken, sir.",1.3065134099616855,0.0246281838199163,522,389,106,27,False,True,25
834,Sorry Sir we sold out of French Hens in December,1.303986710963455,0.0235918701471468,602,456,109,37,False,False,48
834,And our pigeon fricassee is guaranteed to be fresh!,1.303448275862069,0.0235718959489107,580,436,112,32,False,True,51
834,They are from a magician who couldn’t pay his bill!,1.301498127340824,0.024757809064814,534,404,99,31,False,True,51
834,They wanted to thank you personally for not ordering the squab appetizer.,1.3012295081967211,0.0264861295136867,488,373,83,32,False,True,73
834,"One in the hand, or two in the bush, sir?",1.3,0.0279039265294143,440,337,74,29,True,True,41
834,"They prefer “bus-birds”, sir.",1.298059964726631,0.0237242575697157,567,429,107,31,False,True,29
834,They’re the toughest critics—they Tweet about anything that ruffles their feathers.,1.2980251346499103,0.0237392693547537,557,420,108,29,False,True,83
834,"Due to avian flu we can't serve fowl any more, so instead we are teaching them to do stand up and perform light dinner theater.",1.297741273100616,0.0261483065576194,487,372,85,30,False,True,127
834,Would you like to hear the specials?” “The specials” “The specials” “The specials,1.2957198443579767,0.0240922440034308,514,385,106,23,True,False,81
834,"And our special for the evening- Birds of a feather, roasted together",1.2943632567849688,0.0263931686583542,479,368,81,30,False,False,69
834,"and for a limited time, we are offering our Christmas leftovers at a discounted price",1.2932330827067668,0.0249786195689932,532,409,90,33,False,False,85
834,Who had the 3 French Hens? Your Turtle Doves will be out in a minute.,1.291497975708502,0.0261095197538844,494,382,80,32,True,True,69
834,We only use the freshest ingredients.,1.2895752895752897,0.024178836349386,518,393,100,25,False,True,37
834,I heard you wanted dinner and a show.,1.2891304347826087,0.025983145725047,460,351,85,24,False,True,37
834,"Actually, I'm glad you spilled the bread basket.",1.2869379014989293,0.0265628069514664,467,362,76,29,False,True,48
834,The middle one recites the wine list.,1.2860310421286032,0.0255129196498252,451,342,89,20,False,True,37
834,Are they local?,1.2857142857142858,0.0258125939404636,448,341,86,21,True,True,15
834,The eggs here are really fresh.,1.285171102661597,0.0238609295747112,526,401,100,25,False,True,31
834,All our poultry is local.,1.2847058823529411,0.026500537995847,425,324,81,20,False,True,25
834,"I want to eat like a bird."" vs ""I want to eat, like, a bird.",1.2829373650107991,0.0273439060141787,463,365,65,33,False,True,60
834,"Thank you, but usually people leave money as a tip.",1.279445727482679,0.0276672551358068,433,340,65,28,False,True,51
834,You need to order an entree if you want them to sing,1.278723404255319,0.0250651045436285,470,361,87,22,False,False,52
834,"I have your two turtle doves, a partridge, and aperitifs.",1.2785087719298245,0.0242120263265995,456,344,97,15,False,True,57
834,No.  These are “to go”.,1.2776412776412776,0.0269062728213271,407,313,75,19,False,True,23
834,Are you fimished with your breadcrumbs?,1.2773722627737227,0.0273858095570104,411,319,70,22,True,True,39
834,Our full experience includes magic tricks between courses.,1.2760736196319018,0.023672830109724,489,372,99,18,False,True,58
834,Care for a non-dairy creamer?,1.2758620689655171,0.0294941006893815,377,297,56,24,True,True,29
834,"Yes, they’re baked in a pie.",1.275462962962963,0.0260365489848842,432,333,79,20,False,True,28
834,You get 3 complimentary tweets with every meal…,1.2740524781341107,0.0292319909073867,343,265,62,16,False,False,47
834,Let me defer to my colleagues to tell you about about our selection of crackers.,1.273170731707317,0.0279931751443997,410,323,62,25,False,True,80
834,Arm to table!,1.2717622080679405,0.0250774143471173,471,366,82,23,False,True,13
834,Aparrotif?,1.2705570291777188,0.0289012809143272,377,297,58,22,True,True,10
834,Which one would you two lovebirds like to eat?,1.2696078431372548,0.0271432920988309,408,319,68,21,True,True,46
834,May I recommend the perch?,1.2666666666666666,0.0297518884856369,360,286,52,22,True,True,26
834,Our dessert special tonight is poached parakeet in pear sauce.  Would you like to pick your parakeet?,1.2663755458515285,0.0246812966482967,458,355,84,19,True,True,101
834,I’m afraid we’re out of breadsticks.,1.2658227848101269,0.0313244710120817,316,250,48,18,False,True,36
834,"No, I ordered 2 turtle doves. The French hens go to table 12.",1.2645631067961165,0.0266388319431899,412,323,69,20,False,True,61
834,"Welcome to Rick's, where every day is the third day of Christmas!",1.2620320855614973,0.0278654347942542,374,294,62,18,False,True,65
834,We are sourcing our own eggs.,1.2594594594594597,0.0266672011443762,370,287,70,13,False,True,29
834,We overbooked the balcony,1.259016393442623,0.0305503348708455,305,240,51,14,False,False,25
834,"If duck a l'orange is too pricey, 
may I suggest pigeon a l'arm.",1.256,0.0266252798266366,375,293,68,14,False,True,64
834,I think one of them just called you cheap.,1.2554744525547443,0.0323158500896463,274,217,44,13,False,True,42
834,No Sir I’m not giving you the bird.,1.2531645569620251,0.0290058358194289,316,248,56,12,False,True,35
834,All squab is harvested from local cars and statues!,1.2529761904761905,0.0300285672753081,336,270,47,19,False,True,51
834,"They'll take your order.""",1.25,0.026487177171449,408,326,62,20,False,False,25
834,"We're ""arm to table.""",1.2491103202846976,0.0311943001479317,281,223,46,12,False,False,21
834,Simply attach a note to one of the pigeons whenever you’re in need of service,1.2484848484848483,0.0284090832335502,330,261,56,13,False,False,77
834,"Sir, your order was tweeted",1.247887323943662,0.0290681672487733,355,287,48,20,False,False,27
834,It's our cat-lovers' special.,1.2477611940298508,0.0311308335128584,335,275,37,23,False,True,29
834,I believe you inquired about freshness.,1.2474226804123711,0.0260948520896034,388,307,66,15,False,True,39
834,"Welcome to Gino’s authentic New York experience, these are the pigeons that will be bothering you today, can I get you a starter? Mozzarella sticks?",1.2465373961218835,0.0273282109788745,361,287,59,15,True,True,148
834,"Yes, indeed...our eggs are fresh.",1.2464788732394363,0.0320865019616918,284,229,40,15,False,True,33
834,"If you're not in the mood  for French hens, how about the partridge?",1.245664739884393,0.0268596670040344,346,272,63,11,True,True,68
834,They don't recommend the poultry.,1.2445054945054943,0.0265640827690846,364,288,63,13,False,True,33
834,Our violinist is on vacation.,1.2442748091603053,0.0329774837843727,262,211,38,13,False,True,29
834,And tonight we have a special tweet for you folks,1.242603550295858,0.0271732448856351,338,267,60,11,False,False,49
834,It is just like selecting a lobster from the tank.,1.2420749279538903,0.0279310664992666,347,278,54,15,False,True,50
834,Straight to you from the New York Library.,1.240506329113924,0.0293458106421298,316,254,48,14,False,True,42
834,May I interest you in a flight?,1.2394366197183098,0.0298718854589791,284,226,48,10,True,True,31
834,"Christmas special, two-thirds off.  Only one speaks fluent French.",1.239010989010989,0.0280829321094479,364,296,49,19,False,True,66
834,We don't use menus here. Would you prefer to see the lamb?,1.2387543252595157,0.0314883645730126,289,235,39,15,True,True,58
834,"It's our variation on 'pick your own lobster.'""",1.2386706948640482,0.029358083266112,331,269,45,17,False,False,47
834,And here is your flight.,1.238532110091743,0.0276321603999802,327,260,56,11,False,True,24
834,Which mama bird would you like to feed you?,1.2375886524822697,0.0323798332518799,282,231,35,16,True,True,43
834,"From the gentleman at the bar, sir.",1.2365591397849462,0.0321935354166701,279,228,36,15,False,True,35
834,They really really don’t want you to ask about the specials tonight,1.2364217252396166,0.0283529739435517,313,250,52,11,False,False,67
834,Would you like a bird in the hand or two in the bush?,1.236220472440945,0.0320054663266559,254,204,40,10,True,True,53
834,"No, sir, my emotional support animals are unfortunately not on the menu.",1.236220472440945,0.0329635413535258,254,206,36,12,False,True,72
834,"I’m glad you’re here, Mr. Reuter. Your office called and left three messages.",1.2361516034985425,0.0276790648992762,343,276,53,14,False,True,77
834,The squab is exceptionally fresh this evening.,1.236024844720497,0.0278312728225092,322,257,54,11,False,True,46
834,Chef didn’t want them to see us preparing the foie gras.,1.2352941176470589,0.0318853476014832,272,221,38,13,False,True,56
834,"Sir, I was told that you wanted to speak to the managers …",1.2349397590361446,0.0285661639600717,332,269,48,15,False,False,58
834,I can recommend the middle one.,1.2347826086956522,0.0278396705975341,345,279,51,15,False,True,31
834,"I'm sorry, but the chef is in a fowl mood.",1.234375,0.0312959221408645,256,205,42,9,False,True,42
834,"I know - French hens in an Italian bistro, right?  I just work here.",1.2340425531914894,0.0287149599205033,329,267,47,15,True,True,68
834,"No, these are sparkling sparrows. True pigeons come from the Pigeon Forge Region of Tennessee.",1.233983286908078,0.0270939070417528,359,290,54,15,False,True,94
834,Which one’s children would you like in your omelette?,1.233898305084746,0.0309093915684899,295,241,39,15,True,True,53
834,All our dishes are arm-to-table.,1.233812949640288,0.0278673804397141,278,218,55,5,False,True,32
834,Bon appetweet.,1.2336065573770492,0.0332838192842558,244,198,35,11,False,True,14
834,It’s a little gimmicky but these cuties sing you the specials,1.2333333333333334,0.0270263578258724,360,291,54,15,False,False,61
834,We now offer crumb-free service.,1.233201581027668,0.0304825328602567,253,201,45,7,False,True,32
834,We believe it's more humane not to break up the family when preparing them.,1.2317596566523603,0.035333088736007,233,192,28,13,False,True,75
834,These gentlemen paid for your meal. They also kindly provided the creamer in your coffee earlier from their seats above your table.,1.2307692307692308,0.0314787535027359,286,235,36,15,False,True,131
834,Did we save any room for pigeons?,1.2303030303030302,0.0291883021685919,330,271,42,17,True,True,33
834,...and they're 100% free range.,1.22992700729927,0.031135519655386,274,223,39,12,False,True,31
834,"Oh, I thought you said it was your Bird Day.",1.22992700729927,0.031135519655386,274,223,39,12,False,True,44
834,And here we have the cockatiel flight.,1.2297297297297298,0.0291854564044049,296,239,46,11,False,True,38
834,The carrier pigeons will send your order in now. You should expect your meal in two to six days.,1.2294520547945205,0.0298331897422302,292,237,43,12,False,True,96
834,Our pigeons are all locally sourced.,1.229090909090909,0.029272822068289,275,220,47,8,False,True,36
834,French hens special.  Chef's true love took a hike.,1.2286821705426356,0.0323772684845917,258,211,35,12,False,True,51
834,They’re market price.,1.226148409893993,0.0311678842212037,283,233,36,14,False,True,21
834,Did you say check or chick,1.2259136212624584,0.0279688708771238,301,242,50,9,False,False,26
834,We're out of Jerk Chicken. May I offer you some asshole pigeons?,1.225409836065574,0.0335156064383555,244,201,31,12,True,True,64
834,They like crumbs.,1.2253968253968257,0.0271663871578918,315,253,53,9,False,True,17
834,Something tweet to go with your tea?,1.225165562913907,0.0297933783797881,302,248,40,14,True,True,36
834,Tastes like chicken.,1.225,0.0333638284496024,240,197,32,11,False,True,20
834,Would anyone like a cracker?,1.2248062015503876,0.0303214860812343,258,208,42,8,True,True,28
834,"Yes, everything on the menu is arm to table",1.2241992882562278,0.0312580329969929,281,232,35,14,False,False,43
834,"Stick with the drinks, the food is for the birds.",1.2236286919831223,0.034648571121225,237,197,27,13,False,True,49
834,"And they're not just cage free, they're wild caught.",1.2226890756302522,0.0329385224992379,238,195,33,10,False,True,52
834,They are birds of a feather.,1.222591362126246,0.0266402926202384,301,240,55,6,False,True,28
834,Say wren.,1.2214022140221403,0.030645166705876,271,222,38,11,False,True,9
834,Enlarged to show detail.,1.220532319391635,0.0316922564016605,263,217,34,12,False,True,24
834,"It’s our latest thing, we like to call it ‘statue to table’",1.2201492537313432,0.0308295490370281,268,220,37,11,False,False,59
834,"Yes, we pride ourselves on our arm-to-table initiative.",1.22,0.029008129410673,300,246,42,12,False,True,55
834,We fly them in fresh every day.,1.2194244604316546,0.0268741111859202,278,221,53,4,False,True,31
834,I went for the 3 in the bush.,1.219269102990033,0.0277483229472705,301,244,48,9,False,True,29
834,These are my emotional support pigeons.,1.2185185185185186,0.0315088039788213,270,224,33,13,False,True,39
