contest,caption,mean,precision,votes,not_funny,somewhat_funny,funny,has_question_mark,ends_with_punctuation,caption_length
770,"I guess ""trail lawyer"" wasn't a typo after all.",1.9010300044782804,0.0122498065039585,4466,1739,1430,1297,False,True,47
770,"I found them Sir. No, they don't want to extend their vehicle's warranty.",1.8864970645792565,0.0131959018423028,4088,1713,1126,1249,False,True,73
770,He's an adventure capitalist.,1.8634361233480177,0.013126331859582,3632,1418,1292,922,False,True,29
770,I guess I misunderstood when you said your legal problems were behind you.,1.8421208530805688,0.0135269331147902,3376,1351,1207,818,False,True,74
770,"Stop whining, Larry. The destination divorce was your idea.",1.8294144767173812,0.0174072530162482,2169,929,681,559,False,True,59
770,"No, I said be sure to layer up.",1.8256674171759408,0.0144568050640386,3109,1328,995,786,False,True,31
770,This was a molehill until your lawyer got involved.,1.822904368358914,0.013794991146619,3388,1445,1098,845,False,True,51
770,Maybe we should let this guy pass. He looks like he means business.,1.8152295632698767,0.0260009903489878,893,367,324,202,False,True,67
770,"Funny,you never really believe ‘em when they say that they’ll be with you every step of the way.",1.813341684935797,0.0136202896295623,3193,1299,1191,703,False,True,96
770,"What I actually said was, ""Bring along an extra 'layer' for the higher elevations.",1.8018433179723503,0.0171030916439506,2170,946,708,516,False,True,82
770,My husband will never find out about us. He’s on a business trip.,1.7960295834955236,0.0160200639055223,2569,1162,769,638,False,True,65
770,"Whatever you do, don't make eye contact.  The ranger said they can be litigious.",1.7853697749196142,0.0156700790805481,2488,1084,854,550,False,True,80
770,The creepiest thing about him is that there's no cell service up here.,1.7852882703777335,0.0202858475289145,1509,665,503,341,False,True,70
770,"Next time, let's just sign the waiver.",1.7814105558150397,0.016528556630126,2141,911,787,443,False,True,38
770,He did say he'd be with us every step of the way.,1.7800511508951409,0.0169955474264519,1955,814,757,384,False,True,49
770,What makes you think I want a divorce?,1.770673076923077,0.0170670837689599,2080,923,711,446,True,True,38
770,"Hello, you’ve reached Lawyers Without Borders",1.7706725468577729,0.0264363579786562,907,415,285,207,False,False,45
770,I don't think these folks know what a tax hike is.,1.769736842105263,0.0170329979266473,2128,958,702,468,False,True,50
770,Google's tracking used to be more subtle.,1.768162393162393,0.0177811157003851,1872,821,664,387,False,True,41
770,Apparently we’re an accident waiting to happen.,1.7659574468085106,0.0172124132598853,1974,862,712,400,False,True,47
770,"Disregard him dear, there's a tax shelter just ahead.",1.7605,0.0171964453846407,2000,888,703,409,False,True,53
770,Please clarify the next time you invite me to a summit meeting.,1.7592867756315007,0.0170686457698716,2019,895,715,409,False,True,63
770,I'd feel safer about this route if it weren't so crowded with personal-injury attorneys.,1.7573221757322175,0.016710054618806,2151,970,733,448,False,True,88
770,"I think I'm at the wrong summit meeting.""",1.7546012269938651,0.0204074473543282,1467,672,483,312,False,False,41
770,"Yes sir, that’s right. They’ll be coming around the mountain when they come.",1.753528773072747,0.0186546917691122,1842,873,549,419,False,True,76
770,We should’ve never pressed 5 to speak to an actual agent.,1.753528773072747,0.0183518880301709,1842,854,588,400,False,True,57
770,He thought it was a tax hike.,1.7530487804878048,0.0176064819500981,1968,903,647,417,False,True,29
770,I found those last two remote workers you asked me to check on.,1.7523493642896628,0.0184806949687923,1809,838,581,390,False,True,63
770,"Meeting went great, sir. They said I only take things literally, and then asked me to take a hike.",1.7487216946676407,0.0212735770590563,1369,639,435,295,False,True,98
770,"Can't talk, I'm showing a couple that new listing.",1.7479725514660012,0.019336528908454,1603,732,540,329,False,True,50
770,"I’m telling you. I’m not a workaholic. In fact, I’m hiking with my friends as we speak.",1.7468879668049793,0.0206542173607266,1446,675,462,309,False,True,87
770,Just how big a policy did you buy?,1.7412670219064534,0.0189880997183824,1689,789,548,352,True,True,34
770,"If he says ""Can you hear me now"" one more time,I'm kicking him down the mountain.",1.737381126554499,0.0213694612363724,1367,653,420,294,False,True,81
770,"Don’t look at him, Carl. You’ll only encourage more billable hours.",1.7366597366597367,0.019850560685921,1443,650,523,270,False,True,67
770,Oh.  I thought you said we needed a “trail” lawyer.,1.7233169129720851,0.021414511233288,1218,555,445,218,False,True,51
770,Our accountant says this is a tax hike.,1.7221362229102166,0.020995306751253,1292,597,457,238,False,True,39
770,You were right. We should have just signed the release form.,1.7173553719008263,0.0214221957281846,1210,555,442,213,False,True,60
770,I may have gone a little overboard on the travel insurance.,1.7166806370494552,0.0220313495156,1193,562,407,224,False,True,59
770,"Yes, I'm right here. If one of them falls we''ll get the case.",1.7156862745098038,0.026978412486574,816,391,266,159,False,True,62
770,It's some silly requirement because I tripled your life insurance policy,1.714655172413793,0.0228920909517521,1160,565,361,234,False,False,72
770,Guess it's a tax hike.,1.713664055700609,0.0226012826427353,1149,551,377,221,False,True,22
770,"All this, just so he can get a signal.",1.707906976744186,0.0248381847430719,1075,559,271,245,False,True,38
770,Sherpas have come along way since unionizing.,1.707502374169041,0.023193620543686,1053,497,367,189,False,True,45
770,They used to just chase ambulances,1.706896551724138,0.0232044551205758,1044,491,368,185,False,False,34
770,That's the last time I tell a lawyer to go take a hike.,1.7066155321188878,0.0234615138023422,1043,497,355,191,False,True,55
770,"Frank, he said 'layer up' not 'lawyer up'.",1.706333973128599,0.0234430573603796,1042,496,356,190,False,True,42
770,Never tell an IRS agent to take a hike.,1.7058261700095512,0.0249070227590485,1047,539,277,231,False,True,39
770,It doesn’t look like we’re losing him. Let’s just buy the policy.,1.7034825870646766,0.0236347042661553,1005,475,353,177,False,True,65
770,"Remember, if we meet a mountain lion, let the lawyer do all the talking.",1.7015384615384614,0.024068989723641,975,464,338,173,False,True,72
770,"When he told me he couldn't get the day off, I assumed that meant he wasn't coming.",1.700518134715026,0.0246762134148472,965,471,312,182,False,True,83
770,"Yeah, I’m at my desk. What’s up?",1.6965442764578833,0.0252875343079908,926,457,293,176,True,True,32
770,I didn't realize this would be a tax hike.,1.6948775055679288,0.025417496191389,898,439,294,165,False,True,42
770,Remember we did actually tell him to take a hike.,1.693181818181818,0.0245225135358764,880,409,332,139,False,True,49
770,Never look one in the eye. It could trigger an audit.,1.6926605504587156,0.0252863874186293,872,418,304,150,False,True,53
770,I'm not surprised that he can keep up. I'm surprised he can still get a good signal.,1.6924829157175398,0.0243611044698564,878,405,338,135,False,True,84
770,He's a trail attorney.,1.689940828402367,0.0263390245054369,845,419,269,157,False,True,22
770,Should we just buy the damn insurance policy or do you think we can lose him above the tree line?,1.6885245901639343,0.0289022443685076,732,373,214,145,True,True,97
770,You can take the man out of the office . . .,1.6881067961165048,0.0287065867747838,824,448,185,191,False,True,44
770,"Complain all you want, Stanley, but with all the floods and wildfires, we’re lucky to find a realtor who specializes in caves.",1.682170542635659,0.0271743701387518,774,383,254,137,False,True,126
770,"You see him too,right?",1.6804812834224598,0.0274373154973426,748,368,251,129,True,True,22
770,If he passes us dressed like that we should just quit.,1.675977653631285,0.0283971279170154,716,360,228,128,False,True,54
770,"When you said your 'big brother was always watching,' I thought you meant the government.",1.6734104046242777,0.0287845931724982,692,348,222,122,False,True,89
770,That's my broker - he'll bail as soon as we start to go down.,1.6729377713458755,0.0290398783276264,691,351,215,125,False,True,61
770,You should have just signed the liability waiver like everyone else,1.6715542521994136,0.0284692027143404,682,337,232,113,False,False,67
770,"Yeah, I’m meeting with them now, Jim.  I’ll be honest with you…the whole thing is an uphill battle",1.6681681681681682,0.0292787437475304,666,337,213,116,False,False,98
770,Why on earth did you Google “life insurance” just before our vacation?,1.665615141955836,0.0310578180446196,634,335,176,123,True,True,70
770,"Careful - a lawyer in the wild will charge if provoked, and well beyond his billable rate.",1.6651162790697671,0.0303915860996959,645,336,189,120,False,True,90
770,Calmly reach for your Bear Stearns spray.,1.6645468998410176,0.0310250142136615,629,331,178,120,False,True,41
770,He's just a social climber,1.6629570747217806,0.028927533124967,629,307,227,95,False,False,26
770,They say global warming is driving predators to higher elevations,1.6628664495114007,0.0311500610634554,614,321,179,114,False,False,65
770,"His motto is, “Losers chase ambulances.  Winners are there when the accident happens.”",1.6601307189542485,0.0303883062263694,612,312,196,104,False,False,86
770,"When we get home, remind me to open that letter from the IRS.",1.659432387312187,0.030741911043203,599,306,191,102,False,True,61
770,"You know handing me a prenup right after a proposal would ruin the moment,right?",1.6551126516464472,0.0320018320448905,577,304,168,105,True,True,80
770,He’s still there Ruth. Maybe we should just take the extended warranty.,1.6549295774647887,0.0321249697013711,568,298,168,102,False,True,71
770,This is Arthur's first time on a corporate retreat.,1.6547008547008546,0.0293476657282148,585,283,221,81,False,True,51
770,When do we tell him this isn’t that type of summit?,1.6542553191489362,0.0312242883774912,564,286,187,91,True,True,51
770,"Tom, I told you there was something fishy about a Sherpa named Goldberg.",1.6536412078152751,0.0327545751695057,563,301,156,106,False,True,72
770,Thanks for letting me invite Carl. He's trying to improve his work/life balance.,1.6508226691042047,0.0305261603859687,547,268,202,77,False,True,80
770,"Jenny, can you move my 3 o clock? Making the Robinsons look like an accident is taking longer than I thought",1.6497695852534562,0.0363836114906267,434,227,132,75,True,False,108
770,My travel insurance literally provides 24/7 access to an agent on the phone.,1.6497277676951,0.0320553400361218,551,286,172,93,False,True,76
770,First they hike our rates and now they want to rate our hikes...maybe we should switch insurance companies.,1.6496478873239435,0.0322654763368024,568,302,163,103,False,True,107
770,You were the one that wanted trip insurance.,1.6495412844036696,0.0302925999653193,545,265,206,74,False,True,44
770,"Yes, I’m sure. The early voting ballot drop box is just over that ridge.",1.6478342749529191,0.0339901711128711,531,289,140,102,False,True,72
770,Jim is still adjusting to the idea of working remotely.,1.6477272727272727,0.032198343772578,528,270,174,84,False,True,55
770,I've been trying all day but they still don't want insurance.,1.6477272727272727,0.0326417500270883,528,274,166,88,False,True,61
770,"Yes, I'm on my way to the summit meeting.",1.6420454545454546,0.0331264020813241,528,281,155,92,False,True,41
770,I told you we should have just signed the waiver like everybody else!,1.641891891891892,0.034496179927633,444,225,153,66,False,True,69
770,See what happens when you don’t sign the waiver.,1.640159045725646,0.0319568186279393,503,252,180,71,False,True,48
770,"Honey, the ranger warned us not to make eye contact.",1.6391752577319587,0.0339056616445211,485,254,152,79,False,True,52
770,"No, this isn’t a virtual background. I’m actually here.",1.6382536382536383,0.0329755661617407,481,244,167,70,False,True,55
770,"Ignore him, he's just a social climber.",1.6359743040685224,0.0348373935130458,467,248,141,78,False,True,39
770,I'm starting to think he's not a real sherpa.,1.6349892008639308,0.0338648341771783,463,238,156,69,False,True,45
770,"Keep walking, dear. Women now get followed everywhere they go in Texas.",1.6345776031434185,0.0349602390602363,509,285,125,99,False,True,71
770,"Hey, Jim. Listen, I’m beginning to suspect this isn’t really the corporate ladder I’m climbing.",1.6345733041575492,0.0335075781282154,457,231,162,64,False,True,95
770,"Remember, he’s as afraid of us as we are of him.",1.633832976445396,0.0347230980370441,467,248,142,77,False,True,48
770,"Yes Senator Cruz, they are making their way to the abortion clinic right now.",1.6337448559670782,0.0365454151463049,486,279,106,101,False,True,77
770,If you show him any attention he'll bill us for it.,1.6296296296296295,0.0345565055054338,459,242,145,72,False,True,51
770,"I told you to bring your GPS,not your CPA",1.6293103448275863,0.0353356757456949,464,252,132,80,False,False,41
770,"Harry, just buy the frigging insurance policy already!",1.6273148148148149,0.0335035039178963,432,215,163,54,False,True,54
770,Just ignore him. He’s been trying to get me to switch phone plans for weeks.,1.6244725738396624,0.0349048458947384,474,259,134,81,False,True,76
770,This is so much worse than the last audit,1.6238095238095238,0.036508760044143,420,226,126,68,False,False,41
770,You fed him. What did you expect?,1.6232227488151658,0.036684755410352,422,229,123,70,True,True,33
770,"Going to have to call you back, sweetie. I think I’m at the wrong summit.",1.6217494089834514,0.0375340333045726,423,236,111,76,False,True,73
770,I told you not to sign up as an organ donor.,1.621686746987952,0.0373442339904572,415,228,116,71,False,True,44
770,"No I’m not death, I’m taxes",1.6163682864450128,0.0383657943886531,391,216,109,66,False,False,27
770,I remember when they only chased ambulances.,1.61340206185567,0.038796520699283,388,217,104,67,False,True,44
770,I thought you said the IRS couldn’t find us here,1.6133004926108374,0.0352477247524492,406,211,141,54,False,False,48
770,Some chase ambulances – some just can’t wait.,1.6105527638190955,0.0378727944422457,398,221,111,66,False,True,45
770,"Don't worry, pretty soon he'll lose signal and retreat back to his natural habitat.",1.61,0.0356781772352101,400,210,136,54,False,True,83
770,I wish he'd unfollow us.,1.6088082901554404,0.036494872614677,386,204,129,53,False,True,24
770,I wish people would stop feeding them.,1.6082474226804124,0.0561925131047175,194,112,46,36,False,True,38
770,"It's his first week in Workaholics Anonymous, cut him some slack.",1.606060606060606,0.0368734836381867,363,189,128,46,False,True,65
770,"You just had to decline the park’s terms and conditions, didn’t you?",1.605744125326371,0.037108319097962,383,206,122,55,True,True,68
770,Of course we brought a lawyer. The laws of nature are so obscure.,1.6038781163434903,0.0396540296060505,361,202,100,59,False,True,65
770,"I think he misunderstood the phrase ""working remotely"".",1.6022099447513811,0.0369808205738103,362,190,126,46,False,True,55
770,He’s more of a social climber.,1.6016713091922006,0.0380463726502956,359,193,116,50,False,True,30
770,Keep walking... he charges my husband by the hour.,1.6005291005291005,0.0380831216687234,378,209,111,58,False,True,50
770,I can see why someone would tell him to take a hike.,1.600522193211488,0.0376942560699624,383,211,114,58,False,True,52
770,I told you to never make eye contact with an insurance salesman.,1.5994550408719346,0.0387909979783926,367,204,106,57,False,True,64
770,"So far no accidents, but I'll let you know.",1.5994475138121549,0.0376169800184508,362,194,119,49,False,True,43
770,At the top of the climb he is going to make us a tax shelter.,1.5988700564971752,0.0390996308632884,354,195,106,53,False,True,61
770,"When you said our lawyer was going on vacation, I didn’t think you meant with us.",1.5975975975975976,0.0385242437044295,333,176,115,42,False,True,81
770,Exactly how much life insurance did you take out on me before this trip?,1.596273291925466,0.0400164833143335,322,174,104,44,True,True,72
770,"You’re right, Boss. Jim isn’t really working from home.",1.5957446808510638,0.04029715345658,329,181,100,48,False,True,55
770,"I said I wanted a trial lawyer, not a trail lawyer.",1.5923753665689149,0.0392200323340852,341,187,106,48,False,True,51
770,They can’t afford to buy in the city so we’ve expanded the search a bit,1.5917721518987342,0.0420896084275233,316,179,87,50,False,False,71
770,My lawyer? I thought he was your lawyer.,1.5917159763313609,0.0390456450835954,338,184,108,46,True,True,40
770,Can I call you later? I just found a potential client,1.5917159763313609,0.0403721739005182,338,190,96,52,True,False,53
770,I guess no matter where you go they're going to track you down about your car's extended warranty.,1.5914634146341464,0.0415599922109135,328,187,88,53,False,True,98
770,What’s the point of working remotely if your boss follows you everywhere?,1.5911949685534592,0.0399461159582193,318,172,104,42,True,True,73
770,"Listen Susan, of course I thought it was a typo when he wrote that he had tons of trail experience.",1.5907692307692307,0.0407167861359573,325,181,96,48,False,True,99
770,Can't we negotiate the prenup after the hike?,1.590625,0.0407333676415302,320,177,97,46,True,True,45
770,He’s having some trouble adjusting to retirement,1.5902140672782874,0.0383874952542124,327,173,115,39,False,False,48
770,What's even curiouser is how is he getting five bars?,1.5897435897435896,0.04054202128421,312,170,100,42,True,True,53
770,Almost. I'm waiting for a flat place to serve the papers.,1.5893416927899686,0.0386075636819729,319,168,114,37,False,True,57
770,"No Mel, it's not a good sign that the sherpas here are also personal injury lawyers!",1.589171974522293,0.0420766936235128,314,178,87,49,False,True,84
770,"I couldn't find the insect repellant, so I settled for an attorney.",1.587878787878788,0.0416071526874026,330,190,86,54,False,True,67
770,I thought he was YOUR lawyer.,1.5870967741935484,0.0412696994117628,310,172,94,44,False,True,29
770,"I’m with them now, Sir. Is ‘adventurous’ a pre-existing condition?",1.5841584158415842,0.0404340049151834,303,164,101,38,True,True,66
770,What's particularly galling is that he wants to pass us.,1.5823170731707317,0.0409408444823368,328,187,91,50,False,True,56
770,"Don't worry honey, plenty of people sign their wills at the top of a cliff.""",1.5815384615384616,0.0423759270174822,325,191,79,55,False,False,76
770,This is the last time I hire a Sherpa out off Craigslist,1.5789473684210529,0.0421021743369128,285,157,91,37,False,False,56
770,I thought you packed the lawyer spray.,1.5786350148367954,0.0416224336471974,337,199,81,57,False,True,38
770,"They asked for a trial lawyer, not a TRAIL lawyer.",1.5785953177257526,0.0435386509667486,299,174,77,48,False,True,50
770,"When I told our lawyer to take a hike,I did not mean with us.",1.5763888888888888,0.041494919619108,288,158,94,36,False,True,61
770,I think it’s time for people to go back to the office,1.5740740740740742,0.0445298413137871,270,154,77,39,False,False,53
770,How many lawyers does it take to ruin a vacation? One. Just one.,1.5735294117647058,0.0457863979129012,272,160,68,44,True,True,64
770,"If you would just slow down, I can tell you about your car’s extended warranty.",1.5729537366548043,0.0463122028977976,281,170,61,50,False,True,79
770,When will your brother learn how to relax?,1.572463768115942,0.0413141702949862,276,149,96,31,True,True,42
770,"No, we don't need hiking insurance, and that's final.",1.571917808219178,0.0419437979610313,292,164,89,39,False,True,53
770,Don't look at me. I'm not the one who wanted a tax hike.,1.5714285714285714,0.0438616741775959,273,155,80,38,False,True,56
770,"I forgot the attorney spray, so if he charges, we'll have to use our sticks.",1.570945945945946,0.0426060874656835,296,170,83,43,False,True,76
770,He must be working remotely.,1.5708955223880596,0.0419047619115341,268,145,93,30,False,True,28
770,I made this vacation a business expense and the IRS will never know.,1.568181818181818,0.041845030989265,308,178,85,45,False,True,68
770,Gary finally realized that he should have said no and not maybe at that timeshare tour.,1.568181818181818,0.0453463974415568,264,153,72,39,False,True,87
770,I think my husband is having us followed.,1.5672131147540984,0.0403383194579357,305,170,97,38,False,True,41
770,We’ll lose him. He only knows how to climb a ladder.,1.5671641791044777,0.0407980543682818,335,197,86,52,False,True,52
770,Don't answer your phone. It will just be him again.,1.567049808429119,0.0441170088277949,261,147,80,34,False,True,51
770,This is my last team building event,1.5666666666666669,0.0439512077232605,270,154,79,37,False,False,35
770,"In hindsight, was it a good idea telling the IRS agent to take a hike?",1.5666666666666669,0.0445733364395667,270,156,75,39,True,True,70
770,"I'm beginning to regret having a broker with this level of ""personalized service.""",1.5658362989323844,0.0426367873300754,281,159,85,37,False,False,82
770,"What did you think the IRS was going to do when you told them ""Go Take A Hike!""?",1.5656934306569343,0.044976742717468,274,161,71,42,True,True,80
770,"Go ahead, use the bear spray.",1.565217391304348,0.0416754015018002,276,152,92,32,False,True,29
770,Don't make eye contact.  It's trying to form an attorney-client relationship.,1.5643939393939394,0.0459979947147389,264,156,67,41,False,True,77
770,"Maybe it is comprehensive,but our new insurance policy still gives me the creeps.",1.5622895622895625,0.0420028267438412,297,171,85,41,False,True,81
770,This is just an accident lawyer waiting to happen.,1.5615384615384615,0.046565337214167,260,155,64,41,False,True,50
770,"No, I didn't take a policy out on you. Keep climbing",1.5602836879432624,0.043140159789349,282,163,80,39,False,False,52
770,I wish you hadn't used the phrase 'accident waiting to happen' around your brother.,1.5595238095238095,0.0463877520992662,252,148,67,37,False,True,83
770,The life insurance company wasn’t lying when they said their medical assessment would be thorough.,1.5573122529644268,0.0452282574799476,253,146,73,34,False,True,98
770,He must be here for a summit conference,1.556910569105691,0.0451208674946128,246,140,75,31,False,False,39
770,"I asked you to get a trail guide, not a trial guide.",1.5555555555555556,0.0446299309912282,270,159,72,39,False,True,52
770,"Yes sir, I've located the 'road less traveled.' It appears to be an untapped market.""",1.555084745762712,0.0461820154237026,236,135,71,30,False,False,85
770,I said let’s go hiking on account it’s good for us; not let’s go hiking with your accountant Gus.,1.5539568345323742,0.045108590302994,278,168,66,44,False,True,97
770,"Darn it, I left the lawyer repellent back at the campsite.",1.553191489361702,0.0486375766669088,235,141,58,36,False,True,58
770,Does your work have to follow you everywhere?,1.553030303030303,0.0421334452854904,264,147,88,29,True,True,45
770,No worries. We'll lose him when he loses reception.,1.5525291828793777,0.0404296703503325,257,142,90,25,False,True,51
770,We need him. Someone has to certify that we’ve found the missing votes.,1.5518672199170125,0.0484192837184351,241,146,57,38,False,True,71
770,He says he’s Jake from State Farm”,1.5510204081632653,0.049859663360384,245,154,47,44,False,False,34
770,"Move over Steve and let him pass, it's another remote worker.",1.5510204081632653,0.0456564778117552,245,142,71,32,False,True,61
770,I told you keeping him on retainer was a bad idea.,1.5508474576271187,0.045810769333007,236,135,72,29,False,True,50
770,Stay calm...trail attorneys can smell fear.,1.5502183406113537,0.0472714655544013,229,133,66,30,False,True,43
770,I have to keep reminding myself he's bringing the weed.,1.5490196078431373,0.0436021380179919,255,145,80,30,False,True,55
770,I thought he was with you.,1.548780487804878,0.0462488048709197,246,145,67,34,False,True,26
770,You're the one who asked for a sherpa who is 'all business.',1.548780487804878,0.04515971585451,246,142,73,31,False,False,60
770,I can’t believe he’s ordering lunch.,1.5482456140350878,0.0466161755506561,228,131,69,28,False,True,36
770,"Yes, yes. I'm on my way to work now... there's just a little bit of foot traffic.",1.5476190476190477,0.0417833826164027,252,138,90,24,False,True,81
770,They give up once they lose a signal.,1.5475285171102662,0.0426183991638855,263,149,84,30,False,True,37
770,Tell me again how much life insurance you have on me.,1.5461847389558232,0.0468807566317951,249,150,62,37,False,True,53
770,Maybe purchasing the double-indemnity life insurance policy could have waited till after our trip.,1.5458333333333334,0.0448723265022838,240,137,75,28,False,True,98
770,I've located your husband. I think we'll get a generous settlement.,1.5446428571428572,0.0480966962386496,224,132,62,30,False,True,67
770,"I did not say, attorney. I said by the end of this hike I may need a gurney. You never listen to me!",1.544,0.0457013177246244,250,148,68,34,False,True,100
770,I've been trying to get in touch with you about your car's extended warranty.,1.5434782608695652,0.0651468287829509,138,86,29,23,False,True,77
770,Remind me not to bring work with me on vacation next time.,1.54337899543379,0.04492088277749,219,121,77,21,False,True,58
770,"Next time, just sign the d*mn liability waiver!",1.5429864253393666,0.0490220337131395,221,132,58,31,False,True,47
770,"Okay, you win, my clients are taking a hike.",1.542857142857143,0.0453232691745839,245,143,71,31,False,True,44
