contest,caption,mean,precision,votes,not_funny,somewhat_funny,funny,has_question_mark,ends_with_punctuation,caption_length
834,And here we have the Loire Valley Vintage Birds of a Feather.,1.1376146788990826,0.0282942692256723,218,194,18,6,False,True,61
834,Chef is only accepting orders delivered by carrier pigeon,1.1376146788990826,0.0282942692256723,218,194,18,6,False,False,57
834,"Excuse me, but this table is reserved for three of our customers.",1.1375661375661377,0.0262175540048301,189,164,24,1,False,True,65
834,Can I see the a la carte menu first,1.1375661375661377,0.0292612714861421,189,167,18,4,False,False,35
834,We offer a true outdoor experience for only five dollars more; twenty-five if you want to include dry cleaning.,1.1372549019607845,0.026985469411913,204,179,22,3,False,True,111
834,In this case the bird in the hand was worth three on the forearm.,1.1372549019607845,0.028719434528962,204,181,18,5,False,True,65
834,It works just like the lobster tank at the seafood place next door...,1.1372549019607845,0.0278659422866393,204,180,20,4,False,True,69
834,Sorry but inflation’s done away with 4 and 20.,1.1372549019607845,0.028719434528962,204,181,18,5,False,True,46
834,We've taken farm-to-table to the next level.,1.137055837563452,0.0275466568719689,197,173,21,3,False,True,44
834,"Good evening, Have you dined with us at the Parriott before?",1.137055837563452,0.0293668698061154,197,175,17,5,True,True,60
834,We are an arm to table restaurant.,1.137055837563452,0.0265898652897738,197,172,23,2,False,True,34
834,« You’ve got mail. »,1.137055837563452,0.0284713131680936,197,174,19,4,False,False,20
834,Today's special is fresh squab.,1.1369863013698631,0.0266433060402242,219,193,22,4,False,True,31
834,"Don't worry, they don't know why you're choosing them...",1.1367924528301887,0.0263392166547792,212,186,23,3,False,True,56
834,QR codes are so 2022. We’re now displaying the menu via carrier pigeon.,1.1366120218579234,0.0277158958673757,183,160,21,2,False,True,71
834,Today's special is free range chicken.,1.1365853658536584,0.0268618557798468,205,180,22,3,False,True,38
834,These are Quail we plan to BBQ unless you would like to make a large donation to have them released.,1.1365853658536584,0.0277377595272065,205,181,20,4,False,True,100
834,Would you like to start with an Apérikeet?,1.1365853658536584,0.0285868380770062,205,182,18,5,True,True,42
834,Here are your squab. I will return with the tangy orange sauce.,1.1363636363636365,0.0294579122654902,176,155,18,3,False,True,63
834,You did say you ordered on Twitter.,1.1363636363636365,0.0283356097324633,198,175,19,4,False,True,35
834,"Sir, I want to give you the bird.",1.136150234741784,0.0270544553725872,213,188,21,4,False,True,33
834,Our special tonight is squab three ways,1.1361256544502618,0.0280046117645868,191,168,20,3,False,False,39
834,And how would monsieur like his pigeon cooked?,1.136,0.0238388161750223,250,219,28,3,True,True,46
834,That’ll be $44 bn.,1.136,0.0257812858250937,250,222,22,6,False,True,18
834,"We take great pride in providing the freshest, locally sourced menu offerings",1.1359649122807018,0.0266597176728584,228,202,21,5,False,False,77
834,We do our best to offer job opportunities for the locals. It's impressive how these new hires are quite the naturals at cleaning off breadcrumbs.,1.135922330097087,0.0267393620397746,206,181,22,3,False,True,145
834,It just dovetailed into an immersive dinner experience,1.135922330097087,0.0292758018333906,206,184,16,6,False,False,54
834,Our three bird roast is well worth the wait,1.1357466063348416,0.0279299535963999,221,197,18,6,False,False,43
834,"Here, we're sensitive to our partners' preferences. From left to right: rare, medium or well done",1.135678391959799,0.027286408323767,199,175,21,3,False,False,97
834,In exchange for a free-cell phone experience we offer these carrier pigeons to send messages.,1.135678391959799,0.0299470301264987,199,178,15,6,False,True,93
834,I'm sorry sir. Today the special is three French hens. Tomorrow is when we have the four calling birds.,1.1354166666666667,0.027867392893457,192,169,20,3,False,True,103
834,We’re a aviary-to-table restaurant,1.1353711790393013,0.0265496840761222,229,203,21,5,False,False,34
834,Do you need help pecking away at it?,1.1352657004830915,0.0247933915506922,207,180,26,1,True,True,36
834,Welcome to the “Pigeonhole” …snap judgements are on the house.,1.1352657004830915,0.0257218657929656,207,181,24,2,False,True,62
834,"And tonight, our chef has a post-holiday special on French hens.",1.135135135135135,0.026303972002177,222,196,22,4,False,True,64
834,After my shift I'm auditioning to be a tree.,1.135,0.0262166275060112,200,175,23,2,False,True,44
834,Your emotional support animal for the evening,1.1348837209302325,0.0251439550641209,215,188,25,2,False,False,45
834,They won’t eat much,1.1347150259067358,0.029613865629503,193,172,16,5,False,False,19
834,May we sit down?,1.1347150259067358,0.0267406794804594,193,169,22,2,True,True,16
834,Your order will be delivered directly to the Chef without use of a computer.,1.1346153846153846,0.0264976743748814,208,183,22,3,False,True,76
834,I present our third day of Christmas special.,1.1344086021505375,0.0272969957917916,186,163,21,2,False,True,45
834,"It’s the special of the day —get to pluck them, steam them, and bake them!",1.1343283582089552,0.0304906536239692,201,181,13,7,False,True,74
834,These are exotic pigeons but we do raise them locally.,1.1341991341991342,0.0263323053259663,231,205,21,5,False,True,54
834,They wanted to make recommendations from our vegan menu.,1.134020618556701,0.0285483142665802,194,172,18,4,False,True,56
834,Can I tell you about our clutch of the day?,1.134020618556701,0.0275969255073959,194,171,20,3,True,True,43
834,"I don’t know much about these three, but I once kissed a cockatoo.",1.134020618556701,0.0255882472525067,194,169,24,1,False,True,66
834,"Since we went vegan recently, they feel much safer here than outside.",1.1336633663366336,0.0278054212145146,202,179,19,4,False,True,69
834,"And, we are now providing a selection service to help you pick your 3 courses.",1.1336633663366336,0.0259735275713286,202,177,23,2,False,True,78
834,Truly farm to table sir,1.1336206896551724,0.0262249384985277,232,206,21,5,False,False,23
834,Please allow me to introduce our three 'little chefs'.,1.1336032388663968,0.023159726873171,247,216,29,2,False,True,54
834,"As you can see, we serve the freshest food in town.",1.1333333333333333,0.0284098498765158,195,173,18,4,False,True,51
834,These are some of our new trainees. We have developed a new service model.,1.1333333333333333,0.0274636391598229,195,172,20,3,False,True,74
834,May I suggest the partridge? It’s very fresh.,1.1333333333333333,0.0253778314330609,210,184,24,2,True,True,45
834,"You know the lobsters in the tank thing, right?  Well…",1.1333333333333333,0.0309180852420414,180,161,14,5,True,False,54
834,Heads or tails?,1.1333333333333333,0.0277436164863518,180,158,20,2,True,True,15
834,Coffee is on the house. This is my message to you-whoo-whoo.,1.1333333333333333,0.0264836436653975,195,171,22,2,False,True,60
834,The freshest eggs please,1.1333333333333333,0.0271140417770396,210,186,20,4,False,False,24
834,"And if you enjoyed your meal, please consider tweeting about us.",1.1333333333333333,0.0262602893142088,210,185,22,3,False,True,64
834,Vegetarians can eat pigeon because it's like chicken.,1.1330275229357798,0.0256576303413524,218,192,23,3,False,True,53
834,"I’m sorry but we’re out of  sesame seed, poppy seed, and everything bagels - only plain are left",1.1330049261083743,0.0267803003171576,203,179,21,3,False,False,96
834,"Coffee, tea or send a message?",1.132701421800948,0.0278161583207165,211,188,18,5,True,True,30
834,They’re actually pretty easy to train. We think he’ll be speaking full sentences by the end this week.,1.132701421800948,0.0261431747817303,211,186,22,3,False,True,102
834,Freshly poached eggs coming your way,1.1326530612244898,0.0263569569308407,196,172,22,2,False,False,36
834,"'Here is the 'free bird' you ordered, Sir. I just can't get them to play on the jukebox'",1.1326530612244898,0.0273316264135778,196,173,20,3,False,False,88
834,Some little birdies told me we have a few specials,1.1326530612244898,0.0273316264135778,196,173,20,3,False,False,50
834,I got them on the third day of Christmas,1.1323529411764706,0.0257348629070689,204,179,23,2,False,False,40
834,We also have two turtle doves and a partridge in a pear tree.,1.1322751322751323,0.0298656989052642,189,169,15,5,False,True,61
834,Ok so here is your venti mocha frappuccino with one pump of sugar-free vanilla and 3 parakeets?,1.1320754716981132,0.0268722967806527,212,188,20,4,True,True,95
834,Why was your omelette $50?  Our free range organic eggs are hatched in house daily.  These mother birds eat nothing but certified organic wheatgrass.,1.1320754716981132,0.0284875723347843,212,190,16,6,True,True,149
834,"They come pre-salted, sir.",1.131979695431472,0.0262314680894647,197,173,22,2,False,True,26
834,Would you like a little something to go?,1.131979695431472,0.0272008692291675,197,174,20,3,True,True,40
834,You know we only provide the freshest ingredients,1.131979695431472,0.0252248399288268,197,172,24,1,False,False,49
834,They’re completely free-range and local from a quaint nest up on East 83rd.,1.131979695431472,0.0290427619934746,197,176,16,5,False,True,75
834,"Our chef can do one in the hand, but it costs more than two in the bush.",1.131979695431472,0.0299212197763274,197,177,14,6,False,True,72
834,"Not only that but, magic has helped people over come social anxiety",1.1318181818181818,0.0270207677794715,220,196,19,5,False,False,67
834,"Yes, our eggs are smaller. Why do you ask?",1.1317365269461075,0.0312670393093911,167,149,14,4,True,True,42
834,The chef insists on free range squab.,1.1317073170731706,0.0265341799905703,205,181,21,3,False,True,37
834,Pigeons are the original delivery service.,1.1317073170731706,0.025617156362878,205,180,23,2,False,True,42
834,"Sir, as requested this is your entertainment for the night.",1.1317073170731706,0.0265341799905703,205,181,21,3,False,True,59
834,"I don’t have three French Hens, but I do have an extra turtle dove.",1.1313131313131313,0.0270713499033264,198,175,20,3,False,True,67
834,"Here are the three French hens you ordered, they can only whistle Twelve Days of Christmas.",1.1313131313131313,0.0270713499033264,198,175,20,3,False,True,91
834,They have chosen not to go under glass.,1.1312217194570136,0.0236501348790517,221,193,27,1,False,True,39
834,"Eating?
Like birds?",1.1310679611650485,0.0281488066758696,206,184,17,5,True,True,19
834,Welcome to the Dove Bar. Do you prefer coo-free?,1.1310679611650485,0.0281488066758696,206,184,17,5,True,True,48
834,Which one would you like sing for its supper?,1.1308411214953271,0.0266348019706423,214,190,20,4,True,True,45
834,"You’ll love our immersive baby bird dining experience. Each of our mothers here will be delivering a unique, freshly digested course directly to your mouths”",1.1306532663316582,0.027869101980876,199,177,18,4,False,False,157
834,Tonight's spécialités de la maison is quail three ways.,1.1304347826086956,0.0262925159476744,207,183,21,3,False,True,55
834,They're if I forget your order,1.1304347826086956,0.0271698087984459,207,184,19,4,False,False,30
834,"Unfortunately we’re out of turtle doves, but I’ve brought the next best thing.",1.1304347826086956,0.0280196471324945,207,185,17,5,False,True,78
834,Boy! Talk about ‘locally sourced’!,1.1304347826086956,0.0262925159476744,207,183,21,3,False,True,34
834,"If you’re all finished, we’ll clean your plates now",1.1304347826086956,0.0239005266100416,230,202,26,2,False,False,51
834,Dipping Doves for your coffee?,1.1304347826086956,0.0262925159476744,207,183,21,3,True,True,30
834,These are the only ones left on our morning pastry menu.,1.130232558139535,0.0248243069476964,215,189,24,2,False,True,56
834,‘ Here are the 3 Turtle Doves. We are fresh out of Partridge in a Pear Tree. It’s a seasonal item on the menu.’,1.130232558139535,0.0265176137253992,215,191,20,4,False,False,111
834,Roosted or roasted?,1.1302083333333333,0.0275057464975385,192,170,19,3,True,True,19
834,"We have fresh squab on the menu, the middle one looks to be the juicest.  Which one would you like?",1.1302083333333333,0.0294217799260491,192,172,15,5,True,True,99
834,"Oh, yeah, the pigeons unionized.",1.1302083333333333,0.0284798808319462,192,171,17,4,False,True,32
834,"Now the one on your left is a 2021 French 
Carrier pigeon",1.13,0.0277371003111057,200,178,18,4,False,False,57
834,"It’s like picking your own lobster, only with birds.",1.13,0.0258620227574242,200,176,22,2,False,True,52
834,We're managing our staffing shortage with server pigeons. These guys will be happy to bring you anything weighing 2.5 ounces or less.,1.13,0.0258620227574242,200,176,22,2,False,True,133
834,"Next, the girls will do Three Wrenny Opera.",1.1298076923076923,0.026173317641914,208,184,21,3,False,True,43
834,"Sorry, we’re out of live lobster.",1.1298076923076923,0.0252703664986654,208,183,23,2,False,True,33
834,How many guantums of cream would you like in your coffee?,1.1297297297297295,0.0301223935376153,185,166,14,5,True,True,57
834,A little trick to help me remember tonight’s special is Perch.,1.1297297297297295,0.0281042662112709,185,164,18,3,False,True,62
834,"We grow them here, feed them and name them too. They are on the menu as food 1, food 2 and food 3. #tracability",1.1296296296296295,0.0247164672788259,216,190,24,2,False,False,111
834,"And tonight’s special, three little birds found sitting on my doorstep.",1.1295336787564767,0.0253226470530836,193,169,23,1,False,True,71
834,"‘Regrettably we are out of French hens due to the holiday demand, however tonight’s  special is three Turtle doves’.",1.1295336787564767,0.0292767129023934,193,173,15,5,False,True,116
834,A little birdie told us about this place.,1.1293532338308458,0.0257411608363711,201,177,22,2,False,True,41
834,Would you like one drop or two?,1.1293532338308458,0.0257411608363711,201,177,22,2,True,True,31
834,They need to take a look to decide the kind of eggs you'd like.,1.1292134831460674,0.0252129191750883,178,155,23,0,False,True,63
834,"Here's the mariachi you requested, sir",1.1291866028708133,0.0277648361641041,209,187,17,5,False,False,38
834,We specialize in cage to table cuisine,1.1291666666666669,0.0239841857668572,240,212,25,3,False,False,38
834,I suggest you don't grouse about your grouse grouse meal in front of them.,1.1290322580645162,0.0257991852600594,186,163,22,1,False,True,74
834,I’m afraid we’re out of French hens. Would turtle doves suffice?,1.1290322580645162,0.0299681249856254,186,167,14,5,True,True,64
834,We're just giving you a preview of what's on next week's menu.,1.1288888888888888,0.0264508462305827,225,201,19,5,False,True,62
834,They knew most of the entrees and are here paying their respects.,1.1288659793814433,0.0262390461172404,194,171,21,2,False,True,65
834,Would you consider our vulture options?,1.128755364806867,0.0236118762868799,233,205,26,2,True,True,39
834,We serve the freshest eggs in town!,1.1287128712871286,0.0256214159731369,202,178,22,2,False,True,35
834,"They'll sing for you, untill we cook their mother",1.1287128712871286,0.0274767951349229,202,180,18,4,False,False,49
834,I will have the left one!,1.1287128712871286,0.0265653084619305,202,179,20,3,False,True,25
834,"Yes, I can repeat today’s specials again, but this time in 4-part harmony.",1.1285714285714286,0.0250443086176218,210,185,23,2,False,True,74
834,Pick one you would like to eat,1.1283422459893049,0.0288350203882257,187,167,16,4,False,False,30
834,Part of the chef's new aerie to table menu,1.1282051282051282,0.0280641950348114,195,174,17,4,False,False,42
834,The pigeons say they just pooped on your car outside.,1.128099173553719,0.0245073980301556,242,215,23,4,False,True,53
834,We don't need to see the specials.  My wife and I will split the parrot with baby potatoes.,1.1280788177339902,0.0255027728718936,203,179,22,2,False,True,91
834,"I'm sorry, sir, but there was a delay in making your 3-egg omelet.",1.127962085308057,0.0258220844008542,211,187,21,3,False,True,66
834,"Here, farm to table is a one-step process.",1.1277777777777778,0.0305449730559981,180,162,13,5,False,True,42
834,3 French Hens,1.127659574468085,0.0226335774516294,235,206,28,1,False,False,13
834,"Management can't afford self check terminals, so I am training these pigeons to take my job.",1.127659574468085,0.0286893558494996,188,168,16,4,False,True,92
834,The squab is fresh today.,1.1275510204081634,0.0259871685167798,196,173,21,2,False,True,25
834,Live lobsters are no longer available.,1.1275510204081634,0.0269752025252213,196,174,19,3,False,True,38
834,Today’s special is wild pigeon thighs with mashed potatoes. It is served deconstructed. 🔥,1.1275510204081634,0.0259871685167798,196,173,21,2,False,False,89
834,I recently watched Ratatouille but only the chefs get the rats.,1.1274509803921569,0.0280943901481227,204,183,16,5,False,True,63
834,"While the delicacies today are exceptionally fresh, they don't talk.",1.1273584905660377,0.0257070805743305,212,188,21,3,False,True,68
834,"Roasted, sautéed, or broiled, but everyone asks to wrap them up and take them home, they’re so cute.",1.1272727272727272,0.0234243452617473,220,193,26,1,False,True,100
834,This evening's special will be fresh Central Park squab.,1.1272727272727272,0.0242942575798614,220,194,24,2,False,True,56
834,"Tonight's special is this trio of hand-reared, free-range birds, who've been nesting on our kitchen window ledge for the past month.",1.126984126984127,0.0285451490835737,189,169,16,4,False,True,132
834,We ran out of the two turtle doves during the holiday season.,1.1269035532994924,0.0258630232054053,197,174,21,2,False,True,61
834,We serve the freshest squab in town.,1.1269035532994924,0.0258630232054053,197,174,21,2,False,True,36
834,How about three birds in the hand?,1.1269035532994924,0.0258630232054053,197,174,21,2,True,True,34
834,"Our special today is wild fowl, raised wild, caught locally, served bone-in. 
Would you like a sample?",1.1267605633802815,0.02726881207666,213,191,17,5,True,True,102
834,You can hand pick your egg for the special omelette,1.1267605633802815,0.0255930909968884,213,189,21,3,False,False,51
834,The little birdies all recommend the seed cake.,1.1266968325791855,0.0250267190364577,221,196,22,3,False,True,47
834,typically it’s a partridge in a pear tree; but this year we just have these parakeets,1.1266968325791855,0.0250267190364577,221,196,22,3,False,False,85
834,We have three turtle doves left over from our ‘Twelve Days’ special.,1.1263736263736264,0.0270441990296208,182,161,19,2,False,True,68
834,"We're  out of the sushi, but we do have...",1.1263736263736264,0.0281442972740274,182,162,17,3,False,True,42
834,"No pressure, tipping each team member is strictly voluntary.",1.1263157894736842,0.0263686464432688,190,168,20,2,False,True,60
834,We do things a little bit differently here.,1.1263157894736842,0.0263686464432688,190,168,20,2,False,True,43
834,Three birds on my arm are worth way more than two in Bushwick.,1.1262626262626263,0.0257400511236334,198,175,21,2,False,True,62
834,The computers down so they'll take your order and fly it into the kitchen,1.1262135922330097,0.0269705053738664,206,184,18,4,False,False,73
834,I wouldn’t suggest the eggs,1.1261682242990654,0.0279439890679582,214,193,15,6,False,False,27
834,You'll find that our fowl is very fresh.,1.1261261261261262,0.0265056445349915,222,199,18,5,False,True,40
834,"Here, I brought the chefs with me. So what were you saying about the wheat grains topping?",1.1261261261261262,0.0240884817345143,222,196,24,2,True,True,90
834,Our eggs would like to thank you for ordering the vegan omelette.,1.1256830601092895,0.0300669250990556,183,165,13,5,False,True,65
834,"Valentine’s Day special: buy two turtledoves, get the third free.",1.1256830601092895,0.0279985982534483,183,163,17,3,False,True,65
834,We hope you enjoyed your dining experience and found every little thing to be all right.,1.12565445026178,0.0282610226418608,191,171,16,4,False,True,88
834,"Yes, the eggs are indeed coop to table.",1.1255813953488372,0.0253681017266074,215,191,21,3,False,True,39
834,"Sorry sir, we don't have coke, is parrot ok?",1.1255813953488372,0.024496362466364,215,190,23,2,True,True,44
834,This is all we have left from the 12 Days of Christmas menu.,1.125,0.0247100417384553,224,199,22,3,False,True,60
834,"Mind if they sit with you ,their parent’s didn’t show up?",1.125,0.0267669695354847,184,163,19,2,True,True,57
834,This ought to muddy the tip conversation.,1.125,0.024925567382256,208,184,22,2,False,True,41
834,Our special tonight …finch au gratin…,1.125,0.0243896202205925,216,191,23,2,False,False,37
834,Does this answer your question about the freshness of our squab.,1.125,0.0264646345983108,200,178,19,3,False,True,64
834,Here is our special of the night,1.125,0.0278543926402307,184,164,17,3,False,False,32
834,I don't think they want anymore crackers,1.125,0.0267242619382219,208,186,18,4,False,False,40
834,I thought I asked for well done?,1.1243781094527363,0.0253780114325509,201,178,21,2,True,True,32
834,My name is Enrico. I'll be your waiter/magician tonight.,1.1243781094527363,0.0272680390170044,201,180,17,4,False,True,56
834,May I interest you two lovebirds in our lovebird special of the day?,1.1243523316062176,0.0270008595669376,193,172,18,3,True,True,68
834,Our birds are organic and served arm to table,1.1243243243243244,0.0266304631389674,185,164,19,2,False,False,45
834,Will you be having dessert tonight? It's fresh,1.1238938053097345,0.0236871503243477,226,200,24,2,True,False,46
834,"For the sake of transparency, I just want you to know that the birds want to trade places now.",1.1238532110091743,0.0258684050869662,218,195,19,4,False,True,94
834,And our special for this week is extremely fresh turtle doves a trois.,1.123762376237624,0.0252595709326148,202,179,21,2,False,True,70
834,"They taste like Wall Street, chicken…",1.123762376237624,0.0242649390374424,202,178,23,1,False,False,37
834,Three on the arm is better than one in the hand.,1.123762376237624,0.027139698563503,202,181,17,4,False,True,48
834,"Oh, this again! He requested for ""the bryds"" not ""the birds"". Why did we even bother to learn human language?",1.1237113402061856,0.0278452382802541,194,174,16,4,True,True,109
834,Squab is the latest in fine dining.,1.1236559139784943,0.0286050346735439,186,167,15,4,False,True,35
834,which one would you like?,1.1235955056179776,0.028326937308405,178,159,16,3,True,True,25
834,A pair of Peeps I said,1.1232876712328768,0.0240748699861684,219,194,23,2,False,False,22
834,"The one on your right but don't throw it in the pot alive, please.",1.1232227488151658,0.0226819524427934,211,185,26,0,False,True,66
834,"Their names are Manny, Moe, and Jack.",1.1232227488151658,0.0254927554552218,211,188,20,3,False,True,37
834,"They say “cheep”, but we’re actually very pricy.",1.123152709359606,0.0270125554353684,203,182,17,4,False,True,48
834,"Monsieur, Madame, how do you prefer your squab done?",1.123152709359606,0.0270125554353684,203,182,17,4,True,True,52
834,I should have chosen the red pill.,1.123152709359606,0.026094152619072,203,181,19,3,False,True,34
834,"You say pigeon, I say squab. Let's Call the Whole Thing Off.",1.123076923076923,0.0257307444364904,195,173,20,2,False,True,60
834,"'On behalf of the new owners, I hope you like the changes to the place--you see they've replaced the big TV with a preening mirror and newspaper on the floor, but you may not know that there's now millet in everything.'",1.123076923076923,0.0257307444364904,195,173,20,2,False,False,219
834,They're locally-sourced from the coop up on the roof.,1.123076923076923,0.0267383489273588,195,174,18,3,False,True,53
834,"The squab is fresh, and they'll take your order.",1.1228070175438596,0.0277718929909718,171,152,17,2,False,True,48
834,"And for our special, we are serving these three turtle doves the owner gifted his now ex-wife for Christmas",1.1228070175438596,0.0234914281521962,228,202,24,2,False,False,107
834,Our chef recommends sauteing but if you prefer you may take them home as pets for a slight surcharge.,1.1227272727272728,0.0248224762386047,220,196,21,3,False,True,101
834,"At the end of training, I’ll be promoted to a fully grown falcon that’ll catch your dinner live, right in front of you.",1.1227272727272728,0.0230896800711027,220,194,25,1,False,True,119
834,They are not on the menu but I can arrange something for you.,1.1225490196078431,0.0250259570210409,204,181,21,2,False,True,61
834,May I suggest the squab?,1.1225490196078431,0.0250259570210409,204,181,21,2,True,True,24
834,Also for a special today we offer Beef Wellington... Ready to head out back?,1.122340425531915,0.0283151135265445,188,169,15,4,True,True,76
834,Here’s your complimentary eavesdropper birds. Just send them to a table when you’ve run out of things to say to each other,1.122340425531915,0.0251212613878399,188,166,21,1,False,False,122
834,". 
Tonight’s Special:
If you Tweet about your meal, you get a free bird!",1.122340425531915,0.0283151135265445,188,169,15,4,False,True,72
834,Twitter is branching out to locally sourced tweets,1.1222222222222222,0.0268979213376748,180,160,18,2,False,False,50
834,anyway we could get those in a pie,1.1221719457013577,0.0238694849790398,221,196,23,2,False,False,34
834,It's like picking your own lobster.,1.1220657276995305,0.0234475888029203,213,188,24,1,False,True,35
834,"Might I recommend the pigeon, it is extremely fresh",1.1219512195121952,0.0258528464180398,205,183,19,3,False,False,51
834,"Honey, one of our resolutions was to be more connected to the food we eat.",1.1219512195121952,0.0258528464180398,205,183,19,3,False,True,74
