contest,caption,mean,precision,votes,not_funny,somewhat_funny,funny,has_question_mark,ends_with_punctuation,caption_length
711,Out?  Out?  I thought the ump said we'd all be safe at home.,1.2989690721649485,0.0531744609121779,97,71,23,3,True,True,60.0
711,I got promoted to General Manager.,1.2989690721649485,0.0531744609121779,97,71,23,3,False,True,34.0
711,"I would like to unsubscribe to ESPN ExtraHD, no apartment reason",1.2989690721649485,0.0551570478325584,97,72,21,4,False,False,64.0
711,I'll call you back during the seventh-inning stretch.,1.2989690721649485,0.0570708030248878,97,73,19,5,False,True,53.0
711,The Astros are paying to see our Nest Cam footage.,1.2989690721649485,0.0551570478325584,97,72,21,4,False,True,50.0
711,Now is not a good time. The couches are loaded.,1.2989690721649485,0.0570708030248878,97,73,19,5,False,True,47.0
711,"They call it ""Safe at Home""",1.2989690721649485,0.0511150336104588,97,70,25,2,False,False,27.0
711,The playoffs will be at Sheila's.,1.2989690721649485,0.0511150336104588,97,70,25,2,False,True,33.0
711,"I wouldn't have yelled ""take it home"" if I knew they'd take it literally.",1.2989690721649485,0.0589224336751967,97,74,17,6,False,True,73.0
711,"Yeah, the date is going great. Think we might get to third base.",1.2989690721649485,0.0551570478325584,97,72,21,4,False,True,64.0
711,"Remember, no spitting in the house",1.2989690721649485,0.0531744609121779,97,71,23,3,False,False,34.0
711,I thought you meant virtual baseball.,1.2989690721649485,0.0624612396195654,97,76,13,8,False,True,37.0
711,Can't it wait until the seventh inning stretch?,1.2989690721649485,0.0531744609121779,97,71,23,3,True,True,47.0
711,He's looking in for the sign . . . they're thinking curve ball. I'll call you back at the end of the inning.,1.2989690721649485,0.0570708030248878,97,73,19,5,False,True,108.0
711,I bought a baseball game.,1.2989690721649485,0.0551570478325584,97,72,21,4,False,True,25.0
711,"They’re carrying bats and have facial hair. Hurry, they’re about to throw something at my son. Yes, he’s wearing a mask.",1.2989690721649485,0.0607176236566481,97,75,15,7,False,True,120.0
711,And reporting to you live from behind third base.,1.2989690721649485,0.0570708030248878,97,73,19,5,False,True,49.0
711,All I know is that they said they needed a space for Spring training.,1.2989690721649485,0.0551570478325584,97,72,21,4,False,True,69.0
711,"Don’t tell anybody but I think I have Aaron Judge in my
living room.",1.2989690721649485,0.0531744609121779,97,71,23,3,False,True,68.0
711,"Oh nothing,whats happening at your place?",1.2989690721649485,0.0589224336751967,97,74,17,6,True,True,41.0
711,Me and Jerry? He's still trying to get to first base.,1.2989690721649485,0.0589224336751967,97,74,17,6,True,True,53.0
711,Just watching another episode of Sox and the City.,1.2989690721649485,0.0531744609121779,97,71,23,3,False,True,50.0
711,"At least he's not playing games with me anymore, is all I'm saying",1.2989690721649485,0.0551570478325584,97,72,21,4,False,False,66.0
711,High definition. Bring the game to your living room.,1.2989690721649485,0.0531744609121779,97,71,23,3,False,True,52.0
711,"No, I did not steal any signals!",1.2989690721649485,0.0551570478325584,97,72,21,4,False,True,32.0
711,"You're right mom, these new tv's do bring the game right into the living room.",1.2989690721649485,0.0589224336751967,97,74,17,6,False,True,78.0
711,"At first, they wanted to play hockey. But I talked them out of it.",1.2989690721649485,0.0607176236566481,97,75,15,7,False,True,66.0
711,I thought we were doing this baseball game over Zoom?,1.2989690721649485,0.0531744609121779,97,71,23,3,True,True,53.0
711,"This guy fucking walks. I've never
been more certain of anything in my life.",1.2989690721649485,0.0570708030248878,97,73,19,5,False,True,76.0
711,"Oh, for God’s sake, watch your stupid game!",1.2989690721649485,0.0551570478325584,97,72,21,4,False,True,43.0
711,"Yes, maybe the men are suffering from sports withdrawal in lockdown . . . why do you ask?",1.2989690721649485,0.0551570478325584,97,72,21,4,True,True,89.0
711,"I hate to say it, but at the end of the day, it is what it is.",1.2989690721649485,0.0607176236566481,97,75,15,7,False,True,62.0
711,the crowd estimate today is 1,1.2989690721649485,0.0551570478325584,97,72,21,4,False,False,29.0
711,I knoe it's the only game in town but some men will do anything to score.,1.2989690721649485,0.0551570478325584,97,72,21,4,False,True,73.0
711,He'll call if he makes it home.,1.2989690721649485,0.0570708030248878,97,73,19,5,False,True,31.0
711,This whole ‘crowding Home’ thing is getting old,1.2989690721649485,0.0511150336104588,97,70,25,2,False,False,47.0
711,"Just a minute, I'll see if he's at home.",1.2989690721649485,0.0589224336751967,97,74,17,6,False,True,40.0
711,"... and I told him, ""three strikes and you're outta here!""",1.2989690721649485,0.0551570478325584,97,72,21,4,False,False,58.0
711,I've gotta go Mom: I'm up next.,1.2989690721649485,0.0551570478325584,97,72,21,4,False,True,31.0
711,How do I know I'm hallucinating? Because the batter only has one boob.,1.2989690721649485,0.0570708030248878,97,73,19,5,True,True,70.0
711,This isn't the kind of ball-room I hoped for when marrying you,1.2976190476190477,0.0581305677775813,84,62,19,3,False,False,62.0
711,He and I have very different ideas of how to get to third base.,1.2976190476190477,0.0581305677775813,84,62,19,3,False,True,63.0
711,He wanted to flatten the curve at home but now there’s no movement to his breaking ball,1.297029702970297,0.0554808939648391,101,76,20,5,False,False,87.0
711,He liked to pitch inside”,1.2959183673469388,0.0601722467511431,98,76,15,7,False,False,25.0
711,"you can’t play ball in the house, they said. you can’t play ball outside with your friends, they said. and so they played ball with their quaranteam in quarantine",1.2959183673469388,0.0546764937784605,98,73,21,4,False,False,162.0
711,not a great time to not having a backyard,1.2959183673469388,0.0546764937784605,98,73,21,4,False,False,41.0
711,I’m glad the neighbours let us house sit again,1.2959183673469388,0.0601722467511431,98,76,15,7,False,False,46.0
711,"Even in Quarantine, Shelly made sure to remove the garbage can when the Astros practiced.",1.2959183673469388,0.0583978239607919,98,75,17,6,False,True,89.0
711,"Yes, yes, no one’s gone out yet, so we’re staying safe",1.2959183673469388,0.0583978239607919,98,75,17,6,False,False,54.0
711,"How are the boys keeping busy at home? Playing with their bat and balls, what did you expect?",1.2959183673469388,0.0546764937784605,98,73,21,4,True,True,93.0
711,"Yeah, they’re even calling themselves the ‘Home Brewers’",1.2959183673469388,0.050682660747601,98,71,25,2,False,False,56.0
711,I thought the offer was “3 red socks for 2”,1.2959183673469388,0.0583978239607919,98,75,17,6,False,False,43.0
711,"Gotta go, I’m on deck.",1.2959183673469388,0.0565677682751479,98,74,19,5,False,True,22.0
711,The catcher called for a high fast one -- inside.,1.2959183673469388,0.0565677682751479,98,74,19,5,False,True,49.0
711,I’ve got season tickets,1.2959183673469388,0.0546764937784605,98,73,21,4,False,False,23.0
711,The combination of performance enhancing drugs and hydroxychloroquine is having unintended side effects.,1.2959183673469388,0.0583978239607919,98,75,17,6,False,True,104.0
711,"He's at home, but I'm not sure for how long.",1.2959183673469388,0.050682660747601,98,71,25,2,False,True,44.0
711,"Seventh inning 6 -3, Covid vs Flu",1.2959183673469388,0.0527174120778062,98,72,23,3,False,False,33.0
711,"OK, he twitched his nose.  It's gonna be a slider.",1.2959183673469388,0.0583978239607919,98,75,17,6,False,True,50.0
711,"All I can say is, God help us if we're still in quarantine by football season...",1.2959183673469388,0.0565677682751479,98,74,19,5,False,True,80.0
711,"Well mom, it's better than the NASCAR they tried yesterday.",1.2959183673469388,0.0583978239607919,98,75,17,6,False,True,59.0
711,"Hi, I called you yesterday about getting some baseboard installed in my Living Room.",1.2959183673469388,0.0601722467511431,98,76,15,7,False,True,84.0
711,Dave might have misunderstood the safe-at-home order.,1.2959183673469388,0.0583978239607919,98,75,17,6,False,True,53.0
711,It’s the bottom of the ninth and the windows are still intact.,1.2959183673469388,0.0618958214648231,98,77,13,8,False,True,62.0
711,"I'll talk to you later, Jules. It looks like I'm too close to call.",1.2959183673469388,0.0527174120778062,98,72,23,3,False,True,67.0
711,I gotta go-- The vases are loaded!,1.2959183673469388,0.0565677682751479,98,74,19,5,False,True,34.0
711,"What do you mean, who's on first?",1.2959183673469388,0.0583978239607919,98,75,17,6,True,True,33.0
711,"Remember, the spitter's outlawed.",1.2959183673469388,0.0565677682751479,98,74,19,5,False,True,33.0
711,I'll call you back later; the game is on at my place.,1.2959183673469388,0.0546764937784605,98,73,21,4,False,True,53.0
711,"No, no the other American pastime",1.2959183673469388,0.0583978239607919,98,75,17,6,False,False,33.0
711,"It's a home game, so I have a great seat.",1.2959183673469388,0.0618958214648231,98,77,13,8,False,True,41.0
711,"When you asked if I would ""play ball"" with you, I thought you had something else in mind.",1.2959183673469388,0.0583978239607919,98,75,17,6,False,True,89.0
711,"I don’t know about the Astros, but I’m close to taking my husband’s ring away.",1.2959183673469388,0.0601722467511431,98,76,15,7,False,True,78.0
711,"I'd like to return the pitcher I ordered, please. The photo was very misleading",1.2959183673469388,0.0583978239607919,98,75,17,6,False,False,79.0
711,"I told Henry, three strikes and he's outa here for good.",1.2959183673469388,0.0527174120778062,98,72,23,3,False,True,56.0
711,"Guys, ""inside baseball"" is a slang generic expression that I'm speculating you have never heard before.",1.2959183673469388,0.0565677682751479,98,74,19,5,False,True,103.0
711,"30 years from now, will anyone get this year's abundance of quarantine humor?",1.2959183673469388,0.0565677682751479,98,74,19,5,True,True,77.0
711,I win a steak if he hits the grandfather clock.,1.2959183673469388,0.0601722467511431,98,76,15,7,False,True,47.0
711,All his pitches are just a bit inside.,1.2959183673469388,0.0485627291730151,98,70,27,1,False,True,38.0
711,"The open concept is great for baseball, but why is Carlos Beltran banging on our kitchen trash.",1.2959183673469388,0.0565677682751479,98,74,19,5,False,True,95.0
711,"Gotta go, Helen.  I'm on deck.",1.2959183673469388,0.0565677682751479,98,74,19,5,False,True,30.0
711,Hold on a sec -- I want to get a hot dog.,1.2959183673469388,0.0635726839965882,98,78,11,9,False,True,41.0
711,"Yes, this is the manager of the home team.",1.2959183673469388,0.0546764937784605,98,73,21,4,False,True,42.0
711,"Oh, same old, same old.  How about you?",1.2959183673469388,0.0527174120778062,98,72,23,3,True,True,39.0
711,Somebody isn’t getting to third base.,1.2959183673469388,0.0565677682751479,98,74,19,5,False,True,37.0
711,"As a matter of fact, I AM in left field.",1.2959183673469388,0.0583978239607919,98,75,17,6,False,True,40.0
711,"I need a break, Karen. The boys have another home game today.",1.2959183673469388,0.0583978239607919,98,75,17,6,False,True,61.0
711,Bottom of the 9th. The cushions are loaded.,1.2959183673469388,0.0583978239607919,98,75,17,6,False,True,43.0
711,"The game is going fine, but the ""wave"" is a little underwhelming.",1.2959183673469388,0.0583978239607919,98,75,17,6,False,True,65.0
711,"Well, at least you don't have to quarantine with the Cincinnati Reds, Brenda.",1.2959183673469388,0.0565677682751479,98,74,19,5,False,True,77.0
711,Our pitcher used to be just to pour water from,1.2959183673469388,0.0583978239607919,98,75,17,6,False,False,46.0
711,"Yeah the guys are surviving without watching sports, but I'm not sure the house will make it.",1.2959183673469388,0.0583978239607919,98,75,17,6,False,True,93.0
711,"Worse yet, Mom, they expected me to be the umpire.",1.2959183673469388,0.0527174120778062,98,72,23,3,False,True,50.0
711,We're staying inside but Stan says he's tired of the board games.,1.2959183673469388,0.0565677682751479,98,74,19,5,False,True,65.0
711,Get both lefties up in the garage.,1.2959183673469388,0.0565677682751479,98,74,19,5,False,True,34.0
711,"No, they didn't even bring peanuts or cracker jack.",1.2959183673469388,0.0565677682751479,98,74,19,5,False,True,51.0
711,Can I call you later? I'm in the middle of a game,1.2959183673469388,0.0565677682751479,98,74,19,5,True,False,49.0
711,"I'll say this lockdown is frustrating. Here I am in scoring position, and no one has made it to first base.",1.2959183673469388,0.0601722467511431,98,76,15,7,False,True,107.0
711,"Opening Day, Major League Baseball, 2020",1.2959183673469388,0.0583978239607919,98,75,17,6,False,False,40.0
711,"It's the bottom of the ninth inning, The home team has two outs, with a man at the dining room table, and man at the armoire. Kowalski needs a home run to make the winning score.",1.2959183673469388,0.050682660747601,98,71,25,2,False,True,178.0
711,"OK so far, no hits, no spits.",1.2959183673469388,0.0601722467511431,98,76,15,7,False,True,29.0
711,"I wouldn't go to the stadium, so they came here.",1.2959183673469388,0.0546764937784605,98,73,21,4,False,True,48.0
711,"Won't be able to make it, I'm afraid. I'm in a pitch meeting.",1.2959183673469388,0.0546764937784605,98,73,21,4,False,True,61.0
711,"The guys started it because they really miss baseball, but the good news is that ESPN has offered to broadcast the games.",1.2959183673469388,0.0583978239607919,98,75,17,6,False,True,121.0
711,"Honey, did you upgrade our cable package again?",1.2947368421052632,0.0577163085755993,95,72,18,5,True,True,47.0
711,I’ve seen enough balls flying around for a lifetime!,1.2947368421052632,0.0557423367814834,95,71,20,4,False,True,52.0
711,"Hi Barbara, I'm just calling to touch base.",1.2947368421052632,0.049348917036343,95,68,26,1,False,True,43.0
711,"The neighbors are here, their first visit of the season. My husband felt comfortable enough... There's the pitch! Low and outside! 3 and 0 in the first inning and again, this is the first time he felt comfortable enough to invite em over, we've been talking outside and...",1.2947368421052632,0.0536958466189596,95,70,22,3,False,True,272.0
711,Yeah the boys were so bored they started playing baseball in the house. On the bright side every hit is a home run.,1.2947368421052632,0.0577163085755993,95,72,18,5,False,True,115.0
711,2025: I guess they weren’t kidding about sports never being the same after Coronavirus.,1.2947368421052632,0.0557423367814834,95,71,20,4,False,True,87.0
711,Vase-ball anyone?,1.2947368421052632,0.0596249649167803,95,73,16,6,True,True,17.0
711,Can't stand these home runs anymore.,1.2947368421052632,0.0596249649167803,95,73,16,6,False,True,36.0
711,It’s really not as fun as you’d think.,1.2947368421052632,0.0577163085755993,95,72,18,5,False,True,38.0
711,Yeah it looks like they’re hoping for a home field advantage,1.2947368421052632,0.0515682051112248,95,69,24,2,False,False,60.0
711,Is it a six or they're just playing 6 feet apart?,1.2947368421052632,0.0614743898469986,95,74,14,7,True,True,49.0
711,This isn’t what I meant when I said ‘inside baseball.’,1.2947368421052632,0.0557423367814834,95,71,20,4,False,False,54.0
711,Well at least the beer is affordable.,1.2947368421052632,0.0557423367814834,95,71,20,4,False,True,37.0
711,"Dad was upset losing the baseball season, but totally lost it when he heard about the hot-dog shortage",1.2947368421052632,0.0614743898469986,95,74,14,7,False,False,102.0
711,ESPN just offered 100K for a live feed.,1.2947368421052632,0.0596249649167803,95,73,16,6,False,True,39.0
711,I hate it when we're the home team.,1.2947368421052632,0.0557423367814834,95,71,20,4,False,True,35.0
711,They always play better at home,1.2947368421052632,0.0614743898469986,95,74,14,7,False,False,31.0
711,It’s pretty boring. Even Elvis can’t leave the building.,1.2947368421052632,0.0614743898469986,95,74,14,7,False,True,56.0
711,"No Steinbrenner, I don't think this is going to work as a long term arrangement.",1.2947368421052632,0.0536958466189596,95,70,22,3,False,True,80.0
711,"Strike three, and you do the dishes, Adam.",1.2947368421052632,0.0577163085755993,95,72,18,5,False,True,42.0
711,Delivery is way better than curbside.,1.2947368421052632,0.0577163085755993,95,72,18,5,False,True,37.0
711,Putting an end to the does-it-come-from-bats debate. Poor Gus pulled the short straw.,1.2947368421052632,0.0614743898469986,95,74,14,7,False,True,85.0
711,Let’s not play two.,1.2947368421052632,0.0557423367814834,95,71,20,4,False,True,19.0
711,"They keep saying that we have the home-field advantage, but I'm not so sure.",1.2947368421052632,0.0577163085755993,95,72,18,5,False,True,76.0
711,I just called for a bunt but these are uncertain times.,1.2947368421052632,0.0614743898469986,95,74,14,7,False,True,55.0
711,"...Apparently, it's some sort of fantasy baseball league.",1.2947368421052632,0.0614743898469986,95,74,14,7,False,True,57.0
711,Must throw low and outside because of social distancing.,1.2947368421052632,0.0557423367814834,95,71,20,4,False,True,56.0
711,I have to run.  We're about to break a lamp.,1.2947368421052632,0.0536958466189596,95,70,22,3,False,True,44.0
711,Get the bullpen ready.  He's been throwing for 2 months and he's starting to tire out.,1.2947368421052632,0.049348917036343,95,68,26,1,False,True,86.0
711,Joey's using the wall mirror at 2nd base to steal signs...,1.2947368421052632,0.0536958466189596,95,70,22,3,False,True,58.0
711,"I'd like a chili dog, diet Coke, two table lamps, and a mirror, please.",1.2947368421052632,0.0557423367814834,95,71,20,4,False,True,71.0
711,"Apparently, we have home field advantage.",1.2947368421052632,0.0557423367814834,95,71,20,4,False,True,41.0
711,I'm going to need some relief.,1.2947368421052632,0.0536958466189596,95,70,22,3,False,True,30.0
711,Fred's fantasy league is hell on the windows...,1.2947368421052632,0.0536958466189596,95,70,22,3,False,True,47.0
711,"I think it’s the bottom of the 999th. What’s happening over at your house, Linda?",1.2947368421052632,0.0577163085755993,95,72,18,5,True,True,81.0
711,Welcome to the work from home-run derby,1.2947368421052632,0.0557423367814834,95,71,20,4,False,False,39.0
711,Finally got to third base with the guy I’m dating.,1.2947368421052632,0.0536958466189596,95,70,22,3,False,True,50.0
711,It's the bottom of the ninth.  The windows are losing.,1.2947368421052632,0.0577163085755993,95,72,18,5,False,True,54.0
711,"You gotta come by, it’s better than 4K.",1.2947368421052632,0.0515682051112248,95,69,24,2,False,True,39.0
711,"It's not the damage they're making that's bothering me, it's the plays.",1.2947368421052632,0.0577163085755993,95,72,18,5,False,True,71.0
711,I got the home game package.,1.2947368421052632,0.0515682051112248,95,69,24,2,False,True,28.0
711,"Yes, an expansion. I'm thinking sixty feet, six inches.",1.2947368421052632,0.0515682051112248,95,69,24,2,False,True,55.0
711,I love my chances of catching a foul ball.,1.2947368421052632,0.0536958466189596,95,70,22,3,False,True,42.0
711,None of these guys are gonna get to third base.,1.2947368421052632,0.0536958466189596,95,70,22,3,False,True,47.0
711,Belter in place,1.2947368421052632,0.0557423367814834,95,71,20,4,False,False,15.0
711,"No one is trying to sleep with me. I told you, they like baseball.",1.2941176470588236,0.0622264982955827,85,65,15,5,False,True,66.0
711,"Yep, I ordered bundt batter, not a bunt batter.",1.2941176470588236,0.0599335051979461,85,64,17,4,False,True,47.0
711,He can’t hit an inside pitch,1.2941176470588236,0.0575492224143325,85,63,19,3,False,False,28.0
711,"No. Just me, and I got a great seat",1.2941176470588236,0.0575492224143325,85,63,19,3,False,False,35.0
711,The home team is winning.,1.2941176470588236,0.0599335051979461,85,64,17,4,False,True,25.0
711,"There’ve been discussions on lowering mound height again, but this is getting ridiculous.",1.292929292929293,0.0522677352850644,99,73,23,3,False,True,89.0
711,"‘Honey, COVID’s not so bad when the bat comes to you.’",1.292929292929293,0.0560731868044024,99,75,19,5,False,False,54.0
711,"Good fastball, but slider is always in the rug.",1.292929292929293,0.0492209463226855,99,74,22,3,False,True,47.0
711,It’s them not wearing masks that really bugs me.,1.2916666666666667,0.0571943950961049,96,73,18,5,False,True,48.0
711,"No, you wouldn’t understand. It’s inside baseball.",1.2916666666666667,0.0552440094923903,96,72,20,4,False,True,50.0
711,I've got the best seats in the house,1.2916666666666667,0.0489285790510332,96,69,26,1,False,False,36.0
711,Where covid and baseball meet: safe at home.,1.2916666666666667,0.0511204860458823,96,70,24,2,False,True,44.0
711,"Waiter, there’s an infield fly in my soup",1.2916666666666667,0.0609080891313906,96,75,14,7,False,False,41.0
711,Finally a call to the bullpen seeking some sort of relief,1.2916666666666667,0.0552440094923903,96,72,20,4,False,False,57.0
711,"Then he wanted the organist too and, well, enough is enough!",1.2916666666666667,0.0571943950961049,96,73,18,5,False,True,60.0
711,I invited some of his friends over to help him get to first base,1.2916666666666667,0.0590804288747415,96,74,16,6,False,False,64.0
711,This wasn’t what I was envisioning when you said we were going to see the home opener soon!,1.2916666666666667,0.0511204860458823,96,70,24,2,False,True,91.0
711,"Can I have him call you back? He's out on the veranda, announcing the game to the neighbors.",1.2916666666666667,0.0552440094923903,96,72,20,4,True,True,92.0
711,Come on over we are having a ball!,1.2916666666666667,0.0552440094923903,96,72,20,4,False,True,34.0
711,I need a delivery-4 beers- 2 dogs hold the mustard and a bag of nuts!s,1.2916666666666667,0.0552440094923903,96,72,20,4,False,False,70.0
711,Uncle Jerry says send it to the short stop.,1.2916666666666667,0.0571943950961049,96,73,18,5,False,True,43.0
711,Be careful not to hit the old bat.,1.2916666666666667,0.0532221978048754,96,71,22,3,False,True,34.0
711,Only his name is Babe Ruth,1.2916666666666667,0.0590804288747415,96,74,16,6,False,False,26.0
711,....and I just witnessed an inside the room home run.,1.2916666666666667,0.0571943950961049,96,73,18,5,False,True,53.0
711,"Us? Oh, ya know -- same old, same old.",1.2916666666666667,0.0532221978048754,96,71,22,3,True,True,38.0
711,"Use your indoor voices, please.",1.2916666666666667,0.0532221978048754,96,71,22,3,False,True,31.0
711,Two fingers down. It's a fastball,1.2916666666666667,0.0552440094923903,96,72,20,4,False,False,33.0
711,It's the bottom of the 237th. Who knows when it'll end.,1.2916666666666667,0.0571943950961049,96,73,18,5,False,True,55.0
711,"I swear if he breaks another lamp, I’m benching him.",1.2916666666666667,0.0590804288747415,96,74,16,6,False,True,52.0
711,"Jimmy, this cat is meowing every time I signal for a fastball.",1.2916666666666667,0.0609080891313906,96,75,14,7,False,True,62.0
711,No Ma. What's up and Who's on first. We are ahead.,1.2916666666666667,0.0590804288747415,96,74,16,6,False,True,50.0
711,Wanna come over and watch the baseball game?,1.2916666666666667,0.0552440094923903,96,72,20,4,True,True,44.0
711,"Guys, I hate to say this, but the quarantine and the lock-down ended yesterday.",1.2916666666666667,0.0590804288747415,96,74,16,6,False,True,79.0
711,We ran out of puzzles.,1.2916666666666667,0.0590804288747415,96,74,16,6,False,True,22.0
711,They decided to schedule a home game.,1.2916666666666667,0.0552440094923903,96,72,20,4,False,True,37.0
711,"hm!?  basically...
they’ve gone batty.",1.2916666666666667,0.0609080891313906,96,75,14,7,True,True,38.0
711,It's a new symptom...,1.2916666666666667,0.0571943950961049,96,73,18,5,False,True,21.0
711,It’s true what they say about baseball...it IS a game of inches.,1.2916666666666667,0.0571943950961049,96,73,18,5,False,True,64.0
711,Next week you can host,1.2916666666666667,0.0511204860458823,96,70,24,2,False,False,22.0
711,Best seat I've ever had at a baseball game.,1.2916666666666667,0.0571943950961049,96,73,18,5,False,True,43.0
711,Summer Sports 2020,1.2916666666666667,0.0571943950961049,96,73,18,5,False,False,18.0
711,"Yeah, indoor training is great actually. Oliver makes sure they master proper posture before they can move on to other skills.",1.2916666666666667,0.0590804288747415,96,74,16,6,False,True,126.0
711,"Well, I've been furloughed, but thankfully Kevin and his team are able to Work From Home.",1.2916666666666667,0.0571943950961049,96,73,18,5,False,True,89.0
711,"It's the top of the 7th, 2 on base, and Bucky ####ing Dent is up to bat.",1.2916666666666667,0.0590804288747415,96,74,16,6,False,True,72.0
711,"Well he is keeping six feet away from the pitcher, so I feel bad complaining.",1.2916666666666667,0.0532221978048754,96,71,22,3,False,True,77.0
711,"He can hit a triple,but still only get to first base.",1.2916666666666667,0.0532221978048754,96,71,22,3,False,True,53.0
711,Tomorrow we play next door.  Then we go across the street,1.2916666666666667,0.0590804288747415,96,74,16,6,False,False,57.0
711,"Sure, come on over--we can watch a game together.",1.2916666666666667,0.0532221978048754,96,71,22,3,False,True,49.0
711,This is so cool. The MLB said each member of the fan base can have one inning in their home.,1.2916666666666667,0.0552440094923903,96,72,20,4,False,True,92.0
711,I'd invite you over but only one of them is wearing a mask.,1.2916666666666667,0.0511204860458823,96,70,24,2,False,True,59.0
711,Can I call you back. It’s tied at the bottom of the ninth.,1.2916666666666667,0.0552440094923903,96,72,20,4,False,True,58.0
711,"Today, we’re playing living room baseball and I’m “the crowd goes wild”.",1.2916666666666667,0.0590804288747415,96,74,16,6,False,True,72.0
