contest,caption,mean,precision,votes,not_funny,somewhat_funny,funny,has_question_mark,ends_with_punctuation,caption_length
711,Fluffy misses you. She also misses a lot of strike calls.,1.2238805970149254,0.0631628863625909,67,55,9,3,False,True,57.0
711,...It’s going pretty much as you would expect but next week they want to try kite-surfing.,1.2222222222222223,0.0617397725192135,63,51,10,2,False,True,90.0
711,I hope that is a Nurf-Ball,1.2222222222222223,0.0600671970551212,72,59,10,3,False,False,26.0
711,"Too many walks, ready the bull pen",1.2207792207792207,0.0542877092321661,77,62,13,2,False,False,34.0
711,Are we in the right seats?!?,1.2205882352941178,0.0586861873392161,68,55,11,2,True,True,28.0
711,There was no joy in Datesville; mighty Casey has struck out!,1.2205882352941178,0.0548186740229933,68,54,13,1,False,True,60.0
711,So who has home field advantage?,1.2205882352941178,0.0548186740229933,68,54,13,1,True,True,32.0
711,I told him I wanted him to take me out...but I really should’ve specified where...,1.2205882352941178,0.0586861873392161,68,55,11,2,False,True,82.0
711,"No, they aren’t very good but I did manage to get great seats.",1.2205882352941178,0.0586861873392161,68,55,11,2,False,True,62.0
711,I'd say we're in phase 2.,1.2205882352941178,0.0586861873392161,68,55,11,2,False,True,25.0
711,'I told them we need to be based at home and I think they misunderstood',1.2205882352941178,0.0623141247807263,68,56,9,3,False,False,72.0
711,Is there a version of this game where they run away from home?,1.2205882352941178,0.0586861873392161,68,55,11,2,True,True,62.0
711,Jim’s been working from home plate.,1.2205882352941178,0.0586861873392161,68,55,11,2,False,True,35.0
711,Is it even possible to get a home run?,1.2205882352941178,0.0586861873392161,68,55,11,2,True,True,38.0
711,Who’s in the living room.,1.2205882352941178,0.0623141247807263,68,56,9,3,False,True,25.0
711,Yea home base is in the bedroom.,1.2205882352941178,0.0548186740229933,68,54,13,1,False,True,32.0
711,My home my game,1.2205882352941178,0.0690000961791841,68,58,5,5,False,False,15.0
711,Best 1200 bucks I ever spent,1.2205882352941178,0.0657421608251683,68,57,7,4,False,False,28.0
711,Family life in the time of Corona,1.2205882352941178,0.0623141247807263,68,56,9,3,False,False,33.0
711,Phillip said we should try a threesome to spice up our marriage”,1.2205882352941178,0.0586861873392161,68,55,11,2,False,False,64.0
711,"Ever since Roy’s started working from the living room, it’s brought a whole new meaning to ‘safe at home.’",1.2205882352941178,0.0586861873392161,68,55,11,2,False,False,106.0
711,I said I missed Cricket,1.2205882352941178,0.0586861873392161,68,55,11,2,False,False,23.0
711,How many innings are there again?,1.2205882352941178,0.0657421608251683,68,57,7,4,True,True,33.0
711,"I'll call you later. I have to be ready to catch the cat if they send him ""out of the park"" again.",1.2205882352941178,0.0586861873392161,68,55,11,2,False,True,98.0
711,The cardboard props really add a new dimension,1.2205882352941178,0.0586861873392161,68,55,11,2,False,False,46.0
711,I'm sorry what am I hitting again ?,1.2205882352941178,0.0623141247807263,68,56,9,3,True,True,35.0
711,Leave it to Harold to balk at every good idea I have.,1.2205882352941178,0.0657421608251683,68,57,7,4,False,True,53.0
711,"Come on, Peter, I’ve got the best seats in the house!",1.2205882352941178,0.0586861873392161,68,55,11,2,False,True,53.0
711,- A new definition of home base,1.2205882352941178,0.0548186740229933,68,54,13,1,False,False,31.0
711,"Honey, but you said ‘they are not playing at home this year.’",1.2205882352941178,0.0527787479981481,68,56,10,2,False,False,61.0
711,"Good morning doctor... yeah, I think he's hallucinating again",1.2205882352941178,0.0623141247807263,68,56,9,3,False,False,61.0
711,Let me get back to you. I've got to update the scoreboard.,1.2205882352941178,0.0548186740229933,68,54,13,1,False,True,58.0
711,"Oh no, it just went into extra innings.",1.2205882352941178,0.0506567414947393,68,53,15,0,False,True,39.0
711,"I mean, they did say it was an immersive experience, but I just thought they meant HD, ya know?",1.2205882352941178,0.0586861873392161,68,55,11,2,True,True,95.0
711,"‘I swear to god Kevin, if you hit my geraniums...’",1.2205882352941178,0.0548186740229933,68,54,13,1,False,False,50.0
711,"Corona virus aside, it’s boring here, they put me back in the bullpen...",1.2205882352941178,0.0548186740229933,68,54,13,1,False,True,72.0
711,Balls.,1.2205882352941178,0.0506567414947393,68,53,15,0,False,True,6.0
711,"And of course, every run is a home run.",1.2205882352941178,0.0586861873392161,68,55,11,2,False,True,39.0
711,This is not what I meant when I said to bring it home.,1.2205882352941178,0.0586861873392161,68,55,11,2,False,True,54.0
711,Is that 6 feet away?,1.2205882352941178,0.0548186740229933,68,54,13,1,True,True,20.0
711,2020: The year when every game is a home game.,1.2205882352941178,0.0657421608251683,68,57,7,4,False,True,46.0
711,"I had asked what was for dinner, and he said, “Sliders.”",1.2205882352941178,0.0548186740229933,68,54,13,1,False,False,56.0
711,"Hey, I gotta go. We’re coming up on the 7th inning stretch.",1.2205882352941178,0.0586861873392161,68,55,11,2,False,True,59.0
711,"Watching the game, having a Bud.",1.2205882352941178,0.0623141247807263,68,56,9,3,False,True,32.0
711,"Ladies and gentlemen, welcome to the new great American pastime: home-ball.",1.2205882352941178,0.0623141247807263,68,56,9,3,False,True,75.0
711,Larry is pleased to have the home field advantage.,1.2205882352941178,0.0623141247807263,68,56,9,3,False,True,50.0
711,The count is 3 to 1 and no one’s making it to first. Better call the DH,1.2205882352941178,0.0506567414947393,68,53,15,0,False,False,71.0
711,"Yup, if we can’t go to the game, we might as well bring it ‘home’”",1.2205882352941178,0.0586861873392161,68,55,11,2,False,False,66.0
711,I told them everything’s back open but this is game 7.,1.2205882352941178,0.0586861873392161,68,55,11,2,False,True,54.0
711,They said no fans but HD and the fear of Covid makes me feel like they’re right here in my living room,1.2205882352941178,0.0548186740229933,68,54,13,1,False,False,102.0
711,I don’t think the family room can survive another stay-at-home run.,1.2205882352941178,0.0623141247807263,68,56,9,3,False,True,67.0
711,'I would score a homerun but i dont wann break anything. I would prefer loosing then going for shopping.',1.2205882352941178,0.0586861873392161,68,55,11,2,False,False,105.0
711,...and we’re back from commercials,1.2205882352941178,0.0623141247807263,68,56,9,3,False,False,34.0
711,"Trust me Paul, you don’t want to catch that",1.2205882352941178,0.0623141247807263,68,56,9,3,False,False,43.0
711,coronavirus pastime,1.2205882352941178,0.0623141247807263,68,56,9,3,False,False,19.0
711,"The bases are loaded but they don't even sell hotdogs, Carol. I think I'm gonna leave at bottom of the 7th""",1.2205882352941178,0.0623141247807263,68,56,9,3,False,False,107.0
711,"Get the lefty warmed up... and the lasagna too, please.",1.2205882352941178,0.0657421608251683,68,57,7,4,False,True,55.0
711,lockdown can never stop us from playing cricket.,1.2205882352941178,0.0623141247807263,68,56,9,3,False,True,48.0
711,Can you guys move? I’m trying to watch the game!,1.2205882352941178,0.0548186740229933,68,54,13,1,True,True,48.0
711,I’ll get to hit a home run this time,1.2205882352941178,0.0623141247807263,68,56,9,3,False,False,36.0
711,"Pleased to say, the therapy is working Dr. Freud!",1.2205882352941178,0.0586861873392161,68,55,11,2,False,True,49.0
711,The catcher is calling for a breaking ball. Bang the garbage can twice.,1.2205882352941178,0.0623141247807263,68,56,9,3,False,True,71.0
711,"Yep, Pam, this is real inside baseball.",1.2205882352941178,0.0623141247807263,68,56,9,3,False,True,39.0
711,"Yeah, we're definitely having hot dogs tonight.",1.2205882352941178,0.0548186740229933,68,54,13,1,False,True,47.0
711,"Look, I'm going to have to call you back. It's the bottom of the 8th and Andy's still got his no hitter.""",1.2205882352941178,0.0586861873392161,68,55,11,2,False,False,105.0
711,Don't do it.  I know he's signing to get you to knee-cat him.,1.2205882352941178,0.0548186740229933,68,54,13,1,False,True,61.0
711,It wasn't really fair. He had the home-field advantage.,1.2205882352941178,0.0548186740229933,68,54,13,1,False,True,55.0
711,"""Agreed--the Florentine vase is a double, the living room chandelier a home run.""",1.2205882352941178,0.0586861873392161,68,55,11,2,False,False,81.0
711,When you said you had an extra seat for the next home game I assumed you meant something else.,1.2205882352941178,0.0586861873392161,68,55,11,2,False,True,94.0
711,"Yeah, fifty bucks on the home team, please.",1.2205882352941178,0.0586861873392161,68,55,11,2,False,True,43.0
711,Strike one,1.2205882352941178,0.0623141247807263,68,56,9,3,False,False,10.0
711,"Just make contact with the ball, man - they're all technically home runs.",1.2205882352941178,0.0623141247807263,68,56,9,3,False,True,73.0
711,The catcher is wearing a mask but the other guys say it's a hoax.,1.2205882352941178,0.0586861873392161,68,55,11,2,False,True,65.0
711,Don’t worry. There’s no more windows left.,1.2205882352941178,0.0623141247807263,68,56,9,3,False,True,42.0
711,"Alone on the sofa, Doris calls a friend over to start the wave.",1.2205882352941178,0.0623141247807263,68,56,9,3,False,True,63.0
711,Looks like it's going to be another inside pitch.,1.2205882352941178,0.0657421608251683,68,57,7,4,False,True,49.0
711,You want me to tell them you're coming over to call balls and strikes?,1.2205882352941178,0.0586861873392161,68,55,11,2,True,True,70.0
711,Can I call you back; things are a little batty here,1.2205882352941178,0.0623141247807263,68,56,9,3,False,False,51.0
711,I'm thinking bunt.,1.2205882352941178,0.0548186740229933,68,54,13,1,False,True,18.0
711,"You're not missing much...they're better on the road.""",1.2205882352941178,0.0586861873392161,68,55,11,2,False,False,54.0
711,"We got engaged yesterday, but I'm not a big fan of the diamond.",1.2205882352941178,0.0623141247807263,68,56,9,3,False,True,63.0
711,"Opening day.  I am the only fan for the game, but I got to sit in the on deck circle.",1.2205882352941178,0.0586861873392161,68,55,11,2,False,True,85.0
711,"I believe as a condo amenity, it was a gamechanger",1.2205882352941178,0.0586861873392161,68,55,11,2,False,False,50.0
711,"Well, it is not easy nowadays, you know!
We don't have the space for golf so we must make do!",1.2205882352941178,0.0586861873392161,68,55,11,2,False,True,93.0
711,"It's fine, mom, they're just playing through... No, none of them are handsome.",1.2205882352941178,0.0623141247807263,68,56,9,3,False,True,78.0
711,Why is the catcher the only person wearing a mask?!?,1.2205882352941178,0.0548186740229933,68,54,13,1,True,True,52.0
711,"No, it’s not a problem... he can’t hit an inside pitch.",1.2205882352941178,0.0623141247807263,68,56,9,3,False,True,55.0
711,"Close game- both have home field advantage.""",1.2205882352941178,0.0586861873392161,68,55,11,2,False,False,44.0
711,"A goat? No, Billy, this is not the time to bring a new pet home.",1.2205882352941178,0.0657421608251683,68,57,7,4,True,True,64.0
711,I know!  I suggested that and they would still rather play baseball.,1.2205882352941178,0.0548186740229933,68,54,13,1,False,True,68.0
711,Anything inside the house is a home run.,1.2205882352941178,0.0586861873392161,68,55,11,2,False,True,40.0
711,"Lockdown delivery? Can I order aspirin, salami, ribeye, high cheese, cookies, lollipop, goose egg, head of lettuce, ice cream cone, & jerk with extra bases, please? We've got a full house on 77th-inning home runs and broken homeplates. Pitcher that!",1.2205882352941178,0.0586861873392161,68,55,11,2,True,True,249.0
711,"Mom, it's a whole new ballgame.",1.2205882352941178,0.0623141247807263,68,56,9,3,False,True,31.0
711,"Yeah, he's mostly pitching inside at the moment.",1.2205882352941178,0.0548186740229933,68,54,13,1,False,True,48.0
711,"Yes, they’re finally housebroken. No more spitting.",1.2205882352941178,0.0586861873392161,68,55,11,2,False,True,51.0
711,This stay-at-home order is driving me crazy!,1.2205882352941178,0.0623141247807263,68,56,9,3,False,True,44.0
711,I told them offspeed pitches only.,1.2205882352941178,0.0548186740229933,68,54,13,1,False,True,34.0
711,I said three strikes you’re out but they’re not leaving.,1.2205882352941178,0.0623141247807263,68,56,9,3,False,True,56.0
711,The sign was BUNT!!!,1.2205882352941178,0.0548186740229933,68,54,13,1,False,True,20.0
711,"Go high and inside!  No make that go outside, and high.",1.2205882352941178,0.0623141247807263,68,56,9,3,False,True,55.0
711,"I know Major League Baseball players are desperate to play in front of fans, but this is taking it too far.",1.2205882352941178,0.0623141247807263,68,56,9,3,False,True,107.0
711,These luxury box seats feel very homey.,1.2205882352941178,0.0623141247807263,68,56,9,3,False,True,39.0
711,Stuart and I have different takes on how to spice up one’s marriage.,1.2205882352941178,0.0586861873392161,68,55,11,2,False,True,68.0
711,"Home run"" is taking on a whole new meaning",1.2205882352941178,0.0548186740229933,68,54,13,1,False,False,42.0
711,He still can't get to first base!,1.2205882352941178,0.0623141247807263,68,56,9,3,False,True,33.0
711,This new sound system I bought really makes it feel like you are at the game!,1.2205882352941178,0.0548186740229933,68,54,13,1,False,True,77.0
711,You'll never believe what they wanted to use for home plate!,1.2205882352941178,0.0623141247807263,68,56,9,3,False,True,60.0
711,I call'em as I see 'em!,1.2205882352941178,0.0623141247807263,68,56,9,3,False,True,23.0
711,Except his pitches are always high and inside.,1.2205882352941178,0.0586861873392161,68,55,11,2,False,True,46.0
711,My boyfriend is trying to get to second base.,1.2205882352941178,0.0586861873392161,68,55,11,2,False,True,45.0
711,3-D TVs are amazing now Dolores... Come over and we'll watch Naked and Afraid.,1.2205882352941178,0.0586861873392161,68,55,11,2,False,True,78.0
711,We're hitting a little too close to home these days.,1.2205882352941178,0.0506567414947393,68,53,15,0,False,True,52.0
711,And it's a curveball into the kitchen!,1.2205882352941178,0.0586861873392161,68,55,11,2,False,True,38.0
711,"Girl,they weren't lying about these new 4-D televisions.",1.2205882352941178,0.0586861873392161,68,55,11,2,False,True,56.0
711,"I'm telling you Harold, these new box suites are incredible!",1.2205882352941178,0.0690000961791841,68,58,5,5,False,True,60.0
711,"Well, technically, every run is a home run.",1.2205882352941178,0.0548186740229933,68,54,13,1,False,True,43.0
711,Babe? Ruth here.,1.2205882352941178,0.0586861873392161,68,55,11,2,True,True,16.0
711,I'll tell you what Denise...these home games are really getting on my nerves.,1.2205882352941178,0.0586861873392161,68,55,11,2,False,True,77.0
711,They're taking this home base thing very literally!,1.2205882352941178,0.0586861873392161,68,55,11,2,False,True,51.0
711,If he connects it will be off the hook!,1.2205882352941178,0.0548186740229933,68,54,13,1,False,True,39.0
711,Who said you can't have a ball in quarantine?,1.2205882352941178,0.0690000961791841,68,58,5,5,True,True,45.0
711,"The good news is that I get a great seat along the first base line.  The bad news is that we have four broken windows, three broken lamps and one hold out for a better contract.",1.2205882352941178,0.0586861873392161,68,55,11,2,False,True,177.0
711,"Yes, they're keeping distance and using protective gear.",1.2205882352941178,0.0567853660992547,68,57,8,3,False,True,56.0
711,"It's confirmed, watching baseball live is truly boring.",1.2205882352941178,0.0586861873392161,68,55,11,2,False,True,55.0
711,I love having the kids back home.,1.2205882352941178,0.0586861873392161,68,55,11,2,False,True,33.0
711,Me too! I’ve felt like I’ve been out in left field since February.,1.2205882352941178,0.0657421608251683,68,57,7,4,False,True,66.0
711,No mother.  I will not yell “Swing”at him.,1.2205882352941178,0.0548186740229933,68,54,13,1,False,True,42.0
711,I’ve got a front row seat to phase one of MLB’s gradual reopening!,1.2205882352941178,0.0548186740229933,68,54,13,1,False,True,66.0
711,So this is home schooling?!#?,1.2205882352941178,0.0623141247807263,68,56,9,3,True,True,29.0
711,"Yeah Grampa, he still throws the bat.",1.2205882352941178,0.0657421608251683,68,57,7,4,False,True,37.0
711,This better be a walk,1.2205882352941178,0.0548186740229933,68,54,13,1,False,False,21.0
711,"Well, I need *something* to root for.""",1.2205882352941178,0.0586861873392161,68,55,11,2,False,False,38.0
711,One more wild pitch and I'm calling the bullpen.,1.2205882352941178,0.0623141247807263,68,56,9,3,False,True,48.0
711,I'm telling you MLB's live stream hologram is the way to go.,1.2205882352941178,0.0586861873392161,68,55,11,2,False,True,60.0
711,"Hi, Mom.  They're at it again.",1.2205882352941178,0.0657421608251683,68,57,7,4,False,True,30.0
711,"So, I put my foot down, 
and now he's having the cat call balls and strikes.",1.2205882352941178,0.0623141247807263,68,56,9,3,False,True,76.0
711,The virus came from a real bat. Bob believes  he's hitting it,1.2205882352941178,0.0586861873392161,68,55,11,2,False,False,61.0
711,"I told them if they want to play hardball, we can play hardball.",1.2205882352941178,0.0506567414947393,68,53,15,0,False,True,64.0
711,I can't wait for the parks to reopen.,1.2205882352941178,0.0586861873392161,68,55,11,2,False,True,37.0
711,It's not the game that bothers me.  It's all that spitting.,1.2205882352941178,0.0586861873392161,68,55,11,2,False,True,59.0
711,It’s a curve.  I’ll tell him.,1.2205882352941178,0.0548186740229933,68,54,13,1,False,True,29.0
711,...AND! I've got the best seat in the house!,1.2205882352941178,0.0548186740229933,68,54,13,1,False,True,44.0
711,"As he stepped up to the plate, Jerry couldn’t help but wonder if he was going to get on base or strike out with Marsha tonight.",1.2205882352941178,0.0586861873392161,68,55,11,2,False,True,127.0
711,"It's still tied, but we're just at the top of the 147th inning.",1.2205882352941178,0.0657421608251683,68,57,7,4,False,True,63.0
711,"When you guys get through, don't forget to repair the broken lamps, doors and windows---and I refuse to call balls and strikes for you.",1.2205882352941178,0.0586861873392161,68,55,11,2,False,True,135.0
711,Same old ball game. And you?,1.2205882352941178,0.0586861873392161,68,55,11,2,True,True,28.0
711,3D TVs. Brings the action right into your home!,1.2205882352941178,0.0586861873392161,68,55,11,2,False,True,47.0
711,It's for my Sports Culture class.  I'm Zooming a staged re-creation of 'Casey at the Bat.',1.2205882352941178,0.0657421608251683,68,57,7,4,False,False,90.0
711,"I dunno Martha, it's not the same without the stadium vibe",1.2205882352941178,0.0548186740229933,68,54,13,1,False,False,58.0
711,I’m starting to think it’s possible to be TOO close to the action.,1.2205882352941178,0.0657421608251683,68,57,7,4,False,True,66.0
711,"You will not be getting to third base, mister.",1.2205882352941178,0.0623141247807263,68,56,9,3,False,True,46.0
711,"I'd better hang up now, Megan. There's a runner on second.",1.2205882352941178,0.0548186740229933,68,54,13,1,False,True,58.0
711,They threw me a real curveball.,1.2205882352941178,0.0657421608251683,68,57,7,4,False,True,31.0
711,Get the southpaw ready—my husband is gassed.,1.2205882352941178,0.0623141247807263,68,56,9,3,False,True,44.0
711,...just sitting here watching an old ball game...,1.2205882352941178,0.0623141247807263,68,56,9,3,False,True,49.0
711,The only place to watch baseball in the state of Hallucination.,1.2205882352941178,0.0623141247807263,68,56,9,3,False,True,63.0
711,Don’t worry. They’re wearing gloves and masks,1.2205882352941178,0.0548186740229933,68,54,13,1,False,False,45.0
711,"This isolation is great, I’m the sole spectator of the virtual sports season. It almost seems real and no masks except for the catcher.",1.2205882352941178,0.0623141247807263,68,56,9,3,False,True,135.0
711,I can't explain it. I keep waking up with these cravings for peanuts and Cracker Jack.,1.2205882352941178,0.0586861873392161,68,55,11,2,False,True,86.0
711,I've got a front row seat!,1.2205882352941178,0.0586861873392161,68,55,11,2,False,True,26.0
711,At least I won't have to steam clean the carpets thanks to the no spitting rule.,1.2205882352941178,0.0623141247807263,68,56,9,3,False,True,80.0
711,Let me call you back - there’s two outs in the bottom of the ninth and the pasta is boiling over.,1.2205882352941178,0.0623141247807263,68,56,9,3,False,True,97.0
711,"Thanks again, Pat. These seats are amazing!",1.2205882352941178,0.0623141247807263,68,56,9,3,False,True,43.0
711,"I promise, nobody’s spitting.",1.2205882352941178,0.0657421608251683,68,57,7,4,False,True,29.0
711,You can do it babe!,1.2205882352941178,0.0548186740229933,68,54,13,1,False,True,19.0
711,"Mom, It is just part of Covid baseball. You have to expect that you have to leap over the sofa to reach home plate from third.",1.2205882352941178,0.0623141247807263,68,56,9,3,False,True,126.0
711,"Yeah, 22 home games this season.",1.2205882352941178,0.0586861873392161,68,55,11,2,False,True,32.0
711,Throw the spit ball. There's no umpire,1.2205882352941178,0.0623141247807263,68,56,9,3,False,False,38.0
711,"Hello 911? Yeah, I am about to get hit in the face by a baseball bat.",1.2205882352941178,0.0548186740229933,68,54,13,1,True,True,69.0
711,What's the signal for slide?,1.2205882352941178,0.0586861873392161,68,55,11,2,True,True,28.0
711,"Don't worry, Mom.  It's slow pitch.",1.2205882352941178,0.0548186740229933,68,54,13,1,False,True,35.0
711,"I didn't think it was possible, but I like sports even less now.",1.2205882352941178,0.0586861873392161,68,55,11,2,False,True,64.0
711,"I don’t know who to root for, Jan. They’re both home teams.",1.2205882352941178,0.0548186740229933,68,54,13,1,False,True,59.0
711,The pitcher is keeping his distance but only the catcher is wearing a mask.,1.2205882352941178,0.0548186740229933,68,54,13,1,False,True,75.0
711,"If this pitcher gives up one more mirror or window, I'm going to need to order a reliever.",1.2205882352941178,0.0586861873392161,68,55,11,2,False,True,90.0
711,No difference...still can’t stay awake for all 9 innings.,1.2205882352941178,0.0586861873392161,68,55,11,2,False,True,57.0
711,"Yes, my husband swings.",1.2205882352941178,0.0586861873392161,68,55,11,2,False,True,23.0
711,"I don’t know where they came from. But two of them aren’t wearing face masks, and it’s making me really uncomfortable.",1.2205882352941178,0.0548186740229933,68,54,13,1,False,True,118.0
711,"The pitcher's mound is six feet, six inches, but the catcher's mask needs to be redesigned.",1.2205882352941178,0.0623141247807263,68,56,9,3,False,True,91.0
711,That's right officer - he's already taken three balls.,1.2205882352941178,0.0548186740229933,68,54,13,1,False,True,54.0
711,Somehow this is even more boring that social distancing.,1.2205882352941178,0.0623141247807263,68,56,9,3,False,True,56.0
711,"Finally, home base feels like home.",1.2205882352941178,0.0586861873392161,68,55,11,2,False,True,35.0
711,"Officer, I violated social distancing; you MUST arrest me.",1.2205882352941178,0.0623141247807263,68,56,9,3,False,True,58.0
711,Hmm. Maybe I misread the signals.,1.2205882352941178,0.0506567414947393,68,53,15,0,False,True,33.0
711,I want $100 on the home team.,1.2205882352941178,0.0506567414947393,68,53,15,0,False,True,29.0
711,This will finally the year my team makes it to the Living Room Series,1.2205882352941178,0.0623141247807263,68,56,9,3,False,False,69.0
711,"Ya, I'll get a hotdog and a beer.",1.2205882352941178,0.0548186740229933,68,54,13,1,False,True,33.0
711,"We haven't had live sports on TV in 85 days Roberta, let us live a little!",1.2205882352941178,0.0506567414947393,68,53,15,0,False,True,74.0
711,And they’ve taken a salary cut too.,1.2205882352941178,0.0586861873392161,68,55,11,2,False,True,35.0
711,"Having Hubby home has been a real relief.  
He came in after I gave up a lead off walk.",1.2205882352941178,0.0657421608251683,68,57,7,4,False,True,87.0
711,Remember to throw insiders.,1.2205882352941178,0.0548186740229933,68,54,13,1,False,True,27.0
711,Me? Just waiting for parks to open up. How about you?,1.2205882352941178,0.0548186740229933,68,54,13,1,True,True,53.0
711,"Why do they call it ""home"" field advantage?",1.2205882352941178,0.0548186740229933,68,54,13,1,True,True,43.0
711,The boys are trying to keep in shape.,1.2205882352941178,0.0623141247807263,68,56,9,3,False,True,37.0
711,Jason likes to throw high and inside.,1.2205882352941178,0.0657421608251683,68,57,7,4,False,True,37.0
711,"Hi, I called and ordered a hot dog over an hour. Could you hurry up, please? It’s already the 5th inning.”",1.2205882352941178,0.0623141247807263,68,56,9,3,True,False,106.0
711,"Mom, can the chatter!",1.2205882352941178,0.0548186740229933,68,54,13,1,False,True,21.0
711,"The live baseball alternative is working out, but I’m not looking forward to the horse racing.",1.2205882352941178,0.0586861873392161,68,55,11,2,False,True,94.0
711,I'm trying to look on the bright side. This whole thing really is bringing us closer together!,1.2205882352941178,0.0548186740229933,68,54,13,1,False,True,94.0
711,Home runs are the new normal around here,1.2205882352941178,0.0623141247807263,68,56,9,3,False,False,40.0
711,We need an Umpire  -- He's throwing  spitball without a mask!,1.2205882352941178,0.0586861873392161,68,55,11,2,False,True,61.0
711,We can talk longer when I'm not surrounded by rookies.,1.2205882352941178,0.0623141247807263,68,56,9,3,False,True,54.0
711,Get set for a slider.,1.2205882352941178,0.0657421608251683,68,57,7,4,False,True,21.0
