contest,caption,mean,precision,votes,not_funny,somewhat_funny,funny,has_question_mark,ends_with_punctuation,caption_length
684,"I know he's a little freaky looking, but hiring him will help with our diversity goals.",1.162162162162162,0.0431413089590404,74,62,12,0,False,True,87
684,"We're bringing in Harvey, since he writes monsters 
with such authenticity.",1.162162162162162,0.0431413089590404,74,62,12,0,False,True,75
684,"We'll call this meeting to order, but first  give this nice man your   your drink orders.  serena carroll",1.162162162162162,0.0510062646406354,74,64,8,2,False,False,105
684,"Leonard here, is an attorney who's going to help us unionize.",1.162162162162162,0.0510062646406354,74,64,8,2,False,True,61
684,"Oh, ladies! No makeup today?",1.162162162162162,0.0510062646406354,74,64,8,2,True,True,28
684,"And, briefly, before we put the motion to a vote, Melvin from Corporate Social Responsibility is here to provide us with a non-monstrous veiwpoint.",1.162162162162162,0.0472377580505781,74,63,10,1,False,True,147
684,''Really an ODIOUS work to GREET among the FUNNIEST'',1.162162162162162,0.0472377580505781,74,63,10,1,False,False,53
684,"So please join me in welcoming our new committee member, and don't be distracted by the polymer coating referred to as ""clothing.""",1.162162162162162,0.0431413089590404,74,62,12,0,False,False,130
684,The administration would like our assistance at their border facilities.  You guys up for that?,1.162162162162162,0.0431413089590404,74,62,12,0,True,True,95
684,We will not tolerate minority homeowners organizing.,1.162162162162162,0.0472377580505781,74,63,10,1,False,True,52
684,This is Matthews from HR. Apparently certain departments are eating too many interns.,1.162162162162162,0.0510062646406354,74,64,8,2,False,True,85
684,Remember sophistication is not a perquisite for admittance to the Milky Way Advanced Plant council.,1.162162162162162,0.0472377580505781,74,63,10,1,False,True,99
684,"Is he animal, vegetable or mineral? Oh, who cares! Let's eat!",1.162162162162162,0.0510062646406354,74,64,8,2,True,True,61
684,"I was looking for more interesting ideas not more interesting looks, but I guess this is okay.",1.162162162162162,0.0431413089590404,74,62,12,0,False,True,94
684,"For a different perspective on Climate Change, I invited Mr. Smith from the automotive industry.",1.162162162162162,0.0472377580505781,74,63,10,1,False,True,96
684,Do you recommend the garçon?,1.162162162162162,0.0472377580505781,74,63,10,1,True,True,28
684,Look who woke up from his 300 year nap!,1.162162162162162,0.0510062646406354,74,64,8,2,False,True,39
684,"Bob here says enough with energy drinks and job placement, let's just hide under children's beds.",1.162162162162162,0.0472377580505781,74,63,10,1,False,True,97
684,I brought the lawyer because things are starting to get scary.,1.162162162162162,0.0431413089590404,74,62,12,0,False,True,62
684,"I've asked Bob to join us today as an inedible Human Resource, and I'm specifically asking everyone to respect the all boundaries we've previously spoken about regarding this role.",1.162162162162162,0.0510062646406354,74,64,8,2,False,True,180
684,Let's discuss his idea of the Holiday theme for next year's Board Meeting.,1.162162162162162,0.0510062646406354,74,64,8,2,False,True,74
684,Jim is here today to give a talk on diversification in the workplace. Whatever that is?,1.162162162162162,0.0472377580505781,74,63,10,1,True,True,87
684,Trump's Cabinet,1.162162162162162,0.0431413089590404,74,62,12,0,False,False,15
684,"Welcome, welcome, to these special auditions, for roles in the new Dr. Seuss extended editions!",1.162162162162162,0.0431413089590404,74,62,12,0,False,True,95
684,"We should take a break, the hot lunch I ordered has arrived.",1.162162162162162,0.0510062646406354,74,64,8,2,False,True,60
684,And these are the diversity hires.,1.162162162162162,0.0510062646406354,74,64,8,2,False,True,34
684,Elmer here will help us get back on track with our diversity program in,1.162162162162162,0.0472377580505781,74,63,10,1,False,False,71
684,"Ha-ha, Jim forgot again it’s casual Friday.",1.162162162162162,0.0431413089590404,74,62,12,0,False,True,43
684,"Our new spokes person is the bad guy from Shazam""",1.162162162162162,0.0510062646406354,74,64,8,2,False,False,49
684,So it's unanimous; we've agreed to start the meeting after we eat pepperoni slice monster.  Well almost unanimous.,1.162162162162162,0.0472377580505781,74,63,10,1,False,True,114
684,And now Ned is going to tell us about our new health insurance plan.,1.162162162162162,0.0472377580505781,74,63,10,1,False,True,68
684,Our potential investors took one look and ran for the hills even though we have literally ate up our competition.,1.162162162162162,0.0472377580505781,74,63,10,1,False,True,113
684,"Don't blame me, blame #humantoo.",1.162162162162162,0.0472377580505781,74,63,10,1,False,True,32
684,"Dam, is today casual Friday?",1.162162162162162,0.0472377580505781,74,63,10,1,True,True,28
684,Mr. Harris from HR is hear to tell us about our health plan options.,1.162162162162162,0.0431413089590404,74,62,12,0,False,True,68
684,"Let's do all we can to help our new office manager fit in!""",1.162162162162162,0.0472377580505781,74,63,10,1,False,False,59
684,How the turntables..,1.162162162162162,0.0510062646406354,74,64,8,2,False,True,20
684,"Joe’s comb over is pretty scary, so do we let him in?",1.162162162162162,0.0472377580505781,74,63,10,1,True,True,53
684,"What, your name isn’t Bruce? Now that’s going to be confusing!",1.162162162162162,0.0510062646406354,74,64,8,2,True,True,62
684,Shall we start with water?,1.162162162162162,0.0472377580505781,74,63,10,1,True,True,26
684,"George, here, is employee-of-the-month. In the spirit of Thanksgiving, who wants the first bite?",1.162162162162162,0.0472377580505781,74,63,10,1,True,True,96
684,You're right! Of course the cartoonist was on drugs.,1.162162162162162,0.0472377580505781,74,63,10,1,False,True,52
684,No one told me it was going to be a costume meeting.,1.162162162162162,0.0472377580505781,74,63,10,1,False,True,52
684,I believe everyone here knows Jenkins.  He's been tapped to run our Earth office beginning next quarter.,1.162162162162162,0.0510062646406354,74,64,8,2,False,True,104
684,I think we can all agree on diversity,1.162162162162162,0.0431413089590404,74,62,12,0,False,False,37
684,Every focus group liked him for the role of monster.,1.162162162162162,0.0472377580505781,74,63,10,1,False,True,52
684,"And our newest member, a non alien, please help yourself!",1.162162162162162,0.0431413089590404,74,62,12,0,False,True,57
684,"My doctor says I need to cut back on spicy foods, so I'm afraid our lunch today is rather bland.",1.162162162162162,0.0472377580505781,74,63,10,1,False,True,96
684,Let me welcome you all to our annual diversity conference.,1.162162162162162,0.0510062646406354,74,64,8,2,False,True,58
684,Good news. Noah here has agreed to build it. It will feature a mammoth all-you-can-eat-that-don't-eat-you-first buffet table.,1.162162162162162,0.0510062646406354,74,64,8,2,False,True,125
684,And of course separate checks.,1.162162162162162,0.0472377580505781,74,63,10,1,False,True,30
684,"Sorry guys, but we are all older monster actors who
have been retired from any movies in this digital world.",1.162162162162162,0.0472377580505781,74,63,10,1,False,True,108
684,We were serious about our commitment to equity and inclusion.,1.162162162162162,0.0472377580505781,74,63,10,1,False,True,61
684,With our CPA you can write off your UFOs and all your ET expenses!,1.162162162162162,0.0472377580505781,74,63,10,1,False,True,66
684,"Now listen, they didn’t yank us out from under the beds to make just another inflammatory, divisive decision for people to scream about online.",1.162162162162162,0.0472377580505781,74,63,10,1,False,True,143
684,I'm here to boost diversity!,1.162162162162162,0.0472377580505781,74,63,10,1,False,True,28
684,"Now, I want everyone's undivided attention.  Russell has a few ideas on how we can re-brand our organization.",1.162162162162162,0.0472377580505781,74,63,10,1,False,True,109
684,"We need to improve our diversity - I want to see more middle-aged  white men around the table""",1.162162162162162,0.0510062646406354,74,64,8,2,False,False,94
684,"When you get to know Lawson, you'll find he's not really different.",1.162162162162162,0.0431413089590404,74,62,12,0,False,True,67
684,"Okay, he's here, so let's begin the meating.",1.162162162162162,0.0472377580505781,74,63,10,1,False,True,44
684,"Well,I was going to eat him,but I decided to send him to HR instead",1.162162162162162,0.0472377580505781,74,63,10,1,False,False,67
684,"All in favor of the vegetarian selection, say ""Aye.""",1.162162162162162,0.0472377580505781,74,63,10,1,False,False,52
684,Now I know we've been trying to avoid this for some time now but I feel it is time to acknowledge the human in the room.,1.162162162162162,0.0409396618846149,74,64,9,1,False,True,120
684,"So, who still needs a costume for Halloween?",1.162162162162162,0.0431413089590404,74,62,12,0,True,True,44
684,The new guy didn’t get memo about “Casual Fright-day”.,1.162162162162162,0.0472377580505781,74,63,10,1,False,True,54
684,"?hcnul ruo yug siht is

(Is this guy our lunch?)",1.162162162162162,0.0472377580505781,74,63,10,1,True,False,48
684,"For your DMV appointment, you only need bring a birth certificate, social security card and two proofs of residence.",1.162162162162162,0.0510062646406354,74,64,8,2,False,True,116
684,"The 'Skinks 'N' Grubs Platter to Share'  -- dressing on the side, please.",1.162162162162162,0.0472377580505781,74,63,10,1,False,True,73
684,"Attention everybody: May I present our new
First Vice-president from the Planet Earth! """,1.162162162162162,0.0472377580505781,74,63,10,1,False,False,88
684,I can vouch for his bonafides personally,1.162162162162162,0.0510062646406354,74,64,8,2,False,False,40
684,I am proud to announce that we met our divirsity goal by hiring an immigrant to be our server.,1.162162162162162,0.0510062646406354,74,64,8,2,False,True,94
684,"And due to the success of our galactic inclusion program, please welcome our newest team member, Jooooohn Doooooe!",1.162162162162162,0.0472377580505781,74,63,10,1,False,True,114
684,Mr. Jones here is the new Acting Director of the Deep Swamp.,1.162162162162162,0.0545148812668257,74,65,6,3,False,True,60
684,"Meet the lawyer we hired for this year's ""Vilest Creature in the Universe"" competition. He's also the winner!",1.162162162162162,0.0472377580505781,74,63,10,1,False,True,109
684,I think we can finally say we've achieved diversity in the boardroom.,1.162162162162162,0.0472377580505781,74,63,10,1,False,True,69
684,"Dude, what the heck is he wearing?",1.162162162162162,0.0510062646406354,74,64,8,2,True,True,34
684,"Let me introduce you to our cousin. He comes from the most vile of swamps, the White House!",1.162162162162162,0.0545148812668257,74,65,6,3,False,True,91
684,I'd like you to meet our new Human Resources figurehead.,1.16,0.0426170883122746,75,63,12,0,False,True,56
684,"I want you all to welcome Smith, our diversity coordinator.",1.16,0.0357166022414741,75,66,8,1,False,True,59
684,This legislative panel stands by its resolution that Earth's humans are too hideous to remain in this galaxy,1.16,0.0466537948786224,75,64,10,1,False,False,108
684,Introducing  John Token,1.1578947368421053,0.0460839492511006,76,65,10,1,False,False,23
684,"Oh, look. we have an adult in the room.",1.1549295774647887,0.0432478576664078,71,60,11,0,False,True,39
684,"From now on when we order lunch we will no longer use the phrase, ‘I feel like...’",1.1549295774647887,0.0432478576664078,71,60,11,0,False,False,82
684,"Hard to believe, but he claims to have a great understanding 
of the demographics of our target market.",1.1549295774647887,0.0432478576664078,71,60,11,0,False,True,103
684,"Guys, this is Peter. He's a new hire in human resources and, as you can see, he has no idea what that really means.",1.1549295774647887,0.0432478576664078,71,60,11,0,False,True,115
684,"This is Henry from Human Resources, whatever that is.""",1.1549295774647887,0.0432478576664078,71,60,11,0,False,False,54
684,Say hi to Ted.  He's a great dancer.,1.1549295774647887,0.0476738049630548,71,61,9,1,False,True,36
684,Let’s break! I see lunch has arrived.,1.1549295774647887,0.0432478576664078,71,60,11,0,False,True,37
684,"I'd like to welcome the newest member of to the Monster Worker Union, the American Businessman.",1.1549295774647887,0.0432478576664078,71,60,11,0,False,True,95
684,"What do you mean you're a more qualified monster?
This is a human we're talking about!",1.1549295774647887,0.0432478576664078,71,60,11,0,True,True,86
684,"In light of recent events, Bob will be our new VP in Nevada.",1.1549295774647887,0.0476738049630548,71,61,9,1,False,True,60
684,"This is Jerry from HR. He's here to address any questions about last week's incident with the ""Creature from the Lagoon of Color"".",1.1549295774647887,0.0517223952130692,71,62,7,2,False,True,130
684,Melvin from HR wants to discuss what you're not wearing on casual Fridays.,1.1549295774647887,0.0432478576664078,71,60,11,0,False,True,74
684,I guess it's because alligator is no longer on the menu.,1.1549295774647887,0.0476738049630548,71,61,9,1,False,True,56
684,This is our new hire. Please be nice to him.,1.1549295774647887,0.0432478576664078,71,60,11,0,False,True,44
684,"Nice costume, bro, but Halloween was two weeks ago.",1.1549295774647887,0.0476738049630548,71,61,9,1,False,True,51
684,"I'm as excited as you are, but this time we'll eat the accountant AFTER the presentation.",1.1549295774647887,0.0517223952130692,71,62,7,2,False,True,89
684,"Who's the new guy?""
""Former member of US Congress. He'll do well.",1.1549295774647887,0.0554763071364565,71,63,5,3,True,True,65
684,The waiter recommends the Monster Mash for those of you who were wishing for what Mom used to make.,1.1549295774647887,0.0432478576664078,71,60,11,0,False,True,99
684,"His name is Bob, but he's OK with us calling him Neeeeeeeeeeeerd!",1.1549295774647887,0.0476738049630548,71,61,9,1,False,True,65
684,Meet the newest member of the 5 families,1.1549295774647887,0.0476738049630548,71,61,9,1,False,False,40
684,Nigel wants to sponsor us for Odd Fellows.,1.1549295774647887,0.0432478576664078,71,60,11,0,False,True,42
684,"Hey guys, let's welcome Phil, our monster of mediocrity.",1.1549295774647887,0.0476738049630548,71,61,9,1,False,True,56
684,"Diversity is on the table, should we really let this dude in",1.1549295774647887,0.0432478576664078,71,60,11,0,False,False,60
684,I used the diversity card,1.1549295774647887,0.0432478576664078,71,60,11,0,False,False,25
684,I think we've just scratched the surface here guys.,1.1549295774647887,0.0476738049630548,71,61,9,1,False,True,51
684,"Boris wants to know if he can count on us to support Brexit, deal or no deal. Your thoughts?",1.1549295774647887,0.0476738049630548,71,61,9,1,True,True,92
684,I guess we all know who's the winner of this year's costume contest.,1.1549295774647887,0.0476738049630548,71,61,9,1,False,True,68
684,I'd like to introduce Bill.  I'm sure he's gonna fit right in.,1.1549295774647887,0.0432478576664078,71,60,11,0,False,True,62
684,"Everyone welcome this sick freak, Dave",1.1549295774647887,0.0476738049630548,71,61,9,1,False,False,38
684,Everyone please welcome Roger to our team. He worked in a bursar's office and studies show more people are having nightmares about student loans.,1.1549295774647887,0.0517223952130692,71,62,7,2,False,True,145
684,I'd like to thank you for all accepting my invitation to ruin my perfect night's sleep.,1.1549295774647887,0.0432478576664078,71,60,11,0,False,True,87
684,What's truly scary is failing to properly manage risk.,1.1549295774647887,0.0517223952130692,71,62,7,2,False,True,54
684,"You guys won't believe it, no one showed up to see you guys despite our attempts to organize something on Facebook, I'm sorry.""
-Toby, 35, Human Interaction Mgr, Area-51",1.1549295774647887,0.0476738049630548,71,61,9,1,False,False,169
684,Who says you have to be good looking to be on our board?,1.1549295774647887,0.0476738049630548,71,61,9,1,True,True,56
684,"Meet, Greg, our new affirmative action hire.",1.1549295774647887,0.0432478576664078,71,60,11,0,False,True,44
684,"Whoa, Ralph ! 
Today's NOT dress-down day........",1.1549295774647887,0.0476738049630548,71,61,9,1,False,True,49
684,Everyone please welcome Tom—our first affirmative action hire.,1.1549295774647887,0.0476738049630548,71,61,9,1,False,True,62
684,"Let's welcome Mr. Samson, our first diversity hire.",1.1549295774647887,0.0432478576664078,71,60,11,0,False,True,51
684,Somebody was spotted taking the doughnuts intended for this meeting. I won't say who.,1.1549295774647887,0.0432478576664078,71,60,11,0,False,True,85
684,Who ordered pre-packaged lunch again?!,1.1549295774647887,0.0476738049630548,71,61,9,1,True,True,38
684,When are we going to finally see the “whistleblower “ unmasked?,1.1549295774647887,0.0476738049630548,71,61,9,1,True,True,63
684,Is that scary guy in the suit still here? Is he looking at us? Creepy or what? Just ignore him and maybe he'll go away.,1.1549295774647887,0.0476738049630548,71,61,9,1,True,True,119
684,"In the name of diversity, we are electing Jonathan to the Board.",1.1549295774647887,0.0517223952130692,71,62,7,2,False,True,64
684,"Outside of work, Ed is regionally ranked Bocce Ball player!",1.1549295774647887,0.0476738049630548,71,61,9,1,False,True,59
684,Hello do you have a moment to talk about our lord and savior Matthew McConaughey?,1.1549295774647887,0.0476738049630548,71,61,9,1,True,True,81
684,John comes to us from the Big White House. He's here to up our deplorable game.”,1.1549295774647887,0.0517223952130692,71,62,7,2,False,False,80
684,"I'd like you all to give a nice warm welcome to  ""Lunch""",1.1549295774647887,0.0476738049630548,71,61,9,1,False,False,56
684,"OK, what's the theme for the halloween party?",1.1549295774647887,0.0517223952130692,71,62,7,2,True,True,45
684,8 planets....8 representatives.,1.1549295774647887,0.0476738049630548,71,61,9,1,False,True,31
684,"c'mon staff, let's get serious about diversity!",1.1549295774647887,0.0476738049630548,71,61,9,1,False,True,47
684,"As you can see, John is a regular guy.",1.1549295774647887,0.0517223952130692,71,62,7,2,False,True,38
684,Peter came today to give the human perspective on our takeover of the planet.,1.1549295774647887,0.0432478576664078,71,60,11,0,False,True,77
684,"Dinner for Schmucks, alien style",1.1549295774647887,0.0517223952130692,71,62,7,2,False,False,32
684,"Joking aside, we're happy to include a consumer perspective.",1.1549295774647887,0.0432478576664078,71,60,11,0,False,True,60
684,"Now, now, let's give our expert on diversity hiring a chance to explain",1.1549295774647887,0.0432478576664078,71,60,11,0,False,False,71
684,Bernstein is now in charge of M.R. monster resources department.,1.1549295774647887,0.0432478576664078,71,60,11,0,False,True,64
684,"OK, so who volunteers to vaporize the INS?",1.1549295774647887,0.0432478576664078,71,60,11,0,True,True,42
684,May I call the meeting to order?,1.1549295774647887,0.0476738049630548,71,61,9,1,True,True,32
684,"Guys, this is Bob from the new Eighth Gate. He’s here to talk to us about our personal savior.",1.1549295774647887,0.0554763071364565,71,63,5,3,False,True,94
684,His resume says he's delicious,1.1549295774647887,0.0476738049630548,71,61,9,1,False,False,30
684,"No need to be frightened , Grunwald.
He can't help the way he looks.
I think he must have been born that way.",1.1549295774647887,0.0432478576664078,71,60,11,0,False,True,109
684,"Please welcome Monster, Inc.’s newest board member.",1.1549295774647887,0.0476738049630548,71,61,9,1,False,True,51
684,I’m afraid we only do regular mash.,1.1549295774647887,0.0432478576664078,71,60,11,0,False,True,35
684,Thank you all for coming on such short notice.,1.1549295774647887,0.0517223952130692,71,62,7,2,False,True,46
684,the human is coming! the human is coming! act serious!,1.1549295774647887,0.0476738049630548,71,61,9,1,False,True,54
684,George is our new hire.  We just don't hire for good looks.,1.1549295774647887,0.0432478576664078,71,60,11,0,False,True,59
684,"Mole, what is a mole?",1.1549295774647887,0.0517223952130692,71,62,7,2,True,True,21
684,"This is Bob. We weren't able to get an intern from one of the top planets, so here we are. Please make him feel welcome, and don't eat him yet.",1.1549295774647887,0.0476738049630548,71,61,9,1,False,True,143
684,"So,are we agreed? Will we support kicking Trump out of the White House?",1.1549295774647887,0.0517223952130692,71,62,7,2,True,True,71
684,"Hey guys, check out my carnivore costume! Scary, right?",1.1549295774647887,0.0476738049630548,71,61,9,1,True,True,55
684,"So I told him, ""I""m sorry, but we have a very strict dress code policy in our office.""",1.1549295774647887,0.0517223952130692,71,62,7,2,False,False,86
684,Smithers is here to present the staff request that on Fridays we allow business casual.,1.1549295774647887,0.0432478576664078,71,59,11,0,False,True,87
684,Who votes to visit Disney World instead of the zoo?,1.1549295774647887,0.0476738049630548,71,61,9,1,True,True,51
684,We dug up this specimen in the Antarctic desert,1.1549295774647887,0.0432478576664078,71,60,11,0,False,False,47
684,HR wants some cultural diversity!,1.1549295774647887,0.0432478576664078,71,60,11,0,False,True,33
684,The next season of “Succession” will be a little different...,1.1549295774647887,0.0476738049630548,71,61,9,1,False,True,61
684,The Diversity Committee will come to order.,1.1549295774647887,0.0517223952130692,71,62,7,2,False,True,43
684,Nobody?  But he said such nice things about us at the press conference!,1.1549295774647887,0.0432478576664078,71,60,11,0,True,True,71
684,"I'm eager to introduce the stranger among us, and please make note  that our policies continue to encourage socializing by eating together and not eating each other, meeting over bone appetite",1.1549295774647887,0.0476738049630548,71,61,9,1,False,False,192
684,Headquarters wants to know if anyone else is in favor of scaling down?,1.1549295774647887,0.0476738049630548,71,61,9,1,True,True,70
684,I think Cryptocurrency is giving us a bad name.,1.1549295774647887,0.0432478576664078,71,60,11,0,False,True,47
684,"I know we come from different planets, but let us try to agree on a health-care bill.",1.1549295774647887,0.0476738049630548,71,61,9,1,False,True,85
684,Morton here will be our new HR officer.,1.1549295774647887,0.0432478576664078,71,60,11,0,False,True,39
684,"Let's give a warm welcome to our latest White House hire, Bob!",1.1549295774647887,0.0432478576664078,71,60,11,0,False,True,62
684,"Look, corporate said she had to go, but this wasn't a witch hunt.",1.1549295774647887,0.0476738049630548,71,61,9,1,False,True,65
684,Didn’t anybody tell you it’s dress down Friday around here!,1.1549295774647887,0.0517223952130692,71,62,7,2,False,True,59
684,"The straighter they look, the freakier they are in their private lives, my mama told me so. Oh, hey Carl..",1.1549295774647887,0.0476738049630548,71,61,9,1,False,True,106
684,"Well, it looks like you've nailed this job!",1.1549295774647887,0.0476738049630548,71,60,9,1,False,True,43
684,Anyone 13 or older can render an Aye.,1.1549295774647887,0.0476738049630548,71,61,9,1,False,True,37
684,I asked Jeeves to invite her because her species is ABOUT to become extinct,1.1549295774647887,0.0517223952130692,71,62,7,2,False,False,75
684,Did you catch that flabberball game last night?,1.1549295774647887,0.0432478576664078,71,60,11,0,True,True,47
684,You knew that you would be our token human when you interviewed.,1.1549295774647887,0.0517223952130692,71,62,7,2,False,True,64
684,I give up.,1.1549295774647887,0.0517223952130692,71,62,7,2,False,True,10
684,"All in favor of ending the Board meeting and retiring to the Mos Eisley Cantina for a drink, say Aye!",1.1549295774647887,0.0432478576664078,71,60,11,0,False,True,101
684,I've decided our board needs more diversity.,1.1549295774647887,0.0432478576664078,71,60,11,0,False,True,44
684,"If  you would like to know why they are angry, it's 'cause they thought you were bringing lunch. But don't worry, they will improvise by using you.",1.1549295774647887,0.0432478576664078,71,60,11,0,False,True,147
684,Well it’s clear that the human harassment seminar was ten hours well spent.,1.1549295774647887,0.0476738049630548,71,61,9,1,False,True,75
684,Please all welcome our diversity hire,1.1549295774647887,0.0476738049630548,71,61,9,1,False,False,37
684,"He claims ""Monsters"" is a tired brand",1.1549295774647887,0.0432478576664078,71,60,11,0,False,False,37
684,"Seriously, Beth, what planet are you from? I'm thinking deep fried.",1.1549295774647887,0.0476738049630548,71,61,9,1,True,True,67
684,"So, we're all agreed on sausage and pepperoni.  Oh, wait, Bob reminded me that he's vegan.",1.1549295774647887,0.0432478576664078,71,60,11,0,False,True,90
684,We are here to decide who gets the drumsticks.,1.1549295774647887,0.0517223952130692,71,62,7,2,False,True,46
684,OK now that we are diversified lets disagree and fight.,1.1549295774647887,0.0517223952130692,71,62,7,2,False,True,55
684,"And as always, after the lake of fire and the pitchforking, we'll hand it over to legal.",1.1549295774647887,0.0517223952130692,71,62,7,2,False,True,88
684,The regular troughs will be fine and please keep everything on the rare side.,1.1549295774647887,0.0432478576664078,71,60,11,0,False,True,77
684,How about fish ? Fish is nice.,1.1549295774647887,0.0476738049630548,71,61,9,1,True,True,30
684,"This is my stepson, Michael, who finally returned home. If some unlucky accident should befall him, then, I will blame some of you in this room.",1.1549295774647887,0.0432478576664078,71,60,11,0,False,True,144
