contest,caption,mean,precision,votes,not_funny,somewhat_funny,funny,has_question_mark,ends_with_punctuation,caption_length
776,Matt is working from home today.,1.2542372881355932,0.0708684556926678,59,47,9,3,False,True,32
776,Matt’s been working from home ever since COVID hit.,1.2542372881355932,0.0620760093786306,59,45,13,1,False,True,51
776,But is he masked?,1.2542372881355932,0.0666174487376973,59,46,11,2,True,True,17
776,"It's wonderful that Roger has been able to work from home, but I worry about what will happen when the lockdown ends.",1.2542372881355932,0.0708684556926678,59,47,9,3,False,True,117
776,He's practicing for the interview on Thursday,1.2542372881355932,0.0571749718358648,59,44,15,0,False,False,45
776,Everybody else is working from home so I suggested he try it too.,1.2542372881355932,0.0708684556926678,59,47,9,3,False,True,65
776,"I told Matt, this working from home gig has to stop!",1.2542372881355932,0.0620760093786306,59,45,13,1,False,True,52
776,Three days a week his boss lets him work from home.,1.2542372881355932,0.0708684556926678,59,47,9,3,False,True,51
776,Matt gives 'garagiste' new meaning.,1.2542372881355932,0.0666174487376973,59,46,11,2,False,True,35
776,He still works from home two days a week.,1.2542372881355932,0.0571749718358648,59,44,15,0,False,True,41
776,We couldn’t make it work over Zoom…,1.2542372881355932,0.0596758256951999,59,47,10,2,False,False,35
776,"Oh, this? It's just his side-hustle.",1.2542372881355932,0.0666174487376973,59,46,11,2,True,True,36
776,Honestly this is the probably the nicest mechanic shop I’ve ever been to”.,1.2542372881355932,0.0666174487376973,59,46,11,2,False,True,74
776,Matt has decided to work from home today,1.2542372881355932,0.0666174487376973,59,46,11,2,False,False,40
776,I'm so proud.  He finally got a job where he could work from home.,1.253968253968254,0.0638749336767074,63,49,12,2,False,True,66
776,"It costs a bit more, but having 'couchside assistance' is worth every penny.",1.253968253968254,0.0677645919511145,63,50,10,3,False,True,76
776,I love the smell of NAPA in the morning.,1.253968253968254,0.0677645919511145,63,50,10,3,False,True,40
776,"Since the pandemic began, Matt has been working from home. But recently I have inquired about his returning to the office.",1.253968253968254,0.0677645919511145,63,50,10,3,False,True,122
776,Matt is getting a little better with the agoraphobia,1.253968253968254,0.0529143196777635,63,49,13,1,False,False,52
776,He's working remotely.,1.253968253968254,0.0638749336767074,63,49,12,2,False,True,22
776,Stuart works from home on Tuesdays and Thursdays.,1.253968253968254,0.074940679623924,63,52,6,5,False,True,49
776,He is going to work on work-life boundaries once he is finished with the car.,1.253968253968254,0.0597325236542579,63,48,14,1,False,True,77
776,"Don’t cancel your dentist appointment , he has been doing it for forty years",1.253968253968254,0.0638749336767074,63,49,12,2,False,False,76
776,They told him to work from home now.,1.253968253968254,0.0638749336767074,63,49,12,2,False,True,36
776,"Matt didn't like the idea at first, but Jim convinced him that working from home is just a better option given the pandemic.",1.253968253968254,0.0677645919511145,63,50,10,3,False,True,124
776,You should see what he can do in the kitchen.,1.253968253968254,0.0638749336767074,63,49,12,2,False,True,45
776,UberGrease is so convenient,1.253968253968254,0.0677645919511145,63,50,10,3,False,False,27
776,Online vocational training has been a Godsend for him during the pandemic.,1.253968253968254,0.0638749336767074,63,49,12,2,False,True,74
776,I know! Just when Matt and I have finally figured out this whole “co-working-from-home” thing I get called back into the office.,1.253968253968254,0.0597325236542579,63,48,14,1,False,True,128
776,It's a GREAT service.  The only problem with it is getting the car into the house.,1.253968253968254,0.0597325236542579,63,48,14,1,False,True,82
776,He’s so happy that he can work from home.,1.253968253968254,0.0677645919511145,63,50,10,3,False,True,41
776,"Oh, you haven't heard of service-as-a-service?",1.253968253968254,0.0638749336767074,63,49,12,2,True,True,46
776,"And, he calls it performance art!",1.253968253968254,0.0597325236542579,63,48,14,1,False,True,33
776,Matt is a bit  paranoid about the virus!,1.253968253968254,0.0638749336767074,63,49,12,2,False,True,40
776,With Matt's work at home it's been better than TV.,1.253968253968254,0.0638749336767074,63,49,12,2,False,True,50
776,Matt loves it when I come by his office for lunch,1.253968253968254,0.0638749336767074,63,49,12,2,False,False,49
776,The new platinum home health plan is just fabulous!,1.253968253968254,0.0638749336767074,63,49,12,2,False,True,51
776,He has been working from home since the start of Covid.,1.253968253968254,0.074940679623924,63,52,6,5,False,True,55
776,It’s his work-life balance.,1.253968253968254,0.0677645919511145,63,50,10,3,False,True,27
776,"Oh, His hobbies? Well...",1.253968253968254,0.0677645919511145,63,50,10,3,True,True,24
776,He’s taking this whole work from home thing to a whole other level.,1.253968253968254,0.0638749336767074,63,49,12,2,False,True,67
776,He always takes it to far when we play charades,1.253968253968254,0.0677645919511145,63,50,10,3,False,False,47
776,This is the show I've been binging I told you about.,1.253968253968254,0.0638749336767074,63,49,12,2,False,True,52
776,"Yes, 15 minutes guaranteed!",1.2537313432835822,0.0576302865172192,67,51,15,1,False,True,27
776,"I know, but parking garages have gotten so expensive in the city.",1.2537313432835822,0.0614290970015868,67,52,13,2,False,True,65
776,"Oh My, and Frank said, ""just get a new turn-signal bulb"".",1.2537313432835822,0.0683966521635199,67,54,9,4,False,True,57
776,"It's a new car repair app called Mattrix, only $18 an hour!",1.2537313432835822,0.0650062919478103,67,53,11,3,False,True,59
776,Matt likes to work from home.,1.2537313432835822,0.0650062919478103,67,53,11,3,False,True,29
776,"Actually, it's not too bad. My last roommate was a lion tamer. Ugh, fur everywhere. Plus, I get a free oil change whenever I need one.",1.2537313432835822,0.0650062919478103,67,53,11,3,False,True,134
776,Matt is great; he only requires a lifting jig in the middle of the living room to come and service the car at home...,1.2537313432835822,0.0614290970015868,67,52,13,2,False,True,117
776,"The rent is good, and shop closed at 5:00 and on weekends.",1.2537313432835822,0.0614290970015868,67,52,13,2,False,True,58
776,He seems so much happier since he took up a hobby.,1.2537313432835822,0.0576302865172192,67,51,15,1,False,True,50
776,He was feeling so isolated in the home office.,1.2537313432835822,0.0576302865172192,67,51,15,1,False,True,46
776,"me, the 23-year-old family disappointment, now using my college fund to build 90s import cars in my moms living room",1.2537313432835822,0.0650062919478103,67,53,11,3,False,False,116
776,"'i told him that taking things literally, really grinds my gears. So he decided to check them out'",1.2537313432835822,0.0650062919478103,67,53,11,3,False,False,98
776,Don’t you just LOVE a man in a suit?,1.2537313432835822,0.0683966521635199,67,54,9,4,True,True,36
776,This home service is great. We never have to go out again.,1.2535211267605637,0.0557311376330432,71,54,16,1,False,True,58
776,"With his shop in the living room, we can even write off part of the mortgage and heating and cooling. Usually, I’m filming him for a how-to for that YouTube. Money in the bank. Y’all should try it. Jim’s what, a proctologist?",1.2535211267605637,0.0625362988648693,71,56,12,3,True,True,225
776,House calls are so convenient.,1.2535211267605637,0.0656749812534255,71,57,10,4,False,True,30
776,"Well, Matt just installed the lift and said, ""If everybody else is working from home, I will, too.""",1.2535211267605637,0.0625362988648693,71,56,12,3,False,False,99
776,The lift cost us but the convenience is worth it.,1.2535211267605637,0.053895755476776,71,56,13,2,False,True,49
776,"I am desperately hoping this permanent work from home policy ends soon! - Paul Jelinek, NYC",1.2535211267605637,0.0686703549543711,71,58,8,5,False,False,91
776,Isn't it great being in a George Booth cartoon?,1.2535211267605637,0.0625362988648693,71,56,12,3,True,True,47
776,everything has been running smoothly now that he works from home,1.2535211267605637,0.0592315303600602,71,55,14,2,False,False,64
776,Remote tinkering has greatly improved his skill set.,1.2535211267605637,0.0656749812534255,71,57,10,4,False,True,52
776,At least i'm not married to Matt.,1.2533333333333334,0.0603095119963446,75,59,13,3,False,True,33
776,This really is the ultimate customer waiting room!’,1.2533333333333334,0.0603095119963446,75,59,13,3,False,False,51
776,"Matt just loves working from home.but for me, it does have its  drawbacks.",1.2533333333333334,0.0540047823485708,75,57,17,1,False,True,74
776,We felt we needed more togetherness!,1.2533333333333334,0.0572440117119413,75,58,15,2,False,True,36
776,"We didn't consider it at first, but he's made it work.",1.2533333333333334,0.0540047823485708,75,57,17,1,False,True,54
776,I love the smell of lube oil in the morning.,1.2533333333333334,0.0603095119963446,75,59,13,3,False,True,44
776,"When he said work from home,I thought he was going to use the garage.",1.2533333333333334,0.0572440117119413,75,58,15,2,False,True,69
776,"He's on overtime, and I insist on ""Husband home evenings.""",1.2533333333333334,0.0603095119963446,75,59,13,3,False,False,58
776,Working from home has been easier on my husband than it has on me.,1.2533333333333334,0.0660148313484019,75,61,9,5,False,True,66
776,He always resented when I ‘d ask him to clean the garage.,1.2531645569620251,0.0524268378810975,79,60,18,1,False,True,57
776,Unfortunately he takes innuendo very literally.,1.2531645569620251,0.0610105168366915,79,63,12,4,False,True,47
776,Matt can't help but bring his work home.,1.2530120481927711,0.0589938498066457,83,66,13,4,False,True,40
776,He retired too soon…I put a marble in the radiator…,1.2530120481927711,0.0614339700432865,83,67,11,5,False,False,51
776,"Yes, he’s really amazing with his hands.",1.25,0.068613352984621,56,44,10,2,False,True,40
776,Matt is a homebody.,1.25,0.0668153104781061,64,51,10,3,False,True,19
776,Making house calls sounded so good.,1.25,0.0656346677032783,60,47,11,2,False,True,35
776,Your husband is sure home oily.,1.25,0.0641517899283383,68,54,11,3,False,True,31
776,Home office deductions are so worth it!”,1.25,0.0774778991632908,60,50,5,5,False,False,40
776,Can't beat Matt's in home car repair service.,1.25,0.0731925054711399,56,45,8,3,False,True,45
776,Excuse me one second Kathy...Use the ratchet wrench!',1.25,0.0641517899283383,68,54,11,3,False,False,53
776,"Yes, I think the Seminar was called ""find what feels good""",1.25,0.0568989369449107,68,52,15,1,False,False,58
776,"No, it's just a hobby.",1.25,0.0736039915270249,44,34,9,1,False,True,22
776,I hope it won't be long before he gets vaccinated,1.25,0.073741800271926,60,49,7,4,False,False,49
776,He needed a hobby.,1.25,0.068613352984621,56,44,10,2,False,True,18
776,I really enjoy having a man around the house.,1.25,0.0629940788348712,64,50,12,2,False,True,45
776,It's really the best option if your brakes don't actually work.,1.25,0.0606339062590832,68,53,13,2,False,True,63
776,Matt loves this new work-from-home idea.,1.25,0.0606339062590832,68,53,13,2,False,True,40
776,When they told him he could work from home it was a no brainer!,1.25,0.0611795542081449,60,46,13,1,False,True,63
776,"Matt said if I get to work from home, 
he gets to work from home",1.25,0.0637058989297031,56,43,12,1,False,False,64
776,"Yes, I'd say that the work from home trend has definitely gone too far.",1.25,0.0656346677032783,60,47,11,2,False,True,71
776,He's a surgon during the week but he's not allowed to get his hands durty.,1.25,0.0868070330843521,48,40,4,4,False,True,74
776,It’s good he has an interest…,1.25,0.0611795542081449,60,46,13,1,False,False,29
776,And he got such good reviews too. Just look at those fine motor skills!,1.25,0.0775015709937128,56,46,6,4,False,True,71
776,I'm so sick of him bringing his work home with him.,1.25,0.0611795542081449,60,46,13,1,False,True,51
776,These new Discovery Channel reality shows have become so immersive.,1.25,0.0674865446869524,68,55,9,4,False,True,67
776,"Don't worry, he's been vaccinated.",1.25,0.0629940788348712,64,50,12,2,False,True,34
776,Matt now spends more time at home while keeping his customers happy.,1.25,0.0665628905712983,52,40,11,1,False,True,68
776,Harry likes to bring his work home with him.,1.25,0.0731925054711399,56,45,8,3,False,True,44
776,He takes more brakes now that he's working from home.,1.25,0.0731925054711399,56,45,8,3,False,True,53
776,It's hard to believe that Matt started out as a televangelist.,1.25,0.0698060266447833,60,48,9,3,False,True,62
776,"Honey, Beverly just came over for some coffee.",1.25,0.0775015709937128,56,46,6,4,False,True,46
776,Work from home seems such a good idea!,1.25,0.0698060266447833,60,48,9,3,False,True,38
776,I love that he brings his work home.,1.25,0.0611795542081449,60,46,13,1,False,True,36
776,Work from home can have its privileges.,1.25,0.0596039560679269,76,60,13,3,False,True,39
776,We started with Covid and it just seemed so much more convenient!,1.25,0.0568989369449107,68,52,15,1,False,True,65
776,"I'm still telecommuting and the garage was always Matt's home away from home, anyway.",1.25,0.0611795542081449,60,46,13,1,False,True,85
776,"The feng shui for our home is much better this way for my husband and his hobby of fixing classic old automobiles.  It's better to know just what he is going to be doing with his time in retirement anyway, don't you think?",1.25,0.0815833571008459,56,47,4,5,True,True,222
776,"No dear, the car won't do anything - I just named it elephant!",1.25,0.0720053207351927,52,41,9,2,False,True,62
776,Matt really loves working from home.,1.25,0.0585091247916174,72,56,14,2,False,True,36
776,Matt's really considerate about social distancing.,1.25,0.0589255650988789,64,49,14,1,False,True,50
776,"I'm sure the neighbors won't complain about the noise""

Joseph Malecki III, Langhorne PA",1.25,0.0698060266447833,60,48,9,3,False,False,88
776,A garage and tea room is our hedge against an economic slump.,1.25,0.0568989369449107,68,52,15,1,False,True,61
776,"Yes, his boss said he could work from home!",1.25,0.068613352984621,56,44,10,2,False,True,43
776,This gives working at home a whole new dimension.,1.25,0.0641517899283383,68,54,11,3,False,True,49
776,"He's happy to be working from home, but it's a nightmare to vacuum.",1.25,0.0656346677032783,60,47,11,2,False,True,67
776,"Incredible, right. It's this new reality show TV that literally brings the action to YOU!",1.25,0.0736039915270249,44,34,9,1,False,True,89
776,"Just wait till he drops a wrench, Joanne.",1.25,0.0674865446869524,68,55,9,4,False,True,41
776,"Maybe next time the car needs brakes, he'll take it in like a good boy...",1.25,0.0815410091316802,48,39,6,3,False,True,73
776,It took a while to adjust to Bill's working from home,1.25,0.0665628905712983,52,40,11,1,False,False,53
776,We're just happy he's been able to keep his job by working from home.,1.25,0.0698060266447833,60,48,9,3,False,True,69
776,I never thought the industrial look was me but since Matt's been working from home I'm more open to the idea.,1.25,0.0731925054711399,56,45,8,3,False,True,109
776,Matt has adjusted nicely to working at home.,1.25,0.0720053207351927,52,41,9,2,False,True,44
776,"I don't even own a car, but I can never resist a man without a clue.",1.25,0.0815410091316802,48,39,6,3,False,True,68
776,A good entrepreneur starts his business at home,1.25,0.054554472558998,64,48,16,0,False,False,47
776,"One Revell kit for Christmas forty years ago, and, well...",1.25,0.0611795542081449,60,46,13,1,False,True,58
776,He plans to keep working from home.,1.25,0.0585091247916174,72,56,14,2,False,True,35
776,And this is why at ‘Pampered Mechanic’ you’re your own boss.,1.25,0.0568989369449107,68,52,15,1,False,True,60
776,He may not go back to the Garage when the pandemic ends...he enjoys working from home so much,1.25,0.068613352984621,56,44,10,2,False,False,93
776,Obviously I work upstairs.,1.25,0.0698060266447833,60,48,9,3,False,True,26
776,We’ re planning to donate it to the MOMA.,1.25,0.069827548466366,48,37,10,1,False,True,41
776,We save some much money on rent by running Matt’s business out of our living room.,1.25,0.0565840470977899,76,59,15,2,False,True,82
776,He’s looking for the vagina.,1.25,0.0656346677032783,60,47,11,2,False,True,28
776,Working from home really suits Matt!,1.25,0.0617620756663045,72,57,12,3,False,True,36
776,I long for the days before we all started working remotely.,1.25,0.0629940788348712,64,50,12,2,False,True,59
776,What's a car?,1.25,0.0759105483283959,48,38,8,2,True,True,13
776,"I'm so happy that he has found
 a hobby that he can do at home!",1.25,0.0720053207351927,52,41,9,2,False,True,63
776,Matt will never go back to the garage now that he’s found how much work he can do at home.,1.25,0.0665628905712983,52,40,11,1,False,True,90
776,"When Matt said he made house calls, It didn't dawn on me that he would use the living room.",1.25,0.0704295212273763,64,52,8,4,False,True,91
776,I wonder about these home service companies; suppose I need to get something from my glove compartment?,1.25,0.0585091247916174,72,56,14,2,True,True,103
776,I don't get much time to myself since he started working from home,1.25,0.0731925054711399,56,45,8,3,False,False,66
776,We've saved hundreds of dollars doing our own car repairs.,1.25,0.0565840470977899,76,59,15,2,False,True,58
776,The IRS has yet to recognize the home garage as a legitimate home office.  Larry is setting out to change that. We are claiming carpet cleaning as a business expense.,1.25,0.0818111351841585,52,43,5,4,False,True,166
776,"I meant take a TEA break!""",1.25,0.0731925054711399,56,45,8,3,False,False,26
776,We get the furniture and tires wholesale.,1.25,0.0585091247916174,72,56,14,2,False,True,41
776,I hope he realizes you don't do brake work on a hydraulic lift.,1.25,0.073741800271926,60,49,7,4,False,True,63
776,"No, he's actually a lawyer but he does this in his spare time so he can feel useful.",1.25,0.0629940788348712,64,50,12,2,False,True,84
776,Isn't he cute!  We met when I took my husband's car in for repairs.,1.25,0.0637058989297031,56,43,12,1,False,True,67
776,He's a new man!,1.25,0.0775015709937128,56,46,6,4,False,True,15
776,We've been able to spend so much more time together since he started working from home.,1.25,0.0698060266447833,60,48,9,3,False,True,87
776,It's been a real hassle since the garage burned down.,1.25,0.0606339062590832,52,39,13,0,False,True,53
776,He had me at Grease Monkey.,1.25,0.0656346677032783,60,47,11,2,False,True,27
776,"I didn’t think it would be possible to run a successful auto repair shop from our fifth floor walk-up, but Matt has really made it happen.",1.25,0.0629940788348712,64,50,12,2,False,True,138
776,He always wanted to have a home office.,1.25,0.0668153104781061,64,51,10,3,False,True,39
776,"It’s inconvenient, but the six week home immersion course is the only way to gain fluency in the vernacular of auto repair",1.25,0.0637058989297031,56,43,12,1,False,False,122
776,It’s what he calls high performance art.,1.25,0.0548300019507937,80,62,16,2,False,True,40
776,I was just as surprised when Matt said that he would be having to work remotely.,1.25,0.0563734521002121,60,45,15,0,False,True,80
776,They used to say that with a job like his we'd never be able to move out of the city,1.25,0.051863989604749,80,61,18,1,False,False,84
776,"Some people complain about their husbands working from home,but my undercarriage has never felt better.",1.25,0.0818111351841585,52,43,5,4,False,True,103
776,Gone transit! With Matt working from home we could sell the car.,1.25,0.0720053207351927,52,41,9,2,False,True,64
776,We just re-watched The French Connection,1.25,0.0637058989297031,56,43,12,1,False,False,40
776,Living Vroom,1.25,0.0631613940799889,48,36,12,0,False,False,12
776,"He used to work for Matt’s Garage, but now he’s a used car flipper",1.25,0.0606339062590832,68,53,13,2,False,False,66
776,..He threatened to join The Great Resignation if they called him back in..,1.25,0.0568989369449107,68,52,15,1,False,True,74
776,I hate the home office thing.,1.25,0.0656346677032783,60,47,11,2,False,True,29
776,"When he said he wanted to retire, I did not appreciate what he meant.",1.25,0.073741800271926,60,49,7,4,False,True,69
776,Hybrid suits him.,1.25,0.069827548466366,48,37,10,1,False,True,17
776,I LOVE that Matt makes house calls!,1.25,0.0606339062590832,68,53,13,2,False,True,35
776,We tried to isolate but I'm afraid he's got the Corolla virus,1.25,0.0868070330843521,48,40,4,4,False,False,61
776,OK. . . It's not the battery.,1.25,0.0583874208121142,56,42,14,0,False,True,29
776,The bright side of him still working from home is that we keep each other company.,1.25,0.0665628905712983,52,40,11,1,False,True,82
776,He's fixing it so he can ZOOM from home.,1.25,0.0668153104781061,64,51,10,3,False,True,40
776,So happy now that Matt can grease his own nuts at home,1.25,0.0637058989297031,56,43,12,1,False,False,54
776,Matt said it will be more valuable as an art installation,1.25,0.0720053207351927,52,41,9,2,False,False,57
776,This is Matt’s worst online zoom class so far…,1.25,0.068613352984621,56,44,10,2,False,False,46
776,"He promised not to fart.""",1.25,0.0648520647114615,72,58,10,4,False,False,25
776,I love that he’s working from home now…it’s like a second honeymoon!,1.25,0.0867854392946935,44,36,5,3,False,True,68
776,"Matt keeps the old family car going for us. By the by dear, please let me give you a ride home?",1.25,0.0810419435241374,60,51,3,6,True,True,95
776,"My decorator said to Matt: for a comfortable feeling, bring the outside inside",1.25,0.068613352984621,56,44,10,2,False,False,78
776,George has enjoyed working from home so much I think he will have difficulty adjusting to returning to the garage.,1.25,0.0665628905712983,52,40,11,1,False,True,114
776,We fix your car in hibachi style.,1.25,0.0698060266447833,60,48,9,3,False,True,33
776,"It's a mess, but I don't have to leave the house",1.25,0.069827548466366,48,37,10,1,False,False,48
776,I’m just happy he found a hobby,1.25,0.0656346677032783,60,47,11,2,False,False,31
776,I love the way Matt has repurposed your table,1.25,0.0775015709937128,56,46,6,4,False,False,45
776,How do you think it goes with the landscape over my sofa?,1.25,0.068613352984621,56,44,10,2,True,True,57
776,Now I can be sure he will always be home for dinner,1.25,0.0665628905712983,52,40,11,1,False,False,51
776,He’s doing it wrong.,1.25,0.0665628905712983,52,40,11,1,False,True,20
776,"I just couldn’t eat anymore sourdough.”
 #pandemichobb",1.25,0.073741800271926,60,49,7,4,False,False,54
776,He really has gone too far with these home repairs.,1.25,0.054554472558998,64,48,16,0,False,True,51
776,I've always liked a handy man around the house,1.25,0.0606339062590832,68,53,13,2,False,False,46
776,We’re so lucky his job let’s him work from home.,1.25,0.0731925054711399,56,45,8,3,False,True,48
776,This wasn’t what I had in mind when I signed up for a shared workspace.,1.25,0.0606339062590832,68,53,13,2,False,True,71
776,"Re-tyreing? No, I've repaired to the drawing room",1.25,0.0770643499106384,52,42,7,3,True,False,49
776,"Had paid so much to install that stripping pole; so after retiring, I had to put it to some kind of use",1.25,0.0774778991632908,60,50,5,5,False,False,103
776,They said they’d send over technician so he could answer all my questions in person. But I wasn’t expecting this.,1.25,0.068613352984621,56,44,10,2,False,True,113
776,Sure beats television for entertainment!,1.2469135802469136,0.0570111105630559,81,64,14,3,False,True,40
776,"Honey, can you bring back the tea spoons when you're done?",1.2467532467532467,0.0617467435606379,77,62,11,4,True,True,58
776,Oh no! Matt was working from home before COVID happened.,1.2465753424657535,0.0610063434515405,73,58,12,3,False,True,56
776,Ratchet it on up…And grease is the word,1.2465753424657535,0.0610063434515405,73,58,12,3,False,False,39
776,It was either that or animal husbandry.,1.2465753424657535,0.0610063434515405,73,58,12,3,False,True,39
776,He can't live without his toys.,1.2463768115942029,0.0598584473368864,69,54,13,2,False,True,31
776,Working from home has presented some challenges.,1.2463768115942029,0.0598584473368864,69,54,13,2,False,True,48
776,We're still looking for the best place to mount those pictures from his old office to help him feel more at home.,1.2463768115942029,0.0633189638030215,69,55,11,3,False,True,113
776,It's hard to find a mechanic who makes house calls.,1.2463768115942029,0.0561851960758104,69,53,15,1,False,True,51
776,I know the ad said “in your home” but I just assumed that was a typo.,1.2463768115942029,0.0665999146890887,69,56,9,4,False,True,69
776,Matt is beta-testing his Uber Garage concept,1.2463768115942029,0.0598584473368864,69,54,13,2,False,False,44
776,Matt decided that working at home was a better option than vaccination…”,1.2463768115942029,0.0633189638030215,69,55,11,3,False,False,72
776,The kids will be joining us in here too for their afternoon online learning classes.,1.2463768115942029,0.0598584473368864,69,54,13,2,False,True,84
776,"Honestly, until last year I had never even considered working from home as an option for us.",1.2463768115942029,0.0633189638030215,69,55,11,3,False,True,92
776,"You weren't kidding when you said ""open concept""!",1.2463768115942029,0.0598584473368864,69,54,13,2,False,True,49
776,"There’s an app for that. After he’s done, I’m hitting my doc ap for a bypass..",1.2463768115942029,0.0633189638030215,69,55,11,3,False,True,78
