contest,caption,mean,precision,votes,not_funny,somewhat_funny,funny,has_question_mark,ends_with_punctuation,caption_length
813,"Napoleon, the battle is in the other direction",1.194174757281553,0.0458817051092486,103,86,14,3,False,False,46
813,Onward to Russia! who cares about milk,1.194174757281553,0.0437580101767949,103,85,16,2,False,False,38
813,I believe Napoleon started that way!,1.194174757281553,0.0458817051092486,103,86,14,3,False,True,36
813,"You will be home today, and we will all continue washing.",1.194174757281553,0.0437580101767949,103,85,16,2,False,True,57
813,You’re headed in the wrong direction.,1.194174757281553,0.0415258479206979,103,84,18,1,False,True,37
813,"No,I don’t have $27.50 in quarters so you can get to Waterloo.",1.194174757281553,0.0415258479206979,103,84,18,1,False,True,62
813,"Napoleone D Buonaparte, if you do not get off your high horse this minute there will be no water and no loo for you today",1.1938775510204085,0.0516061474957516,98,84,9,5,False,False,121
813,Yo Boney. History is written by the moms.,1.1938775510204085,0.0473540662235426,98,82,13,3,False,True,41
813,"Technically, the sign says, ""Must be shorter than Napoleon to ride"".",1.1938775510204085,0.0450778676534156,98,81,15,2,False,True,68
813,Forget it. I'm sick of my tax dollars going to the military.,1.1938775510204085,0.0495257612120043,98,83,11,4,False,True,60
813,I told you to hold your horses!,1.1935483870967742,0.0512993044199553,93,79,10,4,False,True,31
813,Everything else is now $1.25.,1.1935483870967742,0.0489679950914336,93,78,12,3,False,True,29
813,Tell Marengo that it’s time for your nappy!,1.1935483870967742,0.0535291763869746,93,80,8,5,False,True,43
813,50 cents is missing from my purse.,1.1935483870967742,0.0423500259626214,124,104,16,4,False,True,34
813,"Okay Bonaparte,time for dinner.",1.1935483870967742,0.0512993044199553,93,79,10,4,False,True,31
813,"Yes mommy remembered your brie and camembert, now time to go home.""",1.1932773109243695,0.0418169295123723,119,99,17,3,False,False,67
813,On to Waterloo!,1.1932773109243695,0.0400777462009214,119,98,19,2,False,True,15
813,Don't go to Russia in the winter.,1.1932773109243695,0.0434866122748136,119,100,15,4,False,True,33
813,"You are deeply unloved, Dylan.",1.1932773109243695,0.0418169295123723,119,99,17,3,False,True,30
813,"If you knew about Napoleon's inferiority complexes, you would not
 pretend to be him.",1.1932773109243695,0.0450945151923958,119,101,13,5,False,True,85
813,Grow up! And stop acting like your father!,1.1932773109243695,0.0434866122748136,119,100,15,4,False,True,42
813,The insurrection is over…you missed the whole thing & it’s your horse’s fault,1.1932773109243695,0.0418169295123723,119,99,17,3,False,False,77
813,"Liberte, Bibliothèque public",1.1932773109243695,0.0418169295123723,119,99,17,3,False,False,28
813,"Yes, yes, I bought a French baguette!",1.193181818181818,0.0507466573824295,88,74,11,3,False,True,37
813,I should never have let you win that snowball fight.,1.193181818181818,0.0507466573824295,88,74,11,3,False,True,52
813,You don't want to know how this ends. I'll show you Waterloo; get in the car!,1.193181818181818,0.0453073635933749,88,72,15,1,False,True,77
813,"We're going the other way, Johnny.",1.193181818181818,0.0556568888386434,88,76,7,5,False,True,34
813,Don’t you go developing a complex from this,1.193181818181818,0.0481039521831209,88,73,13,2,False,False,43
813,At least this one will grow out of it.,1.1929824561403508,0.0410943170565212,114,94,18,2,False,True,38
813,"My arms are full sweetie, maybe David can take the picture.",1.1929824561403508,0.0464166896677998,114,97,12,5,False,True,59
813,Give me liberty or give me another ride on this thing!,1.1927710843373494,0.0498538307925901,83,69,12,2,False,True,54
813,I’ll be home when Wellington’s army  surrenders and not a moment before!,1.1926605504587156,0.0460411408384759,109,92,13,4,False,True,72
813,"No need for that honey, the Dr. says you will be tall like Dad.",1.1926605504587156,0.0421900144476552,109,90,17,2,False,True,63
813,"50¢?  Pretty steep price Napoleon, after all Waterloo is just ahead!",1.1926605504587156,0.0421900144476552,109,90,17,2,True,True,68
813,Atta boy! But wait till tomorrow to attack Russia.,1.1926605504587156,0.0441575812788796,109,91,15,3,False,True,50
813,"Enough horsing around, Leon.  Time to go home for your nap-o.",1.1923076923076923,0.0474851556477788,104,88,12,4,False,True,61
813,If you don’t get down from there I’ll banish you to your room.,1.1923076923076923,0.045476735915275,104,87,14,3,False,True,62
813,I've already been to Moscow.,1.1923076923076923,0.0474851556477788,104,88,12,4,False,True,28
813,"Forget it, Nappy. It’s time for your nappy.",1.1923076923076923,0.043375419446059,104,86,16,2,False,True,43
813,Parles-tu anglais?,1.1923076923076923,0.0494120076932711,104,89,10,5,True,True,18
813,Golden arc burger now!,1.1923076923076923,0.0411669833086595,104,85,18,1,False,True,22
813,The grocery store has enough of my money.,1.1923076923076923,0.043375419446059,104,86,16,2,False,True,41
813,"5 more minutes, and then it’s back to Elba with you",1.1923076923076923,0.0474851556477788,104,88,12,4,False,False,51
813,"I can't tell which was worse, this Napoleon phase or the Oedipal phase",1.1923076923076923,0.043375419446059,104,86,16,2,False,False,70
813,"Get in the car, or I will send you right back to Elba.",1.192,0.0371500879172319,125,102,22,1,False,True,54
813,"That's enough, David.",1.192,0.0420383849172588,125,105,16,4,False,True,21
813,"No, we’re not vacationing in Elba.",1.192,0.0435460453372763,125,106,14,5,False,True,34
813,"Actually, they went the other way.",1.192,0.0353708463878594,125,101,24,0,False,True,34
813,"I said read about history, don't reenact it!",1.192,0.0420383849172588,125,105,16,4,False,True,44
813,Aren't you a bit short for that ride?,1.1919191919191918,0.0469141939596215,99,83,13,3,True,True,37
813,Time to come back to St. Helena.,1.1919191919191918,0.0446631675051722,99,82,15,2,False,True,32
813,"Get off your high horse, Napoleon!",1.1919191919191918,0.0446631675051722,99,82,15,2,False,True,34
813,"You can conquer Russia tomorrow, but now it's time for dinner.",1.1919191919191918,0.0469141939596215,99,83,13,3,False,True,62
813,"Sorry , I haven’t used change since we got a washer-dryer .",1.1919191919191918,0.0446631675051722,99,82,15,2,False,True,59
813,Napoleon's mother is out of fifty-cent pieces.,1.1919191919191918,0.0446631675051722,99,82,15,2,False,True,46
813,That is not the way back to Paris.,1.1919191919191918,0.0422924989603257,99,81,17,1,False,True,34
813,I command you to retreat and not to return without french fries!,1.1919191919191918,0.0397808044793369,99,80,19,0,False,True,64
813,"Don't get your blankie dirty, General.",1.1919191919191918,0.0490620490620491,99,84,11,4,False,True,38
813,I should have left you at aunt Elba's.,1.1919191919191918,0.0397808044793369,99,80,19,0,False,True,38
813,Let's just hope he grows up to be tall.,1.1919191919191918,0.0446631675051722,99,82,15,2,False,True,39
813,I said you can conquer the Austrians after you clean your room.,1.1916666666666669,0.043152769682596,120,101,15,4,False,True,63
813,This way to moral superiority!,1.1916666666666669,0.0447461456852782,120,102,13,5,False,True,30
813,Rein of Terror: 50c,1.1916666666666669,0.0414982591065,120,100,17,3,False,False,19
813,"Come on Emperor, that kid dressed as Louis xviii was next.",1.1916666666666669,0.0397749856877567,120,99,19,2,False,True,58
813,"Hurry up, dear, the kids are waiting in the car.",1.1914893617021276,0.0460684830975314,94,78,14,2,False,True,48
813,"Sorry Honey, Napoleon lost the war!",1.1914893617021276,0.0460684830975314,94,78,14,2,False,True,35
813,"Enough horsing around, time to conquer homework!",1.1914893617021276,0.0507923846035789,94,80,10,4,False,True,48
813,"Becasue I'm out of centimes, that's why.",1.1914893617021276,0.0507923846035789,94,80,10,4,False,True,40
813,Napoleon right before losing the argument at wal-martloo,1.1914893617021276,0.0435146473673218,94,77,16,1,False,False,56
813,"If you don’t help me with these groceries, I’ll give you a new complex to worry about!",1.1914893617021276,0.0507923846035789,94,80,10,4,False,True,86
813,"Let’s go ! You already dictate my home, marriage and when I can go to the bathroom.",1.1914893617021276,0.0507923846035789,94,80,10,4,False,True,83
813,I said you’re too young to operate complex machinery.,1.191304347826087,0.0425998216136205,115,96,16,3,False,True,53
813,"You can ride at home, but I’m taking the car",1.191304347826087,0.0425998216136205,115,96,16,3,False,False,44
813,"I can no longer obey; I have tasted command, and I cannot give it up.”
“Don’t quote Napoleon to me young man.  We are leaving now.",1.191304347826087,0.0443542568735967,115,97,14,4,False,True,130
813,He does this every time we come,1.191304347826087,0.0407699583052959,115,95,18,2,False,False,31
813,You’re too short!!,1.1910112359550562,0.0502201600716848,89,75,11,3,False,True,18
813,"Able was I, err I saw Aldi.",1.1910112359550562,0.0448479570080877,89,73,15,1,False,True,27
813,Nice Try.  I said  “Nap time”,1.1910112359550562,0.0448479570080877,89,73,15,1,False,False,29
813,I'll be on the 'mommy wine bench.',1.190909090909091,0.0418413831275622,110,91,17,2,False,False,34
813,You don't have a complex and you're not getting Cognac.,1.190909090909091,0.0491723909078942,110,95,9,6,False,True,55
813,You're too big for that!,1.190909090909091,0.0474459519475152,110,94,11,5,False,True,24
813,"What do you mean, ""I can no longer obey; I have tasted command, and I cannot give it up""? One more time: Get. In. The. Car.",1.190909090909091,0.0437893481730463,110,92,15,3,True,True,123
813,I have your Waterloo,1.190909090909091,0.0418413831275622,110,91,17,2,False,False,20
813,"Au contrair, mon petit ami - This does NOT mean I must let you eat cake!!",1.190909090909091,0.0474459519475152,110,94,11,5,False,True,73
813,Cut it out you’re in the 75 percentile in height for your age.,1.190909090909091,0.0376442558598492,110,89,21,0,False,True,62
813,"Sorry, if you’re being him you took no quarter took no quarter.",1.1904761904761905,0.0385684890120315,126,104,20,2,False,True,63
813,"Okay Napoleon, time to go.  I know you don't want to be banished to your room again.",1.1904761904761905,0.0521378597458005,84,71,10,3,False,True,84
813,No! Haven't you learned anything from your little Russian adventure?,1.1904761904761905,0.0429993570427229,105,87,16,2,True,True,68
813,"Yes, you do have the right attitude to be president",1.1904761904761905,0.0470663900505225,105,89,12,4,False,False,51
813,Get a move on or I'll exile you to Elba for the rest of your life.,1.1904761904761905,0.0470663900505225,105,89,12,4,False,True,66
813,"My Dear Bonaparte, I’ve run the economics and your chances of victory aren’t worth two bits.",1.1904761904761905,0.0429993570427229,105,87,16,2,False,True,92
813,"Mommy’s very busy today , sweetie. 
Maybe tomorrow we can invade Russia.",1.1904761904761905,0.0470663900505225,105,89,12,4,False,True,72
813,"You'll still grow a bit I promise, no need to choose bad role models.",1.1904761904761905,0.0493101884627092,84,70,12,2,False,True,69
813,"It is the cause, not the death, that makes the martyr!",1.1904761904761905,0.0470663900505225,105,89,12,4,False,True,54
813,"Let’s go, David!",1.1904761904761905,0.0463101819644777,84,69,14,1,False,True,16
813,I mus' go to Mosgow!,1.1904761904761905,0.0408141461130498,105,86,18,1,False,True,20
813,Samantha just remembered to go home and play with her toys.,1.1904761904761905,0.0450787631733363,105,88,14,3,False,True,59
813,Cheapest war I ever paid for.,1.1904761904761905,0.0429993570427229,105,87,16,2,False,True,29
813,You'll need permission to cross the street.,1.1904761904761905,0.0493101884627092,84,70,12,2,False,True,43
813,I don't care who you think you are.  Wal Mart does not need to be conquered.,1.1904761904761905,0.0450787631733363,105,88,14,3,False,True,76
813,"Roe Wade, I told you for the last time, get off that damn pony.",1.1904761904761905,0.0493101884627092,84,70,12,2,False,True,63
813,"Not what I meant when I said it's ""Nap time""",1.1904761904761905,0.0450787631733363,105,88,14,3,False,False,44
813,"You have about $40 in quarters, I’m headed to the Legion, meet you here in about an hour",1.1900826446280992,0.0394766897547312,121,100,19,2,False,False,88
813,"I also preferred the Trojan horse, kid.",1.1900826446280992,0.0428239550678731,121,102,15,4,False,True,39
813,Would you like a juice box little Napoleon?,1.19,0.0442559132612339,100,83,15,2,True,True,43
813,That only costs 50 cents – you’re not a Dollar General.,1.19,0.0464823198711731,100,84,13,3,False,True,55
813,I think Russia is the other direction.,1.19,0.0419114024647906,100,82,17,1,False,True,38
813,Try your Willy Wonka coin.,1.19,0.0442559132612339,100,83,15,2,False,True,26
813,I was referring to the complex…not Dynamite,1.19,0.0394277244403662,100,81,19,0,False,False,43
813,Men with big egos are cheap rides.,1.19,0.0486068540704524,100,85,11,4,False,True,34
813,"It's Waterloo or dinner, Richie. Your choice.",1.19,0.0442559132612339,100,83,15,2,False,True,45
813,"The Russians are coming, the Russians are coming!",1.1898734177215189,0.0571869769275872,79,68,7,4,False,True,49
813,"That's not the ""nap"" I meant.",1.1896551724137931,0.0404505975246002,116,96,18,2,False,True,29
813,"That's enough countries, no more quarters!",1.1896551724137931,0.0385528961637894,116,95,20,1,False,True,42
813,"C'mon, little man.  Get off your high horse and I'll let you eat cake.",1.1894736842105262,0.0480172067938968,95,80,12,3,False,True,70
813,"Okay, you win. Never again will I take you down the eggs aisle.",1.1894736842105262,0.0456255189839455,95,79,14,2,False,True,63
813,"Delusions of grandeur aside, you still need school supplies.",1.1894736842105262,0.050295291171454,95,81,10,4,False,True,60
813,"I swear, I give you an inch and you take a country.",1.1894736842105262,0.0480172067938968,95,80,12,3,False,True,51
813,"To the candy store, and beyond.",1.1894736842105262,0.0456255189839455,95,79,14,2,False,True,31
813,"Donald, stop acting like a malignantly narcissistic brat.",1.1894736842105262,0.050295291171454,95,81,10,4,False,True,57
813,So are we Kehinde Wiley or Napoleon today?,1.1894736842105262,0.050295291171454,95,81,10,4,True,True,42
813,"Yes, I know, «L’avenir appartient à celui qui contrôle la jeunesse.», but as long as you’re not eating your vegetables, we’re not conquering anything!",1.1893939393939394,0.0374600963691141,132,109,21,2,False,True,150
813,That's not Teddy Roosevelt. Different metaphor.,1.1891891891891893,0.043427127460021,111,93,15,3,False,True,47
813,"I'm out of change, Napolean. Come on home and conquer your chores.",1.1891891891891893,0.0414983763011126,111,92,17,2,False,True,66
813,"Time’s up, Napoleon Dynamite. Onto Waterloo Pool.",1.1891891891891893,0.0452737845030551,111,94,13,4,False,True,49
813,Don't ask. It's complex.,1.1891891891891893,0.043427127460021,111,93,15,3,False,True,24
813,"Your father just had to name you Napoleon""",1.1891891891891893,0.0533084451837284,74,62,10,2,False,False,42
813,"When you're done Nap, lets look for some underwear.",1.1891891891891893,0.0470480151231615,111,95,11,5,False,True,51
813,Josephine wants you to go home for dinner now!,1.1891891891891893,0.0487577264731386,111,96,9,6,False,True,46
813,You're just like you father with his Napoleon complex.,1.1891891891891893,0.043427127460021,111,93,15,3,False,True,54
813,Aren't you a little old for rides Napolean?,1.1891891891891893,0.043427127460021,111,93,15,3,True,True,43
813,"*Right next to the little men's room.""",1.1888888888888889,0.0471257367823253,90,75,13,2,False,False,38
813,You're supposed to tuck that hand under your armpit.,1.1888888888888889,0.0497043555175433,90,76,11,3,False,True,52
813,Pay up. Yonder lies the castle of my father.,1.1888888888888889,0.0521556406110755,90,77,9,4,False,True,44
813,"Dismount, Napoleon. My code says it's time to return home.",1.1888888888888889,0.0497043555175433,90,76,11,3,False,True,58
813,"With inflation, you don’t get a full minute.",1.1886792452830188,0.0446876100083739,106,89,14,3,False,True,44
813,"Okay, Waterloo is that way, but the car is this way.",1.1886792452830188,0.0466548712095284,106,90,12,4,False,True,52
813,"Honey come on,  I'll let you eat cake.",1.1886792452830188,0.0404671897915607,106,87,18,1,False,True,38
813,That blankie of yours needs washing.,1.1886792452830188,0.0446876100083739,106,89,14,3,False,True,36
813,The Battle of the Homework is yet to be won.,1.1886792452830188,0.04262966067122,106,88,16,2,False,True,44
813,Able was I ere I saw Mama,1.1885245901639343,0.0408750764587257,122,102,17,3,False,False,25
813,I'll start looking for a nice Airbnb in Saint Helena.,1.1885245901639343,0.0408750764587257,122,102,17,3,False,True,53
813,"Wait until you’re out of nappies, Napoleon.",1.188235294117647,0.0515695327481218,85,72,10,3,False,True,43
813,You’re going the wrong way!,1.188235294117647,0.0487781166409865,85,71,12,2,False,True,27
813,"Your father is over six feet tall. Trust me, you’ll grow out of this.",1.188235294117647,0.0426506808082336,85,69,16,0,False,True,69
813,Stop it. That's only for the small people.,1.188235294117647,0.0487781166409865,85,71,12,2,False,True,42
813,Are you sure that's where we parked?,1.188118811881188,0.0460582310875762,101,85,13,3,True,True,36
813,You found Dad's brandy bottle? Where is it?,1.188118811881188,0.0438559100799012,101,84,15,2,True,True,43
813,Sorry. You'll have to conquer the world on your own quarters.,1.188118811881188,0.0415369840859466,101,83,17,1,False,True,61
813,See you on the other side.,1.188118811881188,0.0460582310875762,101,85,13,3,False,True,26
813,The same to you...!,1.188118811881188,0.0481599465624368,101,86,11,4,False,True,19
813,We’re not heading to Le Creperie.,1.188118811881188,0.0460582310875762,101,85,13,3,False,True,33
813,The alps are the least of your problems,1.188118811881188,0.0438559100799012,101,84,15,2,False,False,39
813,Your dad also had his Waterloo moment.,1.188118811881188,0.0460582310875762,101,85,13,3,False,True,38
813,Trust me it’s the cheapest dream of your life.,1.188118811881188,0.0460582310875762,101,85,13,3,False,True,46
813,A little emperor you are not,1.188118811881188,0.0438559100799012,101,84,15,2,False,False,28
813,Do you need another exile?”,1.188118811881188,0.0415369840859466,101,83,17,1,True,False,27
813,"‘And by the way, Josephine says homework is EVERY night…’",1.188118811881188,0.0438559100799012,101,84,15,2,False,False,57
813,"‘ Able was I ere I saw Elba’, my foot. Move it now young man.",1.188034188034188,0.0469079651651649,117,101,10,6,False,True,61
813,Your exile is over.,1.188034188034188,0.0419317367509757,117,98,16,3,False,True,19
813,I command you to get icecream,1.188034188034188,0.0436535538448001,117,99,14,4,False,False,29
813,Your Napolean complex is beginning to annoy me.,1.1875,0.0451908720017737,96,80,14,2,False,True,47
813,I’m praying for a growth spurt,1.1875,0.0475553693907926,96,81,12,3,False,False,30
813,I’ll put in two quarters if you go into battle against inflation.,1.1875,0.0498077444129803,96,82,10,4,False,True,65
813,No! We're not invading Russia. Now get in the car!,1.1875,0.0498077444129803,96,82,10,4,False,True,50
813,If you don't get off that thing in three seconds you'll be meeting your Waterloo. One...two...,1.1875,0.0391579031242912,112,92,19,1,False,True,94
813,"Keep in mind that Waterloo Station is right around the corner.”
R.Weingast
New York, N.Y.",1.1875,0.0451908720017737,96,80,14,2,False,True,89
813,"Listen, little man, even Napoleon had to eat dinner! Dismount! And that’s an order",1.1875,0.0483499449996293,112,97,9,6,False,False,82
813,"Nathan, if you really are Napolean, you should have the money to pay for another ride....",1.1875,0.0411608617252668,112,93,17,2,False,True,89
813,You're getting a little too big for your britches.,1.1875,0.0451908720017737,96,80,14,2,False,True,50
813,"I know the Marseillaise sings- ""Allons Enfants de la Patria "",
But I think you're going in the wrong direction!",1.1875,0.0451908720017737,96,80,14,2,False,True,111
813,That display of ego will take you nowhere,1.1875,0.0475553693907926,96,81,12,3,False,False,41
813,See? We got everything we needed without invading the breadbasket of Europe.,1.1875,0.0426956281914983,96,79,16,1,True,True,76
813,"Whoa... 50 cents for a horsey ride!?  Why, when I was a kid...",1.1875,0.0498077444129803,96,82,10,4,True,True,62
813,"If you get in the car, I’ll get you those silver candlesticks you wanted.",1.1869918699186992,0.0421809685262876,123,104,15,4,False,True,73
813,"Yes, I know he was short too, but you are still going to eat your broccoli at dinner.",1.1869918699186992,0.0421809685262876,123,104,15,4,False,True,85
813,How can you waste your time shopping when they’re empire’s to conquer?,1.1869158878504673,0.0462504149761827,107,91,12,4,True,True,70
813,It's time to manifest destiny the produce aisle,1.1869158878504673,0.0443031053337568,107,90,14,3,False,False,47
813,Have you been in mommy's La Croix again?,1.1869158878504673,0.0462504149761827,107,91,12,4,True,True,40
813,Just pretend it's a cape.,1.1869158878504673,0.0401259723334355,107,88,18,1,False,True,25
813,I guess the era of two-bit dictators is over.,1.1869158878504673,0.0443031053337568,107,90,14,3,False,True,45
813,"No, I am your mother, not your Da-veed!",1.1869158878504673,0.0422661732234986,107,89,16,2,False,True,39
813,"If you don’t get in the car right now, this is going to be your Waterloo.",1.1869158878504673,0.0422661732234986,107,89,16,2,False,True,73
813,This is what they are teaching you in French class now?,1.1869158878504673,0.0443031053337568,107,90,14,3,True,True,55
813,That reminds me. I need to pick up some Elba macaroni.,1.1868131868131868,0.0491989256860976,91,77,11,3,False,True,54
813,I thought you said “I want a loo”,1.1868131868131868,0.0439560439560439,91,75,15,1,False,False,33
813,"Fine, we'll listen to some ABBA on the way home.",1.1868131868131868,0.0491989256860976,91,77,11,3,False,True,48
813,At least you haven't dyed your hair orange.,1.1868131868131868,0.0516210667544404,91,78,9,4,False,True,43
813,You can stop posing now. You’re not Napoleon and I’m not Jacques- Louis David.,1.1868131868131868,0.0491989256860976,91,77,11,3,False,True,78
813,To Moscow!,1.1868131868131868,0.0491989256860976,91,77,11,3,False,True,10
813,"No, I do not have another 50 cents so you can “start a land war in Asia”.",1.1868131868131868,0.0491989256860976,91,77,11,3,False,True,73
813,"Glory is fleeting, but obscurity is forever. Now can I have 50 cents, mama?",1.1868131868131868,0.0491989256860976,91,77,11,3,True,True,75
813,That way's Waterloo.  The car's this way.,1.1866666666666668,0.0559708203685878,75,64,8,3,False,True,41
813,I thought your father was spending too much time with you…,1.1864406779661016,0.0398264243177182,118,98,18,2,False,False,58
813,This is as close as your getting to a pomy for  your birthday.,1.1864406779661016,0.0398264243177182,118,98,18,2,False,True,62
813,"You're getting exiled to the shower, Monsieur Emperor.",1.1862745098039216,0.045641722077372,102,86,13,3,False,True,54
813,"Hey kid, take my advice: Don't invade Russia and get off your high horse.",1.1862745098039216,0.045641722077372,102,86,13,3,False,True,73
813,"No more conquering sweetie, mommy needs to get this Brie home in the fridge.",1.1862745098039216,0.0434629696802136,102,85,15,2,False,True,76
813,Relax! You’ll get taller!,1.1862745098039216,0.049713588843674,102,88,9,5,False,True,25
813,"No, Russia’s this way… and a few cents won’t do it!",1.1862745098039216,0.0434629696802136,102,85,15,2,False,True,51
813,After you get to Waterloo find the car--we parked in B2.,1.1862745098039216,0.045641722077372,102,86,13,3,False,True,56
813,This is a dumb cartoon,1.1862745098039216,0.0516292356759498,102,89,7,6,False,False,22
813,I’ll stop calling you Captain Jack when you stop calling me Josephine!,1.1862745098039216,0.0477211049217531,102,87,11,4,False,True,70
813,Vive helping me with the groceries.,1.1862745098039216,0.045641722077372,102,86,13,3,False,True,35
813,"Of course you can become an emperor one day, you just need a seven-part plan and a few friends to play along.",1.1862745098039216,0.0411690742263931,102,84,17,1,False,True,109
813,No I don’t have fifty cents to insure your immortality.,1.1862745098039216,0.049713588843674,102,88,9,5,False,True,55
813,One Napoleon Complex in the family is enough.,1.1862745098039216,0.0411690742263931,102,84,17,1,False,True,45
813,"I've got your water, Lou.",1.186046511627907,0.0453339271851579,86,71,14,1,False,True,25
813,"C'mon shortstuff, Waterloo is this way.",1.186046511627907,0.0437014429603863,129,111,12,6,False,True,39
813,God help me when he grows to 5’10” and thinks he’s Hitler.,1.186046511627907,0.0482572560890765,86,72,12,2,False,True,58
813,"We have time for you to cross the Delaware OR buy new underwear, make up your mind!",1.186046511627907,0.0510133372410021,86,73,10,3,False,True,83
813,"Yes, it is cheaper than gas, but you're still not going anywhere.",1.186046511627907,0.0482572560890765,86,72,12,2,False,True,65
813,Moscow's in Russia Sweetie. It's a long way away and no one wants to conquer it anymore.,1.186046511627907,0.0536279627403627,86,74,8,4,False,True,88
813,Let me get my camera. You're exhibiting great leadership skills.,1.186046511627907,0.042208614556885,86,70,16,0,False,True,64
813,One coin is worth a thousand tantrums.,1.186046511627907,0.0510133372410021,86,73,10,3,False,True,38
813,"Let's go, Napoleon. You're not the one who went to town riding on a pony.",1.1858407079646018,0.0427201529433709,113,95,15,3,False,True,73
