contest,caption,mean,precision,votes,not_funny,somewhat_funny,funny,has_question_mark,ends_with_punctuation,caption_length
684,The motion to terminate Human Resources carries.,1.2307692307692308,0.0497018166750555,104,84,16,4,False,True,48
684,Earth's representative is a weird looking dude!,1.2307692307692308,0.0515458735320969,104,85,14,5,False,True,47
684,Your ideas are alien to us.,1.2307692307692308,0.0497018166750555,104,84,16,4,False,True,27
684,"For all the new cabinet members,the agenda has changed from yesterday!",1.2307692307692308,0.0477866517284347,104,83,18,3,False,True,70
684,We must show that we subscribe to modern values. That's why we took him on,1.2307692307692308,0.0477866517284347,104,83,18,3,False,False,74
684,I suggest a mixed grill  ...,1.2307692307692308,0.0457914575661073,104,82,20,2,False,True,28
684,"Isn't he kind of cute?""
""Forget the menu, I want a piece of that!",1.2307692307692308,0.0515458735320969,104,85,14,5,True,True,65
684,The board met to discuss the alien and alienating nature of global capitalism,1.2307692307692308,0.0497018166750555,104,84,16,4,False,False,77
684,"I do realize that we have focused   a lot on diversity, but...",1.2307692307692308,0.0457914575661073,104,82,20,2,False,True,62
684,"This is John. As you can see, he's possessed Dave.",1.2307692307692308,0.0497018166750555,104,84,16,4,False,True,50
684,"And now, a spokesman from Tokyo Electric Power Company will explain why the survivors of Fukushima have nothing to fear.",1.2307692307692308,0.0497018166750555,104,84,16,4,False,True,120
684,"Let the microbe summit begin.""",1.2307692307692308,0.0497018166750555,104,84,16,4,False,False,30
684,"This is John Smith, he's our new diversity hire. Don't look so concerned. Ron Smith will be here at noon, and he's our lunch.",1.2307692307692308,0.0477866517284347,104,85,15,4,False,True,125
684,"No introductions.  Just make your pitch, and it better be great!",1.2307692307692308,0.0497018166750555,104,84,16,4,False,True,64
684,The new guy may look strange but I hear he thinks outside the box.,1.2307692307692308,0.0437052752953519,104,81,22,1,False,True,66
684,Coffee pot broken again?,1.2307692307692308,0.0497018166750555,104,84,16,4,True,True,24
684,"Greg, you’re making us loo bad.",1.2307692307692308,0.0497018166750555,104,84,16,4,False,True,31
684,"Guys, calm down! He'll fit in perfectly. He worked for ICE.",1.2307692307692308,0.0515458735320969,104,85,14,5,False,True,59
684,Motion to adjourn the Earth has been made. Do I hear a second?,1.2307692307692308,0.0497018166750555,104,84,16,4,True,True,62
684,"As you can see, the delicious 1981 vintage comes in a handsome wool wrapping.",1.2307692307692308,0.0497018166750555,104,84,16,4,False,True,77
684,"We take casual Friday very seriously here, Bob.",1.2307692307692308,0.0477866517284347,104,83,18,3,False,True,47
684,"He's here, finally!  I'm ordering from KFC and McDonalds.  Good, no objections.",1.2307692307692308,0.0497018166750555,104,84,16,4,False,True,79
684,We’re embracing diversity.,1.2307692307692308,0.0437052752953519,104,81,22,1,False,True,26
684,"Alright, who ordered the appetizer ?",1.2307692307692308,0.0477866517284347,104,83,18,3,True,True,36
684,This is a board meeting not a Star Wars cafe.,1.2307692307692308,0.0497018166750555,104,84,16,4,False,True,45
684,"Let's give Seth a big, warm welcome to Monsters, Inc.""",1.2307692307692308,0.0497018166750555,104,84,16,4,False,False,54
684,"First order of business is to eliminate the Human Resources
Department.",1.2307692307692308,0.0497018166750555,104,84,16,4,False,True,71
684,Lets welcome our speaker today on managing inclusiveness.,1.2307692307692308,0.0515458735320969,104,85,14,5,False,True,57
684,"And now please meet Bob, our new Head of Diversity.",1.2307692307692308,0.0457914575661073,104,82,20,2,False,True,51
684,"Bob, over to you for our mandated asexual harassment training.",1.2307692307692308,0.0457914575661073,104,82,20,2,False,True,62
684,Only one slice. We’re all hungry.,1.2307692307692308,0.0497018166750555,104,84,16,4,False,True,33
684,Let’s vote on who is lunch.,1.2307692307692308,0.0437052752953519,104,81,22,1,False,True,27
684,"I don’t know what he is, but he calls himself a poet.",1.2307692307692308,0.0515458735320969,104,85,14,5,False,True,53
684,And now for our midmorning snack.,1.2307692307692308,0.0477866517284347,104,83,18,3,False,True,33
684,"I’d like to introduce our new intern, Kevin. This one is not for eating.",1.2307692307692308,0.0497018166750555,104,84,16,4,False,True,72
684,Do we think Monsters Inc or LLC?,1.2307692307692308,0.0497018166750555,104,84,16,4,True,True,32
684,"As monsters... I mean, as monsters and humans..."" (Eve, age 7",1.2307692307692308,0.0457914575661073,104,82,20,2,False,False,61
684,"OK, who here agrees with Fred that casual Friday has gone too far?",1.2307692307692308,0.0477866517284347,104,83,18,3,True,True,66
684,I'm sure we'll treat him like the animal he is.,1.2307692307692308,0.0515458735320969,104,85,14,5,False,True,47
684,This morning I thought we should hear from human resources.,1.2307692307692308,0.0367427761129201,104,83,19,1,False,True,59
684,"First, let's thank Mr. Addams for hosting.",1.2307692307692308,0.0457914575661073,104,82,20,2,False,True,42
684,Steve here will be talking about his diversity and inclusion initiatives.,1.2307692307692308,0.0477866517284347,104,83,18,3,False,True,73
684,Ok team- let’s show this guy a real hostile takeover!,1.2307692307692308,0.0497018166750555,104,84,16,4,False,True,53
684,Here comes that creepy guy,1.2307692307692308,0.0437052752953519,104,81,22,1,False,False,26
684,"Yes, but what was she wearing?",1.2307692307692308,0.0437052752953519,104,81,22,1,True,True,30
684,So exactly how far do we want to take this diversity thing?,1.2307692307692308,0.0457914575661073,104,82,20,2,True,True,59
684,"I propose that our new company mascot be named “Maurice,” which has all kinds of cute nicknames, like Moe, Morry, or Morris, highly relatable to eels, our target customers.",1.2307692307692308,0.0477866517284347,104,83,18,3,False,True,172
684,Please welcome the newest member to our diversity group.,1.2307692307692308,0.0457914575661073,104,82,20,2,False,True,56
684,"I'd like to introduce you to Trevor, our new diversity officer.",1.2307692307692308,0.0477866517284347,104,83,18,3,False,True,63
684,"He says ""Eat the monster to your right.""",1.2307692307692308,0.0477866517284347,104,83,18,3,False,False,40
684,I really feel our diversity initiative is going to work out great,1.2307692307692308,0.0477866517284347,104,83,18,3,False,False,65
684,This human species looks pretty appetizing.,1.2307692307692308,0.0515458735320969,104,85,14,5,False,True,43
684,"Everybody, meet George.  He is our new Director of Diversity.",1.2307692307692308,0.0457914575661073,104,82,20,2,False,True,61
684,Maybe this one will stop the complaints about our board's diversity.,1.2307692307692308,0.0477866517284347,104,83,18,3,False,True,68
684,Gnarly?  Sure.  But our focus groups eat these up.,1.2307692307692308,0.0497018166750555,104,84,16,4,True,True,50
684,"Well, I think including a dental plan for everyone is a great idea.",1.2307692307692308,0.0497018166750555,104,84,16,4,False,True,67
684,"Thanks to 23andMe, Bob finally is reunited with his long lost family.",1.2307692307692308,0.0515458735320969,104,85,14,5,False,True,69
684,"Hey, let's give him a chance. He's a Trump supporter.",1.2307692307692308,0.0515458735320969,104,85,14,5,False,True,53
684,"Phil, here, is our new Head of Inhuman Resources.",1.2307692307692308,0.0477866517284347,104,83,18,3,False,True,49
684,"And now we will hear from Jeff, who will discuss the value of having a pet in your life.",1.2307692307692308,0.0515458735320969,104,85,14,5,False,True,88
684,"Let's all welcome Bill, our new general counsel, who comes to us straight from the Department of Justice.",1.2307692307692308,0.0497018166750555,104,84,16,4,False,True,105
684,"Meet our new lobbyist, Dave.",1.2307692307692308,0.0497018166750555,104,84,16,4,False,True,28
684,Let’s see what’s left over at Barney’s,1.2307692307692308,0.0477866517284347,104,83,18,3,False,False,38
684,"And finally, it's Brad's last day; he's the new SCOTUS nominee!",1.2307692307692308,0.0437052752953519,104,81,22,1,False,True,63
684,Looks like the whole family's here.,1.2307692307692308,0.0497018166750555,104,84,16,4,False,True,35
684,Creatues ... the IRS has dropped tax exemption on Area 51,1.2307692307692308,0.0515458735320969,104,85,14,5,False,False,57
684,"I’d like to welcome once again, Don Junior. While we fulfill our roles here in the White House, Don and his father’s loyal associates will continue to oversee the swamp.",1.2307692307692308,0.0515458735320969,104,85,14,5,False,True,169
684,I’m pleased to announce that the board has reached the ultimate in diversity.,1.2307692307692308,0.0477866517284347,104,83,18,3,False,True,77
684,Let's talk about the real elephant in the room.,1.2307692307692308,0.0457914575661073,104,82,20,2,False,True,47
684,"Please welcome Simon who was on the board of the N.R.A before joining us here. But don't let that scare you!""",1.2307692307692308,0.0497018166750555,104,84,16,4,False,False,109
684,Let’s all welcome our new diversity hire!,1.2307692307692308,0.0457914575661073,104,82,20,2,False,True,41
684,"In the interest of diversity, we have hired Bob. Please do not eat him.",1.2307692307692308,0.0515458735320969,104,85,14,5,False,True,71
684,"We have two guesses: either the baby was conceived at Chernobyl, or one of you is the father.",1.2289156626506024,0.0576891189187008,83,68,11,4,False,True,93
684,"Are you sure you're not looking for Cryptology 101?""",1.2289156626506024,0.0576891189187008,83,68,11,4,True,False,52
684,We needed more diversity on the Board.,1.2289156626506024,0.0576891189187008,83,68,11,4,False,True,38
684,Area 51 residents discuss racial profiling by the staff,1.2289156626506024,0.0550833557560326,83,67,13,3,False,False,55
684,"Hi John, thanks for joining us. We wanted to talk to you today about your recreational drug use habit.",1.2289156626506024,0.0550833557560326,83,67,13,3,False,True,102
684,Let's give a warm welcome to our new Director of Diversity & Inclusion.,1.2289156626506024,0.0576891189187008,83,68,11,4,False,True,71
684,He adds diversity.,1.2289156626506024,0.0550833557560326,83,67,13,3,False,True,18
684,I’m developing a second Noah’s ark of mythical creatures and would appreciate your input.,1.2289156626506024,0.0576891189187008,83,68,11,4,False,True,89
684,He is joining us as part of the Human Resources Inclusion Program.,1.2285714285714286,0.0454064728429052,105,83,20,2,False,True,66
684,I hate to sound elitist but who invited  the suit ?,1.2285714285714286,0.0473803541479342,105,84,18,3,True,True,51
684,I’d like to introduce our new VP of Diversity.,1.2285714285714286,0.0492752284858614,105,85,16,4,False,True,46
684,I know you guys have better shot at the winning caption than I do,1.2285714285714286,0.0492752284858614,105,85,16,4,False,False,65
684,"Now remember, judge him by what he say, not by how he looks.",1.2285714285714286,0.0433427917061569,105,82,22,1,False,True,60
684,Diversity in the workplace begins at the top.,1.2285714285714286,0.0492752284858614,105,85,16,4,False,True,45
684,"Hey, everyone, let’s give a warm “No Photographic Evidence Society” welcome to our newest member.",1.2285714285714286,0.0492752284858614,105,85,16,4,False,True,97
684,Next item:  Herschel will head up Human Resources.  Objections?,1.2285714285714286,0.0492752284858614,105,85,16,4,True,True,63
684,Being cold blooded is an advantage when making personnel decisions. And none of you are likely to survive on your good looks.,1.2285714285714286,0.0454064728429052,105,83,20,2,False,True,125
684,I'd  like to introduce  the new director of our workplace diversity program.,1.2285714285714286,0.0492752284858614,105,85,16,4,False,True,76
684,We won’t have to break for lunch.,1.2285714285714286,0.0454064728429052,105,83,20,2,False,True,33
684,Thought this was a a kangaroo court......where’s the stupid kangaroo?,1.2285714285714286,0.0510998857678179,105,86,14,5,True,True,69
684,"Word has come down from corporate,  effective immediately, no more rodents in the vending machine.",1.2285714285714286,0.0648981638044391,70,58,8,4,False,True,98
684,"President Trump is definitely one of us, even if he does file down his claws and his horns.",1.2264150943396226,0.0469807531999574,106,85,18,3,False,True,91
684,"Rodney is here take orders for lunch, unless of course, you just prefer to eat Rodney.",1.2254901960784317,0.048078720202023,102,82,17,3,False,True,86
684,His client agrees to repeal the law of gravity if we annihilate his tax returns.,1.2254901960784317,0.048078720202023,102,82,17,3,False,True,80
684,Our employees have filed a complaint about inhuman treatment.,1.2254901960784317,0.0500569715127605,102,83,15,4,False,True,61
684,"Lets get this meeting of the Interplanetary Peace Committee started.  Oh good, lunch has arrived.",1.2254901960784317,0.0500569715127605,102,83,15,4,False,True,97
684,This is Jason's dream job.,1.2254901960784317,0.0460155003830178,102,81,19,2,False,True,26
684,Next on the agenda: Whatever happened to Drac's Transylvania Twist?,1.2254901960784317,0.048078720202023,102,82,17,3,True,True,67
684,"Arnold here will tell us about the newest trends""",1.2254901960784317,0.0338635640722446,102,83,18,0,False,False,49
684,"Meet Bruce, our new accountant.  And no, you can't eat him.",1.2254901960784317,0.0500569715127605,102,83,15,4,False,True,59
684,Let me introduce to you our new Director for Diversity and Inclusion.,1.2254901960784317,0.048078720202023,102,82,17,3,False,True,69
684,This is James. Please don't let his hideous appearance affect your opinion of his ideas.,1.2254901960784317,0.0460155003830178,102,81,19,2,False,True,88
684,"This is Jerome from the marketing department, he's here to work on our image with the larger urban markets.",1.2254901960784317,0.0500569715127605,102,83,15,4,False,True,107
684,"There's a diversity of opinion whether it's your ark, Noah!",1.2254901960784317,0.0519599601404217,102,84,13,5,False,True,59
684,"This is Ed. He's taking over for Thurber who was eaten by ""one of you"" at our last meeting.",1.2254901960784317,0.0500569715127605,102,83,15,4,False,True,91
684,"It’s going to a monster of a deal, and I hope I have your collective support!",1.2254901960784317,0.0519599601404217,102,84,13,5,False,True,77
684,"His name is ""President.""  Strange that there was a huge cheer when we beamed him up from a place called earth.",1.2254901960784317,0.0537956737903627,102,85,11,6,False,True,110
684,"Ogra, please show our new intern the kitchen.",1.2254901960784317,0.0460155003830178,102,81,19,2,False,True,45
684,"If you are not Dr. Seuss or Maurice Sendak, go home !",1.2254901960784317,0.048078720202023,102,82,17,3,False,True,53
684,"Now that the scariest monster is here, we can finally begin.",1.2254901960784317,0.0519599601404217,102,84,13,5,False,True,60
684,"CARL, The word in the galaxy is 
Earth have best pizza!",1.2254901960784317,0.0537956737903627,102,85,11,6,False,True,55
684,"Please welcome our newest diversity outreach hire, Bill.",1.2254901960784317,0.043855321395865,102,82,18,2,False,True,56
684,"Dan will lead us in our diversity training. He's not from AR, but from HR.",1.2254901960784317,0.0460155003830178,102,81,19,2,False,True,74
684,"Now, should we talk about the elephant in the room""",1.2254901960784317,0.0460155003830178,102,81,19,2,False,False,51
684,"Say hello to our new hire, Steve, who helps reach our goal with under-represented classes in management, but has the makings of a real monster.",1.2254901960784317,0.0415830753308328,102,83,17,2,False,True,143
684,Meet Mr. Johnson.  He doesn't celebrate Halloween,1.2254901960784317,0.0460155003830178,102,81,19,2,False,False,49
684,"Sure, nice suit. But now that we've had more experience with humans, do you honestly think we should make any more room for them at our rule-the-world table?",1.2254901960784317,0.048078720202023,102,82,17,3,True,True,157
684,He says he comes from a parallel universe where humans are in charge: Hah!,1.2254901960784317,0.0519599601404217,102,84,13,5,False,True,74
684,...And Darren here will provide invaluable demographic research from the warm-blooded market.,1.2254901960784317,0.0460155003830178,102,81,19,2,False,True,93
684,Should he join us for lunch or as lunch?,1.2254901960784317,0.0519599601404217,102,84,13,5,True,True,40
684,"Raise your hands for the count - meat, chicken, or vegetarian!",1.2254901960784317,0.048078720202023,102,82,17,3,False,True,62
684,"The suit is weird, but we can get used to it.",1.2254901960784317,0.0500569715127605,102,83,15,4,False,True,45
684,"But other than that, I think you'll find we pretty much think alike.",1.2254901960784317,0.048078720202023,102,82,17,3,False,True,68
684,"Basically, what he's trying to tell us is we are being replaced by animation. No more movie roles.",1.2254901960784317,0.0500569715127605,102,83,15,4,False,True,98
684,He has some good ideas despite the way he looks.,1.2254901960784317,0.048078720202023,102,82,17,3,False,True,48
684,Ark Force One will now be boarding,1.2254901960784317,0.0500569715127605,102,83,15,4,False,False,34
684,We call this model: Secretary of Energy.,1.2254901960784317,0.0519599601404217,102,84,13,5,False,True,40
684,"Bob, we have a strict casual Friday policy.""",1.2254901960784317,0.0460155003830178,102,81,19,2,False,False,44
684,"Once again, Tom forgot about casual Friday.",1.2254901960784317,0.0500569715127605,102,83,15,4,False,True,43
684,Welcome to the cabinet. I promised the base I would drain the swamp.,1.2254901960784317,0.0519599601404217,102,84,13,5,False,True,68
684,"I’d like to introduce everyone to our new team member, Chuck. His interests include golf, line dancing, and not being eaten.",1.2254901960784317,0.048078720202023,102,82,17,3,False,True,124
684,Anyone here from out of town?,1.2254901960784317,0.0460155003830178,102,81,19,2,True,True,29
684,Should we clarify that he IS the snack on this break?,1.2254901960784317,0.0460155003830178,102,81,19,2,True,True,53
684,"Little do they know, they think it’s  the wolf on Wall Street that makes all the money",1.2254901960784317,0.0519599601404217,102,84,13,5,False,False,86
684,"And here is the new hire, Doug. He's an Affirmative Action hire.",1.2254901960784317,0.048078720202023,102,82,17,3,False,True,64
684,"Trust me, he's a monster between the spreadsheets.",1.2254901960784317,0.043855321395865,102,80,21,1,False,True,50
684,He’s kind of sexy.  Let’s let him stick around.,1.2254901960784317,0.048078720202023,102,82,17,3,False,True,47
684,"Professors,your department chairman requests that you put your costumes back on before leaving the faculty meeting.",1.2254901960784317,0.048078720202023,102,82,17,3,False,True,115
684,"Climate change summit is so last season, welcome to extinction club!",1.2254901960784317,0.0500569715127605,102,83,15,4,False,True,68
684,"Due to a change in our diversity policy, please welcome our new hire, Keith.",1.2254901960784317,0.048078720202023,102,82,17,3,False,True,76
684,"Okay, so, raise your hand if you've ever felt overdressed.",1.2254901960784317,0.0460155003830178,102,81,19,2,False,True,58
684,"Now, get out there and have a ghoul day.",1.2254901960784317,0.0519599601404217,102,84,13,5,False,True,40
684,"Please welcome Bob, even though he's so odd looking.",1.2254901960784317,0.0500569715127605,102,83,15,4,False,True,52
684,The work environment here is much less predatory than my last gig.,1.2254901960784317,0.043855321395865,102,80,21,1,False,True,66
684,H.R. calls it a homo sapien. But I call it a boy. A very talented boy.,1.2254901960784317,0.048078720202023,102,82,17,3,False,True,70
684,Good--lunch has arrived!,1.2254901960784317,0.0460155003830178,102,81,19,2,False,True,24
684,double or nothing for the fleshy and medium-aged filet wearing the tie,1.2254901960784317,0.048078720202023,102,82,17,3,False,False,70
684,"Whether you’re a reptile or amphibian, I think you’d agree that this gentleman would be a great addition to our organization.",1.2254901960784317,0.048078720202023,102,82,17,3,False,True,125
684,"Can you believe it, we invested in e-cigarettes and now everyone treats us like monsters",1.2254901960784317,0.048078720202023,102,82,17,3,False,False,88
684,Let’s welcome our new director of Human Resources.,1.2254901960784317,0.048078720202023,102,82,17,3,False,True,50
684,Let's have a cold-blooded welcome for Mr. Savage- the new face of  Human Resources.,1.2254901960784317,0.048078720202023,102,82,17,3,False,True,83
684,I know he looks weird but he is quite good with numbers.,1.2254901960784317,0.048078720202023,102,82,17,3,False,True,56
684,Who sent in HR?,1.2254901960784317,0.0519599601404217,102,84,13,5,True,True,15
684,Please welcome John. He has no experience with interplanetary relations so he'll oversee our new Department of Interplanetary Relations.,1.2254901960784317,0.048078720202023,102,82,17,3,False,True,136
684,"No, you've got the wrong room... this is the cabinet meeting. You're looking for Monsters, Inc. Down the hall and to the left.",1.2254901960784317,0.0500569715127605,102,83,15,4,False,True,126
684,"Okay, I  thought we agreed not to make fun of people just because they look a little freaky!",1.2254901960784317,0.0519599601404217,102,84,13,5,False,True,92
684,Ted here will be joining us for lunch. Who would like a leg?,1.2254901960784317,0.043855321395865,102,80,21,1,True,True,60
684,Simpson from HR is here to give us the Diversity Award,1.2254901960784317,0.0460155003830178,102,81,19,2,False,False,54
684,"Bob, The Meeting Memo said, ""casual dress"". Feel free to lose the tie.",1.2254901960784317,0.0460155003830178,102,81,19,2,False,True,70
684,"If we put him on the board we fulfill our diversity quota, otherwise we can just eat him.",1.2254901960784317,0.048078720202023,102,82,17,3,False,True,89
684,I need three volunteers for an impeachment dream.,1.2254901960784317,0.048078720202023,102,82,17,3,False,True,49
684,"Everyone, this is Bob. I think he's going to fit right in.",1.2254901960784317,0.043855321395865,102,80,21,1,False,True,58
684,We need to put a human face on our corporate image.,1.2254901960784317,0.048078720202023,102,82,17,3,False,True,51
684,"Everyone, let’s welcome our new Human Resources officer!",1.2254901960784317,0.048078720202023,102,82,17,3,False,True,56
684,This Thanks giving dinner is going to be a bit different,1.2254901960784317,0.0500569715127605,102,83,15,4,False,False,56
684,All in favor of continuing Casual Friday say 'aye.',1.2254901960784317,0.048078720202023,102,82,17,3,False,False,51
684,"OK people, time to vote.  Do we seat him or eat him?",1.2254901960784317,0.0500569715127605,102,83,15,4,True,True,52
684,He's so cute!  Who gets to eat him?,1.2254901960784317,0.0460155003830178,102,81,19,2,True,True,35
684,"Hi, I’m Doug! I have an outie.",1.2254901960784317,0.048078720202023,102,82,17,3,False,True,30
684,We are here today to discuss mom’s proposed clean out of my supposed “junk drawer”,1.2254901960784317,0.0500569715127605,102,83,15,4,False,False,82
684,"Let's all welcome today's speaker, who's here to chat with us about how to stand out in a crowd.",1.2254901960784317,0.0460155003830178,102,81,19,2,False,True,96
684,Why Lou?  Because the most heinous monster is man.,1.2254901960784317,0.048078720202023,102,82,17,3,True,True,50
684,"So, you seven think our system is antiquated?",1.2254901960784317,0.048078720202023,102,82,17,3,True,True,45
684,Um...is that one of those humans that is ruining the earth ?,1.2254901960784317,0.048078720202023,102,82,17,3,True,True,60
684,Congratulations! We're ready to go public. And Herb here will help us all dress for success.,1.2254901960784317,0.0460155003830178,102,81,19,2,False,True,92
684,"...so, I suggest we begin the meeting after lunch.",1.2254901960784317,0.048078720202023,102,82,17,3,False,True,50
684,"Due to the complaints about species discrimination in our business, we are proud to introduce our first Human in the office.",1.2254901960784317,0.043855321395865,102,80,21,1,False,True,124
684,Good suggestion! Seven Impossible Burgers it is.,1.2254901960784317,0.0519599601404217,102,84,13,5,False,True,48
684,"usually we order out for lunch, but...",1.2254901960784317,0.0500569715127605,102,83,15,4,False,True,38
684,"James, your new skin is a bit outdated.",1.2252252252252251,0.0437487515856694,111,88,21,2,False,True,39
684,"This is Gene from Accounting, guys.  His work is just out of the world.",1.2244897959183674,0.0470698596820702,98,78,18,2,False,True,71
684,Next we'll hear from the monkey in the middle.,1.2236842105263157,0.0549279726472044,76,61,13,2,False,True,46
684,"Everyone welcome Dan, he’s a former Cabinet member.",1.2233009708737863,0.0496169197692141,103,84,15,4,False,True,51
684,"Three skinny lattes and four half calfs, please.",1.2233009708737863,0.0456191178036742,103,82,19,2,False,True,48
684,"This is Edgar, our new dance master, who will help us prepare for our debut in Dancing with the Stars",1.2222222222222223,0.0657558535859852,63,52,8,3,False,False,101
684,"Meet our new employee, he’ll be head of Human Resources.",1.2222222222222223,0.0508747548738937,99,81,14,4,False,True,56
684,"Now George, you know we’ve been working on diversity for some time!",1.2222222222222223,0.0443825584393353,99,78,20,1,False,True,67
684,What are you crocing about?,1.2211538461538465,0.047248273218307,104,84,17,3,True,True,27
684,“Who wants serve as White House staff and who wants to be in the cabinet?”,1.22,0.0504124403437697,100,82,14,4,True,False,74
684,"Gentlemen, I would like to introduce our new member, Adam.",1.22,0.0483672817035849,100,81,16,3,False,True,58
