contest,caption,mean,precision,votes,not_funny,somewhat_funny,funny,has_question_mark,ends_with_punctuation,caption_length
834,Today's special is Rented Doves for Whatever Eggs You Can Gather.  Market Price +,1.1218274111675126,0.0254840948380066,197,175,20,2,False,False,81
834,"No, it's Polly who recites the dessert wines, and he'll do it in Spanish.",1.1216931216931216,0.0260980074838329,189,168,19,2,False,True,73
834,Macchiato?,1.1216931216931216,0.0271549863737039,189,169,17,3,True,True,10
834,They would like to know if you have a problem with saucers?,1.1216216216216215,0.0269811277122276,222,201,15,6,True,True,59
834,Do they look phresh?,1.121212121212121,0.0243307114093948,198,175,22,1,True,True,20
834,The French hens are today's special!,1.121212121212121,0.0243307114093948,198,175,22,1,False,True,36
834,And then the French hens?,1.121212121212121,0.0243307114093948,198,175,22,1,True,True,25
834,"May I interest you in our special, Homard du Ciel?",1.121212121212121,0.0243307114093948,198,175,22,1,True,True,50
834,"I’m sorry, we’re out of Calling Birds. May I interest you in some French Hens?",1.1210526315789473,0.0259681860249617,190,169,19,2,True,True,78
834,"No one will know we are government spies while working at this restaurant, great undercover idea bob",1.1206896551724137,0.0254166246326504,232,209,18,5,False,False,100
834,No thank you!,1.120603015075377,0.0271786953157582,199,179,16,4,False,True,13
834,They are currently hiding from Micheal Bay,1.1205357142857142,0.0244025076040965,224,200,21,3,False,False,42
834,We're here because of all the wonderful tweets it got.,1.1204188481675392,0.0278910442075351,191,172,15,4,False,True,54
834,My little birds told me you are having a great time.,1.1204188481675392,0.0268849167005343,191,171,17,3,False,True,52
834,Split the bill. Twitter trio will celebrate feminism.,1.1204188481675392,0.0268849167005343,191,171,17,3,False,True,53
834,Hey guys. What happens in Vegas stays in Vegas.,1.1204188481675392,0.0258396428961907,191,170,19,2,False,True,47
834,"Thank you for asking, it’s a new bird flu exposure therapy.",1.120331950207469,0.0233406331611225,241,215,23,3,False,True,59
834,Three more parrots for the legislative house. What could go wrong?,1.1202185792349726,0.0306826939564606,183,167,10,6,True,True,66
834,They’re ortolans in training.,1.1202185792349726,0.025321562087286,183,162,20,1,False,True,29
834,this is where your meat comes from,1.1201923076923077,0.0254991020690688,208,186,19,3,False,False,34
834,My current side-hustle is a party magician.,1.119815668202765,0.023949508382354,217,193,22,2,False,True,43
834,Would you like one tweet or a whole thread?,1.1196172248803828,0.0253833188678712,209,187,19,3,True,True,43
834,"So as you can see, they do charge wirelessly",1.1196172248803828,0.0279702118620866,209,190,13,6,False,False,44
834,"The French hens, David?",1.1194029850746268,0.0250046405435404,201,179,20,2,True,True,23
834,Have you dinned with us before?,1.1194029850746268,0.0269208940467038,201,181,16,4,True,True,31
834,"Being there’s an influx of pigeons in these times, we’ll be using them instead of crumbers.",1.1192660550458715,0.0255572828065117,218,196,18,4,False,True,91
834,Yeah I thought “Park to table” meant farmers market.,1.1192660550458715,0.0263714360548997,218,197,16,5,False,True,52
834,"We don’t carry oat milk, but we have pigeon milk on tap.",1.1191489361702127,0.0251070918803508,235,212,18,5,False,True,56
834,Sorry. We’ve just opened and we only have the one worm.,1.119047619047619,0.0252685776101636,210,188,19,3,False,True,55
834,…and if your canary dies…,1.118811881188119,0.0258582616082643,202,181,18,3,False,False,25
834,"First, we start with bird's nest soup.",1.118811881188119,0.0248875679043258,202,180,20,2,False,True,38
834,"Fried, baked or tare, tare?",1.1184834123222749,0.0251548643676091,211,189,19,3,True,True,27
834,And here is your live tweet.,1.1184834123222749,0.0260365846335564,211,190,17,4,False,True,28
834,How about something daring like a regular coffee?,1.1182266009852218,0.0266679192073618,203,183,16,4,True,True,49
834,Our after Christmas special is three French hens.,1.1181434599156117,0.0234251457035591,237,212,22,3,False,True,49
834,Labor shortage,1.1179775280898876,0.0267369209874149,178,159,17,2,False,False,14
834,These are excellent sauteed in bread crumbs.,1.117948717948718,0.0263605109860249,195,175,17,3,False,True,44
834,"These guys ready to be roasted, deep-fried,
or boiled  for soup, and today's chef special is parrot tartare",1.117948717948718,0.0263605109860249,195,175,17,3,False,False,107
834,"At these prices, they better not taste like chicken.",1.117948717948718,0.0253378855735662,195,174,19,2,False,True,52
834,Welcome to Twitter Cafe. Our new crop of mascot hires will be trailing me during tonight’s service.,1.117948717948718,0.0231575529175411,195,172,23,0,False,True,99
834,Excellent choice sir. It gets 3 coo’s.,1.117948717948718,0.0253378855735662,195,174,19,2,False,True,38
834,"Pick our your squab, then ignore the loud screech.",1.1179245283018868,0.0259195056363455,212,191,17,4,False,True,50
834,"We ordered too many for Christmastime, so today’s special is three turtle doves for the price of two.",1.1176470588235294,0.0236570478091827,204,181,22,1,False,True,101
834,"Special tonight on Parakeet, three to a serving.",1.1176470588235294,0.0256173041385701,204,183,18,3,False,True,48
834,There's no pecking order. But I wouldn't start with the squab.,1.1173708920187793,0.024930467437474,213,191,19,3,False,True,62
834,"The chicken here is so fresh, you pick the chick and come back in two years to order it",1.1173469387755102,0.025215461069101,196,175,19,2,False,False,87
834,Three French hens special,1.11731843575419,0.0241198808839527,179,158,21,0,False,False,25
834,"The chef believes in “slow food”, so your order will be delivered by carrier pigeon.",1.117117117117117,0.0242934291827741,222,199,20,3,False,True,84
834,"Monsieur, you requested your chick?",1.1170731707317074,0.0235483587733657,205,182,22,1,True,True,35
834,Pigeon for your thoughts?,1.1170731707317074,0.0245428036004649,205,183,20,2,True,True,25
834,Are you sure you want the bird for your meal?,1.116822429906542,0.0248197571001611,214,192,19,3,True,True,45
834,"They are in fact cage free, but unfortunately not organic",1.116751269035533,0.0229374048642998,197,174,23,0,False,False,57
834,It’s ironic because they were supposed to be carrier pigeons.,1.116751269035533,0.0240400064601171,197,175,21,1,False,True,61
834,Would you like to hear them mimic the specials?,1.116751269035533,0.0240400064601171,197,175,21,1,True,True,47
834,I'm happy to report that the dinner you declined to eat six month ago have grown big and healthy.,1.1166666666666667,0.0264551668584255,180,161,17,2,False,True,97
834,Everything cage-free is fair game—except the customers.,1.116504854368932,0.0262972153523224,206,186,16,4,False,True,55
834,We’ll start you off with a choice of your Tweet,1.116504854368932,0.0253807769461158,206,185,18,3,False,False,47
834,"Since you will be asking again about the specials, these birds will help me repeat myself.",1.116504854368932,0.0224076939396865,206,182,24,0,False,True,90
834,"Due to supply chain issues, FAA system malfunctions, and inflation, today’s special is normally offered at Christmastime only: Three French hens.",1.116504854368932,0.0244299844758555,206,184,20,2,False,True,145
834,Are these fresh oven birds?,1.1163793103448276,0.0243813431164271,232,209,19,4,True,True,27
834,Tonight's special is quail,1.1162790697674418,0.0247100214682416,215,193,19,3,False,False,26
834,they're waiting for a tree-top,1.1162790697674418,0.0228833463178996,215,191,23,1,False,False,30
834,Compliments of Mr. Marley,1.1162790697674418,0.0247100214682416,215,193,19,3,False,False,25
834,"""Could you please order a plate of crackers?""",1.116161616161616,0.0239255513219152,198,176,21,1,True,False,45
834,i didn't mean live.,1.116161616161616,0.0269491093527313,198,179,15,4,False,True,19
834,They eat the vomit,1.116161616161616,0.0278842008645534,198,180,13,5,False,False,18
834,Sorry. We ran out of turtle doves yesterday.,1.1160220994475138,0.0263164945530699,181,162,17,2,False,True,44
834,": ""Personally, I prefer a medley.""",1.1160220994475138,0.0274580632923517,181,163,15,3,False,False,34
834,"Hear me out, the throuple is working great for them.",1.115942028985507,0.0279102661796402,207,189,12,6,False,True,52
834,All of the chefs specialties reflect a seasonal park to table concept”,1.115577889447236,0.0238121745635854,199,177,21,1,False,False,70
834,"These are my roomies. Can I suggest the shrimp?""",1.1153846153846154,0.0251485595445497,208,187,18,3,True,False,48
834,"You said you were looking to go cheap on dinner, sir?",1.1151832460732984,0.0254287936955727,191,171,18,2,True,True,53
834,I'll have the one on the left.,1.1151832460732984,0.0264902840642377,191,172,16,3,False,True,30
834,"we're going for a more ecological approach, since they're so abundant. They're also free-range...in the city. Take your pick",1.115,0.0247373133821527,200,179,19,2,False,False,124
834,Would you like to put a bird on it?,1.1148936170212769,0.0225239047168931,235,210,23,2,True,True,35
834,"…Locally and sustainably sourced, as always. Now, would you like Gerald, Harry or Veronica?",1.1148936170212769,0.023317301148115,235,211,21,3,True,True,91
834,When the waiter overhears talk of ‘the birds and the bees.’,1.1148325358851674,0.0250340305460004,209,188,18,3,False,False,59
834,My boss totally loved the idea of expanding the rat-in-the-head cook concept to the whole place!,1.1148325358851674,0.0259366403054072,209,189,16,4,False,True,96
834,We boast the finest in bird-to-table cuisine.,1.1147540983606556,0.0260434462413931,183,164,17,2,False,True,45
834,This is worth much more than a bird in hand.,1.1147540983606556,0.0248638663878171,183,163,19,1,False,True,44
834,"If you prefer, we can offer two turtle doves or a partridge in a pear tree.The pears are extra, as a desert item.",1.114678899082569,0.0225864403180625,218,194,23,1,False,True,113
834,The middle one has a more gamey taste.,1.1144278606965174,0.0235885962012531,201,179,21,1,False,True,38
834,The middle one will talk you through your speed date.,1.1142857142857143,0.0241194929746844,175,155,20,0,False,True,53
834,We offer the freshest quail in New York. Pick yours.,1.1142857142857143,0.0230194736906366,210,187,22,1,False,True,52
834,"Depending on which one you select, a gratuity of 15%, 20% or 25% will be added to your check.",1.1142857142857143,0.0258186283302813,210,190,16,4,False,True,93
834,Would you like cream in your coffee?,1.1142857142857143,0.0249205357533924,210,189,18,3,True,True,36
834,Complimentary of the chef...an amuse perch!,1.1139896373056994,0.0262285708954878,193,174,16,3,False,True,43
834,I don’t think this respects the spirit of our no phones at the table rule.,1.1139240506329111,0.0223439028246382,237,212,23,2,False,True,74
834,Three French hens for the price of one. It's our Christmas sale special.,1.113861386138614,0.0254902128503354,202,182,17,3,False,True,72
834,"Honey, this  waiter is really pushing the pigeon!",1.113744075829384,0.0238810252446688,211,189,20,2,False,True,49
834,"Win, place or show?",1.113744075829384,0.0257016817113506,211,191,16,4,True,True,19
834,"We’re out of lobster, but you can pick out one of these.",1.11340206185567,0.0260996366355603,194,175,16,3,False,True,56
834,We brought these in for our customers who miss tweeting!,1.1133004926108374,0.0263142055882908,203,184,15,4,False,True,56
834,Imagine for a moment that my arm is a doorstep,1.1133004926108374,0.0233691541357095,203,181,21,1,False,False,46
834,I’ve brought these chefs to explain their vastly popular trend of left over small plate crumb cuisine.,1.1132075471698113,0.0255857861430958,212,192,16,4,False,True,102
834,Just a little peck will do.,1.112994350282486,0.0264172697843515,177,159,16,2,False,True,27
834,It's the pie special.  A dainty dish to set before the king.,1.1129032258064515,0.0267535450467408,186,168,15,3,False,True,60
834,Which one do you choose? They all are trained differently for weddings...,1.1129032258064515,0.0256442885220118,186,167,17,2,True,True,73
834,"Your choice for protein is left, right or middle.",1.1128205128205129,0.0259719590538755,195,176,16,3,False,True,49
834,it's gonna be all right,1.1128205128205129,0.024933402555427,195,175,18,2,False,False,23
834,"You said you prefer it raw, right?",1.1128205128205129,0.0259719590538755,195,176,16,3,True,True,34
834,"your choices this evening are yellow, blue, or green",1.1127450980392155,0.0242768802871343,204,183,19,2,False,False,52
834,Shall I show you the specials this evening? Flew in directly from the pavilion at Versailles.,1.1127450980392155,0.0232609487410731,204,182,21,1,True,True,93
834,"I realize you ordered pigs in a blanket, but best I can do is birds on a blanket",1.1126760563380282,0.0227133318455616,213,190,22,1,False,False,80
834,If you think these are cool just wait until you see the five golden rings I got,1.1122994652406415,0.0231507791906895,187,166,21,0,False,False,79
834,"I'm not speaking to the chef, but the carrier pigeons will take your order back to the kitchen.",1.1122448979591837,0.0268387690661149,196,178,14,4,False,True,95
834,Obviously our lobsters and squabs are fresh.,1.1122448979591837,0.0248125427449477,196,176,18,2,False,True,44
834,Cream?,1.1122448979591837,0.0258455199449934,196,177,16,3,True,True,6
834,Our menu is very selective,1.1122448979591837,0.0237346509077479,196,175,20,1,False,False,26
834,As you can see your breadcrumbs are being freshly sourced by these local artisans.,1.1121951219512196,0.0241644256922623,205,184,19,2,False,True,82
834,"For your next course, our chef’s take on free range.",1.1121951219512196,0.0251345076874147,205,185,17,3,False,True,52
834,...and for my next trick I'll make these squab disappear.,1.111731843575419,0.0261364405541619,179,161,16,2,False,True,57
834,"Excellent choice, sir.",1.111731843575419,0.0249066823604301,179,160,18,1,False,True,22
834,If you don’t lick your plate nice and clean then I’m gonna have to turn you into a bird like these three miscreants ok?,1.1117021276595744,0.0253848830842483,188,169,17,2,True,True,119
834,"Nobody wants to work anymore, so give your order to these birds",1.1116751269035532,0.0267082623070383,197,179,14,4,False,False,63
834,"Honestly kid, I don’t care about your pigeons.",1.1116751269035532,0.0257203014517305,197,178,16,3,False,True,46
834,"I’m sorry sir, but we don’t tweet.",1.1116504854368932,0.0230475005155235,206,184,21,1,False,True,34
834,"Sir, I understand you asked for our birds?",1.1116504854368932,0.0230475005155235,206,184,21,1,True,True,42
834,Our special tonight is Three French Hens left over from our recent Christmas Celebration.,1.1116279069767443,0.026091029115702,215,196,14,5,False,True,89
834,"As you can see, all our menu items are locally sourced and served “arm-to-table”",1.111587982832618,0.0232014396366403,233,210,20,3,False,False,80
834,So you recommend the squab rare?,1.1111111111111112,0.0229422309382727,207,185,21,1,True,True,32
834,"Our special tonite, a murder of crows.”",1.1111111111111112,0.0263478635579446,189,171,15,3,False,False,39
834,They're Polly-lingual,1.1111111111111112,0.0235079036498155,198,177,20,1,False,False,21
834,"Tonight's Special. Choose Dorothy, Juniper or Shelly.",1.1111111111111112,0.0258273557740864,207,188,15,4,False,True,53
834,"Good choice, sir, I will tell the chef to fry the middle pigeon medium rare, right after she delivered her last letter.Thank you for your patience",1.1111111111111112,0.0265790147081655,198,180,14,4,False,False,146
834,What style of chirp would you like?,1.1105990783410138,0.0223175226033768,217,194,22,1,True,True,35
834,Three mockingbirds for your 12 days of dry January.,1.1105769230769231,0.0228379136181628,208,186,21,1,False,True,51
834,Three French hens?  I was expecting more.,1.1105527638190955,0.0254734565753939,199,180,16,3,True,True,41
834,We're known for park-to-table dining.,1.1100478468899522,0.0255906035796344,209,190,15,4,False,True,37
834,Three little birds sit by my tricep.,1.11,0.0243405487111073,200,180,18,2,False,True,36
834,"Sorry, but we are out of turtle doves...",1.1095890410958904,0.0230520077485574,219,197,20,2,False,True,40
834,Special of the Day? Pigeon egg Benedict.,1.1095238095238096,0.0236173607905722,210,189,19,2,True,True,40
834,"It's like selecting your lobster, but three months in advance.",1.1095238095238096,0.0226320848374815,210,188,21,1,False,True,62
834,"Fresh Squab is the special of the day, your choice.",1.109452736318408,0.0231757506444818,201,180,20,1,False,True,51
834,Do you have a different dessert cart?,1.109452736318408,0.0242253309929151,201,181,18,2,True,True,37
834,They don’t just tell you about tonight’s specials. They ARE tonight’s specials.,1.109375,0.0279767520081086,192,176,11,5,False,True,79
834,"They were on my doorstep singing sweet songs of melodies pure and true, so naturally I decided to take them to work.",1.1090047393364928,0.0235108943450883,211,190,19,2,False,True,116
834,"For Valentine's Day, we like to see lovebirds at every table, and it's obvious this isn't going well.",1.108910891089109,0.0251119165770101,202,183,16,3,False,True,101
834,"Impeach President Joe Biden, V.P. Kamala Harris and Mayorkas !!!",1.108910891089109,0.0270023270958028,202,185,12,5,False,True,64
834,We’ve been short-staffed ever since the birdemic.,1.108910891089109,0.0260742595557328,202,184,14,4,False,True,49
834,Fresh ground worms sir? Tell me when,1.108910891089109,0.0241111944324978,202,182,18,2,True,False,36
834,You know what they say about 2 in the Bush,1.108786610878661,0.0241487936922563,239,218,16,5,False,False,42
834,Can I interest you in some juggling?,1.108695652173913,0.0266006289239687,184,167,14,3,True,True,36
834,Are you her parrot?,1.108695652173913,0.0242652095945106,184,165,18,1,True,True,19
834,"May I suggest today’s special, Mr. Marley: Three Little Birds",1.108695652173913,0.0276945841346869,184,168,12,4,False,False,61
834,"Would you like CNN, FOX or NPR' version of the menu?",1.1084905660377358,0.0243417852966158,212,192,17,3,True,True,52
834,you asked for the bob marley special ?,1.1083743842364533,0.0259510434053473,203,185,14,4,True,True,38
834,The chef would like to substitute these birds instead of the 3 French hens.,1.1083743842364533,0.0229594556360105,203,182,20,1,False,True,75
834,So how was the Kopi pigeon? Isn’t it better than luwak?,1.1079545454545454,0.0260798372362932,176,159,15,2,True,True,55
834,"Sir, your digestifs are being prepared. And, as is your habit, we present this selection to pick your teeth with their little bitty feet.”",1.107843137254902,0.0258289829642525,204,186,14,4,False,False,138
834,Might I suggest the Christmas leftovers flambe.,1.1077844311377243,0.0282091042355973,167,152,12,3,False,True,47
834,It's the only way we get people interested in our vegan options,1.1076923076923078,0.0265858185960471,195,178,13,4,False,False,63
834,"I requested, ""Freebird""; not three birds!",1.10752688172043,0.0263267324774791,186,169,14,3,False,True,41
834,"We have the Three French Hens,
 but our maids will be a-milking for a while yet !",1.1074766355140186,0.0231971543015195,214,193,19,2,False,True,81
834,We are going back to live advertising: You can protect three rain forest birds for the price of a single cup of coffee every month.,1.1073446327683616,0.027148588159019,177,161,13,3,False,True,131
834,Would you like them boiled or fried?,1.1073446327683616,0.0246706945231072,177,159,17,1,True,True,36
834,Can I offer you an organic tweet?,1.1073170731707318,0.0237751223269311,205,185,18,2,True,True,33
834,We want to make the menu an experience,1.1071428571428572,0.0254473322569437,196,178,15,3,False,False,38
834,Oh. I'm sorry. You ordered the worms. My mistake.,1.1071428571428572,0.0242721445301299,224,204,16,4,False,True,49
834,It's three for the price of two.  Their triplets.,1.1069767441860463,0.024017098381006,215,195,17,3,False,True,49
834,Don't worry - we have vaccines now.,1.1069767441860463,0.0221333095669602,215,193,21,1,False,True,35
834,Today’s special is fresh quail eggs,1.1069767441860463,0.024017098381006,215,195,17,3,False,False,35
834,Select your bird,1.106951871657754,0.023895871327877,187,168,18,1,False,False,16
834,Would you like to try our farm-to-table squab?,1.1063829787234043,0.023775232971601,188,169,18,1,True,True,46
834,I got these just last month as a gift. On the third day of Christmas my true love gave to me three French hens. Our special tonight is coq au vin.,1.106280193236715,0.0235562109448234,207,187,18,2,False,True,146
834,It’s our post-Christmas three turtle doves special.,1.106145251396648,0.0230873326086155,179,160,19,0,False,True,51
834,"This is today's special.  You can have them baked, broiled, fried or in a pot pie.",1.106060606060606,0.0230770904045871,198,178,19,1,False,True,82
834,"We're out of turkey""",1.106060606060606,0.0241624970665446,198,179,17,2,False,False,20
834,"DON’T WORRY, THEY’RE PRETTY QUIET!!!",1.1058201058201058,0.0259262705396988,189,172,14,3,False,True,36
834,We'll take the ones on each end; medium-well please.,1.1057692307692308,0.0234482542455033,208,188,18,2,False,True,52
834,"All our parakeet eggs are free range, but allow extra time for the egg white omelette.",1.1055555555555556,0.0229662833078661,180,161,19,0,False,True,86
834,"I assure you folks, every little thing gonna be alrigh",1.105527638190955,0.0260722152501489,199,182,13,4,False,False,54
834,We introduce you to the quail we’ll serve you so you taste their personality in the meal,1.105527638190955,0.0240466779117763,199,180,17,2,False,False,88
834,The special of the day is 'Fried Squab',1.105263157894737,0.0235375576578924,190,171,18,1,False,False,39
834,Today's 3 egg special can no longer be served over easy.,1.105263157894737,0.0246923351069823,190,172,16,2,False,True,56
834,Welcome to dinner at Macbeth. The three Partridges will take a single order between the two of you.,1.105263157894737,0.0233412787890427,209,189,18,2,False,True,99
834,Table crumb sweepers are too wasteful.”,1.105,0.0239319596662566,200,181,17,2,False,False,39
834,Wasn't your take-out area was around the corner?,1.105,0.0228579841015328,200,180,19,1,True,True,48
834,Hmm... May need more than one stone.,1.105,0.0239319596662566,200,181,17,2,False,True,36
834,Can you repeat that order back to me?,1.1049723756906078,0.0253916678751,181,164,15,2,True,True,37
834,Today we don't have phesant on the menu but you can each choose your pigeon.,1.1049382716049383,0.0256919048286768,162,146,15,1,False,True,76
834,I guess we won’t be having the Pastilla.,1.1047619047619048,0.0232352713156294,210,190,18,2,False,True,40
834,Are you cooing at my bird?,1.1047120418848169,0.0245688975981821,191,173,16,2,True,True,26
834,‘Is it me or is he flipping me three birds just because I said the stake was not well done?’.,1.1045454545454545,0.0243621214748082,220,201,15,4,True,True,93
834,"Only fresh meat, as stated on the menu. Which pigeon do you prefer?",1.1045454545454545,0.0225940470461378,220,199,19,2,True,True,67
834,"Fine then, I will order in English, and you will wipe that stupid smirk off your face.",1.1044776119402986,0.023818326773305,201,182,17,2,False,True,86
834,An elevated version of the the classic “on my doorstep”,1.1044776119402986,0.0227499768461167,201,181,19,1,False,False,55
834,"Good evening. I’ll be your crumbelier. Yesterdays’s baguettes are really coming into their prime. Or if you’d like to splurge, we have some three day old croissants i could pull from the cellar.",1.1044776119402986,0.0258227647211163,201,184,13,4,False,True,194
834,Can I interest you in a little tweet for dessert?,1.1043956043956045,0.0252583539220909,182,165,15,2,True,True,49
834,"compliments from the barista, a vocal trio",1.1043956043956045,0.0275573942644035,182,167,11,4,False,False,42
834,"If I liked dogs, I'd have bacon on my wrist.",1.1043478260869566,0.022848113812782,230,209,18,3,False,True,44
834,"You know the limerick, 'There was an old man with a beard...?'",1.104265402843602,0.0210887160770492,211,189,22,0,True,False,62
834,"Welcome to the newest dining experience. I am so sorry, but we have no more rats available for your table.",1.104265402843602,0.0250056013302725,211,193,14,4,False,True,106
834,"In honor of dry January and socia media break resolutions, this month’s special: bottomless cofee & tableside tweets!",1.1041666666666667,0.02444668368558,192,174,16,2,False,True,117
834,These three beauties are nestlings of the three-and-twenty blackbirds in your pie.,1.104072398190045,0.0233929530367962,221,201,17,3,False,True,82
834,"No need to keep repeating the specials, I heard him the first time",1.104072398190045,0.0233929530367962,221,201,17,3,False,False,66
834,we have the menu in 3 languages,1.103960396039604,0.0226429809881421,202,182,19,1,False,False,31
834,Were these not the boobies you wanted?,1.103960396039604,0.0256998163350709,202,185,13,4,True,True,38
834,Birds in our Menu,1.103960396039604,0.0256998163350709,202,185,13,4,False,False,17
834,"Croak madame for the lady? Actually, it’s more of a squawk.",1.1037735849056605,0.0230261084567607,212,192,18,2,True,True,59
834,"No, we don't have lobsters. Which would  you prefer with the demi-glace?",1.1037735849056605,0.0239773308000193,212,193,16,3,True,True,72
834,You two seem birds of a feather!,1.103658536585366,0.0253936572837142,164,148,15,1,False,True,32
834,Have they all been covid tested?,1.103448275862069,0.022536982459421,203,183,19,1,True,True,32
834,"You called me vegan fanatic, but I was just precise: the meat you eat has a family too.",1.103448275862069,0.0231540118851372,174,156,18,0,False,True,87
