contest,caption,mean,precision,votes,not_funny,somewhat_funny,funny,has_question_mark,ends_with_punctuation,caption_length
736,"It's very Cretaceous, but I could see it coming back in about 160 millions years plus 1950 or so.",1.3047619047619048,0.0560020432708893,105,79,20,6,False,True,97
736,I wouldn’t be caught extinct in it.,1.3047619047619048,0.0591821697541998,105,81,16,8,False,True,35
736,"Wow, that cap takes millennia off you.",1.3047619047619048,0.0526301100532214,105,77,24,4,False,True,38
736,I'm not sure it will change where the world is headed but optimism looks good on you.,1.3047619047619048,0.0543422364957901,105,78,22,5,False,True,85
736,"So, you got it for 25 scents and three Tricera tops? Nice!",1.3047619047619048,0.0576140523975249,105,80,18,7,True,True,58
736,"Okay, I'll bite.",1.3047619047619048,0.0576140523975249,105,80,18,7,False,True,16
736,You’re an idiot!,1.3047619047619048,0.0576140523975249,105,80,18,7,False,True,16
736,Does this hat make my arms look bigger?,1.3047619047619048,0.0526301100532214,105,77,24,4,True,True,39
736,Good thing social distance isn’t measured by arm reach.,1.3047619047619048,0.0543422364957901,105,78,22,5,False,True,55
736,You don't care about the fossil you're leaving your children?,1.3047619047619048,0.0560020432708893,105,79,20,6,True,True,61
736,I see you've gotten in touch with your inner child.,1.3047619047619048,0.0576140523975249,105,80,18,7,False,True,51
736,"The next thing you know, we'll all be extinct.",1.3047619047619048,0.0526301100532214,105,77,24,4,False,True,46
736,"Frankly, it detracts from your gravitas.",1.3047619047619048,0.0526301100532214,105,77,24,4,False,True,40
736,"Yeah, it's whimsical, but is it you?",1.3047619047619048,0.0591821697541998,105,81,16,8,True,True,36
736,Said he was a time traveler........so I ate him!,1.3047619047619048,0.0543422364957901,105,78,22,5,False,True,48
736,"That jerk,Brachiosaurus glued it to my head.",1.3047619047619048,0.0526301100532214,105,77,24,4,False,True,44
736,"Cool fashion sense, considering your brain's the size of a walnut.",1.3047619047619048,0.0508603804651913,105,76,26,3,False,True,66
736,"Sure, that'll save us.",1.3047619047619048,0.0543422364957901,105,78,22,5,False,True,22
736,I’m going out happy.,1.3047619047619048,0.0560020432708893,105,79,20,6,False,True,20
736,But how do you make it spin?,1.3047619047619048,0.0591821697541998,105,81,16,8,True,True,28
736,"Well, to be honest, I think our sense of humor will probably have to evolve too.",1.3047619047619048,0.0560020432708893,105,79,20,6,False,True,80
736,"Waist up, right? Just trying to Make Zoom Calls Exciting Again.",1.3047619047619048,0.0526301100532214,105,77,24,4,True,True,63
736,"Research show, these distract attention away from tiny hands",1.3047619047619048,0.0560020432708893,105,79,20,6,False,False,60
736,There’s something different about you... I just can’t quite put my finger on it.,1.3047619047619048,0.0576140523975249,105,80,18,7,False,True,80
736,So when the asteroid comes I'll just have to flip this thing and..,1.3047619047619048,0.0591821697541998,105,81,16,8,False,True,66
736,Congrats on your Google internship Rex,1.3047619047619048,0.0607097965732476,105,82,14,9,False,False,38
736,Your Father and I are getting a divorce.,1.3047619047619048,0.0526301100532214,105,77,24,4,False,True,40
736,Not taking my chances with this natural selection thing Larry,1.3047619047619048,0.0543422364957901,105,78,22,5,False,False,61
736,"Do you have any other hats you might consider wearing to the party?” “I guess I could wear my MAGA hat.” “Actually, you know what, I love it. Let’s head out.",1.3047619047619048,0.0607097965732476,105,82,14,9,True,True,157
736,"Yes, it makes your tail look big.",1.3047619047619048,0.0543422364957901,105,78,22,5,False,True,33
736,It makes me feel less callous.,1.3047619047619048,0.0560020432708893,105,79,20,6,False,True,30
736,"That's some beanie, Baby!",1.303921568627451,0.0570912338794782,102,77,19,6,False,True,25
736,"Wow,is that vintage?",1.303921568627451,0.0553648979509254,102,76,21,5,True,True,20
736,Either you eat the evidence or I will.,1.303921568627451,0.0535829717760361,102,75,23,4,False,True,38
736,That’s not something a 66-million-year-old should wear.,1.303921568627451,0.0570912338794782,102,77,19,6,False,True,55
736,"Be honest, does this make me look fat?",1.303921568627451,0.0553648979509254,102,76,21,5,True,True,38
736,"If that's how you spent all your research money, we're toast.",1.303030303030303,0.0485929530749862,99,70,28,1,False,True,61
736,Have you always been gay?,1.303030303030303,0.0545866675883917,99,73,22,4,True,True,25
736,"We're going to be extinct, who cares if I look Ridiculous.",1.300970873786408,0.0598795533488175,103,80,15,8,False,True,58
736,What? And give up show business?,1.300970873786408,0.0566111834451,103,78,19,6,True,True,32
736,"Dad, please don’t walk me to school with that hat.",1.300970873786408,0.0566111834451,103,78,19,6,False,True,50
736,"Considering the lift dynamics, I don’t see where you’re going with this.",1.300970873786408,0.0549040862045367,103,77,21,5,False,True,72
736,"Wow, you don't see those much anymore.",1.300970873786408,0.0549040862045367,103,77,21,5,False,True,38
736,"Relax, you'll get your turn with the hat - we have plenty of time.",1.300970873786408,0.0598795533488175,103,80,15,8,False,True,66
736,How Triassic of you.,1.300970873786408,0.0531421797902159,103,76,23,4,False,True,20
736,Where on Earth did you get the idea for that?,1.300970873786408,0.0531421797902159,103,76,23,4,True,True,45
736,"Yeah, it looks ridiculous. But the fact that you got it on your head with those short arms is impressive.",1.300970873786408,0.0549040862045367,103,77,21,5,False,True,105
736,"It is a nice hat, but did you really have to eat the child?",1.300970873786408,0.0598795533488175,103,80,15,8,True,True,59
736,They are calling it: Make the Jurrasic Period Great Again!,1.300970873786408,0.0629785338623646,103,82,11,10,False,True,58
736,We'll always have Paris!,1.300970873786408,0.0582682889756883,103,79,17,7,False,True,24
736,What? I thought I'd add some whimsy to our situation.,1.300970873786408,0.0549040862045367,103,77,21,5,True,True,53
736,"Okay, first let me say that I love that you're looking for a meaningful evolutionary adaptation.""",1.300970873786408,0.0513198194049441,103,75,25,3,False,False,97
736,Please tell me I'm not evolving.,1.300970873786408,0.0494303191842467,103,74,27,2,False,True,32
736,It's Hazing! The next thing you know they'll be telling you to eat plants!,1.300970873786408,0.0598795533488175,103,80,15,8,False,True,74
736,"Yeah, but how did it get there?",1.300970873786408,0.0549040862045367,103,77,21,5,True,True,31
736,"Listen man, I'm here for a fun time, not a long time.",1.300970873786408,0.0549040862045367,103,77,21,5,False,True,53
736,"Gee, Igor, we just learned to stand and walk on two feet--and now you want to fly",1.300970873786408,0.0549040862045367,103,77,21,5,False,False,81
736,"Sorry, Frank; you're still not an Archaeopteryx.",1.300970873786408,0.0531421797902159,103,76,23,4,False,True,48
736,"I think we're gonna need a lot more lift, Orville.",1.300970873786408,0.0531421797902159,103,76,23,4,False,True,50
736,I think you might be going too far trying to lighten our image…,1.300970873786408,0.0598795533488175,103,80,15,8,False,False,63
736,I guess it does make you look younger.,1.300970873786408,0.0549040862045367,103,77,21,5,False,True,38
736,"Really Frank,we are trying to evolve",1.300970873786408,0.0531421797902159,103,76,23,4,False,False,36
736,Is it working?,1.300970873786408,0.0566111834451,103,78,19,6,True,True,14
736,That's just a garnish? I always thought you ate the whole thing!,1.300970873786408,0.0531421797902159,103,76,23,4,True,True,64
736,Whatever gets you through the extinction.,1.300970873786408,0.0513198194049441,103,75,25,3,False,True,41
736,Oh NO! It's pledge week again!,1.300970873786408,0.0582682889756883,103,79,17,7,False,True,30
736,"Nice try, but you can't distract me from our inevitable extinction.",1.300970873786408,0.0531421797902159,103,76,23,4,False,True,67
736,"Hey, it was either this or a panic room.",1.300970873786408,0.0513198194049441,103,75,25,3,False,True,40
736,"Really, it makes you look at least ten years younger.",1.300970873786408,0.0531421797902159,103,76,23,4,False,True,53
736,You're going to drive the paleontologists crazy!,1.300970873786408,0.0566111834451,103,78,19,6,False,True,48
736,"To be honest Rex, I can't decide between Spinosaurus, Colorceratops, or Dorkoraptor.",1.300970873786408,0.0566111834451,103,78,19,6,False,True,84
736,"If this is the apex of our evolution, we deserve an asteroid.",1.300970873786408,0.0549040862045367,103,77,21,5,False,True,61
736,"Ah, you're asking ME why no one takes YOU seriously as a monster?",1.300970873786408,0.0566111834451,103,78,19,6,True,True,65
736,"And that protects you from asteroids, how?",1.300970873786408,0.0549040862045367,103,77,21,5,True,True,42
736,"Sorry, I only have one so I’ll have to go without you.",1.300970873786408,0.0531421797902159,103,76,23,4,False,True,54
736,That hat makes you look like a peabrain.,1.300970873786408,0.0549040862045367,103,77,21,5,False,True,40
736,It makes you look a bit flighty,1.300970873786408,0.0531421797902159,103,76,23,4,False,False,31
736,Are you a Velociraptor?,1.300970873786408,0.0513198194049441,103,75,25,3,True,True,23
736,This and my hat with big mouse ears will be around long after we’re gone.,1.300970873786408,0.0566111834451,103,78,19,6,False,True,73
736,"When I wear it, I receive HBO-MAX on the inside of my eyelids.  And on the weekends, I also get the Weather Channel.",1.300970873786408,0.0566111834451,103,78,19,6,False,True,116
736,Guarantees I get an archeological dig named for me.,1.300970873786408,0.0531421797902159,103,76,23,4,False,True,51
736,"Who knew a fad would last 10,000 years.",1.300970873786408,0.0582682889756883,103,79,17,7,False,True,39
736,"Sorry, Chad. Not even if the world was ending.”",1.300970873786408,0.0598795533488175,103,80,15,8,False,False,47
736,I want your opinion. I liked it better than those Make Alligators Great Again caps but they are telling me it is too gay for the swamp.,1.300970873786408,0.0598795533488175,103,80,15,8,False,True,135
736,I thought it would distract from the crappy drawing but it's not working!,1.300970873786408,0.0531421797902159,103,76,23,4,False,True,73
736,'I warned you not to rush that Fraternity.',1.300970873786408,0.0531421797902159,103,76,23,4,False,False,43
736,Not bad Herb–but maybe we should evolve ears instead.,1.300970873786408,0.0513198194049441,103,75,25,3,False,True,53
736,What time is liftoff ?,1.300970873786408,0.0513198194049441,103,75,25,3,True,True,22
736,"No, this does not make your arms look bigger either.",1.300970873786408,0.0494303191842467,103,74,27,2,False,True,52
736,It's silly but it's definitely you.,1.300970873786408,0.0513198194049441,103,75,25,3,False,True,35
736,I have an audition for a kid's show...,1.300970873786408,0.0598795533488175,103,80,15,8,False,True,38
736,Oh please Randy... grow up!,1.300970873786408,0.0614485827204619,103,81,13,9,False,True,27
736,"Yes, morale is important, but the asteroid's still coming.",1.300970873786408,0.0549040862045367,103,77,21,5,False,True,58
736,Do you realize that freshman year doesn't start for another 65 million years.,1.300970873786408,0.0582682889756883,103,79,17,7,False,True,77
736,"It just isn't you,Frederick.",1.300970873786408,0.0566111834451,103,78,19,6,False,True,28
736,That style is so Mesozoic.,1.300970873786408,0.0549040862045367,103,77,21,5,False,True,26
736,Talk to me when you're ready for a serious relationship.,1.300970873786408,0.0566111834451,103,78,19,6,False,True,56
736,If this helps keep us safe from falling objects...I'm all for it.,1.300970873786408,0.0494303191842467,103,74,27,2,False,True,65
736,I need the attention.,1.300970873786408,0.0531421797902159,103,76,23,4,False,True,21
736,"They come in a four-pack, so the triceratops had an extra.",1.300970873786408,0.0582682889756883,103,79,17,7,False,True,58
736,Did you file a claim?,1.300970873786408,0.0598795533488175,103,80,15,8,True,True,21
736,Is my head spinning?,1.300970873786408,0.0549040862045367,103,77,21,5,True,True,20
736,"This may be a style that should go extinct""",1.300970873786408,0.0531421797902159,103,76,23,4,False,False,43
736,Bad Hair Day?,1.300970873786408,0.0598795533488175,103,80,15,8,True,True,13
736,Ah--so that's what natural selection is.,1.300970873786408,0.0614485827204619,103,81,13,9,False,True,40
736,That's the dumbest thing you've bought since comet insurance.,1.300970873786408,0.0566111834451,103,78,19,6,False,True,61
736,"I dunno man, they’re going to think you had something dumb like...feathers.",1.300970873786408,0.0531421797902159,103,76,23,4,False,True,75
736,"Sure... that's exactly what I meant by: ""evolve into flying animals""...",1.300970873786408,0.0474656617520176,103,73,29,1,False,True,71
736,"Be honest, does this hat make me look fat?",1.300970873786408,0.0582682889756883,103,79,17,7,True,True,42
736,They had no T-shirts left,1.300970873786408,0.0513198194049441,103,75,25,3,False,False,25
736,"Doesn’t really have a “terrible lizard-y” vibe, but ok",1.300970873786408,0.0582682889756883,103,79,17,7,False,False,54
736,I plan on catching my prey with the element of childlike whimsy.,1.300970873786408,0.0531421797902159,103,76,23,4,False,True,64
736,Can you help me take this off?,1.300970873786408,0.0549040862045367,103,77,21,5,True,True,30
736,I think it might add some whimsy to Zoom calls with my parents.,1.300970873786408,0.0566111834451,103,78,19,6,False,True,63
736,it’s Hanukkah not Purim you schmuk,1.300970873786408,0.0598795533488175,103,80,15,8,False,False,34
736,"Sorry Melvin, I got the last one",1.300970873786408,0.0566111834451,103,78,19,6,False,False,32
736,That’s certainly one way to evolve,1.300970873786408,0.0549040862045367,103,77,21,5,False,False,34
736,More of a second date outfit.,1.300970873786408,0.0513198194049441,103,75,25,3,False,True,29
736,We’ll be extinct before that look catches on.,1.3,0.0522232967867093,100,73,24,3,False,True,45
736,"Yeah, we're related to birds but that's not gonna fly with the Mrs.",1.3,0.0559581373109678,100,75,20,5,False,True,67
736,"Ugh, that hat is sooo 65 million years ago",1.3,0.0577350269189625,100,76,18,6,False,False,42
736,I don't care where you got the hat. I wanna know where you got the box tops in the first place?,1.3,0.0594588390010563,100,77,16,7,True,True,95
736,"Well if you do catch a Pterodactyl, at least let me know what it tastes like.",1.3,0.0460566186471838,100,70,30,0,False,True,77
736,It's called going extinct in style.,1.3,0.0522232967867093,100,73,24,3,False,True,35
736,"It is cute, but I'm not totally sure it proves intelligent design.",1.3,0.0611340636419152,100,78,14,8,False,True,66
736,"Wow, to see the effects of evolution close up.",1.3,0.0522232967867093,100,73,24,3,False,True,46
736,The kid from the future I ate was wearing it.,1.3,0.0522232967867093,100,73,24,3,False,True,45
736,It's mine. I wrote my name in it.,1.3,0.0577350269189625,100,76,18,6,False,True,33
736,Donald Trump said this would let me fly!,1.3,0.0594588390010563,100,77,16,7,False,True,40
736,Shouldn't someone tell the cartoonist that we're color blind?,1.3,0.0559581373109678,100,75,20,5,True,True,61
736,Sorry. That look became extinct 20 million years ago.,1.3,0.0541229427257325,100,74,22,4,False,True,53
736,Your fashion sense is devolving.”,1.3,0.0559581373109678,100,75,20,5,False,False,33
736,Do you realize that this is an early sign of the end of our species?,1.3,0.0541229427257325,100,74,22,4,True,True,68
736,"Hey, my invention is at least carbon-free.",1.3,0.0502518907629606,100,72,26,2,False,True,42
736,"""It might have been a gift but I wouldn't  keep that on my head.",1.3,0.0559581373109678,100,75,20,5,False,True,64
736,I thought you were Cecil!,1.3,0.0522232967867093,100,73,24,3,False,True,25
736,"Sorry, there is a pandemic, this is the best we could do for a bar mitzvah.",1.3,0.0577350269189625,100,76,18,6,False,True,75
736,Why are you trying to pass as renewable when everyone knows you’re fossil?,1.3,0.0559581373109678,100,75,20,5,True,True,74
736,Am I flying yet?,1.3,0.0522232967867093,100,73,24,3,True,True,16
736,Who do you think you are?  Donald Trump?,1.3,0.0611340636419152,100,78,14,8,True,True,40
736,"No Beanie, I said nightcap.",1.3,0.0541229427257325,100,74,22,4,False,True,27
736,"If that's your big idea, not sure we're gonna make it.",1.3,0.0559581373109678,100,75,20,5,False,True,54
736,"It's just a fad, it'll die out.",1.3,0.0541229427257325,100,74,22,4,False,True,31
736,"It's part of my initiation into Nu Alpha Kappa.""",1.3,0.0559581373109678,100,75,20,5,False,False,48
736,I asked God to be a Pterodactyl and he gave me this,1.3,0.0559581373109678,100,75,20,5,False,False,51
736,"So I ate the kid, clothes and all, but the beanie was a keeper""",1.3,0.0577350269189625,100,76,18,6,False,False,63
736,It's a little cliche.,1.3,0.0541229427257325,100,74,22,4,False,True,21
736,"Keeping it light, are we Earnie?",1.3,0.0522232967867093,100,73,24,3,True,True,32
736,"Those things have gone the way of the, well, you know.",1.3,0.0594588390010563,100,77,16,7,False,True,54
736,I am what I am.,1.3,0.0559581373109678,100,75,20,5,False,True,15
736,"Can you get matching shoes?""",1.3,0.0559581373109678,100,75,20,5,True,False,28
736,You've been snacking on time travelers again.,1.3,0.0541229427257325,100,74,22,4,False,True,45
736,Was it on sale?,1.3,0.0559581373109678,100,75,20,5,True,True,15
736,I'm not sure. Is it returnable?,1.3,0.0541229427257325,100,74,22,4,True,True,31
736,"Honestly, I think it makes you look vane.",1.3,0.0541229427257325,100,74,22,4,False,True,41
736,And you say you can predict meteor strikes with that thing?,1.3,0.0559581373109678,100,75,20,5,True,True,59
736,Going somewhere?,1.3,0.0577350269189625,100,76,18,6,True,True,16
736,"Tonight I’m gonna party like it’s 66,000,001 BC",1.3,0.0577350269189625,100,76,18,6,False,False,47
736,I thought you were going to ask for longer arms?,1.3,0.0541229427257325,100,74,22,4,True,True,48
736,"T-Bro, let's photobomb the Flintstones before that volcanic ash covers us for all eternity!",1.3,0.0627645914460847,100,79,12,9,False,True,91
736,I want to look presidential,1.3,0.0611340636419152,100,78,14,8,False,False,27
736,I do admire your joie de vivre what with the Ice Age upon us and all.,1.3,0.0460566186471838,100,70,30,0,False,True,69
736,"Well, you're dressed up! Got a date for that meteor everyone's talking about?",1.3,0.0502518907629606,100,72,26,2,True,True,77
736,Whatd'ya think? My lunch made it.,1.3,0.0559581373109678,100,75,20,5,True,True,33
736,I can't reach to take it off.,1.3,0.0541229427257325,100,74,22,4,False,True,29
736,Swap for a kazoo?,1.3,0.0522232967867093,100,73,24,3,True,True,17
736,Don't look at me like that. It sparks joy.,1.3,0.0541229427257325,100,74,22,4,False,True,42
736,What’s a drone?,1.3,0.0541229427257325,100,74,22,4,True,True,15
736,I’m an LGTBQ helicopter parent.,1.3,0.0541229427257325,100,74,22,4,False,True,31
736,You'll never be able to fly without one.,1.3,0.0594588390010563,100,77,16,7,False,True,40
736,It was the only part that wasn't digestible,1.3,0.0541229427257325,100,74,22,4,False,False,43
736,"OK, its cute, but you'll never be a terrordactyl.",1.3,0.0541229427257325,100,74,22,4,False,True,49
736,"Well, I went to the future. The bad news is we're extinct. The good news is I got a cool, new hat.",1.3,0.0577350269189625,100,76,18,6,False,True,98
736,I lost mine at the glaad rally.,1.3,0.0594588390010563,100,77,16,7,False,True,31
736,"This seems worse than the ""time traveler kills a butterfly"" thing.",1.3,0.0577350269189625,100,76,18,6,False,True,66
736,I’m accessing the gravity of our situation.,1.3,0.0541229427257325,100,74,22,4,False,True,43
736,Forget it. It will be millions of years before we can fly.,1.3,0.0559581373109678,100,75,20,5,False,True,58
736,Maybe if you flap faster.,1.3,0.0522232967867093,100,73,24,3,False,True,25
736,Were you wearing that hat when you told them your asteroid theory?,1.3,0.0559581373109678,100,75,20,5,True,True,66
736,What? It goes with everything.,1.3,0.0559581373109678,100,75,20,5,True,True,30
736,You won't get far. You can't reach the propeller.,1.3,0.0577350269189625,100,76,18,6,False,True,49
736,"Haven't seen one of those since the 67,890,780s.",1.3,0.0611340636419152,100,78,14,8,False,True,48
736,"Yes, it does make you look less threatening. But also, more ridiculous.",1.3,0.0559581373109678,100,75,20,5,False,True,71
736,"I tried on one of those, but it clashed with my genes.",1.3,0.0594588390010563,100,77,16,7,False,True,54
736,It doesn't really go with our brand.,1.3,0.0522232967867093,100,73,24,3,False,True,36
736,We take the high holy days a little more seriously around here.,1.3,0.0577350269189625,100,76,18,6,False,True,63
736,"Yeah, it's cute, but I still think we're doomed.",1.3,0.0559581373109678,100,75,20,5,False,True,48
736,"You wanna go see the moon and the stars,Baby?",1.3,0.0502518907629606,100,72,26,2,True,True,45
736,Trust me. It will be all the rage 100 million years from now.”,1.3,0.0577350269189625,100,76,18,6,False,False,62
736,They were sold out of MAGA hats.,1.3,0.0577350269189625,100,76,18,6,False,True,32
736,I'll bet the mammals can't come up with something like that.  Not in a million years!,1.3,0.0541229427257325,100,74,22,4,False,True,85
736,How many times do I have to tell you not to play with your food!,1.3,0.0541229427257325,100,74,22,4,False,True,64
736,"Wally, tell me you just didn't eat that guy with the laptop!",1.3,0.0559581373109678,100,75,20,5,False,True,60
736,"The soothsayer said ""evolve"" not ""revolve.""",1.3,0.0594588390010563,100,77,16,7,False,False,43
736,Nice try but I don't think we can escape our fate that way.,1.3,0.0541229427257325,100,74,22,4,False,True,59
736,I was willing to ignore it when they declared that we'd had feathers - even multicolored ones - but this?  Ridiculous!,1.3,0.0577350269189625,100,76,18,6,True,True,118
736,"Well, it DOES draw the focus away from your tiny little arms.",1.3,0.0541229427257325,100,74,22,4,False,True,61
736,Ehh...I've seen worse.,1.3,0.0541229427257325,100,74,22,4,False,True,22
736,"In awhile, imbe-cile",1.3,0.0481999203654147,100,71,28,1,False,False,20
736,I can always tell when you’re lying.,1.3,0.0577350269189625,100,76,18,6,False,True,36
736,The crocodile space program is getting off to a slow start,1.3,0.0594588390010563,100,77,16,7,False,False,58
736,"Yeah, like you're gonna make it off the Yucatan in time...",1.3,0.0502518907629606,100,72,26,2,False,True,58
736,"It will catch on.  Honestly, just trust me on this one!",1.3,0.0541229427257325,100,74,22,4,False,True,55
736,"Seriously, Greorge...I doubt anyone is going to care what I wear to the Comet-Watching party!!",1.3,0.0577350269189625,100,76,18,6,False,True,94
736,Does this make my teeth look big?,1.3,0.0541229427257325,100,74,22,4,True,True,33
736,See you on the other side,1.3,0.0559581373109678,100,75,20,5,False,False,25
736,Look. It’s been a year. I just want to have some fun before the meteor,1.3,0.0541229427257325,100,74,22,4,False,False,70
736,I feel overdressed.,1.3,0.0594588390010563,100,77,16,7,False,True,19
736,"As it occurred with all great artists before me, they'll only appreciate this once I go extinct.",1.3,0.0611340636419152,100,78,14,8,False,True,96
736,"You ate the pretzel guy, didn’t you?",1.3,0.0611340636419152,100,78,14,8,True,True,36
736,It's important to have fun in life. You never know when it will end...”,1.3,0.0559581373109678,100,75,20,5,False,False,71
736,This is how birds evolved in my universe.,1.3,0.0559581373109678,100,75,20,5,False,True,41
736,You're going to have to make that thing go a lot faster if we are going to make it out of here in time.,1.3,0.0559581373109678,100,75,20,5,False,True,103
736,The worse part is I can’t reach it to take it off,1.3,0.0611340636419152,100,78,14,8,False,False,49
736,Pseudo Sue,1.3,0.0541229427257325,100,74,22,4,False,False,10
736,"Whatever, Charles.  You’re the one who told me to be my authentic self.",1.3,0.0594588390010563,100,77,16,7,False,True,71
736,Does this hat make me look any less intimidating?,1.3,0.0594588390010563,100,77,16,7,True,True,49
736,The guy at the store said it made me look ten years younger,1.3,0.0522232967867093,100,73,24,3,False,False,59
736,Evolution is no joke Rex,1.3,0.0541229427257325,100,74,22,4,False,False,24
736,How can you be gay with teeth like that?,1.2990654205607477,0.0534721968586889,107,80,22,5,True,True,40
736,They say it will save the planet.,1.297029702970297,0.0589420834302463,101,78,16,7,False,True,33
736,That's so extinct.,1.2967032967032968,0.0615122916620756,91,70,15,6,False,True,18
736,"Yes, the hat does make your teeth look big.",1.2967032967032968,0.0574052396312373,91,68,19,4,False,True,43
736,I suppose if your friends told you to eat a skinny cave man you’d do that too!!,1.2967032967032968,0.0552373179374192,91,67,21,3,False,True,79
736,Don’t you think the color of this hat is dino-mite?,1.2967032967032968,0.0634662293642887,91,71,13,7,True,True,51
736,What’s a patent?,1.2962962962962965,0.05943261679956,81,60,18,3,True,True,16
736,Really Honey... no one thinks you're boring.,1.2959183673469388,0.0546764937784605,98,73,21,4,False,True,44
736,Those stopped being popular during the Triassic.”,1.2959183673469388,0.0546764937784605,98,73,21,4,False,False,49
736,I hope you weren't expecting much of a campus life...,1.2959183673469388,0.0565677682751479,98,74,19,5,False,True,53
736,We all need to do our part to throw the asteroid off course.,1.2959183673469388,0.050682660747601,98,71,25,2,False,True,60
