contest,caption,mean,precision,votes,not_funny,somewhat_funny,funny,has_question_mark,ends_with_punctuation,caption_length
864,We can stand here and give the speech. Closer to the exit.,1.1666666666666667,0.0462250163521024,78,66,11,1,False,True,58
864,Don't worry.  They will only turn on you if look weak.,1.1666666666666667,0.0510191395747968,66,56,9,1,False,True,54
864,"Go ahead, introduce Daniel.",1.1666666666666667,0.0553999374471945,66,57,7,2,False,True,27
864,"And finally, our last presentation: The winner of the apex predator award goes to . . . .",1.1666666666666667,0.0462250163521024,66,55,11,0,False,True,89
864,Just imagine they're all full.,1.1666666666666667,0.0442287410361896,72,60,12,0,False,True,30
864,You can do it! Just picture them with no fur on.,1.1666666666666667,0.0462250163521024,78,66,11,1,False,True,48
864,"Trust me, they'll just eat you up.",1.1666666666666667,0.0510191395747968,66,56,9,1,False,True,34
864,Just picture them all stuffed and mounted,1.1666666666666667,0.0594588390010563,66,58,5,3,False,False,41
864,"Just picture them all in their underwear, which is blood-soaked from their most recent kill.",1.1666666666666667,0.0594588390010563,66,58,5,3,False,True,92
864,Don't be nervous - just imagine them all in cardboard boxes.,1.1666666666666667,0.0462250163521024,78,66,11,1,False,True,60
864,The catering service must be amazing,1.1666666666666667,0.0510191395747968,66,56,9,1,False,False,36
864,Just imagine they're all wearing Birkenstocks.,1.1666666666666667,0.0484501583111509,72,61,10,1,False,True,46
864,Tell the joke about Murray. They'll eat it up!,1.1666666666666667,0.0523321521352299,72,62,8,2,False,True,46
864,Just remember to tell them that stripes are in this year.,1.1666666666666667,0.0484501583111509,72,61,10,1,False,True,57
864,Imagine them as dust or at least shedding.,1.1666666666666667,0.0484501583111509,72,61,10,1,False,True,42
864,Trust the power of poetry... I'll be right behind you.,1.1666666666666667,0.0496966042074553,78,67,9,2,False,True,54
864,"And, yes, Vegetarian Plates are available",1.1666666666666667,0.0510191395747968,66,56,9,1,False,False,41
864,You’ll be fiiiine.  Just imagine them in their underwear.,1.1666666666666667,0.0523321521352299,72,62,8,2,False,True,57
864,Tell them about the about the benefits of the herbivore lifestyle.,1.1666666666666667,0.0590253544423353,60,52,6,2,False,True,66
864,Don’t be nervous! What’s the worst that can happen? They’ll pounce on you and eat you alive?,1.1666666666666667,0.0576138619860012,54,46,7,1,True,True,92
864,"Go on, we spiked the coffee with Ozempic.",1.1666666666666667,0.0510191395747968,66,56,9,1,False,True,41
864,Whatever you do don’t run.,1.1666666666666667,0.0484501583111509,72,61,10,1,False,True,26
864,"Don't be nervous, it's just Alabama.",1.1666666666666667,0.0424705992864687,78,65,13,0,False,True,36
864,I'd cut the line about focusing on the meaty issues.,1.1666666666666667,0.0442287410361896,72,60,12,0,False,True,52
864,I can’t believe they’re throwing him to the lions,1.1666666666666667,0.0590253544423353,60,52,6,2,False,False,49
864,Just imagine them all in the litter box.,1.1666666666666667,0.0540279623494249,60,51,8,1,False,True,40
864,Offer unconditional amnesty.,1.1666666666666667,0.0442287410361896,72,60,12,0,False,True,28
864,This gives new meaning to dinner and a show.,1.1666666666666667,0.0474034130879283,84,72,10,2,False,True,44
864,Don’t run away from your subject.,1.1666666666666667,0.0462250163521024,78,66,11,1,False,True,33
864,"How predatory the 
Annual meeting is..

....Suhas Kalghatgi",1.1666666666666667,0.0462250163521024,66,55,11,0,False,False,59
864,You'll do fine. I'll be running away if you need anything.,1.1666666666666667,0.0523321521352299,72,62,8,2,False,True,58
864,"Well Henry, you did say you wanted to be lionized someday.",1.1666666666666667,0.0485185424782984,60,50,10,0,False,True,58
864,You have a captive audience.,1.1666666666666667,0.0442743925959454,84,71,12,1,False,True,28
864,No...It can't hurt to strike an ingratiating tone!,1.1666666666666667,0.0511912597361625,54,45,9,0,False,True,50
864,Don’t worry they won’t roast you they like their meat raw,1.1666666666666667,0.0484501583111509,72,61,10,1,False,False,57
864,"The audience has been starved for meaty content,they",1.1666666666666667,0.0462250163521024,66,55,11,0,False,False,52
864,"Song #5: So Long,Farewell,Aufwiedersehn, Adieu",1.1666666666666667,0.0496966042074553,78,67,9,2,False,False,46
864,The bit about Impossible Burgers is gonna kill…,1.1666666666666667,0.0496966042074553,78,67,9,2,False,False,47
864,"You know if your report is not well received, the audience will eat you alive",1.1666666666666667,0.0484501583111509,72,61,10,1,False,False,77
864,Welcome to Toastmasters.,1.1666666666666667,0.0480584330140953,90,78,9,3,False,True,24
864,Looks like w've been set up.  They're not Rotarians.,1.1666666666666667,0.0442743925959454,84,71,12,1,False,True,52
864,Try to imagine them all naked and without teeth,1.1666666666666667,0.0553999374471945,66,57,7,2,False,False,47
864,"Say that snacks will be served in the lobby, and we'll sneak out the back door.",1.1666666666666667,0.0496966042074553,78,67,9,2,False,True,79
864,"Dumb it down, they're not as swift as you.",1.1666666666666667,0.0523321521352299,72,62,8,2,False,True,42
864,Be careful what you say to this crowd. They'll eat you for lunch!,1.1666666666666667,0.0462250163521024,66,55,11,0,False,True,65
864,"Just remember, they're naked.",1.1666666666666667,0.0484501583111509,72,61,10,1,False,True,29
864,"No worries. Really, what's the worst that could happen?",1.1666666666666667,0.052941031372205,78,68,7,3,True,True,55
864,You cannot fail with a speach about turning an enemy into a lover,1.1666666666666667,0.0510191395747968,66,56,9,1,False,False,65
864,"Remember, they’re more afraid of you, than you are of them.  - Brad Rainey",1.1666666666666667,0.0496966042074553,78,67,9,2,False,False,74
864,"You'll be fine, Daniel. But, just in case, don't show any fear.",1.1666666666666667,0.0424705992864687,78,65,13,0,False,True,63
864,"Tarzan's here, so no G.I. Jane jokes.",1.1666666666666667,0.0553999374471945,66,57,7,2,False,True,37
864,"Remember, the Lionesses are the ones you have to fear",1.1666666666666667,0.0442287410361896,72,60,12,0,False,False,53
864,I.. we’re here to speak to you about super greens.,1.1666666666666667,0.0510191395747968,66,56,9,1,False,True,50
864,"Just make a mean of it, this audience will totally eat it up.",1.1666666666666667,0.0540279623494249,60,51,8,1,False,True,61
864,Remember to make eye contact.,1.1666666666666667,0.0484501583111509,72,61,10,1,False,True,29
864,"Oh no, there’s nothing to be scared of. This audience won’t eat you alive.",1.1666666666666667,0.0484501583111509,72,61,10,1,False,True,74
864,"Try an ice breaker, you know, like ""I'd be lion if I said I'm not nervous""",1.1666666666666667,0.0590253544423353,60,52,6,2,False,False,74
864,"Don’t be nervous, I left them hungry for more!",1.1666666666666667,0.0442287410361896,72,60,12,0,False,True,46
864,Talk about the patriarchy!,1.1666666666666667,0.0474034130879283,84,72,10,2,False,True,26
864,Don't joke about the ending of the Lion King.,1.1666666666666667,0.0462250163521024,78,66,11,1,False,True,45
864,Don't worry! Your 'Benefits of Vegetarianism' speech is quite convincing!,1.1666666666666667,0.0523321521352299,72,62,8,2,False,True,73
864,Go ahead and present our contract proposal to the tune of “The Circle of Life” … we need this strike to be over.,1.1666666666666667,0.0462250163521024,66,55,11,0,False,True,112
864,I assure you they are all vegans. They signed a pledge.,1.1666666666666667,0.0553999374471945,66,57,7,2,False,True,55
864,"Ok Hank,
Don’t forget, 
Always leave ‘em wanting more!",1.1666666666666667,0.0559454238864459,72,63,6,3,False,True,54
864,"Remember, they've already had dinner --- just try not to look like dessert.",1.1666666666666667,0.0442287410361896,72,60,12,0,False,True,75
864,Just picture them all having just had a good meal.,1.1666666666666667,0.0523321521352299,72,62,8,2,False,True,50
864,"Don't worry, they'll love it! They'll eat you right up.",1.1666666666666667,0.0590253544423353,60,52,6,2,False,True,55
864,Here's hoping they had a really big breakfast.,1.1666666666666667,0.0590253544423353,60,52,6,2,False,True,46
864,"The public, the politicians plight.",1.1666666666666667,0.0442287410361896,72,60,12,0,False,True,35
864,Just because he froze doesn’t mean you will too.,1.1666666666666667,0.0553999374471945,66,57,7,2,False,True,48
864,They're a very captive audience during open mic night at the zoo.,1.1666666666666667,0.0424705992864687,78,65,13,0,False,True,65
864,Just picture them all as having just eaten.,1.1666666666666667,0.0462250163521024,66,55,11,0,False,True,43
864,"I always like to kick things off with a little Ibex breaker. Take it away, Hal.",1.1666666666666667,0.0510191395747968,66,56,9,1,False,True,79
864,"The other side is mortal so no worry, that’s a rule 25 .",1.1666666666666667,0.0462250163521024,66,55,11,0,False,True,56
864,"I said picture them in the nude, not as if you were food!",1.1647058823529413,0.0468834266331438,85,73,10,2,False,True,57
864,"Next,we'll be serving a lovely catered lunch in the lobby behind the auditorium.",1.1647058823529413,0.0437943335152785,85,72,12,1,False,True,80
864,Please be seated,1.1647058823529413,0.0437943335152785,85,72,12,1,False,False,16
864,"If you need any help, I'll be waiting in the wings.",1.1645569620253164,0.049108837742764,79,68,9,2,False,True,51
864,The audience is really hungry for your report!”,1.1645569620253164,0.049108837742764,79,68,9,2,False,False,47
864,Dear Audience,1.1645569620253164,0.0419825922829797,79,66,13,0,False,False,13
864,Deeerly beloved…..,1.1645569620253164,0.0523091568395843,79,69,7,3,False,True,18
864,"Just try to picture them all naked.  Oh, wait...",1.1645569620253164,0.049108837742764,79,68,9,2,False,True,48
864,That joke will make them roar!,1.1645569620253164,0.049108837742764,79,68,9,2,False,True,30
864,"Oh dear,  this might be a rough crowd to promote our 'vegetarian lifestyle initiative ' to.....""",1.1645569620253164,0.0456848771435583,79,67,11,1,False,False,96
864,Not to wory....they just had supper!,1.1645569620253164,0.0456848771435583,79,67,11,1,False,True,36
864,"Don’t worry, they can’t eat you, this is just a metaphor.",1.1645569620253164,0.0456848771435583,79,67,11,1,False,True,57
864,Throw 'em some red meat right at the beginning.,1.1645569620253164,0.0456848771435583,79,67,11,1,False,True,47
864,They're already naked so imagine them turned inside out.,1.1645569620253164,0.049108837742764,79,68,9,2,False,True,56
864,Don't be nervous-- just picture them wearing underwear,1.1645569620253164,0.0523091568395843,79,69,7,3,False,False,54
864,Just lean into who you are naturally. They’ll eat it up!,1.1645569620253164,0.0456848771435583,79,67,11,1,False,True,56
864,Go on. Their going to eat it up.,1.1643835616438356,0.0436783709354086,73,61,12,0,False,True,32
864,"Go on, they're hungry for new information.",1.1643835616438356,0.0478363626478469,73,62,10,1,False,True,42
864,You're not the only protected species they've accommodated.,1.1643835616438356,0.0478363626478469,73,62,10,1,False,True,59
864,"Lions and tigers and bears, oh my!",1.1643835616438356,0.0478363626478469,73,62,10,1,False,True,34
864,"Try not think “prey”, think “social speed accelerator”!",1.1643835616438356,0.0436783709354086,73,61,12,0,False,True,55
864,"Don't forget to tell them that you are grass fed with no GMO's, and never any antibiotics.",1.1643835616438356,0.0478363626478469,73,62,10,1,False,True,90
864,Do your routine. They’ll eat it up.,1.1643835616438356,0.0478363626478469,73,62,10,1,False,True,35
864,Your audience is HUNGRY for what you have to offer. Break a leg.,1.1643835616438356,0.0478363626478469,73,62,10,1,False,True,64
864,It’s just a formality.,1.1643835616438356,0.0436783709354086,73,61,12,0,False,True,22
864,"The audience silenced the stage fear""",1.1643835616438356,0.0516607694017568,73,63,8,2,False,False,37
864,"I'm sorry, but I thought you knew ""break a leg"" is for good luck.",1.1643835616438356,0.0436783709354086,73,61,12,0,False,True,65
864,"Remember, just think of them as naked.",1.1643835616438356,0.0478363626478469,73,62,10,1,False,True,38
864,"Don't worry.  They can't kill you or eat you.   Wait.  Yes, they can.",1.1643835616438356,0.0436783709354086,73,61,12,0,False,True,69
864,Don’t worry they will eat it up,1.1643835616438356,0.0478363626478469,73,62,10,1,False,False,31
864,Just imagine them wearing pants.,1.1643835616438356,0.0516607694017568,73,63,8,2,False,True,32
864,The audience may be friendly but it's also hungry,1.1643835616438356,0.0516607694017568,73,63,8,2,False,False,49
864,Don't worry. Just picture them in their underwear.,1.1643835616438356,0.0478363626478469,73,62,10,1,False,True,50
864,Don't be nervous; those guys are pussycats; they won't eat you alive.....,1.1643835616438356,0.0436783709354086,73,61,12,0,False,True,73
864,I don't think we should stay for dinner after your lecture.,1.1643835616438356,0.0516607694017568,73,63,8,2,False,True,59
864,"it's alright, they won't bite!",1.1643835616438356,0.0436783709354086,73,61,12,0,False,True,30
864,just don't say anything insulting.,1.1643835616438356,0.0478363626478469,73,62,10,1,False,True,34
864,Don't be shy! They are hungry for what you have to say!,1.1643835616438356,0.0478363626478469,73,62,10,1,False,True,55
864,Just imagine they’re all naked—and vegetarians.,1.1643835616438356,0.0478363626478469,73,62,10,1,False,True,47
864,"Finally, dessert time!",1.1643835616438356,0.0516607694017568,73,63,8,2,False,True,22
864,Nothing to be afraid of.  Just keep in mind they’re here for the Vegetarian-of-the-Year award.,1.1643835616438356,0.0436783709354086,73,61,12,0,False,True,94
864,"It's a tough crowd. Speak forcefully and with confidence,or they will eat you alive.",1.1643835616438356,0.0478363626478469,73,62,10,1,False,True,84
864,You can do this! Just think of them naked.,1.1643835616438356,0.0478363626478469,73,62,10,1,False,True,42
864,Just remember what you learned from your headlight experience.,1.1643835616438356,0.0478363626478469,73,62,10,1,False,True,62
864,"I'm glad this is a captive audience"".",1.1643835616438356,0.0478363626478469,73,62,10,1,False,True,37
864,"Trust me, you’ll have them roaring.",1.1643835616438356,0.0478363626478469,73,62,10,1,False,True,35
864,Chill! You look like we’re throwing you to the beasts.,1.1643835616438356,0.0436783709354086,73,61,12,0,False,True,54
864,I’ll catch you later at the buffet.,1.1643835616438356,0.0478363626478469,73,62,10,1,False,True,35
864,"Go on now, be a deer",1.1643835616438356,0.0516607694017568,73,63,8,2,False,False,20
864,Don’t worry- this will be over quickly!,1.1643835616438356,0.0516607694017568,73,63,8,2,False,True,39
864,The audience wants you!,1.1643835616438356,0.0516607694017568,73,63,8,2,False,True,23
864,We’ll break for lunch after your speech,1.1643835616438356,0.0478363626478469,73,62,10,1,False,False,39
864,This concludes our session on cantaloupe vs antelope,1.1643835616438356,0.0478363626478469,73,62,10,1,False,False,52
864,'There will be no Venison for tonight's dinner ',1.1643835616438356,0.0436783709354086,73,61,12,0,False,False,48
864,"Relax.  I promise you, they'll eat you up!",1.164179104477612,0.0546234796151849,67,58,7,2,False,True,42
864,We are all professionals here. There is nothing to worry about.,1.164179104477612,0.0455977681090133,67,56,11,0,False,True,63
864,"Go on, whats’s the worst that can happen?",1.164179104477612,0.0455977681090133,67,56,11,0,True,True,41
864,Remember: Even Olivier had stage fright.,1.164179104477612,0.0455977681090133,67,56,11,0,False,True,40
864,Toss them some Hunter Crime Family red meat.,1.164179104477612,0.0455977681090133,67,56,11,0,False,True,44
864,"If you're really good and convince them all to go vegan, maybe you'll get to finish.",1.164179104477612,0.0455977681090133,67,56,11,0,False,True,84
864,Don't worry! They'll eat you--eat IT up!,1.164179104477612,0.0503134225718837,67,57,9,1,False,True,40
864,Also.. Don’t mention anyone’s wife.,1.164179104477612,0.0455977681090133,67,56,11,0,False,True,35
864,You might wanna start off with that you have COVID.,1.164179104477612,0.0503134225718837,67,57,9,1,False,True,51
864,"Billy, Billy, Billy.  Read the room, Billy.",1.164179104477612,0.0503134225718837,67,57,9,1,False,True,43
864,You'll be fine. Its not like your being thrown into a lions den,1.164179104477612,0.0546234796151849,67,58,7,2,False,False,63
864,We're asking you all to sign this vegan pledge.,1.164179104477612,0.0455977681090133,67,56,11,0,False,True,47
864,"Wait, Wait. No venison recipes",1.164179104477612,0.0455977681090133,67,56,11,0,False,False,30
864,"Don’t worry, you’ll do fine. I’ll be right back here in a lion proof cage cheering you on.”",1.164179104477612,0.0546234796151849,67,58,7,2,False,False,91
864,"Don’t worry, security is a bunch of poachers.",1.164179104477612,0.0503134225718837,67,57,9,1,False,True,45
864,Don't forget -- they're all naked.,1.164179104477612,0.0503134225718837,67,57,9,1,False,True,34
864,Just try to picture them as wearing no pants.,1.164179104477612,0.0546234796151849,67,58,7,2,False,True,45
864,Did I say Moonlight?  Obviously I meant the live action Lion King…,1.164179104477612,0.0503134225718837,67,57,9,1,True,False,66
864,Just imagine they're all skinned.,1.164179104477612,0.0455977681090133,67,56,11,0,False,True,33
864,The winner gets a private date with me?,1.164179104477612,0.0546234796151849,67,58,7,2,True,True,39
864,"Don't worry, they're just waiting to eat you up.",1.164179104477612,0.0503134225718837,67,57,9,1,False,True,48
864,I don’t like the way they’re looking…you go first!,1.164179104477612,0.0455977681090133,67,56,11,0,False,True,50
864,They’re waiting. Don’t be a victim.,1.164179104477612,0.0586174765717879,67,59,5,3,False,True,35
864,"Carrots, think carrots.",1.164179104477612,0.0455977681090133,67,56,11,0,False,True,23
864,"Well,you ARE naked.",1.164179104477612,0.0546234796151849,67,58,7,2,False,True,19
864,Prey or pray. Not sure it'll matter in the long run.,1.164179104477612,0.0455977681090133,67,56,11,0,False,True,52
864,First Rule: everyone must stay seated throughout tonight’s presentation,1.164179104477612,0.0503134225718837,67,57,9,1,False,False,71
864,"The exit is stage left, if you want a head start.",1.164179104477612,0.0503134225718837,67,57,9,1,False,True,49
864,"And now, without further ado…",1.164179104477612,0.0455977681090133,67,56,11,0,False,False,29
864,Prey or pray. The paws-pause that refreshes.,1.164179104477612,0.0503134225718837,67,57,9,1,False,True,44
864,"No, it’s not dinner and a sho",1.164179104477612,0.0455977681090133,67,56,11,0,False,False,29
864,Just picture them all toothless and clawless.,1.164179104477612,0.0546234796151849,67,58,7,2,False,True,45
864,"But you said you'd give your life to sell our timeshares, remember?",1.164179104477612,0.0455977681090133,67,56,11,0,True,True,67
864,Carnivores Anonymous is really legit!!,1.164179104477612,0.0455977681090133,67,56,11,0,False,True,38
864,"Don’t be intimidated by the roar of the crowd, they just want to get to the meat of it.",1.164179104477612,0.0455977681090133,67,56,11,0,False,True,87
864,"You know, some folks would kill to read their own eulogy.",1.164179104477612,0.0503134225718837,67,57,9,1,False,True,57
864,I don't know. The last guy got eaten alive out there.,1.164179104477612,0.0503134225718837,67,57,9,1,False,True,53
864,"If you are anxious, just picture the audience naked",1.1639344262295082,0.0532050773536091,61,52,8,1,False,False,51
864,Are you certain this is my jury?,1.1639344262295082,0.0477946876626663,61,51,10,0,True,True,32
864,Just visualize them in their underwear.,1.1639344262295082,0.0532050773536091,61,52,8,1,False,True,39
864,"Have some pride in your speech man. I mean,just look at the crowd!",1.1639344262295082,0.0532050773536091,61,52,8,1,False,True,66
864,"Not to worry, they've eaten!",1.1639344262295082,0.0477946876626663,61,51,10,0,False,True,28
864,Stage fright? Flee or pee? It's your call.,1.1639344262295082,0.0477946876626663,61,51,10,0,True,True,42
864,Relax.  You already have a captive audience.,1.1639344262295082,0.0477946876626663,61,51,10,0,False,True,44
864,"Go ahead, You're acting like they'd eat you alive if it doesn't go well..",1.1639344262295082,0.0532050773536091,61,52,8,1,False,True,73
864,...and absolutely do not look at the spotlight.,1.1639344262295082,0.0626392563099764,61,54,4,3,False,True,47
864,Go a little easy on the PETA references!,1.1639344262295082,0.0477946876626663,61,51,10,0,False,True,40
864,"Don't worry, you couldn't find a more appreciative audience.",1.1639344262295082,0.0477946876626663,61,51,10,0,False,True,60
864,"Now is probably a good time to take a moment and locate the nearest exit . . . oh, but don't worry, they're going to love you.",1.1639344262295082,0.0581139255569198,61,53,6,2,False,True,126
864,Thank god I’m on beta blockers,1.1639344262295082,0.0477946876626663,61,51,10,0,False,False,30
864,Don’t forget to mention the vegetarian lunch menu.,1.1639344262295082,0.0477946876626663,61,51,10,0,False,True,50
864,"Don’t be nervous, you’ve had a helluva run!",1.1639344262295082,0.0477946876626663,61,51,10,0,False,True,43
864,"When Predator meets Prey, it will leave you shaking in your hoofs. It's not like you will get eaten or anything.",1.1636363636363636,0.0503431749267762,55,46,9,0,False,True,112
864,Don't forget to mention the free snacks in the lobby,1.1636363636363636,0.056637760682328,55,47,7,1,False,False,52
864,Let us now praise famous veggies,1.162790697674419,0.0463746272326316,86,74,10,2,False,False,32
864,Relax!  What’s the worst that can happen?,1.1625,0.0516920959606991,80,70,7,3,True,True,41
864,"Remember, it's a furry convention",1.1625,0.045157074666159,80,68,11,1,False,False,33
864,"And the Oscar goes to ummm.
  “The Lion’ Den.”",1.1625,0.045157074666159,80,68,11,1,False,False,46
864,Try to throw in a joke.,1.1625,0.0516920959606991,80,70,7,3,False,True,23
864,"On reflection, your suggestion that we schedule the address after the dinner service might have been better.",1.1625,0.0415054899525656,80,67,13,0,False,True,108
864,"Yes, they all are dumber than you.",1.1625,0.045157074666159,80,68,11,1,False,True,34
864,"Go ahead, I warmed them up for you.",1.1625,0.045157074666159,80,68,11,1,False,True,35
864,Just hope they purr.,1.1625,0.045157074666159,80,68,11,1,False,True,20
864,Just picture them as all being naked!!,1.1625,0.0485346998405016,80,69,9,2,False,True,38
864,"Don't be nervous. Imagine them in their under. . .  oh, never mind.""",1.1625,0.045157074666159,80,68,11,1,False,False,68
864,Welcome to the inaugural Predator Sensitivity Training Symposium,1.1625,0.0516920959606991,80,70,7,3,False,False,64
864,Don’t freeze like a deer in the headlights.,1.1625,0.0415054899525656,80,67,13,0,False,True,43
864,They might be kings but you are a GOAT,1.1625,0.0485346998405016,80,69,9,2,False,False,38
864,"They're ready for some red meat... Go!!!""",1.162162162162162,0.0472377580505781,74,63,10,1,False,False,41
864,If they don't like your speech? Run.,1.162162162162162,0.0472377580505781,74,63,10,1,True,True,36
864,Don't worry. All the lions all sleep at night.,1.162162162162162,0.0472377580505781,74,63,10,1,False,True,46
864,Remember: quiet your inner voice or it will eat you alive.,1.162162162162162,0.0431413089590404,74,62,12,0,False,True,58
864,"Now, it’s made from tofu, but it tastes just like us",1.162162162162162,0.0472377580505781,74,63,10,1,False,False,52
864,Have you checked the exits? This may be a hostile crowd.,1.162162162162162,0.0431413089590404,74,62,12,0,True,True,56
864,Start off with a joke and you'll have them eating out of your hand.,1.162162162162162,0.0472377580505781,74,63,10,1,False,True,67
864,"To be or not to be? That is the question? Whether 'tis nobler in the mind to “suffer”
The slings and arrows of outrageous fortune?
Who wrote this?!",1.162162162162162,0.0510062646406354,74,64,8,2,True,True,147
864,"At the conclusion, run like hell!",1.162162162162162,0.0472377580505781,74,63,10,1,False,True,33
864,Don't leave them wanting more!,1.162162162162162,0.0472377580505781,74,63,10,1,False,True,30
864,Just serve up some red meat. They'll eat it up.,1.162162162162162,0.0431413089590404,74,62,12,0,False,True,47
864,"Get your lines right, if not this audience will eat you up.",1.162162162162162,0.0431413089590404,74,62,12,0,False,True,59
864,Suit yourself.  But you should know that they hate it when you read from a prepared text,1.162162162162162,0.0545148812668257,74,65,6,3,False,False,88
864,"No, there is no mosh pit.",1.162162162162162,0.0472377580505781,74,63,10,1,False,True,25
864,Just remember that their hungry eyes will become wistful eyes in the end.,1.162162162162162,0.0545148812668257,74,65,6,3,False,True,73
864,I thought you said this was a pride event.,1.162162162162162,0.0472377580505781,74,63,10,1,False,True,42
864,It's lucky the keynote comes after lunch!,1.162162162162162,0.0431413089590404,74,62,12,0,False,True,41
864,"Just call security if you need to. I'll be, um, out back.",1.162162162162162,0.0472377580505781,74,63,10,1,False,True,57
864,"Just remember we’re Furry, We’re Fast, But we’re not Delicious!",1.162162162162162,0.0431413089590404,74,62,12,0,False,True,63
864,Just picture them fully clothed.,1.161764705882353,0.0449870438750331,68,57,11,0,False,True,32
864,"Don't be afraid, it's not like they'll eat you alive.",1.161764705882353,0.0577994706285209,68,60,5,3,False,True,53
864,"Don’t worry, we’ve vetted everyone here.",1.161764705882353,0.0449870438750331,68,57,11,0,False,True,40
