contest,caption,mean,precision,votes,not_funny,somewhat_funny,funny,has_question_mark,ends_with_punctuation,caption_length
864,I told you they dig standup.,1.2261904761904765,0.0459214028204978,84,65,19,0,False,True,28
864,Public speaking really shouldn’t be your biggest fear.,1.2261904761904765,0.0517928441224476,84,67,15,2,False,True,54
864,It's okay. Go on! We've made sure they've already had plenty to eat.,1.2261904761904765,0.0544918382414928,84,68,13,3,False,True,68
864,"I said you were auditioning to cats, not auditioning for “Cats”.",1.2261904761904765,0.0570633171799702,84,69,11,4,False,True,64
864,"Go ahead, what could 
possibly go wrong?",1.2261904761904765,0.0517928441224476,84,67,15,2,True,True,40
864,Don't let them single you out.,1.2261904761904765,0.0544918382414928,84,68,13,3,False,True,30
864,Ok thanks for taking one for the team.,1.2261904761904765,0.0544918382414928,84,68,13,3,False,True,38
864,"If you just concentrate on talking about the health benefits of farm to table, you take us out of the food chain.",1.2258064516129032,0.053246698550365,93,76,13,4,False,True,113
864,Tough audience. Lean into your shared love of pride.,1.2258064516129032,0.0553982400190658,93,77,11,5,False,True,52
864,I thought you said there'd be lots of lines.,1.2258064516129032,0.0510044783898125,93,75,15,3,False,True,44
864,Be careful not to insult their pride.,1.2258064516129032,0.0435912209478823,93,72,21,0,False,True,37
864,"Now for the next announcement, please don’t kill the messenger …",1.2258064516129032,0.0510044783898125,93,75,15,3,False,False,64
864,"Don't be shy, you are not the first....",1.2258064516129032,0.0553982400190658,93,77,11,5,False,True,39
864,Don’t worry — they’ll eat it up!,1.2258064516129032,0.0553982400190658,93,77,11,5,False,True,32
864,"If you show fear, the audience will eat you alive!",1.2258064516129032,0.053246698550365,93,76,13,4,False,True,50
864,I would ditch the line about all lions being meatheads,1.2258064516129032,0.0486590456659424,93,74,17,2,False,False,54
864,"That ""Captive Speaker""  feeling",1.2254901960784317,0.0460155003830178,102,81,19,2,False,False,31
864,"Remember, they're more afraid of you than you are of them....",1.2254901960784317,0.0519599601404217,102,84,13,5,False,True,61
864,The herd is behind you. Waaaaaaay behind you.,1.2254901960784317,0.0500569715127605,102,83,15,4,False,True,45
864,"Well, so far, so good!",1.2254901960784317,0.048078720202023,102,82,17,3,False,True,22
864,They look like they’re hungry to hear what you have to say.,1.2253521126760565,0.0671260656644357,71,60,6,5,False,True,59
864,They ate before arriving,1.2253521126760565,0.0574340076158851,71,57,12,2,False,False,24
864,"Don't worry, I don't see one headlight out there.",1.2253521126760565,0.0538168258437825,71,56,14,1,False,True,49
864,"Don't mess up, they'll eat you alive",1.2252252252252251,0.0473450482406021,111,90,17,4,False,False,36
864,Remember to leave your audience wanting more.,1.225,0.0532934318037196,80,64,14,2,False,True,45
864,"I got their attention, now you go in for the kill.",1.225,0.0532934318037196,80,64,14,2,False,True,50
864,"If you're nervous,  just picture them all in clothes.",1.225,0.0561840330487252,80,65,12,3,False,True,53
864,Things change. There’s no free lunch. Sell that.,1.225,0.0502367811191679,80,63,16,1,False,True,48
864,Go make our case. Remember you have the high ground!,1.225,0.0502367811191679,80,63,16,1,False,True,52
864,"They all came here for you. Don’t be nervous, you got this.",1.225,0.0532934318037196,80,64,14,2,False,True,59
864,Imagine they are all wearing pants.,1.2247191011235956,0.0524010059162292,89,72,14,3,False,True,35
864,"Either they love you, or they smell your fear.",1.2247191011235956,0.0499049376927726,89,71,16,2,False,True,46
864,"Just announce the winner 
And RUN",1.2247191011235956,0.0524010059162292,89,72,14,3,False,False,33
864,Make 'em roar.,1.2247191011235956,0.0444946915518375,89,69,20,0,False,True,14
864,No need to mention the meet-and-greet following this.,1.2247191011235956,0.0524010059162292,89,72,14,3,False,True,53
864,And the Emmy goes to:”King Of The Jungle “,1.2247191011235956,0.0499049376927726,89,71,16,2,False,False,42
864,"Don't worry, just pretend you're not naked.""",1.2247191011235956,0.0499049376927726,89,71,16,2,False,False,44
864,"Don't worry, it's just the Lions Club.",1.2247191011235956,0.0499049376927726,89,71,16,2,False,True,38
864,"A fishtale would 
be purrfect.",1.2247191011235956,0.0499049376927726,89,71,16,2,False,True,30
864,I guess I shouldn't say 'Break a leg.',1.2247191011235956,0.0472772692866914,89,70,18,1,False,False,38
864,"Go ahead, Bob. Whatever you say, I'm sure the audience will eat it up.",1.2247191011235956,0.0547834649866715,89,73,12,4,False,True,70
864,"So with the giraffe's sudden health crisis, it looks like you're now our keynote speaker.",1.2247191011235956,0.0547834649866715,89,73,12,4,False,True,89
864,Believe me! This audience is hungry for this kind of thing,1.2247191011235956,0.0472772692866914,89,70,18,1,False,False,58
864,"Relax, they’re really excited to see you!",1.2247191011235956,0.0472772692866914,89,70,18,1,False,True,41
864,"Just think, if you can survive this audience…",1.2247191011235956,0.0499049376927726,89,71,16,2,False,False,45
864,Of course we have security around the stage.,1.2244897959183674,0.0492540874061695,98,79,16,3,False,True,44
864,Maybe don’t sing “The Lion Creeps Tonight”.,1.2244897959183674,0.0470698596820702,98,78,18,2,False,True,43
864,Lion de outing antelope by Henri Rousseau,1.2244897959183674,0.0492540874061695,98,79,16,3,False,False,41
864,"Before you read the list of  those who can no longer work from home, let me exit stage right!",1.2238805970149254,0.0666470873184054,67,56,7,4,False,True,93
864,We should skip the meet and greet.,1.2236842105263157,0.0580341224807827,76,62,11,3,False,True,34
864,Make it Quick!!!!,1.2236842105263157,0.0609822643487182,76,63,9,4,False,True,17
864,They are only hungry for your words.,1.2236842105263157,0.0549279726472044,76,61,13,2,False,True,36
864,"'Might I say, we've never had such a receptive audience.'",1.2236842105263157,0.0516353075535489,76,60,15,1,False,False,57
864,Don't be nervous. That's why you got your master's in communication.,1.2236842105263157,0.0516353075535489,76,60,15,1,False,True,68
864,"Enough with the flop sweat; with that material you're gonna slay 'em, kill 'em, knock 'em dead!",1.223529411764706,0.0539126552347745,85,69,13,3,False,True,95
864,"Calling your facts, ‘Bullet Points’? No.
‘Sound Bites’? Definitely NO!",1.223529411764706,0.0512490229140589,85,68,15,2,True,True,70
864,"Don't worry sweetie,  an electric fence was installed just in case",1.223529411764706,0.0454558935673899,85,66,19,0,False,False,66
864,"Remember, be brief, be brilliant, and mostly, be gone.",1.223529411764706,0.0564507434785547,85,70,11,4,False,True,54
864,Remember...this kind of audience wants blood.,1.223529411764706,0.0588795251687674,85,71,9,5,False,True,45
864,"I thought ""lion's den"" was a figure of speech.",1.223529411764706,0.0484391402156129,85,67,17,1,False,True,46
864,Discuss the advantages of a vegeterian diet,1.223529411764706,0.0539126552347745,85,69,13,3,False,False,43
864,They will roar when you finish .,1.223529411764706,0.0512490229140589,85,68,15,2,False,True,32
864,Are you here for the Predators Anonymous meeting?,1.223529411764706,0.0539126552347745,85,69,13,3,True,True,49
864,"You won’t get “eaten alive,” don’t be dramatic.",1.223529411764706,0.0564507434785547,85,70,11,4,False,True,47
864,They're not such a tough crowd if you just picture them clothed.,1.223529411764706,0.0539126552347745,85,69,13,3,False,True,64
864,What drew you to my office?,1.223529411764706,0.0539126552347745,85,69,13,3,True,True,27
864,Skip the lions & tigers & bears part,1.223529411764706,0.0588795251687674,85,71,9,5,False,False,36
864,"You’re probably only gonna get one shot at this, so make it count!",1.223529411764706,0.0539126552347745,85,69,13,3,False,True,66
864,This takes stage fright to new heights.,1.223529411764706,0.0512490229140589,85,68,15,2,False,True,39
864,Don't be nervous. An old trick is to picture them with clothes on.,1.2234042553191489,0.052731943044405,94,77,13,4,False,True,66
864,Tough crowd tonight !,1.2234042553191489,0.0505161084985097,94,76,15,3,False,True,21
864,Tough crowd. If you’re not careful they’ll eat you alive.,1.2234042553191489,0.0481985126163457,94,75,17,2,False,True,57
864,It'll be fine! They're obviously hungry for you.,1.2234042553191489,0.0505161084985097,94,76,15,3,False,True,48
864,Your funny.  Don’t worry.  You’ll have them roaring.,1.2234042553191489,0.0481985126163457,94,75,17,2,False,True,52
864,Just visualize them all as naked.,1.2234042553191489,0.0505161084985097,94,76,15,3,False,True,33
864,Fear of public speaking? Are you joking?,1.2234042553191489,0.052731943044405,94,77,13,4,True,True,40
864,"You tell them the winner is ""The WOMAN King""...",1.2234042553191489,0.0505161084985097,94,76,15,3,False,True,47
864,"Just change the refrain to ‘Home, home on the range / where the lions and the antelope play’ - it’ll kill! Or… maybe they will. Either way, the show’ll be memorable.",1.2234042553191489,0.052731943044405,94,77,13,4,False,True,165
864,"Relax, I have a feeling they’re going to eat this up.",1.2234042553191489,0.052731943044405,94,77,13,4,False,True,53
864,Be ready for a quick getaway,1.2232142857142858,0.0469634935656532,112,91,17,4,False,False,28
864,Just picture them with their clothes on.,1.2222222222222223,0.0496903994999952,81,64,16,1,False,True,40
864,Leave out that part about being a 'seasoned professional',1.2222222222222223,0.0608580619450184,81,68,8,5,False,False,57
864,You got this Joe!,1.2222222222222223,0.05187562620058,90,73,14,3,False,True,17
864,You’ll have them eating out of your hand in no time.,1.2222222222222223,0.0494104513596565,90,72,16,2,False,True,52
864,Afraid? Just picture them with clothes on.,1.2222222222222223,0.0527046276694729,81,65,14,2,True,True,42
864,Just picture everyone full.,1.2222222222222223,0.0488067374467179,99,80,16,3,False,True,27
864,You'll be fine. You won't find a more receptive audience.,1.2222222222222223,0.05187562620058,90,73,14,3,False,True,57
864,"It's okay, this is the Vegan group.",1.2222222222222223,0.0462010095904977,108,87,18,3,False,True,35
864,For our final number we will sing The Circle of Life.,1.2222222222222223,0.0527046276694729,81,65,14,2,False,True,53
864,"Go on, Don...Tell them that the FDA has determined that antelope meat causes erectile dysfunction.""

reeniewalsh@gmail.com",1.2222222222222223,0.058267158231675,81,67,10,4,False,False,122
864,"OK, the naked part is true. But the rest is irrational stage fright. You got this.",1.2222222222222223,0.0462010095904977,108,87,18,3,False,True,82
864,Just pretend them to be vegetables. You are gonna be great!,1.2222222222222223,0.0480375223519018,108,88,16,4,False,True,59
864,Don't do the mosh pit thing with this crowd.,1.2222222222222223,0.0555555555555555,81,66,12,3,False,True,44
864,"Lions don't know from homophones. Cut the ""Pray, Pray, Pray"" section.",1.2222222222222223,0.0555555555555555,81,66,12,3,False,True,69
864,I heard they came for Gisele.,1.2222222222222223,0.0494104513596565,90,72,16,2,False,True,29
864,"Be sure to tell them that vegan is great -- for the environment, I mean.",1.2222222222222223,0.0566274657152917,99,84,8,7,False,True,72
864,Stick to the mane points and keep them hungry for more,1.2222222222222223,0.0555555555555555,81,66,12,3,False,False,54
864,HEY! Someone swapped my speech with this menu!,1.2222222222222223,0.0527046276694729,81,65,14,2,False,True,46
864,"Good luck on your presentation,""Vegetarianism for Carnivores"".",1.2222222222222223,0.0564841249731016,90,75,10,5,False,True,62
864,Put a lot of emphasis on how important it is to be a vegan.,1.2222222222222223,0.0466471280670839,99,79,18,2,False,True,59
864,The nearest exit is stage right.,1.2222222222222223,0.0496903994999952,81,64,16,1,False,True,32
864,I hope they like me...,1.2222222222222223,0.0494104513596565,90,72,16,2,False,True,22
864,Just tell them some of your killer jokes. We’ll be miles away by then.,1.2222222222222223,0.058267158231675,81,67,10,4,False,True,70
864,This will be your fleeting moment of fame.,1.2222222222222223,0.0494104513596565,90,72,16,2,False,True,42
864,Recovering Carnivore Convention,1.2222222222222223,0.0564841249731016,90,75,10,5,False,False,31
864,Remind them of horn indigestibility,1.2222222222222223,0.0555555555555555,81,66,12,3,False,False,35
864,"I’d say ‘break a leg’, but you might need all of the ones you’ve got.",1.2222222222222223,0.05187562620058,90,73,14,3,False,True,69
864,"I understand.  For some people, public speaking is their worst nightmare.",1.2222222222222223,0.0555555555555555,81,66,12,3,False,True,73
864,In the event of emergency your nearest exit may be behind you.,1.2222222222222223,0.0567171213596873,72,58,12,2,False,True,62
864,Don’t worry — Only rarely do the new faculty get eaten alive.,1.2222222222222223,0.0494104513596565,90,72,16,2,False,True,61
864,I think they are eating it up!,1.2212389380530972,0.0482541491150422,113,93,15,5,False,True,30
864,Just visualize them all as stuffed and mounted on a wall.,1.2211538461538465,0.0491844062635496,104,85,15,4,False,True,57
864,Pretend they're naked!,1.2210526315789474,0.050036822652392,95,77,15,3,False,True,22
864,"You're going to do great, just think of them as a sea of shrubs.",1.2210526315789474,0.0477464077749672,95,76,17,2,False,True,64
864,Speak softly and prepare your exit!,1.2210526315789474,0.0477464077749672,95,76,17,2,False,True,35
864,"If you go out there and break a leg, they eat you.",1.2209302325581397,0.0533454344218124,86,70,13,3,False,True,50
864,"It's okay. Remember, we scheduled your speech AFTER lunch.",1.2209302325581397,0.0507162455475007,86,69,15,2,False,True,58
864,Don't worry.  They'll pay attention to you.,1.2209302325581397,0.0533454344218124,86,70,13,3,False,True,43
864,I think this all worked out much better with the penguins .,1.2209302325581397,0.0558509909032007,86,71,11,4,False,True,59
864,You’ll be fine. We have the same elaborate security system used by Siegfried und Roy,1.2209302325581397,0.060551868735031,86,73,7,6,False,False,84
864,"Look, they all signed the ""I am now a vegetarian"" pledge but I'd keep an eye out for backsliders.
""""",1.2209302325581397,0.0533454344218124,86,70,13,3,False,False,100
864,Don't forget to promote the buffet.,1.2209302325581397,0.0507162455475007,86,69,15,2,False,True,35
864,"Don’t worry, you just have to keep them engaged until dinner.",1.2209302325581397,0.0558509909032007,86,71,11,4,False,True,61
864,"Remember, when you finish your remarks, back away from the podium slowly, don't run!",1.2209302325581397,0.0533454344218124,86,70,13,3,False,True,84
864,"Relax! Remember, they can smell fear.",1.2209302325581397,0.0507162455475007,86,69,15,2,False,True,37
864,"No, I love your speech. I just have to run home for second.",1.2209302325581397,0.0582488712001092,86,72,9,5,False,True,59
864,Keep it quick.,1.2209302325581397,0.0449993548842576,86,67,19,0,False,True,14
864,"Don't worry, they only roar with laughter here.",1.2209302325581397,0.0507162455475007,86,69,15,2,False,True,47
864,"You’re going to be just fine. And don’t worry, they all signed a waiver.",1.2209302325581397,0.0558509909032007,86,71,11,4,False,True,72
864,"Don't worry, you'll do fine.  It's not like they will eat you.",1.2207792207792207,0.0573490965345964,77,63,11,3,False,True,62
864,"You Can't
Read ???",1.2207792207792207,0.0475776037055225,77,60,17,0,True,True,18
864,Open with a joke...like 'Is it hot in here or am I lion?',1.2207792207792207,0.0573490965345964,77,63,11,3,True,False,57
864,Just imagine them in clothes.,1.2207792207792207,0.0602551439546259,77,64,9,4,False,True,29
864,Tell the one about the orangutan and the frog...,1.2207792207792207,0.0542877092321661,77,62,13,2,False,True,48
864,"Focus on your material, not on your audience.",1.2207792207792207,0.0542877092321661,77,62,13,2,False,True,45
864,...this could have been an email.,1.2207792207792207,0.0630273422623144,77,65,7,5,False,True,33
864,"Just read why they should eat more chicken, Vera. I’ll take it from there.",1.2207792207792207,0.0510430394277024,77,61,15,1,False,True,74
864,Will they understand the concept of Diversity Equity and Inclusion?,1.2207792207792207,0.0573490965345964,77,63,11,3,True,True,67
864,"You'll do fine.
 Just don't make any sudden moves.",1.22,0.0439926531974775,100,79,20,1,False,True,50
864,"I don’t care: you decide. But either way, it’s got to be stage left or stage right, and now!",1.22,0.0523778039195453,100,83,12,5,False,True,92
864,Just tell them how forest diversity benefits everyone equally.,1.22,0.0504124403437697,100,82,14,4,False,True,62
864,"Be congenial, but not too appealing.",1.21978021978022,0.0489254442697845,91,73,16,2,False,True,36
864,Go ahead- you’ll be Grreat!,1.21978021978022,0.0536851896280183,91,75,12,4,False,True,27
864,Don't be nervous. Pretend they've just eaten.,1.21978021978022,0.0489254442697845,91,73,16,2,False,True,45
864,Quick! Close the curtain.,1.21978021978022,0.0489254442697845,91,73,16,2,False,True,25
864,You are going to do great; you've got that animal magnetism.,1.21978021978022,0.0513604842383328,91,74,14,3,False,True,60
864,You'll be fine.  I mean you're wearing your Rotting Meat Cologne.,1.21978021978022,0.0536851896280183,91,75,12,4,False,True,65
864,I'm sure they will be interested in your Vegan recipes.,1.21978021978022,0.0513604842383328,91,74,14,3,False,True,55
864,Imagine your audience of captive carnivores clothed.,1.21978021978022,0.0463626881532504,91,72,18,1,False,True,52
864,"You can't give up now, you'll hurt their pride!",1.21978021978022,0.0513604842383328,91,74,14,3,False,True,47
864,Go ahead.. We got a cease and desist order.,1.21978021978022,0.0489254442697845,91,73,16,2,False,True,43
864,But I only have to outrun you.,1.21978021978022,0.0536851896280183,91,75,12,4,False,True,30
864,"Go on, honey.  They don’t bite.",1.21978021978022,0.0513604842383328,91,74,14,3,False,True,31
864,"Don’t worry, they’re hungry for your content.",1.21978021978022,0.0489254442697845,91,73,16,2,False,True,45
864,My therapist assured me it’s okay to be vulnerable.,1.21978021978022,0.0513604842383328,91,74,14,3,False,True,51
864,"Yes, in most other cases I agree in presenting in person is better than zoom.",1.21978021978022,0.0580560080766562,91,77,8,6,False,True,77
864,Just follow the script and you'll have them eating right out of your hand.,1.21978021978022,0.0489254442697845,91,73,16,2,False,True,74
864,Stop thinking of their eyes as the headlights of a car.,1.2195121951219512,0.0549407450751037,82,67,12,3,False,True,55
864,"You're next on the menu, uh, I mean agenda.",1.2195121951219512,0.0576159664646864,82,68,10,4,False,True,43
864,"Imagine them clothed - every single one of them in a ""Mamma wuvs Pussykins"" handknit sweater.",1.2195121951219512,0.0601723666969499,82,69,8,5,False,True,93
864,Just pretend they're all hairless.,1.2195121951219512,0.0521284120912502,82,66,14,2,False,True,34
864,"Go with it. You'll have 'em roaring.""",1.2195121951219512,0.0521284120912502,82,66,14,2,False,False,37
864,You've got this! They're suckers for antelope jokes!,1.2195121951219512,0.0459906849552226,82,64,18,0,False,True,52
864,I don't think the underwear trick is gonna work this time.,1.2195121951219512,0.0601723666969499,82,69,8,5,False,True,58
864,You better start by telling them you’re high in cholesterol,1.2195121951219512,0.0576159664646864,82,68,10,4,False,False,59
864,"I know it's scary,  but just try to imagine them all wearing suits and ties",1.2195121951219512,0.0521284120912502,82,66,14,2,False,False,75
864,Last words,1.2195121951219512,0.0491554394233524,82,65,16,1,False,False,10
864,You go hard on the pro-vegan pitch and I’ll get an Uber just in case.”,1.2195121951219512,0.0549407450751037,82,67,12,3,False,False,70
864,Just say Barbenheimer,1.2195121951219512,0.0491554394233524,82,65,16,1,False,False,21
864,« Oh deer »,1.2195121951219512,0.0521284120912502,82,66,14,2,False,False,11
864,They’re hungry to know more.,1.2195121951219512,0.0491554394233524,82,65,16,1,False,True,28
864,Stay calm. They smell fear.,1.2195121951219512,0.0576159664646864,82,68,10,4,False,True,27
864,Remember: they’re more scared of you than you are of them.,1.2195121951219512,0.0521284120912502,82,66,14,2,False,True,58
864,It helps if you picture them all as rugs.,1.2191780821917808,0.0560175531798415,73,59,12,2,False,True,41
864,Don’t forget to thank those who couldn’t be here today.,1.2191780821917808,0.0560175531798415,73,59,12,2,False,True,55
864,"You’ve spoken at a PTA meeting before, so you should be fine.",1.2191780821917808,0.0525114155251141,73,58,14,1,False,True,61
864,Relax and just imagine everyone is clothed.,1.2191780821917808,0.0593168084783862,73,60,10,3,False,True,43
864,This crowd's gonna eat you up.,1.2191780821917808,0.0593168084783862,73,60,10,3,False,True,30
864,"don't worry, everyone is nervous the first time they give a LEO talk",1.2191780821917808,0.0624419832473851,73,61,8,4,False,False,68
864,They were fed before they were seated.,1.2191780821917808,0.0593168084783862,73,60,10,3,False,True,38
864,"If it’s any help, they’re already picturing you in your underwear.",1.2191780821917808,0.0560175531798415,73,59,12,2,False,True,66
864,Don’t make any sudden moves,1.2191780821917808,0.0560175531798415,73,59,12,2,False,False,27
864,Don’t worry. It’s not like you’re being fed to the lions!,1.2190476190476192,0.0468435013943775,105,85,17,3,False,True,57
864,Picture them with an underbite.,1.2190476190476192,0.0448459969198463,105,84,19,2,False,True,31
864,Relax. You’re giving the AFTER dinner speech.,1.21875,0.0449247055267663,96,76,19,1,False,True,45
864,"Worse, the guy on the left is dating my ex.",1.21875,0.0495663762836737,96,78,15,3,False,True,43
864,"After our employee presentation of Shareholders Eat Last, we will leave promptly.",1.21875,0.0495663762836737,96,78,15,3,False,True,81
864,Perhaps it's time to release the rabbits.,1.21875,0.0473025095769844,96,77,17,2,False,True,41
864,"If you show any nervousness, this audience will eat you alive.",1.21875,0.0473025095769844,96,77,17,2,False,True,62
864,Don't worry; you're the after-dinner speaker.,1.21875,0.0495663762836737,96,78,15,3,False,True,45
864,Wrap it up.  We're about to break for lunch....,1.21875,0.0577409615468159,96,82,7,7,False,True,47
864,"...And when you're done, walk slowly toward the exit.",1.2183908045977012,0.047456806164156,87,69,17,1,False,True,53
864,Just picture the audience wearing collars.,1.2183908045977012,0.052789817806336,87,71,13,3,False,True,42
864,Just blame bears and their market.,1.2183908045977012,0.052789817806336,87,71,13,3,False,True,34
864,"I’ve got to run, but thanks for filling in, Steve.",1.2183908045977012,0.052789817806336,87,71,13,3,False,True,50
864,Just try to picture them in their underwear.,1.2183908045977012,0.0552636686294719,87,72,11,4,False,True,44
864,"If you get nervous, just look at that one in the second row with the huge erection.",1.2183908045977012,0.052789817806336,87,71,13,3,False,True,83
864,"Oh, I almost forgot to tell you..there will be an eat and greet after your speech.",1.2183908045977012,0.0501941894810964,87,70,15,2,False,True,82
864,"The ""Antelopes""  buttering up their unfriendly crowd sang, ""The Lion Sleeps Tonight.""",1.2183908045977012,0.0620966801807785,87,75,5,7,False,False,85
864,Just imagine that they are all hanging on the wall of some rich guy's game room.,1.2183908045977012,0.0552636686294719,87,72,11,4,False,True,80
864,"Okay, some bad news...the flier misspelled stakeholders meeting.",1.2183908045977012,0.0552636686294719,87,72,11,4,False,True,64
864,What did you expect at the MGM Theater?,1.2179487179487178,0.0595449384872119,78,65,9,4,True,True,39
864,Imagine them clothed.,1.2179487179487178,0.0566797968101997,78,64,11,3,False,True,21
864,After closing remarks there will be heavy h’ors d’oeuvres on stage,1.2179487179487178,0.0566797968101997,78,64,11,3,False,False,66
864,Relax…You got this! Their gonna just eat you up!,1.2179487179487178,0.0566797968101997,78,64,11,3,False,True,48
864,"I told you the title should've been 'How to Help the Antelope' not 'How to Serve the Antelope'""",1.2179487179487178,0.0536618955446524,78,63,13,2,False,False,95
864,It helps if you just picture all of them naked.,1.2179487179487178,0.0566797968101997,78,64,11,3,False,True,47
864,"No worries, they all checked the vegetarian option.",1.2179487179487178,0.0566797968101997,78,64,11,3,False,True,51
864,Don't worry you won't forget your Lions!,1.2179487179487178,0.0622784074334451,78,66,7,5,False,True,40
864,"They're gonna eat me alive out there""",1.2179487179487178,0.0504638355700878,78,62,15,1,False,False,37
864,Let's keep it short; the audience is starving,1.2179487179487178,0.0536618955446524,78,63,13,2,False,False,45
864,Imagine they're all naked dogs.,1.2179487179487178,0.0536618955446524,78,63,13,2,False,True,31
864,Just imagine them in their underwear. And not chasing you. Or tearing you limb from limb.,1.2179487179487178,0.0566797968101997,78,64,11,3,False,True,89
864,Just be yourself. The audience are going to eat it up.,1.2179487179487178,0.0536618955446524,78,63,13,2,False,True,54
864,Maybe don’t break a leg on this one,1.2179487179487178,0.0504638355700878,78,62,15,1,False,False,35
864,Everyone’s nervous for their first Pride!,1.2179487179487178,0.0536618955446524,78,63,13,2,False,True,41
864,I knew we should have worked on our disappearing act!,1.2179487179487178,0.0566797968101997,78,64,11,3,False,True,53
