contest,caption,mean,precision,votes,not_funny,somewhat_funny,funny,has_question_mark,ends_with_punctuation,caption_length
877,Would you like my What’s App in the Latin Alphabet or Emoji?,1.148936170212766,0.0426674284505853,94,82,10,2,True,True,60
877,"I identify as non-emoji”

Lisa E.R., New York Cit",1.148936170212766,0.0426674284505853,94,82,10,2,False,False,49
877,AI gone wild!,1.148936170212766,0.0426674284505853,94,82,10,2,False,True,13
877,"Anne didn't like the ""Karen""
 emoji her friends suggested for her.",1.148936170212766,0.0426674284505853,94,82,10,2,False,True,66
877,"The dangling conversation, the superficial sighs, the emojis of our lives"" (Simon & Garfunkel",1.148936170212766,0.0452690849254874,94,83,8,3,False,False,93
877,“Joyce (per/hum)”,1.148936170212766,0.036918129039477,94,80,14,0,False,False,17
877,The usual suspects.,1.148936170212766,0.0398964766762762,94,81,12,1,False,True,19
877,"When they said that the new IOS would have a unique ""inter-face,"" they were not kidding around.",1.1485148514851484,0.0382439760709465,101,87,13,1,False,True,95
877,"You-know-who is on his way, this party is going to stink.",1.1485148514851484,0.0382439760709465,101,87,13,1,False,True,57
877,Oh man the acid's really kicking in,1.1485148514851484,0.0431119624892619,101,89,9,3,False,False,35
877,Oh dear God-- I was just about to send the poop emoji!,1.1485148514851484,0.0382439760709465,101,87,13,1,False,True,54
877,It's just so hard to express my feelings.,1.1485148514851484,0.0382439760709465,101,87,13,1,False,True,41
877,I just can't wrap my head around all of these emojis!,1.1485148514851484,0.0382439760709465,101,87,13,1,False,True,53
877,Interpretation has entered the chat,1.1485148514851484,0.0355609603882534,101,86,15,0,False,False,35
877,I need to update my phone.,1.148148148148148,0.0468485579284204,81,71,8,2,False,True,26
877,Is there one for lonely?,1.148148148148148,0.0367765153714786,108,93,14,1,True,True,24
877,Where's shithead?,1.148148148148148,0.0432634127462598,108,96,8,4,True,True,17
877,Talk about a digital revolution....,1.148148148148148,0.0434297755539206,81,70,10,1,False,True,35
877,"No,I don’t have an iPhone.",1.148148148148148,0.0500342818003937,81,72,6,3,False,True,26
877,Finally some diversity in my friends!,1.148148148148148,0.0468485579284204,81,71,8,2,False,True,37
877,Icon't - I just con't...,1.148148148148148,0.0500342818003937,81,72,6,3,False,True,24
877,It won't load!,1.148148148148148,0.0432634127462598,108,96,8,4,False,True,14
877,"I really think we've taken this ""emoji rules"" business too far.",1.1478260869565218,0.0354624633918728,115,99,15,1,False,True,63
877,I can't seem to find my emotional cue.,1.1477272727272727,0.0413328510836402,88,76,11,1,False,True,38
877,"Guys, Halloween ended a month ago.",1.1477272727272727,0.04992097393144,88,79,5,4,False,True,34
877,Emoji Face Syndrome; will the suffering never end?,1.1477272727272727,0.0443805993487705,88,77,9,2,True,True,50
877,We're always waiting on that shithead!,1.1477272727272727,0.04992097393144,88,79,5,4,False,True,38
877,Losing my head over you?  I don’t think so!,1.1477272727272727,0.0413328510836402,88,76,11,1,True,True,43
877,Mine doesn't come out until the next update.,1.1477272727272727,0.0443805993487705,88,77,9,2,False,True,44
877,So I’m the ice cube?,1.1473684210526316,0.0395053997262686,95,82,12,1,True,True,20
877,These phone updates are getting really advanced.,1.1473684210526316,0.0422450088562631,95,83,10,2,False,True,48
877,I don’t know what any of you mean,1.1473684210526316,0.0422450088562631,95,83,10,2,False,False,33
877,Always thought that movie was CGI.,1.1473684210526316,0.0395053997262686,95,82,12,1,False,True,34
877,Oh no! We live in the future and my face still looks like a face!!,1.1470588235294117,0.0403754915644375,102,89,11,2,False,True,66
877,Can we just pick a place for brunch,1.1470588235294117,0.0427120285146335,102,90,9,3,False,False,35
877,This new 17.1.1 update makes me look so plain.,1.1470588235294117,0.0403754915644375,102,89,11,2,False,True,46
877,"If you guys don't swipe left, I will!",1.1470588235294117,0.0403754915644375,102,89,11,2,False,True,37
877,I can't download the app.,1.1470588235294117,0.0403754915644375,102,89,11,2,False,True,25
877,"Oh my God! These people all have emojis for heads. What nightmare have I awoken into?!? Perhaps the demons of Hell have been unleashed upon the face of the Earth and Man's days are numbered. These people literally have heads that are not human, yet here I stand with a perfectly human head. Perhaps I am the reason. Perhaps I have done something to anger the elder Gods and they are punishing me by transporting me to a world where emojis have replaced people's heads. I am at a loss for words. I have no idea what to do now. I may have to go into hiding with my family, if my family is even still alive now that these monsters roam the Earth.",1.1470588235294117,0.0449272126956455,102,91,7,4,True,True,643
877,OMG.  Are those your IRL heads now?,1.146788990825688,0.0364628942355146,109,94,14,1,True,True,35
877,"I am aware I have an advantage in hat shopping, do not patronize me.",1.146788990825688,0.0387225686304231,109,95,12,2,False,True,68
877,"Ah... no coffee at this work session, OK?",1.146341463414634,0.0463089633892549,82,72,8,2,True,True,41
877,"I get it. The three of you look at your phones so much that your heads have turned into emojis, but David is not like you and his head is really on fire. Can one of you call 911? I'm at three percent.",1.146341463414634,0.0463089633892549,82,72,8,2,True,True,200
877,Hanging with the Stereopeeps.,1.146341463414634,0.0463089633892549,82,72,8,2,False,True,29
877,Elaine confronts inherent danger of meeting online friends in person.,1.146341463414634,0.0429349038421541,82,71,10,1,False,True,69
877,I feel so blab!,1.146341463414634,0.0392720237024104,82,70,12,0,False,True,15
877,"Thought I downloaded Tinder, not Grindr!",1.146341463414634,0.0463089633892549,82,72,8,2,False,True,40
877,Just read my mind!,1.146067415730337,0.043910490827793,89,78,9,2,False,True,18
877,Have you ever dreamed that you were stuck in a zoom meeting forever?,1.146067415730337,0.0376484524902597,89,76,13,0,True,True,68
877,"Um, oh gee",1.146067415730337,0.0408994937600029,89,77,11,1,False,False,10
877,My phone is too old for the new upgrade!,1.146067415730337,0.043910490827793,89,78,9,2,False,True,40
877,Are you all running for Congress?,1.146067415730337,0.0467278698385757,89,79,7,3,True,True,33
877,I guess I’m just feeling myself today…,1.146067415730337,0.043910490827793,89,78,9,2,False,False,38
877,Peer pressure,1.146067415730337,0.043910490827793,89,78,9,2,False,False,13
877,"Wait, I have to be the eggplant?!",1.1458333333333333,0.0362107823753356,96,82,14,0,True,True,33
877,Are we taking this too far?,1.1458333333333333,0.0391218481905949,96,83,12,1,True,True,27
877,"No offense, but I was hoping to meet Mr. Eggplant.",1.1458333333333333,0.0418308170068669,96,84,10,2,False,True,50
877,"Hey, something's wrong with my phone!",1.1458333333333333,0.0418308170068669,96,84,10,2,False,True,37
877,My emoji ate my avatar.,1.1458333333333333,0.046780484635049,96,86,6,4,False,True,23
877,"I'm set on being a Strawberry, but can't find the right shade of Blonde.",1.1458333333333333,0.0418308170068669,96,84,10,2,False,True,72
877,"Hey, we're just giving you a heads up.",1.1458333333333333,0.0418308170068669,96,84,10,2,False,True,38
877,Have you guys seen my mask?,1.1458333333333333,0.0391218481905949,96,83,12,1,True,True,27
877,Jerry?,1.1458333333333333,0.0362107823753356,96,82,14,0,True,True,6
877,"NO.  I will NOT be ""the eggplant""!",1.1458333333333333,0.0418308170068669,96,84,10,2,False,True,34
877,"Guys, drop your cellphones! Isn't it better to express our emotions face to face?",1.145631067961165,0.0375525952386118,103,89,13,1,True,True,81
877,am i the only one thats normal,1.145631067961165,0.0375525952386118,103,89,13,1,False,False,30
877,"But, I don't wanna be an emoji!",1.145631067961165,0.0466011485432844,103,93,5,5,False,True,31
877,How am I supposed to get ahead in this world?,1.145631067961165,0.0400070596052068,103,90,11,2,True,True,45
877,still waiting for Mr Potato Head to pick up ?,1.145631067961165,0.0375525952386118,103,89,13,1,True,True,45
877,"I don't have an emoji...I just dated myself,  didn't I?",1.145631067961165,0.0400070596052068,103,90,11,2,True,True,55
877,Are you all discussing elections in Georgia?,1.1454545454545455,0.0462728673696163,110,100,4,6,True,True,44
877,"Is there an ""I hate all of you"" emoji?",1.1454545454545455,0.0425154902573221,110,98,8,4,True,True,38
877,I don’t like labels!,1.1454545454545455,0.0405063111184865,110,97,10,3,False,True,20
877,I’m clearly not supposed to be here.,1.1454545454545455,0.0405063111184865,110,97,10,3,False,True,36
877,I'm on Android. No one will chat with me.,1.1452991452991452,0.0388930180504621,117,103,11,3,False,True,41
877,"Included, yet excluded. --Tom",1.144578313253012,0.0457815858810471,83,73,8,2,False,False,29
877,Has anyone seen where I parked my DeLorean?,1.144578313253012,0.0488857030843788,83,74,6,3,True,True,43
877,"OMG, I have major FOMO.",1.144578313253012,0.0457815858810471,83,73,8,2,False,True,23
877,Where are my emotions?,1.144578313253012,0.0424510923948176,83,72,10,1,True,True,22
877,"Oh, no! The poomoji is the only one left!",1.144578313253012,0.0457815858810471,83,73,8,2,False,True,41
877,Can you find a reversible one for schizophrenics?,1.1444444444444444,0.0434501769895963,90,79,9,2,True,True,49
877,Why can't I use 'eggplant'?,1.1444444444444444,0.0404750539257196,90,78,11,1,True,True,27
877,"I can't decide, eggplant?",1.1444444444444444,0.048859939221226,90,81,5,4,True,True,25
877,They’re call words.,1.1444444444444444,0.0434501769895963,90,79,9,2,False,True,19
877,"Hey Guys,FOMO?",1.1444444444444444,0.0434501769895963,90,79,9,2,True,True,14
877,"I know I shouldn’t worry, it’s all in my head…",1.1444444444444444,0.0434501769895963,90,79,9,2,False,False,46
877,I'm probably gonna skip this update tbh,1.1444444444444444,0.0404750539257196,90,78,11,1,False,False,39
877,I hate being left out of the text thread.,1.1444444444444444,0.0404750539257196,90,78,11,1,False,True,41
877,"Guys, 💦 just told us it's going to be late in the group chat",1.1444444444444444,0.048859939221226,90,81,5,4,False,False,60
877,I'm having some weird side affects from this dopamine detox,1.1444444444444444,0.0513515486703101,90,82,3,5,False,False,59
877,Let cooler heads prevail!,1.1443298969072164,0.0414246166709319,97,85,10,2,False,True,25
877,SHOW ME WHO YOU GO WITH AND I'LL TELL YOU WHO YOU ARE!,1.1443298969072164,0.0439405905585719,97,86,8,3,False,True,54
877,This friend group is light on characters.,1.1443298969072164,0.0387456092226106,97,84,12,1,False,True,41
877,Can somebody help me with my iPhone 5?,1.1443298969072164,0.0463201050402356,97,87,6,4,True,True,38
877,When did I become invisible?,1.1442307692307692,0.0419339010767694,104,92,9,3,True,True,28
877,I'd like to report a missing avatar.,1.1442307692307692,0.0396452464001698,104,91,11,2,False,True,36
877,It’s a pity that there is no emoji with social anxiety,1.1442307692307692,0.0396452464001698,104,91,11,2,False,False,54
877,Anyone else feeling a little sextually frustrated?,1.1442307692307692,0.0419339010767694,104,92,9,3,True,True,50
877,"Oh, no! I've lost my e-MOJO-con!""",1.1441441441441442,0.040161114606403,111,98,10,3,False,False,33
877,Geekhead  I'm not!,1.1441441441441442,0.0358512872687761,111,96,14,1,False,True,18
877,"No wait, I was just inviting him over for eggplant parm!",1.1441441441441442,0.0380672426454619,111,97,12,2,False,True,56
877,"Thanks for your demos but I don’t think I’ll be letting AI choose my personal emoji.
Peter Monro, Portland, Maine
Jpmonro@me.com",1.143939393939394,0.0374600963691141,132,117,11,4,False,False,128
877,I'm in a state of Emoji ambivalence. Is that an eggplant?,1.1428571428571428,0.0429993570427229,91,80,9,2,True,True,57
877,I need to cut down on my screen time!,1.1428571428571428,0.0483460980275353,91,82,5,4,False,True,37
877,"But ""Barbie"" was already taken!",1.1428571428571428,0.0400592618739701,91,79,11,1,False,True,31
877,"I think the genius vaccine is working, Marta.",1.1428571428571428,0.0457509010871677,91,81,7,3,False,True,45
877,"Yup, that's me, before the surgery.",1.1428571428571428,0.0458686642191382,98,88,6,4,False,True,35
877,"I’m a fifth wheel, but the only one I can find is a tire.",1.1428571428571428,0.0429993570427229,91,80,9,2,False,True,57
877,I'm stuck between hell and a hot place.,1.1428571428571428,0.0419779780764853,84,73,10,1,False,True,39
877,don't even think about it...,1.1428571428571428,0.0398217207427341,112,99,10,3,False,True,28
877,Multiculturalism has really gotten out of hand!,1.1428571428571428,0.0435148356485836,98,87,8,3,False,True,47
877,"I really liked being the ""thumbs up"" emoji, but Gen Z said it's old now and cancelled it",1.1428571428571428,0.0400592618739701,91,79,11,1,False,False,88
877,"Didn't your mother tell you if you stared at that screen too long, you'd turn into a Republican?",1.1428571428571428,0.0481074608867778,98,89,4,5,True,True,96
877,Alright guys; Word Salad won't get it!,1.1428571428571428,0.0419779780764853,84,73,10,1,False,True,38
877,I’m sorry but I use NoEmoji.,1.1428571428571428,0.0452660178946055,84,74,8,2,False,True,28
877,"So, not the Apathetics Anonymous meetup?",1.1428571428571428,0.0429993570427229,91,80,9,2,True,True,40
877,I fucking need to find some real friends.,1.1428571428571428,0.0429993570427229,91,80,9,2,False,True,41
877,I must have read the sign wrong. I'm looking for the EMOTIONAL support group.,1.1428571428571428,0.0458686642191382,98,88,6,4,False,True,77
877,I told you guys not to get that vaccine!,1.1428571428571428,0.0368855556781658,105,91,13,1,False,True,40
877,Are you sure this is the new normal?,1.1428571428571428,0.0384094898527046,84,72,12,0,True,True,36
877,"Really, smiling poop again??",1.1428571428571428,0.0400592618739701,91,79,11,1,True,True,28
877,"So, does punctuation go before after the emoji?",1.1428571428571428,0.0457509010871677,91,81,7,3,True,True,47
877,…”ok be cool just pick one! 🍆 no! um 🤡 no! … $#*%! 💀”,1.1428571428571428,0.0368855556781658,91,78,13,0,False,False,53
877,You'll feel differently about things when you turn 30.,1.1428571428571428,0.0429993570427229,91,80,9,2,False,True,54
877,I guess I just don't know how to feel.,1.1428571428571428,0.0513464826748417,77,69,5,3,False,True,38
877,What emoji would show that I'm down-to-earth and relatable?,1.1415929203539823,0.0352596846250204,113,98,14,1,True,True,59
877,I can’t find the emoji for ennui.,1.1415094339622642,0.0411834788473484,106,94,9,3,False,True,33
877,I ran out of color markers,1.1415094339622642,0.0433102002914689,106,95,7,4,False,False,26
877,Which emoji for I need new friends ?,1.1414141414141414,0.0430972136307881,99,88,8,3,True,True,36
877,I thought the Horsemen of the Apocalypse would be taller.,1.1414141414141414,0.0406352895824782,99,87,10,2,False,True,57
877,This selfie will be totally iconic.,1.1414141414141414,0.0430972136307881,99,88,8,3,False,True,35
877,''Well it doesn't look like a peach!'',1.1414141414141414,0.0454259054507855,99,89,6,4,False,False,38
877,I just can't find the words to express myself,1.1414141414141414,0.0430972136307881,99,88,8,3,False,False,45
877,This really is the Age of AI.,1.1414141414141414,0.0380142564857705,99,86,12,1,False,True,29
877,So you guys can really make me popular on the Internet?,1.1414141414141414,0.0406352895824782,99,87,10,2,True,True,55
877,Oh she’s the sweet friend alright…and the naughty friend.,1.141304347826087,0.0365154534667852,92,79,13,0,False,True,57
877,I'm trying out Basic Girl but it's not going over too well.,1.141304347826087,0.0452775106604047,92,82,7,3,False,True,59
877,The problem with face-to-face conversations is that you can only make one emoji at a time.,1.141304347826087,0.0396518585330413,92,80,11,1,False,True,90
877,It was just an x-ray of an hamster.,1.141304347826087,0.0452775106604047,92,82,7,3,False,True,35
877,You're all at premium level?,1.141304347826087,0.0365154534667852,92,79,13,0,True,True,28
877,Wait..so how long will my head look like an eggplant after I send this?!?,1.141304347826087,0.0396518585330413,92,80,11,1,True,True,73
877,"Ever since we started using emojis, I don’t see actual faces anymore.",1.141304347826087,0.0396518585330413,92,80,11,1,False,True,69
877,Four horsemen of the emoji-calypse,1.141304347826087,0.0425577422846148,92,81,9,2,False,False,34
877,I think I need a new lifestyle designer,1.141304347826087,0.0396518585330413,92,80,11,1,False,False,39
877,"Wasn't this, 'Come as you are?'",1.141304347826087,0.0452775106604047,92,82,7,3,True,False,31
877,The latest iOS feature is too intrusive.,1.141304347826087,0.0478429149910667,92,83,5,4,False,True,40
877,So about those texts from my new AI phone…,1.141304347826087,0.0396518585330413,92,80,11,1,False,False,42
877,I second these emotions.,1.141304347826087,0.0396518585330413,92,80,11,1,False,True,24
877,"I just haven’t found MY emoji yet, you know? Maybe in the next update.",1.141304347826087,0.0425577422846148,92,81,9,2,True,True,70
877,Are you the four-out-of-five who recommend sugarless gum?,1.1411764705882352,0.0477884612037409,85,76,6,3,True,True,57
877,My nickname is Peanuts.,1.1411764705882352,0.0477884612037409,85,76,6,3,False,True,23
877,"There's no emoji for ""fifth wheel.""",1.1411764705882352,0.0379921161527977,85,73,12,0,False,False,35
877,You guys have been texting way too much!,1.1411764705882352,0.0447618697040631,85,75,8,2,False,True,40
877,But I'm right here!!!,1.1411764705882352,0.0447618697040631,85,75,8,2,False,True,21
877,What do you mean with that apricot-ass?,1.1411764705882352,0.04151521329086,85,74,10,1,True,True,39
877,Cartoonists sure are getting lazy these days.,1.1411764705882352,0.0477884612037409,85,76,6,3,False,True,45
877,I was just trying to share my recipe for eggplant parmesan.,1.1411764705882352,0.0379921161527977,85,73,12,0,False,True,59
877,"Geez, Connie, could you be any more obvious that you have a craving for eggplant!?",1.1411764705882352,0.0447618697040631,85,75,8,2,True,True,82
877,I don’t think I got the emoji memo guys,1.1411764705882352,0.04151521329086,85,74,10,1,False,False,39
877,A day in the life of an android user.,1.141025641025641,0.0473203315465489,78,69,7,2,False,True,37
877,"OMG, she's being so antisocial.""",1.141025641025641,0.0473203315465489,78,69,7,2,False,False,32
877,I’m not sure how I feel about Travis and Taylor.,1.141025641025641,0.0507170002136921,78,70,5,3,False,True,48
877,"Uh, uh. I don't even like eggplant.",1.1401869158878504,0.0385977956736652,107,94,11,2,False,True,35
877,When you still have an Android,1.1401869158878504,0.0362416071333881,107,93,13,1,False,False,30
877,Why am I surrounded by millennials?!,1.1401869158878504,0.0385977956736652,107,94,11,2,True,True,36
877,"No, not the POOP emoji!",1.14,0.0376587548676509,100,87,12,1,False,True,23
877,It was all fun and games until the emojis really started taking up head space.”,1.14,0.0376587548676509,100,87,12,1,False,False,79
877,Reminds me. Eggplant for dinner.,1.14,0.042687494916219,100,89,8,3,False,True,32
877,"With friends like these, who needs emojis.",1.14,0.0402517331328978,100,88,10,2,False,True,42
877,I think Eggplant is ghosting me.,1.14,0.0402517331328978,100,88,10,2,False,True,32
877,If we keep doing this with our faces will they stick that way?,1.14,0.0376587548676509,100,87,12,1,True,True,62
877,"Yes, it's my first time at the Emoti Con.",1.1397849462365592,0.044813774580074,93,83,7,3,False,True,41
877,The doctor says your face lift surgery  has been approved by your insurance company.,1.1397849462365592,0.0421250555063978,93,82,9,2,False,True,84
877,Is it so difficult for you all to understand why I don't want to post-on-line our scathing criticisms of the boss?,1.1397849462365592,0.0421250555063978,93,82,9,2,True,True,114
877,This is my emoji: ??‍♀️,1.1397849462365592,0.0392525949552448,93,81,11,1,True,False,23
877,So how do I type LOL?,1.1397849462365592,0.0421250555063978,93,82,9,2,True,True,21
877,Is that what this means by getting ahead?,1.1397849462365592,0.0421250555063978,93,82,9,2,True,True,41
877,Would I look good in pumpkin?,1.1397849462365592,0.0421250555063978,93,82,9,2,True,True,29
877,Could someone show me how to use spellcheck?,1.1397849462365592,0.0421250555063978,93,82,9,2,True,True,44
877,I kind of just want to stay in tonight though,1.1397849462365592,0.044813774580074,93,83,7,3,False,False,45
877,Worst nightmare ever!,1.1395348837209305,0.0410624651704613,86,75,10,1,False,True,21
877,"Ah yes, the I'm still human emoji.",1.1395348837209305,0.0500691469822273,86,78,4,4,False,True,34
877,"Geez, everyone has turned into such an eggplant.",1.1395348837209305,0.0442687684162645,86,76,8,2,False,True,48
877,"No, the eggplant is not an option.",1.1395348837209305,0.0442687684162645,86,76,8,2,False,True,34
877,I don't know whether to laugh or cry.,1.1395348837209305,0.0410624651704613,86,75,10,1,False,True,37
877,"You really should try facing your inner Emoji, my dear!",1.1395348837209305,0.0442687684162645,86,76,8,2,False,True,55
877,"OMG you guys. I don’t know what’s wrong with me, but I swear I’m LOLing.",1.1395348837209305,0.0442687684162645,86,76,8,2,False,True,72
877,"Smiley head, Fiery head, Luddite head, Blue Devil head, Peachy head",1.1395348837209305,0.0442687684162645,86,76,8,2,False,False,67
877,I'm just not feeling specific enough today,1.1395348837209305,0.0410624651704613,86,75,10,1,False,False,42
877,How come you guys always know exactly what to say?,1.1395348837209305,0.0472580328442728,86,77,6,3,True,True,50
877,"I'm sorry, I'm too emo to emoji.",1.1395348837209305,0.0410624651704613,86,75,10,1,False,True,32
877,Shannon quickly realized she'd misunderstood her invitation to the Tech-Head Convention.,1.1395348837209305,0.0442687684162645,86,76,8,2,False,True,88
877,Millennial divorcee opening her online dating app for the first time.,1.1395348837209305,0.0410624651704613,86,75,10,1,False,True,69
877,I don’t think I like the new update…,1.1395348837209305,0.0410624651704613,86,75,10,1,False,False,36
877,Jane had resisted becoming an emoji head like her friends but was rethinking her position after realizing savings she would incur on hair care.,1.1395348837209305,0.0410624651704613,86,75,10,1,False,True,143
877,"The Only Emoji-Face Left is ""Crying-Face!",1.139240506329114,0.0391991280198551,79,68,11,0,False,True,41
877,"I’d like to speak to the manager”
-Karen Emoj",1.1388888888888888,0.0425444066528241,108,97,7,4,False,False,45
877,But I don’t want to be  ?,1.1388888888888888,0.0382607632488486,108,95,11,2,True,True,25
877,„Oh shit. Here comes eggplant…“,1.1388888888888888,0.0445319750737498,108,98,5,5,False,False,31
877,I just don’t care about Taylor Swift that much.,1.1386138613861383,0.0398753080506975,101,89,10,2,False,True,47
877,Does this mean I'm the eggplant?,1.1386138613861383,0.0445654551878293,101,91,6,4,True,True,32
877,"Dang it, why do *I* always end up having to be the eggplant??",1.1386138613861383,0.0398753080506975,101,89,10,2,True,True,61
877,The perils of upgrading your device on the day it is released.,1.1386138613861383,0.0422854584238864,101,90,8,3,False,True,62
877,"No! No ! No! Yes! Yes, that's the butt I want!",1.1386138613861383,0.0422854584238864,101,90,8,3,False,True,46
877,I tried to tell you guys…,1.1386138613861383,0.0445654551878293,101,91,6,4,False,False,25
877,"My grandpa says I have nutty fiends.""",1.1386138613861383,0.0422854584238864,101,90,8,3,False,False,37
877,"There's no imoji for 'normal""?",1.1382978723404256,0.041701030432061,94,83,9,2,True,True,30
877,This must be emoticon Armageddon,1.1382978723404256,0.0388612318344454,94,82,11,1,False,False,32
877,Why do I feel like the poop emoji?,1.1382978723404256,0.041701030432061,94,83,9,2,True,True,34
877,I ? emojis.,1.1382978723404256,0.0388612318344454,94,82,11,1,True,True,11
877,Why I never use the poop emoji.,1.1382978723404256,0.0443594019177541,94,84,7,3,False,True,31
877,"Please,not the eggplant.",1.1382978723404256,0.041701030432061,94,83,9,2,False,True,24
877,I need an ethnographic study to understand this,1.1382978723404256,0.0443594019177541,94,84,7,3,False,False,47
877,I don’t think my tweets have enough snarky shorthand symbolism.  Nobody’s going to take me seriously.,1.137931034482759,0.0406194148155552,87,76,10,1,False,True,101
877,Where the realheads at?,1.137931034482759,0.0467392048785815,87,78,6,3,True,True,23
877,What happened to just wearing your heart on your sleeve?,1.137931034482759,0.0437863570798038,87,77,8,2,True,True,56
877,But why do I have to be Pile of Poo?,1.137931034482759,0.0437863570798038,87,77,8,2,True,True,36
877,"So you guys actually went for the ‘ Buy
a new i-phone, become the emoji of your choice’ promotion?",1.137931034482759,0.0437863570798038,87,77,8,2,True,True,98
877,omg new Karen emoji ?,1.137931034482759,0.0437863570798038,87,77,8,2,True,True,21
877,So that’s how you get Face ID to work…,1.137931034482759,0.0467392048785815,87,78,6,3,False,False,38
877,I guess this is easier to learn than Esperanto,1.137931034482759,0.0467392048785815,87,78,6,3,False,False,46
877,Are you the four horsemen of my dating apocalypse?,1.137931034482759,0.0406194148155552,87,76,10,1,True,True,50
877,Louder than words.,1.1376146788990826,0.0331490571692336,109,94,15,0,False,True,18
877,But I'm on my bank's website!,1.1375,0.0426338176224378,80,70,9,1,False,True,29
877,Are you guys all on Ozempic or something?,1.1375,0.0461962996490608,80,71,7,2,True,True,41
877,"Hey, guys, it's easier with Photoshop.",1.1372549019607845,0.0342408466989152,102,88,14,0,False,True,38
