contest,caption,mean,precision,votes,not_funny,somewhat_funny,funny,has_question_mark,ends_with_punctuation,caption_length
834,Singing sweet songs of melodies pure and true. These are our specials for you-hoo-hoo,1.174757281553398,0.0298820547791361,206,174,28,4,False,False,85
834,We’re an arm-to-table restaurant.,1.1746724890829694,0.0280269691904944,229,193,32,4,False,True,33
834,"Yes, three birds did build a nest on my arm during the time it took me to reach your table, but I don’t think that necessarily proves my service is slow.",1.1746724890829694,0.0300071177096988,229,196,26,7,False,True,153
834,Today's special is Egg Drop Soup.,1.1746031746031746,0.030584982562343,189,159,27,3,False,True,33
834,We’re a “farm to table” restaurant.,1.1746031746031746,0.0276871682797157,189,156,33,0,False,True,35
834,"Would you like the rest of your order to stay, to go, or to be fed to these ravenous pigeons as a waste free option?",1.1745283018867925,0.0301055005167695,212,180,27,5,True,True,116
834,"As a New York City native, the Chef believes in locally sourced pigeons, a fowl delicacy",1.1743589743589744,0.0341320362611685,195,169,18,8,False,False,88
834,A drop of guano?,1.1741293532338308,0.0318990449789262,201,172,23,6,True,True,16
834,Our special this evening is arm-fresh pigeon. Can I start you off with some drinks?,1.1741293532338308,0.0302992835394728,201,170,27,4,True,True,83
834,They will sing you the specials,1.1741293532338308,0.0302992835394728,201,170,27,4,False,False,31
834,Our new Phone-Free policy allows up to three messages now.,1.173913043478261,0.0328945261672351,184,157,22,5,False,True,58
834,Here's tonight's special ; they'll be roasted and served in a lemon butter drizzle along with brussel sprouts.,1.173913043478261,0.0292438333610707,230,196,28,6,False,True,110
834,Would you like a Tweet with that?,1.173913043478261,0.0289503092889531,207,174,30,3,True,True,33
834,"Thank you for ordering the Bob Marley special, Every Little Thing, starting with the three little birds.”",1.173913043478261,0.0328945261672351,184,157,22,5,False,False,105
834,Choice of chirping with your morning coffee?,1.1737089201877935,0.0299750279747533,213,181,27,5,True,True,44
834,Turns out we weren’t lying about the eggs being poached.,1.1737089201877935,0.0299750279747533,213,181,27,5,False,True,56
834,The dating site said you liked birds”,1.1737089201877935,0.031417894700066,213,183,23,7,False,False,37
834,"May we repeat your order, sir?",1.1735537190082646,0.0276878824909186,242,205,32,5,True,True,30
834,Our coffee makes doves cry. Let me show you!,1.1733333333333331,0.0289498745782298,225,191,29,5,False,True,44
834,They come in at the main chorus,1.1733333333333331,0.0275450568837706,225,189,33,3,False,False,31
834,The poultry special is very fresh.,1.1732673267326732,0.0293332822124681,202,170,29,3,False,True,34
834,I apologize. They just enjoy the Christmas songs so much and we haven't the time to teach them anything else.,1.173160173160173,0.0284731582892101,231,196,30,5,False,True,109
834,May I recommend the squab today. It’s very fresh,1.1730769230769231,0.0296177613702154,208,176,28,4,False,False,48
834,Each one is worth two in the bush.,1.1728971962616823,0.0298456693683179,214,182,27,5,False,True,34
834,We can’t use drones indoors.,1.1725888324873095,0.0338076945640029,197,171,18,8,False,True,28
834,This is our blind date special—a more explicit take on getting butterflies in your stomach,1.1725888324873095,0.0322391915895169,197,169,22,6,False,False,90
834,We're experimenting with live tweeting.,1.172566371681416,0.0288316960349579,226,192,29,5,False,True,39
834,Your first time at Les Trois Oiseaux?,1.1724137931034482,0.0283599868517141,232,197,30,5,True,True,37
834,And now for this evening's entertainment ...,1.1724137931034482,0.0283599868517141,232,197,30,5,False,True,44
834,I really would recommend the quail over the elk.,1.1722689075630253,0.0279095236360223,238,202,31,5,False,True,48
834,"Your card? Take a look under your plate, sir. And for my next trick . . .",1.1714285714285717,0.030124134242405,210,179,26,5,True,True,73
834,"Yes Sir  it's very exotic , expensive and exclusive. Why, Ivanka Trump just bit the head off an endangered macaw over at that table Sir.",1.1714285714285717,0.0267574011173238,245,207,34,4,False,True,136
834,Is this fresh enough for you?,1.170854271356784,0.0294575403291978,199,168,28,3,True,True,29
834,Actually Sir these are the Managers,1.1708333333333334,0.0283174846969675,240,205,29,6,False,False,35
834,Our January special: three French hens.,1.1708333333333334,0.027694989367686,240,204,31,5,False,True,39
834,Would you like to start with a flight of fancy?,1.170731707317073,0.0320749027141174,205,177,21,7,True,True,47
834,„Don’t let my emotional support animals discourage you from ordering meat“,1.1706349206349207,0.0285792884626518,252,217,27,8,False,False,74
834,So our concept is city-street to table,1.1704545454545454,0.027714312097472,264,227,29,8,False,False,38
834,we just had these flown in from Staten Island.,1.170124481327801,0.0263057667743622,241,203,35,3,False,True,46
834,I use the towel to keep the bird poop off my sleeve and out of your food.,1.1699604743083003,0.028474091412164,253,218,27,8,False,True,73
834,Our last customer gave us three tweets.,1.1699029126213591,0.0296212567346285,206,175,27,4,False,True,39
834,Feeling peckish?,1.1696428571428572,0.0288421570586228,224,191,28,5,True,True,16
834,The chef is winging it.,1.1695652173913045,0.0255514299941017,230,192,37,1,False,True,23
834,Same idea as a lobster tank.,1.1694915254237288,0.0272625105631214,236,200,32,4,False,True,28
834,I’m just a really big Bob Marley fan.,1.169398907103825,0.0298863084600424,183,154,27,2,False,True,37
834,This is the only cheep entree we have.,1.1693548387096775,0.0270698869071861,248,211,32,5,False,True,38
834,"Pick a squab, any squab.",1.1693121693121693,0.0320866190995486,189,162,22,5,False,True,24
834,They're French hens. Just in case you need to give them to somebody.,1.1692307692307693,0.0297204281463764,195,165,27,3,False,True,68
834,New York pigeon is best served fresh.,1.1691542288557213,0.030028492364821,201,171,26,4,False,True,37
834,Sorry my bird sitter called out sick,1.1691542288557213,0.0291883385947714,201,170,28,3,False,False,36
834,Today's specials are top-flight.,1.1691542288557213,0.0316419474948415,201,173,22,6,False,True,32
834,"If you liked your entrees, please tweet out a good review.",1.1690821256038648,0.0294892364270433,207,176,27,4,False,True,58
834,"Rare, medium, or well done?",1.1690821256038648,0.0302740347548102,207,177,25,5,True,True,27
834,"I’m sorry sir, they don’t know ‘Happy Birthday.’",1.1690140845070425,0.0282022126983671,213,180,30,3,False,False,48
834,"Ah, yes, sorry, our vegan option flew away.",1.1689497716894977,0.0299234701910219,219,188,25,6,False,True,43
834,"""I can highly recommend the seed cake.""",1.1688311688311688,0.026889567334975,231,195,33,3,False,False,39
834,Eggs over easy if they can lay one in a timely manner.,1.1688311688311688,0.0275806516849501,231,196,31,4,False,True,54
834,Don’t ask about the secret ingredient in the ‘coofee’,1.1686746987951808,0.0281448187791752,249,214,28,7,False,False,53
834,"Yes, our pigeon is locally sourced.",1.168421052631579,0.0291962918245035,190,160,28,2,False,True,35
834,"Fried, boiled or baked.  Your choice.",1.1683673469387754,0.0321250978822806,196,169,21,6,False,True,37
834,Chef is on a mission to promote Fresh from the Tree,1.1683673469387754,0.0295810081416189,196,166,27,3,False,False,51
834,"Sorry for the substitution, but the lobster tank is broken.",1.1683168316831682,0.0322685564299293,202,175,20,7,False,True,59
834,"I'd like six in a bush, please.",1.1682692307692308,0.0309001043130886,208,179,23,6,False,True,31
834,Today's post-holiday special is three french hens.,1.1682692307692308,0.0309001043130886,208,179,23,6,False,True,50
834,"They identify as ""squab"".",1.1681818181818182,0.0290921414226322,220,188,27,5,False,True,25
834,This is a nest to table restaurant.,1.168141592920354,0.0299493572778691,226,195,24,7,False,True,35
834,We’re PETA approved.,1.168103448275862,0.0281421966939272,232,198,29,5,False,True,20
834,It's bring your birds to work day.,1.1680672268907564,0.0276992163409305,238,203,30,5,False,True,34
834,Glad you enjoyed everything. Mind if we tweet about it?,1.16793893129771,0.0277374215696907,262,226,28,8,True,True,55
834,"Oh yes, the squab is very fresh.",1.1675675675675676,0.0295905297982786,185,156,27,2,False,True,32
834,Shall I just skip to the partridge in the pear tree?,1.1675675675675676,0.0324324324324324,185,159,21,5,True,True,52
834,"Oh, no, I don’t need to write down your order, I’m just winging it.",1.1675392670157068,0.0317743592395499,191,164,22,5,False,True,67
834,Did I not say Evian?,1.1674418604651162,0.0316097471421986,215,187,20,8,True,True,20
834,"Tonight’s feature will be freshly captured pigeon, found locally on nearby scaffoldings and served with a side of breadcrumbs.",1.167420814479638,0.0282513218018392,221,188,29,4,False,True,126
834,"No, I am their service-human!”",1.1674008810572687,0.0277966793734811,227,193,30,4,False,False,30
834,How can I be sure that the one I choose will be the same one we eat?,1.1674008810572687,0.0277966793734811,227,193,30,4,True,True,68
834,"Yes, the eggs are fresh",1.1673469387755102,0.0277814607287706,245,210,29,6,False,False,23
834,They take care of any crumbs left on the plates.,1.1666666666666667,0.0278423023194852,216,183,30,3,False,True,48
834,"We take farm to table very seriously.""",1.1666666666666667,0.0298459297556379,192,163,26,3,False,False,38
834,Our bird’s nest soup is the best in the city.,1.1666666666666667,0.0319726129625282,204,177,20,7,False,True,45
834,My chef does an excellent job with songbirds.,1.1666666666666667,0.0320793994830503,210,183,19,8,False,True,45
834,How’s this for ‘farm to table?’,1.1666666666666667,0.0329587896097352,180,155,20,5,True,False,31
834,"For our next dish in our ""12 courses of Christmas"" menu...",1.1666666666666667,0.0298253109424021,234,203,23,8,False,True,58
834,Three little birds told me that you are on a first date.,1.1666666666666667,0.030896188826233,222,193,21,8,False,True,56
834,"I'm sorry, we're out of the lobster. But you can pick your own pigeon.",1.1659574468085103,0.0284559490456354,235,202,27,6,False,True,70
834,Peckish?,1.1659192825112108,0.0272869225680889,223,189,31,3,True,True,8
834,"Of course, we only serve wild-caught.” @rozchas",1.165898617511521,0.0292228994055494,217,186,26,5,False,False,47
834,It's the tri-peck-ta,1.1658536585365853,0.0347020437648502,205,182,12,11,False,False,20
834,this is our curb to table menu,1.1658536585365853,0.0302867594097905,205,176,24,5,False,False,30
834,"Broiled, Baked or marinated in buttermilk from a Wisconsin cow fed only hibiscus flower, fried in the fat of a American Yorkshire pig that has only been fed apricots, seasoned simply with ambrosia salt ethically mined by the Tonitary Tribe and finally Madagascar Black Pepper grown on a 2 hectare plot of land at an elevation of 4,000 feet, it’s only available every 7 years.",1.1658536585365853,0.0340059970270795,205,181,14,10,False,True,375
834,"Have you been here before?  The concept is pretty simple. There is no menu. The parrots are each trained to pick a meal item. The one on the right picks a protein, middle is starch, and left is vegetable; and that’s your meal!",1.16580310880829,0.0305984761943464,193,165,24,4,True,True,226
834,They may be called parakeets but we sell them in groups of 3,1.1653225806451613,0.0274693883173077,248,213,29,6,False,False,60
834,"Yes,our squab is super fresh.",1.1651785714285714,0.029977167018643,224,194,23,7,False,True,29
834,It's the new thing: perch to plate.,1.165137614678899,0.0283627287238238,218,186,28,4,False,True,35
834,"You know they say, ‘3 French Hens aren’t just for Christmas.’",1.165137614678899,0.0276073621614882,218,185,30,3,False,False,61
834,A little birdie told me it was your birthday!,1.1650943396226414,0.0317953986924434,212,185,19,8,False,True,45
834,we let you choose which parrot says things that offend your particular sensibilities the most and then we cook it for you.,1.165,0.0307179583440065,200,172,23,5,False,True,122
834,You ordered our street food selections.  The pigeons add “verismo” for our indoor diners.,1.1649484536082475,0.0321586200954496,194,168,20,6,False,True,89
834,Asking you to choose is the only way to be fair to the lobsters.,1.1645021645021645,0.0293440804327704,231,200,24,7,False,True,64
834,You ordered rare squab?,1.1644444444444444,0.0291804578128202,225,194,25,6,True,True,23
834,today's special is a selction of fresh fowl,1.1643835616438356,0.0289751322326216,219,188,26,5,False,False,43
834,We no longer need table crumb sweepers.,1.164319248826291,0.0279392406279724,213,181,29,3,False,True,39
834,"They sayin don't worry, about a ting.",1.1642512077294689,0.0315386647224924,207,180,20,7,False,True,37
834,The French chef asked me to present these three hens with his best Christmas wishes,1.1641221374045805,0.0291090910913664,262,230,21,11,False,False,83
834,You be surprised how many of these you can fit in your ass,1.1641025641025642,0.0320044595874462,195,169,20,6,False,False,58
834,This is just my day job - I’m really a falconer.,1.163716814159292,0.0283753732452353,226,194,27,5,False,True,48
834,This used to be a crumby place to eat.,1.1636363636363636,0.0266073531837187,220,186,32,2,False,True,38
834,Would you like to twist their necks or leave that pleasure to the chef?,1.1636363636363636,0.0295634105796944,220,190,24,6,True,True,71
834,A pigeon for the lady?,1.1636363636363636,0.0281242465547678,220,188,28,4,True,True,22
834,"Buy 2, get 1 free",1.1635514018691588,0.0293538644094295,214,184,25,5,False,False,17
834,Are you sure you wouldn’t prefer the vegan dish?,1.1633663366336633,0.0312336498348029,202,175,21,6,True,True,48
834,"For those with dietary restrictions, we offer a premastication course where our feathered friends will chew the food for you and spit it directly into your mouths.",1.1633663366336633,0.0304348849972211,202,174,23,5,False,True,163
834,"No sir, The Bob Marley special LAST week was buffalo soldiers...""  which will be completely puzzling to the white majority in the USA",1.163265306122449,0.0301641723691691,196,168,24,4,False,False,133
834,They do our tweets,1.163265306122449,0.0301641723691691,196,168,24,4,False,False,18
834,I kind of rescued them from our free range menu.,1.1630434782608696,0.0322903603122543,184,159,20,5,False,True,48
834,"Okay so they’re fresh, but are they organic?",1.16289592760181,0.0294386485999807,221,191,24,6,True,True,44
834,"Oh, so you guys heard about the free bread as well?",1.16289592760181,0.0264970317277467,221,187,32,2,True,True,51
834,It's now your turn to sing for your supper,1.162790697674419,0.026903647529855,215,182,31,2,False,False,42
834,"Special tonight 
Fresh quail.",1.1626984126984128,0.0258692445299287,252,215,33,4,False,True,29
834,"Yes, they'll be served with two turtle doves and we'll finish the meal with a partridge in a pear tree.",1.1626794258373203,0.0281584599442508,209,178,28,3,False,True,103
834,"Baked, Roasted or Fried?",1.1626794258373203,0.0281584599442508,209,178,28,3,True,True,24
834,Tweets with biscuits?,1.1625615763546795,0.0294793246260845,203,174,25,4,True,True,21
834,As our special today we have fresh killed sparrow.,1.1624365482233503,0.0308727091477998,197,170,22,5,False,True,50
834,Restaurant critics say that we have the best crackers in town.,1.1624365482233503,0.0325072131612659,197,172,18,7,False,True,62
834,"It's ""bring your pets to work"" day",1.1624365482233503,0.0291466881950128,197,168,26,3,False,False,34
834,They're free range.,1.162303664921466,0.0314824266951492,191,165,21,5,False,True,19
834,Today I'm glad they make me wear the napkin.,1.162280701754386,0.0260031796803252,228,193,33,2,False,True,44
834,We recommend the breadsticks to start.,1.162162162162162,0.0263876096440893,222,188,32,2,False,True,38
834,Would you like to live tweet this experience?,1.161904761904762,0.0296156122021315,210,181,24,5,True,True,45
834,We've got 21 more in the kitchen ready to be baked into today's pie special.,1.161904761904762,0.0288360194806069,210,180,26,4,False,True,76
834,We’re taking ‘farm-to-table’ to a whole new level.,1.161904761904762,0.0296156122021315,210,181,24,5,False,True,50
834,Here’s tonight lovebird special.,1.1618497109826589,0.0314694816137299,173,148,22,3,False,True,32
834,"I assure you, it’s three turtle doves…",1.161764705882353,0.0293452836978731,204,175,25,4,False,False,38
834,Can we interest you in a four part harmony to enhance your special night?,1.161764705882353,0.0301569371032551,204,176,23,5,True,True,73
834,These are my support Pigeons.,1.1617021276595745,0.0295000837281819,235,205,22,8,False,True,29
834,"We had many complaints recently, they are official tasters, if they do not die or get diarrhea 5 minutes after they taste, bonne appetit.",1.1616161616161615,0.0290107111519413,198,169,26,3,False,True,137
834,This is part of our sustainable dishwashing initiative,1.1611570247933884,0.0270628400587313,242,208,29,5,False,False,54
834,"Sure you can order the chicken, they don't mind.",1.161137440758294,0.0287092865253843,211,181,26,4,False,True,48
834,Want to see our Twitter feed?,1.1609756097560977,0.0308060861208673,205,178,21,6,True,True,29
834,"We'll order from the vegan menus, thank you.",1.1608040201005023,0.0297419110678076,199,171,24,4,False,True,44
834,Your generous tip might just get me outta that garden apartment,1.1608040201005023,0.0279832732986688,199,169,28,2,False,False,63
834,Hope you enjoyed it here at Cinderella's. Let's clear those dishes for you.,1.1608040201005023,0.0297419110678076,199,171,24,4,False,True,75
834,And which of you ordered the fresh local catch?,1.1605504587155964,0.0281103205728916,218,187,27,4,True,True,47
834,Each one is worth TWO in the bush - it's our Valentine's Day Special.,1.1605504587155964,0.0281103205728916,218,187,27,4,False,True,69
834,"Bathed solely in the finest fountain water, before a delicate pan searing",1.1605504587155964,0.0302824029454017,218,190,21,7,False,False,73
834,"May I introduce you to our 3 squabs, Well Done, Medium and Rare. ,",1.160493827160494,0.0256668835601105,243,207,33,3,False,False,66
834,'yes and the chef is a rat..',1.160377358490566,0.0293553383484049,212,183,24,5,False,False,29
834,We pride ourselves on sourcing locally.,1.16,0.0282561975221843,225,194,26,5,False,True,39
834,These are the Jacu birds that actually partially digested the coffee you are drinking!,1.16,0.0312551503293545,200,174,20,6,False,True,86
834,you asked the eggs well done?,1.16,0.0304406498917015,200,173,22,5,True,True,29
834,The bill?,1.1598360655737705,0.0274775498024509,244,211,27,6,True,True,9
834,Just verifying reports you've been ruffling some feathers...,1.1598173515981736,0.0279912704356866,219,188,27,4,False,True,60
834,"My mistake, I thought you said plumage.  I’ll be right back with your cheese course.",1.1598173515981736,0.0308395616332164,219,192,19,8,False,True,84
834,"Why yes, we are a farm-to-table establishment.",1.1597938144329898,0.033510803926856,194,171,15,8,False,True,46
834,Were you the couple that ordered fresh eggs?,1.1597938144329898,0.0301547704321141,194,167,23,4,True,True,44
834,"I'm puzzled, sir. What did you think 'New York's finest avian cuisine' implied?",1.1597938144329898,0.0318769835432847,194,169,19,6,True,True,79
834,Serving under glass is much too distressing for them.,1.15962441314554,0.0284591021782144,213,183,26,4,False,True,53
834,"Our Christmas special was three French Hens, but you can substitute turtle doves.",1.15962441314554,0.0292268951385303,213,184,24,5,False,True,81
834,"Colonel Sanders sends his regrets, but we’ve run out of chicken",1.1595744680851063,0.0307363855092003,188,162,22,4,False,False,63
834,And we'll set all three of them free for $120.,1.1594827586206895,0.0296453441709902,232,203,21,8,False,True,46
834,They said this was worth SIX in the bush!,1.1592039800995024,0.0302992835394728,201,174,22,5,False,True,41
834,"Our menu items are locally sourced, right here.",1.1590909090909092,0.0263418698882912,220,187,31,2,False,True,47
834,They remind us why we're vegan.,1.1590909090909092,0.0286081651011909,220,190,25,5,False,True,31
834,Care to try the entree flight?,1.1590909090909092,0.0278732149211727,220,189,27,4,True,True,30
834,They chirp when you order the most expensive wine.,1.1589958158995817,0.0284245686340629,239,208,24,7,False,True,50
834,"Sorry, no bread, but do you want a cracker?",1.158798283261803,0.0282448907813166,233,202,25,6,True,True,43
834,Dinner theater really isn't what it used to be.,1.1587301587301588,0.030584982562343,189,163,22,4,False,True,47
834,Can I interest you in an insult from one of our cockatoos?,1.158371040723982,0.0284875190344397,221,191,25,5,True,True,58
834,They’d like to know if you would interested in a tasting flight,1.1581920903954803,0.0308096850564195,177,152,22,3,False,False,63
834,Is there a message you would like me to send to the chef?,1.158139534883721,0.0297140087701222,215,187,22,6,True,True,57
834,Didn't you read the sign? This is a dovetail joint.,1.158139534883721,0.0282132007212027,215,185,26,4,True,True,51
834,They can lay eggs any style.,1.158102766798419,0.0249461083382891,253,216,34,3,False,True,28
834,Imagine how many are in the bush!,1.1578947368421053,0.0294836068264915,209,181,23,5,False,True,33
834,"Yes, sir. You did ask if we have slaughtered the squab yet. To answer your question — no.",1.1578947368421053,0.0286927943314195,209,180,25,4,False,True,89
834,Feel free to tip me in crackers.,1.157676348547718,0.0256345131298072,241,206,32,3,False,True,32
834,Fresh foods menu .Eat or adopt ?,1.1576576576576576,0.0290775040702864,222,193,23,6,True,True,32
834,Mobile phones are not permitted in the restaurant but our staff are more than happy to share some live tweets with you.,1.1576576576576576,0.0290775040702864,222,193,23,6,False,True,119
834,We're out of the lobster.,1.1576354679802956,0.0265731517863404,203,172,30,1,False,True,25
834,A little birdie told me you wanted hot chocolate,1.1576086956521738,0.0337829095755825,184,162,15,7,False,False,48
834,"Our special tonight is 'Three French Hens,"" but we still have 'A Partridge in a Pear Tree'  and 'Two Turtle Doves' on the menu, if you'd prefer.""",1.1574074074074074,0.0310067051694306,216,190,18,8,False,False,145
834,Would you prefer the Cornish hens?,1.1573604060913705,0.0279305513742868,197,168,27,2,True,True,34
834,Alright I'm going to have them repeat your order back to you,1.1573604060913705,0.0305860720942177,197,171,21,5,False,False,60
834,Complementary.,1.1572052401746724,0.0263821964488964,229,196,30,3,False,True,14
834,Three Turtle Doves?,1.1571428571428573,0.0308659430672099,210,184,19,7,True,True,19
834,I'll have what she's having,1.1571428571428573,0.0260633006678289,210,178,31,1,False,False,27
834,It's a new thing. Kinda like choosing your lobster.,1.1569767441860466,0.0290153168814041,172,146,25,1,False,True,51
834,Our third day of Christmas special,1.156862745098039,0.0273514498706667,204,174,28,2,False,False,34
834,Because our lobster tank was so popular…,1.156862745098039,0.029063588393549,204,176,24,4,False,False,40
834,We have an early bird special.,1.156862745098039,0.0264538585065878,204,173,30,1,False,True,30
834,We hoped you enjoyed your dinner this evening. Tip and crackers are appreciated .,1.1567567567567567,0.0299107829546153,185,159,23,3,False,True,81
834,My name is Jerry. I’ll be your waiter today and my favorite documentary is Ratatouille.,1.1566820276497696,0.028724080036366,217,188,24,5,False,True,87
834,Pick one..they are all named Kevin,1.1565656565656566,0.029587424629604,198,171,23,4,False,False,34
834,"You’re gonna have to wait on those omelettes a little while, with the price of eggs these days you will have to give me a couple of extra minutes.",1.1564885496183206,0.0261004110428601,262,227,29,6,False,True,146
834,It doesn’t get much more local or organic than this,1.1563981042654028,0.0268057459386846,211,180,29,2,False,False,51
834,Our special this evening is fresh free range squab.,1.15625,0.0281315610896403,224,194,25,5,False,True,51
834,"Due to staffing shortages, these 3 will be delivering your food today.  I will caution not to order the soup""",1.15625,0.03274145939289,192,169,16,7,False,False,109
834,"you’ve seen Ratatouille, right?",1.1560975609756097,0.029746609646818,205,178,22,5,True,True,31
834,Don't order eggs.,1.1559139784946235,0.0307224332592056,186,161,21,4,False,True,17
834,"Our hand menu is a bit limited, but the bush menu features 6 additional dishes.",1.1559139784946235,0.029761472856674,186,160,23,3,False,True,79
834,Hyde Park was too far so they chose this place to tweet their mind.,1.1557788944723617,0.0285740738848107,199,171,25,3,False,True,67
834,...even our music is organic,1.1557788944723617,0.0302984387028772,199,173,21,5,False,False,28
834,Squabble?,1.1556603773584906,0.0298522425955083,212,185,21,6,True,True,9
834,"They're not mocking you, just reciting back your coffee order.",1.1556603773584906,0.0290937392981726,212,184,23,5,False,True,62
834,"We’re so glad you enjoyed the meal! Oh, him? That’s Gregory, he’s kind of like our service dog. No, you can’t pet him.",1.1555555555555554,0.0303325477441626,180,155,22,3,True,True,118
834,"We'd like to acknowledge your split checks and tips: ""Cheep, cheep, cheep""",1.155440414507772,0.0317423594685047,193,169,18,6,False,False,74
834,Might I recommend the flight this evening?,1.1552511415525115,0.0269679970778418,219,188,28,3,True,True,42
