contest,caption,mean,precision,votes,not_funny,somewhat_funny,funny,has_question_mark,ends_with_punctuation,caption_length
877,...who farted...,1.1071428571428572,0.0379398365068223,84,76,7,1,False,True,16
877,I see you’ve all got the new emoji app!,1.1071428571428572,0.0379398365068223,84,76,7,1,False,True,39
877,I don't think this one needs a caption.  I think it's hilarious as is.,1.1071428571428572,0.0339495134209541,84,75,9,0,False,True,70
877,u guyz have color??  :o,1.1071428571428572,0.0379398365068223,84,76,7,1,True,False,23
877,So this is what a live-action group chat looks like!,1.1071428571428572,0.0379398365068223,84,76,7,1,False,True,52
877,have any of you seen the water emoji guy?,1.1071428571428572,0.0339495134209541,84,75,9,0,True,True,41
877,How is it my friends are all so cool??,1.106666666666667,0.0358843655048781,75,67,8,0,True,True,38
877,I am not sure if this is possible but I feel even more alone.,1.106666666666667,0.0405961580454117,75,68,6,1,False,True,61
877,"Oh, I thought this was an Imogene party, I came as Imogene Coca.",1.106666666666667,0.0405961580454117,75,68,6,1,False,True,64
877,I'm feeling a bit moji.,1.106666666666667,0.04481526981296,75,69,4,2,False,True,23
877,"Guys: you don't have to be afraid of biometrics every damn day,",1.106666666666667,0.04481526981296,75,69,4,2,False,False,63
877,"I've gotta be me, but I forgot how.",1.106666666666667,0.0358843655048781,75,67,8,0,False,True,35
877,And if you click this one you can show videos on your ass.,1.106666666666667,0.0405961580454117,75,68,6,1,False,True,58
877,I'm on Lexapro,1.1063829787234043,0.03536936228202,94,85,8,1,False,False,14
877,What would you like for lunch peach head?,1.1063829787234043,0.03536936228202,94,85,8,1,True,True,41
877,You have all become what you beheld.,1.106060606060606,0.0438730308268501,66,60,5,1,False,True,36
877,"My favorite emojis:  cool, lit, Karen, trouble, and butt.",1.106060606060606,0.0381921767870499,66,59,7,0,False,True,57
877,Reading the room nowadays.,1.106060606060606,0.0381921767870499,66,59,7,0,False,True,26
877,"OK non-boomers, you do you.",1.1058823529411763,0.0410763087503044,85,78,5,2,False,True,27
877,My phone makes me use facial expressions.,1.1058823529411763,0.0410763087503044,85,78,5,2,False,True,41
877,The pile of poop? No way!,1.1058823529411763,0.0375120126857039,85,77,7,1,True,True,25
877,wanted a shower radio for Christmas & I dont think I'm getting it,1.1058823529411763,0.0375120126857039,85,77,7,1,False,False,65
877,I’m so emoji challenged!,1.1058823529411763,0.0335714022780473,85,76,9,0,False,True,24
877,I know you think he’s a drag but I’m still texting with Period.,1.1058823529411763,0.0335714022780473,85,76,9,0,False,True,63
877,All I wanted to say was new number who this…,1.1058823529411763,0.0375120126857039,85,77,7,1,False,False,44
877,TFW you’re the last to react on Insta,1.1058823529411763,0.0375120126857039,85,77,7,1,False,False,37
877,"When you added me to the chat for group stuff I didn't know you meant ""group stuff"".",1.1057692307692308,0.0332412291990669,104,94,9,1,False,True,84
877,I’d say that Apple’s new augmented reality app just jumped the shark.,1.105263157894737,0.031653514053981,95,85,10,0,False,True,69
877,"It's not my fault there's no ""unassuming woman"" emoji.",1.105263157894737,0.0354368594328493,76,68,8,0,False,True,54
877,"No, I promise you, I am wearing one too",1.105263157894737,0.0442439305716437,76,70,4,2,False,False,39
877,What if I just wear a T-shirt that says I'm surrounded by ??,1.105263157894737,0.0350129849869881,95,86,8,1,True,True,60
877,So you think I should sleep with him and break up with him?,1.105263157894737,0.0409125585751615,95,88,4,3,True,True,59
877,Turns out that Apple's revolutionary new Memoji system can turn your face into an emoji.,1.105263157894737,0.0380772016229205,95,87,6,2,False,True,88
877,Heard from y’all before.  No thanks!,1.105263157894737,0.0442439305716437,76,70,4,2,False,True,36
877,"I can't decide, there's too many of you!",1.105263157894737,0.040083016346652,76,69,6,1,False,True,40
877,I don't see one for conflicted capitalist progressive!,1.105263157894737,0.0480458383776461,76,71,2,3,False,True,54
877,I’ll wait to download the new iOS software update when you get your faces back.,1.105263157894737,0.040083016346652,76,69,6,1,False,True,79
877,Darn! All the good emojis are already taken.,1.105263157894737,0.0354368594328493,76,68,8,0,False,True,44
877,"Come for Christmas, he said…it’ll be fun, he said…",1.105263157894737,0.0442439305716437,76,70,4,2,False,False,50
877,Oh shit!,1.105263157894737,0.0442439305716437,76,70,4,2,False,True,8
877,"Having trouble choosing? Go with eggplant, and you’re bound to go home with somebody.",1.105263157894737,0.0354368594328493,76,68,8,0,True,True,85
877,"So this is how Right Said Fred felt, I totally get it now.",1.105263157894737,0.040083016346652,76,69,6,1,False,True,58
877,Can you guys stop making the group chat so weird?,1.105263157894737,0.040083016346652,76,69,6,1,True,True,49
877,Wait; which one of these is non-binary: 🍌🍆🌶️?,1.105263157894737,0.040083016346652,76,69,6,1,True,True,45
877,But what MI?,1.1046511627906976,0.0332015763121984,86,77,9,0,True,True,12
877,?????,1.1046511627906976,0.040614533015286,86,79,5,2,True,True,5
877,… and not a thought in your head,1.1046511627906976,0.0370936986674589,86,78,7,1,False,False,32
877,Where is the tampon emoji?,1.1046511627906976,0.040614533015286,86,79,5,2,True,True,26
877,I need an oversaturated with emojis emoji.,1.1046511627906976,0.0370936986674589,86,78,7,1,False,True,42
877,These LinkedIn post reaction options are getting out of hand,1.1046511627906976,0.0332015763121984,86,77,9,0,False,False,60
877,"Butt wait, there’s more!",1.1046511627906976,0.0332015763121984,86,77,9,0,False,True,24
877,Your phone’s electric like mine. What makes it different?,1.1041666666666667,0.0313412410700799,96,86,10,0,True,True,57
877,Choose your “ Disposition of the day” !,1.1041666666666667,0.0346636933610211,96,87,8,1,False,True,39
877,Everyone’s trying to invent a new word game. I don’t like this one.,1.103896103896104,0.0395826466272485,77,70,6,1,False,True,67
877,I think the iPhone 24 is when Apple took this memoji thing too far.,1.103896103896104,0.0436869478640459,77,71,4,2,False,True,67
877,"When I click 'See All,' all I get are
updates from my bank!",1.103896103896104,0.0395826466272485,77,70,6,1,False,True,59
877,What are the other prizes?,1.103896103896104,0.0350003202036694,77,69,8,0,True,True,26
877,This is just too much.  I'm digging out the 23-channel citizen band radio and going retro.,1.103896103896104,0.0350003202036694,77,69,8,0,False,True,90
877,Everyone checks the weather.,1.103896103896104,0.0395826466272485,77,70,6,1,False,True,28
877,"And, as usual, Joan just can't find an appropriate emoji.",1.103896103896104,0.0395826466272485,77,70,6,1,False,True,57
877,what is this your business?!,1.103896103896104,0.0350003202036694,77,69,8,0,True,True,28
877,Try not to overreact but they canceled our family plan.,1.103896103896104,0.0395826466272485,77,70,6,1,False,True,55
877,Why am I always the outlier?,1.103896103896104,0.0395826466272485,77,70,6,1,True,True,28
877,It’s just so hard to choose.,1.103896103896104,0.0350003202036694,77,69,8,0,False,True,28
877,"Wait - wait - you attracted the hot one and you ended up with the devilish one, but both of you used my picture on Tinder. Why am I dateless tonight?",1.103448275862069,0.0433632905680698,87,81,3,3,True,True,149
877,Am I the only one who can see your personality on your faces?,1.103448275862069,0.0366845819952604,87,79,7,1,True,True,61
877,I picked the poo emoji.  Does that mean...,1.103448275862069,0.0401630024092935,87,80,5,2,False,True,42
877,why am i humming stealers wheel,1.103448275862069,0.0401630024092935,87,80,5,2,False,False,31
877,"What do you think, butthead?",1.103448275862069,0.0366845819952604,87,79,7,1,True,True,28
877,I can't get my  game on because I can't download the app!,1.103448275862069,0.0328397678098528,87,78,9,0,False,True,57
877,Could I still attend the party without a mask?,1.103448275862069,0.0366845819952604,87,79,7,1,True,True,46
877,Oh no!  My battery just died.,1.103448275862069,0.0366845819952604,87,79,7,1,False,True,29
877,"Finally accepted into the shape-shifting club, Karen had forgotten to memorize her entry code.",1.1029411764705883,0.0426292687910726,68,62,5,1,False,True,94
877,There's a word for that...,1.1029411764705883,0.0426292687910726,68,62,5,1,False,True,26
877,Man!!!! All you guys left me was the poop emoji !!!,1.1025641025641026,0.0345743519211918,78,70,8,0,False,True,51
877,Has anyone seen FOMO?,1.1025641025641026,0.0345743519211918,78,70,8,0,True,True,21
877,You guys are great to let me in the group even though I'm so different.,1.1025641025641026,0.0345743519211918,78,70,8,0,False,True,71
877,I honestly don’t know how to react to this.”,1.1025641025641026,0.0345743519211918,78,70,8,0,False,False,44
877,Remember when your mom warned you your face would stay that way if . . . . .,1.1025641025641026,0.0390945794678847,78,71,6,1,False,True,76
877,I was just trying to get ahead--not all of you!,1.1025641025641026,0.0431437883915064,78,72,4,2,False,True,47
877,Don't turn around but that eggplant guy just walked in.,1.1025641025641026,0.0390945794678847,78,71,6,1,False,True,55
877,I’m not as good at expressing myself.,1.1025641025641026,0.0390945794678847,78,71,6,1,False,True,37
877,Which one of you is least likely to be perceived as offensive?,1.1025641025641026,0.0345743519211918,78,70,8,0,True,True,62
877,My transition failed! Wrong app on my phone I guess?,1.1025641025641026,0.0390945794678847,78,71,6,1,True,True,52
877,I feel like a hot dog at a corndog party.,1.1025641025641026,0.0390945794678847,78,71,6,1,False,True,41
877,I miss my green bubbles,1.1025641025641026,0.0390945794678847,78,71,6,1,False,False,23
877,Am I the eggplant?,1.1025641025641026,0.0390945794678847,78,71,6,1,True,True,18
877,No one told me that this was an emoji party … I left mine at home.,1.1025641025641026,0.0345743519211918,78,70,8,0,False,True,66
877,I can’t face Gen Z’s anymore.,1.1025641025641026,0.0345743519211918,78,70,8,0,False,True,29
877,You haven't downloaded the latest Software Update?,1.1022727272727273,0.0397213804993674,88,81,5,2,True,True,50
877,I've got all the feels.,1.1022727272727273,0.0397213804993674,88,81,5,2,False,True,23
877,IYKYK,1.1022727272727273,0.0397213804993674,88,81,5,2,False,False,5
877,So I guess I'm the odd one,1.1020408163265305,0.0307347293622136,98,88,10,0,False,False,26
877,Then he texts me that I’m emotionally insecure,1.1020408163265305,0.0339855414065058,98,89,8,1,False,False,46
877,Wait! What? I thought we all agreed that 7:00 was best.,1.1014492753623188,0.0468301584551483,69,64,3,2,True,True,55
877,"Who knew if you made an ""Emoji"" face, it would stay like that.",1.1012658227848102,0.034158577388959,79,71,8,0,False,True,62
877,Do you ever get tired of _representing_?,1.1012658227848102,0.0386183680916298,79,72,6,1,True,True,40
877,Let’s just be ourselves!,1.1012658227848102,0.0426139448876036,79,73,4,2,False,True,24
877,"It’s all right for you lot, but I didn’t get it!",1.1012658227848102,0.034158577388959,79,71,8,0,False,True,48
877,This way I can stay anonymous.,1.1012658227848102,0.034158577388959,79,71,8,0,False,True,30
877,No comment.,1.1012658227848102,0.0386183680916298,79,72,6,1,False,True,11
877,Make it a ??.,1.1012658227848102,0.0386183680916298,79,72,6,1,True,True,13
877,I left my heart in San Francisco.,1.1012658227848102,0.0386183680916298,79,72,6,1,False,True,33
877,"C'mon guys, you took all the best emotional cues.",1.1012658227848102,0.0386183680916298,79,72,6,1,False,True,49
877,Were's the emoji for RBF!,1.1012658227848102,0.0386183680916298,79,72,6,1,False,True,25
877,Plain Jane having difficulty with how her colleagues see her--the usual self-image crisis!,1.1012658227848102,0.034158577388959,79,71,8,0,False,True,90
877,Guys chill. I just said I won't be able to make it to the party,1.1012658227848102,0.0386183680916298,79,72,6,1,False,False,63
877,Does the limits of my language mean the limits of my world?,1.1012658227848102,0.034158577388959,79,71,8,0,True,True,59
877,Why do I keep getting the poo emoji?,1.101123595505618,0.0321391884015368,89,80,9,0,True,True,36
877,"Hothead says, 'That's just Peachy.'",1.101123595505618,0.0392893453869599,89,82,5,2,False,False,35
877,"I suggest we start with ""O little town of Bethlehem"" - Peach, can you give us an A?""",1.101123595505618,0.035892757570611,89,81,7,1,True,False,84
877,"I don't think auditioning to the mask singer is a good idea,
the judges will have a hard time to figure out our costumes..",1.101123595505618,0.0321391884015368,89,80,9,0,False,True,122
877,"Is the art of conversation dead? 
Plain Jane wondered ,when her friends texted emojis after she asked, ""How ya guys doin' ?""",1.101123595505618,0.0392893453869599,89,82,5,2,True,False,124
877,I thought you chose a pumpkin head.,1.101123595505618,0.035892757570611,89,81,7,1,False,True,35
877,A group selfie would probably send the wrong message.,1.101123595505618,0.0392893453869599,89,82,5,2,False,True,53
877,This was not how Ann envisioned her Emoticon Wrapped 2023 to look like.,1.101123595505618,0.0321391884015368,89,80,9,0,False,True,71
877,What if my phone can only handle emoticons?,1.1,0.0317999364001907,90,81,9,0,True,True,43
877,Can’t I wait for an avatar update?,1.1,0.0420969345526984,80,74,4,2,True,True,34
877,Am I the only one here with an Android?,1.1,0.0420969345526984,80,74,4,2,True,True,39
877,I guess this means the orgy's a go?,1.1,0.0381535870205101,80,73,6,1,True,True,35
877,No thanks. I'm looking for the Israeli hostage emoji.,1.1,0.0461790555986524,70,65,3,2,False,True,53
877,Hot heads & fruit cakes,1.1,0.0381535870205101,80,73,6,1,False,False,23
877,"So....what? 
I'm the only one out ? !",1.1,0.0337526370277806,80,72,8,0,True,True,37
877,They say you are what you text,1.1,0.0337526370277806,80,72,8,0,False,False,30
877,How did you do that? I couldn’t find that app at the App Store!,1.1,0.0381535870205101,80,73,6,1,True,True,63
877,We all suffer from our own idiosyncrasies.,1.1,0.0381535870205101,80,73,6,1,False,True,42
877,Wait! You want me to wear the poop emoji?,1.1,0.0355094895090524,90,82,7,1,True,True,41
877,Someone please call me an ?,1.1,0.0355094895090524,90,82,7,1,True,True,27
877,Doesn't Pixar cast humans anymore?,1.1,0.0355094895090524,90,82,7,1,True,True,34
877,You ever notice there's no sociopath emoji?,1.1,0.0504636884396263,70,66,1,3,True,True,43
877,I knew this was putting off the software update for a reason.,1.1,0.0414539081515265,70,64,5,1,False,True,61
877,Oh!  did I just read we are being accused of being com-formative.,1.1,0.0337526370277806,80,72,8,0,False,True,65
877,Why won’t you FaceTime?,1.1,0.0381535870205101,80,73,6,1,True,True,23
877,"But my old iPhone won't support the ""Design Your New Head"" upgrade!",1.1,0.0337526370277806,80,72,8,0,False,True,67
877,I still wound't look cool like you guys.,1.1,0.0337526370277806,80,72,8,0,False,True,40
877,"Macy's Thanksgiving Day Parade said no""

By Thomas Sievers",1.1,0.0355094895090524,90,82,7,1,False,False,58
877,How many of there are you?,1.1,0.0381535870205101,80,73,6,1,True,True,26
877,Flip phone :(,1.1,0.0461790555986524,70,65,3,2,False,False,13
877,This one’s interesting. Must love interminable meaningless snippets of anonymous banter……,1.1,0.0317999364001907,90,81,9,0,False,False,89
877,My emoji stays on my phone,1.1,0.0355094895090524,90,82,7,1,False,False,26
877,Anyone to just like me?,1.1,0.0337526370277806,80,72,8,0,True,True,23
877,But my daughter says you’re all too cheugy now!,1.1,0.0388665889335664,90,83,5,2,False,True,47
877,This isn't what I meant when I asked for help facing my fears.,1.1,0.0461790555986524,70,65,3,2,False,True,62
877,"Not sure why I downloaded Grindr, but I got mushroom, Ferris wheel, and matryoshka 🍄🎡🪆",1.1,0.0337526370277806,80,72,8,0,False,False,86
877,Yes. We are also the 4 horsemen. Kinda.,1.1,0.0355094895090524,90,82,7,1,False,True,39
877,It was at this moment Karen asked to speak to the emoji manager,1.1,0.0381535870205101,80,73,6,1,False,False,63
877,It must be a generational thing.,1.098901098901099,0.0351342968740858,91,83,7,1,False,True,32
877,I can't tell what's ahead any longer.,1.098901098901099,0.0314677386006073,91,82,9,0,False,True,37
877,"Despite being the only DJ left in the world who didn't wear a mask, Jaclyn still didn't get it.",1.098901098901099,0.0351342968740858,91,83,7,1,False,True,95
877,Why do I have to be the handgun emoji?,1.098901098901099,0.0351342968740858,91,83,7,1,True,True,38
877,It’s not Halloween but it’s Halllwmene!,1.0987654320987654,0.0333561878669291,81,73,8,0,False,True,39
877,Wait a minute.  Search what?,1.0987654320987654,0.0333561878669291,81,73,8,0,True,True,28
877,I can relate.  This morning I woke up with a song from ABBA playing in my head.,1.0987654320987654,0.0376998308261789,81,74,6,1,False,True,79
877,So I have to go into the office to access the full range of emojis?,1.0987654320987654,0.0333561878669291,81,73,8,0,True,True,67
877,I guess I am the only one that has not upgraded.,1.0987654320987654,0.0376998308261789,81,74,6,1,False,True,48
877,bratting has gotten overwhelmingly complicated,1.0987654320987654,0.0333561878669291,81,73,8,0,False,False,46
877,Where’s the blushing thanks but no thanks with polite conviction?,1.0987654320987654,0.0333561878669291,81,73,8,0,True,True,65
877,Doesn’t anybody communicate anymore,1.0987654320987654,0.0415922975998099,81,75,4,2,False,False,35
877,Do I need a decoder ring or just a really open mind?!,1.0987654320987654,0.0376998308261789,81,74,6,1,True,True,53
877,I can’t with these characters.,1.0987654320987654,0.0376998308261789,81,74,6,1,False,True,30
877,All that’s left is eggplant?!,1.0985915492957747,0.0408901437281721,71,65,5,1,True,True,29
877,sooo...wyd?,1.0985915492957747,0.0356312975793619,71,64,7,0,True,True,11
877,"What do we have here?   One hot head, two Amazon smerks, a vertical smile and my astonishment.",1.0985915492957747,0.0455457829116165,71,66,3,2,True,True,94
877,Whatever happened to just coming out and saying it?,1.0985915492957747,0.0408901437281721,71,65,5,1,True,True,51
877,Do I really have to be the eggplant emoji?,1.0985915492957747,0.0408901437281721,71,65,5,1,True,True,42
877,is this part of Spotify wrapped this year?,1.0985915492957747,0.0408901437281721,71,65,5,1,True,True,42
877,"So, does this mean that I’m hot or that I’m cool?",1.0985915492957747,0.0356312975793619,71,64,7,0,True,True,49
877,I have not yet lost my head!,1.0978260869565215,0.0347669279034979,92,84,7,1,False,True,28
877,I can’t decide between the ? and the ?.,1.0978260869565215,0.0347669279034979,92,84,7,1,True,True,39
877,Nobody has the new iOS update?,1.0978260869565215,0.0347669279034979,92,84,7,1,True,True,30
877,"What's the word---logo, symbol, icon, AVATAR, that's IT!",1.0975609756097562,0.0372567129671206,82,75,6,1,False,True,56
877,"All these emojis have gone to your head.""",1.0975609756097562,0.0329689026032423,82,74,8,0,False,False,41
877,The emoji filter really has gone too far.,1.0975609756097562,0.0372567129671206,82,75,6,1,False,True,41
877,i couldnt think of a caption sorry,1.0975609756097562,0.0410995959027184,82,76,4,2,False,False,34
877,Do you think I'm more face screaming in fear or person with exploding head?,1.0975609756097562,0.0372567129671206,82,75,6,1,True,True,75
877,Open with a $500 bid.,1.0975609756097562,0.0329689026032423,82,74,8,0,False,True,21
877,This is so dumb. Do better.,1.0975609756097562,0.0372567129671206,82,75,6,1,False,True,27
877,Please don't text Poop our location.,1.0975609756097562,0.0372567129671206,82,75,6,1,False,True,36
877,Your guys plastic surgeon is clearly spending too much time on Facebook.,1.0975609756097562,0.0372567129671206,82,75,6,1,False,True,72
877,I wonder sometimes if I’m getting TOO in touch with my feelings.,1.0975609756097562,0.0329689026032423,82,74,8,0,False,True,64
877,The people who look down,1.0972222222222223,0.0403414719518496,72,66,5,1,False,False,24
877,What's the human emoji look like?,1.0972222222222223,0.0403414719518496,72,66,5,1,True,True,33
877,Let's not bang heads!,1.0972222222222223,0.0351596082531163,72,65,7,0,False,True,21
877,I feel like such a boomer…LOL.,1.0972222222222223,0.0351596082531163,72,65,7,0,False,True,30
877,"What's the right emoji to show you're lame with emojis?""",1.0972222222222223,0.0351596082531163,72,65,7,0,True,False,56
877,"Harry, you need to chill out and stop starting at the ass on that peach",1.0972222222222223,0.0449296190276652,72,67,3,2,False,False,71
877,I don't know what to say.  It really didn't make much of an impression on me.,1.0972222222222223,0.0449296190276652,72,67,3,2,False,True,77
877,They don’t have an emoji for ennui.,1.0972222222222223,0.0351596082531163,72,65,7,0,False,True,35
877,"Shit, my phone died!",1.096774193548387,0.0344071411564538,93,85,7,1,False,True,20
877,Why we don't really talk to each other any more.,1.0963855421686748,0.0368238647055129,83,76,6,1,False,True,48
877,I can't believe you guys are accusing *me* of being so emojinal all the time...,1.0963855421686748,0.0325904687229191,83,75,8,0,False,True,79
877,I don't know what to say.,1.0963855421686748,0.0368238647055129,83,76,6,1,False,True,25
877,These mememojis are getting out of hand,1.0963855421686748,0.0325904687229191,83,75,8,0,False,False,39
877,And I thought the green bubble was bad,1.0963855421686748,0.0406184117380317,83,77,4,2,False,False,38
877,"I don't think even Carl Jung himself could've predicted that MBTI would end up having an 'Anonymous' group.""",1.0963855421686748,0.0406184117380317,83,77,4,2,False,False,108
877,If anyone Rick rolls me again I’m leaving this chat.,1.0963855421686748,0.0325904687229191,83,75,8,0,False,True,52
877,"So your answer is 'Happy Face, Flame, Devil, Peach?' There is no way to feel all of these feelings at once! Do you remember words? Please use your words!",1.0963855421686748,0.0368238647055129,83,76,6,1,True,True,153
877,Eh? I’m just surrounded by boxed question marks.. my phone is 2 years old”,1.0963855421686748,0.0368238647055129,83,76,6,1,True,False,74
877,Not sure how I’m supposed to feel about this.,1.0963855421686748,0.0406184117380317,83,77,4,2,False,True,45
877,Does any have an android charger?,1.095890410958904,0.0398072962880426,73,67,5,1,True,True,33
877,Just me today. Poop’s playing golf.,1.095890410958904,0.0443298809108392,73,68,3,2,False,True,35
877,My friends don't understand me.,1.095890410958904,0.0398072962880426,73,67,5,1,False,True,31
877,OMG !! FOMO !!,1.095890410958904,0.0347001921314398,73,66,7,0,False,True,14
877,I can’t believe they cancelled the melting face emoji.,1.095890410958904,0.0347001921314398,73,66,7,0,False,True,54
877,I feel so old when I’m with you guys,1.095890410958904,0.0347001921314398,73,66,7,0,False,False,36
877,Something happened to my phone! I seem to be out of emojis.,1.095890410958904,0.0443298809108392,73,68,3,2,False,True,59
877,"I'll never us an emoji again.""",1.095890410958904,0.0347001921314398,73,66,7,0,False,False,30
877,There goes are Uber.,1.095890410958904,0.0443298809108392,73,68,3,2,False,True,20
877,Emotionally stunted,1.095890410958904,0.0398072962880426,73,67,5,1,False,False,19
877,Hey guys...I'd be so EXMOJIED if we'd have one lunch WIITHOUT our phones and ACTUALLY CONVERSE!!,1.0957446808510638,0.0372626291543722,94,87,5,2,False,True,96
877,"It’s not easy to stay a-head of societal trends. 

-Taylor S.
Boston, Mass",1.0952380952380951,0.0322205876812368,84,76,8,0,False,False,74
877,"You bobblehead folks need to get a life and stop sending selfies to you X friends""",1.0952380952380951,0.0364009340974807,84,77,6,1,False,False,82
877,"Your ""get ahead"" app really responds quickly!",1.0952380952380951,0.0322205876812368,84,76,8,0,False,True,45
877,"Oh no, one bite and I'm next!",1.0952380952380951,0.0322205876812368,84,76,8,0,False,True,29
877,This is so frustrating -- the only emoji my phone will let me project is Mickey Mouse.,1.0952380952380951,0.0322205876812368,84,76,8,0,False,True,86
877,I am beginning to feel like the odd one out,1.0952380952380951,0.0364009340974807,84,77,6,1,False,False,43
877,Help!  I mistakenly used my own ID.,1.0952380952380951,0.0364009340974807,84,77,6,1,False,True,35
877,Y’all really are the ‘emo’ in emoji.,1.0952380952380951,0.0401483466137025,84,78,4,2,False,True,36
877,"Yes, Eggplant and Taco are always late.",1.0952380952380951,0.0364009340974807,84,77,6,1,False,True,39
877,"Folded-Hands I get the invitation, or I'll be Pile-of-Poo.",1.0952380952380951,0.0322205876812368,84,76,8,0,False,True,58
877,Do you guys always react to eggplant this way?,1.0947368421052632,0.0368820771803751,95,88,5,2,True,True,46
877,I pray nobody is working on a nuclear detonation emoji.,1.0947368421052632,0.0302052857240613,95,86,9,0,False,True,55
877,What if I feel the same way as one of you?,1.0945945945945943,0.034252578598678,74,67,7,0,True,True,42
877,I’m having so many emotions.,1.0945945945945943,0.0392870511441644,74,68,5,1,False,True,28
877,Jane realizes she picked up an iCON instead of her iPHONE,1.0945945945945943,0.0437459213475927,74,69,3,2,False,False,57
877,"Is this the Overcommitters Anonymous meeting?""",1.0945945945945943,0.0437459213475927,74,69,3,2,True,False,46
877,Does the peach head patch the drapes?,1.0945945945945943,0.034252578598678,74,67,7,0,True,True,37
877,I am so introverted I don’t seem to be able to create an avatar.,1.0945945945945943,0.0392870511441644,74,68,5,1,False,True,64
877,"One of you, just one of you, look me in the eye and tell me how you really feel.",1.0945945945945943,0.034252578598678,74,67,7,0,False,True,80
