contest,caption,mean,precision,votes,not_funny,somewhat_funny,funny,has_question_mark,ends_with_punctuation,caption_length
682,"I hate to leave you, its been lovely",1.1375,0.0387451507786556,80,69,11,0,False,False,36
682,Hold on dearest Leif.,1.1375,0.0387451507786556,80,69,11,0,False,True,21
682,"Sorry to break this off, but I've got a date with the handsome guy with the rake in the two-flat.",1.1375,0.0426338176224378,80,70,9,1,False,True,97
682,"It's too late, I had no pride to begin with!",1.1375,0.0426338176224378,80,70,9,1,False,True,44
682,Not if I see you fiiiiiiiiirst.....!,1.1375,0.0461962996490608,80,71,7,2,False,True,36
682,I hate leafing you. Maybe we will meet again on the pile,1.1375,0.0387451507786556,80,69,11,0,False,False,56
682,My dad was a paratrooper but they said I was too green for the job.,1.1375,0.0387451507786556,80,69,11,0,False,True,67
682,See you in hell BITCH!,1.1375,0.0426338176224378,80,70,9,1,False,True,22
682,Don’t forget to rake!,1.1375,0.0387451507786556,80,69,11,0,False,True,21
682,Ohhhhh......I didn't want to be just one of many.....,1.1375,0.0387451507786556,80,69,11,0,False,True,53
682,"I knew you'd love me and leaf me.""",1.1375,0.0426338176224378,80,70,9,1,False,False,34
682,Bye! I’ll be joining Marty now.,1.1375,0.0387451507786556,80,69,11,0,False,True,31
682,I've never liked the idea of conforming.,1.1375,0.0387451507786556,80,69,11,0,False,True,40
682,Hey....don’t leaf me all alone!,1.1375,0.0461962996490608,80,71,7,2,False,True,31
682,"For God's sake, Felix, you can't just keep floating around like a leaf in the wind!",1.1375,0.0461962996490608,80,71,7,2,False,True,83
682,I thought you said this would be fun.,1.1375,0.0426338176224378,80,70,9,1,False,True,37
682,"Well, it's been Nice Knowing You for the year....
But it looks like we need to Split Up...
Cheers",1.1375,0.0387451507786556,80,69,11,0,False,False,97
682,I'm sorry to leave you but I have reservations at the place we watched blossom across the street.,1.1375,0.0426338176224378,80,70,9,1,False,True,97
682,"Ah, if we once go to see them in the city!",1.1375,0.0426338176224378,80,70,9,1,False,True,42
682,"Goodbye Taylor, it's time we broke off this relationship.",1.1375,0.0387451507786556,80,69,11,0,False,True,57
682,Noooo! I’m leafing you!,1.1375,0.0426338176224378,80,70,9,1,False,True,23
682,I can't be-leaf we're breaking up like this!,1.1375,0.0387451507786556,80,69,11,0,False,True,44
682,Sorry to be leafing you! Hope you enjoy your alone time before the reunion down there.,1.1375,0.0426338176224378,80,70,9,1,False,True,86
682,"Just give me a little time, I could fall  for you.",1.1375,0.0387451507786556,80,69,11,0,False,True,50
682,...and then he felt truly and absolutely leafed behind,1.1375,0.0387451507786556,80,69,11,0,False,False,54
682,Finally finished my photosynthesis!,1.1375,0.0461962996490608,80,71,7,2,False,True,35
682,Didn't you hear the rumors of coming winter?,1.1375,0.0387451507786556,80,69,11,0,True,True,44
682,Last One out of Beech City...,1.1375,0.0387451507786556,80,69,11,0,False,True,29
682,"If I see her, I'll tell her to meet you here.",1.1375,0.0387451507786556,80,69,11,0,False,True,45
682,"Goodbye, Donald. It’s just you alone now.",1.1375,0.0426338176224378,80,70,9,1,False,True,41
682,We're drop dead gorgeous!,1.1375,0.0461962996490608,80,71,7,2,False,True,25
682,"I hope for cremation, not compose.",1.1375,0.0426338176224378,80,70,9,1,False,True,34
682,Dave don't leaf me!,1.1375,0.0387451507786556,80,69,11,0,False,True,19
682,Till we meet again...,1.1375,0.0426338176224378,80,70,9,1,False,True,21
682,Time to migrate “Down under”… the snow!,1.1375,0.0387451507786556,80,69,11,0,False,True,39
682,Why do all my girlfriends leaf me?,1.1375,0.0387451507786556,80,69,11,0,True,True,34
682,"Sorry to leave, but  I couldn't help falling. 'Tis the season!",1.1375,0.0387451507786556,80,69,11,0,False,True,62
682,See you next autumn.,1.1375,0.0495030685661843,80,72,5,3,False,True,20
682,"One leaf falling from the tree, one leaf falling",1.1375,0.0387451507786556,80,69,11,0,False,False,48
682,See you in the next world,1.1375,0.0387451507786556,80,69,11,0,False,False,25
682,"There IS a town compost site,isn't there?",1.1375,0.0426338176224378,80,70,9,1,True,True,41
682,I think this is the end of our relationship!,1.1375,0.0461962996490608,80,71,7,2,False,True,44
682,At least this year John swapped his rake for a blower.,1.1375,0.0387451507786556,80,69,11,0,False,True,54
682,"Oh, my, I am about to leaf you behind.",1.1375,0.0387451507786556,80,69,11,0,False,True,38
682,I call shotgun!,1.1375,0.0426338176224378,80,70,9,1,False,True,15
682,"Forget about their Autumn promotion, you have to cancel cable.",1.1375,0.0387451507786556,80,69,11,0,False,True,62
682,Don't worry - I'm fine with Salutatorian.  Congratulations!,1.1375,0.0461962996490608,80,71,7,2,False,True,59
682,Reincarnation here I come!,1.1375,0.0387451507786556,80,69,11,0,False,True,26
682,"On Oh, looks like I'm going to leaf you hanging.",1.1375,0.0387451507786556,80,69,11,0,False,True,48
682,Hope we end up in the Smith’s mulch pile.,1.1375,0.0387451507786556,80,69,11,0,False,True,41
682,I thought you said you were falling for me too!,1.1375,0.0387451507786556,80,69,11,0,False,True,47
682,"'That why they call it 'fall' is all you got to say?""",1.1375,0.0387451507786556,80,69,11,0,True,False,53
682,"No, not that trunk. The other trunk.",1.1375,0.0387451507786556,80,69,11,0,False,True,36
682,"Did you ever think, when you were just a sap-sucking little bud that it would all end like this?""",1.1375,0.0387451507786556,80,69,11,0,True,False,97
682,You get the rest of the wine.,1.1375,0.0461962996490608,80,71,7,2,False,True,29
682,Remember to turn off the lights.,1.1375,0.0426338176224378,80,70,9,1,False,True,32
682,Maybe it's the fact that we weren't meant to be that I am falling because of you.,1.1375,0.0387451507786556,80,69,11,0,False,True,81
682,I have this sinking feeling.,1.1375,0.0387451507786556,80,69,11,0,False,True,28
682,Don't be afraid.  Just let go.  You'll just flutter down.  Like this.,1.1375,0.0387451507786556,80,69,11,0,False,True,69
682,Peace Out!,1.1375,0.0426338176224378,80,70,9,1,False,True,10
682,Is this why they call it fall?,1.1375,0.0426338176224378,80,70,9,1,True,True,30
682,It won't hurt when you hit the ground because you will be dead.,1.1375,0.0426338176224378,80,70,9,1,False,True,63
682,I'm leafing you for good this time!,1.1375,0.0461962996490608,80,71,7,2,False,True,35
682,We'll be back in a few months,1.1375,0.0426338176224378,80,70,9,1,False,False,29
682,"Oh no I think I’m falling for him, again!",1.1375,0.0426338176224378,80,70,9,1,False,True,41
682,"Maine or Florida...?...Your call, Mr. Know-It-All.",1.1375,0.0426338176224378,80,70,9,1,True,True,50
682,"No, no, no... billionaires don’t fall!",1.1375,0.0387451507786556,80,69,11,0,False,True,38
682,"I am just “leaving”, and I may be some time.",1.1375,0.0387451507786556,80,69,11,0,False,True,44
682,"Remember, don't land near the lawn mower!",1.1375,0.0387451507786556,80,69,11,0,False,True,41
682,I'm not a leaves person!,1.1375,0.0426338176224378,80,70,9,1,False,True,24
682,"When you fall flat on your face, don't bother coming back.",1.1375,0.0461962996490608,80,71,7,2,False,True,58
682,I'm hoping for a plastic bag over a fire.,1.1375,0.0426338176224378,80,70,9,1,False,True,41
682,"I'll never let go, I promise",1.1375,0.0426338176224378,80,70,9,1,False,False,28
682,I wouldn’t hang around this place much longer.,1.1375,0.0387451507786556,80,69,11,0,False,True,46
682,I thought we going on 3.......!,1.1375,0.0426338176224378,80,70,9,1,False,True,31
682,Don’t be a tough guy.  Don’t be a fool.  I will call you later.,1.1375,0.0387451507786556,80,69,11,0,False,True,63
682,Haven't you heard?  It's time for the fall.,1.1375,0.0426338176224378,80,70,9,1,True,True,43
682,...like I said: hold out so you don’t “drop”!,1.1375,0.0387451507786556,80,69,11,0,False,True,45
682,"It's just a matter of time now, and there's nothing you can do about it.",1.1375,0.0387451507786556,80,69,11,0,False,True,72
682,I THINK WE ARE FALLING,1.1375,0.0426338176224378,80,70,9,1,False,False,22
682,"They are all there but one - I, Chingachgook , Last of the Mohicans",1.1375,0.0426338176224378,80,70,9,1,False,False,67
682,Who knows? The salad days may be yet to come.,1.1375,0.0426338176224378,80,70,9,1,True,True,45
682,"Ok, sweetheart, I lied about one little thing: I am scared of heights!",1.1375,0.0387451507786556,80,69,11,0,False,True,70
682,Next year I'm opening a new branch office.,1.1375,0.0426338176224378,80,70,9,1,False,True,42
682,"I'd like to say something poignant, profound, or funny, but after so many seasons of the same scene, it's all been said.",1.1375,0.0426338176224378,80,70,9,1,False,True,120
682,"Meet me later at ""The Mulch"".",1.1375,0.0387451507786556,80,69,11,0,False,True,29
682,I've gotta go now. Hope to see you in the compost bin.,1.1375,0.0387451507786556,80,69,11,0,False,True,54
682,I thought I had more time.,1.1375,0.0387451507786556,80,69,11,0,False,True,26
682,But you said O. Henry drew us!,1.1375,0.0426338176224378,80,70,9,1,False,True,30
682,What do you mean you got busy and just forgot? You had all summer to book us a spot!,1.1375,0.0387451507786556,80,69,11,0,True,True,84
682,It’s fall time baby.,1.1375,0.0461962996490608,80,71,7,2,False,True,20
682,"No collusion! It was a perfect conversation. I’m not a puppet, I’m a leaf! I must be the worst treated leaf in the history of leaves! This is a witch hunt and they’re gonna burn me...",1.1375,0.0387451507786556,80,69,11,0,False,True,183
682,If all your friends jumped off th--DAVE NO!,1.1375,0.0387451507786556,80,69,11,0,False,True,43
682,There's something I've been wanting to tell you for a long time.,1.1375,0.0426338176224378,80,70,9,1,False,True,64
682,"My time has come at last
to join the ""Leaves of Grass""!",1.1375,0.0426338176224378,80,70,9,1,False,True,55
682,It seems more like a Poisson distribution.,1.1375,0.0387451507786556,80,69,11,0,False,True,42
682,.... is it Spring back and Fall forward - I always get that mnemonic mixed up ...,1.1375,0.0426338176224378,80,70,9,1,False,True,81
682,Every branch has a silver lining,1.1375,0.0426338176224378,80,70,9,1,False,False,32
682,"I told you, it's Logan's Run for real!",1.1375,0.0387451507786556,80,69,11,0,False,True,38
682,"Tis a far, far better thing I do......",1.1375,0.0426338176224378,80,70,9,1,False,True,38
682,"Don't forget, Russell, last one who leaves turns out the lightest.",1.1375,0.0387451507786556,80,69,11,0,False,True,66
682,"Come Spring, I promise you that I'll turn over a new leaf.",1.1375,0.0387451507786556,80,69,11,0,False,True,58
682,"Well, obviously you don’t want to be part of the fall crowd!",1.1375,0.0426338176224378,80,70,9,1,False,True,60
682,I had a feeling I'd be the first to go.,1.1375,0.0387451507786556,80,69,11,0,False,True,39
682,I am not lief to leave you brother leaf.,1.1375,0.0387451507786556,80,69,11,0,False,True,40
682,"OH  MY GOD, I’m going to Fall",1.1375,0.0387451507786556,80,69,11,0,False,False,29
682,"Corporate said it’s fall, but come on.",1.1375,0.0426338176224378,80,70,9,1,False,True,38
682,See you in hell when they burn us to a crisp.,1.1375,0.0387451507786556,80,69,11,0,False,True,45
682,"Sorry, John. I’m leafing you.",1.1375,0.0426338176224378,80,70,9,1,False,True,29
682,I didn't  LITERALLY mean for you to leaf  me alone.,1.1375,0.0387451507786556,80,69,11,0,False,True,51
682,We said on threeeee!,1.1375,0.0387451507786556,80,69,11,0,False,True,20
682,Tis the season for separation anxiety,1.1375,0.0426338176224378,80,70,9,1,False,False,37
682,I think I'll go for a reverse two and a half followed by a pike.,1.1375,0.0387451507786556,80,69,11,0,False,True,64
682,"Gotta go now!  You think that's why they call us ""leaves""?",1.1375,0.0426338176224378,80,70,9,1,True,True,58
682,The shredder waits for no leaf.,1.1375,0.0387451507786556,80,69,11,0,False,True,31
682,"Ugh, I’m just not in the mood to be social.",1.1375,0.0387451507786556,80,69,11,0,False,True,43
682,Sorry I have to 'leaf' like this.,1.1375,0.0426338176224378,80,70,9,1,False,True,33
682,The horror! The horror!,1.1375,0.0387451507786556,80,69,11,0,False,True,23
682,I warned them about climate change.,1.1375,0.0387451507786556,80,69,11,0,False,True,35
682,Don't be a lemming!,1.1375,0.0387451507786556,80,69,11,0,False,True,19
682,Will you marry me???,1.1375,0.0426338176224378,80,70,9,1,True,True,20
682,We should have invested in evergreens.,1.1375,0.0426338176224378,80,70,9,1,False,True,38
682,I haaavve chaaannged!,1.1375,0.0387451507786556,80,69,11,0,False,True,21
682,"""Don't over think it""",1.1375,0.0426338176224378,80,70,9,1,False,False,21
682,Remember me in therapy,1.1375,0.0426338176224378,80,70,9,1,False,False,22
682,Please promise me you will have me properly cremated.,1.1375,0.0294665117795726,80,72,7,1,False,True,53
682,"I know it's the autumn of our lives, but I'm still leafing you!",1.1375,0.0387451507786556,80,69,11,0,False,True,63
682,How did I fall for that?,1.1375,0.0387451507786556,80,69,11,0,True,True,24
682,Don't forget to lock the door.,1.1375,0.0387451507786556,80,69,11,0,False,True,30
682,"I didn’t wanna give in to peer pressure, Jerry, but I’m staying here with just you.",1.1375,0.0426338176224378,80,70,9,1,False,True,83
682,You knew I'd eventually fall for you.,1.1375,0.0387451507786556,80,69,11,0,False,True,37
682,"This is my gift, this is my cuuuurrrrsssseeee!",1.1375,0.0461962996490608,80,71,7,2,False,True,46
682,- You said you would never leave me...!,1.1375,0.0426338176224378,80,70,9,1,False,True,39
682,"Oh no, my stem is showing!",1.1375,0.0387451507786556,80,69,11,0,False,True,26
682,"Martha, I always thought you’d go before meeee……",1.1375,0.0387451507786556,80,69,11,0,False,False,48
682,I know I said I would never leave you..,1.1375,0.0426338176224378,80,70,9,1,False,True,39
682,Sorry about the break  up.,1.1375,0.0387451507786556,80,69,11,0,False,True,26
682,Do you believe in reincarnation?,1.1375,0.0387451507786556,80,69,11,0,True,True,32
682,It’s not your fault. I changed.,1.1375,0.0387451507786556,80,69,11,0,False,True,31
682,Now I understand what it means to fall for someone.,1.1375,0.0426338176224378,80,70,9,1,False,True,51
682,Vive la Tontine!,1.1375,0.0426338176224378,80,70,9,1,False,True,16
682,What a re-leaf,1.1375,0.0387451507786556,80,69,11,0,False,False,14
682,I leave you with your reincarnation theory.,1.1375,0.0426338176224378,80,70,9,1,False,True,43
682,"Finally, I can leave! I thought the year was never going to end.",1.1375,0.0426338176224378,80,70,9,1,False,True,64
682,"Oh, dear.  I knew it.  Pride cometh before the fall.",1.1375,0.0387451507786556,80,69,11,0,False,True,52
682,Whoa . . . death do us part!,1.1375,0.0387451507786556,80,69,11,0,False,True,28
682,"Well, it's time to turn a new leaf Larry!",1.1375,0.0461962996490608,80,71,7,2,False,True,41
682,I'm leafing you––and anyway you've always hated my puns.,1.1375,0.0426338176224378,80,70,9,1,False,True,56
682,"I never told you I have ""Fear of Flying""",1.1375,0.0387451507786556,80,69,11,0,False,False,40
682,I'm falling for you and that's exactly why I must leave.,1.1375,0.0461962996490608,80,71,7,2,False,True,56
682,"They say it's not the impact that gets you, but rather the heart attack on the way down.",1.1375,0.0426338176224378,80,70,9,1,False,True,88
682,We weren't right for each other anyway.,1.1375,0.0426338176224378,80,70,9,1,False,True,39
682,See you when you catch your wind.,1.1358024691358024,0.0456539804619767,81,72,7,2,False,True,33
682,You were a great neighbor. I’ll miss you.,1.1358024691358024,0.0383014618703421,81,70,11,0,False,True,41
682,Now I know why they call it the fall.,1.1358024691358024,0.0383014618703421,81,70,11,0,False,True,37
682,I guess this means we aren’t hanging out after all.,1.1358024691358024,0.0383014618703421,81,70,11,0,False,True,51
682,"Goodbye, my love",1.1358024691358024,0.0383014618703421,81,70,11,0,False,False,16
682,Did I tell you I'm falling for you?,1.1358024691358024,0.0421383905330272,81,71,9,1,True,True,35
682,"I know, I know. You don't have to tell me. It's Fear Of Missing Out.",1.1358024691358024,0.0421383905330272,81,71,9,1,False,True,68
682,"I know I’m one of the few, but I hate the fall.",1.1358024691358024,0.0421383905330272,81,71,9,1,False,True,47
682,...and I thought you said fall was only a noun!,1.1358024691358024,0.0421383905330272,81,71,9,1,False,True,47
682,Congrats. You get the million bucks,1.1358024691358024,0.0421383905330272,81,71,9,1,False,False,35
682,My attorney has the will!,1.1358024691358024,0.0421383905330272,81,71,9,1,False,True,25
682,Maybe I'll see you again someday.,1.1358024691358024,0.0383014618703421,81,70,11,0,False,True,33
682,"Wait!  What do you mean, 'It's not how we fall but how we pick ourselves up again?'",1.1358024691358024,0.0383014618703421,81,70,11,0,True,False,83
682,"Hopefully, I'll see you next year...",1.1358024691358024,0.0383014618703421,81,70,11,0,False,True,36
682,Woooooaoooaooooaoaoaa,1.1358024691358024,0.0421383905330272,81,71,9,1,False,False,21
682,I hate to leave now that I've fallen for you.,1.1358024691358024,0.0421383905330272,81,71,9,1,False,True,45
682,"Wait, don't leave so soon.",1.1358024691358024,0.0383014618703421,81,70,11,0,False,True,26
682,See you in Capistrano!,1.1358024691358024,0.0456539804619767,81,72,7,2,False,True,22
682,Let’s try to be a spruce in our next incarnation.,1.1358024691358024,0.0421383905330272,81,71,9,1,False,True,49
682,I don't care what you say. I'm going!  Whee!!!!!,1.1358024691358024,0.0456539804619767,81,72,7,2,False,True,48
682,Watch me go down...I am a champion flutterer !,1.1358024691358024,0.0383014618703421,81,70,11,0,False,True,46
682,I’m leafing you and taking the kids.,1.1358024691358024,0.0383014618703421,81,70,11,0,False,True,36
682,Be sure to tell Chlora and Phil I’ll see them next spring.,1.1358024691358024,0.0421383905330272,81,71,9,1,False,True,58
682,"Don't be scared. After the first big drop, the ride's a breeze.",1.1358024691358024,0.0383014618703421,81,70,11,0,False,True,63
682,I just can't take your annoying updates any more.  You think you're the only one losing color?,1.1358024691358024,0.0421383905330272,81,71,9,1,True,True,94
682,So this is it! Proof that we are mediocre like everyone,1.1333333333333333,0.0438397299480952,75,66,8,1,False,False,55
682,"Uh uh - you get the last man standing prize (good for a few seconds, don't waste it)",1.1333333333333333,0.0395165985575879,75,65,10,0,False,False,84
682,"Supposedly the branches are cheaper in Boise, plus my buddy says I can stay with him",1.1333333333333333,0.0438397299480952,75,66,8,1,False,False,84
682,If you're lucky they'll rake the lawns before you land.,1.1333333333333333,0.0477732381389652,75,67,6,2,False,True,55
682,I will make sure to give George your regards,1.1333333333333333,0.0395165985575879,75,65,10,0,False,False,44
682,"Dude, I'm really blown away!",1.1333333333333333,0.0395165985575879,75,65,10,0,False,True,28
682,"So Long, old pal. See you next year.",1.131578947368421,0.043294605892116,76,67,8,1,False,True,36
682,"Fine, I'll leaf you a alone!",1.131578947368421,0.043294605892116,76,67,8,1,False,True,28
682,Let's not get carried away.,1.131578947368421,0.0390326236162929,76,66,10,0,False,True,27
682,I said it's fall,1.131578947368421,0.043294605892116,76,67,8,1,False,False,16
682,"You’ll be next, Mudbloods!",1.1304347826086956,0.0457626641650565,69,61,7,1,False,True,26
682,"There is no shame in letting go, you said...thanks for nothing!",1.1304347826086956,0.0457626641650565,69,61,7,1,False,True,63
682,Tell the saplings not to miss me,1.1304347826086956,0.0502043712338805,69,62,5,2,False,False,32
682,See you in the black plastic bag.,1.12987012987013,0.0385602534725039,77,67,10,0,False,True,33
682,"Daughter leaf overheard talking loudly over wind gust.
“For the last time mom, it’s the fruits that don’t fall far.”",1.12987012987013,0.0427627951322407,77,68,8,1,False,False,116
682,"OOOPS, gotta go, Dave, see ya in the compost pile.",1.12987012987013,0.0385602534725039,77,67,10,0,False,True,50
682,i will be leafing you now....,1.12987012987013,0.0385602534725039,77,67,10,0,False,True,29
682,Here we go again. See ya next fall!,1.12987012987013,0.0385602534725039,77,67,10,0,False,True,35
682,"I told you to leaf me alone, so now you're alone.",1.12987012987013,0.0427627951322407,77,68,8,1,False,True,49
682,GERANIUMMMMMMMMMMMMM!,1.12987012987013,0.0385602534725039,77,67,10,0,False,True,21
682,"Despite Global Warming, I guess fall's still a thing.",1.12987012987013,0.0427627951322407,77,68,8,1,False,True,53
682,"Shucks, you win!",1.12987012987013,0.0385602534725039,77,67,10,0,False,True,16
682,I’ve heard of leafing but this is ridiculous!,1.12987012987013,0.0427627951322407,77,68,8,1,False,True,45
682,Let's meet here again in the spring.,1.12987012987013,0.0427627951322407,77,68,8,1,False,True,36
682,Even the leaves fall for you,1.12987012987013,0.0427627951322407,77,68,8,1,False,False,28
682,"Confession, I’ve always sailed under false colours.",1.12987012987013,0.0385602534725039,77,67,10,0,False,True,51
682,"Don’t worry, you’re going to have a good fall!",1.12987012987013,0.0385602534725039,77,67,10,0,False,True,46
682,"Time to leaf, see you next Spring",1.12987012987013,0.0427627951322407,77,68,8,1,False,False,33
682,"I hate to tell you, but I've fallen for someone else",1.12987012987013,0.0385602534725039,77,67,10,0,False,False,52
682,"So long, Sweetheart.  I'll be keeping an eye out for you!",1.12987012987013,0.0385602534725039,77,67,10,0,False,True,57
682,"It's not you. Or me. It's just ""fall.""",1.12987012987013,0.0427627951322407,77,68,8,1,False,False,38
682,I'll wait for you!,1.12987012987013,0.0427627951322407,77,68,8,1,False,True,18
682,"Dang, I'm older so I should've known.",1.12987012987013,0.0427627951322407,77,68,8,1,False,True,37
682,"Heeeeeeeeeellllppppp! I'm going down.....!!!!!!
""Well yes, you're a leaf, for God's sake""",1.12987012987013,0.0385602534725039,77,67,10,0,False,False,89
682,I hope to be reincarnated as a walnut.,1.12987012987013,0.0465877682142021,77,69,6,2,False,True,38
682,'Near... Far... My chloroplast will go on...',1.12987012987013,0.0385602534725039,77,67,10,0,False,False,45
682,"Come on, it's your turn now.",1.12987012987013,0.0385602534725039,77,67,10,0,False,True,28
682,Let's hope I don't land face down!,1.12987012987013,0.0427627951322407,77,68,8,1,False,True,34
682,I’m hoping for cremation- don’t want to end up as worm food in some mulch pile!,1.12987012987013,0.0385602534725039,77,67,10,0,False,True,79
682,"Oh it's a long, long time from May to December, but the days grow short when you reach September!",1.12987012987013,0.0385602534725039,77,67,10,0,False,True,97
682,... but the word of our God lives forever.,1.12987012987013,0.0427627951322407,77,68,8,1,False,True,42
682,"You said you wood never leave me!""

""Sorry...it's just too breezy.",1.12987012987013,0.0385602534725039,77,67,10,0,False,True,66
682,Some rise to the occasion as carbon we fall…,1.12987012987013,0.0427627951322407,77,68,8,1,False,False,44
682,"Good bye, dear; I do so hate to leaf you.",1.12987012987013,0.0385602534725039,77,67,10,0,False,True,41
682,"Well, my breeze is here! Tell Ethel I'm sorry I couldn't hang around.",1.12987012987013,0.0385602534725039,77,67,10,0,False,True,69
682,I really am falling in love with you.,1.12987012987013,0.0385602534725039,77,67,10,0,False,True,37
682,I’m leaving now.,1.12987012987013,0.0385602534725039,77,67,10,0,False,True,16
682,I regret nothing!,1.12987012987013,0.0427627951322407,77,68,8,1,False,True,17
682,"I apologise, but I must leave now.",1.12987012987013,0.0427627951322407,77,68,8,1,False,True,34
682,"No, it's too soon! There's still so many unanswered questions! Where did we come from? What is the meaning of leaf? Why are we the only two leaves with faces? Oh god, not like this... Man I'm falling very slowly.",1.12987012987013,0.0427627951322407,77,68,8,1,True,True,212
682,I am not falling for you. I have no other choice.,1.12987012987013,0.0427627951322407,77,68,8,1,False,True,49
682,Don’t worry honey. We’ll be mulched soon.,1.12987012987013,0.0427627951322407,77,68,8,1,False,True,41
682,Just call me the answer ‘cause I’ll be blowin’ in the wind.,1.12987012987013,0.0385602534725039,77,67,10,0,False,True,59
682,"Oh dear, darling Deciduous, I have to leaf you now!",1.12987012987013,0.0385602534725039,77,67,10,0,False,True,51
682,"I'm sorry, Jimmy. We caught you leaf peeping... Our branch has to let you go.",1.12987012987013,0.0385602534725039,77,67,10,0,False,True,77
682,"I'm falling for you. No, really - I'm falling for you. Ah!",1.12987012987013,0.0385602534725039,77,67,10,0,False,True,58
682,"Oh the days dwindle down to a precious few. September, November...",1.12987012987013,0.0385602534725039,77,67,10,0,False,True,66
682,"No I don't wanna go to counseling, I'm leaving.",1.12987012987013,0.0427627951322407,77,68,8,1,False,True,47
682,Sorry I have to leaf you alone.,1.12987012987013,0.0465877682142021,77,69,6,2,False,True,31
682,"But,I did give at the office!",1.12987012987013,0.0427627951322407,77,68,8,1,False,True,29
682,"I‘m tellin‘ ya, it‘s just those damn energy saving light bulps. No was it‘s already fall.",1.12987012987013,0.0385602534725039,77,67,10,0,False,True,89
682,‘Stop going on about how beautiful fall is!’,1.12987012987013,0.0385602534725039,77,67,10,0,False,False,44
682,I guess this is why we're called leaves.,1.12987012987013,0.0385602534725039,77,67,10,0,False,True,40
682,It is feeling more like a fall than a ride.,1.12987012987013,0.0385602534725039,77,67,10,0,False,True,43
682,I think we should see other people.,1.12987012987013,0.0385602534725039,77,67,10,0,False,True,35
