contest,caption,mean,precision,votes,not_funny,somewhat_funny,funny,has_question_mark,ends_with_punctuation,caption_length
771,"Don't worry, I called in the professionals.  They'll find my car keys.",1.3287671232876712,0.0731306729591185,73,55,12,6,False,True,70.0
771,Dad and his friends are hunting for Bitcoin.,1.3287671232876712,0.0704810458467266,73,54,14,5,False,True,44.0
771,We’ll find it. These are the top retirees from some of the best beaches in the country.,1.3285714285714283,0.0696677372343726,70,51,15,4,False,True,87.0
771,Not sure this gesture is making up for losing your wedding band in the first place.,1.3285714285714283,0.0780757941759307,70,54,9,7,False,True,83.0
771,"Dating's a minefield, don't you think?",1.3285714285714283,0.0666296850991309,70,50,17,3,True,True,38.0
771,I could have sworn you told me I had a mental problem.,1.3285714285714283,0.0725787316388611,70,52,13,5,False,True,54.0
771,Kids these days,1.3285714285714283,0.0725787316388611,70,52,13,5,False,False,15.0
771,"Do they have to hum the ""Imperial Death March?""",1.3285714285714283,0.0666296850991309,70,50,17,3,True,False,47.0
771,I see you misplaced your keys again!,1.3285714285714283,0.0666296850991309,70,50,17,3,False,True,36.0
771,What's mine is yours and yours is mine--right?,1.3285714285714283,0.0696677372343726,70,51,15,4,True,True,46.0
771,"Hey, times are tough.",1.3285714285714283,0.0634463258310606,70,49,19,2,False,True,21.0
771,"Seriously, it's in your pants, isn't it?",1.3285714285714283,0.0725787316388611,70,52,13,5,True,True,40.0
771,This isn’t what I meant when I said we’re sitting on a gold mine.,1.3285714285714283,0.0725787316388611,70,52,13,5,False,True,65.0
771,Who let the beat drop?,1.3285714285714283,0.0753773902523433,70,53,11,6,True,True,22.0
771,I know the housing market is tough but did you have to settle for the budget lead paint inspectors?,1.3285714285714283,0.0725787316388611,70,52,13,5,True,True,99.0
771,I know I left my car keys here before the pandemic.,1.3285714285714283,0.0696677372343726,70,51,15,4,False,True,51.0
771,They’re here looking for my last fuck to give.,1.3267326732673268,0.0631027935411017,101,77,15,9,False,True,46.0
771,Did you lose another filling?,1.326530612244898,0.0645030040776992,98,75,14,9,True,True,29.0
771,All this for a lost penny? What was the date on it?,1.326315789473684,0.0625012524186415,95,71,17,7,True,True,51.0
771,What do we do if they don’t find the remote?,1.326315789473684,0.0588088277593745,95,69,21,5,True,True,44.0
771,Want to check out some heavy metal?,1.326086956521739,0.0600777797582582,92,67,20,5,True,True,35.0
771,I guess finding coins under the couch cushions DOES count as buried treasure.,1.326086956521739,0.0537835011036253,92,64,26,2,False,True,77.0
771,Dad’s totally going to figure out I got my belly button pierced.,1.326086956521739,0.0600777797582582,92,67,20,5,False,True,64.0
771,I just took it off for a second,1.326086956521739,0.0559603121346105,92,65,24,3,False,False,31.0
771,We did drop a lot of money for this therapist.,1.3258426966292134,0.0593101319464104,89,64,21,4,False,True,46.0
771,"Like I said, we’re sitting on a gold mine.",1.3258426966292134,0.0593101319464104,89,64,21,4,False,True,42.0
771,This isn't the solution I had in mind when I said I thought you were hiding things from me.,1.3255813953488371,0.0649989171016104,86,64,16,6,False,True,91.0
771,Are you finally ready to admit you lost your wedding ring?,1.3255813953488371,0.0628590599131462,86,63,18,5,True,True,58.0
771,"I said I find ""mental deflection"" and interesting topic!",1.3255813953488371,0.0649989171016104,86,64,16,6,False,True,56.0
771,These guys are even nerdier than your Settlers of Catan group.,1.3255813953488371,0.0690800611379075,86,66,12,8,False,True,62.0
771,When did Emotional Support Roombas become a thing?,1.3255813953488371,0.0649989171016104,86,64,16,6,True,True,50.0
771,Loose change is the new Bitcoin.,1.3253012048192772,0.0620646666233045,83,60,19,4,False,True,32.0
771,I have told you a hundred times- that’s not how Bitcoin works!,1.3253012048192772,0.0666313707168225,83,62,15,6,False,True,62.0
771,"By the way, 'I can't find my keys, guess I'll have to spend the night' won't work anymore.",1.3253012048192772,0.0688011476929926,83,63,13,7,False,True,90.0
771,Pretend you're at the beach.,1.3253012048192772,0.0596503519083633,83,59,21,3,False,True,28.0
771,I have a jealous ex. This is just a precaution.,1.3253012048192772,0.0666313707168225,83,62,15,6,False,True,47.0
771,Still think buying a house on Treasure Island is a brilliant idea?,1.3253012048192772,0.0709045575696184,83,64,11,8,True,True,66.0
771,"You've got great friends, but I think if you get on your knees, you'll find it under the couch.",1.3253012048192772,0.0620646666233045,83,60,19,4,False,True,95.0
771,"We’re sitting on a gold mine, I tell you!",1.3253012048192772,0.0571341064734649,83,58,23,2,False,True,41.0
771,It was a beautiful proposal until you dropped the ring.,1.3253012048192772,0.0620646666233045,83,60,19,4,False,True,55.0
771,I see lead people.,1.3253012048192772,0.0620646666233045,83,60,19,4,False,True,18.0
771,The invite read:  Heavy Metal Party ! Sorry Gary!,1.325,0.0660240654245849,80,59,16,5,False,True,49.0
771,I've been told I have a magnetic personality.,1.325,0.0610431472221478,80,57,20,3,False,True,45.0
771,"If they find an abortion, they win $10,000.",1.325,0.0728597577802552,80,62,10,8,False,True,43.0
771,I told you buying a beach house was a bad idea.,1.325,0.0660240654245849,80,59,16,5,False,True,47.0
771,I really thought you were kidding about this being a TSA hangout spot,1.325,0.0660240654245849,80,59,16,5,False,False,69.0
771,I love the sound of metal detectors in the morning.,1.324675324675325,0.0652079025440129,77,56,17,4,False,True,51.0
771,"I’m Cool, at least they’re not Geiger Counters .",1.324675324675325,0.0652079025440129,77,56,17,4,False,True,48.0
771,Searching for gold while the gold is sitting right next to you.,1.324675324675325,0.0652079025440129,77,56,17,4,False,True,63.0
771,Did you tell them that they can't find bitcoins that way?,1.3243243243243243,0.0722723368456013,74,56,12,6,True,True,57.0
771,"It's a new startup I found, WheresMyKeys.Com.",1.3243243243243243,0.0669538959227386,74,54,16,4,False,True,45.0
771,I told you to vacuum.,1.3243243243243243,0.0641294856699111,74,53,18,3,False,True,21.0
771,Gold or silver ?,1.3243243243243243,0.0641294856699111,74,53,18,3,True,True,16.0
771,They're checking for anything resembling a ball and chain.,1.323943661971831,0.0744521179154911,71,54,11,6,False,True,58.0
771,Sometimes my Mom gets a little carried away,1.323943661971831,0.0716986985598808,71,53,13,5,False,False,43.0
771,"You should have downloaded the ""Find my Phone"" app.",1.323943661971831,0.0716986985598808,71,53,13,5,False,True,51.0
771,"The car keys are lost, move on.",1.323943661971831,0.0688352299935079,71,52,15,4,False,True,31.0
771,"If you tell them I swallowed it, they will only stay longer.",1.323943661971831,0.0744521179154911,71,54,11,6,False,True,60.0
771,"I'm sorry I lost your engagement ring, but this is ridiculous.",1.323943661971831,0.0716986985598808,71,53,13,5,False,True,62.0
771,Maybe they should look in the sofa for coins,1.3235294117647058,0.0768142477186675,68,52,10,6,False,False,44.0
771,"Currently, it's the best way I have to pay off my college loans.",1.3235294117647058,0.0677014325126266,68,49,16,3,False,True,64.0
771,"Next time, read the prenup more carefully.",1.3235294117647058,0.0708693553451426,68,50,14,4,False,True,42.0
771,Pick your feet up while they clean the rug.,1.3235294117647058,0.0708693553451426,68,50,14,4,False,True,43.0
771,Let me guess. You misplaced your bit coins. Again.,1.3235294117647058,0.0768142477186675,68,52,10,6,False,True,50.0
771,My surgeon said there’d be pros and cons of getting a knee replacement.,1.3235294117647058,0.0677014325126266,68,49,16,3,False,True,71.0
771,Wait - you said all that mail we got addressed to Jimmy Hoffa was just a simple postal error!,1.3235294117647058,0.0708693553451426,68,50,14,4,False,True,93.0
771,"Well, clearly you've taken the term 'cryptocurrency' too literally...",1.3235294117647058,0.0796204133081409,68,53,8,7,False,True,69.0
771,I keep telling you to put the remote back on the console,1.3235294117647058,0.0643778098531425,68,48,18,2,False,False,56.0
771,"I said, “Where’s your mettle”.",1.3235294117647058,0.0739016041085067,68,51,12,5,False,True,30.0
771,"I don't think the vaccine worked. They can't find us."" ""You need to stop listening to your mom Susan.",1.3235294117647058,0.0708693553451426,68,50,14,4,False,True,101.0
771,I keep telling them this isn't how Bitcoin works.,1.3235294117647058,0.0768142477186675,68,52,10,6,False,True,49.0
771,"honey, change the channel now",1.3235294117647058,0.0708693553451426,68,50,14,4,False,False,29.0
771,I told you the ring felt loose.,1.3229166666666667,0.0563798047446151,96,69,23,4,False,True,31.0
771,Because there's buried treasure around here. It said so on the internet.,1.3225806451612905,0.0595316187680278,93,68,20,5,False,True,72.0
771,When did you last see your keys?,1.3222222222222222,0.0587590729898044,90,65,21,4,True,True,32.0
771,"You still going with your lame "" I lost the ring"" excuse?",1.3222222222222222,0.0608466642369037,90,66,19,5,True,True,57.0
771,"If we can’t travel,
I thought I’d bring the beach to us.",1.3218390804597702,0.0643563590063207,87,65,16,6,False,True,56.0
771,This is not what I meant when I said I enjoy a good heavy metal scene.,1.3218390804597702,0.0683838969149485,87,67,12,8,False,True,70.0
771,"Wait, aren’t your glasses plastic?",1.3218390804597702,0.0577911440055017,87,62,22,3,True,True,34.0
771,I forgot to tell you that our new therapist has BS detectors.,1.3218390804597702,0.0683838969149485,87,67,12,8,False,True,61.0
771,Gotta love the gig economy.,1.3218390804597702,0.0600593417531908,87,63,20,4,False,True,27.0
771,"Did you tell them that you lost your keys again""",1.3214285714285714,0.0565825223682569,84,59,23,2,False,False,48.0
771,Did you want to consider another excuse in case the missing ring doesn’t show up?,1.3214285714285714,0.0565825223682569,84,59,23,2,True,True,81.0
771,I didn’t expect this when the condo newsletter said that there would be change in the lobby.,1.3214285714285714,0.0659471664905609,84,63,15,6,False,True,92.0
771,"I will admit to the slightest possibility that the keys were left in the car, but for now I would prefer to stay the course.",1.3209876543209875,0.0604181940900847,81,58,20,3,False,True,124.0
771,"t’s nice your family does things together, but it’s making me a little nervous.",1.3209876543209875,0.0629205860781333,81,59,18,4,False,True,79.0
771,If they find anything do we get a cut,1.3209876543209875,0.0550733531436924,81,56,24,1,False,False,37.0
771,"Your dating profile said, ‘Hidden Treasure,’ so I came prepared.",1.3209876543209875,0.0653271928657923,81,60,16,5,False,True,64.0
771,Is anyone dragging the lake?,1.3209876543209875,0.0629205860781333,81,59,18,4,True,True,28.0
771,They won't leave until they can check under the cushions.,1.3209876543209875,0.0676482379891233,81,61,14,6,False,True,57.0
771,"They have zydeco on Friday nights — Saturdays, underground metal.",1.3209876543209875,0.0629205860781333,81,59,18,4,False,True,65.0
771,I told you this relationship would be a minefield.,1.3209876543209875,0.0578075791034229,81,57,22,2,False,True,50.0
771,"Call me a Luddite, but the change is obviously buried in the couch.",1.3209876543209875,0.0629205860781333,81,59,18,4,False,True,67.0
771,I said this is “mental”,1.3209876543209875,0.0629205860781333,81,59,18,4,False,False,23.0
771,This is not what I thought you meant when you said your friends were into metal,1.3205128205128205,0.0645009266986524,78,57,17,4,False,False,79.0
771,"You really miss Florida,huh?",1.3205128205128205,0.0670326030971889,78,58,15,5,True,True,28.0
771,"I heard you went ring shopping a couple of weeks ago, so I asked over a few friends.",1.3205128205128205,0.0670326030971889,78,58,15,5,False,True,84.0
771,I lost another AirPod.,1.3205128205128205,0.0645009266986524,78,57,17,4,False,True,22.0
771,I stand corrected.  Winning the lottery was not your dumbest idea.,1.3205128205128205,0.0694720822416141,78,59,13,6,False,True,66.0
771,It’s nice to have people over once in a while,1.3205128205128205,0.0694720822416141,78,59,13,6,False,False,45.0
771,"Since we can’t make it to the beach, I brought the beach to you.",1.3205128205128205,0.0645009266986524,78,57,17,4,False,True,64.0
771,I started a TikTok challenge to find my keys.,1.3205128205128205,0.0670326030971889,78,58,15,5,False,True,45.0
771,Do you find relationships to be a minefield?,1.3203883495145632,0.0538160955151456,103,74,25,4,True,True,44.0
771,I swear the ad said 'metal inspectors',1.32,0.06619654055902,75,55,16,4,False,False,38.0
771,I don't think this is how you mine for Bitcoin.,1.32,0.0688646668643822,75,56,14,5,False,True,47.0
771,You lost your earbud again?,1.32,0.06619654055902,75,55,16,4,True,True,27.0
771,I may have told them I paid off my debt from the change you dropped in my sofa.,1.32,0.07391253657576,75,58,10,7,False,True,79.0
771,All I wanted was a quiet evening and now magazines are looking for captions in our living room,1.32,0.0714332044829482,75,57,12,6,False,False,94.0
771,Are they looking for a ‘remote’ job?,1.32,0.0714332044829482,75,57,12,6,True,True,36.0
771,Al Capone lived in this apartment.  Geraldo and the  TV crew will be here shortly.,1.3194444444444444,0.0587639667708461,72,50,21,1,False,True,82.0
771,"Love.  They're helping me look for love, and just a little attention.",1.3194444444444444,0.0650820743684744,72,52,17,3,False,True,69.0
771,"No, what I actually said was the apartment was going to be mined.",1.3194444444444444,0.0708388948075996,72,54,13,5,False,True,65.0
771,"They,like me,have been doing this for a while,and still no engagement ring.",1.3194444444444444,0.0680214136197778,72,53,15,4,False,True,75.0
771,You sure you dropped it in here?,1.3194444444444444,0.0620035490707941,72,51,19,2,True,True,32.0
771,"Honey, they're not going to detect you. I told you the vaccines won't magnetise you.",1.3194444444444444,0.0680214136197778,72,53,15,4,False,True,84.0
771,I wanted to start a book club but no!,1.3194444444444444,0.0650820743684744,72,52,17,3,False,True,37.0
771,"When you invited me over to listen to metal, I had assumed we were talking about music.",1.319148936170213,0.0570228473065847,94,68,22,4,False,True,87.0
771,You lose a Sacagawea dollar in the couch one time…,1.319148936170213,0.0645501937454161,94,72,14,8,False,False,50.0
771,"Your personality is magnetic, but I still haven’t detected any change.",1.319148936170213,0.0662986282812543,94,73,12,9,False,True,70.0
771,I don't think they understand how you lose bitcoins,1.318840579710145,0.0699919421229572,69,51,14,4,False,False,51.0
771,Wouldn't ordering a new AirPod be cheaper?,1.318840579710145,0.0636109820953293,69,49,18,2,True,True,42.0
771,"well, you did say you dropped
the engagement ring
in the carpet, right?",1.318840579710145,0.0758378987126784,69,53,10,6,True,True,71.0
771,"""The whole world is like a minefield and NOW it's come to us""",1.318840579710145,0.0699919421229572,69,51,14,4,False,False,61.0
771,At least they’re not Hipsters,1.318840579710145,0.0758378987126784,69,53,10,6,False,False,29.0
771,They’re gonna freak out when they find the kitchen.,1.318840579710145,0.0729734843737705,69,52,12,5,False,True,51.0
771,You said you wanted change --- I'm just trying to be helpful.,1.3186813186813189,0.064201911502437,91,69,15,7,False,True,61.0
771,It has something to do with a theory on social media.,1.318181818181818,0.0688198584566337,66,48,15,3,False,True,53.0
771,"Honey, with our unemployment benefits ending, we have to find as many other money sources as possible.",1.318181818181818,0.0752899319324438,66,50,11,5,False,True,102.0
771,They don't fully understand where to find bitcoin,1.318181818181818,0.0616421366928009,88,65,18,5,False,False,49.0
771,Think they'll find the remote?,1.318181818181818,0.0657435856624916,88,67,14,7,True,True,30.0
771,Is this how you were imagining your bachelor party?,1.318181818181818,0.0721274800904036,66,49,13,4,True,True,51.0
771,"At this rate, they’ll find your iphone 4 from middle school",1.318181818181818,0.0752899319324438,66,50,11,5,False,False,59.0
771,If they're looking for bitcoin they're going to be sorely disappointed.,1.318181818181818,0.0783248001375841,66,51,9,6,False,True,71.0
771,"If you want out of the marriage, just say so.",1.318181818181818,0.0721274800904036,66,49,13,4,False,True,45.0
771,You're sure the bitcoin was in here?,1.318181818181818,0.0721274800904036,66,49,13,4,True,True,36.0
771,I kind of liked it more when we just worried about algorithms,1.318181818181818,0.0721274800904036,66,49,13,4,False,False,61.0
771,"Okay, where did you last see your keys?",1.318181818181818,0.0688198584566337,66,48,15,3,True,True,39.0
771,Apparently someone found traces of civility last night….,1.318181818181818,0.0752899319324438,66,50,11,5,False,True,56.0
771,They’re trying to find where I asked for your opinion.,1.318181818181818,0.0783248001375841,66,51,9,6,False,True,54.0
771,"Well, it beats vacuuming.",1.3176470588235294,0.0608339907240847,85,62,19,4,False,True,25.0
771,I think there’s something fishy about this Roomba home demo.,1.3176470588235294,0.0652763243224822,85,64,15,6,False,True,60.0
771,I guess the vaccine indeed made us magnetic…,1.3176470588235294,0.0608339907240847,85,62,19,4,False,False,44.0
771,Welcome to our company's annual 401k shareholder meeting. Refreshments are in Starbucks across the street.,1.3176470588235294,0.0630942665559712,85,63,17,5,False,True,106.0
771,"Ok, you got your vaccination, now which conspiracy theory is this?",1.3170731707317074,0.0669327318982572,82,62,14,6,True,True,66.0
771,I always feel like I’m in a minefield talking to you!,1.3170731707317074,0.0646442300372713,82,61,16,5,False,True,53.0
771,"What I said was, ""This condo is 'mine'.""",1.3170731707317074,0.0712896825906011,82,64,10,8,False,False,40.0
771,Next time pay attention to your hearing aid when you take your mask off.  Those things cost a fortune.,1.3170731707317074,0.0691455329115071,82,63,12,7,False,True,102.0
771,They came all the way from Arizona and are looking for what? Voter fraud in our living room? That's insane!!!!,1.3170731707317074,0.0712896825906011,82,64,10,8,True,True,110.0
771,Are these guys always here?,1.3170731707317074,0.0646442300372713,82,61,16,5,True,True,27.0
771,Some believe our living room was built over an ancient burial ground containing gilded artifacts.,1.3170731707317074,0.0646442300372713,82,61,16,5,False,True,97.0
771,"Fuck this, I'm calling the cops.",1.3170731707317074,0.0691455329115071,82,63,12,7,False,True,32.0
771,You drop something?,1.3170731707317074,0.0622716818052902,82,60,18,4,True,True,19.0
771,. “And how is this easier than buying a Tile?”,1.3170731707317074,0.0669327318982572,82,62,14,6,True,False,46.0
771,The anti vaxxers are searching for that chip again.,1.3170731707317074,0.0646442300372713,82,61,16,5,False,True,51.0
771,They haven’t found us yet.,1.3170731707317074,0.0669327318982572,82,62,14,6,False,True,26.0
771,For Christ sakes ! This is Brooklyn!,1.316831683168317,0.0561657608066646,101,74,22,5,False,True,36.0
771,Sometimes it's worth exploring what's going on beneath the surface of our relationship.,1.3164556962025316,0.0663028953833219,79,59,15,5,False,True,87.0
771,"If they find it Harold, you're in deep shit",1.3164556962025316,0.068706942014871,79,60,13,6,False,False,43.0
771,I knew it - marriage counseling is nothing but land mines!,1.3164556962025316,0.0638083379456684,79,58,17,4,False,True,58.0
771,I haven’t needed my keys until the lockdown ended.,1.3164556962025316,0.0663028953833219,79,59,15,5,False,True,50.0
771,I told you we needed to have an extra set of car keys made.,1.3164556962025316,0.0638083379456684,79,58,17,4,False,True,59.0
771,Nobody wants to work anymore.,1.3164556962025316,0.061212205045771,79,57,19,3,False,True,29.0
771,"Yes, but why are they working from _my_ home?",1.3164556962025316,0.0663028953833219,79,59,15,5,True,True,45.0
771,Did you drop your Bitcoin again?,1.316326530612245,0.0554175071619449,98,71,23,4,True,True,32.0
771,It's a bitcoin. They'll never find it.,1.316326530612245,0.0590921904442019,98,73,19,6,False,True,38.0
771,Didn't I tell you to fix that whole in your pocket?,1.3157894736842106,0.0680828347787096,76,57,14,5,True,True,51.0
771,Is your gold filling that important?,1.3157894736842106,0.0654552916006232,76,56,16,4,True,True,36.0
771,Rumba hockey!,1.3157894736842106,0.0706126729736775,76,58,12,6,False,True,13.0
771,Dads seeking lost youth.,1.3157894736842106,0.0680828347787096,76,57,14,5,False,True,24.0
771,"Well, last week they found Julie's contact lens.",1.315217391304348,0.0616878147203368,92,69,17,6,False,True,48.0
771,A key under the flower pot would due.,1.315217391304348,0.0597201384939053,92,68,19,5,False,True,37.0
771,Might be time to have the rug cleaned.,1.3150684931506849,0.0643333461351843,73,53,17,3,False,True,38.0
771,"They are the ""Beach Boys"" ! handy friends to have when I drop small jewelry .",1.3150684931506849,0.0581183655769765,73,51,21,1,False,True,77.0
771,It was my financial advisor’s idea.,1.3150684931506849,0.0672257162755043,73,54,15,4,False,True,35.0
771,Our chances of finding something good are still better than yours with “Play Something” on Netflix.,1.3150684931506849,0.0699986745057346,73,55,13,5,False,True,99.0
771,This is not what I had in mind when you said it was your night to host the metal heads,1.3150684931506849,0.0672257162755043,73,54,15,4,False,False,86.0
771,Thought you said we were going to see a new metal band?,1.3150684931506849,0.0643333461351843,73,53,17,3,True,True,55.0
771,"They’re looking for bamboo fibers, or some shit",1.3150684931506849,0.0726658925243815,73,56,11,6,False,False,47.0
771,Did you check the couch cushions?,1.3148148148148149,0.0536777368859859,108,79,24,5,True,True,33.0
771,"Great, one week from the wedding and you lose the ring.",1.3146067415730338,0.0631071239678998,89,67,16,6,False,True,55.0
771,"On second thought ""Ancient Roman Settlements Under Our House"" was not a wise title for our thesis.",1.3146067415730338,0.0589218454028174,89,65,20,4,False,True,98.0
771,Maybe it’s your magnetic personality.,1.3146067415730338,0.0670315919945679,89,69,12,8,False,True,37.0
771,Wouldn’t it be easier to return pop cans for the deposit?,1.3146067415730338,0.0610503602003026,89,66,18,5,True,True,57.0
771,"So tell me more, a career in Roomba wrangling sounds interesting",1.3146067415730338,0.065098937859331,89,68,14,7,False,False,64.0
771,Did you lose your retainer again?,1.3142857142857145,0.069135020003115,70,52,14,4,True,True,33.0
771,Pick your feet up,1.3142857142857145,0.069135020003115,70,52,14,4,False,False,17.0
771,They're just testing your mettle.,1.3142857142857145,0.0720675354496,70,53,12,5,False,True,33.0
771,You know this is overkill.,1.3142857142857145,0.0660724777489301,70,51,16,3,False,True,26.0
771,Searching for America's soul,1.3142857142857145,0.069135020003115,70,52,14,4,False,False,28.0
771,"Life is not a beach!""",1.3142857142857145,0.0776008183956576,70,55,8,7,False,False,21.0
771,It’s much easier if they do it!,1.3142857142857145,0.069135020003115,70,52,14,4,False,True,31.0
771,Now they are after our silver linings too,1.3142857142857145,0.069135020003115,70,52,14,4,False,False,41.0
771,"'When the real estate agent said this property was a hidden gem, I didn't think they meant this...'",1.3142857142857145,0.069135020003115,70,52,14,4,False,False,99.0
771,Does everyone here listen to metal?,1.3142857142857145,0.0628609070960214,70,50,18,2,True,True,35.0
771,I didn't mean I am that kind of heavy metal fan,1.3142857142857145,0.0720675354496,70,53,12,5,False,False,47.0
771,I just love the sound of the beach.,1.313953488372093,0.0646184802588618,86,65,15,6,False,True,35.0
771,My RingFinder app isn’t working. You still haven’t proposed.,1.313953488372093,0.0667019175300262,86,66,13,7,False,True,60.0
771,You can’t keep them in a dish by the front door like a normal person?,1.313953488372093,0.0646184802588618,86,65,15,6,True,True,69.0
771,"The Texas Legislature passed a ""law"" which they  do not enforce, but  any person can enter your home and search for evidence of  Fetal Heartbeat. Coupled with the belief that anyone on the premises has thought of the word ""abortion"" they get $10,000.",1.3134328358208955,0.0712013447188296,67,50,13,4,False,True,250.0
771,This is not what I meant by “help more around the house.”,1.3134328358208955,0.080165351573422,67,53,7,7,False,False,57.0
771,"Repeat after me, ""I promise to stop clipping my toenails on the sofa.""",1.3134328358208955,0.0743095924100192,67,51,11,5,False,False,70.0
771,"They spend two years ringing doorbells, looking for the Golden Plates.",1.3134328358208955,0.080165351573422,67,53,7,7,False,True,70.0
771,Should I tell them I have a knee replacement?,1.3134328358208955,0.0712013447188296,67,50,13,4,True,True,45.0
771,That’s not what I meant by mixed signals…,1.3134328358208955,0.0712013447188296,67,50,13,4,False,False,41.0
771,"relationships are a minefield, it is better to sweep the area first",1.3134328358208955,0.0712013447188296,67,50,13,4,False,False,67.0
771,It’s not looking like we’re going to locate that loving feeling,1.3134328358208955,0.0743095924100192,67,51,11,5,False,False,63.0
771,"Honey, I said your mental health. Please get your hearing checked.",1.3134328358208955,0.0743095924100192,67,51,11,5,False,True,66.0
771,You seriously expected me to look for it?,1.3134328358208955,0.080165351573422,67,53,7,7,True,True,41.0
