contest,caption,mean,precision,votes,not_funny,somewhat_funny,funny,has_question_mark,ends_with_punctuation,caption_length
710,Poor guy. He’s a quarantined Blues-bird.,1.211009174311927,0.0413692637873659,109,87,21,1,False,True,40
710,"I guess with all the man-made noise these days, it's getting harder for them to attract mates.",1.211009174311927,0.043374078106816,109,88,19,2,False,True,94
710,"Going out a limb here, but I haven't heard something so daring since Dylan went electronic.",1.211009174311927,0.043374078106816,109,88,19,2,False,True,91
710,Shh...it’s the mating song of the Lonsesome Warbler.,1.211009174311927,0.0413692637873659,109,87,21,1,False,True,52
710,"Looks like he knew we were coming, boss. He's putting on a show.",1.211009174311927,0.0452902342334822,109,89,17,3,False,True,64
710,"He thinks all it takes is a hat and a guitar to attract a mate.” 
    “And he clearly built the nest only big enough for himself.”",1.211009174311927,0.0452902342334822,109,89,17,3,False,False,130
710,Everyone wants to sound like Willie Nelson these days,1.211009174311927,0.0392622123803685,109,86,23,0,False,False,53
710,I thought he said he was a moose.,1.211009174311927,0.043374078106816,109,88,19,2,False,True,33
710,He sings like a bird,1.211009174311927,0.0452902342334822,109,89,17,3,False,False,20
710,"Yea, I think he’s high, too.",1.211009174311927,0.0452902342334822,109,89,17,3,False,True,28
710,We can get it on birdnest.com!,1.211009174311927,0.043374078106816,109,88,19,2,False,True,30
710,He's been doing live shows from home every day since quarantine started.,1.211009174311927,0.0452902342334822,109,89,17,3,False,True,72
710,"Ah, a blues bird!",1.211009174311927,0.0471285474233102,109,90,15,4,False,True,17
710,Looks like a nesting Blues Jay.,1.211009174311927,0.043374078106816,109,88,19,2,False,True,31
710,Glad to hear him opening on a high note.,1.211009174311927,0.043374078106816,109,88,19,2,False,True,40
710,"Listen, he's the last one of The Byrds, singing ""You Ain't Going Nowhere.""",1.211009174311927,0.0471285474233102,109,90,15,4,False,False,74
710,"Oh, look!  A blues bird. I’ve never seen one outside of the Mississippi Delta.",1.211009174311927,0.043374078106816,109,88,19,2,False,True,78
710,Now that doesn't sound like a swam song,1.211009174311927,0.0471285474233102,109,90,15,4,False,False,39
710,It absolutely IS the Blues Byrd! That Bossa Nova rhythm is unmistakable!,1.211009174311927,0.0413692637873659,109,87,21,1,False,True,72
710,How apropos that the elusive Blues Bird decided to show up in 2020.,1.211009174311927,0.0452902342334822,109,89,17,3,False,True,67
710,"He's a song bird,but he plays blues guitar really well.",1.211009174311927,0.0413692637873659,109,87,21,1,False,True,55
710,"When the red Red Robin stops bob bob bobbin  to sing the blues, Spring needs a booster shot.",1.211009174311927,0.043374078106816,109,88,19,2,False,True,92
710,"My goodness,  I think we are in luck,  he’s going to do bird land !",1.211009174311927,0.043374078106816,109,88,19,2,False,True,67
710,It appears the crow has evolved the ability to sing the blues!,1.211009174311927,0.0488977979825135,109,91,13,5,False,True,62
710,So that's why the chicks are always screeching,1.211009174311927,0.0452902342334822,109,89,17,3,False,False,46
710,The chicks just can't resist.,1.211009174311927,0.043374078106816,109,88,19,2,False,True,29
710,"Cool, I've always wanted to see Cheep Trick live.",1.211009174311927,0.0452902342334822,109,89,17,3,False,True,49
710,Shhh! It's the elusive blues bird.,1.211009174311927,0.0392622123803685,109,86,23,0,False,True,34
710,"...The same, exact hat.",1.211009174311927,0.0488977979825135,109,91,13,5,False,True,23
710,It’s a common self-absorbed strummer,1.211009174311927,0.0452902342334822,109,89,17,3,False,False,36
710,Nesty rocks for the audience.,1.211009174311927,0.0452902342334822,109,89,17,3,False,True,29
710,"I don't believe it, a Bird-on-a-Wire Warbler!!",1.211009174311927,0.0471285474233102,109,90,15,4,False,True,46
710,"So, no diamond ring?",1.211009174311927,0.043374078106816,109,88,19,2,True,True,20
710,"Oh, I'll have to slow my jam. Two other anxious humans down there who read 'The Peace of Wild Things'",1.211009174311927,0.0452902342334822,109,88,17,3,False,False,101
710,"Is that a 12 bar bluebird?""",1.211009174311927,0.043374078106816,109,88,19,2,True,False,27
710,Do you know why they call it a Western Blues Bird?,1.211009174311927,0.0452902342334822,109,89,17,3,True,True,50
710,It's a Tennessee Rambler!,1.211009174311927,0.0413692637873659,109,87,21,1,False,True,25
710,This one's from his first solo album.,1.211009174311927,0.0488977979825135,109,91,13,5,False,True,37
710,One in the band is worth two in the Bush.,1.211009174311927,0.0471285474233102,109,90,15,4,False,True,41
710,"Yep, that's ""The Ballad of a Bachelor.""",1.211009174311927,0.043374078106816,109,88,19,2,False,False,39
710,My god!  It's a blues bird.,1.211009174311927,0.0471285474233102,109,90,15,4,False,True,27
710,"What a mockingbird, it looks and sounds just like Dylan!",1.211009174311927,0.0452902342334822,109,89,17,3,False,True,56
710,He's been like this ever since his bird left him.,1.211009174311927,0.0403295010340435,109,89,18,2,False,True,49
710,"Looks like the blues jay really exists .""",1.211009174311927,0.0452902342334822,109,89,17,3,False,False,41
710,It appears to be the rare Screaming Jay Hawk.,1.211009174311927,0.0452902342334822,109,89,17,3,False,True,45
710,They’re All working harder since the exposure of Wet Markets!,1.211009174311927,0.0471285474233102,109,90,15,4,False,True,61
710,It's a Woodland Guthrie. If you stay quiet you'll here its mournful song which will kinda make you feel like we ain't got no home in this world.,1.211009174311927,0.043374078106816,109,88,19,2,False,True,144
710,Request 'Mr. Tambourine Man'.,1.211009174311927,0.043374078106816,109,88,19,2,False,True,29
710,"It’s the rare Balladbird, a type of Songbird that has an agent.",1.211009174311927,0.0413692637873659,109,87,21,1,False,True,63
710,From the song he sings he’s probably endemic.,1.211009174311927,0.043374078106816,109,88,19,2,False,True,45
710,He only sings songs from the 60s band The Birds.,1.211009174311927,0.0452902342334822,109,89,17,3,False,True,48
710,That's the bluest jay I've ever seen.,1.211009174311927,0.0452902342334822,109,89,17,3,False,True,37
710,"You can let the Beatles know, I don't got everything I wanted, but my bird sure can sing.",1.211009174311927,0.0452902342334822,109,89,17,3,False,True,89
710,"Well, there you have it. That there is a single-father if I've ever seen it. Mother bird left the nest, looks like she took the kids too. Aaand there's his guitar. Might want to leave him alone before he starts showing us his cover of  ""Yesterday.""",1.211009174311927,0.0452902342334822,109,89,17,3,False,False,248
710,"Anne, how exciting, it is the rare strummingbird! I",1.211009174311927,0.043374078106816,109,88,19,2,False,False,51
710,"He’s not tweeting anymore, so he needed a new hobby.",1.211009174311927,0.0452902342334822,109,89,17,3,False,True,52
710,Concert in the age of social distancing,1.211009174311927,0.043374078106816,109,85,18,2,False,False,39
710,It might be the Redneck Warbler and the Country Cockatoo.,1.211009174311927,0.0392622123803685,109,86,23,0,False,True,57
710,Found it at last - Hallelujah!,1.211009174311927,0.0452902342334822,109,89,17,3,False,True,30
710,It’s one of those rare breeds... a soloist not putting their cover song on YouTube”,1.2105263157894737,0.0440068945822071,114,93,18,3,False,False,83
710,It's mating call can only be heard on dusty roads at sunset and every liberal arts college cafe.,1.2105263157894737,0.0490140077543597,114,96,12,6,False,True,96
710,The rare delta-winged blues jay.,1.2105263157894737,0.0474037715906599,114,95,14,5,False,True,32
710,Yep. It’s a bluebird. Singing the blues.,1.2105263157894737,0.0490140077543597,114,96,12,6,False,True,40
710,"Look, even the birds become creative in isolation""",1.21,0.0477683805651623,100,82,15,3,False,False,50
710,"Well, I guess the times they are a'changin after all.""",1.21,0.0477683805651623,100,82,15,3,False,False,54
710,I have a better view when I watch it ‘live’ on my phone”,1.209090909090909,0.0410363140824114,110,88,21,1,False,False,56
710,"When you suggested we needed to branch out when it comes to music, this isn’t quite what I had in mind.",1.209090909090909,0.0430207478417466,110,89,19,2,False,True,103
710,"not bad, but nobody does Little Wing like Jimi",1.209090909090909,0.0410363140824114,110,88,21,1,False,False,46
710,"Look darling, even she’s upskilling!”",1.209090909090909,0.0430207478417466,110,89,19,2,False,False,37
710,She’s got her channel up and running this stay at home season.,1.209090909090909,0.0410363140824114,110,88,21,1,False,True,62
710,He must be working on his country album during quarantine,1.209090909090909,0.0400072023237554,110,90,18,2,False,False,57
710,Some call me the songbird of my generation”,1.209090909090909,0.0410363140824114,110,88,21,1,False,False,43
710,When did he go solo?,1.209090909090909,0.0430207478417466,110,89,19,2,True,True,20
710,There was division in the band as to whether it was safe to tour.,1.209090909090909,0.0484891921879672,110,92,13,5,False,True,65
710,"...this time of year it is try to attract groupies, roadies and press coverage.",1.209090909090909,0.0430207478417466,110,89,19,2,False,True,79
710,I’m sure The Bird is just a stage name.,1.209090909090909,0.0449175958423419,110,90,17,3,False,True,39
710,I can't tell you if it's red breasted or not till it moves the guitar.,1.209090909090909,0.0484891921879672,110,92,13,5,False,True,70
710,That’s one way to get your demo heard.,1.209090909090909,0.0449175958423419,110,90,17,3,False,True,38
710,He's had the blues ever since he flew solo.,1.209090909090909,0.0449175958423419,110,90,17,3,False,True,43
710,"It's either a Leon Redrobinbone 
or a Tomtit Waites.",1.209090909090909,0.0467375233367023,110,91,15,4,False,True,52
710,It sounds like 'Oh solo mio' to me.,1.209090909090909,0.0449175958423419,110,92,14,4,False,True,35
710,"Wow, during lockdown, the pigeons have really taken begging to the next level.",1.209090909090909,0.0430207478417466,110,89,19,2,False,True,78
710,"I've never seen anything like it, Marv. It's the bluebird of happiness, but he's singing the Blues.",1.209090909090909,0.0467375233367023,110,91,15,4,False,True,99
710,It must be a blues bird.,1.209090909090909,0.0410363140824114,110,88,21,1,False,True,24
710,You gotta fly some miles to be able to sing like that.,1.209090909090909,0.0378651629651989,110,89,20,1,False,True,54
710,"That's no warbler's song, it's the first bluesbird of  spring.",1.209090909090909,0.0389509101572414,110,87,23,0,False,True,62
710,They lined his cage with the Django Reinhardt Songbook...,1.209090909090909,0.0484891921879672,110,92,13,5,False,True,57
710,I think that's a Blues Bluebird.,1.209090909090909,0.0484891921879672,110,92,13,5,False,True,32
710,"Im stuck here in this birds nest, // and I don' know what to do. // My hen done gone and left me...",1.209090909090909,0.0467375233367023,110,91,15,4,False,True,99
710,One of the rare shared traits with our distant avian cousins—ubiquitous “Hallelujah” covers.,1.209090909090909,0.0430207478417466,110,89,19,2,False,True,92
710,That's an Eastern Blues-bird.,1.209090909090909,0.0449175958423419,110,90,17,3,False,True,29
710,What a shame!  His career never took off.,1.209090909090909,0.0430207478417466,110,89,19,2,False,True,41
710,looks like this one didn't find a mate,1.209090909090909,0.0449175958423419,110,90,17,3,False,False,38
710,This variety has such lovely blues.,1.209090909090909,0.0467375233367023,110,91,15,4,False,True,35
710,"Ted, I thought the Rockin' Robin was extinct?",1.209090909090909,0.0430207478417466,110,89,19,2,True,True,45
710,He's got a million YouTube followers.,1.209090909090909,0.0430207478417466,110,89,19,2,False,True,37
710,"Yeah, I can see him - but his Zoom is on mute",1.209090909090909,0.0449175958423419,110,90,17,3,False,False,45
710,When do it go from just watching to podcasting?,1.209090909090909,0.0467375233367023,110,91,15,4,True,True,47
710,"... The wings she got now will never be deep-fried. No, the wings she got now will never be deep-fried ...",1.208,0.0472413159795943,125,106,12,7,False,True,106
710,Some are only comfortable performing at home.,1.2075471698113207,0.0417862208597789,106,85,20,1,False,True,45
710,He's singing mean tweets again!,1.2075471698113207,0.0458854801911949,106,87,16,3,False,True,31
710,Wait a second. Birds can sing?”,1.2075471698113207,0.0458854801911949,106,87,16,3,True,False,31
710,See the old bird is sheltered  quite well.,1.2075471698113207,0.0458854801911949,106,87,16,3,False,True,42
710,You told me he'd be unplugged.,1.2075471698113207,0.0438837415572029,106,86,18,2,False,True,30
710,"Well, that bird's a catch.",1.2075471698113207,0.0458854801911949,106,87,16,3,False,True,26
710,It's his song's acoustic version.,1.2075471698113207,0.0417862208597789,106,85,20,1,False,True,33
710,Now there's a good reason for repealing the Endangered Species Act!,1.2075471698113207,0.0478034707076139,106,88,14,4,False,True,67
710,Among Friends he’s known as Nero.,1.2075471698113207,0.0458854801911949,106,87,16,3,False,True,33
710,They’ve been driven out of their natural habitat by humans.,1.2075471698113207,0.0478034707076139,106,88,14,4,False,True,59
710,That's the tenth songbird we've seen.,1.2075471698113207,0.0458854801911949,106,87,16,3,False,True,37
710,Maybe he's the reincarnation of the Big Bopper,1.2075471698113207,0.0496474201848481,106,89,12,5,False,False,46
710,"Well, it looks like Steve Miller but not flying, of course.",1.2075471698113207,0.0438837415572029,106,86,18,2,False,True,59
710,He’s an original tweeter.,1.2075471698113207,0.0438837415572029,106,86,18,2,False,True,25
710,"I may need better binoculars, but I'm pretty sure it's just an empty nest.",1.2075471698113207,0.0438837415572029,106,86,18,2,False,True,74
710,"Yep, definitely a Woodstocker up there ...",1.2075471698113207,0.0438837415572029,106,86,18,2,False,True,42
710,It sounded better on the recording.,1.2075471698113207,0.0478034707076139,106,88,14,4,False,True,35
710,Who knew that songbirds take requests?,1.2075471698113207,0.0438837415572029,106,86,18,2,True,True,38
710,So This one is a Country song bird”,1.207207207207207,0.0386443434045535,111,88,23,0,False,False,35
710,Even the birds are picking up new hobbies!,1.207207207207207,0.0463528416860251,111,92,15,4,False,True,42
710,"He should...be should really reinforce the bottom of that nest. These binoculars are quite strong, and, let’s just say it Marla - I can see his thing. And I’m not talking guitar, here.”",1.207207207207207,0.0480872758239628,111,93,13,5,False,False,185
710,"How much longer before he plays the one song we know?""",1.207207207207207,0.0480872758239628,111,93,13,5,True,False,54
710,has definitely lost his originality,1.207207207207207,0.0426730079179964,111,90,19,2,False,False,35
710,I can’t quite tell...I think he might be singing the blues.”,1.207207207207207,0.0445509345420446,111,91,17,3,False,False,60
710,blue birds are more and more common these days,1.207207207207207,0.0463528416860251,111,92,15,4,False,False,46
710,"So, I guess this must be that Rockin’ Robin fella, eh?",1.207207207207207,0.0445509345420446,111,91,17,3,True,True,54
710,Eddie Vedder is looking rough these days.,1.207207207207207,0.0445509345420446,111,91,17,3,False,True,41
710,Yup! It's a Western Bearded Warbler!,1.207207207207207,0.0445509345420446,111,91,17,3,False,True,36
710,It could be a Hooded Warbler.,1.207207207207207,0.0463528416860251,111,94,12,5,False,True,29
710,It’s mating season for the Western Blues Bird.,1.207207207207207,0.0426730079179964,111,90,19,2,False,True,46
710,Well of course it's a blues jay - just listen to it's song.,1.207207207207207,0.0480872758239628,111,93,13,5,False,True,59
710,He is all plugged-in!,1.207207207207207,0.0426730079179964,111,90,19,2,False,True,21
710,"No, no... a BLUES-jay.",1.207207207207207,0.0480872758239628,111,93,13,5,False,True,22
710,All the books said that bird was nocturnal,1.207207207207207,0.0445509345420446,111,91,17,3,False,False,42
710,"That's a Blues Jay: a modern, social media-era descendant of the Blue Jay, but more on-brand.",1.207207207207207,0.0426730079179964,111,90,19,2,False,True,93
710,"Sadly,this species only knows one song -- 'Blackbird' by the Beatles!",1.207207207207207,0.0463528416860251,111,92,15,4,False,True,69
710,"I'm just a bird, so they say,
""They don't sing, it's not music, no way,""
But I got a sad song to sing,
This is one bluesy bluejay today.",1.207207207207207,0.0463528416860251,111,92,15,4,False,True,136
710,At least he can carry a toon.,1.207207207207207,0.0426730079179964,111,90,19,2,False,True,29
710,His nest is made of bluegrass.,1.207207207207207,0.0386443434045535,111,88,23,0,False,True,30
710,"Nope, it's a bird song",1.207207207207207,0.0426730079179964,111,90,19,2,False,False,22
710,Funny...he only does covers of Roger McGuinn songs.,1.207207207207207,0.0463528416860251,111,92,15,4,False,True,51
710,He usually performs at Augusta National.,1.207207207207207,0.0407085426043382,111,89,21,1,False,True,40
710,It sounds like Dylan’s Desolation Row.,1.207207207207207,0.0445509345420446,111,91,17,3,False,True,38
710,The warbler has a nice song but I prefered his first album.,1.207207207207207,0.0480872758239628,111,93,13,5,False,True,59
710,"That particular species, Peragit Avem, is know for having its own YouTube Channel.",1.207207207207207,0.0407085426043382,111,89,21,1,False,True,82
710,Wasn't I right when I said that the best spot for bird watching is near the chemical plant ?,1.207207207207207,0.0463528416860251,111,92,15,4,True,True,92
710,This is the only way he can compete with younger fellas.,1.207207207207207,0.0353225852885772,111,94,15,2,False,True,56
710,"It’s a bird! Oh, it most definitely is a bird.",1.207207207207207,0.0407085426043382,111,91,18,2,False,True,46
710,Did you eat my leftover waffles for lunch?,1.207207207207207,0.0364634764301059,111,94,15,2,True,True,42
710,Unplugged.,1.207207207207207,0.0463528416860251,111,92,15,4,False,True,10
710,"No, I'm pretty sure it's a BLUESbird, not a blue bird. Look at its fedora crown.",1.207207207207207,0.0445509345420446,111,91,17,3,False,True,80
710,Looks like you've found yourself a bluesbird.,1.207207207207207,0.0407085426043382,111,89,21,1,False,True,45
710,"I think it’s “Home,home in the nest”",1.206896551724138,0.0450174735012565,116,96,16,4,False,False,36
710,He’s also tweeting this.”,1.205607476635514,0.0492194724957285,107,90,12,5,False,False,25
710,Let’s go... he’s playing something off his new album.”,1.205607476635514,0.0473943111512617,107,89,14,4,False,False,54
710,I told you we should have splurged for front row.”,1.205607476635514,0.0435149312649382,107,87,18,2,False,False,50
710,'Looks like a Bluesbird',1.205607476635514,0.0414392748456961,107,86,20,1,False,False,24
710,I think it’s not just us who are looking for a new career path.,1.205607476635514,0.0435149312649382,107,87,18,2,False,True,63
710,"No, that was his old band... Now he calls himself the Bluesbird of Sadness.",1.205607476635514,0.0473943111512617,107,89,14,4,False,True,75
710,It’s necessary to use some degree of autotune to remain relevevant”,1.205607476635514,0.0435149312649382,107,87,18,2,False,False,67
710,Venmo me @tweettweet,1.205607476635514,0.0435149312649382,107,87,18,2,False,False,20
710,-Isn't that Charlie Parker? -Nah! He played saxophone.,1.205607476635514,0.0435149312649382,107,87,18,2,True,True,54
710,You think he’s any good a cappella?”,1.205607476635514,0.0435149312649382,107,87,18,2,True,False,36
710,"Well Larry, didn't I tell you we should have gotten the skybox?",1.205607476635514,0.0435149312649382,107,87,18,2,True,True,63
710,That’s one hell of a song bird,1.205607476635514,0.0435149312649382,107,87,18,2,False,False,30
710,I't's just a sparrow. Too pitchy.,1.205607476635514,0.0454959886830417,107,88,16,3,False,True,33
710,"Holy moly Jim, this is no ordinary birdsong, is that what i think it is?""
""Yep, its a another live stream",1.205607476635514,0.0435149312649382,107,87,18,2,True,False,105
710,Told you we should have gotten the lower branch seats.,1.205607476635514,0.0435149312649382,107,87,18,2,False,True,54
710,Looks like he hasn’t heard that the lockdown has ended,1.205607476635514,0.0454959886830417,107,88,16,3,False,False,54
710,I saw him open for A Flock of Seagulls back in the day.,1.205607476635514,0.0454959886830417,107,88,16,3,False,True,55
710,Wait til you see his mating call.,1.205607476635514,0.0454959886830417,107,88,16,3,False,True,33
710,Sheesh....even the birds are looking for their 15 minutes of  fame during this pandemic.,1.205607476635514,0.0414392748456961,107,86,20,1,False,True,88
710,"Good God Gertie i thought it was extinct, but I know those markings,  it is a Llewelyn Davis Warbler",1.205607476635514,0.0435149312649382,107,87,18,2,False,False,100
710,"You're going to love his cover of ""Rockin"" Robin"".",1.205607476635514,0.0492194724957285,107,90,12,5,False,True,50
710,OMG an OGM!,1.205607476635514,0.0414392748456961,107,86,20,1,False,True,11
710,The aviation industry has been hit so hard that workers are now participating in the gig economy.,1.205607476635514,0.0435149312649382,107,87,18,2,False,True,97
710,Alcatraz was full,1.205607476635514,0.0435149312649382,107,87,18,2,False,False,17
710,"That's Bluesy Bluebird,Rockin' Robin's cousin.",1.205607476635514,0.0454959886830417,107,88,16,3,False,True,46
710,He found a safe spot where his social distance will not have encroached.,1.205607476635514,0.0454959886830417,107,88,16,3,False,True,72
710,They don't call him Twister just because his last studio blew away.,1.205607476635514,0.0435149312649382,107,87,18,2,False,True,67
710,There's a jay that's really lived the blues.,1.205607476635514,0.0414392748456961,107,86,20,1,False,True,44
710,Been seeing a lot of these Bluesbirds lately.,1.205607476635514,0.0492194724957285,107,90,12,5,False,True,45
710,Told ya!! He is in our tree,1.205607476635514,0.0492194724957285,107,90,12,5,False,False,27
710,Yeow! He just flew in from the Grand Ole Opry,1.205607476635514,0.0435149312649382,107,87,18,2,False,False,45
710,"More of a nighttime sound, don't you think, dear?",1.205607476635514,0.0454959886830417,107,88,16,3,True,True,49
710,"He hasn't been the same since migrating back from Clarksdale, Mississippi.",1.205607476635514,0.0454959886830417,107,88,16,3,False,True,74
710,Looks and sounds like a blues bird to me.,1.205607476635514,0.0435149312649382,107,87,18,2,False,True,41
710,Musicians need to have a nest egg,1.205607476635514,0.0435149312649382,107,87,18,2,False,False,33
710,Can you believe this guy? I stopped setting my alarm in the morning for a reason.,1.205607476635514,0.0414392748456961,107,86,20,1,True,True,81
710,He was picked sexiest man alive 2020,1.2053571428571428,0.0423307304777935,112,91,19,2,False,False,36
710,The early bird gets the ear-worm”,1.2053571428571428,0.0423307304777935,112,91,19,2,False,False,33
710,It's the first Boxcar WillieBird I've seen this Spring.,1.2053571428571428,0.0372787183335975,112,90,20,1,False,True,55
710,Are you live tweeting this?,1.2053571428571428,0.0441901109260744,112,92,17,3,True,True,27
710,"Even the birds are getting new hobbies, I think it’s time you finally found one!”",1.2053571428571428,0.0459743522470292,112,93,15,4,False,False,81
710,I think this one’s for the birds.,1.2053571428571428,0.0403858339261236,112,90,21,1,False,True,33
710,A Blues bird in its natural habitat.,1.2053571428571428,0.0423307304777935,112,91,19,2,False,True,36
710,The rarest of all - a Roger McGuinn!,1.2053571428571428,0.0441901109260744,112,92,17,3,False,True,36
710,I think it is a hootin nanny,1.2053571428571428,0.0423307304777935,112,91,19,2,False,False,28
710,I think that's our son.,1.2053571428571428,0.0493496847637778,112,95,11,6,False,True,23
710,Don't do it. Don't do it. Don't do...FREEEEEEBIRRRRDDDD,1.2053571428571428,0.0459743522470292,112,93,15,4,False,False,55
710,That's definitely not Charlie Bird.  He played sax.,1.2053571428571428,0.0441901109260744,112,92,17,3,False,True,51
710,Hey look. There's your lost uncle!,1.2053571428571428,0.0403858339261236,112,90,21,1,False,True,34
710,"Empty nesters, eh?",1.2053571428571428,0.0441901109260744,112,92,17,3,True,True,18
710,"Is that “Fly, Robin, Fly”?",1.2053571428571428,0.0441901109260744,112,92,17,3,True,True,26
710,I hear he was an original member of The Byrd’s,1.2053571428571428,0.0459743522470292,112,93,15,4,False,False,46
710,"There you go. Just Zoom-in to see the Eagle’s performance live.""",1.2053571428571428,0.0441901109260744,112,92,17,3,False,False,64
710,I think that one's playing the robin's egg blues.,1.2053571428571428,0.0441901109260744,112,92,17,3,False,True,49
710,"Frankly, I'll take pigeons over the blues-chested woodpickers.",1.2053571428571428,0.0493496847637778,112,95,11,6,False,True,62
710,It's the Eastern Hipster.,1.2053571428571428,0.0423307304777935,112,91,19,2,False,True,25
710,Wow. Songbirds are really getting sophisticated.,1.2053571428571428,0.0403858339261236,112,90,21,1,False,True,48
710,"No way, it's ""THE Blackbird""",1.2053571428571428,0.0403858339261236,112,90,21,1,False,False,28
710,Migrating from the South doesn’t always work out.,1.2053571428571428,0.0423307304777935,112,91,19,2,False,True,49
710,I think it’s an Eagles tribute band.,1.2037037037037035,0.0469920035825515,108,90,14,4,False,True,36
710,Imagine the uproar when he goes electric.,1.2037037037037035,0.0431521478914562,108,88,18,2,False,True,41
