contest,caption,mean,precision,votes,not_funny,somewhat_funny,funny,has_question_mark,ends_with_punctuation,caption_length
711,"Commissioner Manfred? Yeah, I got a bone to pick with you",1.1428571428571428,0.0652050663696626,49,44,3,2,True,False,57.0
711,Day 2,1.1428571428571428,0.0583211843519804,49,43,5,1,False,False,5.0
711,He said this is the way he wants the pill in his mouth. And he is the potus after all.,1.1428571428571428,0.0583211843519804,49,43,5,1,False,True,86.0
711,At least the hot dogs are cheaper.,1.1428571428571428,0.0505076272276105,49,42,7,0,False,True,34.0
711,Not what I had in mind for a Home Opener... but 2020 keeps me guessing!,1.1428571428571428,0.0505076272276105,49,42,7,0,False,True,71.0
711,"No, I'm certain he's playing around on me",1.1428571428571428,0.0583211843519804,49,43,5,1,False,False,41.0
711,"Karen, get off the phone, kitty's about to steal home!!",1.1428571428571428,0.0505076272276105,49,42,7,0,False,True,55.0
711,This gives “inside baseball” a whole new meaning,1.1428571428571428,0.0583211843519804,49,43,5,1,False,False,48.0
711,It's not easy now to play because mom is there too and last memory i remind as a kid was the broken tubelight and broken window 😂.  @newyorkermag,1.1428571428571428,0.0583211843519804,49,43,5,1,False,False,145.0
711,"Yeah, that's what I said! It's fill count, two outs, in the bottom of the ninth!",1.1428571428571428,0.0583211843519804,49,43,5,1,False,True,80.0
711,"Please, take indoor outdoor again!",1.1428571428571428,0.0505076272276105,49,42,7,0,False,True,34.0
711,"Darling, you REALLY should bring some beer",1.1428571428571428,0.0505076272276105,49,42,7,0,False,False,42.0
711,"Wife 📱: Honey ! I thought you said we’d be safe at home .

 
#safeathome #mickeymantle #rogermaris 📽⚾️🍽",1.1428571428571428,0.0505076272276105,49,42,7,0,False,False,103.0
711,Missing $15 hot dogs the most.,1.1428571428571428,0.0652050663696626,49,44,3,2,False,True,30.0
711,"Dr. Batsie, I am trying to cope, but it just feels like my tv is on all the time in my living room.",1.1428571428571428,0.0652050663696626,49,44,3,2,False,True,99.0
711,Series of unfortunate events,1.1428571428571428,0.0583211843519804,49,43,5,1,False,False,28.0
711,"Let me root, root, root, for the home team.",1.1428571428571428,0.0505076272276105,49,42,7,0,False,True,43.0
711,"Yes Midge, Arthur still wants to be a catcher for the Yankees. No! I don't know when he'll give up on the dream!",1.1428571428571428,0.0583211843519804,49,43,5,1,False,True,112.0
711,The backyard is a home run,1.1428571428571428,0.0505076272276105,49,42,7,0,False,False,26.0
711,Mom says no playing ball in the house except during quarantine.,1.1428571428571428,0.0505076272276105,49,42,7,0,False,True,63.0
711,"Same here, day 60 is just another INning.",1.1428571428571428,0.0652050663696626,49,44,3,2,False,True,41.0
711,"Babe, go get the hot dog canon.",1.1428571428571428,0.0652050663696626,49,44,3,2,False,True,31.0
711,"Quarantine schmarantine, Karen, this virus is a hoax. No way one little bat could do real damage.",1.1428571428571428,0.0583211843519804,49,43,5,1,False,True,97.0
711,"Yep, I've definitely lost it but I never would've predicted baseball. Can you believe it? Baseball!",1.1428571428571428,0.0583211843519804,49,43,5,1,True,True,99.0
711,I’m gonna have to call you back. This always fouls off the inside fastball.,1.1428571428571428,0.0583211843519804,49,43,5,1,False,True,75.0
711,I’m currently regretting my quaranteam,1.1428571428571428,0.0505076272276105,49,42,7,0,False,False,38.0
711,This pandemic sure has given a whole new meaning to ‘home stretch’”,1.1428571428571428,0.0505076272276105,49,42,7,0,False,False,67.0
711,"Ok, Ok!  Just tell me where first base is when the floor is lava!",1.1428571428571428,0.0583211843519804,49,43,5,1,False,True,65.0
711,DeSantis did say they could play anywhere,1.1428571428571428,0.0583211843519804,49,43,5,1,False,False,41.0
711,"He said that if I can present my yoga sessions live on IG, why not showing his batting skills live too",1.1428571428571428,0.0583211843519804,49,43,5,1,False,False,102.0
711,"Sigh, another sports guy",1.1428571428571428,0.0583211843519804,49,43,5,1,False,False,24.0
711,Where else are they going to practice during a lockdown?,1.1428571428571428,0.0583211843519804,49,43,5,1,True,True,56.0
711,"The open floor plan sure came in handy.                                                      
                                   Jake Ashburn.                                                                      
   Columbus, Ohio",1.1428571428571428,0.0505076272276105,49,42,7,0,False,False,230.0
711,"I swear to God, this year come hockey season I'm outta' here!",1.1428571428571428,0.0583211843519804,49,43,5,1,False,True,61.0
711,Can we talk later? It's top of the ninth and both sides tied.,1.1428571428571428,0.0505076272276105,49,42,7,0,True,True,61.0
711,"It's more like an Off-White Monster, maybe Eggshell.",1.1428571428571428,0.0505076272276105,49,42,7,0,False,True,52.0
711,You deliver? Perfect- I'll have one bag of peanuts and a box of cracker jacks.,1.1428571428571428,0.0505076272276105,49,42,7,0,True,True,78.0
711,It's bottom of the 9th and one strike away from a win for the home team,1.1428571428571428,0.0505076272276105,49,42,7,0,False,False,71.0
711,"Mom, have you left your red socks in the lounge?",1.1428571428571428,0.0652050663696626,49,44,3,2,True,True,48.0
711,I suspect my husband misinterpreted some of these quarantine rules.,1.1428571428571428,0.0505076272276105,49,42,7,0,False,True,67.0
711,They're playing charades. I'm taking a nap.,1.1428571428571428,0.0583211843519804,49,43,5,1,False,True,43.0
711,Try again.  Three strikes to bat an eyelash.,1.1428571428571428,0.0583211843519804,49,43,5,1,False,True,44.0
711,I have to get off the phone. One more out and it's the seventh-inning stretch.,1.1428571428571428,0.0505076272276105,49,42,7,0,False,True,78.0
711,"Because of social distancing, it seems I'm the only one 
watching the Yankee's spring training game.""",1.1428571428571428,0.0505076272276105,49,42,7,0,False,False,101.0
711,Don’t hit the $1200 television,1.1428571428571428,0.0583211843519804,49,43,5,1,False,False,30.0
711,I never got to third base with her.,1.1428571428571428,0.0505076272276105,49,42,7,0,False,True,35.0
711,Okay guys--Mom says its going to rain. Let's head to the dugouts.,1.1428571428571428,0.0583211843519804,49,43,5,1,False,True,65.0
711,I agreed to a small gathering...,1.1428571428571428,0.0505076272276105,49,42,7,0,False,True,32.0
711,It’s better than the archery module the boys completed last week.,1.1428571428571428,0.0583211843519804,49,43,5,1,False,True,65.0
711,"Hey, join me in five for the second wave. This time California goes first.",1.1428571428571428,0.0505076272276105,49,42,7,0,False,True,74.0
711,"Yes, yes, the seats are great—I can see home.",1.1428571428571428,0.0583211843519804,49,43,5,1,False,True,45.0
711,Aaron - pick up a loaf of bread on your way home.,1.1428571428571428,0.0505076272276105,49,42,7,0,False,True,49.0
711,"Honey,can you call balls and strikes?",1.1428571428571428,0.0505076272276105,49,42,7,0,True,True,37.0
711,"Well, at least they're wearing gloves",1.1428571428571428,0.0583211843519804,49,43,5,1,False,False,37.0
711,"Boys, why don’t you play outside?",1.1428571428571428,0.0583211843519804,49,43,5,1,True,True,33.0
711,I can’t talk. The bases are loaded with two outs.,1.1428571428571428,0.0505076272276105,49,42,7,0,False,True,49.0
711,"As a catcher, Jim was always used to working from home.",1.1428571428571428,0.0583211843519804,49,43,5,1,False,True,55.0
711,"I'll call you later. It's the bottom of the ninth, and the game's tied.",1.1428571428571428,0.0505076272276105,49,42,7,0,False,True,71.0
711,I told you to text me when the game is on.,1.1428571428571428,0.0505076272276105,49,42,7,0,False,True,42.0
711,"Remember now, if you hit her out of the park, we all get to go back to watching the pros at the stadium",1.1428571428571428,0.0505076272276105,49,42,7,0,False,False,103.0
711,"Yes, I did receive the pillow with a spiral on it and the painting of a semicircle. I'm very happy with my purchases.",1.1428571428571428,0.0505076272276105,49,42,7,0,False,True,117.0
711,"The cat’s trying to steal signals, but otherwise it’s all good. I can’t wait for football season.",1.1428571428571428,0.0583211843519804,49,43,5,1,False,True,97.0
711,"Hello, Doc?  I think we need to adjust the dosage of those pills you prescribed.",1.1428571428571428,0.0583211843519804,49,43,5,1,True,True,80.0
711,Pretend I'm needed in your bullpen.,1.1428571428571428,0.0583211843519804,49,43,5,1,False,True,35.0
711,Mighty Casey’s at the bat,1.1428571428571428,0.0505076272276105,49,42,7,0,False,False,25.0
711,"If quarantine were a sport. You want it to end, but it’s only the 5th inning.",1.1428571428571428,0.0505076272276105,49,42,7,0,False,True,77.0
711,"Dr. Fauci, you’ve got to end the lockdown on Major League Baseball.",1.1428571428571428,0.0583211843519804,49,43,5,1,False,True,67.0
711,And FiFi is calling the play.,1.1428571428571428,0.0505076272276105,49,42,7,0,False,True,29.0
711,"You know I'm Suzie's dad right? Don't even THINK about getting to 'first base!' Not now, not EVER.""

""Sir, with all due respect, I'm hittin' a home run with Suzie tonight. And tell her mom to bring some popcorn. I get hungry after sex.",1.1428571428571428,0.0583211843519804,49,43,5,1,True,True,235.0
711,"It’s been great having him home more, but I don’t think working from home will be long term.",1.1428571428571428,0.0583211843519804,49,43,5,1,False,True,92.0
711,Gotta run. I don't want to rattle Scott - he's working a no-hitter,1.1428571428571428,0.0583211843519804,49,43,5,1,False,False,66.0
711,HomeTown bailout for the MLB,1.1428571428571428,0.0505076272276105,49,42,7,0,False,False,28.0
711,2 fingers is a fast ball...,1.1428571428571428,0.0505076272276105,49,42,7,0,False,True,27.0
711,It's home base,1.1428571428571428,0.0583211843519804,49,43,5,1,False,False,14.0
711,"That’s one dozen panes, 16x24, make that two dozen, delivered to 1621 Northfield Ave!",1.1428571428571428,0.0583211843519804,49,43,5,1,False,True,85.0
711,Iä! Iä! Cthulhu fhtagn! Ph’nglui mglw’nafh Cthulhu R’lyeh wgah-nagl fhtagn!,1.1428571428571428,0.0583211843519804,49,43,5,1,False,True,75.0
711,"If you strike him out ,they will open the ball park !",1.1428571428571428,0.0583211843519804,49,43,5,1,False,True,53.0
711,"No mom, I promise. I won't go to second basement with him.",1.1428571428571428,0.0583211843519804,49,43,5,1,False,True,58.0
711,I should win this home game,1.1428571428571428,0.0583211843519804,49,43,5,1,False,False,27.0
711,I don’t mind the dust – it’s the spitting sunflower seeds I can’t stand.,1.1428571428571428,0.0505076272276105,49,42,7,0,False,True,72.0
711,"Crack open a cold one, it’s time for my play-by-play.",1.1428571428571428,0.0583211843519804,49,43,5,1,False,True,53.0
711,It's important to leave room for trial and error when working at home.,1.1428571428571428,0.0583211843519804,49,43,5,1,False,True,70.0
711,Honey? Do you think you could steal a plate on the way home?,1.1428571428571428,0.0583211843519804,49,43,5,1,True,True,60.0
711,MLB? I think my cat might be stealing signals,1.1428571428571428,0.0505076272276105,49,42,7,0,True,False,45.0
711,Get out of the living room..no fans allowed,1.1428571428571428,0.0505076272276105,49,42,7,0,False,False,43.0
711,Two out in the bottom of the ninth,1.1428571428571428,0.0505076272276105,49,42,7,0,False,False,34.0
711,Now or never!,1.1428571428571428,0.0505076272276105,49,42,7,0,False,True,13.0
711,"Yes, we have the MVP narrowed down to three players.",1.1428571428571428,0.0505076272276105,49,42,7,0,False,True,52.0
711,"Son, I've always fooled him with a change up.",1.1428571428571428,0.0505076272276105,49,42,7,0,False,True,45.0
711,You've reached Amanda's Audio Sample Co. where we knock the competition out of the park!,1.1428571428571428,0.0652050663696626,49,44,3,2,False,True,88.0
711,"The front row, Dorothy, the front row.",1.1428571428571428,0.0583211843519804,49,43,5,1,False,True,38.0
711,The game's been pretty tight -  lots of home runs on both sides,1.1428571428571428,0.0583211843519804,49,43,5,1,False,False,63.0
711,"I'll have to call you back, the game's about to start.",1.1428571428571428,0.0583211843519804,49,43,5,1,False,True,54.0
711,Apparently their coach told them to try and steal home,1.1428571428571428,0.0652050663696626,49,44,3,2,False,False,54.0
711,Retirement parties playing best of three gets the girl should be banned,1.1428571428571428,0.0583211843519804,49,43,5,1,False,False,71.0
711,"If the baseball season doesn't start, I'm getting out of here!",1.1428571428571428,0.0583211843519804,49,43,5,1,False,True,62.0
711,At least the dugout is more comfortable.,1.1428571428571428,0.0505076272276105,49,42,7,0,False,True,40.0
711,"Hang on a second, three two pitch, two outs and the runners will be going...",1.1428571428571428,0.0505076272276105,49,42,7,0,False,True,76.0
711,Myrtle's play-by-play was captivating for a small crowd during the first home game in Brooklyn's new Quarantine Indoor Stadium.,1.1428571428571428,0.0505076272276105,49,42,7,0,False,True,127.0
711,"I know, but it's a different kind of parlor game",1.1428571428571428,0.0583211843519804,49,43,5,1,False,False,48.0
711,These home games are thrilling from the bench.,1.1428571428571428,0.0583211843519804,49,43,5,1,False,True,46.0
711,I'm apparently the stay at home base.,1.1428571428571428,0.0583211843519804,49,43,5,1,False,True,37.0
711,"Oh, no, I'm not ""playing""  I'm just third base!",1.1428571428571428,0.0505076272276105,49,42,7,0,False,True,47.0
711,"It’s 3 to 2, top of the third.",1.1428571428571428,0.0652050663696626,49,44,3,2,False,True,30.0
711,Today they're playing a home game. The away game is Thursday at the Schilowitz's.,1.1428571428571428,0.0583211843519804,49,43,5,1,False,True,81.0
711,Yup. It’s a great seat. And the only one that’s not up.,1.1428571428571428,0.0505076272276105,49,42,7,0,False,True,55.0
711,Police? I think someone is in my house trying to steal signs.,1.1428571428571428,0.0505076272276105,49,42,7,0,True,True,61.0
711,"Hold on a sec dear..."" 
""Second base is through the dining room and right, guys",1.1428571428571428,0.0583211843519804,49,43,5,1,False,False,79.0
711,It’s gonna be REAL hard to tell this team to ‘stay at home’ this season.,1.1428571428571428,0.0505076272276105,49,42,7,0,False,True,72.0
711,"Hello? Yes, I’m calling to report a theft.",1.1428571428571428,0.0583211843519804,49,43,5,1,True,True,42.0
711,There's nothing like home field advantage!,1.1428571428571428,0.0505076272276105,49,42,7,0,False,True,42.0
711,The lockdown is inconvenient but at least I feel safe.,1.1428571428571428,0.0583211843519804,49,43,5,1,False,True,54.0
711,It's not looking good here. I need some relief.,1.1428571428571428,0.0583211843519804,49,43,5,1,False,True,47.0
711,I don't understand what innings are.,1.1428571428571428,0.0583211843519804,49,43,5,1,False,True,36.0
711,I told you I didn’t want a diamond.,1.1428571428571428,0.0505076272276105,49,42,7,0,False,True,35.0
711,No peanuts or hot dogs—it could ruin the couch.,1.1428571428571428,0.0583211843519804,49,43,5,1,False,True,47.0
711,"I’d like to order some peanuts and cracker Jacks, that’s my call.",1.1428571428571428,0.0505076272276105,49,42,7,0,False,True,65.0
711,Mikey was wondering why his brothers were playing baseball inside,1.1428571428571428,0.0652050663696626,49,44,3,2,False,False,65.0
711,Well mom I did ask my boyfriend for a diamond.,1.1428571428571428,0.0505076272276105,49,42,7,0,False,True,46.0
711,Is that dog Astro banging on the garbage can again?,1.1428571428571428,0.0583211843519804,49,43,5,1,True,True,51.0
711,It is weird. The catcher asked if this was heaven.  I guess the ‘living room of dreams’ is the best they can do during quarantine.”,1.1428571428571428,0.0505076272276105,49,42,7,0,False,False,131.0
711,I'm watching the All Star Game.,1.1428571428571428,0.0583211843519804,49,43,5,1,False,True,31.0
711,It really is hard to feel safe at home anymore.,1.1428571428571428,0.0505076272276105,49,42,7,0,False,True,47.0
711,Is your earpiece working? It looks like he's coming with the curve ball.,1.1428571428571428,0.0505076272276105,49,42,7,0,True,True,72.0
711,I told you not to wear hats in the house!,1.1428571428571428,0.0583211843519804,49,43,5,1,False,True,41.0
711,"Yes, Tom's friends are over again.  First of a double header.  It's the bottom of the eigth.  No, they're not six feet apart, no, only one of them is wearing a mask.  I hope it's not another spitball!",1.1428571428571428,0.0652050663696626,49,44,3,2,False,True,200.0
711,And they said baseball wouldn't be back dureing the pandemic ...,1.1428571428571428,0.0583211843519804,49,43,5,1,False,True,64.0
711,We're just self quarantining around home plate.,1.1428571428571428,0.0505076272276105,49,42,7,0,False,True,47.0
711,"Right: four hot dogs, three beers, one can of cat food.",1.1428571428571428,0.0505076272276105,49,42,7,0,False,True,55.0
711,Need a relief pitcher he's losing it.,1.1428571428571428,0.0505076272276105,49,42,7,0,False,True,37.0
711,I THInk  he spit.,1.1428571428571428,0.0583211843519804,49,43,5,1,False,True,17.0
711,Family only game,1.1428571428571428,0.0505076272276105,49,42,7,0,False,False,16.0
711,And my Ethan just hit an at home run.,1.1428571428571428,0.0652050663696626,49,44,3,2,False,True,37.0
711,Not much.  Just shagging flies.,1.1428571428571428,0.0583211843519804,49,43,5,1,False,True,31.0
711,My life feels like I'm at the bottom of the ninth with no men on base.,1.1428571428571428,0.0505076272276105,49,42,7,0,False,True,70.0
711,"Oh, nuthin' much. Johnny still thinks he's gonna get to third base, but he'll never even make it to first.",1.1428571428571428,0.0583211843519804,49,43,5,1,False,True,106.0
711,I keep finding odd Sox around the house.,1.1428571428571428,0.0505076272276105,49,42,7,0,False,True,40.0
711,Baseball woes continue; every pitch just inside.,1.1428571428571428,0.0652050663696626,49,44,3,2,False,True,48.0
711,"Can't talk now, I've got the Yankees working from home.",1.1428571428571428,0.0505076272276105,49,42,7,0,False,True,55.0
711,"They're currently on pause, hoping to resume play late summer.",1.1428571428571428,0.0505076272276105,49,42,7,0,False,True,62.0
711,I forgot the peanuts and cracker jacks!,1.1428571428571428,0.0583211843519804,49,43,5,1,False,True,39.0
711,"I think I preferred them glued to the TV, watching a different kind of home run.",1.1428571428571428,0.0583211843519804,49,43,5,1,False,True,80.0
711,Just one spitball and I'm reporting you to the CDC.,1.1428571428571428,0.0652050663696626,49,44,3,2,False,True,51.0
711,"It's the bottom of the ninth, tensions are high and I've got a meatloaf in the oven for the winner.",1.1428571428571428,0.0505076272276105,49,42,7,0,False,True,99.0
711,Low and on the inside-please!,1.1428571428571428,0.0505076272276105,49,42,7,0,False,True,29.0
711,So you say you can't play without fans?,1.1428571428571428,0.0505076272276105,49,42,7,0,True,True,39.0
711,"Hahaha. They're playing baseball in this lady's living room. Quarantine just won't quit, huh? Anyway. How you been?  Sorry I haven't reached out in a few weeks. Been in a bit of a funk. Starting to see things clearer now though.",1.1428571428571428,0.0583211843519804,49,43,5,1,True,True,228.0
711,Just remember - two pats on the pillow means off-speed is coming.,1.1428571428571428,0.0583211843519804,49,43,5,1,False,True,65.0
711,Mostly Gerrit's just happy to pitch with a beard again.,1.1428571428571428,0.0505076272276105,49,42,7,0,False,True,55.0
711,"Nothing else to do, hope it goes extra innings.",1.1428571428571428,0.0583211843519804,49,43,5,1,False,True,47.0
711,"Bullpen? Ya, I'm about to relieve him.  Get the lefty warming up.",1.1428571428571428,0.0505076272276105,49,42,7,0,True,True,65.0
711,I'm looking at it now - the pitcher I ordered was for water.,1.1428571428571428,0.0583211843519804,49,43,5,1,False,True,60.0
711,Work hard for it. I phone with the coach.,1.1428571428571428,0.0505076272276105,49,42,7,0,False,True,41.0
711,"Yes, Josh is pitching, no - not the screenplay.",1.1428571428571428,0.0505076272276105,49,42,7,0,False,True,47.0
711,"« Take, me home to the ball park »",1.1428571428571428,0.0505076272276105,49,42,7,0,False,False,34.0
711,Baseball is a little harder to do over zoom,1.1428571428571428,0.0652050663696626,49,44,3,2,False,False,43.0
711,"No, I can talk, Rick always bunts to the kitchen.",1.1428571428571428,0.0505076272276105,49,42,7,0,False,True,49.0
711,Hold on a second Louise:  Yankees suck!  Yankees suck!,1.1428571428571428,0.0583211843519804,49,43,5,1,False,True,54.0
711,He’s a sucker for a sinker!,1.1428571428571428,0.0583211843519804,49,43,5,1,False,True,27.0
711,"Bottom of the ninth, mozzarella behind his back, breadstick ready to crumble.",1.1428571428571428,0.0505076272276105,49,42,7,0,False,True,77.0
711,"Hi Darla, Yes, The seats are good and close.  And no need to worry, the Presidents news conference says facial hair works the same as a face mask, so we’re ok.",1.1428571428571428,0.0505076272276105,49,42,7,0,False,True,159.0
711,"I'd like to report that my husband has ""lost his fastball"".",1.1428571428571428,0.0505076272276105,49,42,7,0,False,True,59.0
711,"In their defense, they are only marginally worse than the Korean Baseball League.",1.1428571428571428,0.0505076272276105,49,42,7,0,False,True,81.0
711,I’m the pinch batter waiting for the first Thursday of November.,1.1428571428571428,0.0583211843519804,49,43,5,1,False,True,64.0
711,Hello? I would like to order a $7 hot dog and a $15 beer.,1.1428571428571428,0.0583211843519804,49,43,5,1,True,True,57.0
711,My living room has become a man cave!,1.1428571428571428,0.0583211843519804,49,43,5,1,False,True,37.0
711,Squeeze bunt coming...I’ll be home in a sec...,1.1428571428571428,0.0505076272276105,49,42,7,0,False,True,46.0
711,"Sixty feet six inches. shmixty shmeet shmix shminches, let the games begin.",1.1428571428571428,0.0505076272276105,49,42,7,0,False,True,75.0
711,They say they're the home team.,1.1428571428571428,0.0505076272276105,49,42,7,0,False,True,31.0
711,"Sorry, Philippa, I can't make your Zoom happy hour.  I'm third base.",1.1428571428571428,0.0583211843519804,49,43,5,1,False,True,68.0
711,These days it's his best chance to get to Third Base.,1.1428571428571428,0.0583211843519804,49,43,5,1,False,True,53.0
711,"When the parks are closed, PLAY BALL!  This particular location has more comfortable stadium seating, anyway.",1.1428571428571428,0.0505076272276105,49,42,7,0,False,True,109.0
711,I miss the spitting and the scratching.,1.1428571428571428,0.0505076272276105,49,42,7,0,False,True,39.0
711,"Yeah, if he makes it to 3rd we're gonna have to upstairs.",1.1428571428571428,0.0583211843519804,49,43,5,1,False,True,57.0
711,Oh it's back already.  And with a live crowd.,1.1428571428571428,0.0505076272276105,49,42,7,0,False,True,45.0
711,"I thought they were almost done, but it's the eleventh inning and the pitching is spot on.",1.1428571428571428,0.0505076272276105,49,42,7,0,False,True,90.0
711,This is the only place I can hit a home run.,1.1428571428571428,0.0505076272276105,49,42,7,0,False,True,44.0
711,He prefer to fly out but he's currently safe at home.,1.1428571428571428,0.0583211843519804,49,43,5,1,False,True,53.0
711,He said he's be coming home any minute now.,1.1428571428571428,0.0652050663696626,49,44,3,2,False,True,43.0
711,bonus for a bulls eye while missing her leg.,1.1428571428571428,0.0505076272276105,49,42,7,0,False,True,44.0
711,"Oh nothing, just watching the game.""

Andy Mathieson, Los Angeles, Calif",1.1428571428571428,0.0652050663696626,49,44,3,2,False,False,72.0
711,"Gotta go, Cathy. Every hit is a home run with these boys.",1.1428571428571428,0.0583211843519804,49,43,5,1,False,True,57.0
711,Hello Information?  May I please have the number of the Acme Psychiatric Center?,1.1428571428571428,0.0505076272276105,49,42,7,0,True,True,80.0
711,"Yes, hi. I think my son's VR kit is broken...",1.1428571428571428,0.0583211843519804,49,43,5,1,False,True,45.0
711,We need lemonade... could you bring another pitcher?,1.1428571428571428,0.0583211843519804,49,43,5,1,True,True,52.0
711,"Can't talk now, Dad is in to save the windows.",1.1428571428571428,0.0583211843519804,49,43,5,1,False,True,46.0
711,So the sign is for a split-finger fastball.,1.1428571428571428,0.0505076272276105,49,42,7,0,False,True,43.0
711,"I thought  we wereplaying without fans, at first?",1.1428571428571428,0.0505076272276105,49,42,7,0,True,True,49.0
711,"It's just like a real game, including the spitting and cup-adjusting.",1.1428571428571428,0.0583211843519804,49,43,5,1,False,True,69.0
711,Baseball: still boring from any distance.,1.1428571428571428,0.0583211843519804,49,43,5,1,False,True,41.0
711,What do you mean you're not accepting bets on games in my living room?!,1.1428571428571428,0.0505076272276105,49,42,7,0,True,True,71.0
711,"Gotta go, Maggie, dear. It’s the 7th inning stretch and they’re bringing Aroldis in off the settee.",1.1428571428571428,0.0583211843519804,49,43,5,1,False,True,99.0
711,"Hi, I need help coping with this feeling of impending danger during stay-at-home with my grownup kid and husband.",1.1428571428571428,0.0583211843519804,49,43,5,1,False,True,113.0
711,This diamond is definitely not my best friend!,1.1428571428571428,0.0652050663696626,49,44,3,2,False,True,46.0
711,"Yeah, it's going into the bottom of the ninth, it's still scoreless, be upstairs soon...",1.1428571428571428,0.0505076272276105,49,42,7,0,False,True,88.0
711,"Marsha, get over here right now...they need someone to call paws and strikes",1.1428571428571428,0.0583211843519804,49,43,5,1,False,False,76.0
