contest,caption,mean,precision,votes,not_funny,somewhat_funny,funny,has_question_mark,ends_with_punctuation,caption_length
682,I don't mind autumn so much; it's the fall I hate.,2.2621002592912705,0.0061063461452311,13884,2266,5719,5899,False,True,50
682,Congratulations. You're now the branch manager.,2.050351662404092,0.0069981446477953,12512,3539,4806,4167,False,True,47
682,Deciduous? When were you going to tell me,2.012859915884827,0.0070093418681072,12364,3679,4848,3837,True,False,41
682,"I've led a good life, but now it's time to meet my raker.",2.004685800351435,0.0071268044844001,11951,3599,4697,3655,False,True,57
682,I'll wait for you on the car.,2.0046078525487183,0.0074323908293688,10417,2973,4423,3021,False,True,29
682,You said we’d BOTH go on three!,1.987733823980374,0.0077139889531831,9783,2908,4087,2788,False,True,31
682,It’s not you. It’s November.,1.949062533867996,0.0079645690667425,9227,2947,3803,2477,False,True,28
682,"As usual, you're never ready when it's time to leave.",1.908325128541735,0.0079565367996488,9141,3102,3775,2264,False,True,53
682,Seems to me you have problems letting go.,1.897078480045828,0.0072802713576005,10474,3509,4537,2428,False,True,41
682,Give me a call when you get to the ground. We'll do mulch.,1.8935226264418812,0.009446081826604,6762,2438,2606,1718,False,True,58
682,Here's hoping a leaf blower is what I think it is.,1.8870247806680007,0.01012553151135,6497,2572,2087,1838,False,True,50
682,"On the bright side, we lasted longer than any member of the current administration!",1.8785354849904563,0.0105543077103144,5763,2242,1979,1542,False,True,83
682,Sorry to leave you hanging.,1.869269340974212,0.0143260043010058,2792,1006,1145,641,False,True,27
682,Aim for the Johnson's yard -- they don't rake.,1.860344047080127,0.0080139477443518,8836,3210,3650,1976,False,True,46
682,I heard our branch was letting everyone go but didn't want to believe it.,1.8452092701487377,0.0097483547263987,5782,2105,2467,1210,False,True,73
682,I don't think you're grasping the gravity of the situation.,1.841642827952595,0.010932914483161,4894,1880,1909,1105,False,True,59
682,Fall! Now I get it!,1.8391686427674712,0.0089893801204369,7169,2748,2827,1594,False,True,19
682,I’m worried I’ll find you lying in a gutter somewhere.,1.8323839116174696,0.009995437792337,5793,2243,2278,1272,False,True,54
682,I told you it was a seasonal position,1.8298114640010124,0.0083901379389413,7903,2985,3278,1640,False,False,37
682,"Whatever happens, at least we're not nuts.",1.820068463842533,0.0111751734445819,4674,1860,1795,1019,False,True,42
682,That's why we're called leaves; it's what we do.,1.8034188034188037,0.0102522739104084,5382,2155,2130,1097,False,True,48
682,"I don't want to move to Florida, you said. I'd miss the changing of the seasons, you said.",1.7814197051978278,0.0105470232737246,5156,2165,1953,1038,False,True,90
682,Kermit was wrong...it was easier being green,1.763466602824994,0.0117988351881792,4177,1825,1515,837,False,False,44
682,Nature calls! Gotta go!,1.756020942408377,0.0099957347530782,5730,2512,2105,1113,False,True,23
682,”Don’t be sad. We’ll be buds again in the Spring.,1.75183228225669,0.009802034119723,5867,2572,2183,1112,False,True,49
682,We’ll always have summer.,1.7477087576374746,0.0083436527208038,7856,3389,3060,1407,False,True,25
682,I've been faking photosynthesis for weeks now.,1.7354802680565895,0.0102732166411492,5372,2421,1951,1000,False,True,46
682,"I love the colors, but I hate the fall.",1.726661544371879,0.0102069507489834,5206,2320,1990,896,False,True,39
682,"Think of this as not the end, but a leaf of absence.",1.7155371138773627,0.0157026667667904,2169,976,834,359,False,True,52
682,Let me know if he gets impeached!,1.707388316151203,0.0102709716011432,5820,2887,1749,1184,False,True,33
682,"I forget... Is it ""fall forward"" or ""fall back?""",1.7041208088047095,0.0120229585906566,3907,1852,1359,696,True,False,48
682,You never think it's going to happen to you.,1.6983240223463687,0.0101646470473168,5191,2411,1935,845,False,True,44
682,Now is the autumn of my discontent.,1.6975937066173068,0.0113734422514183,4322,2059,1511,752,False,True,35
682,"Watch this, reverse 3 and a half somersaults with a half twist.",1.697545159796202,0.0113396885917077,4318,2052,1523,743,False,True,63
682,"If you stay, you'll never amount to mulch.",1.6953428201811125,0.0191670897545692,1546,746,525,275,False,True,42
682,"I asked my mother ""What will I be?
Will I be compost?
Will I be free?
Will I be just debris?""",1.6952141057934509,0.011594947762137,4367,2150,1398,819,True,False,93
682,"I'm falling for you. There, I said it.",1.6946438431805633,0.0173096288045298,1811,852,660,299,False,True,38
682,"The answer, my friend....",1.6928466677529737,0.0097449359191206,6137,3020,1982,1135,False,True,25
682,I'm off to the after-leaf.,1.6789507912421415,0.0110239716653935,4613,2271,1552,790,False,True,26
682,Head for the gutter; you’ll last for years.,1.6757286995515694,0.0123520856815062,3568,1742,1243,583,False,True,43
682,But how will I know it’s you?,1.6751697181649867,0.0105733084212802,4861,2374,1695,792,True,True,29
682,"I admire your conviction, Walter, but denying season change is not a thing.",1.6630305904671567,0.011369428643989,4217,2102,1437,678,False,True,75
682,"And now, I'm going to meet my raker.",1.6609342319312108,0.0113371529060662,4303,2179,1409,715,False,True,36
682,The answer my dear is ”blowing in the wind!”,1.6526435474701535,0.0177362441875028,1759,898,574,287,False,False,44
682,Call me when you land.,1.6496268656716415,0.0137833051750876,2680,1316,987,377,False,True,22
682,"We had joy, we had fun, we had...well, one season in the sun.",1.6475063398140322,0.0148504018961354,2366,1181,838,347,False,True,61
682,Seasonal Affective Disorder brings me down every year,1.6436642453591606,0.0148543170126171,2478,1276,809,393,False,False,53
682,I'm being transferred to a different branch.,1.640933264710928,0.0096301068107631,5829,3000,1923,906,False,True,44
682,And my will is in the loose leaf binder.,1.6283215607130843,0.0137078964570762,2973,1588,902,483,False,True,40
682,"Forget the whistleblower, it’s the leaf blower you gotta watch out for!",1.6249388753056235,0.0160093666016066,2045,1063,686,296,False,True,71
682,Sometimes letting go is the hardest part.,1.6188925081433223,0.0147836916504838,2149,1070,828,251,False,True,41
682,C'mon! Don't be so indeciduous!,1.6165090283748924,0.021227680440355,1163,613,383,167,False,True,31
682,Are you aware of the gravity of this situation?,1.616260162601626,0.016853111211135,1845,973,607,265,True,True,47
682,On 3 - you were supposed to go on 3!,1.61268603827073,0.0133352244090342,2822,1466,983,373,False,True,36
682,"Perennials, they all act so entitled.",1.6122661122661122,0.0239068307735408,962,523,289,150,False,True,37
682,"I don’t care what Kermit said, it WAS easy being green...",1.6098667422738873,0.0121477278052788,3527,1874,1155,498,False,True,57
682,"No, no -- you're confusing weather with climate.",1.6081314878892734,0.0209405191700247,1156,608,393,155,False,True,48
682,I hate being the last one to leave.,1.6058823529411763,0.018821730317002,1360,701,494,165,False,True,35
682,Best case scenario is we wind up in the same student's art project.,1.6055646481178396,0.0128629946251557,3055,1612,1036,407,False,True,67
682,Penultimate. Look it up.,1.6022686990428925,0.0138216322315862,2821,1544,855,422,False,True,24
682,We survived a caterpillar for this?!,1.5946148092744952,0.0196866737675574,1337,727,425,185,True,True,36
682,I'm gonna go out on a limb and say this is the end.,1.5933147632311977,0.0123998309601865,3231,1734,1080,417,False,True,51
682,I always thought you would leave me first,1.5909990108803165,0.0110835736277682,4044,2177,1347,520,False,False,41
682,Quick! Tell me the punchline!,1.5901898734177216,0.0202048096770049,1264,691,400,173,False,True,29
682,Don't forget to turn off the sap when you leave!,1.581896551724138,0.0207384253320615,1160,633,379,148,False,True,48
682,"Dammit, Darrel.",1.5718705378391242,0.0125284643195959,4202,2670,661,871,False,True,15
682,"I'm aiming at that convertible and hope to finish up in a nice place in the country.""",1.5640886965927527,0.016054012036708,1849,1019,617,213,False,False,85
682,You feeling okay? You still look a little green.,1.5565939771547248,0.0220315050539328,963,533,324,106,True,True,48
682,"I said if ever I would leave you, it wouldn't be in Springtime.",1.5520677628300947,0.0160592086844875,2007,1170,566,271,False,True,63
682,Why is that everyone I meet leaves?!,1.5492565055762082,0.0207574515520985,1076,601,359,116,True,True,36
682,"Oh Frank, it's beautiful......I see a white light, and grandma, and cousin Eddie.....""",1.5480392156862746,0.0160782783303052,2040,1207,548,285,False,False,86
682,The hard part is just letting go.,1.5471698113207548,0.0133462272058901,2544,1413,870,261,False,True,33
682,But I voted Remain!,1.54638124362895,0.0235931552219003,981,591,244,146,False,True,19
682,I told you it wouldn't stop with the acorns.,1.542325581395349,0.0204920669310827,1075,601,365,109,False,True,44
682,Calling it autumn is just a form of denial.,1.5421115065243178,0.016765305224922,1686,962,534,190,False,True,43
682,Here goes -- I'll see you in the after-leaf!,1.5420151334129828,0.0137657431933165,2511,1438,786,287,False,True,44
682,My therapist is helping me work through my attachment issues.,1.5415162454873643,0.0169234068810261,1662,951,522,189,False,True,61
682,"'First they came for the maple leaves, and I did not speak out--Because I was not a maple leaf.'",1.5344370860927152,0.0183315361393375,1510,898,417,195,False,False,96
682,Hurry up Martha; before all the good spots are taken.,1.5339901477832512,0.0152441081440619,2030,1172,632,226,False,True,53
682,It’s not you. I’ve changed.,1.5320121951219512,0.0154161252031771,1968,1136,617,215,False,True,27
682,I'm sorry; I just snapped.,1.5294811320754718,0.0237535667552822,848,496,255,97,False,True,26
682,What do you mean you changed your mind?!,1.5259009009009008,0.0162536884295403,1776,1037,544,195,True,True,40
682,I'm ending it all. I just heard someone say I was the color of Trump.,1.52263701350278,0.0204460866676454,1259,775,310,174,False,True,69
682,Guess this is what it's like to be a Trump adviser.,1.5214646464646464,0.0250666372685506,792,477,217,98,False,True,51
682,"I hate to see us fall apart, but I need to be the one that leaves.",1.521025641025641,0.0155808960989864,1950,1152,580,218,False,True,66
682,We're leaves.  We can't stay.,1.5189274447949528,0.0156433877400719,1902,1120,577,205,False,True,29
682,I'll never forget the way you rustled!,1.5188612099644128,0.0183572454632782,1405,833,415,157,False,True,38
682,"We’ve both changed, Helen.  That’s why I have to leave.",1.5181483429773803,0.0157732475487443,1901,1130,558,213,False,True,55
682,I’m heading to Vermont where at least I’ll be appreciated.,1.5170229612034838,0.0192946349173437,1263,749,375,139,False,True,58
682,"Sorry, I just have attachment issues.",1.5166852057842046,0.0159113717249324,1798,1061,548,189,False,True,37
682,It was nice hanging out with you.,1.515828677839851,0.0164087210260252,1611,928,535,148,False,True,33
682,"It’s not about letting go, it’s about letting the wind take you places you have never been.",1.5132591958939263,0.0198139808131291,1169,691,356,122,False,True,91
682,It was a fun summer but I have attachment issues.,1.5126874279123417,0.0162265069803739,1734,1024,531,179,False,True,49
682,"After all that photosynthesis,I can’t believe we are being let go!",1.5107816711590296,0.0172757987234695,1484,869,472,143,False,True,66
682,Did you realize the gravity of our situation?,1.5091575091575091,0.0167840382775906,1638,977,488,173,True,True,45
682,"I just pray they're baggers, not burners.",1.5077138849929874,0.0251931870120887,713,423,218,72,False,True,41
682,We’re going to amount to mulch,1.5070876288659794,0.0174730563466739,1552,941,436,175,False,False,30
682,Winter? I'm pretty discontent now.,1.506720430107527,0.0253760269727031,744,452,207,85,True,True,34
682,"I know I’m not a tree and this isn’t a forest, but let me know if you hear anything when I fall.",1.5062137531068769,0.0199560982594178,1207,735,333,139,False,True,96
682,I just want you to know this has been the best 6 months of my  life,1.5059880239520955,0.026588119163542,668,404,190,74,False,False,67
682,'Autumn' doesn't quite capture the existential dread of this moment.,1.505938242280285,0.0236022342498575,842,508,242,92,False,True,68
682,Thanks Harry. You have a great Fall too.,1.4988416988416988,0.0184066979013536,1295,771,402,122,False,True,40
682,My goal is to get into a kindergarten show and tell,1.496780128794848,0.0209423610459765,1087,670,294,123,False,False,51
682,"Hang tough until the snow and really piss them off.""",1.4964788732394363,0.023750429522324,852,527,227,98,False,False,52
682,Well this blows.,1.487037037037037,0.0207928711908995,1080,671,292,117,False,True,16
682,"Remember, aim for that spot right where the hood meets the windshield",1.4860646599777034,0.0228619678394304,897,559,240,98,False,False,69
682,Detached? I’ll show you detached!,1.4836223506743738,0.0206998288496196,1038,637,300,101,True,True,33
682,Everyone leaves,1.483526268922529,0.0198494906568011,1123,688,327,108,False,False,15
682,"As usual, you are going to let me take the fall.",1.4828897338403042,0.0203681395637986,1052,642,312,98,False,True,48
682,Gonna drift by a window.,1.482174688057041,0.0211033019611247,1122,721,261,140,False,True,24
682,"Ah, fall.  I get it now.",1.4811407543698252,0.0201092034388305,1087,667,317,103,False,True,24
682,I hope there's an after-leaf!,1.4775224775224776,0.0211493961801624,1001,622,280,99,False,True,29
682,"Seriously, do you not know what deciduous means?",1.4772507260406582,0.0204474336018056,1033,634,305,94,True,True,48
682,Don't look surprised you knew how this was going to end.,1.4770114942528736,0.0203390217588191,1044,641,308,95,False,True,56
682,I hope to reincarnate as an Evergreen.,1.4752,0.027168307328152,625,394,165,66,False,True,38
682,It's over. We've changed.,1.475,0.0306724692965529,440,267,137,36,False,True,25
682,Dude......delete my browser history!,1.471938775510204,0.0246625600808251,784,503,192,89,False,True,36
682,First I change colors...and now this?,1.4718526100307063,0.020722493265988,977,599,295,83,True,True,37
682,Shoot for the Wilson's. They never rake.,1.470967741935484,0.021401417767719,930,574,274,82,False,True,40
682,Storm the lawn. They can't rake all of us!,1.469904963041183,0.0212330422793256,947,586,277,84,False,True,42
682,"You’re late, as usual.",1.4662983425414364,0.0216429655447312,905,562,264,79,False,True,22
682,"Face it, baby. The chlorophyll is gone.",1.4657179818887451,0.0237406086146924,773,485,216,72,False,True,39
682,I guess this makes you the new branch manager.,1.4644478063540092,0.0253528947842368,661,412,191,58,False,True,46
682,"I'm not leaving you, I'm falling for you.",1.4624413145539903,0.0232459124385663,852,548,214,90,False,True,41
682,I'll see you on the street.,1.462253193960511,0.022414766934733,861,542,240,79,False,True,27
682,I’m leaving you Doris. It was only a summer fling.,1.4621653084982538,0.0225723370070811,859,548,227,84,False,True,50
682,My tine has come.,1.4610849056603774,0.0262444973894151,848,599,107,142,False,True,17
682,"I'm not falling, I'm descending into old age gracefully.",1.4603550295857988,0.0219598987703033,845,523,255,67,False,True,56
682,"Oh well, nature calls.",1.457593688362919,0.0295384652532193,507,324,134,49,False,True,22
682,"Never let go, Rose.",1.4566831683168318,0.0229180487725712,808,510,227,71,False,True,19
682,You're the last leaf on the tree.  You deserve a bough.,1.4564676616915422,0.0233325533790239,804,513,215,76,False,True,55
682,I'm coming back as an evergreen.,1.456140350877193,0.0223593406480124,798,494,244,60,False,True,32
682,Who the hell  could possibly make a song out of this?,1.4545454545454546,0.0235474801894649,803,517,207,79,True,True,53
682,Good luck Mr. Pence.,1.454428754813864,0.0242748184133179,779,507,190,82,False,True,20
682,And I was just getting the hang of it...,1.4541284403669723,0.0252428182945902,654,412,187,55,False,True,40
682,Meet me at the Henderson's. They don't mulch.,1.4539722572509457,0.022450999748491,793,493,240,60,False,True,45
682,You are right - we should have tried stem cell therapy.,1.4538461538461538,0.0266281103941525,650,424,157,69,False,True,55
682,"It's like a ride share, but the city picks you up.",1.4528043775649797,0.0239120310229152,731,462,207,62,False,True,50
682,"Well Rustle, it was fun shooting the breeze, but it's time for me to leaf.",1.452348993288591,0.0235941358265689,745,470,213,62,False,True,74
682,"I've changed, we both have.",1.450534759358289,0.0234465067842378,748,472,215,61,False,True,27
682,You need to learn to let go,1.448700410396717,0.0235847374205325,731,461,212,58,False,False,27
682,"Wow, Branch Manager in under a year!",1.4482288828337877,0.0239081312627045,734,468,203,63,False,True,36
682,I'm hoping for burial in a compost heap rather than cremation.,1.4480431848852902,0.0242797424879353,741,479,192,70,False,True,62
682,And I thought it was hard being green.,1.4480431848852902,0.0236712255435382,741,471,208,62,False,True,38
682,Fall already? I just got tan!,1.4477611940298507,0.0236828875494254,737,468,208,61,True,True,29
682,Looks like I have to be the fall guy.,1.4460028050490883,0.0237425920675466,713,450,208,55,False,True,37
682,I just can’t date a climate change denier.,1.4431486880466473,0.0245528979468083,686,439,190,57,False,True,42
682,"Look, they don't call this season ""Hold!""",1.4425036390101893,0.0248692752970548,687,444,182,61,False,False,41
682,"It's one small leaf for man,one giant mess for mankind.",1.4424514200298957,0.0251662383629307,669,432,178,59,False,True,55
682,"Do you think people know we do this alphabetically, Zyggy?",1.4423076923076923,0.025155662654293,676,438,177,61,True,True,58
682,We tried - but these May to December romances fall apart around October.,1.4416543574593796,0.0249524447457297,677,437,181,59,False,True,72
682,"Frankly, I'm embarrassed to be orange.",1.4409566517189836,0.0259491203370966,669,442,159,68,False,True,38
682,There’s a rumor they’re closing down the branch.,1.440652818991098,0.0247618679106364,674,433,185,56,False,True,48
682,Beat this. A half gainer with a full twist.,1.4404761904761905,0.0249910852576061,672,434,180,58,False,True,43
682,"Horrible timing, eh? Now we'll never find out if he got impeached.",1.439509954058193,0.0263164931277406,653,433,153,67,True,True,66
682,Why do I have to be the fall guy?,1.437978560490046,0.0244605710159801,653,414,192,47,True,True,33
682,"Well, my friend, I'm off to find out if the answer really is just blowin' in the wind.",1.437978560490046,0.0253100231325802,653,423,174,56,False,True,86
682,"Remember, you promised Mom you won’t end up in the gutter.",1.436026936026936,0.0264306536558339,594,385,159,50,False,True,58
682,"No - honestly, I’m falling for you.",1.4357366771159874,0.0254323501933294,638,413,172,53,False,True,35
682,It's been arboreal!,1.4356589147286822,0.0253332474081202,645,418,173,54,False,True,19
682,"To infinity, and the lawn!",1.4353312302839116,0.0265009499537745,634,421,150,63,False,True,26
682,Will you finally admit that photosynthesis was not some wacky conspiracy theory?,1.4350797266514803,0.032243103269003,439,294,99,46,True,True,80
682,I don’t think you appreciate the gravity of the situation.,1.4346456692913383,0.0254148029040343,635,411,172,52,False,True,58
682,I slept with your sister.,1.4344422700587085,0.0298078349768017,511,342,116,53,False,True,25
682,Remember to set the clock back!,1.4343598055105349,0.0262348711688569,617,404,158,55,False,True,31
682,You sure? Everyone's going to be there!,1.432739059967585,0.025413018412674,617,397,173,47,True,True,39
682,"Sure, the colors are nice, but what did I really achieve?",1.4326750448833034,0.0268175930843171,557,359,155,43,True,True,57
682,I should have moisturized!!,1.432300163132137,0.0257338764286145,613,397,167,49,False,True,27
682,Oh crap. You win.,1.4322580645161291,0.0263345568016005,620,409,154,57,False,True,17
682,So you know the drill.  Once this anal idiot has raked us all up you fall.,1.4321608040201006,0.0275724498999927,597,401,134,62,False,True,74
682,This isn't what I had in mind when I said I was falling for you!,1.4304418985270049,0.026401515224267,611,408,145,58,False,True,64
682,"Come on, we're half in the bag already.",1.4304347826086956,0.0302161322682759,460,302,118,40,False,True,39
682,Spring will be such a releaf,1.4302134646962232,0.0260508587916375,609,398,160,51,False,False,28
682,"I'm just not as strong as you Bob,  I just have to do what everyone else is doing.",1.42998352553542,0.0254778708912834,607,391,171,45,False,True,82
682,"I am not afraid of the fall, It is the leafblower  that I am terrified of.",1.429530201342282,0.0249097558190044,596,377,182,37,False,True,74
682,This is where I leave you.,1.429519071310116,0.0254843258598896,603,388,171,44,False,True,26
682,I've always preferred the word autumn.,1.4292845257903497,0.0259721998409059,601,391,162,48,False,True,38
682,So much for your theory about drinking six glasses of water a day.,1.4290484140233723,0.0264571521127636,599,394,153,52,False,True,66
682,"At some point in life, we all have to just let go.",1.4261168384879723,0.0254097393773233,582,372,172,38,False,True,50
682,"Oh no, this is premature evacuation",1.4259927797833936,0.0281904136339322,554,372,128,54,False,False,35
682,I told you everybody suddenly turning orange wasn't a good sign.,1.425828970331588,0.0260313526536734,573,370,162,41,False,True,64
682,I guess those coniferous bastards will have the last laugh now.,1.4250440917107583,0.0277182251243416,567,380,133,54,False,True,63
682,"No, really, it was an honor to serve in your Administration!",1.423146473779385,0.0287881785150129,553,378,116,59,False,True,60
682,This place is dead anyway.,1.4227353463587922,0.0272753740578388,563,374,140,49,False,True,26
682,I guess that makes ME the new Secretary of Homeland Security.,1.421903052064632,0.0279454141997509,557,375,129,53,False,True,61
682,Seasons change and so did—AAH!,1.4216216216216215,0.0273110905380161,555,368,140,47,False,True,30
682,"Stay golden, bro.",1.4216216216216215,0.0262174249224875,555,359,158,38,False,True,17
682,I hung around for as long as I could.,1.4212454212454213,0.0273822041305392,546,361,140,45,False,True,37
682,"Wait...What do you mean, 'I look rakish'",1.4209558823529411,0.0272036268963509,544,358,143,43,False,False,40
682,I think that’s my Uber.,1.4185185185185183,0.0272048616375502,540,356,142,42,False,True,23
682,I didn't realize that I would end up the fall guy!,1.416030534351145,0.027236914579796,524,344,142,38,False,True,50
682,"Well, screw you, tree, and the acorn you rode in on.",1.4155339805825242,0.0286365344546026,515,347,122,46,False,True,52
682,"We had joy, we had fun, we had a season in the sun.",1.4148727984344422,0.0271461464639172,511,333,144,34,False,True,51
682,It's ok.Just try to compost yourself.,1.4143968871595332,0.0285370858649234,514,346,123,45,False,True,37
682,I hope I land face up,1.4130434782608696,0.0276015157226795,506,333,137,36,False,False,21
682,This is the last time I explain inevitably to you.,1.4128256513026052,0.0285784093752136,499,334,124,41,False,True,50
682,"So long pal, it's been a breeze.",1.4118811881188118,0.0280550239020615,505,336,130,39,False,True,32
682,Remember- Tuck and Roll!,1.4118811881188118,0.028472059147439,505,339,124,42,False,True,24
682,Would it be too ironic to shout 'Geronimo' on Columbus Day?,1.411530815109344,0.0296386054502019,503,346,107,50,True,True,59
682,Don’t be sad. We knew we were going out on a limb with this relationship.,1.4093686354378818,0.0284487403856745,491,328,125,38,False,True,73
682,I just want to feel more grounded.,1.408624229979466,0.0275531857648396,487,319,137,31,False,True,34
682,"I want to be raked, not blown.",1.4085365853658536,0.0291226492631379,492,334,115,43,False,True,30
682,I'll be waiting on the car.,1.4083333333333334,0.029638176056145,480,327,110,43,False,True,27
682,Just remember....I don't want to be cremated!,1.4082191780821918,0.0329418793150697,365,244,93,28,False,True,45
682,"I think I understand now, why you said you felt detached.",1.4079497907949792,0.0288253060577293,478,320,121,37,False,True,57
682,Hope falls eternal.,1.4079497907949792,0.0289012823040251,478,323,116,39,False,True,19
682,We used to be buds!,1.4078674948240166,0.0289154686136129,483,325,119,39,False,True,19
682,"In the end, everyone leaves.",1.407563025210084,0.0293624404758848,476,322,114,40,False,True,28
682,"See, I told you there's a reason it's called Fall.",1.4063829787234043,0.0282069245133107,470,310,129,31,False,True,50
682,"Big deal. So you're the last ! You know what they say about pride, don't you ?",1.405612244897959,0.0335484740534257,392,272,81,39,True,True,78
682,"I know I should be all like, 'Wheeee', but I'm more like 'Meh.'",1.4045584045584043,0.035238902836486,351,243,74,34,False,False,63
682,The wind is from the south so let's go with Evacuation Plan B--meet on the front porch steps.,1.4030172413793105,0.0281001888701184,464,306,129,29,False,True,93
682,I'm heading for his wiper blade.  It's my only chance to see the world.,1.4022222222222225,0.0295304990233833,450,303,113,34,False,True,71
682,"Depending on where you land, this conversation is not over.",1.4019370460048426,0.0302086947151,413,275,110,28,False,True,59
682,"They were right, we ARE going to end up on the street!",1.40153452685422,0.0323879727820244,391,267,91,33,False,True,54
682,Nature calls.  I really gotta go.,1.4013157894736843,0.0287553660113595,456,304,121,31,False,True,33
